title,authors,publishedDate,categories,description,averageRating,textSnippet,language
Encyclopedia of Soil Science,['Ward Chesworth'],2007-11-22,['Nature'],"The Encyclopedia of Soil Science provides a comprehensive, alphabetical treatment of basic soil science in a single volume. It constitutes a wide ranging and authorative collection of some 160 academic articles covering the salient aspects of soil physics, chemistry, biology, fertility, technology, genesis, morphology, classification and geomorphology. With increased usage of soil for world food production, building materials, and waste repositories, demand has grown for a better global understanding of soil and its processes. longer articles by leading authorities from around the world are supplemented by some 430 definitions of common terms in soil sciences.",N/A,N/A,en
The Manners and Customs of the Ancient Egyptians,['John Gardner Wilkinson'],2012-06-03,[],"Hardcover reprint of the original 1837 edition - beautifully bound in brown cloth covers featuring titles stamped in gold, 8vo - 6x9. No adjustments have been made to the original text, giving readers the full antiquarian experience. For quality purposes, all text and images are printed as black and white. This item is printed on demand. Book Information: Wilkinson, John Gardner, Sir. The Manners And Customs of The Ancient Egyptians, Volume 3. Indiana: Repressed Publishing LLC, 2012. Original Publishing: Wilkinson, John Gardner, Sir. The Manners And Customs of The Ancient Egyptians, Volume 3. London: J. Murray, 1837.",N/A,N/A,en
Weapons of the Weak,['James C. Scott'],1985-01-01,['Political Science'],"Weapons of the Weak is an ethnography by James C. Scott that studies the effects of the Green Revolution in rural Malaysia. One of the main objectives of the study is to make an argument that the Marxian and Gramscian ideas of false consciousness and hegemony are incorrect. He develops this conclusion throughout the book, through the different scenarios and characters that come up during his time of fieldwork in the village. This publication, based on 2 years of fieldwork (1978-1980), focuses on the local class relations in a small rice farming community of 70 households in the main paddy-growing area of Kedah in Malaysia. Introduction of the Green Revolution in 1976 eliminated 2/3 of the wage-earning opportunities for smallholders and landless laborers. The main ensuing class struggle is analyzed being the ideological struggle in the village and the practice of resistance itself consisting of: foot-dragging, dissimulation, desertion, false compliance, pilfering, feigned ignorance and sabotage acts. Rich and poor are engaged in an unremitting if silent struggle to define changes in land tenure, mechanization and employment to advance their own interests, and to use values that they share to control the distribution of status, land, work and grain.",N/A,N/A,en
Georgicks of Virgil,['Virgil'],1741,['Agriculture'],N/A,N/A,N/A,en
History of the Italian Agricultural Landscape,['Emilio Sereni'],1997,['History'],"From his perspective in the Italian tradition of cultural Marxism, Sereni guides the reader through the millennial changes that have affected the agriculture and ecology of the regions of Italy, as well as through the successes and failures of farmers and technicians in antiquity, the middle ages, the Renaissance, and the Industrial Revolution.",N/A,N/A,en
The Farmer's Magazine,[],1840,['Agriculture'],N/A,N/A,N/A,en
"Foure Bookes of Husbandry,",['Conrad Heresbach'],1578,['Agriculture'],N/A,N/A,N/A,en
Ultra-High-Temperature Processing of Milk and Milk Products,['H. Burton'],2012-12-06,['Technology & Engineering'],"This book attempts to explain the scientific basis for UHT sterilization and aseptic filling, as well as describe the processes and equipment used. I have tried to avoid producing merely a catalogue of sterilizers and aseptic fillers. Instead I have attempted to explain the principles on which the different types of plant operate, and discuss the factors which influence performance, so that information given by manufac turers may be assessed by readers in relation to their own processing requirements. Statements are generally supported by references. Where no re ference is given, personal experience or my interpretation of the work of others is my justification. Although the book deals mainly with milk and milk products, I hope that the information it contains will be useful to those dealing with other products, since the principles of processing are in general the same. The book is based on more than 30 years' involvement with research into UHT processing and aseptic filling. During this time I have been fortunate to work with and to talk to many people from whom I have learned a great deal. I benefited from conta.cts with Dr T. R. Ashton (England) and Professor H. Hostettler. (Switzerland), who were pioneers in the commercial development of UHT milk. More recently I have been privileged to know and work with research workers in many countries having a common interest in UHT processing. Of these, I should mention particularly Professors E. L. Thomas, V. A.",5,N/A,en
Five Hundred Pointes of Good Husbandrie,['Thomas Tusser'],1878,['Agriculture'],N/A,N/A,N/A,en
Biocommunication of Fungi,['Günther Witzany'],2012-05-31,['Science'],"Fungi are sessile, highly sensitive organisms that actively compete for environmental resources both above and below the ground. They assess their surroundings, estimate how much energy they need for particular goals, and then realise the optimum variant. They take measures to control certain environmental resources. They perceive themselves and can distinguish between ‘self’ and ‘non-self’. They process and evaluate information and then modify their behaviour accordingly. These highly diverse competences show us that this is possible owing to sign(aling)-mediated communication processes within fungal cells (intraorganismic), between the same, related and different fungal species (interorganismic), and between fungi and non-fungal organisms (transorganismic). Intraorganismic communication involves sign-mediated interactions within cells (intracellular) and between cells (intercellular). This is crucial in coordinating growth and development, shape and dynamics. Such communication mustfunction both on the local level and between widely separated mycelium parts. This allows fungi to coordinate appropriate response behaviors in a differentiated manner to their current developmental status and physiological influences.",N/A,N/A,en
The Georgics of Virgil,['Virgil'],1940,['Agriculture'],N/A,N/A,N/A,en
"Magazine of Horticulture, Botany, and All Useful Discoveries and Improvements in Rural Affairs",[],1861,['Agriculture'],N/A,N/A,N/A,en
Five Hundred Pointes of Good Husbandrie,['Thomas Tusser'],1878,['Agriculture'],N/A,N/A,N/A,en
The Cultivator,[],1850,['Agriculture'],N/A,N/A,N/A,en
The Eclogues ; The Georgics,['Virgil'],1983,['Drama'],"In part these poems bear reference to an agricultural manual, full of observations of animals and nature. They deal with the farmer's life and give it powerful allegorical meaning.",N/A,N/A,en
Health Benefits of Organic Food,[],2008-01-01,['Agriculture'],"Examines factors such as the role of certain nutrients in prevention and promotion of chronic disease, and health benefits of bioactive compounds in plants. This title covers the prevalence of food-borne pesticides and pathogens and how local and global environmental factors may affect differences between organic and conventionally produced food.",N/A,N/A,en
Farming for the Future,"['Coen Reijntjes', 'Bertus Haverkort', 'Ann Waters-Bayer']",1992,['Nature'],Part I: low-external-input and sustainable agriculture (leisa): an emerging option; Agriculture and sustainability; Sustainability and farmers: making decisions at the farm level; Technology development by farmers; Part II: Priciples and possibilities of leisa; Low-external-input farming and agroecology; Basic ecological principles of leisa; Development of leisa systems; Part III: Linking farmers and scientists in developing leisa technologies; Actors and actitities in developing leisa technologies; Participatory technology development in practice: process and methods; Appendices; Appendix A some promising leisa techniques and practices; Appendix B glossary of key terms; Appendix C useful contacts and sources of further information; References; Index.,4,N/A,en
Travels in France,['Arthur Young'],1889,['Agriculture'],N/A,N/A,N/A,en
Women and Farming,['S. Shortall'],1999-06-30,['Political Science'],"Arguing that property and power are central to understanding the position of women in farming and using comparative examples, this book considers the transfer of land between men, the changed role of women in the dairy industry in the nineteenth century, women in farming organisations, women in agricultural education programmes, and the role of the state in shaping the lives of farm women. The common themes of power and property underpin all the chapters.",N/A,N/A,en
The Changing Scale of American Agriculture,['John Fraser Hart'],2003,['Business & Economics'],"Few Americans know much about contemporary farming, which has evolved dramatically over the past few decades. In The Changing Scale of American Agriculture, the award-winning geographer and landscape historian John Fraser Hart describes the transformation of farming from the mid-twentieth century, when small family farms were still viable, to the present, when a farm must sell at least $250,000 of farm products each year to provide an acceptable level of living for a family. The increased scale of agriculture has outmoded the Jeffersonian ideal of small, self-sufficient farms. In the past farmers kept a variety of livestock and grew several crops, but modern family farms have become highly specialized in producing a single type of livestock or one or two crops. As farms have become larger and more specialized, their number has declined. Hart contends that modern family farms need to become integrated into tightly orchestrated food-supply chains in order to thrive, and these complex new organizations of large-scale production require managerial skills of the highest order. According to Hart, this trend is not only inevitable, but it is beneficial, because it produces the food American consumers want to buy at prices they can afford. Although Hart provides the statistics and clear analysis such a study requires, his book focuses on interviews with farmers: those who have shifted from mixed crop-and-livestock farming to cash-grain farming in the Midwest agricultural heartland; beef, dairy, chicken, egg, turkey, and hog producers around the periphery of the heartland; and specialty crop producers on the East and West Coasts. These invaluable case studies bring the reader into direct personal contact with the entrepreneurs who are changing American agriculture. Hart believes that modern large-scale farmers have been criticized unfairly, and The Changing Scale of American Agriculture, the result of decades of research, is his attempt to tell their side of the story.",N/A,N/A,en
Brassica,"['Eng Chong Pua', 'Carl J. Douglas']",2004-05-13,['Technology & Engineering'],"Recent advances in plant cell and molecular biology have opened new avenues for the improvement of crop plants in the genus ""Brassica"" - oilseeds and vegetables of worldwide economic importance. This volume reviews advances in various areas of ""Brassica"" biotechnology. It covers the use of rapid-cycle brassicas, tissue culture and gene transfer, molecular genetics, biotic and abiotic stress resistance, and molecular farming. Contributors are world-leading international ""Brassica"" researchers. The volume is an invaluable reference for plant breeders, researchers and graduate students in the fields of plant biotechnology, agronomy, horticulture, genetics, and cell and molecular biology.",N/A,N/A,en
Seed to Civilization,['Charles Bixler Heiser'],1990,['Cooking'],"Eating is the second favorite activity of many people, and for some it is the first. This lively book recounts the intriguing story of the plants and animals that stand between humans and starvation. In narrating his tale, the author traces the intricate patterns of food use and distribution that have developed since prehistoric times. This book is a must reading for anyone interested in the problem of feeding the world's teeming millions over the next half century.",N/A,N/A,en
The Agrarian Sociology of Ancient Civilizations,['Max Weber'],1976,['Agriculture'],N/A,N/A,N/A,en
The Georgics I & IV,['Virgil'],1965,['Agriculture'],N/A,N/A,N/A,en
"Fields, Factories and Workshops",['Petr Alekseevich Kropotkin (kni︠a︡zʹ)'],1919,['Agriculture'],N/A,N/A,N/A,en
The Temperature of the Bee Colony,['Burton Noble Gates'],1914,['Agriculture'],N/A,N/A,N/A,en
Ireland Before and After the Famine,['Cormac Ó Gráda'],1993,['Business & Economics'],"This edition of Cormac O'Grada's study expands upon his central arguments about the agricultural and demographic developments surrounding the Great Irish Famine. It provides new statistical information, new appendices and integrated responses to the new research and writing on the subject that has appeared since the publication of the first edition in 1987.",N/A,N/A,en
Chymistry Applied to Agriculture,['Jean-Antoine-Claude Chaptal (comte de Chanteloup)'],1836,['Agricultural chemistry'],N/A,N/A,N/A,en
"Digital Soil Mapping Across Paradigms, Scales and Boundaries","['Gan-lin Zhang', 'Dick Brus', 'Feng Liu', 'Xiao-Dong Song', 'Philippe Lagacherie']",2016-02-15,['Nature'],"This book contains papers presented at the 6th Global Workshop on Digital Soil Mapping, held 11-14 November 2014 at the Institute of Soil Science, Chinese Academy of Sciences of Nanjing, China. Digital soil mapping is advancing on different fronts at different paces throughout the world. The researches and applications on DSM are moving from method development to realizations in different scales and regions, serving the generation of national and continental to global soil grids. Meanwhile, new ideas and insights on mapping complex soil-landscapes such as flat plains,anthropogenically altered agriculture and urban spaces are emerging, with the help of new paradigms and models.The goal of the sixth workshop was to review and discuss the state of the art in digital soil mapping, and to explore strategies for bridging research, production, and environmental applications. This book provides a very useful and comprehensive overview of the status of digital soil mapping, in which graduate students, scientists and specialists working within the field of geography can find the spatial prediction approaches and related theory.",N/A,N/A,en
Yedo and Peking,['Robert Fortune'],1863,['Agriculture'],N/A,N/A,N/A,en
The Peasants of Languedoc,['Emmanuel Le Roy Ladurie'],1974,['Social Science'],N/A,N/A,N/A,en
Cottage Economy,['William Cobbett'],2009-07-20,['Business & Economics'],"Throughout the course of his life, Cobbett (1763-1835) was constantly concerned with improving the living conditions of the labouring classes. Performing timelessly as the quintessential guide to self-sufficiency, Cottage Economy (1821) provided practical instructions to teach labourers the arts of keeping livestock, making bread, and brewing beer.",N/A,N/A,en
Hesiodi Theogonia ; Opera et dies ; Scutum,"['Hesiod', 'Reinhold Merkelbach']",1990,['Literary Collections'],Enthält: Theogonia ; Opera et dies ; Scutum ; Fragmenta selecta,N/A,N/A,en
First Principles of Agriculture,['Henry Tanner (F.C.S.)'],1884,['Agriculture'],N/A,N/A,N/A,en
Medicinal and Aromatic Plants of the Middle-East,"['Zohara Yaniv', 'Nativ Dudai']",2014-09-11,['Science'],"The current volume, ""Medicinal and Aromatic Plants of the Middle-East"" brings together chapters on selected, unique medicinal plants of this region, known to man since biblical times. Written by leading researchers and scientists, this volume covers both domesticated crops and wild plants with great potential for cultivation. Some of these plants are well-known medicinally, such as opium poppy and khat, while others such as apharsemon and citron have both ritual and medicinal uses. All have specific and valuable uses in modern society. As such, it is an important contribution to the growing field of medicinal and aromatic plants. This volume is intended to bring the latest research to the attention of the broad range of botanists, ethnopharmacists, biochemists, plant and animal physiologists and others who will benefit from the information gathered therein. Plants know no political boundaries, and bringing specific folklore to general medical awareness can only be for the benefit of all.",N/A,N/A,en
T'ien-kung K'ai-wu,['Yingxing Song'],1966,['Agriculture'],N/A,N/A,N/A,en
Japanese Economic Development,['Penelope Francks'],1999,['Business & Economics'],"This revised edition presents Japan's economic history from the 19th century through to World War II. Within a framework based on the theories and approaches of development studies, Penelope Francks demonstrates the relevance of Japan's pre-war experience to the problems facing developing countries today, and draws out the historical roots of the institutions and practices on which Japan's post-war economic miracle was based. The text incorporates theoretical perspectives, additional material derived from new sources, more case studies, and up-dated references and a bibliography.",N/A,N/A,en
"Young's Travels in France During the Years 1787, 1788, 1789",['Arthur Young'],1915,['Agriculture'],N/A,N/A,N/A,en
Transactions of the Essex Agricultural Society for the Year ...,['Essex Agricultural Society (Mass.)'],1837,['Agriculture'],N/A,N/A,N/A,en
"Miscellaneous Tracts Relating to Natural History, Husbandry, and Physick","['Carl von Linné', 'Benjamin Stillingfleet']",1775,['Agriculture'],N/A,N/A,N/A,en
A.V. Chayanov on the Theory of Peasant Economy,['Aleksandr Vasilʹevich Chai︠a︡nov'],1986,['Business & Economics'],"The work of A. V. Chayanov is today drawing more attention among Western scholars than ever before. Largely ignored in his native Russia because they differed from Marxist-Leninist theory, and neglected in the West for more than forty years, Chayanov s sophisticated theories were at last published in English in 1966. That trenchant is reprinted in this Wisconsin paperback edition, which includes a new introduction by the sociologist Teodor Shanin, of the University of Manchester, one of the world s leading Chayanov scholars. The Wisconsin edition will be essential reading for political scientists, anthropologists, and all whose interests include peasant studies, Third World development, and women s studies. ""The past two decades have seen the emergence of a whole new field called 'peasant studies' and, along with those of Karl Marx, Chayanov's ideas have been central to its development. . . . The publishers are to be commended for re-issuing the book with both old and new introductions and making it available as an affordable paperback for students. The work is a classic."" Times Higher Education Supplement """,N/A,N/A,en
Progress in Botany,"['K. Esser', 'J. W. Kadereit', 'U. Lüttge', 'M. Runge']",2012-12-06,['Science'],"With one volume each year, this series keeps scientists and advanced students informed of the latest developments and results in all areas of the plant sciences. The present volume includes reviews on genetics, cell biology, physiology, comparative morphology, systematics, ecology and vegetation science.",N/A,N/A,en
Agricultural Statistics,[],1988,['Agriculture'],N/A,N/A,N/A,en
"Eat, Cook, Grow","['Jaz Hee-jeong Choi', 'Marcus Foth', 'Greg Hearn']",2014-03-27,['Cooking'],"Tools, interfaces, methods, and practices that can help bring about a healthy, socially inclusive, and sustainable food future. Our contemporary concerns about food range from food security to agricultural sustainability to getting dinner on the table for family and friends. This book investigates food issues as they intersect with participatory Internet culture—blogs, wikis, online photo- and video-sharing platforms, and social networks—in efforts to bring about a healthy, socially inclusive, and sustainable food future. Focusing on our urban environments provisioned with digital and network capacities, and drawing on such “bottom-up” sociotechnical trends as DIY and open source, the chapters describe engagements with food and technology that engender (re-)creative interactions. In the first section, “Eat,” contributors discuss technology-aided approaches to sustainable dining, including digital communication between farmers and urban consumers and a “telematic” dinner party at which guests are present electronically. The chapters in “Cook” describe, among other things, “smart” chopping boards that encourage mindful eating and a website that supports urban wild fruit foraging. Finally, “Grow” connects human-computer interaction with achieving a secure, safe, and ethical food supply, offering chapters on the use of interactive technologies in urban agriculture, efforts to trace the provenance of food with a “Fair Tracing” tool, and other projects. Contributors Joon Sang Baek, Pollie Barden, Eric P. S. Baumer, Eli Blevis, Nick Bryan-Kinns, Robert Comber, Jean Duruz, Katharina Frosch, Anne Galloway, Geri Gay, Jordan Geiger, Gijs Geleijnse, Nina Gros, Penny Hagen, Megan Halpern, Greg Hearn, Tad Hirsch, Jettie Hoonhout, Denise Kera, Vera Khovanskaya, Ann Light, Bernt Meerbeek, William Odom, Kenton O'Hara, Charles Spence, Mirjam Struppek, Esther Toet, Marc Tuters, Katharine S. Willis, David L. Wright, Grant Young",N/A,N/A,en
Annual Report of the Secretary of the Board of Agriculture,['Massachusetts. State Board of Agriculture'],1881,['Agriculture'],N/A,N/A,N/A,en
"Travels During the Years 1787, 1788, & 1789",['Arthur Young'],1794,['Agriculture'],N/A,N/A,N/A,en
Yearbook of the United States Department of Agriculture,[],1896,['Agriculture'],N/A,N/A,N/A,en
Agricultural Economic Report,[],1955,['Agriculture'],N/A,N/A,N/A,en
Lost Crops of the Incas,[],1989,['Crops'],N/A,N/A,N/A,en
My Farm of Edgewood,['Donald Grant Mitchell'],1872,['Agriculture'],N/A,N/A,N/A,en
AgExporter,[],1990,['Agriculture'],N/A,N/A,N/A,en
The Oxford History of South Africa,"['Monica Wilson', 'Leonard Monteath Thompson']",1969,['History'],N/A,N/A,N/A,en
The Landed Interest and the Supply of Food,['Sir James Caird'],1880,['Agriculture'],N/A,N/A,N/A,en
Foreign Agriculture,[],1965,['Agriculture'],N/A,N/A,N/A,en
Annual Report of the American Institute of the City of New York,[],1874,['Agriculture'],N/A,N/A,N/A,en
Empire of Dust,['David C. Jones'],1987,['History'],"Settlers in 1912 knew it as Carlstadt, the ""Star of the Prairie""; survivors remember it as Alderson, the ghost town. The history of this doomed village west of Medicine Hat is a life-sized saga of frothy boosterism, lightning expansion and utter miscalculations-a tragedy of drought, destitution and depopulation. It is the tale of the disaster that befell the prairie dry belt after the Great War, the untold sorrow of southwestern Saskatchewan and especially southeastern Alberta, an empire of dust.",N/A,N/A,en
Agricultural Development in the Third World,"['Carl K. Eicher', 'John M. Staatz']",1990,['Architecture'],N/A,N/A,N/A,en
Gleanings from Books on Agriculture and Gardening,['Arthur Young'],1802,['Agriculture'],N/A,N/A,N/A,en
"The Rural Cyclopedia, Or, A General Dictionary of Agriculture and of the Arts, Sciences, Instruments, and Practice, Necessary to the Farmer, Stockfarmer, Gardener, Forester, Landsteward, Farrier, &c: K-P",['John Marius Wilson'],1857,['Agriculture'],N/A,N/A,N/A,en
Agriculture Handbook,['Thomas C. Marcin'],1949,['Agriculture'],Set includes revised editions of some issues.,N/A,N/A,en
Statistical Bulletin,[],1935,['Agriculture'],N/A,N/A,N/A,en
Country Life,['Robert Morris Copeland'],1866,['Agriculture'],N/A,N/A,N/A,en
Quick Bibliography Series,[],1976,['Agriculture'],N/A,N/A,N/A,en
Experiment Station Record,['United States. Office of Experiment Stations'],1891,['Agricultural experiment stations'],N/A,N/A,N/A,en
Forestry,['Catherine Raven'],2006,['Agriculture'],"Explore the science of forestry, from trees and shrubs grown for commercial and medicinal use, to their impact on the environment and society.",N/A,N/A,en
Essays on Husbandry,['Walter Harte'],1764,['Agriculture'],N/A,N/A,N/A,en
Journal of Agricultural Research,[],1917,['Agriculture'],N/A,N/A,N/A,en
United States Treaties and Other International Agreements,['United States'],1969,['Agriculture'],N/A,N/A,N/A,en
Circular,[],1943,['Agriculture'],N/A,N/A,N/A,en
Annals of Agriculture and Other Useful Arts,['Arthur Young'],1796,['Agriculture'],N/A,N/A,N/A,en
Annual Report of the Secretary of the Maine Board of Agriculture,['Maine. Board of Agriculture'],1876,['Agriculture'],N/A,N/A,N/A,en
My First Summer in the Sierra,['John Muir'],1911,['Biography & Autobiography'],"John Muir, a young Scottish immigrant, had not yet become a famed conservationist when he first trekked into the foothills of the Sierra Nevada, not long after the Civil War. He was so captivated by what he saw that he decided to devote his life to the glorification and preservation of this magnificent wilderness. ""My First Summer in the Sierra,"" whose heart is the diary Muir kept while tending sheep in Yosemite country, enticed thousands of Americans to visit this magical place, and resounds with Muir's regard for the ""divine, enduring, unwasteable wealth"" of the natural world. A classic of environmental literature, ""My First Summer in the Sierra"" continues to inspire readers to seek out such places for themselves and make them their own.",N/A,N/A,en
Agricultural Economics Literature,[],1932,['Agriculture'],N/A,N/A,N/A,en
