title,authors,publishedDate,categories,description,averageRating,textSnippet,language
Handy Farm Devices and How to Make Them (1909),['Rolfe Cobleigh'],2009-07,['House & Home'],"A wonderful book for anyone interested in starting their own homestead or small farm. This book will show you how to be self reliant and build the things you'll need. There are more than 200 illustrations showing you how to make handy farm devices. You'll learn about the farmer's workshop and tools, running a grindstone, making a dumb waiter, making a cradle, how to clean a well, how to stake out stock, bee keeping, how to transplant trees, how to build a bridge for a small stream, how to keep a gate from sagging, important points in house building, how to build small greenhouses, advice on the best way to split wood, black smithing, and much, much more in this thrift-conscious and environmentally wise book.",N/A,N/A,en
"The Great Plains, Second Edition",['Walter Prescott Webb'],2022-08,['History'],"Walter Prescott Webb identifies the revolver, barbed wire, and the windmill as technological adaptations that facilitated Anglo conquest of the arid, treeless region of the Great Plains.",N/A,N/A,en
"Annual Report of the American Institute, of the City of New York",['American Institute of the City of New York'],1864,['Agriculture'],N/A,N/A,N/A,en
Report of the Statistician,[],1903,['Agriculture'],N/A,N/A,N/A,en
Foreign Agricultural Economic Report,[],1977,['Agriculture'],N/A,N/A,N/A,en
Kiln-Drying of Lumber,"['R B Keey', 'T A G Langrish', 'J C F Walker']",1999-12-08,[],N/A,N/A,N/A,en
Crop Production for Agricultural Improvement,"['Muhammad Ashraf', 'Münir Öztürk', 'Muhammad Sajid Aqeel Ahmad', 'Ahmet Aksoy']",2012-06-02,['Technology & Engineering'],"In the recent years, the looming food scarcity problem has highlighted plant sciences as an emerging discipline committed to devise new strategies for enhanced crop productivity. The major factors causing food scarcity are biotic and abiotic stresses such as plant pathogens, salinity, drought, flooding, nutrient deficiency or toxicity which substantially limit crop productivity world-wide. In this scenario, strategies should be adopted to achieve maximum productivity and economic crop returns. In this book we have mainly focused on physiological, biochemical, molecular and genetic bases of crop development and related approaches that can be used for crop improvement under environmental adversaries. In addition, the adverse effects of different biotic (diseases, pathogens etc.) and abiotic (salinity, drought, high temperatures, metals etc) stresses on crop development and the potential strategies to enhance crop productivity under stressful environments are also discussed.",N/A,N/A,en
Bibliography of Agriculture,[],1957,['Agriculture'],N/A,N/A,N/A,en
FAS Release,[],1980,['Agriculture'],N/A,N/A,N/A,en
An Edible History of Humanity,['Tom Standage'],2009,['Business & Economics'],Customs.,N/A,N/A,en
Agricultural Libraries Information Notes,[],1989-02,['Agricultural libraries'],N/A,N/A,N/A,en
Agricultural Situation,[],1927,['Agriculture'],N/A,N/A,N/A,en
Principles of Agronomy for Sustainable Agriculture,"['Francisco J. Villalobos', 'Elias Fereres']",2017-01-25,['Technology & Engineering'],"This textbook explains the various aspects of sustainable agricultures to undergraduate and graduate students. The book first quantifies the components of the crop energy balance, i.e. the partitioning of net radiation, and their effect on the thermal environment of the canopy. The soil water balance and the quantification of its main component (evapotranspiration) are studied to determine the availability of water to rain fed crops and to calculate crop water requirements. Then it sets the limitations of crop production in relation to crop phenology, radiation interception and resource availability (e.g. nutrients). With that in mind the different agricultural techniques (sowing, tillage, irrigation, fertilization, harvest, application of pesticides, etc.) are analyzed with special emphasis in quantifying the inputs (sowing rates, fertilizer amounts, irrigation schedules, tillage plans) required for a given target yield under specific environmental conditions (soil & climate). For all techniques strategies are provided for improving the ratio productivity/resource use while ensuring sustainability. The book comes with online practical focusing on the key aspects of management in a crop rotation (collecting weather data, calculating productivity, sowing rates, irrigation programs, fertilizers rates etc).",N/A,N/A,en
Losing Ground,['Hugh Ulrich'],1989,['Business & Economics'],"A history and bitter criticism of US farm price policies by an experienced commodity trader. He proposes a restoration of the family farm. His work is unsubstantiated by bibliographic citations. Annotation copyrighted by Book News, Inc., Portland, OR",N/A,N/A,en
Annual Report of the Agricultural Experiment Station of the University of Wisconsin for the Year ...,['University of Wisconsin. Agricultural Experiment Station'],1898,['Agricultural experiment stations'],N/A,N/A,N/A,en
Foreign Agriculture,[],1974,['Agriculture'],N/A,N/A,N/A,en
Annual Report of the Board of Control of the New York Agricultural Experiment Station,['New York State Agricultural Experiment Station. Board of Control'],1886,['Agriculture'],N/A,N/A,N/A,en
"The Journal of the Department of Agriculture, Victoria",['Victoria. Department of Agriculture'],1947,['Agriculture'],N/A,N/A,N/A,en
Dictionary of Cultivated Plants and Their Centres of Diversity,"['A. C. Zeven', 'Petr Mikhaĭlovich Zhukovskiĭ']",1975,['Gardening'],Origins of agriculture and plant domestication; Cradles of agriculture and centres of diversity; Species with a not identified centre.,N/A,N/A,en
Plant Structure: Function and Development,"['John A. Romberger', 'Zygmunt Hejnowicz', 'Jane F. Hill']",1993-05-03,['Nature'],"This book is about the developmental anatomy of large, complex plants, particularly of the woody plants that grow and survive for decades or centuries. It is focused on the meaning of that anatomy, that integrated structure, as a determinant of effective function. A pervading theme is that the plant structures that have survived ""selection"" processes during the eons of organismal evolution, within the larger context of geo logic and climatic evolution, are well attuned to biochemical and biophysical principles that determine and define efficient function. The sets of structure-and-function couples existing in the various plant taxa differ so widely that generalities are often difficult to discern. This diversity is due partly to the broad range of ecological conditions to which higher plant organisms have become adapted under stresses imposed by competition and continual climatic change. It is also due to the tendency of different taxa, with their different complements of inherited information, to respond to similar situations in different ways. Cognizant of this reality, we have tried throughout the book to avoid generalizing too broadly on the basis of data from the relatively small fraction of plant species that have as yet been studied. This book is intended for those who have already studied the anatomy and develop ment of plants. It is addressed to advanced students, teachers, and researchers in the interrelated fields of botany, forestry, horticulture, and agronomy, and to others having professional interests in the culture of woody plants and the stewardship of ecosystems.",N/A,N/A,en
Peasant Europe,['Hubert Hessell Tiltman'],1934,['Agriculture'],N/A,N/A,N/A,en
"Agricultural Change, Environment and Economy",['Keith Hoggart'],1992,['Business & Economics'],"Examines the relationships between the development of agriculture, environmental conditions, and the character of national economies, synthesizing and comparing studies from the Third World, advanced capitalist economies, and Eastern Europe to distill fundamental patterns. Among the themes are the impact of production techniques on both agriculture and the environment, and how farm production processes are affected by factors in other areas of the economy and by political influences. Of interest to readers in development, farm policy, or economics. Annotation copyright by Book News, Inc., Portland, OR",N/A,N/A,en
Journal of Agriculture,[],1842,['Agriculture'],N/A,N/A,N/A,en
Mini Farming,['Brett L. Markham'],2011,['Agriculture'],Start a mini farm on a quarter acre or less and provide 85 percent of thefood for a family of four and earn an income.,N/A,N/A,en
Phosphorus,"['Mikhail Butusov', 'Arne Jernelöv']",2013-03-26,['Science'],"​This book starts with depiction of the phosphorus role in life creation and evolution. Then it outlines in which vital processes different phosphates participate in life of all flora and fauna, from DNA molecules till body tissues. Crucial function of phosphates was noticed long ago, but only in XIX century discovery of mineral fertilizers made it possible to sustain the needs of growing global population, thus initiating a “green revolution”. Though, for many decades after it, the complexity of interactions “fertilizer-soil-plant roots” was underrated, causing massive damages, such as soil destruction and eutrophication of waters. Still, mining of exhausting natural phosphate reserves continued worldwide. Lessons of what happened in XIX century due to scarcity of phosphates were ignored. In the meantime, production of phosphates reached its peak few years ago. Immediate implementation of phosphate recycling technologies from municipal wastes can help avoid imminent global disaster.​",N/A,N/A,en
Southern Cultivator and Farming,[],1868,['Agriculture'],N/A,N/A,N/A,en
Publications,['Georgia. Department of Agriculture'],1896,['Agriculture'],N/A,N/A,N/A,en
"The Dancing Goddesses: Folklore, Archaeology, and the Origins of European Dance",['Elizabeth Wayland Barber'],2014-03-17,['History'],"An ethnographic and archaeological exploration of ancient traditions and folklore pertaining to ""dancing goddesses"" traces their roots in early Roman, Greek and European cultures to reveal the origins of such customs as ritual dancing, coloring Easter eggs and throwing rice at brides. 13,000 first printing.",N/A,N/A,en
The Journal of the Department of Agriculture of Victoria,['Victoria Department of Agriculture'],1951,['Agriculture'],N/A,N/A,N/A,en
The Economics of Agricultural Development,['John Williams Mellor'],1966,['Business & Economics'],The role of agriculture in economic development. The nature of traditional agriculture. The modernization of agriculture.,N/A,N/A,en
Regenerating the Soil,['Claude Bourguignon'],2005,['Agricultural productivity'],"Summary of lectures delivered between 1985 and 1989 in the agricultural circles of Europe, Canada and Africa.",N/A,N/A,en
The Politics of Hunger,"['John W Warnock', 'Taylor & Francis Group']",2021-03,[],"Originally published in 1987. This important and provocative book explains the persistence of hunger, poverty, and the lack of balanced development in many countries and the central role of agriculture in economic development. Most theories of agricultural development are based on the experiences of western Europe and the United States while the two models for successful ""late development"" have been Japan and the Soviet Union. This book surveys the evolution of agriculture under colonialism in Latin America, Africa, and Asia and concludes that this long period distorted the development prospects for these areas and retarded the production of food. Under strong state capitalist governments, a few underdeveloped countries have broken the colonial patterns of development. However, other post-revolutionary societies are having far less success because of economic blockades and outside military intervention. While the primary focus of the book is on the short-run problems of inequality, the author examines the long-run ecological and resource constraints to a sustainable food system and raising the standard of living in the underdeveloped world.",N/A,N/A,en
Products of the Empire,['J. Clinton Cunningham'],1921,['Agriculture'],N/A,N/A,N/A,en
Properties and Management of Soils in the Tropics,['Pedro A. Sanchez'],1976,['Science'],"The tropical environment. Soils of the tropics. Soil physical properties. Clay mineralogy and Ion Exchange Processes. Soil organic matter. Nitrogen. Soil acidity and liming. Phosphorus, silicon, and sulfur. Soil fertility evaluation. Soil management in shifting cultivation areas. Soil management in rice cultivation systems. Soil management in multiple cropping Systems. Soil Management for tropical pasture production.",N/A,N/A,en
Publications Handbook and Style Manual,[],1984,['Technology & Engineering'],"Journal managmenet and procedures. Procedures for crops and soils magazine. Procedures for monographs, books, and other publications. Preparing the manuscript. Conventions and style. Tables, illustrations, and mathematics.",N/A,N/A,en
The conditions of agricultural growth,['Ester Boserup'],1970,['Agriculture'],N/A,N/A,N/A,en
History of the English Landed Interest: Modern period,['Russell Montague Garnier'],1898,['Agriculture'],N/A,N/A,N/A,en
Food in Early Modern Europe,['Ken Albala'],2003-02-28,['History'],This unique book examines food's importance during the massive evolution of Europe following the Middle Ages.,N/A,N/A,en
Annual Report of the Secretary,['Massachusetts. State Board of Agriculture'],1880,['Agriculture'],N/A,N/A,N/A,en
Growth in Ghana,['Daniel Bruce Sarpong'],1997,['Business & Economics'],"This text is set in a context where Ghana has experienced improvements in aggregate output performance over the past decade (1986-1996) yet agriculture's performance remains sub-optimal. The author focuses on agriculture's fragmentation as attributable to space (storage, transportation and marketing), form (rudimentary production methods in general) and content (stagnent productivity and poor organization of production) and notes that whilst current policies have impinged on the space fragmentation, issues on form and content seem to have been left to the dictates of the market.",N/A,N/A,en
Commercial Fertilizers,['Melville Amasa Scovell'],1898,['Agriculture'],N/A,N/A,N/A,en
Works and Days ; and Theogony,['Hesiod'],1993,['Poetry'],"A translation of Hesiod's poems. It captures Hesiod's rustic wisdom, his humour and his cautious pessimism.",N/A,N/A,en
The Gardeners' Chronicle and Agricultural Gazette,[],1843,['Agriculture'],N/A,N/A,N/A,en
Sustainable Solutions for Elemental Deficiency and Excess in Crop Plants,"['Kumkum Mishra', 'Pramod Kumar Tandon', 'Sudhakar Srivastava']",2020-11-28,['Technology & Engineering'],"This book covers all aspects of deficiency of essential elements and excess of toxic ones in crop plants. The metal deficiency and toxicity are the two sides of same problem that are threatening to sustainable agricultural growth. The book presents prospective strategies for the management of elemental nutrition of crop plants. Chapters are arranged in a manner so as to develop a lucid picture of the topic beginning from basics to advanced research. The content is supplemented with flow charts and figures to make it convenient for readers to holistically grasp the concepts. It will be a value addition for students, research scholars and professionals in understanding the basics as well latest developments in the area of metal deficiency and excess in crop plants.",N/A,N/A,en
Principles of Agricultural Economics,"['Andrew Barkley', 'Andrew P. Barkley', 'Paul W. Barkley']",2020,['Agriculture'],"Principles of Agricultural Economics, now in its third edition, continues to showcase the power of economic principles to explain and predict issues and current events in the food, agricultural, and agribusiness sectors. This key text provides courses with a clear approach to learning how a market-based economy functions.",N/A,N/A,en
International Crop Report and Agricultural Statistics,[],1920,['Agriculture'],N/A,N/A,N/A,en
Winter Wheat in the Golden Belt of Kansas,['James Claude Malin'],1973,['Business & Economics'],N/A,N/A,N/A,en
Comparative Wood Anatomy,['Sherwin Carlquist'],2010-12-15,['Technology & Engineering'],"This second edition has been completely revised and has incorporated significant changes that have occurred in wood anatomy over the past years. ""This book is recommended to all who are interested in a modern, stimulating, competent, and well illustrated work."" (Holzforschung).",N/A,N/A,en
The Economics of American Agriculture,['Steven C. Blank'],2008,['Agriculture'],"This book answers the questions: What is happening to American agriculture, and why? Steven C. Blank uses portfolio theory to analyze both macro- and microeconomic data that paints a clear picture of the trends in agriculture, and explains why these trends are consistent with market evolution and global economic development. He clarifies agriculture's specific role in economic development with a focus on the current and future globalizing commodity markets.The book features empirical research that demonstrates the link between farm-level investment decisions and regional and national economic trends. It shows how the dynamic environment of industrialization and globalization of agriculture is part of a continuing development that is driven by technological innovation. This all points to a future with a very different agricultural production sector and some extremely important policy choices that will face the entire country.",N/A,N/A,en
"Monthly Notes, Farm Management, and Farm Economics",[],1953,['Agriculture'],N/A,N/A,N/A,en
"Journal of the College of Agriculture, Imperial University of Tokyo",['Tōkyō Daigaku. Nōgakubu'],1929,['Agriculture'],N/A,N/A,N/A,en
"Eleventh Census of the United States, 1890",['United States. Census Office'],1895,['Agriculture'],"Includes reports on population, housing, agriculture, education, language, employment, crime, manufacturing, commerce, geography, territories and possessions, vital statistics and life tables.",N/A,N/A,en
Quick Bibliography Series,['National Agricultural Library (U.S.). Reference Division'],1993,['Agriculture'],N/A,N/A,N/A,en
Louisiana Bulletin,['Louisiana State University and Agricultural and Mechanical College'],1888,['Agriculture'],N/A,N/A,N/A,en
International Library of Technology,[],1907,['Agriculture'],N/A,N/A,N/A,en
The Foundations of Japan,['John William Robertson Scott'],1922,['Agriculture'],N/A,N/A,N/A,en
Dust Bowl,['Donald Worster'],2004-09-16,['Business & Economics'],Personal recollections recreate experiences of two Dust Bowl communities,5,N/A,en
Meehans' Monthly,[],1900,['Agriculture'],N/A,N/A,N/A,en
West Indian Bulletin,[],1906,['Agriculture'],N/A,N/A,N/A,en
Journal,"['South Africa. Department of Agriculture(1910-1934)', 'South Africa. Dept. of agriculture (1910-1934).']",1927,['Agriculture'],N/A,N/A,N/A,en
Plant Microbe Symbiosis: Fundamentals and Advances,['Naveen Kumar Arora'],2013-08-27,['Science'],"Plant microbe interaction is a complex relationship that can have various beneficial impacts on both the communities. An urgent need of today’s world is to get high crop yields in an ecofriendly manner. Utilization of beneficial and multifaceted plant growth promoting (PGP) microorganisms can solve the problem of getting enhanced yields without disturbing the ecosystem thus leading to sustainability. For this to achieve understanding of the intricate details of how the beneficial microbes form associations with the host plant and sustain that for millions of years must be known. A holistic approach is required wherein the diversity of microbes associated with plant and the network of mechanisms by which they benefit the host must be studied and utilized. ‘Plant Microbe Symbiosis – Fundamentals and Advances’ provides a comprehensive understanding of positive interactions that occur between plant and microorganisms and their utilization in the fields. The book reviews the enormous diversity of plant associated microbes, the dialog between plant-microbes-microbes and mechanisms of action of PGP microbes. Utilization of PGPRs as nutrient providers, in combating phytopathogens and ameliorating the stressed and polluted soils is also explained. Importantly, the book also throws light on the unanswered questions and future direction of research in the field. It illustrates how the basic knowledge can be amalgamated with advanced technology to design the future bioformulations.",N/A,N/A,en
Economics of Farm Management in India,['A. S. Kahlon'],1980,['Agriculture'],N/A,N/A,N/A,en
The Russian Peasantry,['S. Stepniak'],1905,['Agriculture'],N/A,N/A,N/A,en
The English Village Community,['Frederic Seebohm'],1913,['Agriculture'],N/A,N/A,N/A,en
Subsistence Agriculture and Economic Development,['Clifton R. Wharton'],1969,['Agriculture'],N/A,N/A,N/A,en
Cost Accounting,"['Jesse T. Barfield', 'Cecily A. Raiborn', 'Michael R. Kinney', 'Mark S. Bettner', 'Sherry K. Mills', 'Robert A. Needham']",1997-01-01,['Accounting'],N/A,N/A,N/A,en
"Ethnicities, Community Making, and Agrarian Change",['Hsain Ilahiane'],2004-11-19,['Philosophy'],"This ethnography studies how, when, and under what circumstances culture change occurs. It is author Hsain Ilahiane's conviction that culture change directly affects resource use and community building processes. This study investigates the relationship between ethnicity and agricultural production at the household level, as well as the result of recent ethnic transformations in the restructuring of patterns of land access and social mobility within ethnically stratified communities. Ilahiane focuses specifically on the intensive farming systems of Morocco's Ziz Oasis, a 250 km long expanse watered by the Ziz River. Surrounded by Saharan desert, the valley houses a dense, rapidly grown, and ethnically diverse population of Arabs, Berbers, and Haratine (blacks). The author employs a varied body of data collected during fieldwork, including ethnographic accounts, oral histories and colonial archival records, and socio-economic and ecological findings based on a household questionnaire strategy.",N/A,N/A,en
"Handbook of Tropical Gardening and Planting, with Special Reference to Ceylon",[],N/A,[],N/A,N/A,N/A,en
"The Journal of the Department of Agriculture, Victoria",['Victoria. Dept. of Agriculture'],1972,['Agriculture'],N/A,N/A,N/A,en
An Economic History of Ireland,['David Alfred Chart'],1920,['Agriculture'],N/A,N/A,N/A,en
Bulletin,['Mauritius. Department of Agriculture'],1915,['Agriculture'],N/A,N/A,N/A,en
Technical Bulletin,"['New York (State). Argicultural Experiment Station, Geneva']",1917,['Agriculture'],N/A,N/A,N/A,en
The Principles of Agriculture,['Albrecht Daniel Thaer'],1858,['Agriculture'],N/A,N/A,N/A,en
Walks and Talks of an American Farmer in England,['Frederick Law Olmsted'],2003,[],"Before becoming a landscape architect, Frederick Law Olmsted (1822-1903) visited southern England and Wales during a month-long walking tour, recording his impressions in this richly detailed volume. Charles C. McLaughlin's introduction clarifies the links between Olmsted's developing picturesque aesthetic, social conscience, and reformer's passion for change, and persuasively argues that Olmsted came to adapt many of the features of the cultivated English countryside in designed landscapes such as New York's Central Park.",N/A,N/A,en
Bulletin,[],1916,['Agriculture'],N/A,N/A,N/A,en
Annual Report of the Bureau of Industries for the Province of Ontario,['Ontario. Bureau of Industries'],1892,['Agriculture'],"Includes statistics of agriculture, values, rents, farm wages, loan and investment companies, labor organizations, municipal statistics, etc.",N/A,N/A,en
The Journal of the Department of Victoria,['Victoria. Department of Agriculture'],1932,['Agriculture'],N/A,N/A,N/A,en
Press Bulletin,['University of Florida. Agricultural Experiment Station'],1901,['Agricultural experiment stations'],N/A,N/A,N/A,en
Planting in Uganda,"['Ernest Brown', 'H. H. Hunter']",1913,['Agriculture'],N/A,N/A,N/A,en
