title,authors,publishedDate,categories,description,averageRating,textSnippet,language
Tradition Alive,['Michael Plekon'],2003,['Religion'],"Michael Plekon's Tradition Alive presents a collection of essays highlighting not only the vibrant tradition of 20th century Eastern Orthodox thought, but also the necessity of its inclusion in the theological canon constructed mainly by Western Christian thinkers. Ranging from the thought of the first generation of Russian ZmigrZs to contemporary Eastern Orthodox theologians, the essays in Tradition Alive point toward a positive theology that is convinced of the immanence of the holy spirit despite a world torn apart by revolution, violence, and despair. The contributors profess their faith in the transforming presence of Christ and the divine dimensions of the church by looking to the meaning and power of tradition in the practices of Eastern Orthodox Christianity. By focusing on the Orthodox Church's ecclesial and liturgical character, the authors emphasize the living character of the Christian tradition. With many contributions difficult, if not impossible, to access until now, Tradition Alive presents a brave and distinctive effort to enliven Western theology by looking to the theology of the East.",N/A,N/A,en
The Cardinal Sins,['Andrew M. Greeley'],2009-03-03,['Fiction'],The blockbuster international bestseller!,N/A,N/A,en
The Church and the Changing Order,['Shailer Mathews'],1907,['Christian sociology'],N/A,N/A,N/A,en
Pentecostal Politics in a Secular World,['Joel Halldorf'],2020-07-08,['Religion'],"This book investigates the life and leadership of Lewi Pethrus, a monumental figure in Swedish and international Pentecostalism. Joel Halldorf describes Pethrus’ role in the emergence of Pentecostalism in Sweden, the ideals and practices of Swedish Pentecostalism, and the movement’s turn to professional party politics. When Pentecostals in the USA ventured into politics, they became allied with the Republican party, and later Donald Trump. The Swedish Pentecostals took another route: while culturally conservative, they embraced the progressive economic politics of the Social Democratic party. During the 2010s, they have also rejected the nationalism of the growing populist movement. Halldorf analyzes and explains these differences between Swedish evangelicals and Pentecostals on the one hand, and the Religious Right in the USA on the other.",N/A,N/A,en
The Gospel and the Catholic Church,['Michael Ramsey'],2009,['Religion'],"Michael Ramsey's modern classic The Gospel and the Catholic Church is as relevant today as it was when it was first published some 70 years ago. In it, Ramsey understands the church as a reflection the death and resurrection of Christ, and then argues that the various expressions of Christianity today each express their own gifts in accordance with the Resurrection, whether they are Catholic, Protestant/Evangelical, Eastern, or Anglican. A rewarding read for whomever undertakes it, this book will broaden your view of the church, and deepen your appreciation for the many forms of Christian expression.",N/A,N/A,en
The Church God Blesses,"['Jim Cymbala', 'Stephen Sorenson']",2002,['Reference'],"In this second book of a three-book series, the pastor of The Brooklyn Tabernacle describes the kind of church God wants to bless and use.",N/A,N/A,en
On Heaven and Earth,"['Pope Francis', 'Abraham Skorka']",2013,['Christianity and other religions'],"Shares conversations between the pope and a rabbi and biophysicist on such religious and social issues as God, fundamentalism, atheism, abortion, homosexuality, euthanasia, same-sex marriage, and globalization.",N/A,N/A,en
The Living Church,['John R. W. Stott'],2007-11-07,['Religion'],"Stott describes the characteristics of an ""authentic"" or ""living"" church that conserves Scripture and radically combines tradition and culture. He shows that becoming a living church is not an impossible goal.",N/A,N/A,en
In the Fullness of Faith,['Hans Urs von Balthasar'],1988-01-01,['Religion'],"Virtually every aspect of Catholicism which is controversial within the Church or a stumbling block to non-Catholic Christians is treated in this book. Rather than avoiding what is most glaringly un-modern or what is most criticized by non-Catholics, Balthasar reviews these elements one by one, and shows how they are rooted in the central Christian mysteries and the commonly accepted tradition. What is specifically Catholic is not defended polemically, but described in such a way that others can see, even from their own point of view, the inner consistency with the mystery affirmed by all. Here is a form of thought which is truly ecumenical precisely because it is fully Catholic.",N/A,N/A,en
Christianity and Infallibility,['Daniel Lyons'],1916,['Christianity'],N/A,N/A,N/A,en
From a Mess to a Miracle,['Kimberly Daniels'],2014,['Religion'],"Kim Daniels exposes the enemy's traps that are at work inside of our churches that prevent believers from experiencing a truly transformed life in Christ. She pulls no punches as she teaches believers how to sharpen their spiritual discernment, demolish strongholds, tear down idols, and avoid snakes in the pews.",N/A,N/A,en
The Forgotten Ways,['Alan Hirsch'],2006,['Family & Relationships'],A well-known pastor and missiologist explores how the early church saw phenomenal growth and calls for a new kind of evangelism that combines missiology with the emerging church.,N/A,N/A,en
Church Affairs,['Watchman Nee'],1988,['Religion'],N/A,N/A,N/A,en
The Primacy of Peter,['John Meyendorff'],1973,['Church'],N/A,N/A,N/A,en
Meta-Ecclesiology,['Cyril Hovorun'],2015-08-18,['Religion'],"The book explores the variables and invariables of the church. Its argument is that self-awareness of the church was often a matter of change, depending on historical circumstances. It encourages appreciating plurality in the church and sets the system of coordinates for identifying the ecclesial 'self'.",N/A,N/A,en
The Primitive Church and Reunion,['William Sanday'],1913,['Christian union'],N/A,N/A,N/A,en
The Rise of Endymion,['Dan Simmons'],1998,['Church'],"The final chapter of this saga begins with two momentous events: the death and resurrection of Pope Julius XV and the coming-of-age of the new messiah, Aenea. Together with her protector, Endymion, she embarks on a final mission to find and comprehend the underlying fabric of the universe.",N/A,N/A,en
"Church, Charism and Power",['Leonardo Boff'],1985,['Religion'],N/A,N/A,N/A,en
A General Outline of God's Economy and the Proper Living of a God-Man,['Witness Lee'],1998,['Religion'],N/A,N/A,N/A,en
A Service of Love,['Paul McPartlan'],2013-06-24,['Religion'],"A crucial topic in Catholic-Orthodox ecumenical dialogue is the nature and exercise of universal primacy in the church. In 1995, Pope John Paul II expressed the hope that pastors and theologians of both churches might seek ways in which the papal ministry could accomplish """"a service of love recognised by all concerned"""" (Ut Unum Sint). In this short and penetrating study, Paul McPartlan, a member of the international Roman Catholic-Orthodox theological dialogue, presents a proposal, carefully argued both historically and theologically, for a primacy exercising a service of love in a reconciled church, West and East. McPartlan builds on the substantial foundation already laid in the dialogue for an understanding of the church in terms of the Eucharist. Eucharistic ecclesiology has been one of the most remarkable developments in the theological renewal of recent decades. Drawing particularly on scriptural and patristic teaching, it offers a highly promising framework for resolving this most sensitive and difficult of issues -- recognising the bishop of Rome as the focal point and servant of the Eucharistic communion among bishops. Vatican II directed that those working for reconciliation between Catholics and Orthodox pay close attention to the relationships that pertained between the Eastern churches and the see of Rome before the split of 1054. McPartlan seeks to do just that, notably incorporating the teaching of the council on the role of the papacy to craft a proposal that may commend itself to Catholics and to Orthodox.",N/A,N/A,en
"Dispensationalism, Israel and the Church",['Craig A. Blaising'],1992,['Medical'],"The relationship between Israel and the church is a crucial reference point in theology, especially in distinguishing between dispensational and nondispensational schools of thought. The writers of this book view Israel and the church as distinct theological institutions within the historical progress of divine revelation. But they are also related as successive phases of a redemptive program that is historically progressive and eschatologically converging. The goal of the book is a convergence of ideas among evangelical scholars in recognizing both continuity and discontinuity in the Israel-church relationship. - Back cover.",N/A,N/A,en
The Church and the Age,['William Ralph Inge'],1912,['Christian civilization'],N/A,N/A,N/A,en
The Scripture Doctrine of the Church,['David Douglas Bannerman'],1887,['Church'],N/A,N/A,N/A,en
Decide for Yourself,['Gordon R. Lewis'],1970-01-01,['Religion'],"Gordon R. Lewis surveys Christian doctrine, encouraging readers to draw their own conclusions from the evidence and arguments.",5,N/A,en
Cyprian the Bishop,['J. Patout Burns'],2002,['Biography & Autobiography'],"This is the first up-to-date, accessible study on the rule of Cyprian as the Bishop of Carthage in the 250s AD. It controversially shows that Cyprian radically enforced the primary emphasis on the unity of the church, interpreting loyalty in the community as fidelity to Christ. It uses cultural anthropology to examine the impact of Cyprian's policy during the Decian persecution. Cyprian attempted to steer the middle ground between compromise and traditionalism and succeeded by defining the boundary between the empire and the church. J. Patout Burns Jr. concentrates on social structures to reveal the logic of Cyprian's plan, the basis for its success in his time, and why it later failed. This book will be of great interest to classicists, ancient historians and sociologists as well as theologians.",N/A,N/A,en
"Of the Church, Five Bookes",['Richard Field'],1628,['Church'],N/A,N/A,N/A,en
Dogmatic Constitution on the Church,[],2000-11,['Religion'],"The central document of the Second Vatican Council, Lumen Gentium was promulgated by Pope Paul VI on November 21, 1964. This document is ""the keystone"" of the Councils whole Magisterium. It focuses on the whole Church as a communion of charity. With it, according to John Paul II, the Second Vatican Council wished to shed light on the Churchs reality: a wonderful but complex reality consisting of human and divine elements, visible and invisible.",N/A,N/A,en
Transformational Church,"['Ed Stetzer', 'Thom S. Rainer']",2010,['Religion'],It is time to take heart and rework the scorecard. --,N/A,N/A,en
"Church, Papacy, and Schism",['Philip Sherrard'],1978,['Religion'],N/A,N/A,N/A,en
The Normal Christian Church Life,['Watchman Nee'],1980,['Religion'],"This volume was originally published in Chinese in 1938. In it the author outlined the nature of New Testament Christianity as seen in the establishment of local churches and the corporate life of a community of believers who function together in a biblical manner. Its influence was felt immediately throughout all of China and much of the rest of Asia. There was a great demand for an edition in English, so the author made the translation himself and it was published under the title, Concerning Our Missions. But at that time its message made no extensive penetration into North America. Today, however, there is an increasing hunger for reality in Christian experience, and for renewed power and life among groups of believers who long to be a local expression of the Body of Christ. To all such Watchman Nee has a message, with his gifted insight into the Word of God and his experimental knowledge of life in the Spirit.",N/A,N/A,en
Appalachia,['Cynthia Rylant'],1998,['History'],Text and illustrations explore the countryside and people of Appalachia.,N/A,N/A,en
Orthodox and Wesleyan Ecclesiology,['S. T. Kimbrough'],2007,['Biography & Autobiography'],N/A,N/A,N/A,en
John Calvin,['Kilian McDonnell'],1967,['Biography & Autobiography'],N/A,N/A,N/A,en
"The Word, Church and Sacraments in Protestantism and Catholicism",['Louis Bouyer'],1961,['Authority'],"This classic work seeks to foster unity and deeper understanding among Christians by comparing the Catholic and Protestant views of Scripture, Church authority and the sacraments. The author, one of the greatest theologians of the 20th century and a convert from Protestantism, contributed significantly to the movement out of which came the Second Vatican Council's efforts to promote Christian unity. He shows how Catholic teaching is often misunderstood by Catholics and Protestants alike, and how this teaching is fundamentally compatible with key positive elements of Reformation thought. He also examines the main points of disagreement between Catholicism and Protestantism, and demonstrates how Catholicism, properly understood, maintains the theological balance necessary to uphold some of the main truths on which Catholics and Protestants agree.",N/A,N/A,en
The Peasant of the Garonne,['Jacques Maritain'],1968,['Church'],N/A,N/A,N/A,en
Church in the Making,['Nikolaos Loudovikos'],2015,['Church'],"Over the past fifty years, Orthodox theologies of ecclesiology have been revoling around competing schools of ecclesiology one universal, the other eucharistic. Father Loudovikos, in this masterful interconnected series of studies, moves beyond this dialectic by exploring the very mode of the Church's existence. In the end, it is the profound theological insights of St Maximus the Confessor that propel Father Loudovikos beyond the familiar borders of ecclesiology and into a new way of understanding the Church s self that is indissolubly linked to the human person and his participation in the divine Love that is God.",N/A,N/A,en
Why Study the Past?,['Rowan Williams'],2005-07-06,['Religion'],"In this small but thoughtful volume, a respected theologian and churchman opens up a theological approach to history.",5,N/A,en
Our Lady and the Church,['Hugo Rahner'],1965,['Church'],N/A,1,N/A,en
The Church in the Power of the Spirit,['Jürgen Moltmann'],1977,['Religion'],N/A,N/A,N/A,en
"Tradition and Authority in the Western Church, 300-1140",['Karl F. Morrison'],2015-12-08,['RELIGION'],"Beginning with the conversion of Constantine in 312 and the establishment of the Christian Empire, the book continues through the Middle Ages up to the publication of Gratian's Decretum, the great, systematic book of Church law which transformed the idea of tradition into legal concepts. Throughout this period the hierarchy was called upon to deal with such fundamental questions as the nature of tradition and the extent of its authority, the infallibility of the pope, and the proper role of the laity in defining dogma. Originally published in 1969. The Princeton Legacy Library uses the latest print-on-demand technology to again make available previously out-of-print books from the distinguished backlist of Princeton University Press. These editions preserve the original texts of these important books while presenting them in durable paperback and hardcover editions. The goal of the Princeton Legacy Library is to vastly increase access to the rich scholarly heritage found in the thousands of books published by Princeton University Press since its founding in 1905.",N/A,N/A,en
Pope Joan,['Donna Woolfolk Cross'],1996,['Fiction'],"Set against the turbulent events of the Dark Ages, a fictional account of the controversial figure of historical record profiles a spirited woman who, disguised as a man, rose to rule Christianity as the only woman ever to become pope. Reader's Guide included. Reissue. 25,000 first printing.",N/A,N/A,en
Last Essays on Church and Religion,['Matthew Arnold'],1903,['Christianity'],N/A,N/A,N/A,en
Corrective Love,['Thomas C. Oden'],1995,['Religion'],An examination of how the church should function using ecclesiastical tough love.,N/A,N/A,en
On the Church Militant,"['Robert Bellarmine', 'St Robert Bellarmine S J']",2016-06-10,[],"St. Robert Bellarmine's theological writings on the Church of Christ constitute an invaluable treasure not only for Catholics, but for the commonweal and eternal salvation of humanity itself. This is no slight exaggeration. His is the very first independent theological and dogmatic treatise on the Church. Patristic and medieval Catholic authors treated on the mystery of the Church, to be sure; but they provided no free-standing treatment de ecclesia.Bellarmine's is the first and the best of its kind. From the Foreword St. Robert Bellarmine's On the Church Militant is the first ever English language translation of his treatise De Ecclesia Militante, dealing with questions such as, what is the Church? Who is in the Church? How do we define it? Not only does Bellarmine define it, he refutes false notions of the Church, such as the Protestant contention that the Church is invisible, as well as ancient heresies that bear upon the modern debate such as, are only the good in the Church? Are sinners also in the Church? As always, Bellarmine answers the question directly from Scripture, the Fathers and right reason to show us clearly that there is a visible Church composed of those united in the same profession of faith and unity of the Sacraments, irrespective of their interior disposition. This is the latest from the Bellarmine translation project, which aims to translate the whole of Bellarmine's De Controversiis into English. For more info, visit http://www.mediatrixpress.com.",N/A,N/A,en
The Fullness of God,['Frithjof Schuon'],2004-03,['Religion'],"For the first time, this book collects from Schoun's vast corpus his writings on Christianity, including selections from his personal correspondence and other previously unpunblished materials.",5,N/A,en
"Flesh of the Church, Flesh of Christ",['Jean-Marie-Roger Tillard'],2001,['Religion'],"Renowned scholar J.-M. R. Tillard defines what the flesh of the Church is for the New Testament and the period of the undivided Church. He enables readers to understand not the structure of God's Church but the living reality of grace for which this structure exists. He explains that the ""flesh of the church"" is communion of life for humanity reconciled with the Father and with itself ""in Christ"".",N/A,N/A,en
Christ Among Us,['Anthony J. Wilhelm'],1981,['Juvenile Nonfiction'],N/A,N/A,N/A,en
The Bloody Theater,['Thieleman Janszoon Braght'],2011-06-01,['Anabaptists'],"Who Baptized Only Upon Confession Of Faith, And Who Suffered And Died For The Testimony Of Jesus, Their Savior, From The Time Of Christ To The Year A. D. 1660.",N/A,N/A,en
The Body of Christ,['Reinder Bruinsma'],2009,['Religion'],"With a clear, straightforward definition such as this, the subject of the church isn't one that most people would consider a ""doctrine."" For this reason, there aren't many books that deal with this crucial fundamental belief. This very readable and informative treatment of such a vital topic fills an important gap in Adventist literature. Reinder Bruinsma's far-ranging look at the doctrine of the church moves from Old and New Testament foundations for this doctrine up through church government and on to controversial issues such as ordination and church discipline. Fittingly, he concludes with the mission and future of the church. His fourfold approach-biblical and theological, historical, practical, and with an Adventist perspective-ensures that every facet of the doctrine is explored in detail. This thought-provoking discussion challenges those who call themselves ""God's people"" to examine their current understanding of the church and to prayerfully consider their roles as part of the body of Christ. Book jacket.",N/A,N/A,en
Warnings to the Churches,['John Charles Ryle'],1967,['Religion'],"As a pastor of the flock of God, Ryle seeks to guard Christ's sheep and to warn them of approaching dangers.",N/A,N/A,en
The Glorious Church,['Watchman Nee'],1996-08,['Religion'],N/A,N/A,N/A,en
Short Studies on Great Subjects,['James Anthony Froude'],1867,['Church'],N/A,N/A,N/A,en
Towards a Truly Catholic Church,['Thomas P. Rausch'],2005,['Religion'],"""Ecclesiology which takes into account the Second Vatican Council, ecumenism, and globalization""--Provided by publisher.",N/A,N/A,en
Church of Churches,['Jean-Marie-Roger Tillard'],1992,['Religion'],"Except for some excellent studies on the notion of koinonia, few works have been devoted to a revival of the entire vision of the Church around communion, a vision of ecclesiology which is rooted in the solidarity that finds its locus in Jesus Christ. Church of Churches, the fruit of several years of research, teaching, and ecumenical involvement, is intended to overcome this lack. It is not an exhaustive study but rather a point of departure for discussing how the vision of the ecclesiology of communion - the most difficult question of the ecumenical debate - can break down the barrier of misunderstanding, suspicions, and claims in which the diverse ecclesial traditions are locked.",N/A,N/A,en
Be Ready,['Warren W. Wiersbe'],1984-07-06,['Religion'],"This in-depth Bible study series now covers the entire New Testament and much of the Old Testament. With more than 3 million copies sold, the Be Series has touched people's hearts everywhere. Let Warren Wiersbe's words of wisdom touch your heart, too.",N/A,N/A,en
A Critical Study of Hans Küng’s Ecclesiology,['C. Simut'],2008-07-07,['Literary Criticism'],"The book presents the transition from traditionalism to modernism in connection to two of Küng's most important books on ecclesiology: Structures of the Church (1962) as representing Küng's traditional theology, and On Being a Christian (1974) as a reflection of his modern approach to Christianity.",N/A,N/A,en
"Church, Ecumenism, and Politics","['Benedikt XVI. (Papst)', 'Joseph Cardinal Ratzinger']",2008-01-01,['Religion'],"In this collection of essays, theologian Joseph Ratzinger, now Benedict XVI, tackles three major issues in the Church today--the nature of the Church, the pursuit of Christian unity, and the relationship of Christianity to the secular/political power.",N/A,N/A,en
Introduction to the Mystery of the Church,"['Benoit-Dominique de La Soujeole, OP']",2014,['Religion'],"Introduction to the Mystery of the Church is an ecclesiological survey presenting a doctrinal synthesis of the Church. The author's intention is to propose an overview of this mystery in connection with the entirety of the Christian mystery. The book is divided into two major parts, the first presenting the foundations in the Bible and the tradition up to our day, and the second being an explanatory proposal introducing the reader to the Church's definition and personality and concluding with an exposition of the four properties enunciated in the Creed (one, holy, catholic, and apostolic). The value of this way of proceeding is first and foremost in the proposal of a synthesis that allows one to situate each question in its rightful place, such study being oriented toward a better overall grasp of the subject. As the title suggests, the book is an introduction that should allow the reader to apprehend the mystery in its internal coherence in order subsequently, with the aid of other texts, to be able to enter more deeply into the study of one or other specific point. While this ecclesiology treatise is written from a Catholic point of view, an ecumenical perspective is often present, either through the presentation of divergent views from other Christian confessions or through the proposal for a theological convergence.",N/A,N/A,en
Testimonies to the Church,['H. E. Ross'],1996,['Bible'],N/A,N/A,N/A,en
Destined for the Throne,['Paul E. Billheimer'],1983,['Religion'],"This book is a study in biblical cosmology setting forth the ultimate goal of the universe which is the church reigning with Christ with a new view of prayer as""on-the-job"" training in preparation for the throne.",N/A,N/A,en
Ecclesiogenesis,['Leonardo Boff'],1986,['Religion'],Examines whether Catholicism should be adapted to suit an individual country's culture and analyzes the structure of the Catholic Church.,N/A,N/A,en
The New International Dictionary of the Christian Church,"['James Dixon Douglas', 'Earle Edwin Cairns']",1996*,['Christianity'],N/A,N/A,N/A,en
The New International Dictionary of the Christian Church,['James Dixon Douglas'],1974-01-01,['Christianity'],N/A,N/A,N/A,en
I Sold My Soul on EBay,['Hemant Mehta'],2007-04-17,['Biography & Autobiography'],"An atheist, who offered his religion-consulting services on eBay and critiqued a variety of church services for the winning bidder, offers an assessment of how Christianity is presented and the elements that enhance or detract from it.",3,N/A,en
"Christ and the Church: Or Parallels, in Three Books",['Henry Vertue'],1659,['Bible'],N/A,N/A,N/A,en
