title,authors,publishedDate,categories,description,averageRating,textSnippet,language
Church Dogmatics,"['Karl Barth', 'Thomas Forsyth Torrance']",2004,['Religion'],N/A,N/A,N/A,en
The Churches the Apostles Left Behind,['Raymond Edward Brown'],1984,['Religion'],This book is a study of seven very different churches in the New Testament period after the death of the apostles.,N/A,N/A,en
The Concise Oxford Dictionary of the Christian Church,"['E. A. Livingstone', 'Elizabeth A. Livingstone']",2013-09-12,['Reference'],"Based on the acclaimed 'Oxford Dictionary of the Christian Church', this is a guide for both students and the general reader. It contains over 5,000 entries, and is suitable for those with an interest in Christianity.",N/A,N/A,en
Beginning from Jerusalem,['James D.G. Dunn'],2009-03-16,['History'],"Beginning from Jerusalem covers the early formation of the Christian faith from 30 to 70 C.E. After outlining the quest for the historical church (parallel to the quest for the historical Jesus) and reviewing the sources, James Dunn follows the course of the movement stemming from Jesus beginning from Jerusalem. / He opens with a close analysis of what can be said of the earliest Jerusalem community, the Hellenists, the mission of Peter, and the emergence of Paul. Then Dunn focuses solely on Paul the chronology of his life and mission, his understanding of his call as apostle, and the character of the churches that he founded. The third part traces the final days and literary legacies of the three principal figures of first-generation Christianity: Paul, Peter, and James the brother of Jesus. Each section includes detailed interaction with the vast wealth of secondary literature on the many subjects covered.",N/A,N/A,en
The Church in the Power of the Spirit,['Jürgen Moltmann'],1977,['Religion'],N/A,N/A,N/A,en
The Didache,['Aaron Milavec'],2003,['Religion'],"""In this study, Aaron Milavec comprehensively examines how the first-century pastoral manual known as the Didache enumerated the step-by-step training of converts for the full, active participation in the earliest Jewish-Christian communities. Milavec shows how the Didache can, in turn, illuminate our understanding of how these first Christian men and women organized their community life socially, religiously, and politically in order to safeguard its members from the challenges of the surrounding Roman, pagan society of the first-century Mediterranean basin. He argues not only that the Didache's textual and contextual clues demonstrate the document's organic unity from beginning to end, but also that it dates from a period before the gospels were written and had gained acceptance.""--BOOK JACKET.Title Summary field provided by Blackwell North America, Inc. All Rights Reserved",N/A,N/A,en
The First Coming,['Thomas Sheehan'],1986,['Philosophy'],N/A,N/A,N/A,en
Lectures on the History of the Eastern Church,['Arthur Penrhyn Stanley'],1862,['Church'],N/A,N/A,N/A,en
Ascension and Ecclesia,['Douglas Farrow'],1999-11,['Religion'],"Recent theology offers few attempts to come to grips with the meaning and implications of the ascension of Jesus. Ascension and Ecclesia promises to refocus attention on this crucial Christian doctrine. Farrow begins with a discussion of the biblical treatment of the ascension and eucharistic celebration, from which emerges a unique ecclesial worldview. Succeeding chapters explore the link between the ascension, cosmology, and ecclesiology and examine the difficulties faced by the doctrine of ascension in our modern scientific world.",N/A,N/A,en
Saeculum,"['R. A. Markus', 'Robert Austin Markus']",1988,['Biography & Autobiography'],The main concern of this book is with those aspects of Augustine's thought which help to answer questions about the purpose of human society.,N/A,N/A,en
The Community of the Beloved Disciple,['Raymond Edward Brown'],1979,['Religion'],"""This study in Johannine ecclesiology reconstructs the history of one Christian community in the first century -- a community whose life from its inception to its last hour is reflected in the Gospel and Epistles of John. It was a community that struggled with the world, with the Jews, and with other Christians. Eventually the struggle spread even to its own ranks. It was, in short, a community not unlike the Church of today. This book offers a different view of the traditional Johannine eagle. In the Gospel the eagle soars above the earth, but with talons bared for the fray. In the Epistles we discover the eaglets tearing at each other for possession of the nest"" -- Back cover.",5,N/A,en
Why the Church?,['Luigi Giussani'],2001,['Religion'],"Giussani (professor emeritus, U. Cattolica del Sacro Cuore, Milan) is a founder of the Catholic lay movement Communion and Liberation. In this work, originally published in Italian as Perche la chiesa?, he discusses issues of faith in an age of rationalism--the mystery of the communion of believers. He explores the Catholic Church's definition of itself as both human and divine, and argues that a different type of existence is born in those who try to live the life of the Church. c. Book News Inc.",N/A,N/A,en
Being Christian,['Rowan Williams'],2014-07-23,['Religion'],"""This book explains essential elements of the Christian life brilliantly but briefly, expounding themes and answering difficulties in everyday commonsense language. It lifts the heart and enriches the mind."" --From book cover.",N/A,N/A,en
The Voice of Conscience,['Lewis V. Baldwin'],2010,['Biography & Autobiography'],"Before he was a civil rights leader, the Rev. Martin Luther King, Jr., was a man of the church. His father was a pastor, and much of young Martin's time was spent in Baptist churches. He went on to seminary and received a Ph.D. in theology. In 1953, he took over leadership of Dexter Avenue Baptist Church in Atlanta. The church was his home. But, as he began working for civil rights, King became a fierce critic of the churches, both black and white. He railed against white Christian leaders who urged him to be patient in the struggle - or even opposed civil rights altogether. And, while the black church was the platform from which King launched the struggle for civil rights, he was deeply ambivalent toward the church as an institution, and saw it as in constant need of reform. In this book, Lewis Baldwin explores King's complex relationship with the Christian church, from his days growing up at Ebenezer Baptist, to his work as a pastor, to his battles with American churches over civil rights, to his vision for the global church. King, Baldwin argues, had a robust and multifaceted view of the nature and purpose of the church that serves as a model for the church in the 21st century.",5,N/A,en
Life and Practice in the Early Church,['Steve McKinion'],2001-08,['Religion'],"A collection of primary texts revealing how early Christians practiced their faith Life and Practice in the Early Church brings together a range of primary texts from the church's first five centuries to demonstrate how early Christians practiced their faith. Rather than focusing on theology, these original documents shed light on how early believers ""did church,"" addressing such practical questions as, how did the church administer baptism? How were sermons delivered? How did the early church carry out its missions endeavors? Early Christian writings reveal a great deal about the tradition, as well as the wider culture in which it developed. Far from being monolithic, the documents which present the voices of the early church fathers in their own words demonstrate variation and diversity regarding how faith was worked out during the patristic period. The texts illuminate who was eligible for baptism, what was expected of worshippers, how the Eucharist was celebrated, and how church offices and their functions were organized. Contextual introductions explain practices and their development for those with little prior knowledge of Christian history or tradition. The pieces included here, all in accessible English translation, represent such sources as Justin Martyr, Tertullian, the Cappadocians, Cyril of Jerusalem, John Chrysostom, and Augustine.",N/A,N/A,en
What Is a Healthy Church?,['Mark Dever'],2007,['Religion'],Guides both pastors and members to recognize key characteristics of a healthy church and then challenge each person to do his or her part in developing those characteristics in the local church body.,4,N/A,en
The Church of Christ,['Everett Ferguson'],1996,['Religion'],"By systematically examining the New Testament's teaching, Ferguson unveils a comprehensive model of the church that is boh biblically centered and relevant to a world on the verge of the twenty-first century.",4,N/A,en
The Origin of Paul's Religion ...,['John Gresham Machen'],1921,['Bible'],N/A,N/A,N/A,en
The Agony of the Church,['Nikolaj Velimirović'],1917,['Christianity'],N/A,N/A,N/A,en
Communion and Otherness,"['Jean Zizioulas', 'John D. Zizioulas']",2006-01-01,['Religion'],Communion and otherness: how can these be reconciled? This work seeks to answer the question. It probes the Christian tradition and highlights the existential concerns that already underlay the writings of the Greek fathers and the definitions of the early ecumenical councils.,N/A,N/A,en
"Fresh Wind, Fresh Fire",['Jim Cymbala'],2010-09,['Religion'],"The Times Are Urgent God Is on the Move Now Is the Moment to ... ask God to ignite his fire in your soul! Pastor Jim Cymbala believes that Jesus wants to renew his people-to call us back from spiritual dead ends, apathy, and lukewarm religion. Cymbala knows the difference firsthand. Thirty-five years ago his own church, the Brooklyn Tabernacle, was a struggling congregation of twenty. Then they began to pray ... God began to move ... street-hardened lives by the hundreds were changed by the love of Christ ... and today they are more than ten thousand strong. The story of what happened to this broken-down church in one of America's toughest neighborhoods points the way to new spiritual vitality in the church and in your own life. Fresh Wind, Fresh Fire shows what the Holy Spirit can do when believers get serious about prayer and the gospel. As this compelling book reveals, God moves in life-changing ways when we set aside our own agendas, take him at his word, and listen for his voice.",N/A,N/A,en
Unity and Diversity in the New Testament,['James D. G. Dunn'],2006,['Religion'],"A challenging textbook for level two and three New Testament scholars. The new material is the author's critical refinement of all the original issues covered. New Testament study, the synoptic question, and the origins of Christianity are all fundamental areas of study on theology undergraduate degrees today.",N/A,N/A,en
Jesus Or Paul?,['Arnold Meyer'],1909,['Christianity'],N/A,N/A,N/A,en
A Treatise on the Church of Christ,['William Palmer'],1841,['Church'],N/A,N/A,N/A,en
Theology and Identity,"['Kwame Bediako', 'Kwame Bedieko']",1992,['Reference'],This book is all about Jesus.nbsp;The words recorded in it were written about Jesus over 2000 years ago. Yet today his message of peace hope love and forgiveness still resonates with people of all races nationalities educational and economic backgrounds. Some like what he said while others disagree with what he said. But almost everyone finds him intriguing. nbsp;The story of Jesus comes to us from four different authors Matthew Mark Luke and John written over a period of nearly seventy years. The message and uniqueness of Jesus remain the same but each author tells the story from his perspective and for his purpose. Some writers wrote more; others wrote less. nbsp;But what if we could read it as one single story from beginning to end This book does just that by combining the four reports of Jesusrsquo; life into a single chronological story.nbsp;Through this book you will take a new look at Jesus his life his miracles and his teachings and be able to come to your own conclusion about him.nbsp;Produced in cooperation with the International Bible Society.,5,N/A,en
Telling God's Story,['Gerard Loughlin'],1999-09-23,['Religion'],"This book presents narrative theology as radically orthodox. It is orthodox because in the tradition of all those who maintain the priority of the story of Jesus, as it is sacramentally performed in the Church, and radical because it eschews all modern attempts to found Christian faith on some other story, such as that of reason, critical history or human consciousness. Acknowledging the indeterminacy of and textuality of human existance, Telling God's Story presents the Christian life as as a truly postmodern venture: the groundless enactment of God's future now.",N/A,N/A,en
After Our Likeness,['Miroslav Volf'],1998,['Religion'],"In After Our Likeness, Miroslav Volf explores the relationship between persons and community in Christian theology. He seeks to counter the tendencies toward individualism in Protestant ecclesiology and give community its due.",3.5,N/A,en
Creature of the Word,"['Matt Chandler', 'Eric Geiger', 'Josh Patterson']",2012,['Religion'],"Respected pastor Matt Chandler launches a compelling discussion about fostering churches that view the gospel as not one piece but the very basis of their existence, allowing that truth to inform their theology, culture, and practice.",N/A,N/A,en
For the Life of the World,['Alexander Schmemann'],1973,['Religion'],"""This book was originally written to serve as an outline for students in a discussion of the Christian ""worldview."" It suggests an approach to the world and to man's life in it that stems from the liturgical experience of the Orthodox Church. Alexander Schmemann understands issues such as secularism and Christian culture from the perspective of the unbroken experience of the Church, as revealed and communicated in her worship, in her liturgy -- the sacrament of the world, the sacrament of the Kingdom. - El Editor.",4.5,N/A,en
Catholicity and the Church,['John Meyendorff'],1983,['Religion'],"Fr Meyendorff affirms that one cannot ""claim to be a Christian except through concrete membership in the catholic Church and through a continuous effort at manifesting the catholicity of the Church.""",3,N/A,en
The True Temple,['Charles Pettit McIlvaine'],1861,['Christian union'],N/A,N/A,N/A,en
The Church of Christ,['Thomas Wharton Phillips'],1909,['Christianity'],N/A,N/A,N/A,en
"Church, World and the Christian Life",['Nicholas M. Healy'],2000-09-18,['Religion'],This book analyzes the impact of pluralism and inclusivism upon ecclesiology.,N/A,N/A,en
Christ and His Church in the Book of Psalms,['Andrew Alexander Bonar'],1861,['Bible'],N/A,N/A,N/A,en
The Nature and Purpose of a Christian Society,['Terrot Reaveley Glover'],1912,['Christian sociology'],N/A,N/A,N/A,en
The Oxford Dictionary of the Christian Church,"['Frank Leslie Cross', 'Elizabeth A. Livingstone']",2005,['Literary Criticism'],"Uniquely authoritative and wide-ranging in its scope, The Oxford Dictionary of the Christian Church is the indispensable one-volume reference work on all aspects of the Christian Church. It contains over 6,000 cross-referenced A-Z entries, and offers unrivalled coverage of all aspects of this vast and often complex subject, including theology, churches and denominations, patristic scholarship, the bible, the church calendar and its organization, popes, archbishops, saints, and mystics. In this revision, innumerable small changes have been made to take into account shifts in scholarly opinion, recent developments, such as the Church of England's new prayer book (Common Worship), RC canonizations, ecumenical advances and mergers, and, where possible, statistics. A number of existing articles have been rewritten to reflect new evidence or understanding, for example the Holy Sepulchre entry, and there are a few new articles. Perhaps most significantly, a great number of the bibliographies have been updated. Established since its first appearance in 1957 as an essential resource for ordinands, clergy, and members of religious orders, ODCC is an invaluable tool for academics, teachers, and students of church history and theology, as well as for the general reader.",N/A,N/A,en
The Reformers and Their Stepchildren,['Leonard Verduin'],2001-08,['Religion'],N/A,4,N/A,en
The Holy Catholic Church,['Henry Barclay Swete'],1915,"[""Apostles' Creed""]",N/A,5,N/A,en
Church and State Through the Centuries,"['Sidney Z. Ehler', 'Sidney Zdeneck Ehler', 'John B. Morrall']",1954,['Religion'],N/A,N/A,N/A,en
The Body of Christ,['Watchman Nee'],1997-11,['Religion'],N/A,N/A,N/A,en
The Lapsed,['Saint Cyprian (Bishop of Carthage.)'],1957,['Religion'],St. Cyprian's writings portray vividly the life of the Christian church in the middle of the third century. The two pastoral addresses of this intensely devout bishop reveal the aftermath of the persecution by the Emperor Decius. +,N/A,N/A,en
Nicholas of Cusa: The Catholic Concordance,['Cardinal Nicholas (of Cusa)'],1991,['History'],A new translation of Kant's great essay on religion and its relation to reason. Copyright © Libri GmbH. All rights reserved.,5,N/A,en
The Amen Corner,['James Baldwin'],1968,['Drama'],"Comic Drama Characters: 4 male, 10 female Compelete interior Self-anointed Harlem store front preacher Margaret Alexander is the leader of her flock and about to see her world crumble. Son David her church organist, is set on following in the footsteps of his father, jazz musician Luke. When the errant husband and father comes home to die, Sister Margaret finds herself losing everything but coming to terms with her own true sense of faith. From the author of Blues for Mr.",N/A,N/A,en
"The Church, the People, and the Age","['Robert Scott', 'George William Gilmore']",1914,['Christianity'],"""There can ne no doubt that the churches of to-day do not fully satisfy the religious needs of mankind. Often the most religious natures are those that hold themselves aloof from the Church. I find the main reason for this is that the churches cling too tenaciously to some old formula that is becoming more and more antiquated, so that the Church loses touch with the spiritual life of the present.... If the churches cannot find the courage and strength for such a course, they will find themselves becoming more and more estranged from mankind"" / Rudolf Christoph Eucken. p. xx-xxi.",N/A,N/A,en
The Purpose-driven Life,"['Richard Warren', 'Rick Warren']",2002,['Religion'],"A Groundbreaking Manifesto on the Meaning of Life This book will help you understand why you are alive and God's amazing plan for you-both here and now, and for eternity. Rick Warren will guide you through a personal 40-day spiritual journey that will transform your answer to life's most important question: What on earth am I here for? Knowing God's purpose for creating you will reduce your stress, focus your energy, simplify your decisions, give meaning to your life, and, most importantly, prepare you for eternity. The Purpose-Driven Life is a blueprint for Christian living in the 21st century-a lifestyle based on God's eternal purposes, not cultural values. Using over 1,200 Scriptural quotes and references, it challenges the conventional definitions of worship, fellowship, discipleship, ministry, and evangelism. In the tradition of Oswald Chambers, Rick Warren offers distilled wisdom on the essence of what life is all about. This is a book of hope and challenge that you will read and re-read, and it will be a classic treasured by generations to come.",N/A,N/A,en
"Tradition and Authority in the Western Church, 300-1140",['Karl Frederick Morrison'],1969,['Church'],"The Description for this book, Tradition and Authority in the Western Church, 300-1140, will be forthcoming.",N/A,N/A,en
Brownson's Defence,['Orestes Augustus Brownson'],1840,['Christian socialism'],N/A,N/A,N/A,en
The Building Work of God,['Witness Lee'],2001-10,['Juvenile Nonfiction'],N/A,N/A,N/A,en
The Form of the Christian Temple,['Thomas Witherow'],1889,['Church'],N/A,N/A,N/A,en
Nine Marks of a Healthy Church,['Mark Dever'],2004,['Religion'],"Did you know that . . .FROGS drink through their skin? Instead of swallowing water with their mouths, frogs absorb moisture through their skin. Frogs can also take in oxygen through their skin, which helps them breathe better in the water.FROGS eat with their eyes closed? The eyes help the frog swallow by lowering into its head and pushing the food down its throat.FROGS can jump 20 times their own length? That’s like a human jumping past four school buses in one leap!FROGS have sticky tongues? Frogs don’t use their hands to catch food . . . they just stick out their tongues! Flies, mosquitoes, and other yummy bugs stick to the tip and get pulled into the frog’s mouth for dinner.SOME FROGS wear camouflage? Stripes and spots help frogs blend into their natural surroundings. Some frogs can even change color depending on their location or the weather.FROGS recycle? Frogs shed their skin about once a week. Then they eat the old skin to reuse the nutrients stored inside.FROGS can live to be 40 years old? Most frogs live from 4 to 15 years.A FROG wasn’t always a frog? Every frog starts as a tiny egg that hatches into a tadpole. A tadpole has a round head and a tail and lives in the water like a fish. The tadpole eats a lot as its body changes and grows new parts. After three to four months, the tadpole has four legs and no tail and can live on land—it has become a frog!AWESOME!Did you know that you can become a new creature, too? You may not have a tail and live in the water, but God can give you a new life. Do you sometimes do things that make you feel bad inside? Maybe you were mean to someone at school or told a lie to your parents. God calls those bad things sin. Everyone is born knowing how to sin, and everyone who sins must be punished. But God, who loves us, doesn’t want us to sin. He wants us to be like Him—loving, kind, and good. Just as a tadpole changes into a frog, God can help you become more like Him. God sent His only Son, Jesus, to earth to be a human, just like us, except Jesus never sinned. Even so, He chose to die so that He could pay the death penalty for our sins. Three days after He died, God raised Him back to life again!Do you want to have a clean, new life? Then just believe in what Jesus did for you. Tell God that you are sorry for your sins and thank Him for sending Jesus to save you. The Bible says, “If anyone is in Christ, he is a new creation; the old has gone, the new has come!” (2 Corinthians 5:17). God will change you on the inside to make you a totally new creature—just like a tadpole changes into a frog. To do this, you can pray something like this:Dear God, I am sorry for the bad things I do. Thank You for sending Jesus to pay the penalty for my sins. Please change me on the inside and help keep me from sin so I can live a clean, new life for You. Amen.If you have just prayed to ask God to change you, write your name and address on the lines below and send it to us. We will send you a free booklet to help you grow in your new life with Christ.",5,N/A,en
The Religions of Authority and the Religion of the Spirit,['Auguste Sabatier'],1910,['Authority'],N/A,N/A,N/A,en
The Misunderstanding of the Church,['Emil Brunner'],1953,['Church'],"Christ-community and the churches of history -- The task before the churches: to serve the growth of the ""ecclesia""--The summing up; outlook for the future.",N/A,N/A,en
Vitoria: Political Writings,['Francisco de Vitoria'],1991-10-31,['History'],"Francisco Vitoria was the earliest and arguably the most important of the Thomist political philosophers of the Counter-Reformation. Not only did he write important essays on civil and ecclesiastical power, but he became celebrated for his defence of the new world Indians against the imperialism of his own master, the King of Spain. Vitoria's political works are thus of great importance for an understanding both of the rise of modern absolutism, and the debate about the emergent imperialism of the European powers. His works are also unusually accessible, since they survive mainly in the form of 'relectiones', or summaries delivered at the end of his lecture courses on law and theology at the University of Salamanca. Translated here into English for the first time, these texts comprise the core of Vitoria's thought, and will be of interest to specialists in political theory and the history of ideas, ecclesiastical history, and the history of early modern Spain. A comprehensive introduction, a chronology, and a bibliography accompany the texts.",N/A,N/A,en
The Peace of the Church,['William Reed Huntington'],1891,['Christian union'],N/A,N/A,N/A,en
The New Chosen People,['William Wade Klein'],1990,['Religion'],N/A,N/A,N/A,en
Orthodox Readings of Augustine,"['George E. Demacopoulos', 'Aristotle Papanikolaou']",2008,['Biography & Autobiography'],"This book not only presents Eastern Orthodox readings of the great Latin theologian, but also demonstrates the very nature of theological consensus in ecumenical dialogue, from a referential starting point of the ancient and great Fathers. This collection exemplifies how, once, the Latin and Byzantine churches, from a deep communion of the faith that transcended linguistic, cultural and intellectual differences, sang from the same page a harmonious song of the beauty of Christ. Contributors are: Lewis Ayres ¿ John Behr ¿ David Bradshaw ¿ Brian E. Daley ¿ George E. Demacopoulos ¿ Elizabeth Fisher ¿ Reinhard Flogaus ¿ Carol Harrison ¿ David Bentley Hart ¿ Joseph T. Lienhard ¿ Andrew Louth ¿ Jean-Luc Marion ¿ Aristotle Papanikolaou ¿ David Tracy",N/A,N/A,en
