title,authors,publishedDate,categories,description,averageRating,textSnippet,language
The Eucharist Makes the Church,['Paul McPartlan'],1993,['Church'],N/A,N/A,N/A,en
Divine Renovation,['James Mallon'],2014,['Religion'],"Highly acclaimed for his work with parish renewal and the New Evangelization, Fr. James Mallon shares with us the many ways for bringing our parishes to life. Through humorous and colorful stories, Mallon challenges us to rethink our models of parish life, from membership-based communities to assemblies of disciples of Jesus who proclaim and share the good news with all peoples. Accessible and engaging, Divine Renovation turns to the Churchs many writings on evangelization and mission so as to articulate practical ways for injecting new life into our parishes. Pastors and parish ministers will be inspired by this book and turn to it for many years to come.""",N/A,N/A,en
Balthasar Hubmaier's Doctrine of the Church,['Eddie Louis Mabry'],1994,['Religion'],Based on the author's thesis (doctoral)--Princeton Theological Seminary.,N/A,N/A,en
The Critical Meaning of the Bible,['Raymond Edward Brown'],1981,['Religion'],"The Word of God is living and active, sharper than any two-edged sword, piercing to the division of soul, discerning the thoughts of the heart. So proclaims te Epistle to the Hebrews. Yet for many persons the biblical Word of God is less a sharp sword than a crutch, supporting rather than piercing them. Interpreted as they have ""always"" heard it, scripture tells them exactly what they want to hear. Modern critical investigation of the Bible can change that radically, for now Christians and the churches are being told that the biblical authors did not always mean what they were thought to have meant when read through the spectacles of later interests. Because of its approach, some Protestants and Catholics believe the new biblical criticism is impious. Raymond Brown, a Catholic priest who is Auburn Professor of Biblical Studies at Union Theological Seminary in New York City, argues strongly to the contrary. Critically interpreted, the Bible is all the more critical to Christians and the Church. The challenge of the scriptures is unleashed, ""piercing to the division of soul, discerning the thoughts of the heart."" - Back cover.",N/A,N/A,en
Models of the Church,['Avery Dulles'],1987,['Religion'],Examines the contemporary writings of Protestant and Catholic ecclesiologists to discuss the basic functions of the Church and assess its role in the lives of believers,N/A,N/A,en
De Ecclesia,['Jan Hus'],2023,['Church'],N/A,N/A,N/A,en
The Splendour of the Church,['Henri de Lubac'],1963,['Church'],N/A,N/A,N/A,en
