title,authors,publishedDate,categories,description,averageRating,textSnippet
Lawrence of Arabia,[],1989,['Biographical films'],"Assigned to Arabia during World War I, Lawrence courageously unites the warring Arab factions into a strong guerrilla front and leads them to brilliant victories in treacherous desert battlefields where they defeat the ruling Turkish Empire.",N/A,N/A
"Uncommercial Traveller And, Edwin Drood",['Charles Dickens'],1880,['Classic'],N/A,N/A,N/A
"The Apology of Socrates, Phaedo and Crito of Plato",[],1907,['Classic'],N/A,N/A,N/A
And Harvest Comes Tomorrow,['Dorothy M. Leaney'],1988,['Australian fiction'],N/A,N/A,N/A
The Collected Short Stories of F. Scott Fitzgerald,['Francis Scott Fitzgerald'],1986,['American literature'],N/A,N/A,N/A
The Collected Short Stories of F. Scott Fitzgerald,['Francis Scott Fitzgerald'],1986,['American literature'],"A collection of author's stories including The Diamond as Big as the Ritz, a fairy tale of unlimited wealth; the sad and hilarious stories of Hollywood hack Pat Hobby; and The Lost Decade.",N/A,N/A
Oliver Twist,['Charles Dickens'],1970,['Classic'],Novel raises a never-to-be-forgotten cry against callous social evils.,N/A,N/A
Gulliver's Travels,['Jonathan Swift'],1983,['Travelers'],N/A,N/A,N/A
There is a Tide,['Agatha Christie'],1974,['Classic'],"After Gordon Cloade's gruesome death, his sister-in-law enlists Hercule Poirot to gather information on Rosaleen, Gordon's widow and sole heir, and her deceased first husband.",N/A,N/A
Silas Marner,['George Eliot'],1968,[],N/A,N/A,N/A
The Promise,['Chaim Potok'],1972,[],N/A,N/A,N/A
Dr. Strangelove: Or,['Peter George'],1964,['Classic'],A satiric tragicomedy about the Cold War and how military bureaucracy warmed it up.,N/A,N/A
Oliver Twist,"['Charles Dickens', 'George Evans']",2015-09,['Classic'],"A graphic novel version of the classic, set in Victorian England, in which a poor orphan is forced into the workhouse at age eight and runs away to become a thief and has a series of misadventures before discovering his true identity.",N/A,N/A
The Scarlet Letter,['Nathaniel Hawthorne'],1948,['Classic'],N/A,N/A,N/A
The Adventures of Sherlock Holmes,['Sir Arthur Conan Doyle'],2000,['Classic'],Six fascinating stories in this book are terrific tales that will delight any young mystery-lover!,N/A,N/A
Please Don't Eat the Daisies (Videorecording),['Home Video Mgmmua'],1981-01-01,['Biographical films'],"A theater critic (Niven), his wife (Day), and their children move to the country where they hope to escape problems of urban living.",N/A,N/A
Elizabethan Drama,[],1909,[],N/A,N/A,N/A
Jude the Obscure,['Thomas Hardy'],1923,['Adultery'],Originally published 1896. Revised and updated bibliography. Victorian novel of Jude Fawley whose children and two women destroy his ideals and cause his destruction.,N/A,N/A
Drums.,['James Boyd'],1968-06-01,[],N/A,N/A,N/A
