title,authors,publishedDate,categories,description,averageRating,textSnippet,language
Industrial Chocolate Manufacture and Use,['Steve T. Beckett'],2011-09-07,['Technology & Engineering'],"Since the third edition of this standard work in 1999, there has been a significant increase in the amount of chocolate manufactured worldwide. The fourth edition of Industrial Chocolate Manufacture and Use provides up-to-date coverage of all major aspects of chocolate manufacture and use, from the growing of cocoa beans to the packaging and marketing of the end product. Retaining the important and well-received key features of the previous edition, the fourth edition also contains completely new chapters covering chocolate crumb, cold forming technologies, intellectual property, and nutrition. Furthermore, taking account of significant changes and trends within the chocolate industry, much new information is incorporated, particularly within such chapters as those covering the chemistry of flavour development, chocolate flow properties, chocolate packaging, and chocolate marketing. This fully revised and expanded new edition is an essential purchase for all those involved in the manufacture and use of chocolate.",4,N/A,en
Street Food around the World,"['Bruce Kraig', 'Colleen Taylor Sen']",2013-09-09,['Cooking'],"In this encyclopedia, two experienced world travelers and numerous contributors provide a fascinating worldwide survey of street foods and recipes to document the importance of casual cuisine to every culture, covering everything from dumplings to hot dogs and kebabs to tacos. Street foods run deep throughout human history and show the movements of peoples and their foods across the globe. For example, mandoo, manti, momo, and baozi: all of these types of dumplings originated in Central Asia and spread across the Old World beginning in the 12th century. This encyclopedia surveys common street foods in about 100 countries and regions of the world, clearly depicting how ""fast foods of the common people"" fit into a country or a region's environments, cultural history, and economy. The entries provide engaging information about specific foods as well as coverage of vendor and food stall culture and issues. An appendix of recipes allows for hands-on learning and provides opportunities for readers to taste international street foods at home.",N/A,N/A,en
Curry,['Lizzie Collingham'],2006-02-06,['History'],"Curry serves up a delectable history of Indian cuisine, ranging from the imperial kitchen of the Mughal invader Babur to the smoky cookhouse of the British Raj. In this fascinating volume, the first authoritative history of Indian food, Lizzie Collingham reveals that almost every well-known Indian dish is the product of a long history of invasion and the fusion of different food traditions. We see how, with the arrival of Portuguese explorers and the Mughal horde, the cooking styles and ingredients of central Asia, Persia, and Europe came to the subcontinent, where over the next four centuries they mixed with traditional Indian food to produce the popular cuisine that we know today. Portuguese spice merchants, for example, introduced vinegar marinades and the British contributed their passion for roast meat. When these new ingredients were mixed with native spices such as cardamom and black pepper, they gave birth to such popular dishes as biryani, jalfrezi, and vindaloo. In fact, vindaloo is an adaptation of the Portuguese dish ""carne de vinho e alhos-""-the name ""vindaloo"" a garbled pronunciation of ""vinho e alhos""--and even ""curry"" comes from the Portuguese pronunciation of an Indian word. Finally, Collingham describes how Indian food has spread around the world, from the curry houses of London to the railway stands of Tokyo, where ""karee raisu"" (curry rice) is a favorite Japanese comfort food. We even visit Madras Mahal, the first Kosher Indian restaurant, in Manhattan. Richly spiced with colorful anecdotes and curious historical facts, and attractively designed with 34 illustrations, 5 maps, and numerous recipes, Curry is vivid, entertaining, and delicious--a feast for food lovers everywhere.",4,N/A,en
The Physiology of Taste,['Jean Anthelme Brillat-Savarin'],2009-10-06,['Cooking'],"A culinary classic on the joys of the table—written by the gourmand who so famously stated, “Tell me what you eat, and I will tell you what you are”—in a handsome new edition of M. F. K. Fisher’s distinguished translation and with a new introduction by Bill Buford. First published in France in 1825 and continuously in print ever since, The Physiology of Taste is a historical, philosophical, and ultimately Epicurean collection of recipes, reflections, and anecdotes on everything and anything gastronomical. Brillat-Savarin, who spent his days eating through the famed food capital of Dijon, lent a shrewd, exuberant, and comically witty voice to culinary matters that still resonate today: the rise of the destination restaurant, diet and weight, digestion, and taste and sensibility.",N/A,N/A,en
The Invention of the Restaurant,['Rebecca L. Spang'],2020-01-14,['History'],"As Spang explains, during the 1760s and 1770s, sensitive, self-described sufferers made public show of their delicacy by going to the new establishments known as “restaurateurs’ rooms” to sip bouillons. But these locations soon became sites for extending frugal, politically correct hospitality and later became symbols of aristocratic greed.",N/A,N/A,en
Food and Drink in Medieval Poland,['Maria Dembinska'],1999-08-20,['Cooking'],"Topics examined include not just the personal eating habits of kings, queens, and nobles but also those of the peasants, monks, and other social groups not generally considered in medieval food studies.""--BOOK JACKET.",4,N/A,en
Pizza,"['Diane Morgan', 'Tony Gemignani']",2012-01-13,['Cooking'],"The ultimate pizza cookbook with more than sixty classic and creative recipes from a thirteen-time World Pizza Champion and a James Beard Award–winning author. Pizza master Tony Gemignani teams up with acclaimed cookbook author Diane Morgan to offer the definitive tome on the art of pizza-making. There are more than sixty selections on the menu, including the thick, rounded-edge crust of classic Neapolitan pizza Margherita, the thin crust New York style Italian Sausage and Three Pepper Pizza, and the stick-to-your-ribs, deep-dish kind, smothered in spinach and mozzarella. There are also plenty of new-fangled pizzas: layered with Thai curry flavored chicken or pineapple; cooked on the grill; even quick and easy versions using store-bought crust. Aficionados will find six pizza dough recipes ready to suit anyone’s crust preferences. Dough-tossing techniques and tips on using peels, stones, tiles, pans, grills, ovens, and more make this a complete pizza package.",N/A,N/A,en
Original 1896 Boston Cooking-School Cook Book,['Fannie Merritt Farmer'],1997-01-01,['Cooking'],"A cookbook classic, acclaimed for such innovations as simple directions, concern with nutrition and terms now standard in American cooking. Detailed methods for preparing soups, seafood, meat, vegetables, poultry, salads, hot and cold desserts, and many other dishes. A delightful repository of information for nostalgia buffs and a useful aid for today's homemaker.",N/A,N/A,en
The Cook's Oracle; and Housekeeper's Manual,['William Kitchiner'],2022-07-20,['Cooking'],"William Kitchiner's ""The Cook's Oracle; and Housekeeper's Manual"" serves as a quintessential guide to the culinary arts of the early 19th century, deftly marrying practical cooking methods with domestic management. Written with an engaging and instructional tone, Kitchiner's work reflects the burgeoning interest in gastronomy during the Regency era, marked by a shift towards more refined culinary techniques and diverse ingredients. This authoritative manual offers an extensive collection of recipes, coupled with wisdom on the organization and operation of a household, revealing the social dynamics and culinary trends of the time. Kitchiner, a physician by profession and a fervent culinary enthusiast, draws upon his diverse background to present his compendium. His insights are shaped not only by his medical expertise but also by his experiences in aristocratic households, which informed his understanding of dietary needs and preferences. This unique perspective enables him to blend health consciousness with the joy of cooking, making his manual a notable contribution to both the culinary and domestic spheres of his era. For anyone passionate about historical gastronomy or the evolution of cooking techniques, Kitchiner's ""The Cook's Oracle"" is indispensable. It provides a window into the culture of the time while also offering timeless culinary advice, rendering it useful for contemporary cooks and historians alike. Dive into its pages to explore the intersection of cuisine and domestic art, and let it inspire your own culinary journey.",N/A,N/A,en
Pasta,"['Silvano Serventi', 'Françoise Sabban']",2002-11-06,['Cooking'],"Ranging from the imperial palaces of ancient China and the bakeries of fourteenth-century Genoa and Naples all the way to the restaurant kitchens of today, Pasta tells a story that will forever change the way you look at your next plate of vermicelli. Pasta has become a ubiquitous food, present in regional diets around the world and available in a host of shapes, sizes, textures, and tastes. Yet, although it has become a mass-produced commodity, it remains uniquely adaptable to innumerable recipes and individual creativity. Pasta: The Story of a Universal Food shows that this enormously popular food has resulted from of a lengthy process of cultural construction and widely diverse knowledge, skills, and techniques. Many myths are intertwined with the history of pasta, particularly the idea that Marco Polo brought pasta back from China and introduced it to Europe. That story, concocted in the early twentieth century by the trade magazine Macaroni Journal, is just one of many fictions umasked here. The true homelands of pasta have been China and Italy. Each gave rise to different but complementary culinary traditions that have spread throughout the world. From China has come pasta made with soft wheat flour, often served in broth with fresh vegetables, finely sliced meat, or chunks of fish or shellfish. Pastasciutta, the Italian style of pasta, is generally made with durum wheat semolina and presented in thick, tomato-based sauces. The history of these traditions, told here in fascinating detail, is interwoven with the legacies of expanding and contracting empires, the growth of mercantilist guilds and mass industrialization, and the rise of food as an art form. Whether you are interested in the origins of lasagna, the strange genesis of the Chinese pasta bing or the mystique of the most magnificent pasta of all, the timballo, this is the book for you. So dig in!",N/A,N/A,en
Tastes of Byzantium,['Andrew Dalby'],2010-06-30,['History'],"For centuries, the food and culinary delights of the Byzantine empire - centred on Constantinople - have captivated the west, although it appeared that very little information had been passed down to us. Andrew Dalby's ""Tastes of Byzantium"" now reveals in astonishing detail, for the first time, what was eaten in the court of the Eastern Roman Empire - and how it was cooked. Fusing the spices of the Romans with the seafood and simple local food of the Aegean and Greek world, the cuisine of the Byzantines was unique and a precursor to much of the food of modern Turkey and Greece. Bringing this vanished cuisine to life in vivid and sensual detail, Dalby describes the sights and smells of Constantinople and its marketplaces, relates travellers' tales and paints a comprehensive picture of the recipes and customs of the empire and their relationship to health and the seasons, love and medicine. For food-lovers and historians alike, ""Tastes of Byzantium"" is both essential and riveting - an extraordinary illumination of everyday life in the Byzantine world.",N/A,N/A,en
Uncorked,['Gérard Liger-Belair'],2013-06-02,['Cooking'],"The spectacular science behind champagne's effervescence Uncorked quenches our curiosity about the inner workings of one of the world's most prized beverages. Esteemed for its freshness, vitality, and sensuality, champagne is a wine of great complexity. Mysteries aplenty gush forth with the popping of that cork. Just what is that fizz? Can you judge champagne quality by how big the bubbles are, how long they last, or how they behave before they fade? And why does serving champagne in a long-stemmed flute prolong its chill and effervescence? Through lively prose and a wealth of state-of-the-art photos, this revised edition of Uncorked unlocks the door to what champagne is all about. Providing an unprecedented close-up view of the beauty in the bubbles, Gérard Liger-Belair presents images that look surprisingly like lovely flowers, geometric patterns, even galaxies as the bubbles rise through the glass and burst forth on the surface. He illustrates how bubbles form not on the glass itself but are ""born"" out of debris stuck on the glass wall, how they rise, and how they pop. Offering a colorful history of champagne, Liger-Belair tells us how it is made and he asks if global warming could spell champagne's demise. In a brand-new afterword, he updates the reader on new developments in the world of bubble science and delves even more deeply into the processes that give champagne its unique and beautiful character. Bubbly may tickle the nose, but Uncorked tackles what the nose and the naked eye cannot—the spectacular science that gives champagne its charm and champagne drinkers immeasurable pleasure.",N/A,N/A,en
Dracula by Bram Stoker,['Bram Stoker'],2021-01-14,[],This book holds an important place among the World Classics.,N/A,N/A,en
Street Foods,"['Hinnerk von Bargen', 'The Culinary Institute of America (CIA)']",2025-04-01,['Cooking'],"GLOBAL STREET FOOD FOR TODAY’S “WORLD CASUAL” DINERS Sausage and pepper sandwiches at an Italian street fair . . . Fish tacos from a beachfront truck . . . Spicy Asian noodles slurped by a roadside stand . . . Sugar-dusted fried dough at a July 4th carnival . . . few foods are as widely beloved or as evocative of local culture and tradition as street foods. Street Foods explores the medley of global cuisines, cultures, and cooking techniques that are propelling the demand for “world casual” flavors from diners in every foodservice segment. This comprehensive guide teaches professional chefs and culinary students how to capitalize on the ingredients, flavors, cooking techniques, and service of cherished portable foods from around the world. It reveals how to bring foods off the street and showcase them on menus in creative ways that honor their unique histories and cultural drivers—while wowing diners. This richly illustrated book features more than 225 recipes for on-the-go items, all divided into categories including bowl foods, foods on a stick, finger foods, stuffed foods, sandwiches, and much, much more. Global and regional American street foods comprise one of the hottest trends in the culinary world today. With Street Foods, the bold flavors, international influences, and enjoyable eating of these quick bites are at your fingertips.",N/A,N/A,en
Cheese,['Andrew Dalby'],2009-11-15,['Cooking'],"Take a slice of bread. It’s perfectly okay in and of itself. Maybe it has a nice, crisp crust or the scent of sourdough. But really, it’s kind of boring. Now melt some cheese on it—a sharp Vermont cheddar or a flavorful Swiss Gruyere. Mmm, delicious. Chee",2,N/A,en
Green Kitchen Travels,"['David Frenkiel', 'Luise Vindahl']",2014-09-15,['Cooking'],"Delicious, nutritious and healthy vegetarian and vegan food, inspired by flavors from around the world, from the Green Kitchen Stories family. The Green Kitchen Stories family David, Luise and their children are a family who love to travel. Hungry to see and taste more of the world, they embarked on an around-the-world trip with their seven-month-year-old. Start the day with indulgent almond pumpkin waffles from San Francisco, tuck into a raw beansprout pad thai from Thailand for lunch, and a Sri Lankan vegetable curry for supper. With easy to find ingredients and simple instructions, these recipes are sure to be a success. With stunning photography and food styling, as well as personal anecdotes and images from the authors’ travels, Green Kitchen Travels shares modern and inspiring vegetarian, vegan and gluten-free recipes for all appetites.",N/A,N/A,en
"Canadian Whisky, Second Edition",['Davin de Kergommeaux'],2017-10-03,['Cooking'],"Savour the bold notes and rich varieties of Canadian whisky with this fully revised, updated, and indispensable guide. This fully updated and revised edition of the award-winning Canadian Whisky invites you on a journey across Canada and back through time to discover the story of this unique spirit. Independent whisky expert Davin de Kergommeaux weaves a compelling narrative, beginning with the substance of Canadian whisky—grains, water, and wood—and details the process of how it’s made and how to taste it. He traces the fascinating history of the country’s major distilleries and key visionaries, and introduces the present-day players—big and small—who are shaping the industry through both tradition and innovation. Newly designed, and now including a map of Canada’s whisky distilleries, over 100 up-to-date tasting notes, and a handy tasting checklist, Canadian Whisky reflects the latest research on flavour development and the science of taste. At once authoritative and captivating, this is a must-have resource for beginners, enthusiasts, and aficionados alike.",N/A,N/A,en
"The Peppers, Cracklings, and Knots of Wool Cookbook",['Diane M. Spivey'],2000-09-07,['Social Science'],A groundbreaking treatment of heritage survival in African and African American cooking.,N/A,N/A,en
Cold Dishes for Hot Weather,"['Ysaguirre', 'La Marca']",1896,['Cold dishes (Cooking)'],N/A,N/A,N/A,en
Caviar,['Inga Saffron'],2002,['Cooking'],"Today caviar is renowned as a gourmet delicacy, but few realize that it became a luxury food only in recent times. In Caviar, Inga Saffron tells, for the first time, the story of how the virgin eggs of the prehistoric-looking sturgeon were transformed from a humble peasant food into a czar's delicacy -- and ultimately a coveted status symbol for a rising middle class. She explores how the glistening black eggs became a culinary extravagance, while taking readers on a revealing excursion into the murky world of caviar on the banks of the Volga River and Caspian Sea in Russia, the Elbe River in Europe, and the Hudson and Delaware Rivers in the United States. Saffron describes the complex industry caviar has spawned, illustrating the unfortunate consequences of mass marketing such a rare commodity.The story of caviar has long been one of conflict, crisis, extravagant claims, and colorful characters, such as the Greek sea captain who first discovered the secret method of transporting the perishable delicacy to Europe, the canny German businessmen who encountered a wealth of untapped sturgeon in American waters, the Russian Communists w",N/A,N/A,en
An Omelette and a Glass of Wine,['Elizabeth David'],1986,['Cooking'],Contains delightful explorations of food and cooking among which are the collections namesake essay and many other gems; Z99 black-and-white photographs and illustrations,N/A,N/A,en
The Potato,['Larry Zuckerman'],1999-10-25,['Cooking'],"The Potato tells the story of how a humble vegetable, once regarded as trash food, had as revolutionary an impact on Western history as the railroad or the automobile. Using Ireland, England, France, and the United States as examples, Larry Zuckerman shows how daily life from the 1770s until World War I would have been unrecognizable-perhaps impossible-without the potato, which functioned as fast food, famine insurance, fuel and labor saver, budget stretcher, and bank loan, as well as delicacy. Drawing on personal diaries, contemporaneous newspaper accounts, and other primary sources, this is popular social history at its liveliest and most illuminating.",N/A,N/A,en
The Ni'matnama Manuscript of the Sultans of Mandu,['Norah M. Titley'],2004-11-30,['Cooking'],"The Ni'matnama is a late fifteenth-century book of the recipes of the eccentric Sultan of Mandu (Madhya Pradesh), Ghiyath Shahi, collected and added to by his son and successor, Nasir Shah. It contains recipes for cooking a variety of delicacies and epicurean delights, as well as providing remedies and aphrodisiacs for the Sultan and his court. It also includes important sections on the preparation of betel leaves as well as advice on the logistics of hunting expeditions and warfare. The text provides a remarkable and tantalizing account of rarified courtly life in a fifteenth-century Indian Sultanate region.",N/A,N/A,en
Radical Brewing,['Randy Mosher'],2004-05-06,['Cooking'],"Radical Brewing takes a hip and creative look at beer brewing, presented with a graphically appealing two-color layout.",N/A,N/A,en
Cravings,"['Chrissy Teigen', 'Adeena Sussman']",2016-02-23,['Cooking'],"Maybe she’s on a photo shoot in Zanzibar. Maybe she’s making people laugh on TV. But all Chrissy Teigen really wants to do is talk about dinner. Or breakfast. Lunch gets some love, too. For years, she’s been collecting, cooking, and Instagramming her favorite recipes, and here they are: from breakfast all day to John’s famous fried chicken with spicy honey butter to her mom’s Thai classics. Salty, spicy, saucy, and fun as sin (that’s the food, but that’s Chrissy, too), these dishes are for family, for date night at home, for party time, and for a few life-sucks moments (salads). You’ll learn the importance of chili peppers, the secret to cheesy-cheeseless eggs, and life tips like how to use bacon as a home fragrance, the single best way to wake up in the morning, and how not to overthink men or Brussels sprouts. Because for Chrissy Teigen, cooking, eating, life, and love are one and the same.",N/A,N/A,en
The Power of the Center,['Rudolf Arnheim'],1983-01-01,['Cooking'],"The tension between two systems for understanding and picturing space, the concentric and the Cartesian, is regarded by the author as the key to composition in painting, sculpture and architecture",N/A,N/A,en
The Unexpected Genius of Pigs,['Matt Whyman'],2018-10-04,['Nature'],"We often consider dogs to be our enduring sidekicks but the truth is domestic pigs have played a role in our lives for nearly as long. Pigs are highly social and smart. They like to play. They’re inventive, crafty and belligerent – and incredibly singleminded. Ultimately, we have far more in common with these creatures than we like to admit.",N/A,N/A,en
The Art and Craft of Coffee,['Kevin Sinnott'],2011-01-19,['Cooking'],"“Sinnott’s guide to primo coffee enables readers to fill their cups to the rim . . . with greatness . . . [It] will result in a better cup of joe.” —Publishers Weekly (starred review) There is no other beverage that gives you a better way to travel the world than coffee. You can literally taste the volcanic lava from Sumatra, smell the spice fields of India, and lift your spirits to the Colombian mountaintops in your morning cup of joe. The Art and Craft of Coffee shows you how to get the most out of your coffee, from fresh-roasted bean to hand-crafted brew. In The Art and Craft of Coffee, Kevin Sinnott, the coffee world’s most ardent consumer advocate, educates, inspires, and caffeinates you. Inside you will find: How green coffee beans are farmed and harvested Insight into single-origin coffee beans and worldwide coffee harvests A photo guide to roasting your own coffee at home How to choose the best grinder for your beans A complete, visual manual for 9 coffee brewing styles, including French press, vacuum, Chemex, auto-drip, Turkish ibrik, and espresso Delicious recipes for dozens of coffee and espresso beverages “In the decades that Kevin Sinnott has spent meeting with and interviewing hundreds of coffee professionals, rather than crossing over to the dark side and becoming one himself, he has taken what he has learned and translated it from coffee geek-speak into English. Why? For the sole purpose of allowing you to better enjoy your coffee. In short, if you like coffee, you will love this book.” —Oren Bloostein, proprietor of Oren’s Daily Roast",N/A,N/A,en
Just how,['Adeline Dutton Train Whitney'],1892,['Cooking'],N/A,N/A,N/A,en
