title,authors,publishedDate,categories,description,averageRating,textSnippet,language
The Complete Idiot's Guide to Coffee and Tea,"['Travis Arndorfer', 'Kristine Hansen']",2006,['Cooking'],"""A freshly brewed introduction to the caffeine subculture."" For hot beverage novices and budding baristas, here is an essential introduction to the world of coffee and tea, from a basic history of each product, to advanced tips and tricks for blending, brewing, and using syrups and milk, to recipes from around the world. ? Includes information on different types of beans and teas, available brewing equipment, and little-known secrets to making fabulous coffee- and tea-based drinks ? Written by food and beverage writers who are experts in the field ? Contains the finest recipes from worldwide barista champions",N/A,N/A,en
Scratch,['Maria Rodale'],2016-10-11,['Cooking'],"Maria Rodale was raised on real food. She doesn’t think of eating homemade, from-scratch meals as part of a trend or movement; it has always been her life. Raised in a family of farmers, bakers, chefs, gardeners, and publishers, Maria is used to growing, cooking, reading and writing about, and eating organic, delicious food. And now, for the first time ever, she’s sharing her tried-and-true family recipes. Scratch is full of comfort food recipes that aren’t focused on any one healthy trend, but are instead innately healthy, because Maria inspires you to return to your kitchen and cook with real, organic food. Recipes like Pasta Fagiole, Maria’s Fried Chicken, and Lamb & Barley Soup will be crowd pleasers for sure, but Maria throws in some unique-to-the-family recipes that are going to delight as well, such as her Pennsylvania Dutch Dandelion Salad with Bacon Dressing, Ardie’s Pasties, and Homemade Hoppin’ John (a black-eyed pea stew made with smoked turkey or ham). Besides sharing her family’s favorite recipes, Maria’s book also gives you a peek into her life as a Rodale, with personal family portraits and stories. With this cookbook, you can eat like the Rodale family every night of the week with delicious food to make at home, from scratch. Naturally healthy, bacon included.",N/A,N/A,en
Budget Cooking,['Audrey Ellis'],1977,['Cooking'],N/A,N/A,N/A,en
Taste,['Stanley Tucci'],2021-10-07,[],N/A,N/A,N/A,en
"The DIRTY, LAZY, KETO Cookbook","['Stephanie Laska', 'William Laska']",2020-01-07,['Cooking'],"USA TODAY BESTSELLER * As seen on the Today show * More than 100,000 copies sold! After losing 140 pounds, bestselling author Stephanie Laska shares her unconventional weight loss secrets and 100 easy, accessible recipes so you too can experience the fun behind the keto lifestyle with lots of humor and zero judgement. You don’t have to be perfect to be successful at weight loss—now you can bend the rules and still lose the weight. If your version of the keto diet includes a Diet Coke, low-carb beer, or the occasional chocolate-covered protein bar, The DIRTY, LAZY, KETO Cookbook is your roadmap for results. Bestselling author Stephanie Laska explains her flexible, honest, and real-world approach to losing weight with the keto diet and inspires you to cook your way to weight loss, maintenance, and beyond whether you’re a beginner or experienced keto veteran. Including 100 recipes that are under 10 net carbs per serving, The DIRTY, LAZY, KETO Cookbook presents affordable, traditional, and—most importantly—recognizable recipes to guide you on your weight loss journey. All of the ingredients can be found at discount grocery stores—nothing fancy here! Within these relatable and unique recipes there are meals for picky eaters, fancier meals for guests, and some that are vegetarian “ish” (don’t contain meat, but may contain dairy or eggs). And with simple, stress-free instructions that require no cooking experience, there’s no excuse not to cook.",N/A,N/A,en
What She Ate,['Laura Shapiro'],2018-07-24,['Cooking'],"A Washington Post Notable Nonfiction Book of The Year One of NPR Fresh Air's ""Books to Close Out a Chaotic 2017"" NPR's Book Concierge Guide To the Year’s Great Reads “How lucky for us readers that Shapiro has been listening so perceptively for decades to the language of food.” —Maureen Corrigan, NPR Fresh Air Six “mouthwatering” (Eater.com) short takes on six famous women through the lens of food and cooking, probing how their attitudes toward food can offer surprising new insights into their lives, and our own. Everyone eats, and food touches on every aspect of our lives—social and cultural, personal and political. Yet most biographers pay little attention to people’s attitudes toward food, as if the great and notable never bothered to think about what was on the plate in front of them. Once we ask how somebody relates to food, we find a whole world of different and provocative ways to understand her. Food stories can be as intimate and revealing as stories of love, work, or coming-of-age. Each of the six women in this entertaining group portrait was famous in her time, and most are still famous in ours; but until now, nobody has told their lives from the point of view of the kitchen and the table. What She Ate is a lively and unpredictable array of women; what they have in common with one another (and us) is a powerful relationship with food. They include Dorothy Wordsworth, whose food story transforms our picture of the life she shared with her famous poet brother; Rosa Lewis, the Edwardian-era Cockney caterer who cooked her way up the social ladder; Eleanor Roosevelt, First Lady and rigorous protector of the worst cook in White House history; Eva Braun, Hitler’s mistress, who challenges our warm associations of food, family, and table; Barbara Pym, whose witty books upend a host of stereotypes about postwar British cuisine; and Helen Gurley Brown, the editor of Cosmopolitan, whose commitment to “having it all” meant having almost nothing on the plate except a supersized portion of diet gelatin.",N/A,N/A,en
Green Smoothie Revolution,['Victoria Boutenko'],2009-08-04,['Health & Fitness'],"A raw food pioneer takes the chore out of eating your greens with this surprisingly simple and powerful solution to getting proper nutrition, every day Thanks to the advent of processed food, people who live in industrial countries, especially those whose families have done so for several generations, often have symptoms of multiple nutrient deficiencies on a very high level. We may not be obviously sick, but may suffer from lack of focus, insomnia, sluggishness, or any host of symptoms caused by nutritional deficiency. Green smoothies provide a way for us to correct these persistent imbalances and begin to discover what health actually feels like. Green Smoothie Revolution offers a wide variety of smoothie recipes as well as the nutrition and know-how behind the drinks. Featuring 200 recipes that pack a powerhouse punch, Boutenko reintroduces long neglected fruits, vegetables, and greens in the most persuasive style for our busy lives: with fast prep and delicious results. Green Smoothie Revolution offers both simplicity and enough variety to keep taste buds happy and the vital nutrients you need.",N/A,N/A,en
The Modern Cook’s Year: Over 250 vibrant vegetable recipes to see you through the seasons,['Anna Jones'],2017-10-05,['Cooking'],"Winner of the Guild of Food Writers Cookery Book Award and OFM Best New Cook Book 2018 An essential addition to every cook’s bookshelf, The Modern Cook’s Year will show you how to make the most of seasonal produce, using simple, hugely inventive flavours and ingredients.",N/A,N/A,en
Nadiya's Fast Flavours,['Nadiya Hussain'],2021-10-28,['Cooking'],"Discover mouth-watering, time-saving new recipes to whip up this summer in Nadiya's latest bestselling cookbook 'An abundance of refreshingly original ideas. Her recipes are achievable for us all' DAILY EXPRESS ________ Nadiya's Fast Flavours will bring the excitement back into your daily meals, with all the recipes she cooks on her hit BBC2 programme and more besides. Known for her bold and surprising flavour combinations, Nadiya loves to throw the rulebook out of the window, and is always adding her signature twist to classic recipes. Now she makes it easy for you to do the same, with a host of everyday recipes that are guaranteed to send your taste buds into overdrive, including . . . · Brioche Custard French Toast · Sweet-And- Sour Prawns with Noodles · Squash, Saffron And Grapefruit Soup · Blueberry And Fennel Ice Cream Cake · Lemon Leg Of Lamb with Jewelled Couscous · Coffee-Glazed Focaccia Sour, sweet, spicy, zesty, earthy, fruity, herbal - her delicious recipes offer new and innovative ways to pack your meals with flavour, using clever shortcuts, hacks and handy ingredients to put the va-va-voom into your food but without spending hours in the kitchen. ________ Praise for Nadiya Hussain: 'Let Nadiya fill your kitchen with pure joy' Woman & Home 'All hail the brilliant Nadiya Hussain' Radio Times 'The queen of Bake Off' Good Housekeeping",N/A,N/A,en
Drink,['Iain Gately'],2009-05-05,['Cooking'],"A spirited look at the history of alcohol, from the dawn of civilization to the modern day Alcohol is a fundamental part of Western culture. We have been drinking as long as we have been human, and for better or worse, alcohol has shaped our civilization. Drink investigates the history of this Jekyll and Hyde of fluids, tracing mankind's love/hate relationship with alcohol from ancient Egypt to the present day. Drink further documents the contribution of alcohol to the birth and growth of the United States, taking in the War of Independence, the Pennsylvania Whiskey revolt, the slave trade, and the failed experiment of national Prohibition. Finally, it provides a history of the world's most famous drinks-and the world's most famous drinkers. Packed with trivia and colorful characters, Drink amounts to an intoxicating history of the world.",N/A,N/A,en
A History and Description of Modern Wines,['Cyrus Redding'],2022-10-27,[],"This work has been selected by scholars as being culturally important, and is part of the knowledge base of civilization as we know it. This work is in the ""public domain in the United States of America, and possibly other nations. Within the United States, you may freely copy and distribute this work, as no entity (individual or corporate) has a copyright on the body of the work. Scholars believe, and we concur, that this work is important enough to be preserved, reproduced, and made generally available to the public. We appreciate your support of the preservation process, and thank you for being an important part of keeping this knowledge alive and relevant.",N/A,N/A,en
A Week in the Zone,"['Barry Sears', 'Deborah Kotz']",2009-10-13,['Cooking'],"A national bestseller for more than three years in hardcover, The Zone has introduced millions of people worldwide to a breakthrough approach to dieting based on Novel Prize–winning scientific research. Treating food as the most powerful drug available, The Zone plan shows how food, when used unwisely, can be toxic. Used wisely however, it will take anyone into the Zone, a state of exceptional health familiar to champion athletes. Now the benefits of Barry Sears߲evolutionary program can be experienced in just one week! With A Week in the Zone, everyone can start on the path to permanent weight loss and learn how to burn body fat, and keep it off – without deprivation or hunger. They'll also discover how the Zone helps to both increase energy and fight heart disease, diabetes, PMS, chronic fatigue, depression, and cancer.",N/A,N/A,en
Hello My Name Is Mariana and I'm a Wineaholic: Wine Tasting Review Journal,['Ss Custom Designs'],2019-03-31,['Cooking'],"Keep track of trips to your favorite winery with this wine tasting review journal. Make notes of the various red or white wines you come across and refine your palate with this simple and fun log book. This wine taster journal features a unique and funny design and is the perfect size to take with you to a dinner party or your favorite vineyard. Details include: . 6x9 inches 120 pages Matte-finish paperback cover White paper This wine log book also makes a great gift for any mom, dad, or friend who enjoys keeping a record of their experiences so they can review them at the end of the year. If you are looking for a holiday gift to show your appreciation for someone you care about and want to let them know you are grateful to have them in your life, this is a perfect choice.",N/A,N/A,en
Dining Out,"['Katie Rawson', 'Elliott Shore']",2019-08-12,['History'],"A global history of restaurants beyond white tablecloths and maître d’s, Dining Out presents restaurants both as businesses and as venues for a range of human experiences. From banquets in twelfth-century China to the medicinal roots of French restaurants, the origins of restaurants are not singular—nor is the history this book tells. Katie Rawson and Elliott Shore highlight stories across time and place, including how chifa restaurants emerged from the migration of Chinese workers and their marriage to Peruvian businesswomen in nineteenth-century Peru; how Alexander Soyer transformed kitchen chemistry by popularizing the gas stove, pre-dating the pyrotechnics of molecular gastronomy by a century; and how Harvey Girls dispelled the ill repute of waiting tables, making rich lives for themselves across the American West. From restaurant architecture to technological developments, staffing and organization, tipping and waiting table, ethnic cuisines, and slow and fast foods, this delectably illustrated and profoundly informed and entertaining history takes us from the world’s first restaurants in Kaifeng, China, to the latest high-end dining experiences.",N/A,N/A,en
Gluten-Free on a Shoestring,['Nicole Hunn'],2011-02-22,['Cooking'],"Collects economical gluten-free recipes for blueberry muffins, soft pretzels, macaroni and cheese, and chocolate-chip cookies, with information on bulk buying, coupon strategies, using naturally gluten-free foods, and equipment.",N/A,N/A,en
Natural Wine for the People,['Alice Feiring'],2019-08-06,['Cooking'],"A compact illustrated guide to the emerging and enormously popular category of natural wine, a style that focuses on minimal intervention, lack of additives, and organic and biodynamic growing methods. Today, wine is more favored and consumed that it's ever been in the United States--and millennials are leading the charge, drinking more wine than any other generation in history. Many have been pulled in by the tractor beam of natural wine--that is, organic or biodynamic wine made with nothing added, and nothing taken away--a movement that has completely rocked the wine industry in recent years. While all of the hippest restaurants and wine bars are touting their natural wine lists, and while more and more consumers are calling for natural wine by name, there is still a lot of confusion about what exactly natural wine is, where to find it, and how to enjoy it. In Natural Wine for the People, James Beard Award-winner Alice Feiring sets the record straight, offering a pithy, accessible guide filled with easy definitions, tips and tricks for sourcing the best wines, whimsical illustrations, a definitive list to the must-know producers and bottlings, and an appendix with the best shops and restaurants specializing in natural wine across the country, making this the must-buy and must-gift wine book of the year.",N/A,N/A,en
Hello My Name Is Noelle and I'm a Wineaholic: Wine Tasting Review Journal,['Ss Custom Designs'],2019-03-30,['Cooking'],"Keep track of trips to your favorite winery with this wine tasting review journal. Make notes of the various red or white wines you come across and refine your palate with this simple and fun log book. This wine taster journal features a unique and funny design and is the perfect size to take with you to a dinner party or your favorite vineyard. Details include: . 6x9 inches 120 pages Matte-finish paperback cover White paper This wine log book also makes a great gift for any mom, dad, or friend who enjoys keeping a record of their experiences so they can review them at the end of the year. If you are looking for a holiday gift to show your appreciation for someone you care about and want to let them know you are grateful to have them in your life, this is a perfect choice.",N/A,N/A,en
Vegan Chocolate,['Fran Costigan'],2013-10-22,['Cooking'],"It can be difficult to find truly indulgent vegan desserts -- especially chocolate. But for the first time, chocolate cakes, brownies, truffles, puddings, ice creams, and more are within reach: dairy-free, organic, fair-trade, and sublime. Author, baking instructor, and vegan powerhouse Fran Costigan has dedicated years to satisfying her sweet tooth while keeping it vegan. Through experimentation and long hours in the kitchen, she's recreated some of her favorite chocolate desserts as better-for-you interpretations that pass the taste test: Bittersweet Chocolate Truffles (with a variety of flavor variations), a Brooklyn Blackout Layer Cake, a Sacher Torte, even chocolate Moon Pies! Her detailed instructions make for professional-quality outcomes every time: it's like a personal baking class, right in your kitchen. The perfect gift for anyone with a sweet tooth, Vegan Chocolate is sure to become an instant classic.",N/A,N/A,en
Easy Cupcake Recipes,"['Hinkler Books Pty, Limited']",2012-08-01,[],N/A,N/A,N/A,en
Pancake,['Ken Albala'],2008-10-15,['Cooking'],"Round, thin, and made of starchy batter cooked on a flat surface, it is a food that goes by many names: flapjack, crêpe, and okonomiyaki, to name just a few. The pancake is a treasured food the world over, and now Ken Albala unearths the surprisingly rich history of pancakes and their sizzling goodness. Pancake traverses over centuries and civilizations to examine the culinary and cultural importance of pancakes in human history. From the Russian blini to the Ethiopian injera, Albala reveals how pancakes have been a perennial source of sustenance from Greek and Roman eras to the Middle Ages through to the present day. He explores how the pancake has gained symbolic currency in diverse societies as a comfort food, a portable victual for travelers, a celebratory dish, and a breakfast meal. The book also features a number of historic and modern recipes—tracing the first official pancake recipe to a sixteenth-century Dutch cook—and is accompanied by a rich selection of illustrations. Pancake is a witty and erudite history of a well-known favorite and will ensure that the pancake will never be flattened under the shadow of better known foods.",N/A,N/A,en
Hello My Name Is Katie and I'm a Wineaholic: Wine Tasting Review Journal,['Ss Custom Designs'],2019-04-03,['Cooking'],"Keep track of trips to your favorite winery with this wine tasting review journal. Make notes of the various red or white wines you come across and refine your palate with this simple and fun log book. This wine taster journal features a unique and funny design and is the perfect size to take with you to a dinner party or your favorite vineyard. Details include: . 6x9 inches 120 pages Matte-finish paperback cover White paper This wine log book also makes a great gift for any mom, dad, or friend who enjoys keeping a record of their experiences so they can review them at the end of the year. If you are looking for a holiday gift to show your appreciation for someone you care about and want to let them know you are grateful to have them in your life, this is a perfect choice.",N/A,N/A,en
The Book For All Households,['Nicolas Appert'],2023-07-18,['Cooking'],"Originally published in the early 19th century, this book is a classic guide to home economics. Written by Nicolas Appert, a pioneering French chef and food scientist, the book provides practical advice on everything from cooking and cleaning to shelter and clothing. With a focus on healthy living and sustainable practices, this book remains a valuable resource for anyone interested in domestic life. This work has been selected by scholars as being culturally important, and is part of the knowledge base of civilization as we know it. This work is in the ""public domain in the United States of America, and possibly other nations. Within the United States, you may freely copy and distribute this work, as no entity (individual or corporate) has a copyright on the body of the work. Scholars believe, and we concur, that this work is important enough to be preserved, reproduced, and made generally available to the public. We appreciate your support of the preservation process, and thank you for being an important part of keeping this knowledge alive and relevant.",N/A,N/A,en
The New Cabbage Soup Diet,['Margaret Danbrot'],2004-02-16,['Cooking'],"Have the holidays left you with too-tight pants? Is there a dress you need to squeeze into for next week's special occasion? Are you planning on putting on a bathing suit anytime soon? If you want to crash off pounds fast--before you start on that long term eating plan--The New Cabbage Soup Diet is for you. Featured in Cosmopolitan magazine and USA Today, The Cabbage Soup Diet has been a word-of-mouth phenomenon. This revised and updated edition for healthier, safe weight loss contains true stories from a number of successful Cabbage-Soup dieters, so that readers can find out what worked for them and what didn't.",5,N/A,en
Hello My Name Is Presley and I'm a Wineaholic: Wine Tasting Review Journal,['Ss Custom Designs'],2019-03-30,['Cooking'],"Keep track of trips to your favorite winery with this wine tasting review journal. Make notes of the various red or white wines you come across and refine your palate with this simple and fun log book. This wine taster journal features a unique and funny design and is the perfect size to take with you to a dinner party or your favorite vineyard. Details include: . 6x9 inches 120 pages Matte-finish paperback cover White paper This wine log book also makes a great gift for any mom, dad, or friend who enjoys keeping a record of their experiences so they can review them at the end of the year. If you are looking for a holiday gift to show your appreciation for someone you care about and want to let them know you are grateful to have them in your life, this is a perfect choice.",N/A,N/A,en
Let's Eat Italy!,['Franois-Rgis Gaudry'],2021-11-09,['Cooking'],"The ultimate book on every aspect of Italian food—inspiring, comprehensive, colorful, extensive, joyful, and downright encyclopedic.",N/A,N/A,en
Salt,['Pierre Laszlo'],2001,['Cooking'],"In the tradition of ""The Story of Corn"" and ""Uncommon Grounds"" comes a fascinating look at salt, a substance that is a necessity for the body, a treat for the tongue, and a commodity that shaped history. 10 halftones.",N/A,N/A,en
The Little Tea Book,['a Gray'],2013-04-07,['Cooking'],"The Little Tea Book Compiled By A. Gray After all, tea is the drink! Domestically and socially it is the beverage of the world. There may be those who will come forward with their figures to prove that other fruits of the soil--agriculturally and commercially--are more important. Perhaps they are right when quoting statistics. But what other product can compare with tea in the high regard in which it has always been held by writers whose standing in literature, and recognized good taste in other walks, cannot be questioned? A glance through this book will show that the spirit of the tea beverage is one of peace, comfort, and refinement. As these qualities are all associated with the ways of women, it is to them, therefore--the real rulers of the world--that tea owes its prestige and vogue. Further peeps through these pages prove this to be true; for nearly all the allusions and references to the beverage, by male writers, reveal the womanly influence that tea imparts. But this is not all. The side-lights of history, customs, manners, and modes of living which tea plays in the life of all nations will be found entertaining and instructive. Linked with the fine feminine atmosphere which pervades the drinking of the beverage everywhere, a leaf which can combine so much deserves, at least, a little human hearing for its long list of virtues; for its peaceful walks, talks, tales, tattle, frills, and fancies which go to make up this tribute to ""the cup that cheers but not inebriates.""",N/A,N/A,en
The Boston Cooking-School Cook Book,['Fannie Merritt Farmer'],2015-08-22,"['Cooking, American']","This work has been selected by scholars as being culturally important, and is part of the knowledge base of civilization as we know it. This work was reproduced from the original artifact, and remains as true to the original work as possible. Therefore, you will see the original copyright references, library stamps (as most of these works have been housed in our most important libraries around the world), and other notations in the work.This work is in the public domain in the United States of America, and possibly other nations. Within the United States, you may freely copy and distribute this work, as no entity (individual or corporate) has a copyright on the body of the work.As a reproduction of a historical artifact, this work may contain missing or blurred pages, poor pictures, errant marks, etc. Scholars believe, and we concur, that this work is important enough to be preserved, reproduced, and made generally available to the public. We appreciate your support of the preservation process, and thank you for being an important part of keeping this knowledge alive and relevant.",N/A,N/A,en
Food and Feast in Medieval England,['P. W. Hammond'],1995,['Cooking'],"Describes the extraordinary range of food which found its way on to the tables of medieval English society, its production and distribution.",N/A,N/A,en
