title,authors,publishedDate,categories,description,averageRating,textSnippet,language
The Dada Almanch,"['Richard Huelsenbeck', 'Malcolm Green']",1993,[],N/A,N/A,N/A,en
Proceedings of the 2nd International Conference on Interaction Sciences,"['Association for Computing Machinery', 'ACM Digital Library']",2009-11-24,['Computer security'],"ICIS 2009: The 2nd International Conference on Interaction Sciences: Information Technology, Culture and Human Nov 24, 2009-Nov 26, 2009 Seoul, Republic of Korea. You can view more information about this proceeding and all of ACMs other published conference proceedings from the ACM Digital Library: http://www.acm.org/dl.",N/A,N/A,en
Economic Well-being of the Elderly,"['Tine Stanovnik', 'Nada Stropnik']",2000,['Business & Economics'],"Providing an in-depth analysis of the economic well-being of the elderly in the UK, Austria, Hungary, Poland and Slovenia, this book offers an assessment of the performance of national social security systems in terms of income provision for the elderly. Each country analysis strictly adheres to a common methodological framework. This enables meaningful cross-country comparisons, revealing important common developments in the economic well-being of the elderly in all five countries. The authors also examine country-specific features, and every country chapter is written by an expert in the field who has a thorough knowledge of both the national pension systems and the data sets on which the empirical analyses are based.",N/A,N/A,en
Objectives and Design of Environmental Monitoring Programmes for Radioactive Contaminants,"['International Atomic Energy Agency', 'World Health Organization']",1975,['Business & Economics'],N/A,N/A,N/A,en
Education and Informatics Worldwide,['Jacques Hebenstreit'],1992,['Education'],"The micro computer has had a revolutionary impact on many aspects of society though its success has not been universal and unrestricted. This book looks at the current use of information technology in education and examines why the main objectives behind its introduction in this area have not been achieved. The various political, social and economic reasons behind the failure to maximize the use of informatics are examined on the one hand whilst, on the other, basic strategies and prescriptions are outlined for seizing the opportunities which will be presented by the availability of cheaper, more accessible technology in the future. One chapter describes in detail the situation in seven different regions, presenting the needs, possibilities, obstacles and prospects in each one. Finally, the book draws on the trends and issues that have emerged from previous experience in the planning and implementation of national policies to make proposals for improving the practices of international co-operation by using the full potential of informatics.",N/A,N/A,en
UbiComp 2016,[],N/A,[],N/A,N/A,N/A,en
Manual of Food Irradiation Dosimetry,['International Atomic Energy Agency'],1977,['Science'],"Abstract: A manual for food processing plant operators presents and discusses the basic problems relevant to the dosimetry of food irradiation, treating dosimetry in sufficient practical and theoretical detail to enable technical staff to make any requisite dosimetric measurements. The material is organized among 5 major areas: (1) the basics of dosimetry (measuring absorbed doses; the physical aspects of radiation absorption; dosimetry systems and guidelines); (2) characteristics of irradiators (design criteria; radiation source selection; specific irradiator designs; practical designs); (3) dose-distribution patterns in large-scale irradiators and dose-distribution measurements); (4) the control of irradiation processing conditions in plant operation; and (5) detailed protocols for using different dose-meter systems (including, specific standardized procedures, the calibration of spectrophotometers, and the characteristics of other possibly useful dosimetry systems). Numerous illustrations and expamples are presented throughout the manual, and literature references and an expanded glossary are appended. (wz.",N/A,N/A,en
Provenance and Annotation of Data,['Luc Moreau'],2006-09-27,['Business & Economics'],"This book constitutes the thoroughly referred post-proceedings of the International Provenance and Annotation Workshops, IPAW 2006, held in Chicago, Il, USA in May 2006. The 26 revised full papers presented together with two keynote papers were carefully selected for presentation during two rounds of reviewing and improvement. The papers are organized in topical sections.",N/A,N/A,en
Age Factors in Biometric Processing,['Michael Fairhurst'],2013-10-04,['Computers'],"Age Factors in Biometric Processing explores the implications of ageing on biometric technologies, and how such factors can be managed in practical situations.",N/A,N/A,en
Big Data,"['Nathan Marz', 'James Warren']",2015,['Computers'],"Summary Big Data teaches you to build big data systems using an architecture that takes advantage of clustered hardware along with new tools designed specifically to capture and analyze web-scale data. It describes a scalable, easy-to-understand approach to big data systems that can be built and run by a small team. Following a realistic example, this book guides readers through the theory of big data systems, how to implement them in practice, and how to deploy and operate them once they're built. Purchase of the print book includes a free eBook in PDF, Kindle, and ePub formats from Manning Publications. About the Book Web-scale applications like social networks, real-time analytics, or e-commerce sites deal with a lot of data, whose volume and velocity exceed the limits of traditional database systems. These applications require architectures built around clusters of machines to store and process data of any size, or speed. Fortunately, scale and simplicity are not mutually exclusive. Big Data teaches you to build big data systems using an architecture designed specifically to capture and analyze web-scale data. This book presents the Lambda Architecture, a scalable, easy-to-understand approach that can be built and run by a small team. You'll explore the theory of big data systems and how to implement them in practice. In addition to discovering a general framework for processing big data, you'll learn specific technologies like Hadoop, Storm, and NoSQL databases. This book requires no previous exposure to large-scale data analysis or NoSQL tools. Familiarity with traditional databases is helpful. What's Inside Introduction to big data systems Real-time processing of web-scale data Tools like Hadoop, Cassandra, and Storm Extensions to traditional database skills About the Authors Nathan Marz is the creator of Apache Storm and the originator of the Lambda Architecture for big data systems. James Warren is an analytics architect with a background in machine learning and scientific computing. Table of Contents A new paradigm for Big Data PART 1 BATCH LAYER Data model for Big Data Data model for Big Data: Illustration Data storage on the batch layer Data storage on the batch layer: Illustration Batch layer Batch layer: Illustration An example batch layer: Architecture and algorithms An example batch layer: Implementation PART 2 SERVING LAYER Serving layer Serving layer: Illustration PART 3 SPEED LAYER Realtime views Realtime views: Illustration Queuing and stream processing Queuing and stream processing: Illustration Micro-batch stream processing Micro-batch stream processing: Illustration Lambda Architecture in depth",N/A,N/A,en
"Health Services--Judaea & Samaria, Gaza & Sinai, 1967-1971",['Israel. Tseva haganah le-Yiśraʼel. Mifḳedet ezor Yehudah ṿeha-Shomron'],1972,['Data'],N/A,N/A,N/A,en
The Mathematical Field,['Vincent J. Hyde'],2023-03-06,[],"While writing this book, I felt intuitively that readers would want to know whether the Creator knew about the Mathematical Field. I have answered the question in one section of this book. Unfortunately, I do not know whether you will agree with me because as I mention in the book, human beings have free will. The book shows the beauty and purity of the Mathematical Field, particularly how the numbers follow specific rules to form different systems like Binary, Octal, Decimal, Duodecimal, and Hexadecimal, where they can have different place values. It is significant that the decimal system suits human beings and our design of 10 fingers and 10 toes for counting seems to be no accident. The rules of the decimal system allows the numbers to be easily added, subtracted, multiplied and divided. Even the higher functions of calculating square roots, cube roots, Sine, Cosine, Tan, logarithms, and exponentials can be easily calculated using a simple calculating machine. The numbers form sequences and series. The arithmetic and geometric series enable easy calculation of numbers using formulae. All the periodic functions like Sine, Cosine, Tan, and ex can be expressed as a series. The Algebraic Arm has shown us how lines and curves can be expressed as simple equations, which we can visualise on the Cartesian Plane in two dimensions. Through differentiation and integration, we can sketch curves and calculate areas and volumes. In the Geometric Arm, we can visualise the points forming lines and the lines forming different slopes and different angles. Geometry also shows the different formations the lines can take-three lines to form triangles, four lines to form quadrilaterals, five lines to form pentagons, and many other shapes with more lines. Geometry also shows the purity of the conic sections forming hyperbolas, ellipses, parabolas, and circles with specific equations and characteristics that enable them to be easily sketched. The manner in which the two foci of the ellipse can come together to form the beautiful circle with one centre and one radius is amazing. Although the Cartesian Plane is more of an algebraic way of showing points in terms of x and y coordinates from an origin of (0,0), the Geometric Arm has shown that points can be described geometrically, as a distance and an angle from an origin. Geometry has also shown us how points around a circle can be drawn as Sine and Cosine waves, which generate the numerous trigonometric identities. The Mathematical Field shows the importance of measurements, which has led to standardisation and mass production of goods and services. This has obviously made things easy for the large populations supported in the cities and towns all over the world. The Mathematical Field has also made it possible to draw and design objects before manufacture and construction; this eliminates errors and wastage. Numbers are essentially pure producing the same results when put in equations and formulae. Human beings and the Fields of Knowledge can produce uncertain results because of the free will issue. Mathematics allows for this in Probability Theory, a branch of Arithmetic Arm. The Sporting Field is full of probability associated with the results. If five horses are running in a race, there is only a certain probability that a particular horse will win. Also, if one tossed a coin, there is only a 50% chance of getting a head and a 50% chance of not getting a head. Probability Theory shows how to calculate the chances of certain events occurring. Finally, the Mathematical Field shows us how to sort the data accumulated in many of Fields of Knowledge to produce useful statistical data and generate formulae and applications in many other Fields of Knowledge, some of which will be considered in my next book.",N/A,N/A,en
Elementary Statistics,['Allan G. Bluman'],2009,['Statistics'],"ELEMENTARY STATISTICS: A STEP BY STEP APPROACH is for general beginning statistics courses with a basic algebra prerequisite. The book is non-theoretical, explaining concepts intuitively and teaching problem solving through worked examples and step-by-step instructions",N/A,N/A,en
Elementary Statistics A Step By Step Approach,['Allan G Bluman'],N/A,[],N/A,N/A,N/A,en
Become a SELECT Star!,['Julia Evans'],2023,[],N/A,N/A,N/A,en
Il contratto concluso mediante computer,['Francesco Parisi'],1987,['Law'],N/A,N/A,N/A,en
Data,"['Mikkel Holm Sørensen', 'Simon Bentholm']",N/A,[],"Om data, med fokus på hvorfor data bliver så afgørende for virksomheders værdiskabelse, hvori består mulighederne og hvor ligger udfordringerne",N/A,N/A,da
Klimatologische gegevens van Nederlandse stations,['[Anonymus AC02877219]'],1968,[],N/A,N/A,N/A,en
Computerization of Corrosion Data,['DB. Anderson'],1990,['Artificial intelligence'],"Computerization of the wealth of available corrosion data facilitates both data access and interpretation to address specific user needs. Data collection and compilation can be enhanced by adoption of format standards which define guidelines for common terminology, documentation of performance measurement for both metals and nonmetals, data output and presentation, and for assessing data quality. Well-defined programs, using a variety of established computerization techniques, can serve as effective tools for selection of corrosion resistant materials, assessing material limitations, selection and design of corrosion control methods, and for gaining a better understanding of the significance and theoretical considerations relating to operative corrosion mechanisms.",N/A,N/A,en
Attendance Checking System,['Hải Phong Phạm'],2010,['Data'],N/A,N/A,N/A,en
Report on the Fifth Four-Centre Meeting,['A. Lorenz'],1969,['Data'],N/A,N/A,N/A,en
Data Center 2.0,['Rien Dijkstra'],2014-06-09,[],"Data Center 2.0: The Sustainable Data Center is an in-depth look into the steps needed to transform modern-day data centers into sustainable entities. A sustainable data center should be environmentally viable, economically equitable, and socially bearable. Creating sustainable data centers is not a technical problem but an economic problem to be solved. This book takes a conceptual approach to the subject of data centers and sustainability. It offers at least multiple views and aspects on sustainable data centers to allow readers to gain a better understanding and provoke thoughts on how to create sustainable data centers. ""Data Center 2.0, is not so much about technology but about people, society and economic development. By helping readers understand that even if Data Centers, enabling the Digital economy, are contributing a lot to energy saving, they need to be sustainable themselves; Rien Dijkstra is on the right track. When explaining how to build sustainable Data Centers, through multi disciplinary approach, breaking the usual silos of the different expertise, Rien Dijkstra is proposing the change of behavior needed to build sustainable Data Centers. Definitely it is about people, not technology."" Paul-Francois Cattier Global Senior Vice-President Data Center - Schneider Electric “In Data Center 2.0 The Sustainable Data Center author Rien Dijkstra has gone several steps further in viewing the data center from the perspective of long term ownership and efficiency in combination with treating it as a system. It's an excellent read with many sections that could be extracted and utilized in their own right. I highly recommend this read for IT leaders who are struggling with the questions of whether to add capacity (co-locate, buy, build, or lease) or how to create a stronger organizational ownership model for existing data center capacity. The questions get more complex every year and the risks more serious for the business. The fact that you're making a business critical decision that must stand the test of technology and business change over 15 years is something you shouldn't take lightly.” Mark Thiele President and Founder Data Center Pulse “Data centers used to be buildings to house computer servers along with network and storage systems, a physical manifestation of the Digital Economy. Internet of Things, the digitization of about everything in and around us, brings many profound changes. A data center is the place where it all comes together. Physical and digital life, fueled by energy and IT, economical and social demands and needs and not to forget sustainability considerations. Sustainable data centers have a great potential to help society to optimize the use of resources and to eliminate or reduce wastes of capital, human labor and energy. A data center in that sense is much more than just a building for servers. It has become a new business model. Data center 2.0 is a remarkable book that describes the steps and phases to facilitate and achieve this paradigm.” John Post Managing Director - Foundation Green IT Amsterdam region",N/A,N/A,en
IERI Monograph Series on Issues and Methodologies in Large Scale Assessment,[],2009,[],N/A,N/A,N/A,en
Databases on safety issues for WWER and RBMK reactors,[],1996,[],N/A,N/A,N/A,en
Automating the Cadet Discipline Tracking System,['Douglas D. Shatto'],1998,['Data'],N/A,N/A,N/A,en
Neoprene in Bridge Bearing Pads--The Proven Performance,"['JS. Burpulis', 'RS. Graff', 'Seay, JR.']",1990,['Bearings'],"Elastomeric bearings have a long and successful record of performance supporting bridges, railroads, buildings, and heavy machinery. Bearings based on neoprene synthetic rubber have been in use in the United States since 1957. Today, millions of bearings based on neoprene support highway and railroad bridges throughout the world.",N/A,N/A,en
Description of Background Data in the Skb Database Geotab. Version 2,"['E. Eriksson', 'Stefan Sehlstedt']",1991,[],N/A,N/A,N/A,en
FLANGE II (version 71-1),"['H. C. Honeck', 'D. R. Finch']",1971,['Thermal neutrons'],N/A,N/A,N/A,en
The Risk of Death from Radiation-induced Cancer as Estimated from the Published Data on the Japanese Atomic Bomb Survivors,['S. G. Goss'],1974,['Atomic bomb'],N/A,N/A,N/A,en
Radioactive Waste Management Systems,[],1971,['Radioactive waste disposal'],N/A,N/A,N/A,en
Hoshasen Riyo Tokei. Statistics on the Use of Radiation in Japan,['Japan. Kagaku Gijutsucho. Genshiryoku Anzenkyoku. Nihon Aisotopu Kyokai. Japan. Kagaku Gijutsucho. Genshiryoku Anzenkyoku. Statistics on the use of radiation in Japan'],1976,['Asia'],N/A,N/A,N/A,en
Pulse Width Control of Sampled Data Systems,"['Winston L. Nelson', 'Columbia University. Department of Electrical Engineering']",1959,['Data'],N/A,N/A,N/A,en
List of INDSWG and INDC Documents,['International Atomic Energy Agency. Nuclear Data Section. International Nuclear Data Committee'],1967,['Bibliography'],N/A,N/A,N/A,en
Israel,"['Merkaz Ṭaʼub le-ḥeḳer ha-mediniyut ha-ḥevratit be-Yiśraʼel', 'American Jewish Joint Distribution Committee']",2005,[],N/A,N/A,N/A,en
The Data/C++ Programming Language,['Andrew J. Savige'],1995,['Data/C++ (Computer program language)'],N/A,N/A,N/A,en
Radioactivity Survey Data in Japan,[],2000,['Data'],N/A,N/A,N/A,en
A Compilation of S and P Wave Neutron Strength Function Data,['A. R. de L. Musgrove'],1973,['Neutron resonance'],N/A,N/A,N/A,en
Comparison of Severity of Exposure in ASTM E 119 and ISO 834 Fire Resistance Tests,"['T. Z. Harmathy', 'Mohammed A. H. Sultan', 'J. W. MacLaurin', 'Institute for Research in Construction (Canada)']",1987,['Building materials'],N/A,N/A,N/A,en
Theoretical Analysis of Some Problems which are Due to the Presence of Plutonium in Heterogeneous Thermal Reactors,['E.. Diana'],1963,[],N/A,N/A,N/A,en
DGPS-SCAPE Comparison,"['Canada. Transport Canada. Aviation Group', 'A. Taucer']",1993,['Data'],N/A,N/A,N/A,en
Data analysis skills,['Karen Johnston Miller'],2011,['Data'],N/A,N/A,N/A,en
Mexico,['Monica Tinajero'],2010,['Business development'],"Unlike social programs targeting individuals, few enterprise support programs have been rigorously evaluated, and existing evaluations have mostly been done in high-income countries such as the United States and Europe. Mexico spends a large share of government resources on small and medium enterprise programs each year. How effective these programs have been in achieving their objectives is unclear. In Mexico, impact evaluations of small and medium enterprise programs are rare, and most are qualitative in nature. This is the first paper evaluating these programs in Mexico using firm-level panel data. The continuous and ten-year panel data -- from the 1994-2005 period -- allow the authors to address selectivity bias and unobserved firm heterogeneity by applying a generalization of differences-in-differences models combined with propensity score matching methods. This study finds evidence that participation in small and medium enterprise programs is associated with improvements in key variables such as value added, gross production, and wages. Furthermore, the study finds evidence that some of the positive effects can take several years to realize. The results also call for streamlining and greater efficiency in Mexico's small and medium enterprise programs.",N/A,N/A,en
Obtaining Accurate Utilization and Fuel Use Data for Vehicle Maintenance Reporting Systems,"['Roger T. Nation', 'Society of Automotive Engineers']",1978,['Commercial vehicles'],N/A,N/A,N/A,en
A Microprocessor Controlled Recorder for Fatigue Load Measurements on Board of Long-term-test Vehicles,"['Charles Tscheuschner', 'G. Bossmann', 'J. Petersen', 'Society of Automotive Engineers']",1984,['Data'],N/A,N/A,N/A,en
Developing a Data Utilization System for Jewish Demographic Studies,"['Gary A. Tobin', 'Nancy Boguslaw']",1983,['Demographic surveys'],N/A,N/A,N/A,en
Convention/Conference Center Feasibility Study,['Aurora (Colo.)'],1997,['Convention facilities'],N/A,N/A,N/A,en
Report of a Consultants Meeting on Non-Neutron Nuclear Data,['International Atomic Energy Agency. Nuclear Data Section. International Nuclear Data Committee'],1971,['Data'],N/A,N/A,N/A,en
Scientific Program and Abstracts,"['CODATA. Israel National Committee', 'Moʻatsah ha-leʼumit le-meḥḳar ule-fituaḥ (Israel)']",1984,[],N/A,N/A,N/A,en
Documentation problems of large amounts of measured data,['Gerd K. Hartmann'],1979,[],N/A,N/A,N/A,de
"Status of the Energy-dependent Antineutrino-values for the Heavy Isotopes Z Greater Than Or Equal to 90 from Thermal to 15 MeV, and of the Antineutrino-values for Spontaneous Fission","['F. Manero', 'V.A. Konshin']",1972,['Californium 252'],N/A,N/A,N/A,en
Environmental Isotope Data,['International Atomic Energy Agency'],1973,['Deuterium'],N/A,N/A,N/A,en
Safety Attribute Model Validation Project,"['Vellapillil Gourisankar', 'Georgia Institute of Technology. Center for Information Technology Insertion. Project no. E-15-649']",1998,['Airplanes'],N/A,N/A,N/A,en
XSAMS,"['D. Humbert', 'B. J. Braams']",2010,['Atoms'],N/A,N/A,N/A,en
"Neutron Capture Cross Section Measurements of 109 Ag, 186W and 158Gd on Filtered Neutron Beams of 55 and 144 KeV",['Vuong Huu Tan'],2004,['Baryon reactions'],N/A,N/A,N/A,en
A Fission Cross Section of Pu241 from 0.01 EV to 3 KeV,['G.D. James'],1964,[],N/A,N/A,N/A,en
The Use of Ranked Versus Rated Data in the Evaluation of Weathered Specimens Or Material,['LB. Asher'],1996,['Analysis of variance'],"The evaluation of specimens after weathering (in natural outdoor exposures or accelerated cycles) can be handled by a number of approaches; two of these are ranking and rating. This paper will center on these two approaches and will demonstrate how ranking is often superior. Rating requires one to compare the specimens against a scale (ie. 1 through 10 with 1 being ""excellent"", 5 being ""good"" and 10 being ""poor"", etc.). Ranking on the other hand requires the direct comparison of the specimens against each other.",N/A,N/A,en
Fact Sheet,['Markaz al-Bahth wa-al-Takhtit al-Sihhi'],1994,[],N/A,N/A,N/A,en
Test Equipment for Accurate Determination of Time Relations and Its Use for the Measurement of the Timing Accuracy and the Calibration of Fast Photomultipliers,"['H. Meyer', 'H. Verelst']",1965,[],N/A,N/A,N/A,en
Mexico,['Monica Tinajero'],2010,['Business development'],"Abstract: Unlike social programs targeting individuals, few enterprise support programs have been rigorously evaluated, and existing evaluations have mostly been done in high-income countries such as the United States and Europe. Mexico spends a large share of government resources on small and medium enterprise programs each year. How effective these programs have been in achieving their objectives is unclear. In Mexico, impact evaluations of small and medium enterprise programs are rare, and most are qualitative in nature. This is the first paper evaluating these programs in Mexico using firm-level panel data. The continuous and ten-year panel data - from the 1994-2005 period - allow the authors to address selectivity bias and unobserved firm heterogeneity by applying a generalization of differences-in-differences models combined with propensity score matching methods. This study finds evidence that participation in small and medium enterprise programs is associated with improvements in key variables such as value added, gross production, and wages. Furthermore, the study finds evidence that some of the positive effects can take several years to realize. The results also call for streamlining and greater efficiency in Mexico's small and medium enterprise programs.",N/A,N/A,en
We Need Publishing Standards for Datasets and Data Tables,['Toby Green'],2003,['Data'],N/A,N/A,N/A,en
How VMRS Helps the Manufacturers,[],1978,[],N/A,N/A,N/A,en
Data Retrieval Device Using Near Field Communication,['Nur Farezan Mohammed Suhaimi'],2016,['Data'],N/A,N/A,N/A,en
"Testing of ENDF/B Thermos Cross Sections for H2O, D2O, C, ZrH2, (C2H4)x, Be, BeO, C6H6, and UO2","['F. J. McCrosson', 'D. R. Finch', 'E. C. Olson']",1971,['Thermal neutrons'],N/A,N/A,N/A,en
