title,authors,publishedDate,categories,description,averageRating,textSnippet,language
Stress-Rupture Data Correlation with Generalized Regression Analysis,['DR. Rummler'],1977,['Creep rupture strength'],"The applicability of multiple regression analysis techniques to stress-rupture data correlation has been investigated. A generalized interacting variable (GIVAR) method of data correlation is proposed and evaluated. The GIVAR method is compared to 6 parametric methods of data correlation on 20 sets of data. In all cases, the GIVAR method provided the best data correlation. Application of prediction intervals is discussed. The applicability of correlating variables, such as tensile strength and elastic modulus, in addition to temperature and stress, is also discussed.",N/A,N/A,en
Survey of Current and Future Needs for Charged Particle and Photonuclear Reaction Data,['A. Calamand'],1974,['Charged particles'],N/A,N/A,N/A,en
Some Procedures for the Analysis of Ordered Categorical Data with Regard to Factorial Experiments,['Shabani Saidi Kiwanga'],1990,['Data'],N/A,N/A,N/A,en
Improving Biometric and Forensic Technology,['Melissa K. Taylor'],2017,['Biometrics'],"On January 26th and 27th, 2015, the National Institute of Standards and Technology (NIST), in collaboration with the National Institute of Justice (NIJ), held a workshop entitled: Improving Biometric and Forensic Technology: The Future of Research Datasets at NIST's campus in Gaithersburg, Maryland. This document summarizes the discussions and conclusions of the workshop, including feedback obtained from workshop participants during panel discussions.",N/A,N/A,en
Software Requirements Specification to Distribute Manufacturing Data,['Thomas Hedberg Jr.'],2017,['Computer networks'],"The purpose of this document is to describe the requirements specifications for applications and a data repository to distribute manufacturing data. Prospective developers, technical-assessment personnel, and interested end-users are the intended audience of this document.",N/A,N/A,en
Radioactivity Survey Data in Japan,[],2000,['Radioactivity'],N/A,N/A,N/A,en
Cement-based Radioactive Waste Hosts Formed Under Elevated Temperatures and Pressures (FUETAP Concretes) for Savannah River Plant High-level Defense Waste,[],1983,[],N/A,N/A,N/A,en
Artificial Intelligence and Machine Learning for Business,['Scott Chesterton'],2019-07-19,[],"**Buy the paperback version of this book and get the kindle book version for FREE** Are you thinking about implementing artificial intelligence and machine learning in your business but you have no concrete idea how to do so? Artificial Intelligence and the field of Machine learning are growing exponentially, and with the help of this book, there are endless possibilities of what you will be able to do with them! This guidebook is going to take a closer look at how Artificial Intelligence and Machine Learning are able to work for businesses, as well as how you can use some of the tips and techniques that come with these processes for your own needs. Some of the topics that we will explore when we go through this book will include: The basics of Artificial Intelligence (AI) and Machine Learning (ML); How to be prepared for the challenges to face when using Artificial Intelligence and Machine Learning; How ML can enhance the competitiveness of any business; A step-by-step method to develop AI and ML Projects and to build an enterprise's strategy; If you want to find out how to boost your business with the new technologies, scroll up to the page and push the BUY now button.",N/A,N/A,en
Hurricane Floyd Flood Mapping Integrating Landsat 7 TM Satellite Imagery and DEM Data,"['Jeffrey D. Colby', 'Young Wang', 'Karen Mulcahy']",2000,['Data'],N/A,N/A,N/A,en
Fallout,['Roger Cross'],2001,['Biography & Autobiography'],The strange but true story of a celebrated Australian scientist's involvement in the 1956 British atomic bomb tests.,N/A,N/A,en
Emergency Data Handbook,"['N. P. McColl', 'S. L. Prosser']",2002,['Environmental engineering'],N/A,N/A,N/A,en
Radioactive waste management profiles,['International Atomic Energy Agency'],1991,['Data'],N/A,N/A,N/A,en
IAEA Panel on Fission Product Nuclear Data,['M. Lammer'],1975,[],N/A,N/A,N/A,en
Scientific Program and Abstracts,[],1986,['Data'],N/A,N/A,N/A,en
Collection of USSR Reports on Nuclear Data Topics,['International Atomic Energy Agency. Nuclear Data Section. International Nuclear Data Committee'],1971,['Atoms'],N/A,N/A,N/A,en
The Elderly Population with Chronic Functional Disability: Implications for Home Care Eligibilty,['United States. Department of State'],1990,['Analytical Methods'],N/A,N/A,N/A,en
Generically Based Data Needs and Priorities for Pavement Management,['R. Haas'],1991,['Data'],"The foundation for pavement management is reliable and sufficient data. It is required to quantify present and future status, to identify needs and to provide the basis for priority programming of maintenance and rehabilitation. The role of data in a generically based pavement management framework is to provide the factual basis for activities models, methods and procedures, and for making decisions, at both the network and project levels. In order to develop a strategy and priorities for what data should be acquired and how often for any particular situation requires consideration of such factors as type and class of facility, characteristics of the agency, intended uses of the data, costs and the accuracy needed. Sets of priority guidelines for highway, airport and other area pavements, using these factors and for average or representative conditions, have been developed.",N/A,N/A,en
Old Data for New Research,"['William M. Mason', 'Karl E. Taeuber', 'Halliman H. Winsborough']",1977,['Demography'],N/A,N/A,N/A,en
Implementation Strategy for Data Assimilation Into AWRAv0.5,[],2012,['Data'],N/A,N/A,N/A,en
IPC for Modular Software Requires a Third Party Connect,"['Stuart Arthur Friedberg', 'ROCHESTER UNIV NY DEPT OF COMPUTER SCIENCE.']",1987,['Data'],"Reconfiguration, on-line maintenance, load balancing, and similar operations on complex software require (among other things) dynamic binding of communicating peers, so that modules can be installed and removed in a frame-work of other functional modules. A binding may take the form of TCP/IP protocol connection, remote procedure call server location, shared memory address resolution, or object handle resolution, depending on the underlying communication mechanism. However, the need for abstraction and modularity is independent of the particular IPC mechanism(s) being used. A module should not need to know how it is used (specifically, how it is bound together with other modules to implement a more complex function). Therefore, the bindings between two modules A and B should in general be created and destroyed by a third module C. We call this facility a third party connect. The module C should not have to have any particular relationship (other than authentication) to modules A and B in order to dynamically connect and disconnect them. In particular, it should not have to be one of A and B, be a common ancestor of them, or have an existing binding to them. Similarly, neither A nor B should have to take an active part in establishing or tearing down bindings.",N/A,N/A,en
Papers Presented at the Consultants' Meeting on Charged Particle and Photonuclear Reaction Data,['International Atomic Energy Agency. Nuclear Data Section. International Nuclear Data Committee'],1974,['Charged particles'],N/A,N/A,N/A,en
Consolidated Progress Report for ... on Nuclear Data Activities Outside the NDS Service Area,['International Atomic Energy Agency. Nuclear Data Section. International Nuclear Data Committee'],1972,['Data'],N/A,N/A,N/A,en
The Women's Health Data Book,"[""Jacobs Institute of Women's Health""]",1995,['Data'],N/A,N/A,N/A,en
The Language of Panel Data and Lacunae in Communication about Panel Data,['Martin Heidenhain David'],1985,['Social surveys'],N/A,N/A,N/A,en
A Note on Correlated Measurement Error in Wife-husband Data,"['Elizabeth Jean Thomson', 'Richard A. Williams']",1983,['Social sciences'],N/A,N/A,N/A,en
The Use of SGML for Retrieval of Chemical Data,"['KT. Barry', 'PL. Kienlen', 'JD. Mason', 'RA. Strehlow', 'TO. Tallant']",1994,['Chemistry'],"The encoding of information within a document using Standard Generalized Markup Language (SGML) permits a novel approach to direct retrieval of data from documents. Although SGML is designed primarily for electronic interchange of texts, its features have been found to be useful in the management of data contained within a document. Encoding can include scientific and technical information, as well as associated and ancillary data, management data, and other metadata. This paper describes and gives examples of the use of the technique with special reference to chemical data. Examples of tags used in documents are shown. Retrieval of contained information is conventionally done by means of searches to retrieve a set of documents that have a probability of containing the desired information. The method described here uses a radically different approach to the information retrieval problem.",N/A,N/A,en
VMRS,"['J. E. Paquette', 'Society of Automotive Engineers']",1978,['Data'],N/A,N/A,N/A,en
"The Status of Hospital Discharge Data in Denmark, Scotland, West Germany and the United States",['Lola Jean Kozak'],1981,['Cross-cultural studies'],N/A,N/A,N/A,en
Uniform Ambulatory Medical Care,[],1981,['Ambulatory medical care'],N/A,N/A,N/A,en
The Role of Brain Drain on Africa's Development,['Oluwatosin Emmanuel Folowosele'],2021,['African studies'],"This economic literature research emerged as evidence on the impact of Brain Drain (Skilled Workers) as a critical role in developing countries. In this paper, we tested emigration panel data estimations for a sample of all Sub-Saharan African countries. Our empirical strategy plan employs the Fixed Effect and Random Effect regression analysis techniques on a unique model. We utilized a dataset of 43 Sub-Saharan African countries between 2004-2015. We show that economic down in most African countries is likely to cause increases in Brain Drain turnover in the region. Additionally, our panel data tested the wide range of diminishing returns and the prediction model of emigration rates in this region. The estimated cross-region findings in this region of the combined effects increase on Brain Drain have caused a frequency of prone economies. However, the main cause for the present poverty in the region is due to poor African political specifications.",N/A,N/A,en
Issues Regarding Confidentiality of Data in the Cooperative Health Statistics Systems,['National Center for Health Statistics (U.S.)'],1980,[],N/A,N/A,N/A,en
Use of Abstraction in Creating Data Dictionaries for Materials Data Banks,['PM. Sargent'],1991,['Abstraction'],"Construction of all databases requires an underlying ""data model,"" either implicit or explicit. The different options for data models for materials property data are an appropriate subject for standardization because they require agreed specifications for the formats of catalogs, data dictionaries, or thesauri. An understanding of these underlying data models is also crucial in deriving useful and flexible data interchange formats. This paper shows that a ""layered"" approach in constructing data dictionaries can be helpful both in setting up databases and in defining interchange formats.",N/A,N/A,en
Pollution Prevention Act of 1990,['United States. Congress. Senate. Committee on Environment and Public Works'],1990,['Environmental law'],N/A,N/A,N/A,en
U.S. Censuses of Population and Housing : 1960,['United States. Bureau of the Census. Population Division'],1962,['Housing'],N/A,N/A,N/A,en
Data Measures that Characterise Classification Problems,['Christiaan Maarten Van der Walt'],2005,[],"We have a wide-range of classifiers today that are employed in numerous applications, from credit scoring to speech-processing, with great technical and commercial success. No classifier, however, exists that will outperform all other classifiers on all classification tasks, and the process of classifier selection is still mainly one of trial and error. The optimal classifier for a classification task is determined by the characteristics of the data set employed: understanding the relationship between data characteristics and the performance of classifiers is therefore crucial to the process of classifier selection. Empirical and theoretical approaches have been employed in the literature to define this relationship. None of these approaches have, however, been very successful in accurately predicting or explaining classifier performance on real-world data. We use theoretical properties of classifiers to identify data characteristics that influence classifier performance: these data properties guide us in the development of measures that describe the relationship between data characteristics and classifier performance. We employ these data measures on real-world and artificial data to construct a meta-classification system. We use theoretical properties of classifiers to identify data characteristics that influence classifier performance: these data properties guide us in the development of measures that describe the relationship between data characteristics and classifier performance. We employ these data measures on real-world and artificial data to construct a meta-classification system. The purpose of this meta-classifier is two-fold: (1) to predict the classification performance of real-world classification tasks, and (2) to explain these predictions in order to gain insight into the properties of real-world data. We show that these data measures can be employed successfully to predict the classification performance of real-world data sets: these predictions are accurate in some instances but there is still unpredictable behaviour in other instances. We illustrate that these data measures can give valuable insight into the properties and data structures of real-world data: these insights are extremely valuable for high-dimensional classification problems.",N/A,N/A,en
Eureka Math - a Story of Units,['Great Minds'],2021-03-15,['Addition'],"Eureka helps students to truly understand math, connect it to the real world, and prepare them to solve problems they haven't encountered before. The team of teachers and mathematicians who created Eureka Math believe that it is not enough for students to know the process for solving a problem; they need to know why that process works. Eureka presents math as a story, one that develops from grades PK through 12. In A Story of Functions, our high school curriculum, this sequencing has joined with the methods of instruction that have been proven to work, in this nation and abroad.",N/A,N/A,en
Health Promotion Data for the 1990 Objectives,"['Owen T. Thornberry', 'Ronald W. Wilson', 'Patricia M. Golden']",1986,['Health surveys'],N/A,N/A,N/A,en
Reporting and Evaluating Stress Corrosion Data,['D. O. Sprowls'],1967,['Aluminum alloys'],"Susceptibility of a metal to stress corrosion implies a greater deterioration of its mechanical properties through the simultaneous action of a static stress and exposure to a corrosive environment than would be produced by the combined effects of each factor operating separately. In recent years this point of view on stress corrosion and stress corrosion cracking (the ultimate in stress corrosion) has become widely recognized. However, confusion still exists, with the result that some work is published that has little value because of the poor design of testing procedure. It is still sometimes erroneously assumed that failure of a specimen under stress corrosion test conditions suffices to demonstrate susceptibility to stress corrosion cracking. This conclusion is unjustified, for the specimen may have become so weakened by corrosion, even without any acceleration by stress, as to fail under the applied load. Thus, it is most essential to select techniques (type of specimen and method of loading, test medium and period of exposure) that produce failure that is purely the result of stress corrosion cracking. Because of the marked effect that test procedure can have upon ordinary criteria, such as specimen life, percentage of specimen survival, threshold stress, etc., investigators should report details of procedure and technique as well as detailed data along with their analysis of the results. This is necessary to enable the reviewer to adapt the information to his need and to make possible a reanalysis of the data by some method that may be developed in the future.",N/A,N/A,en
Environment Canada,['Canada. Inland Waters Directorate. Water Planning and Management Branch'],1984,['Data'],N/A,N/A,N/A,en
Fertility and Family Surveys in Countries of the ECE Region,"['United Nations. Economic Commission for Europe', 'United Nations Population Fund']",1999,['Medical'],"Unlike previous Population and Family Study Centre assessments of fertility and family formation, this survey of the Brussels capital and Flemish regions interviewed both women and men. Includes graphs and 36 tables on selected economic, social, and cultural indicators. Lacks an index. Annotation copyrighted by Book News, Inc., Portland, OR.",N/A,N/A,en
A Digital-analog Controller for Sampled Data Systems,"['Stephen C. Bigelow', 'Columbia University. Department of Electrical Engineering']",1959,['Data'],N/A,N/A,N/A,en
Identifying New Faculty and Administrator Orientation Needs in a Community College Setting,['Janet Crawley'],1998,['Research'],N/A,N/A,N/A,en
Medicare Drug Discount Card Program,['Keith D. Lind'],2004,['Medicare'],N/A,N/A,N/A,en
An Approach to Laboratory Data Management,['TW. May'],1988,['Application program'],"A programmable data base, capable of generating complex application programs with management personnel, was investigated in order to facilitate the documentation requirements of Good Laboratory Practice Standards (GLPS). Emphasis was placed on developing a system that would be adaptable at the small independent laboratory level, that is, one that was limited in funds available for computerization and without high-level programming expertise. A successful system was developed around an enhanced IBM PC (XT) with the following software: the Sensible Solution relational data base, Volkswriter 3.0 word processor, and the Labcode-QC statistical quality control system. Application programs were developed as part of a total sample and data tracking system that featured distinct data categories: laboratory/field collection preparation methods or both; sample batch history; sample inventory listing; laboratory homogenization methods; chemical preparation methods; instrumental methods; final reports and other documents; current sample status; chemical, stock, and standard catalogue; control material catalogue; instrument service log; instrument/equipment calibration; personnel monthly time tracking. The system was developed easily without the expertise of experienced programmers and can be modified readily when needed.",N/A,N/A,en
Nuclear Data for Thermonuclear Reactors,[],1970,[],N/A,N/A,N/A,en
South African Child Gauge 2007/2008,"['Paula Proudlock', ""University of Cape Town. Children's Institute""]",2008,['Child care'],N/A,N/A,N/A,en
"The Key Role of Monitoring in Controlling the Construction of the New Jubilee Line Between Waterloo and Westminster, London",['NH. Osborne'],1999,['Data'],"Crucial to the success of Contract 102 of the Jubilee Line Extension Project (JLEP) was the detailed analysis of the impact of the construction process on the surrounding ground, structures and tunnels under construction. The construction works were to pass under or alongside some of London's most historic and prestigious buildings, consequently stringent limits were imposed upon ground and structure movements. To control these movements and remain within the limits set, a comprehensive monitoring system was required, comprising a wide variety of instruments linked to a geotechnical database. An extensive and integrated instrumentation system was designed to produce quality data and as no monitoring system existed that covered the unique requirements of the contract and of the Balfour Beatty Amec Joint Venture (BBA), the option was taken by BBA to design and develop a system in house.",N/A,N/A,en
"Nuclear Reactors Built, Being Built, Or Planned in the United States",['United States. Department of Energy. Technical Information Center'],1980,['Capacity'],N/A,N/A,N/A,en
Nail to Nail Fingerprint Challenge,['Gregory Fiumara'],2018,['Acquisition'],"In September 2017, the Intelligence Advanced Research Projects Activity held a fingerprint data collection as part of the Nail to Nail Fingerprint Challenge. Participating Challengers deployed devices designed to collect an image of the full nail to nail surface area of a fingerprint - equivalent to a rolled fingerprint - from an unacclimated user without assistance from a trained device operator. Images captured from these devices were searched against a set of traditionally- captured operator-assisted rolled fingerprints. Thousands of latent fingerprints were also searched against the images.",N/A,N/A,en
The Comparability of Treatment and Control Groups at Randomization,"['Randall S. Brown', 'Margaret Harrigan', 'Mathematica Policy Research, Inc']",1983,[],N/A,N/A,N/A,en
Data,['Rampai Suksawasdi Na Ayuthaya'],1980,['Data'],N/A,N/A,N/A,en
The UK's Share of World Research Output,['Research Information Network (Organization)'],2009,['Bibliometrics'],N/A,N/A,N/A,en
Public Law: Pollution Prevention Act of 1990,[],1990,['Air quality management'],N/A,N/A,N/A,en
American National Standard,['American National Standards Institute'],2001,['Data'],N/A,N/A,N/A,en
The American Community Survey and Enhanced Community-level Social Vulnerability Assessment,"['John Boos', 'Lee Rivers Mobley', 'Gale Boyd', 'William Wheaton']",2009,['Data'],N/A,N/A,N/A,en
Dine data på nettet,"['Ulla Jarulf Kjærgaard', 'Marianne Edler von Eyben']",2021,[],N/A,N/A,N/A,da
Surveillance de la contamination radioactive de l'environnement,['International Atomic Energy Agency. World Health Organization'],1975,['Contamination'],N/A,N/A,N/A,fr
