title,authors,publishedDate,categories,description,averageRating,textSnippet,language
Serious Training for Endurance Athletes,"['Rob Sleamaker', 'Ray Browning']",1996,['Health & Fitness'],"SERIOUS Training for Endurance Athletes provides the tools to create training programs and workouts that will pay off in competition. Endurance athletes, coaches, and multisport fitness buffs will learn how to design, schedule, execute, and monitor training programs for top results. Rob Sleamaker joins with Ray Browning, seven-time Ironman Triathlon winner, to produce a much improved version of the highly popular earlier edition. You'll learn to: - set up and manage your personalized training schedule; - use the S-E-R-I-O-U-S system of training--Speed, Endurance, Race-pace, Intervals, Overdistance, Up-hill Intervals, Strength; - add variety to your workouts; - develop a winning nutritional program; - prepare mentally for races; and - stay motivated to train and win. The authors share their expertise in a fun and informative way, drawing from their own experiences as champions. Plus, the book features the latest training advice for running, cycling, mountain biking, swimming, rowing, cross-country skiing, cross training, duathlons, and triathlons. SERIOUS Training for Endurance Athletes is your guide to high-level fitness and performance.",4.5,N/A,en
Advanced Personal Training,"['Paul Hough', 'Brad J. Schoenfeld']",2021-11-14,['Medical'],"Effective fitness instruction and training programme design require an exercise specialist trainer to combine professional experience with strategies underpinned by scientific evidence. This book allows readers to develop their understanding of the scientific rationale behind important components of personal training, such as monitoring fitness and training programme design. Each chapter synthesizes the findings of cutting-edge scientific research to identify optimum training methods and dispel some myths that are prevalent in the fitness industry. The chapters within this new edition have been written by internationally renowned experts from several disciplines, including strength and conditioning, physiology, psychology, and nutrition. Contributions have also been made from esteemed academics who have conducted some of the scientific studies discussed within the book. The authors have interpreted and summarised the scientific evidence and produced evidence-based recommendations, allowing readers to explore the latest concepts and research findings and apply them in practice. The book includes several new chapters, such as evidenced based practice (EBP), and designing training programmes female clients. This second edition remains the essential text for fitness instructors, personal trainers and sport and exercise students. The book provides an invaluable resource for fitness courses, exercise science degree programmes and continued professional development for exercise professionals.",N/A,N/A,en
Physical Activity and Health,[],N/A,['Fitness'],N/A,N/A,N/A,en
The Body in Motion,[],1988,['Health & Fitness'],"Discusses how your body moves, the mechanics of grace, and includes exercises that will not only make your everyday motions more graceful but will also improve your athletic performance by making your movements more accurate and confident, enhancing agility and coordination. Includes recipes for breakfast, lunch, dinner, desserts, snacks and beverages that combine foods that are naturally rich in potassium and low in sodium.",N/A,N/A,en
Group Fitness Instructor Manual,[],2000,['Exercise'],"A handbook for today's fitness instructor. Group fitness instructors may be expected to offer participants a wide range of activities, such as indoor cycling, yoga and strength training, as well as aerobics. The contributors to this book are experts in a variety of fields, including exercise physiology, psychology and the law. The manual offers the foundation of knowledge necessary to teach fitness in a group setting. Topics covered include: exercise physiology; fundamentals of anatomy and applied kinesiology; nutrition; health screening; designing a group exercise programme; teaching the class; adherence and motivation; disabilities and health limitations; exercise and pregnancy; injury prevention and emergency procedures; and legal and professional responsibilities.",N/A,N/A,en
Walking for Fitness,['Nina Barough'],2003,['Fitness'],"Explains how readers can obtain maximum fitness results at their own pace and in their own time, demonstrating how to use walking to tone the body, strengthen bones and muscles, lose weight, and enhance overall fitness and quality of life.",N/A,N/A,en
Lauren Conrad Beauty,['Lauren Conrad'],2012-10-16,['Health & Fitness'],"""A beauty guide with tips on hair, makeup and beauty in general by celebrity Lauren Conrad""--",N/A,N/A,en
Physical Activity and Health,"['Claude Bouchard', 'Steven N. Blair', 'William L. Haskell']",2012,['Exercise'],"The human body is designed for activity. For most of our history, physical activity was required for survival, but technological advances have eliminated much of the need for hard physical labor. As our activity levels have dropped, it has become clear that a physically inactive lifestyle can lead to a host of health problems. Physical Activity and Health, Second Edition, provides a comprehensive treatment of the research on the benefits of a physically active lifestyle in comparison with the harmful consequences of physical inactivity. Written by leading scientists from the United States, Canada, Europe, and Australia, Physical Activity and Health, Second Edition, brings together the results of the most important studies on the relationship between physical activity, sedentarism, and various health outcomes. The second edition has been fully updated based on the latest advances in this rapidly changing field and expanded to include the following new content: A chapter on the physiology of inactivity and the effects of sedentary behavior even in people who engage in appropriate amounts of physical activity, which is an area of growing interest; More extensive coverage of physical activity, aging, and the brain, including a new chapter on the relationship between physical activity and brain structures and functions; A chapter on the development of national and international physical activity and health guidelines, which will help readers better understand how scientific findings are converted into practical recommendations. Physical Activity and Health, Second Edition, offers a detailed yet concise presentation of key concepts as well as a framework to help readers relate results from single studies or collections of studies to the overall paradigm linking physical activity and physical fitness to health. For each of the topics covered, the text provides an overview of the most important research findings, discusses the limitations of the current knowledge base, and identifies directions for future investigation. At the core of the text is a review of our current understanding of how physical activity affects health concerns such as cardiovascular disease, diabetes, cancer, and obesity as well as aging and mental health. The text identifies sedentary living habits and poor fitness as major public health problems and examines the potential of physical activity to prevent disease and enhance quality of life. This complete resource also looks at the evolution of the field of physical activity and health; variations in physical activity levels across age, sex, and ethnic groups; the body's physiological responses to physical activity; dose-response issues; and the influence of genetics on physical activity, fitness, and health. The book ends with an integration of the issues covered and discusses new opportunities for research. The second edition of Physical Activity and Health continues to offer clear, user-friendly coverage of the most important concepts and research in the field. Numerous special features will aid readers in their comprehension of the material. Chapter outlines and callout boxes help readers key in on important topics and focus their reading, and chapter summaries, definitions of key terms, and study questions provide tools for review and self-testing. Where other books have simply promoted physical activity for the individual or a population, Physical Activity and Health, Second Edition, completely integrates current knowledge of the relationship between physical activity and health. With contributions from some of the finest scientists in the field, this comprehensive text offers information unmatched in accuracy and reliability.",N/A,N/A,en
Perfectly Imperfect,['Baron Baptiste'],2016,['Health & Fitness'],"A little over a decade ago, Baron Baptiste published his seminal book, 'Journey into Power.' The first of its kind, it introduced the world to Baptiste Power Vinyasa, his signature method that marries a lifetime of studying with some of the world's most renowned yoga masters with his uniquely powerful approach to inner and outer transformation. Since then, yoga has steadily moved into the mainstream in our culture, and Baron's unique contribution has played a key role. As millions of participants incorporate yoga into their daily lives, Baron's teachings have evolved to bring them even deeper into their own transformative possibilities. This book takes readers beyond the foundations of the practice by speaking to everything that happens in their bodies and minds after they get into a yoga pose.",N/A,N/A,en
Survival Fitness,"['Sam Fury', 'Shumona Mallick']",2013-05-05,['Sports & Recreation'],"Discover How To Train Yourself in the 6 Most Useful Physical Activities in Terms of Escape/Survival and Increasing General Fitness. 3+ books in 1 makes Survival Fitness the only physical training book you will ever need! Survival Fitness contains all the information from; Learn Parkour by Sam Fury Basic Swimming by Sam Fury Basic Rock Climbing by Sam Fury And adds to it… Basic riding skills Professional techniques to improve your running speed Hiking techniques to ensure you can safely cover long distances on foot if needed It also includes a special strength, stretch, warm-up and cool down routine which has been specifically designed as a quick workout to increase cardiovascular fitness, whole body strength, flexibility, explosiveness, co-ordination and balance. This routine requires no special equipment and relies only on your own bodyweight. You'll also gain exclusive access to bonus materials that cannot be found anywhere else; Access to Instructional Videos Common Training Injuries Report Calming the Mind Report Get your copy of Survival Fitness today!",N/A,N/A,en
Physical Activity and Health,[],N/A,['Fitness'],N/A,N/A,N/A,en
Move Well Age Well,['Alyssa Kuhn'],2020-03-22,[],"When you think about getting older, how does it make you feel? Are you happy, fearful, motivated, or trying to avoid it at all costs? Getting older is inevitable for us all, so why not choose to embrace it? Aging doesn't have to mean hospitalizations, pain, weakness, and falls. These are not only manageable but also preventable. In order to ensure we are living our best lives into the later years we have to take action!This book is designed to give you the key steps towards achieving success with mindset, memory, exercise, osteoarthritis, and balance. These are all common things that can be affected by increasing age but you don't have to let them hold you back from doing the things you love! It is never too late to pursue your goals and to find a new purpose for yourself. There are so many successful entrepreneurs, authors, models, and fashion designers who began their careers after 60! Getting older is not about giving up. It's about starting to create a new path in your life with so many possibilities along the way! If we can give our bodies and minds the fuel they need, we can set ourselves up for the happiest years yet. Let's dive in to find out how you can keep your adventure alive, no matter your age!",N/A,N/A,en
Fitness for Women,['Karen Liptak'],1990,['Health & Fitness'],The exercises and hints in this book will help women get into shape and look and feel their best. Photos and illustrations.,3,N/A,en
Healthy You!,['Cass Hollander'],2015-01-01,['Juvenile Nonfiction'],"Keeping fit isn't just for grown-ups. You need to keep fit too. Healthy You! includes great ideas for how to take time out of each day for fitness and exercise so you can grow up strong and healthy. You will also learn about healthful eating habits. As you read and learn about many different ways to stay healthy, you'll practice some key phonics skills too.",N/A,N/A,en
The Body in Motion,['Time-Life Books'],1989,['Exercise'],Mechanics of grace - Finding your centre - Tumbling - Partner exercise - Potassium and mscrominerals.,N/A,N/A,en
Health & Fitness Excellence,['Robert K. Cooper'],1989,['Health & Fitness'],"A comprehensive, vital and practical program of health and fitness for those who want to achieve their unlimited potential.",2,N/A,en
Ten Minute Workouts,['Chrissie Gallagher-Mundy'],2003,['Health & Fitness'],Simple but highly effective strategies for fighting the flab and toning the muscles of your body.,N/A,N/A,en
BTEC National Sport,['Ray Barker'],2004,['Sports & Recreation'],"For the BTEC Sports Development and Fitness National qualification. As a companion to the core textbook, it covers six of the most popular option units. Additional features such as real-life case studies and discussion points help bring your learning to life.",N/A,N/A,en
The Art of Resilience,['Ross Edgley'],2020-05-28,['Biography & Autobiography'],"'Incredible individual, incredible book, incredible story.' CHRIS HEMSWORTH 'A hero who is as humble as he is resilient... testament to a ""never give up"" spirit!' BEAR GRYLLS 'From reading this book, the message that comes shining through is this: you can achieve anything.' ANT MIDDLETON Bestselling author and award-winning adventurer Ross Edgley has been studying the art of resilience for years, applying all he has learned to become the first person in history to swim around Great Britain, breaking multiple world records. Now Ross focuses on mental strength, stoicism and the training needed to create an unbreakable body. Ross Edgley famously ran a marathon pulling a 1.4-tonne car and climbed a rope the height of Everest (8,848m), after living with Yamabushi warrior monks in Japan and partaking in Shamanic pain rituals with fire ants in the Amazon jungle. On his epic 1,780-mile journey around Great Britain, which lasted 157 days, Ross swam through giant jellyfish, arctic storms, 'haunted' whirlpools and polluted shipping lanes, going so hard, and so fast, his tongue fell apart. Ross's previous book, The World's Fittest Book, was a Sunday Times bestseller and explored the science of physical fitness. Now, in The Art of Resilience, Ross uses his swim experience and other amazing endurance feats, where he managed to overcome seemingly insurmountable pain, hardship and adversity, to study the performance of extreme athletes, military and fitness specialists and psychologists to uncover the secrets of mental fitness and explore the concept of resilience, persistence, valour and a disciplined mindset in overcoming adversity. This ground-breaking book represents a paradigm shift in what we thought the human body and mind were capable of and will give you a blueprint to become a tougher, more resilient and ultimately better human - whatever the challenge you face.",N/A,N/A,en
Be Your Own Beautician,['Aroona Reejhsinghani'],2006-01-01,['Health & Fitness'],Includes: Choosing the right jewellery; Learn to be presentable; Beauty is not just skin deep; Does not of beauty care; Your complete guide to make-up; The art of applying makeup correctly; Skin disorders and physical defects and how to improve them; Be your own beautician.,N/A,N/A,en
The Alexander Technique Workbook,['Richard Brennan'],1992,['Alexander technique'],A simple method of learning to be more aware of how we move and the posture we should maintain. Step-by step guide with a series of simple exercises and procedures.,N/A,N/A,en
Find Your Path,['Carrie Underwood'],2020,['BIOGRAPHY & AUTOBIOGRAPHY'],"NEW YORK TIMES BESTSELLER I want to be healthy and fit 52 weeks of the year, but that doesn't mean I have to be perfect every day. This philosophy is a year-round common-sense approach to health and fitness that involves doing your best most of the time--and by that I don't mean being naughty for three days and good for four. I mean doing your absolute best most of the time during every week, 52 weeks of the year.--Carrie Underwood Carrie Underwood believes that fitness is a lifelong journey. She wasn't born with the toned arms and strong legs that fans know her for. Like all of us, she has to work hard every day to look the way that she does! In FIND YOUR PATH she shares her secrets with readers, with the ultimate goal of being the strongest version of themselves, and looking as good as they feel. Carrie's book will share secrets for fitting diet and exercise into a packed routine--she's not only a multi-Platinum singer, she's a businesswoman and busy mom with two young children. Based on her own active lifestyle, diet, and workouts, FIND YOUR PATH is packed with meal plans, recipes, weekly workout programs, and guidelines for keeping a weekly food and workout journal. It also introduces readers to Carrie's signature Fit52 workout, which involves a deck of cards and exercises that can be done at home--and it sets her fans on a path to sustainable health and fitness for life. Fit52 begins with embracing the Pleasure Principle in eating, making healthy swaps in your favorite recipes, and embracing a long view approach to health--so that a cheat a day won't derail you. Throughout the book, Carrie shares her personal journey towards optimal health, from her passion for sports as a kid, to the pressure to look perfect and fit the mold as she launched her career after winning American Idol, to eventually discovering the importance of balance and the meaning of true health. For Carrie, being fit isn't about crash diets or a workout routine that you're going to dread. It's about healthy choices and simple meals that you can put together from the ingredients in your local grocery store, and making the time, every day, to move, to love your body, and to be the best version of yourself.",N/A,N/A,en
Beauty Pure and Simple,['Kristen Ma'],2011,['Health & Fitness'],"""Beauty Pure and Simple provides an all-natural, holistic view of skincare and beauty drawn from both the latest in skincare science and from Ayurveda, a system of wellness that has been practiced for thousands of years on the Indian subcontinent. In this practical guide, Kristen Ma, who is both a popular esthetician and an Ayurvedic practitioner, provides a skincare and beauty regimen that is easy to use, safe, and effective. Ma gives a clear and readable explanation of skin biology and the basics of Ayurveda as it applies to skin health, helps readers determine their true skin type according to their specific dosha (physical constitution according to Ayurvedic principles), and then recommends individualized regimens with easy-to-obtain products. She also covers such topics as the influence of diet on skin, dealing with skin changes that come with aging, protecting skin from the sun and pollutants, the effect of stress on skin and how to cope with it, and how to treat common problems such as dark circles under the eyes, breakouts, acne, eczema, rosacea, puffy eyes, hyperpigmentation, and many others. Ma is a persuasive advocate for chemical-free products and biodegradable or recyclable packaging, and she alerts readers to the harmful ingredients that are ubiquitous in most products and treatments on the market and recommends alternatives. ""--",N/A,N/A,en
Killer Body,['Bonnie Hearn Hill'],2004,['Fiction'],"When the spokesperson for Killer Body Weight Loss mysteriously disappears, three women--a penniless princess, a washed-up actress, and a media darling--vie for the chance to become the new spokesmodel, a position that comes with a deadly price.",N/A,N/A,en
Can Piggles Do It,['Frank Rodgers'],1992,['Eating'],N/A,N/A,N/A,en
Fit Can be Fun,['J. S. Jackson'],2011-01-01,['Juvenile Fiction'],"People come in all shapes and sizes. That's the way God make us. How boring it would be if we all looked the same! Some things we can't change, like how tall we are or the color of our eyes. Some things we can, like how we treat other people or how we take care of our bodies. This book is about taking care of our bodies so they work the best they can. You'll find that life is a lot more fun when you have a body that works well. In this book, the Elves will try to show you what to do--and what not to do--to make your life as fun and fit as it can be.",N/A,N/A,en
Nutrition and Fitness,[],1980,['Fitness'],"Turn valuable nutritional knowledge into fun and games! Start by learning about the rainbow colors of healthy foods and what various foods make a healthy, varied meal. Read about one terrible eater who learned the joy of healthy eating after eating a mountain of junk food. Then play a game where everyone tries to be the first to build a healthy meal on their plate. Next learn about fitness fun. Keeping your body moving and active should be a joy, not a chore! Try an action dice game, dancing to kid Zumba, or try out a quick workout following along to a Fit Kids’ DVD. Leave boring behind and have some fun with nutrition and fitness.",N/A,N/A,en
"Motionsdoping. Styrketræning, identitet og kultur",['Ask Vest Christiansen'],2018,[],"Det er ikke kun bodybuildere, der er på steroider. Også helt almindelige unge mænd kombinerer styrketræning i fitnesscentret med brug af doping og sætter hårdt ind med ambitiøse træningsprogrammer og avancerede kostregimer. Den muskuløse krop er idealet, og anabole steroider genvejen.0I 'Motionsdoping. Styrketræning, identitet og kultur.' undersøger lektor Ask Vest Christiansen brugen af præstationsfremmende stoffer i fitness- og styrketræningsmiljøerne. Han beskriver koblingen mellem muskler, maskulinitet og identitet og lader mændene selv fortælle om deres oplevelser med steroider. Samtidig karakteriserer han fire idealtypiske brugere og belyser kulturelle, sociale, psykologiske og biologiske aspekter, der spiller ind, når motionister vælger at opbygge drømmekroppen med andet end tunge vægte.",N/A,N/A,da
Abriendo Viejos Y Olvidados Baules,['Lilian J. Aguayo'],2011-12-22,['Fitness'],"Hoy presentamos ABRIENDO VIEJOS Y OLVIDADOS BA?ÜLES.......Sab?¡a Usted? , como una pauta general de conductas y consejos de salud que persiguen brindar una mejor calidad de vida en todos sus formas. El primero de futuros libros, que busca hurgar hasta en lo m?ís rec'ndito de los viejos y olvidados secretitos de las abuelas, con el objetivo genuino de rescatarnos de las garras del abuso, desconocimiento, y una tan alarmante falta de informaci'n en cuanto a c'mo vivir m?ís y mejor hoy en d?¡a. En este valioso, sabio y sencillo libro, el autor hace una invitacion a padres, educadores, ni'os, j'venes y comunidad en general a cambiar los insanos h?íbito de vida que la sociedad moderna, tan alarmantemente nos obliga a seguir. A amar, respetar y cuidar la Madre Tierra, y darle el lugar que se merece como portadora de todo lo que realmente necesitamos. Es un compendio de ideas, datitos y sugerencias que nos permitir?í conocer como alcanzar un equilibrio total entre nuestro cuerpo, mente y esp?¡ritu, para lograr una vida sana y salud integral plena. Nos invita, por ejemplo, a abrazar los maravillosos arboles y sentir su incre?¡ble energ?¡a reparadora, restableciendo con ello el equilibrio b?ísico entre nuestro cuerpo y la Madre Naturaleza. ESTE LIBRO DEBE SER LEIDO POR TODOS AQUELLOS QUE NECESITAN Y ESPERAN CONSEGUIR UNA MEJOR CALIDAD DE VIDA!Dedicado a mi amado padre Manuel Aguayo Garc?¡a, por toda la confianza que siempre deposit? en cada uno de mis proyectos, y a Alicia Mart?¡nez, una madre simplemente maravillosa.",N/A,N/A,es
Fit mit Spaß,"['Sylvia Mätzel', 'Kristin Fallet']",2023-03,[],N/A,N/A,N/A,de
발레 피트니스,['박현선'],2014-06-26,[],N/A,N/A,N/A,ko
Der gesunde Mensch,['Burkhard Jahn'],2020-03-02,[],N/A,N/A,N/A,de
Pyjama-Pilates,['Maria Mankin'],2023-11-21,['Health & Fitness'],N/A,N/A,N/A,de
Aqua Fitness,['John Mason'],1999,['Aquatic exercises'],"There's a lot of mythology surrounding swimming and water exercises: that water work is only for senior citizens, arthritis sufferers and professional athletes recovering from injury; that it's not an efficient way to build cardiovascular endurance or burn fat; that it's inferior to land-based exercise programs like running and weight training. AQUA FITNESS not only attacks those myths, it shows how to use a swimming pool and a few pieces of equipment to improve everything: strength, endurance, flexibility, muscularity. If you don't mind getting wet, this is one of the best workout manuals you'll find. AQUA FITNESS is the essential companion to water exercises, including information about the pool itself, from depth, water temperature, hygiene and safety to addressing various forms of water exercising, to the equipment and facilities involved. John Mason has worked closely with an Aqua Fitness specialist and tutor in providing information on different types of exercises, hints and tips on Aqua Fitness Leadership, designing aqua programmes for yourself and others, first aid and legal considerations for those going into business. There are many advantages to working out in the water, including muscle cushioning and minimal impact on the body, and John Mason reveals the best exercises and techniques for achieving good health and fitness.",4,N/A,en
