title,authors,publishedDate,categories,description,averageRating,textSnippet,language
Active).,[],2005,['Exercise'],N/A,N/A,N/A,en
Fatigue Solution,['Max Tuck'],2017-03-30,['Chronic fatigue syndrome'],"""More than 20 years ago, Health Educator and veterinary surgeon Max Tuck approached collapse with Epstein Barr virus and chronic fatigue after years of pushing herself relentlessly. Though written off as a chronic invalid by her doctor she has since run marathons and climbed mountains in addition to managing her tough work schedule. How did she do it? And what can readers suffering burn out and exhaustion learn from Max? In 'The Fatigue Solution', Max explains what contributed to her collapse, what factors helped her overcome her personal illness and what she has learned along the way - including the latest research - that will help other sufferers from chronic fatigue to rebuild their energy and their lives""--Publisher.",N/A,N/A,en
Exercise For Mood,['Raul Valencia'],2020-07-15,['Health & Fitness'],"If you want to reach your fitness goals and improve your mood as soon as possible, the exercises found in this book is absolutely indispensible in your workout routine. Let's cut down the time it takes for you to gain strength and start growing those muscles that you've always dreamed of and to rewire your brain for happiness today!",N/A,N/A,en
The Importance of Being Life Long Lean and Strong,['Robyn Reimers'],2015-07-17,['Exercise'],"This book has been written in a bid for people to gain better understanding of exactly what it takes to achieve better health, fitness and strength. It allows the reader to look at the fitness game through a different set of eyes. Putting forward powerful, yet simple concepts can help someone understand exactly where they are going wrong when looking to get in shape. The book aims to achieve a much healthier focus on food and training using simple analogies that have a scientific basis that is hard to look past. Going into battle against something that nature intends is a recipe for failure. Just delivering some simple concepts can be the difference between success and failure when looking to improve your health. Real results start from the inside. If health is improved, weight and size will fall into place. Come on a journey and live the life you never thought possible. Your health is your wealth, so go out and grab it with both hands. You will be so glad you did!",N/A,N/A,en
Wellness Uprising,['Rob Pell'],2014-10-07,[],"Every page of Wellness Uprising delivers long-term, drug-free, health solutions based on time-tested wisdom. These solutions function within the framework of methods that have kept humans alive and healthy since the beginning of time. This will help you understand why so many of today's so-called medical ""advances"" often fall short, or may even cause you great harm. The internet, magazines, and doctors offer health solutions that tell us what supposedly work. Over the last two decades, thousands of real live customers at the author's health food store have shared their health success stories confirming what really works! Wellness Uprising reveals the secret of how to easily avoid the nation's #1 killer and also provides proven healthy solutions to many of today's most common health challenges: high cholesterol the silent killer - high blood pressure cancer osteoporosis relieving stress and preventing burnout insomnia plus a lot more Further, Wellness Uprising Will Teach You How To Stay Safe, It Delivers the Truth About: Using Cell Phones Safely- Simple steps you can take to reduce cancer-causing risks Food Production- It will help you understand myriad benefits of traditional organic farming methods that place trust in strong, healthy, fertile soil. In contrast, GMO farming methods put faith in bio-tech scientists working in laboratories developing patented methods to artificially control food production. Choosing Non-toxic Cookware and Safe Household Cleaning Products - Easy ways to ensure your home is safe. This is where you spend the most time; it's important to get this right! Vaccines - Current American Academy of Pediatrics recommendations state that children should receive 35 vaccine doses by the age of 15 months, 49 doses by the age of six, and 69 doses by the age of 18! But are kids in America today any healthier than kids were back in the 60s? Definitely not! Wellness Uprising logically addresses the questions: what are the proven, likely, or possible benefits of vaccines compared with the proven, likely, or possible risks? What steps you can take to improve immunity for yourself and your children, with or without vaccines. Treating The Carcinogens In Your Drinking and Bathing Water - You can live for months without food but only days without water. Learn why it's important to get this right. Selecting Truly Natural Pet Foods - Just like for their human owners, clean, high quality food plays a critical role in pet health. This can save thousands of dollars in vet bills. Plus... a lot more about today's most critical health concerns! For the specific solutions, hope, and the limitless possibilities represented, chapter 29 titled, ""Natural Healing Success Stories"" is alone worth the price of the entire book.",N/A,N/A,en
Physical Fitness,['Vijaya Lakshmi'],2004-01-01,['Physical fitness'],N/A,N/A,N/A,en
10 Tips to Healthy Eating and Physical Activity for You,[],1998,['Children'],N/A,N/A,N/A,en
Zest: Bikini Body Made Easy,['Charmaine Yabsley'],2009-05-18,['Family & Relationships'],"Whether you've got just one or the luxury of six weeks to go before you jet off on holiday and you’ve had little time to think about how you are going to look in your bikini, then this is the book for you. Bikini Body Made Easy offers simple and achievable ways to feel great in your bikini. The book is divided into body types: Pencil figure, Sporty figure, Pear shape, Hourglass and Apple shape. For each body type Yabsley offers a workout to target specific problem areas and a 6-week diet plan. There are also 24-hour emergency plans and 10-minute fixes you can do just days before you depart. As well as information on diet and fitness there is advice on beauty including exfoliation, make up, hair, applying fake tan, getting rid of cellulite, keeping well moisturized and most importantly, the best bikini for you. To complete the package there is advice on confidence building and self esteem. Throughout the book there are week-by-week plans and time-saving tips. So, even if you’ve left it to the last minute, there is still time to look and feel great on the beach. Other books in the series: Running Made Easy (9781861057037) - over 30,000 copies sold; Triathlon Made Easy (9781843404330).",N/A,N/A,en
Fitness for Life,"['Susie Dinan', 'Craig Sharp']",1996,['Exercise'],"This book is based on the ""Exercises for the 50+"" training course devised by the Y (the London Central YMCA) professionals in clinical & community geriatric medicine, physiotherapists & exercise physiologists. The plan has options for everyone.",N/A,N/A,en
Physical Activity and Health,[],N/A,['Fitness'],N/A,N/A,N/A,en
Strong to the Core,['Lisa Westlake'],2003,['Exercise'],Using an exercise ball for strength and fitness is not just another fitness fad. The ball has been used extensively in rehabilitation and physiotherapy for more than 30 years. This book provides a comprehensive guide to working-out with an exercise ball.,N/A,N/A,en
Natural Superwoman,['Rosamond Richardson'],1999,['Fitness'],"This practical, down-to-earth guide is suitable for women of all ages on how to survive the stresses and strains of modern life. Beautifully illustrated, it focuses on various topics but primarily on how to live a natural lifestyle in the modern world.",N/A,N/A,en
Romana's Pilates,[],2003,['DVD-Video discs'],"A guide, step-by-step, through the basics of Pilates. You'll discover your Powerhouse and what it means to your overall well-being. You'll develop a positive mind-set, while stretching and strengthening your muscles.",N/A,N/A,en
Gamification in Healthcare and Fitness,['Mario Herger'],2015-01-07,['Fitness'],"Research shows when people are engaged they are more productive. That's why gamification has caught on in the corporate world. The clever combination of fields such as game design, psychology, motivation theory, neurophysiology, and behaviorism has been scientifically shown to improve engagement and compliance. Being healthy and fit are as much influenced by behavior as they are by environment or medicine. If you are a healthcare professional, or if you are a manager looking for solutions that allow your employees to manage medical training and healthcare options, or if you are interested in staying fit or working towards an athletic goal, then this book is for you. Gamification in Healthcare and Fitness highlights several dozen examples of gamified fitness tracking applications, as well as solutions to train healthcare professionals and support patients, families and employers to heal faster and maintain a healthy lifestyle. By the end of the book you will possess the tools necessary to begin or expand your own gamified healthcare and fitness programs.",N/A,N/A,en
The Easy Fitness Workbook,['Lorna Lee Malcolm'],2005-01,['Exercise'],"A complete programme of fitness, providing three key benefits - cardiovascular fitness, muscle strength and suppleness - in a range of different exercises. The 20 exercises can be done in isolation or as part of a Total Easy Workout, and each exercise is accompanied by spoken instructions on the CD and step-by-step photographs.",N/A,N/A,en
Flatten Your Belly with Pilates,['Michelle Dozois'],2004,['Fitness'],N/A,N/A,N/A,en
Customized Edition of Fitness Walking,['Hawkins Hawkins'],2006,['Fitness'],N/A,N/A,N/A,en
Exercise Your Way to Lower Blood Pressure,[],2001,['Fitness'],N/A,N/A,N/A,en
"Nutrition, Health & Wellness","['Abour H. Cherif', 'Dianne M. Jedlicka', 'Sujata Verma', 'Robert D. Aron', 'Bashar W. Hanna', 'Betsy A. Hornick']",2011,['Diet therapy'],N/A,N/A,N/A,en
The Mayo Clinic Guide to Healthy Living,[],2017,['Diet'],N/A,N/A,N/A,en
The Ultimate Guide to Weight Training for Roller Hockey,['Robert Price'],2003,['Sports & Recreation'],"This is the most comprehensive and up-to-date roller hockey-specific training guide in the world today. It contains descriptions and photographs of over 80 of the most effective weight training, flexibility, and abdominal exercises used by athletes world-wide. This book features year-round roller hockey-specific weight-training programs guaranteed to improve your performance and get you results. No other roller hockey book to date has been so well designed, so easy to use, and so committed to weight training. This book takes you from the off-season to the in-season, and is loaded with dozens of tips and pointers to help you maximise your training and improve your performance. Both beginners and advanced athletes and weight trainers can follow this book and utilise its programs. From recreational to professional, thousands of athletes all over the world are already benefiting from this book and its techniques, and now you can too!",N/A,N/A,en
Anatomy of Fitness,['Hollis Lance Liebman'],2014-02,['Exercise'],"The Anatomy of Fitness series offers the total fitness experience, with a comprehensive catalogue of step-by-step exercises. These user-friendly titles feature detailed, full-colour anatomical illustrations of the muscles used in each exercise, so you're always familiar with what your body should be doing. Detailed tips on the correct form and what to avoid mean you'll be exercising effectively and safely.- Information on exercise basics, nutrition and training at home.- Comprehensive sections on the different types of exercises or poses.- Tailored workouts and routines to suit your fitness and exercise needs.- Modifications and variations on many of the exercises to simplify or intensify the challenge.- Anatomical information and labels to complement the detailed drawings of the body's muscle system that accompany each exercise.Produced in partnership with Moseley Road, the creators of Hinkler's bestselling Anatomy of Exercise range of titles: over 100,000 titles sold!Surveys have found there are 11 million people practising Pilates regularly in the United States alone.Yoga is a common alternative therapy in the United States, with 19 million people, or 6.1 per cent of the population, participating.Core training is one of the hottest topics in the fitness industry. Google searches for 'core exercises' have increased by 300% over the last 7 years.Exercising at home is an affordable alternative to expensive gym fees and exercise equipment; especially relevant in an environment where people are watching their spending but wanting to maintain their fitness.",N/A,N/A,en
The Mediterranean Diet for Beginners:,['Jerry Allan'],2018-09-20,[],"If YOU want to lose up to 10lbs in the next 2 weeks then keep reading! Do You finally want to put an end to the years of monotonous dieting you have struggled through? Do You want to finally find an eating plan that allows You to enjoy the pleasures of eating, while shedding fat? I'm almost certain over the years you've had some limited success losing weight with certain diets, sure you lost 10lb 3 years ago basically starving yourself, however if you had found something that sustainably worked, you wouldn't be where you are right now. But, I've been where You are now. Endlessly repeating 'fad diets' that simply mask over the real issue- Your relationship with food. Restriction doesn't work, it simply masks over the problem until you simply can't resist anymore, instead Healthy choices of delicious food that you actually enjoy are the answer, which is what the Mediterranean Diet provides. This is not about restriction, its about learning how to make sustainable, healthy food choices, not only for a week, but, instead lays the foundation for a lifetime of thriving with food. No longer will your scales create unhappiness in you, from this day forward no longer will food control you. So what is the Mediterranean Diet? It is a lifestyle that focuses your eating habits around the Mediterranean style of eating, which is not only much healthier than the 'S.A.D' but incorporates actual food that is incredibly delicious, not just processed poison. But, don't just believe me, its backed up by numerous scientific studies for example- The benefits of the Mediterranean Diet are greater than any drug aimed at improving health or longevity. Why? Because its whole food that nourishes are body, and what our body thrives on.In The Mediterranean Diet for Beginners you'll discover:The Almost UNKNOWN link Between Food and Brain health, and How To Protect YOUR Brain! (Page 21) How To Reduce Your Risk of Cancer by Up To 50%! (Page 23) The Secret Food That Protects Your Eyesight (Did you know food impacted eyesight?) (Page 23) How to Lose Weight WITHOUT Calorie Counting (Page 6)The Scientifically Proven Plate Portion Ratio (Page 10)The One Thing You Must Avoid like the Plague! (Page 6)You can't partake in this diet on a budget right? WRONG, It even includes 9 Money Saving Tips!......And much, much MORE! So, if you thought lack of time or money could stop you on this lifestyle, think again, there is literally NOTHING standing in your way to reaching your weight loss goals. Its now all over to YOU-So if YOU want to FINALLY reach your weight loss goals once and for all, then click ""Add to Cart.""",N/A,N/A,en
Heart Health Manual,['National Heart Foundation of Australia'],1996,['Health education (Primary)'],N/A,N/A,N/A,en
Complete Idiot's Guide to Fitness Boxing Illustrated,"['Tom Seabourne', 'Ph. D. Seabourne']",2006,['Health & Fitness'],"Fitness boxing is one of the hottest workout trends across America, with over 10,000 health clubs featuring fitness boxing and boxaerobics programs. But what is fitness boxing, exactly? It's an exercise program that uses aspects of professional boxing training and aerobics to build strength and confidence, and of course, burn calories. And, it's fun--especially with a partner. This is the only book of its kind to lead the reader through each dynamic stage of fitness boxing. From stretching and jumping rope to sit ups, toning, and leg work, to each kind of punch and their combinations, expert Tom Seabourne puts it all together in this knockout of a fitness title. And, to make it even easier, he and two of his students demonstrate the program on a professional 30- minute DVD, produced for and packaged exclusively with this title.",N/A,N/A,en
Extrait des registres des délibérations des Trois-Ordres de la ville de Metz. Du 21 Juin 1789,[],1789*,[],N/A,N/A,N/A,en
Is Sam Fit?,['Learning Logic Pty Ltd'],2019-03-15,[],N/A,N/A,N/A,en
Lisa B,['Lisa B.'],2008,"['Beauty, Personal']","How often do you stop and think about your outlook and approach to life, the way it defines you and how it affects the way you live? While busy juggling the many elements of a hectic, modern lifestyle it's all too easy to accept things the way they are. But, are you actually getting the most out of life and yourself? Actress, model and mother Lisa B will help you take stock of all aspects of your life allowing you to develop a more positive, balanced, and fulfilled approach to it. By giving advice and sharing her tips, Lisa B will show you how to make the most of yourself - tackling a healthy lifestyle, emotional well being, appearance, social and personal etiquettes, family, work and ambitions. Learn how being confident, organised and focused. There will be no holding you back!",N/A,N/A,en
Total Fitness and Wellness,['SK. Powers'],2007,['Fitness'],N/A,N/A,N/A,en
Winning Nutrition for Athletes,[],N/A,['Fitness'],N/A,N/A,N/A,en
Wellness kit,[],2018,['Exercise'],N/A,N/A,N/A,en
Get Active!,['Louise Spilsbury'],2009,['Fitness'],N/A,N/A,N/A,en
Going for Gold,['Poppy Masselos'],2008,['Fitness'],N/A,N/A,N/A,en
Fitsmart System 3,"['Funtastic Publishing', 'Sharon Natoli', 'Tony Boutagy']",2004,['Exercise'],N/A,N/A,N/A,en
"Peak Performance, Enjoyment, and Well-Being",['Allan Warrener'],2015-09,['Self-Help'],"Revitalize your mind and body with Vortex Energy Therapy, a groundbreaking program developed by chiropractor Allan Warrener. Based on his decades of studying how our bodies and brains work, he examines the body for what it is: a biological, multidimensional computer. Its surface is a computer screen, with numerous points through which information can be accessed as an aid to diagnose ailments. For the body and brain to work properly, its systems must function in harmony. By understanding how they interconnect, you'll be equipped to: - develop better posture and synchronize movements; - avoid environmental factors that can hinder the body from reaching its potential; - cultivate a positive self-image that promotes better performance; - steer clear of negative thoughts and feelings that inhibit success. You'll also learn how to boost the flow of energy throughout the body, eliminate stress, breathe properly, and improve muscle strength. Take control of your life and boost your emotional and physical health with the powerful insights and proven strategies in Peak Performance, Enjoyment, and Well-Being.",N/A,N/A,en
Health -- Exercising for Excellence,['Sharon McDowell'],2003,['Exercise'],Discusses the significance of data that the Center for Creative Leadership collected from participants of its Leadership at the Peak (LAP) program in order to learn about what motivates executives to exercise and what types of exercise they engage in. Top two reasons given by LAP executives for exercising; Number of kilocalories that exercisers expended per week doing exercise; Relationship between fitness and health; Types of fitness.,N/A,N/A,en
Personal Fitness with Norma Chase,[],1996,['Fitness'],"This CD-ROM provides a comprehensive interactive guide to overall fitness, with easy to follow instructions and over 40 colorful video demonstrations.",N/A,N/A,en
Healthy Harold's Fitness Fun!,['Louise Parrott'],2019,['Exercise'],"Fitness + friends = Fun for Harold, Boots and Red as their team powers through soccer season. The pressure is mounting. How will they go as the finals are approaching? Harold's fun stories are designed to share with pre-schoolers or for early readers. They subtly reinforce the safer, smarter life choices that he and Life Education are famous for.",N/A,N/A,en
Wally's Total Body Workout,"[""Jane O'Brien""]",N/A,['Aerobic exercises'],N/A,N/A,N/A,en
Complete Exercise and Fitness Book,"['A Consumers Institute guide', ""Consumers' Institute"", ""Consumers' Institute of New Zealand""]",1984-07-01,['Exercise'],N/A,N/A,N/A,en
Health & Fitness,[],1997,['Fitness'],N/A,N/A,N/A,en
Certificate IV in Fitness Lecture Notes,[],2006,['Fitness'],Lecturers from the Health and Fitness Department West Coast TAFE will be adding notes from lectures to these files periodically.,N/A,N/A,en
Comparision of Factors Driving Purchasing Decision for Slimming Services,[],2013,['Fitness'],N/A,N/A,N/A,en
Michelle Bridges,['Michelle Bridges'],2011-11-23,['Health & Fitness'],"MICHELLE BRIDGES is Australia's MOST SUCCESSFUL WEIGHT-LOSS EXPERT. In this handy pocket-sized guide, she shares her secrets to STAYING FOCUSED, STAYING FIT and getting the MOST OUT OF YOUR LIFE, EVERY DAY.",N/A,N/A,en
Tae-Bo Advanced [Video],['Billy Blanks'],1998,[],This video contains step by step instruction from seven time World Martial Arts Champion Billy Blanks. It contains Billy Blank's electrifying advanced workout.,N/A,N/A,en
Sport & Fitness,[],2003,[],N/A,N/A,N/A,en
Be Active,[],2001,['Exercise'],N/A,N/A,N/A,en
You are what You Eat,[],2005,['Diets'],N/A,N/A,N/A,en
Walking Works,[],N/A,['Fitness'],N/A,N/A,N/A,en
'Mainly Fitness',['John Balding'],1997,['Social surveys'],N/A,N/A,N/A,en
Move,['Crystal Hartmann'],2018,['Exercise'],N/A,N/A,N/A,en
The Party Girl Diet,['Aprilanne Hurley'],2011-02-18,['Health & Fitness'],"Party Girl Diet In The News: Party Girl Diet Author Aprilanne Hurley has recently appeared LIVE on ABC, CBS, NBC, and FOX to discuss her Party Girl Diet's FUN, New Diet & Lifestyle Plan That Lets You Lose Weight While You are Having the Time of Your Life! IMAGINE IF YOU COULD: Kickstart your healthy weight loss by losing up to 5 pounds in 3-Days eating yummy, filling foods, continue to lose weight at a healthy pace - and keep the weight off! Blast More Fat & Calories in Less Time - without stepping foot in a gym! Cook healthy, tasty, 10-Minute Meals your whole family will enjoy... ...You can - with The Party Girl Diet! The Party Girl Diet is a sexy new Diet & Lifestyle Plan based on the most respected research available to date - that lets you ""keep the party going...while you lose the weight!"" While the name is fun the Party Girl Diet is not a ""fad diet"" - it is a healthy, NEW lifestyle that lets you: - Eat Chocolate - Drink red wine or your favorite cocktail daily - Enjoy a wide variety of delicious foods & LOSE WEIGHT...While You're Having the Time of Your Life!"" - Discover The Party Girl Diet's easy to follow scientific Fitness Formulas designed to cut your workout time & increase yourfFitness results. - Learn How to Incorporate The Party Girl Diet's 9 - ""PRICELESS"" Keys to Good Living into your life to quickly transform you overall health & wellbeing. - PLUS get The Party Girl Diet's 2 WEEKS of easy, tasty, and nutritious 10 Minute Recipes your guests and family will love. The Party Girl Diet's weight loss and fitness success formulas will revolutionize the way you approach diet and weight loss forever - so you can ""Keep the Party Going...and Keep the Weight Off."" With the Party Girl Diet's sustainable lifestyle you will enjoy: Authentic Italian Dishes like Spaghetti & Meatballs, Tuscan Chicken Stew, and Bruschetta... ""California Fresh"" Cuisine Inspired Pasta and Seafood Dishes Savory California Wine Country and Mediterranean Style Recipes perfect for entertaining that take just 10 minutes to prepare. Featured customer review on Amazon.com by Maria K.: ""I've read them all and this one is terrific. I was so inspired after reading this book that I changed my whole way of eating. I truly have read every ""famous"" diet book published and I had settled into a low carb mentality. I would only eat certain fruits, certain veggies and almost no breads, rice or pastas (unless of course I wasn't ""ON"" my diet. This always left me feeling like I went ""OFF"" my diet.) After reading this well written survival guide for a healthy lifestyle my fridge looks like a rainbow and I have ditched the low carb mentality. Aprilanne Hurley has included so much valuable information and tips that this book serves me well as a reference book that I keep out on the counter. Included in the book are great recipes, exercise charts and tips, top 10 foods and why we should include them in our diet, and of course the 9 PRICELESS keys to good living. I printed a copy of that page and hung it by my desk. I especially like the PGD Overnight Makeover on page 123. This book explains WHY we should incorporate all this information into our healthy lifestyle which makes it more motivating to follow it. It is all backed up by the latest science available on the topic. I highly recommend this enjoyable gem of a book.""",N/A,N/A,en
7-Minute Total Body Workouts,['Moseley Road Inc'],2019-11-15,[],N/A,N/A,N/A,en
This is Your Life! You're It. Get Fit!.,[],N/A,['Fitness'],N/A,N/A,N/A,en
Nutrition and Fitness,['Cindy Brattan Wolff'],1997-02-01,['Diet'],N/A,N/A,N/A,en
Everything about diets and fitness,['J. Alhalabi'],2006,['Fitness'],N/A,N/A,N/A,en
Youth and Recreation,['A. M. Duncan'],1946,['Fitness'],N/A,N/A,N/A,en
