title,authors,publishedDate,categories,description,averageRating,textSnippet,language
Laura's Great Guide to Fitness,['Laura Gudipalley'],2016-09-28,['Health & Fitness'],"""Laura's Great Guide to Fitness"" is an informative guide to the health-and-fitness industry. This guide is a cumulation of years of learned knowledge from ISSA, ACE, FIDER, AFFA, and CPR, which Laura S. Gudipalley is certified in various degrees and certifications. First, this guide has basic detailed instructions for health and fitness, including charts and guidelines. Second, this guide provides meal plans based on calorie count for kids, women, and men. And third, this guide provides detailed exercise plans for kids, women, and men. ""Laura's Great Guide to Fitness"" is a one-of-a-kind guide that provides knowledge that one would have to pay hundreds of dollars for. This guide is a an easy read that will walk you through the health-and-fitness industry and teach you how to stay in shape, eat properly, measure yourself, find your target heart rate, and so much more. With the index, one can easily locate where you want to start your own personal journey.",N/A,N/A,en
Training Programs,['Jeff Galloway'],2007,['Running'],"This book is for just about anyone who wants to run/walk or walk a 10-miler, a half marathon or a marathon. Jeff includes training schedules for beginners and time goal runners, information on nutrition, issues for the ""mature"" exerciser, motivation and recovery plus some new concepts: Magic Mile, shorter ""long"" runs between the really long weekend sessions. Includes a special chapter on Donna Hicken, breast cancer survivor and originator of the Breast Cancer Half Marathon & Marathon (February 21, 2010) in Jacksonville, Florida. --from publisher description.",N/A,N/A,en
"Helping You Child be Healthy and Fit/ Carol S. Katzman and Carolyn R. McCary with Deborah Kidushim-Allen, R.D.","['Carol S. Katzman', 'Carolyn R.McCary']",1993,"[""Children's health""]",N/A,N/A,N/A,en
Special Issue,"['Bradley J. Cardinal', 'Kris Day']",2007,['Exercise'],N/A,N/A,N/A,en
Certificate III in Fitness C597 Lecture Notes,[],2006,['Exercise'],Lecturers from the Health and Fitness Department West Coast TAFE will be adding notes from lectures to these files periodically.,N/A,N/A,en
Physical Activity and Health,[],N/A,['Fitness'],N/A,N/A,N/A,en
The Real Woman's Personal Trainer,['Sam Murphy'],2005,['Exercise for women'],"ost women still want to stay healthy and look great. That's why every quick-fix health craze has so much appeal. But they don't work. The Real Woman's Guide to Fitness shows women what will work, providing ways to improve fat loss, posture and flexibility in relation to body shapes and lifestyles.",N/A,N/A,en
Your Health Transformation,['Regan Archibald Lac'],2016-10-25,['Health & Fitness'],"Whether you're a professional athlete, stay-at-home mom, or entrepreneur, you make an impact in the world. You can only serve at this level if you are healthy. This book is about reclaiming your health and putting trust and energy back into the belief that your body can heal itself. In this book you will: Discover Secrets to Reverse Chronic Disease Learn How to Lose that Stubborn Belly Fat Understand How to Eat Better and Live Longer Learn About Digestive, Thyroid, and Adrenal Health Gain New Purpose and Meaning for Getting Healthy ""There is no magic pill or secret to fix your health. If you want real solutions, look no further! Regan does an excellent job of giving you the truth about health and healing. Take everything out of your medicine cabinet and make room for this book."" - Dan Kellams, LAc ""Your Health Transformation is a must-read-powerful, forward-thinking, and setting standards for the future of medicine. Truly a revolutionary work! In my sixteen years as a board certified Family Physician this book is the best. Regan Archibald has produced a masterpiece that inspires and creates a road map to health and healing."" - R. Wade Oakden, MD ""Nobody is more skilled and passionate in the field of health and acupuncture than Regan Archibald. For years I have asked Regan to write a book as a template, so the rest of us can follow as an example what he does for all his patients, but most important, to follow what he does for his own integrated health. This book is a home run in meeting that goal."" - Jim Stringham, PhD """,N/A,N/A,en
Fitness for Life Lifetime Fitness,"['Charles Corbin', 'Chuck Corbin']",2005-06-28,['Education'],"The DVD spells out exactly why each aspect of fitness is important, then provides tools that allow students to assess their current fitness levels and interpret their assessment results.",N/A,N/A,en
Ferdi Fly and the Flamenco Guitar - Being Active,[],2019,[],"Ferdi loves to play the flamenco guitar. He travels Muzicbug Land spreading the word that 'being active is fun!' Whenever he plays his guitar, he creates excitement and fun, and everyone just wants to get up and dance... The first book in the Muzicbug Tales series introduces Ferdi Fly who has a fun message for kids about Being Active. Why is this important for kids? Physical activity has benefits for children beyond those of fitness. Keeping active also assists children to manage stress and anxiety, improve their mood, and enhance their sense of self-efficacy.",N/A,N/A,en
Finding Theo,['Timothy Krause'],2018-08,['Biography & Autobiography'],Strangers and friends converge in an epic battle against an unthinkable future and an ordinary miracle transforms a parent's nightmare into an affirmation of hope.,N/A,N/A,en
5 Minutes a Day,['Michelle Bridges'],2011,['Fitness'],"""Michelle Bridges is Australia's most successful weight-loss expert. In this handy pocket-sized guide, she shares her secrets to staying focused, staying fit and getting the most out of your life."" - Back cover.",N/A,N/A,en
The Complete Mediterranean Diet Cookbook for Beginners,['Nigel Methews'],2019-03-10,['Cooking'],"★★★Are you tired of trying out diets that don't work?.★★★ ★★★Are you still grumpy about how genetics doesn't seem to favor you?★★★ ★★★Do you want to live a healthier lifestyle and have a thin waist for years to come?★★★ ★★★Are you tired of filling your body with chemicals every time you eat processed foods?★★★ Learn how a diet of whole natural foods can make you healthier, happier and more energized than ever! Benefit from the Mediterranean diet! The Mediterranean diet is the healthiest, most well-respected and scientifically documented diet in the world. This book will teach you how to improve your health, add years to your life and give your body all the nutrients it needs to function at its best! The Mediterranean diet is not just a dietary adjustment, but a complete lifestyle change that can reduce the chance of developing medical conditions such as: heart disease type 2 diabetes high blood pressure obesity some cancers fibromyalgia Parkinson's disease Alzheimer's disease... For many of us, the idea of dieting conveys unpleasant notions of flavorless piles of lettuce and overpriced freezer meals. But, the secret to losing weight isn't starving yourself or eating processed ""diet food."" With The Complete Mediterranean Diet Cookbook for Beginners, you'll begin dropping pounds immediately--and learn how to keep them off for good--by following this healthy diet packed with tasty, wholesome meals that you'll love. Mediterranean Diet is useful for people wishing to lose weight as it is rich in fruits, vegetables, right amount of sugar and saturated fats than a typical Western diet. The Complete Mediterranean Diet Cookbook for Beginners Includes: All the information you need about Mediterranean Diet? Why you should choose this weight loss method over the thousands out there. In the very first chapter, you will be learning the vast history of the diet and the science to back it up. Unlike many diets that involve increasing your intake of certain vitamins and minerals, the Mediterranean diet is different in the sense that it allows you to eat a wide variety of foods in moderation. You were never meant to feel sluggish, unhealthy and overweight. Choose to change your lifestyle choice TODAY with the amazing health benefits of the Mediterranean diet! How many hours of your life are you willing to waste away in a bid to gather partially true or totally false information scattered around the web, when you can get everything you need to REACH YOUR GOALS by reading this excellent guide. If you need an easy plan to maximize your time and save money by preparing your low carb meals in advance, then you just found the right book! ★Just scroll up and select the ""Buy now with 1-Click"" Button - It's quick and easy!★ ★ Buy the Paperback version and get the Kindle Book versions for FREE ★",N/A,N/A,en
21 dian shi ni geng mei li,['Yiyi Ye'],1990*,['Fitness'],N/A,N/A,N/A,zh-CN
Escalire: Le robot détective,"['Dannie Pomerleau', 'Pascal-Hugo Caron-Cantin', 'Simon Tobin']",2014,[],N/A,N/A,N/A,fr
#EnForma con Tu Vida,['Adriana Martin'],2016-02-23,['Aptitud'],Descubre los mejores secretos para ponerte En Forma por dentro y por fuera (luce y sientete cada dia mejor) sin efecto rebote con la entrenadora de las celebridades Adriana Martin,N/A,N/A,en
Workout,['Marina Aagaard Elstrup Salminen'],2006,[],N/A,N/A,N/A,da
Modern fitness,['Zulkuf Turan'],2006,['Physical fitness'],N/A,N/A,N/A,tr
Træn i det fri,[],N/A,[],N/A,N/A,N/A,da
Phiṭanesa,['Vijaya Kumāra'],2002,['Exercise'],Exercises for fitness.,N/A,N/A,gu
"Wo Shu ko li, Billy Shu Xin Bo Gin DIY.",['Dong Fong Be li'],2002,['Fitness'],N/A,N/A,N/A,en
運動與補酒,"['遼原', '慕容菲']",2007,['Exercise'],N/A,N/A,N/A,zh-CN
5K Fitness Run,['David Holt'],2004-07-01,['Fitness'],Perfect bound quality paperback with a good shelf life.,N/A,N/A,en
Bodytrainer,['Sabine Letuwnikova'],1997,['Exercise for women'],N/A,N/A,N/A,cs
Strečink,['Bernhard Kurz'],2000,['Fitness'],N/A,N/A,N/A,cs
Dopingkontrol i motions- og fitnesscentre,['Kulturministeriet'],2012,[],"Indeholder en række anbefalinger til, hvordan dopingkontrollen kan forbedres i motions- og fitnesscentre i Danmark",N/A,N/A,da
Как быть здоровым,"['Майя Гогулан', 'Анна Соловьева']",2003,['Alternative medicine'],N/A,N/A,N/A,ru
Politikens fitnessbog,"['Terje Nordberg', 'Mads Andreasen', 'Janne Risbjerg Nielsen']",2003,[],N/A,N/A,N/A,da
Muškarac u formi,"['Cyrus A. Rahman', 'Manfred Schwarz']",2006,['Exercise'],N/A,N/A,N/A,en
