title,authors,publishedDate,categories,description,averageRating,textSnippet,language
Medieval Herbals,['Minta Collins'],2000-01-01,['Art'],Collins shows how the principal herbal traditions of Classical descent were replaced by a new observation of nature that itself paved the way for the magnificent paintings of later French and Italian herbals.,N/A,N/A,en
Moby Dick,['Herman Melville'],2020-09-03,[],"Melville's heritage and youthful experiences were perhaps crucial in forming the conflicts underlying his artistic vision. He was the third child of Allan and Maria Gansevoort Melvill, in a family that was to grow to four boys and four girls. His forebears had been among the Scottish and Dutch settlers of New York and had taken leading roles in the American Revolution and in the fiercely competitive commercial and political life of the new country. Moby Dick, novel by Herman Melville, published in London in October 1851 as The Whale and a month later in New York City as Moby-Dick; or, The Whale. It is dedicated to Nathaniel Hawthorne. Moby Dick is generally regarded as Melville's magnum opus and one of the greatest American novels. Moby Dick famously begins with the narratorial invocation ""Call me Ishmael."" The narrator, like his biblical counterpart, is an outcast. Ishmael, who turns to the sea for meaning, relays to the audience the final voyage of the Pequod, a whaling vessel. Amid a story of tribulation, beauty, and madness, the reader is introduced to a number of characters, many of whom have names with religious resonance. The ship's captain is Ahab, who Ishmael and his friend Queequeg soon learn is losing his mind. Starbuck, Ahab's first-mate, recognizes this problem too, and is the only one throughout the novel to voice his disapproval of Ahab's increasingly obsessive behavior. This nature of Ahab's obsession is first revealed to Ishmael and Queequeg after the Pequod's owners, Peleg and Bildad, explain to them that Ahab is still recovering from an encounter with a large whale that resulted in the loss of his leg. That whale's name is Moby Dick. The Pequod sets sail, and the crew is soon informed that this journey will be unlike their other whaling missions: this time, despite the reluctance of Starbuck, Ahab intends to hunt and kill the beastly Moby Dick no matter the cost.",N/A,N/A,en
The Pinetum,['George Gordon'],2014-01,[],"This is a reproduction of a book published before 1923. This book may have occasional imperfections such as missing or blurred pages, poor pictures, errant marks, etc. that were either part of the original artifact, or were introduced by the scanning process. We believe this work is culturally important, and despite the imperfections, have elected to bring it back into print as part of our continuing commitment to the preservation of printed works worldwide. We appreciate your understanding of the imperfections in the preservation process, and hope you enjoy this valuable book.",N/A,N/A,en
The Bulb Book,"['Martyn Rix', 'Roger Phillips']",1981,['Gardening'],N/A,N/A,N/A,en
Formal and Transcendental Logic,"['Edmund Husserl', 'Dorion Cairns']",1977-11-30,[],N/A,N/A,N/A,en
The Cut Flower Patch,['Louise Curley'],2014-03-06,['Gardening'],"An inspiring guide to transforming a small patch of ground, be it on an allotment or in a garden, into a cut flower patch which produces flowers from early spring to late autumn. Louise Curley looks at what makes a great cut flower, ideal conditions and soil and the tools you’ll need. There is advice on what to grow – from favourite hardy annuals, half hardies and biennials to spring and summer bulbs to adding foliage and fillers to balance arrangements – and advice on how and when to sow, how to support your plants and tips on weeding, deadheading, pests and feeding. Growing your own means greater choice, working with the seasons and super fresh flowers. Bought flowers can be expensive and the international flower trade often means dangerous chemicals, poor working conditions for growers, demands on water resources and the ‘flower miles’ of worldwide airfreight. This book will help you get the most from your patch with guidance on how to cut the flowers so that they keep producing more blooms and how to look after them once they have been picked. The Cut Flower Patch is completed by a selection of flower arranging tips and sample arrangements as well as tips on finding great containers, planting plans and a helpful year planner The Cut Flower Patch won the ‘Best Practical Book’ at the Garden Media Guild Awards, 2014 Jason Ingram won Photographer of the Year at the Garden Media Guild Awards, 2014",N/A,N/A,en
Citrus Fruits and Their Culture,['H Harold Hume'],2015-10-26,[],"This work has been selected by scholars as being culturally important, and is part of the knowledge base of civilization as we know it. This work was reproduced from the original artifact, and remains as true to the original work as possible. Therefore, you will see the original copyright references, library stamps (as most of these works have been housed in our most important libraries around the world), and other notations in the work.This work is in the public domain in the United States of America, and possibly other nations. Within the United States, you may freely copy and distribute this work, as no entity (individual or corporate) has a copyright on the body of the work.As a reproduction of a historical artifact, this work may contain missing or blurred pages, poor pictures, errant marks, etc. Scholars believe, and we concur, that this work is important enough to be preserved, reproduced, and made generally available to the public. We appreciate your support of the preservation process, and thank you for being an important part of keeping this knowledge alive and relevant.",N/A,N/A,en
Soil Types and Soil Preparation for Your Land - How to Get the Best Out Of Your Land,"['Dueep Jyot Singh', 'John Davidson']",2015-12-29,['Technology & Engineering'],"Table of Contents Introduction Soil Classification Soil series Soil Type Soil Class Mineral Soils Sandy Soils Sandy Loams Loam Soils Silt Loams Clay Loam Peat Soils and Muck Characteristics of Muck Soil Importance of Muck Soil Soil Preparation Tillage Drainage Subsiding of the Soil Plowing Fall Plowing Harrowing and Disking Dragging and Rolling Conclusion Author Bio Publisher Introduction For many people who work outdoors on their land, the feel of the soil between their fingers is enough to give them a feeling of euphoria and satisfaction. This book is going to tell you all about how you can get the best of your land through knowing more about the types of soils, and soil preparation. When you learn more about the types of soils, especially in your area, you can go out, and look at those soils and classify them accordingly. After that, you are going to know all about their plus and minus points and how best you can enrich the soil, naturally, and get the best out of this land, given to us by nature, by right of inheritance. The soil is the storage house of mineral nutrients and water used by higher plants as well as the home of their roots. Therefore, it is necessary for you to know all about the physical and chemical composition of the soil with regards to crop production. The chemical composition can be changed by adding fertilizers and other materials, and to some extent by tillage, proper drainage, and other methods which are going to favor soil aeration. The physical condition can be changed by drainage, by tillage, by plowing, by incorporating rich organic matter, and by use of lime and other materials. Unless the soil is in good physical condition, you are not going to get large yields. That is the reason why so many gardeners, as well as farmers, get disheartened, when they find their yields, not up to their expectations. What they may have overlooked is that they have done absolutely nothing in order to enrich the soil. So if you are not feeding mother Earth with rich fertilizer or giving her enough water, and leaving it to the rains to nourish the ground and water it, and leaving the land to overflow with weeds because you could not be bothered to take care of the land, how would you expect her to give you abundantly of her bounty? Also, good natural fertilizer practice, good seed, and the best of care is not going to ensure success unless the soil is already of good texture and is well prepared before hand. So this book is now going to tell you all about the different kinds of soils, soil classification, and how best you can take full advantage of rich soil in order to get a good and fruitful harvest year after year after year.",N/A,N/A,en
Gleanings from Books on Agriculture and Gardening,['Arthur Young'],1802,['Agriculture'],N/A,N/A,N/A,en
Greek Revival from the Garden,['Patricia Moore-Pastides'],2013-06-30,['Cooking'],"The acclaimed cookbook author guides you from your garden to your dining table in this volume of Mediterranean recipes, organic gardening advice, and more. Patricia Moore-Pastides, author of Greek Revival: Cooking for Life, heads to the garden, offering guidance on how to cultivate a healthy diet from the ground up. An accomplished cook and public-health professional, Moore-Pastides presents all new recipes focused on bringing the bounty of the garden to the table in easy and accessible ways. The growing section provides all the information necessary for growing an exciting array of fruits and vegetables in containers, raised beds, or yard gardens. Topics include preparing the soil, composting to create organic fertilizer, watering, working with basic tools, and dealing with common pests and problems. Greek Revival from the Garden then invites the reader into the kitchen. This section assumes little prior cooking experience and includes kitchen safety, common equipment, and cooking methods. Moore-Pastides also shares fifty mouth-watering recipes featuring your harvest of homegrown vegetables, including garden gazpacho, curried butternut squash and apple soup, and nut crusted creamy almond fruit tart.",N/A,N/A,en
Organic Lawn Care,['Howard Garrett'],2014-06-01,['Gardening'],"A renowned landscape gardener’s guide to less expensive, less water-intensive lawns, whether it’s a front yard or a fairway. A lush green lawn is one of the great pleasures of the natural world, whether it’s outside your front door or on a majestic fairway at a legendary golf course. But anyone who’s tried to grow the perfect lawn the conventional way knows it requires an endless cycle of watering and applying synthetic fertilizers and toxic chemical pesticides that costs a lot of money and kills all the life in the soil, on the surface, and on the grass. Fortunately, there’s a better way. Organic lawn care is not only healthier for the environment, it’s actually cheaper and less water-intensive, whether you’re managing a small yard or acres of turf. In this book, Howard Garrett, the renowned “Dirt Doctor,” takes you step-by-step through creating and maintaining turf organically. He begins with the soil, showing you how to establish a healthy habitat for grass. Then he discusses a variety of turfgrasses, including Bermudagrass, bluegrass, buffalo grass, fescue, ryegrass, St. Augustine, and zoysia. He explains in detail planting, mowing, watering, fertilizing, composting, and managing weeds and pests. And he offers alternatives to lawn grasses and turf, describing the situations in which they might be your best choice.",N/A,N/A,en
Encyclopedia of Cultivated Plants [3 Volumes],['Christopher Cumo'],2013-04-25,['Nature'],"Readers of this expansive, three-volume encyclopedia will gain scientific, sociological, and demographic insight into the complex relationship between plants and humans across history. Comprising three volumes and approximately half a million words, this work is likely the most comprehensive reference of its kind, providing detailed information not only about specific plants and food crops such as barley, corn, potato, rice, and wheat, but also interdisciplinary content that draws on the natural sciences, social sciences, and humanities. The entries underscore the fascination that humans have long held for plants, identifies the myriad reasons why much of life on earth would be impossible without plants, and points out the intertwined relationship of plants and humans--and how delicate this balance can be. While the majority of the content is dedicated to the food plants that are essential to human existence, material on ornamentals, fiber crops, pharmacological plants, and carnivorous plants is also included.",N/A,N/A,en
The Giant Book on Growing Fruits in Your Garden,"['Dueep Jyot Singh', 'John Davidson']",2016-03-22,['Gardening'],"Table of Contents Introduction Which Fruit to Grow? Fruit Production Charts Cold Hardiness zones Buying the Right Trees and Bushes Soil Conditions Nitrogen Fixing Crops Planning your garden Natural Weedkillers General Planting Supporting Your Fruit Trees Bird Protection Frost Protection Planting Fruit Trees against Walls What Are Espaliers? Keeping Your Bushes and Trees Healthy Fertilizers and pesticides – Cow Manure – the Best Organic Fertilizer/Compost Base John Innes Compost Basic Healthy Compost Mixtures How to Make Leaf Compost Natural Pesticides Neem Pesticide Preparing Neem seeds Chilis Tobacco Bougainvillea Leaves Fungicides for Soil Onion – Garlic Antifungal Solution Papaya Cure – Using Cow Manure Ash as a Pesticide Nutrient Deficiency Symptoms in Plants Spraying Garden Pests Pollination Fruit Plant Propagation Harvesting your fruit APPLES Growing Apples Time to plant Choosing the Right Tree Planting Tips Feeding Your Trees Pruning an Apple Tree Root Pruning and Ringing Ringing Popular Varieties of Apples Preserving and Storing Apples Pests and Diseases Apples in Cuisine Traditional Applesauce Traditional Apple Cake Traditional Dutch Schnitz Un Knepp – Apples and Buttons These are made by sifting together the flour, baking powder, salt and pepper. Appendix How to Make Traditional Apple Butter Conclusion CHERRIES Growing Cherries Budding Choosing the Right Plants Best Varieties of Cherries Maintenance of Cherry Trees Pruning Your Cherry Tree Root pruning Sour Cherries Planting Sour Cherries Feeding Sour Cherries Pruning of Sour Cherries Mulch cultivation Rejuvenating Cherries Diseases and Pests Cherries in Cuisine Two-Step Cherry Pudding Conclusion CUCURBITAS (MELONS) Cucumbers Soil Requirements Planting Cucumbers Planting in “Hills” Harvesting Pumpkins Pumpkins Sowing Harvesting Pumpkin Curing and Storage Watermelons Soil Requirements and Climate Watermelon Planting Harvesting Muskmelons Paper Plant Protectors Planting Conclusion Strawberries Planting Your Strawberries Mulching Strawberries. Propagation Feeding Strawberries Protecting Your Strawberries. Growing Strawberries in Barrels Citrus fruits Sweet Oranges Blood oranges Growing Oranges Planting Oranges From Seeds Propagation of the Tree How Far Should You Plant Trees? Orange planting in a Nutshell. Pruning Pruning for Rejuvenation Flowers and Fruit Setting How to Get a Good Harvest Uses of the Rind Storing of Oranges Enemies of Oranges Conclusion Natural Remedies Cures by Oranges Pain in the chest – Constipation Nausea Swelling in Your Belly? Tomatoes Sowing of Seeds OLIVES Growing Olives Olive Propagation Popular Varieties Table and Mill Olives Soil Conditions Soil Moisture Pruning Harvesting of the Fruit Olives for Taste Extracting Olive Oil Conclusion STRAWBERRIES Planting Strawberries Straw and Sedge Peat Mulch Selecting the Right Plants Feeding Your Plants Protecting Your Strawberries Strawberry Pests and Diseases Aphids – Fungi and Viruses – Soil pests – Popular Strawberry Varieties Remontant Strawberries Climbing Strawberries – Innovative Ways of Growing Strawberries Polythene Covered Frames Traditional Gardening Soil Mix The Best Organic Fertilizer/Compost Base Conclusion Author Bio Publisher Introduction When Mother Nature blessed the new born earth with life forms milleniums ago, the diversity of one celled creatures took up different lines of evolution due to climatic changes and mutations. That is when plant life evolved along with animal life. And that is how the surface of the earth was covered with lush fruitful vegetation, which flourished and evolved in different climates.",N/A,N/A,en
Dream Plants for the Natural Garden,"['Henk Gerritsen', 'Piet Oudolf']",2000,['Gardening'],"This new collaboration between Dutch landscapers guides the reader in the selection of over 1,200 plants most suitable for Oudolf's New Wave naturalism, emphasizing the importance of plant structures in providing all-season interest, and more. 262 photos & illustrations.",N/A,N/A,en
Soils and Human Health,"['Eric C. Brevik', 'Lynn C. Burgess']",2016-10,[],"Despite the connections between soils and human health, there has not been a great amount of attention focused on this area when compared to many other fields of scientific and medical study. Soils and Human Health brings together authors from diverse fields with an interest in soils and human health, including soil science, geology, geography, biology, and anthropology to investigate this issue from a number of perspectives. The book includes a soil science primer chapter for readers from other fields, and discusses the ways the soil science community can contribute to improving our understanding of soils and human health. Features Discusses ways the soil science community can contribute to the improvement of soil health Approaches human health from a soils-focused perspective, covering the influence of soil conservation and contact with soil on human health Illustrates topics via case studies including arsenic in groundwater in Bangladesh; the use of Agent Orange in Vietnam; heavy metal contamination in Shipham, United Kingdom and Omaha, Nebraska, USA; and electronic waste recycling in China. In a scientific world where the trend has often been ever-increasing specialization and increasingly difficult communication between fields and subfields, the interdisciplinary nature of soils and human health studies presents a significant challenge going forward. Fields with an interest in soils and human health need to have increased cross-disciplinary communication and cooperation. This book is a step in the direction of accessibility and innovation, elucidating the state of knowledge in the meeting of soil and health sciences, and identifying places where more work is needed.",N/A,N/A,en
The History of Gardens,['Christopher Thacker'],1985-10-22,['Gardening'],"""Christopher Thacker tells the history of gardens from their origins in the 'natural' paradises of Greek myth to the present day. Studying individual gardens or garden topics which are representative of an age or region, he builds up a comprehensive survey of the gardens and garden theories of an era""--",2,N/A,en
Introduction to Cucurbits,"['Dueep Jyot Singh', 'John Davidson']",2016-03-17,['Gardening'],"Table of Contents Introduction Cucumbers Soil Requirements Planting Cucumbers Planting in “Hills” Harvesting Pumpkin Pumpkins Sowing Harvesting Pumpkin Curing and Storage Watermelons Soil Requirements and Climate Watermelon Planting Harvesting Muskmelons Paper Plant Protectors Planting Conclusion Author Bio Publisher Introduction The Cucurbita family is one of the largest and most popular groups of summer vegetables grown all over the world. Come summer, and you are going to see the gardens flourishing with watermelons, musk melons, cucumbers, gourds, pumpkins, squashes, and other large number of trailing vegetables.",N/A,N/A,en
The Amateur Garden,['George Washington Cable'],1914,['Gardening'],N/A,N/A,N/A,en
The Magic Lantern,[],2020,['Animal welfare'],Graves & Ellis was located at 20 Cornhill between 1868 and 1872. In beige publisher's cloth binding with chromolithographed pictorial label on front cover. One of at least twelve titles with this binding issued by Graves & Ellis.,N/A,N/A,en
Sunset Western Garden Book,['Sunset Books'],1995,['Gardening'],"This completely revised edition of the Western garden book includes more than 2,000 new plant entries, all new maps for Alaska, Hawaii, and southwest Canada. The book contains full-color photos and practical tips for successful Western gardening from Sunset gardening editors and also features information on the latest gardening tools and gear.",N/A,N/A,en
Italian Villas and Their Gardens,['Edith Wharton'],2018-10-16,[],"This work has been selected by scholars as being culturally important and is part of the knowledge base of civilization as we know it. This work is in the public domain in the United States of America, and possibly other nations. Within the United States, you may freely copy and distribute this work, as no entity (individual or corporate) has a copyright on the body of the work. Scholars believe, and we concur, that this work is important enough to be preserved, reproduced, and made generally available to the public. To ensure a quality reading experience, this work has been proofread and republished using a format that seamlessly blends the original graphical elements with text in an easy-to-read typeface. We appreciate your support of the preservation process, and thank you for being an important part of keeping this knowledge alive and relevant.",N/A,N/A,en
An Agricultural Testament,['Albert Howard'],2021-04,[],"Why is there a cow on the front cover of this book? This is a book about agriculture, and farm animals have become unfashionable in some quarters. Cows, it turns out, are responsible for global warming, climate change, and so, no doubt, rising sea levels and chemtrails. But any real farmer, from any time in history, knows that this is not true. Animals have been around forever. Animals are a vital part of an insanely complex living system. Anyone who knows the basics of regenerative agriculture understands this. Albert Howard spent years studying and using the methods of traditional Asian agriculture, and shows in this book that the fertility and health of the soil depend on humus, in the production of which animal materials play an vital role. A healthy soil needs animal inputs. Animals in agriculture are central; they're right in there with fungi. This message is not welcomed by those who would feed the modern world a diet of plant-based, lab-grown food substitutes that have lists of ingredients as long as your arm, and are going to save the planet using gene-spliced soybeans and 3D printed pizzas. So, the cow and her calf are on the cover to redress the balance, and also to feature as one of the stars of this book (along with sugar cane, waste pits, and public servants). She was the photogenic one. Albert Howard's text has been thoroughly re-edited in this new version of his book. The habit, common at the time, of using long paragraphs is not preferred by modern readers, so the text has been extensively 'reparagraphed'. Grammar has been tweaked, and styles have been adopted. Headings have been added, infinitives unsplit. The changes made have been to make things more comfortable for modern eyes and tastes. The sense and intention of the author has not been altered at all, of course. We hope that Albert Howard would approve of this reworking of his book. His ideas are more important than ever. Wendell Berry wrote in The Last Whole Earth Catalog ""Howard's discoveries and methods, and their implications, are given in detail in An Agricultural Testament. They are of enormous usefulness to gardeners and farmers, and to anyone who may be interested in the history and the problems of land use. But aside from its practical worth, Howard's book is valuable for his ability to place his facts and insights within the perspective of history. This book is a critique of civilisations, judging them not by their artefacts and victories, but by their response to the sacred duty of handing over to the next generation, unimpaired, the heritage of a fertile soil.""",N/A,N/A,en
National Geographic Complete Guide to Herbs and Spices,['Nancy J. Hajeski'],2016-03,['Cooking'],Offers everything you need to know about how herbs and spices can enhance your cooking and improve your life.,5,N/A,en
