title,authors,publishedDate,categories,description,averageRating,textSnippet,language
A Simple Non-Euclidean Geometry and Its Physical Basis,['I.M. Yaglom'],1979-02-28,['Gardening'],"There are many technical and popular accounts, both in Russian and in other languages, of the non-Euclidean geometry of Lobachevsky and Bolyai, a few of which are listed in the Bibliography. This geometry, also called hyperbolic geometry, is part of the required subject matter of many mathematics departments in universities and teachers' colleges-a reflec tion of the view that familiarity with the elements of hyperbolic geometry is a useful part of the background of future high school teachers. Much attention is paid to hyperbolic geometry by school mathematics clubs. Some mathematicians and educators concerned with reform of the high school curriculum believe that the required part of the curriculum should include elements of hyperbolic geometry, and that the optional part of the curriculum should include a topic related to hyperbolic geometry. I The broad interest in hyperbolic geometry is not surprising. This interest has little to do with mathematical and scientific applications of hyperbolic geometry, since the applications (for instance, in the theory of automorphic functions) are rather specialized, and are likely to be encountered by very few of the many students who conscientiously study (and then present to examiners) the definition of parallels in hyperbolic geometry and the special features of configurations of lines in the hyperbolic plane. The principal reason for the interest in hyperbolic geometry is the important fact of ""non-uniqueness"" of geometry; of the existence of many geometric systems.",N/A,N/A,en
Secrets of Wildflowers,['Jack Sanders'],2014-05-06,['Nature'],"Now available in paperback, The Secrets of Wildflowers is destined to be an indispensable book for anyone who loves and admires the natural world. Few things in nature beautify the world more than wildflowers. Their countless colors and endless designs are found almost anywhere—from fields to woods, deserts to ponds, and even in junkyards, dumps, and cracks in the pavement. The Secrets of Wildflowers, Jack Sanders’s colorful tribute, is bursting with odd facts and wonderful superstitions about some of North America’s most beautiful and common plants. Reader's will find natural history, folklore, habitats, horticulture, ingenious uses past and present, origins of names, and even their literary pedigrees. Far richer and eminently more varied than any field guide, The Secrets of Wildflowers contains more than 100 species of North American wildflowers organized by blooming seasons. Wildflowers are not just pretty to look at; they are an essential part of our environment. How they grow and what they do are often overlooked, and how they have been used has largely been forgotten. They feed insects, birds, animals, and even humans. They hold and condition the soil, and they are used in modern medicines and natural remedies and appear throughout history in art and literature. The Secrets of Wildflowersprovides detailed information on more than one hundred representative species of North American wildflowers.",N/A,N/A,en
Ulysses by James Joyce,['James Joyce'],2020-11-03,[],"The Original 1922 Edition. Unabridged. Ulysses chronicles the peripatetic appointments and encounters of Leopold Bloom in Dublin in the course of an ordinary day, 16 June 1904. Ulysses is the Latinised name of Odysseus, the hero of Homer's epic poem Odyssey, and the novel establishes a series of parallels between the poem and the novel, with structural correspondences between the characters and experiences of Leopold Bloom and Odysseus, Molly Bloom and Penelope, and Stephen Dedalus and Telemachus, in addition to events and themes of the early twentieth-century context of modernism, Dublin, and Ireland's relationship to Britain. The novel imitates registers of centuries of English literature and is highly allusive. Since publication, Ulysses has attracted controversy and scrutiny, ranging from early obscenity trials to protracted textual ""Joyce Wars"". Ulysses' stream-of-consciousness technique, careful structuring, and experimental prose - full of puns, parodies, and allusions - as well as its rich characterization and broad humor, made the book a highly regarded novel in the modernist pantheon. Joyce fans worldwide now celebrate 16 June as Bloomsday. In 1998, the American publishing firm Modern Library ranked Ulysses first on its list of the 100 best English-language novels of the 20th century.",N/A,N/A,en
Kew,['Peter Høeg'],1995,['Fiction'],Chilling tale of oppression and rebellion in a Danish school for disturbed children. By the author of M̀iss Smilla's feeling for snow'.,N/A,N/A,en
Popular Deciduous and Evergreen Trees,['Franklin Reuben Elliott'],2008-11-11,['Gardening'],Franklin Elliott provides readers with a practical guide to landscaping with popular deciduous and evergreen plants.,N/A,N/A,en
Succulents,"['John Bagnasco', 'Bob Reidmuller Jr.']",2019-10-29,['Gardening'],"Loved the world over for their unique beauty and lower maintenance requirements, this gift-able edition of Succulents shows you how to choose and take care of the ever-popular succulent. Cactuses and other succulents are wildly popular in homes the world over, regardless of climate. They're resilient, beautiful, and easy to care for as long as you know what you're doing. Whether you live in a warm, dry climate and want to grow a whole cactus garden outdoors or you'd like to add one of these alluring species to your indoor windowsill, this book has what you need to pick the perfect plants for you and make them thrive. With this all-inclusive guide, you'll get all the information you'll need on: Color combinations Sizes and shapes Container growing Watering Grooming Propagation Learn everything you need to know about succulents! Includes more than 100 plant profiles with corresponding color photography, with details that will help you succeed in gardening prickly and waxy varieties of all kinds.",N/A,N/A,en
Miraculous Abundance,"['Perrine Herve-Gruyer', 'Charles Herve-Gruyer']",2016-03-14,['Gardening'],"“Farmers like Charles and Perrine Hervé-Gruyer [are] beacons of light. Their work allows the rest of the world to see that there is another life, there is another way.”—Eliot Coleman What began as a simple dream has turned into one of the world’s most radical, innovative experiments in small-scale farming—using the Bec Hellouin model for growing food, sequestering carbon, creating jobs, and increasing biodiversity without using fossil fuels When Charles and Perrine Hervé-Gruyer set out to create their farm in a historic Normandy village, they had no idea just how much their lives would change. Neither one had ever farmed before. Charles had been traveling the globe teaching students about ecology and indigenous cultures. Perrine had been an international lawyer in Japan. Their farm Bec Hellouin has since become an internationally celebrated model of innovation in ecological agriculture. Miraculous Abundance is the eloquent tale of the couple’s quest to build an agricultural model that can carry us into a post-carbon future. The authors dive deeper into the various farming methods across the globe that contributed towards the creation of the Bec Hellouin model, including: Permaculture and soil health principles Korean natural farming methods Managing a four-season farm Creating a productive agroecosystem that is resilient and durable Using no-dig methods for soil fertility Modelling an agrarian system that supports its community in totality; from craft, restaurants and shared work spaces to jobs, agritourism, energy and ecological biodiversity Perfect for aspiring and experienced farmers, gardeners, and homesteaders, Miraculous Abundance is a love letter to a future where ecological farming is at the centre of every community. “This book, more about philosophy than a how-to, describes how two inexperienced beginners succeeded in creating a gorgeous, productive, self-sustaining farm.”—Marion Nestle",N/A,N/A,en
RHS Encyclopedia Of Plants and Flowers,['Christopher Brickell'],2019-10-03,['Nature'],"An updated edition of the best-selling highly illustrated garden plant reference, featuring more than 8,000 plants and 4,000 photographs. Choose the right plants for your garden and find all the inspiration and guidance you need with The RHS Encyclopedia of Plants & Flowers. Drawing on expert advice from the RHS, this best-selling ebook features a photographic catalogue of more than 4,000 plants and flowers, all organised by colour, size, and type, to help you select the right varieties for your outdoor space. Discover perennials, bulbs, shrubs, and trees, succulents, and ornamental shrubs, all showcased in beautiful, full-colour photography. Browse this photographic catalogue to find at-a-glance plant choice inspiration. Or use the extensive plant dictionary to look up more than 8,000 plant varieties and the best growing conditions. This new edition features the latest and most popular cultivars, with more than 1,400 new plants added, as well as updated photography, comprehensive hardiness ratings, and a brand-new introduction. Fully comprehensive yet easy to use, the RHS Encyclopedia of Plants & Flowers is the inspirational, informative guide every gardener needs on their bookshelf.",N/A,N/A,en
Garden by the Sea,['Mercè Rodoreda'],2020,['Fiction'],A Gatsby-esque novel about Spain in the 1920s on the eve of the Spanish Civil War,N/A,N/A,en
The Biology and Cultivation of Edible Mushrooms,"['Shu-ting Chang', 'W. A. Hayes']",1978,['Gardening'],N/A,N/A,N/A,en
The Dictionary of Science for Gardeners,['Michael Allaby'],2015-09-05,['Gardening'],"A Library Journal Best Reference Pick of 2015! Every gardener is a scientist. Pollination, native plants, ecology, climatology—these are just a few of the scientific concepts that play a key role in a successful garden. While the ideas are intuitive to many gardeners, they are often discussed in unfamiliar scientific terms. The Dictionary of Science for Gardeners is the first of its kind to provide practical scientific descriptions for gardening terms. Highlighting 16 branches of science that are of particular interest to gardeners, with entries from abaptation to zoochory, Michael Allaby explores more than 6,000 terms in one easy-to-use reference.",N/A,N/A,en
Fundamentals of Turfgrass Management,"['Nick E. Christians', 'Aaron J. Patton', 'Quincy D. Law']",2016-10-24,['Gardening'],"FUNDAMENTALS OF TURFGRASS MANAGEMENT THE PREMIER TURFGRASS MANAGEMENT HANDBOOK—UPDATED AND EXPANDED Fundamentals of Turfgrass Management is the longstanding authority on all aspects of the science and practices behind world-class turfgrass care. This fully revised Fifth Edition comes enriched by two new authors who share their cutting-edge research and real-world expertise on such topics as growth, soil testing, nutrition, herbicides, insecticides, and fungicides. Coverage throughout is refreshed with new illustrations and charts, as well as: Expanded coverage on professional lawn care programs, including cool-season and warm-season turfgrasses, establishing methods and costs, cultivation, sand topdressing, and more Enhanced material on the most up-to-date thinking and practices in weed management Brand-new chapters on the environmental, economic, and quality-of-life benefits of well-maintained turf, as well as the influence of light on turf health Whether you’re earning a degree or a paycheck, Fundamentals of Turfgrass Management, Fifth Edition remains the most complete, respected guidebook of solutions for developing and maintaining the finest-standards of turfgrass.",N/A,N/A,en
Dracula by Bram Stoker,['Bram Stoker'],2020-11-24,[],"During a business visit to Count Dracula's castle in Transylvania, a young English solicitor finds himself at the center of a series of horrifying incidents. Jonathan Harker is attacked by three phantom women, observes the Count's transformation from human to bat form, and discovers puncture wounds on his own neck that seem to have been made by teeth. Harker returns home upon his escape from Dracula's grim fortress, but a friend's strange malady -- involving sleepwalking, inexplicable blood loss, and mysterious throat wounds -- initiates a frantic vampire hunt. The popularity of Bram Stoker's 1897 horror romance is as deathless as any vampire. Its supernatural appeal has spawned a host of film and stage adaptations, and more than a century after its initial publication, it continues to hold readers spellbound.",N/A,N/A,en
The Secret Garden,['Frances Hodgson Burnett'],2010,"[""Children's stories""]","A newly illustrated edition of this classic tale by one of Australia's greatest children's book illustrators. ""When Mary Lennox was sent to Misselthwaite Manor to live with her uncle everybody said she was the most disagreeable looking child ever seen."" So begins Frances Hodgson Burnett's classic, regarded as one of the best children's books of the 20th century. The story of a spoilt, neglected and sickly young girl, who comes to the home of Mr Craven, her widowed and grieving uncle, The Secret Garden was first serialised for adults in The American Magazine before its publication in book form in 1911. The Secret Garden is a walled, overgrown paradise, its roses abandoned since the death of Mr Craven's wife. Mary is led to its ivy-covered door by a robin, and with the help of a servant's son, Dickon, begins to tend it. Her petulance mellows, and the garden also helps to bring the transformation of wheelchair-bound and tantrum-throwing Colin, the son that Craven keeps hidden away - and of the uncle himself. In this edition, beautifully illustrated by award-winning Robert Ingpen, the full and unabridged text is accompanied by hand drawings that bring the garden, and the young people it touches, back into bloom.",N/A,N/A,en
How to Grow Mushrooms in Your Garden,"['M. Usman', 'John Davidson']",2017-10-07,['Nature'],"Table of Contents Introduction Benefits of Mushrooms Health Benefits of Mushrooms Other Beneficial Uses of Mushrooms How Mushrooms Grow Places One Can Grow Mushrooms Outdoor mushroom growing Preparation of logs and stumps in your Courtyard Medium for fungal preparation Stump drilling Spawn run Courtyard Preparation Procedures Courtyard Garden Patch Preparation of a chip bed Inoculation Watering Harvesting Spore Harvesting From Mushrooms Spore Harvesting From Mushrooms Spore Collection Techniques Spore syringe Poisonous, Toxic & Psychoactive Mushrooms Toxic/Poisonous mushrooms Psychoactive Mushrooms Myths about Mushroom Picking Family features of Different Mushroom Species Miscellaneous Information on Mushrooms Conclusion Author Bio Publisher Introduction Thank you for acquiring this book. It is the hope of the author that with this gardening guide, readers will be equipped with the necessary knowledge and information to establish and manage a courtyard mushroom plot. Truth be told, not everyone you will meet, will appreciate the value of mushrooms the way you do. Also, this isn't just because of ignorance; the truth is that most people do not know or have not yet heard of the countless benefits of mushrooms‐ For example; do you know that there are certain species of mushrooms that can produce dyes? Being a fungus, not all mushrooms are edible; furthermore, the different species of mushrooms that are edible also produce different effects in the human body after consumption. Nowadays mushrooms are utilized extensively by chefs all over the world when preparing cuisines or dishes. Mushrooms are also becoming a commodity of interest in most groceries as well as supermarkets and farmer's markets. Poisonous and toxic varieties of mushrooms have been discussed in order to educate the reader on the dangers that they pose if eaten. Moreover, those with psychoactive properties have also been discussed. In view of the last statement, please note that some jurisdictions do not allow the cultivation of certain mushroom species, so if you are interested in growing a particular species, make sure that you verify with the local administration. Lastly, this mushroom farming guide has been written to enlighten both the readers who just seek for information as well as those who actually want to practice mushroom farming. It has been written in a casual yet decent manner in order to keep the reader entertained as well as informed. Enjoy!",N/A,N/A,en
Introduction to Plant Science,['R. O. Parker'],2004,['Gardening'],"This revised text provides a comprehensive introduction to the fascinating world of plant science. From the basic requirements for plant growth, to genetic engineering and biotechnology, this easy- to- understand book is ideal for the high school level agriscience curriculum or college freshman level plant science course. Students will learn about the origins of cultivated plants, structure and anatomy, photosynthesis, respiration, propagation, production of major agronomic crops, and more.",N/A,N/A,en
Fruitful Sites,['Craig Clunas'],1996,['Architecture'],1.- The Fruitful Garden 2.- The Aesthetic Garden 3.- The Gardens of the Wen Family 4.- The Represented Garden 5.- The Landcape of Number.,N/A,N/A,en
Encyclopedia of Herbs & Their Uses,['Deni Bown'],1995,['Gardening'],"Describes and pictures a thousand herbs found both in the wild and in cultivation, and provides tips on growing and harvesting, herb gardens, and herbs in cooking and medicine.",N/A,N/A,en
Rodale's Illustrated Encyclopedia of Herbs,"['Claire Kowalchik', 'William H. Hylton']",1998-01-15,['Gardening'],"Provides information on the history, uses, range, and characteristics of more than one hundred herbs, and offers tips on growing them",4.5,N/A,en
Planting a Rainbow,['Lois Ehlert'],2003,['Juvenile Nonfiction'],A mother and child plant a rainbow of flowers in the family garden.,N/A,N/A,en
RHS Weeds,"['Gareth Richards', 'Royal Horticultural Society']",2021-06-24,['Gardening'],"The Times Top 10 Gardening Books 2021 Gardens Illustrated Books of the Year 2021 RHS Weeds gathers together 50 untamed and beautifully wild plant species, illustrated with exquisite botanical images. These subversive species no longer need to be seen as 'plants out of place'. In the modern garden, where harmony with nature and the ability to thrive under challenging conditions are key, weeds are finally getting their moment in the sun. RHS Weeds highlights the delicate charms of some of the most fascinating vagabond plants around. Beautiful botanical illustrations, including many from the Royal Horticultural Society's collections, and captivating profiles by RHS author Gareth Richards, provide key information for the modern gardener on the characteristics, usefulness and cultivation of these unsung heroes of the plant world.",N/A,N/A,en
Edible Wild Plants,"['Thomas S. Elias', 'Peter A. Dykeman']",1990,['Cooking'],"A season-by-season guide to identifying, harvesting, and preparing over 200 healthful plants from the wild.",N/A,N/A,en
The Effects of Cross and Self Fertilisation in the Vegetable Kingdom,['Charles Darwin'],2017-01-23,[],"Mimulus luteus; height, vigour, and fertility of the crossed and self-fertilised plants of the first four generations.--Appearance of a new, tall, and highly self-fertile variety.--Offspring from a cross between self-fertilised plants.--Effects of a cross with a fresh stock.--Effects of crossing flowers on the same plant.--Summary on Mimulus luteus.--Digitalis purpurea, superiority of the crossed plants.--Effects of crossing flowers on the same plant.--Calceolaria.--Linaria vulgaris.--Verbascum thapsus.--Vandellia nummularifolia.--Cleistogene flowers.--Gesneria pendulina.--Salvia coccinea.--Origanum vulgare, great increase of the crossed plants by stolons.--Thunbergia alata.",N/A,N/A,en
Road and Home,[],19??,['Australian periodicals'],N/A,N/A,N/A,en
"Grow It, Heal It","['Christopher Hobbs', 'Leslie Gardner']",2013-05-21,['Gardening'],"Explains the healing power of plants, provides tips on growing and storing herbs, and discusses how to make teas, tinctures, salves, and poultices.",N/A,N/A,en
Introduction to the Bean Family - Growing Beans in Your Garden Organically,"['Dueep Jyot Singh', 'John Davidson']",2016-03-08,['Gardening'],"Table of Contents Introduction Cultivating Beans Using Poles Lima Beans Climatic requirements Planting Harvesting Broad Beans Planting and Cultivation Harvesting Soybeans French Beans String Beans and String Less Beans Planting Mung Beans Mung Beans Sprouts – How to Make Sprouts Bean Harvesting Tips Conclusion Author Bio Publisher Introduction The moment one talks about beans, one immediately has a mental picture of beans on toast, roasted beans, fried beans, baked beans…. These beans are different from the beans which we are going to grow in our garden. They belong to the Phaseolus family and are also called lentils in many parts of the world. French beans belong to this family. Also, there are the other beans, which come under the legume beans category. These green beans – legumes- are members of the Bean and Pea family (Leguminoseae). These can easily be grown in your garden to provide your family with lots of good, natural and nutritious food.",N/A,N/A,en
The Poetics of Gardens,"['Charles W. Moore', 'William John Mitchell', 'William Turnbull (Jr.)']",1988,['Architecture'],"This is an entirely different garden book: a pattern book in which a score of landscapes and gardens are drawn, described, and analyzed not just as a bouquet of pleasures but as sources, lodes to be mined for materials, shapes and relationships, and ideas for transforming our own backyards. There is a universality about the creation of gardens across time and in diverse cultures that has inspired this entirely different garden book: a playful and affectionate typology of gardens; a pattern book in which a score of landscapes and gardens are drawn, described, and analyzed not just as a bouquet of pleasures but as sources, lodes to be mined for materials, shapes and relationships, and ideas for transforming our own backyards. The Poetics of Gardens is a celebration of places and the gardens they can become. Most of the 500 sketches, axonometric drawings, and photographs were created especially for this book. They explore the special qualities of places and the acts that can transform them into gardens. The authors discuss the qualities that create the promise of a garden the shapes of land and water, the established plants, the light and wind, the climate and show how these can be organized to give a place a special meaning. And they pay particular attention to the ""rituals of habitation"" by which we imaginatively take possession of places on the surface of the earth. The Poetics of Gardens examines great gardens made in other places, with other climates, at other times from ancient Rome to modem England, from Ball to Botany Bay, from the court of Ch'ien Lung to the magic kingdom of Walt Disney to explore their devices and record their images, scents, and sounds. The authors discuss the adaptation of the great garden traditions of the past to North American soil and call together the creators of these gardens to speculate about how their patterns and ideas can be appropriated, transformed, and composed into places that come alive for us.",4,N/A,en
The Well-Tended Perennial Garden,['Tracy DiSabato-Aust'],2006-07-24,['Gardening'],"With more than 180,000 copies sold since its original publication, The Well-Tended Perennial Garden has proven itself to be one of the most useful tools a gardener can have. Now, in this expanded edition, there's even more to learn from and enjoy. This is the first, and still the most thorough, book to detail essential practices of perennial care such as deadheading, pinching, cutting back, thinning, disbudding, and deadleafing, all of which are thoroughly explained and illustrated. More than 200 new color photographs have been added to this revised edition, showing perennials in various border situations and providing images for each of the entries in the A-to-Z encyclopedia of important perennial species. In addition, there is a new 32-page journal section, in which you can enter details, notes, and observations about the requirements and performance of perennials in your own garden. Thousands of readers have commented that The Well-Tended Perennial Garden is one of the most useful and frequently consulted books in their gardening libraries. This new, expanded edition promises to be an even more effective ally in your quest to create a beautiful, healthy, well-maintained perennial garden.",N/A,N/A,en
Totality and Infinity,['Emmanuel Levinas'],1980-02-29,[],N/A,N/A,N/A,en
The Subtropical Garden ...,['William Robinson (F.L.S.)'],1871,['Gardening'],N/A,N/A,N/A,en
