title,authors,publishedDate,categories,description,averageRating,textSnippet,language
Zoo,"['Eric Baratay', 'Elisabeth Hardouin-Fugier']",2004,['Gardening'],"Wild animals have fascinated human observers since time immemorial. The story of our interest in collecting, classifying and dominating Nature so that its inner workings could be understood also looms large in the history of science, and thus it is surprising that the history of menageries, zoological gardens and the zoo as we know it today has been so poorly documented. This gap is addressed by Zoo, a comprehensive history of the zoo in the Western world.",N/A,N/A,en
Floriography,['Jessica Roux'],2020-09-15,['Reference'],"A charming, gorgeously illustrated botanical encyclopedia for your favorite romantic, local witch, bride-to-be, or green-thumbed friend. Floriography is a full-color guide to the historical uses and secret meanings behind an impressive array of flowers and herbs. The book explores the coded significances associated with various blooms, from flowers for a lover to flowers for an enemy. The language of flowers was historically used as a means of secret communication. It soared in popularity during the 19th century, especially in Victorian England and the U.S., when proper etiquette discouraged open displays of emotion. Mysterious and playful, the language of flowers has roots in everything from the characteristics of the plant to its presence in folklore and history. Researched and illustrated by popular artist Jessica Roux, this book makes a stunning display piece, conversation-starter, or thoughtful gift.",N/A,N/A,en
On the Various Contrivances by Which British and Foreign Orchids are Fertilised by Insects,['Charles Darwin'],1862,['Gardening'],This 1862 publication describes the flower structure of orchids and their pollination to illustrate aspects of Darwin's evolutionary theory.,N/A,N/A,en
The European Garden Flora Flowering Plants,"['James Cullen', 'Sabina G. Knees', 'H. Suzanne Cubey', 'J. M. H. Shaw']",2011-08-11,['Gardening'],"The European Garden Flora is the definitive manual for the accurate identification of cultivated ornamental flowering plants. Designed to meet the highest scientific standards, the vocabulary has nevertheless been kept as uncomplicated as possible so that the work is fully accessible to the informed gardener as well as to the professional botanist. This new edition has been thoroughly reorganised and revised, bringing it into line with modern taxonomic knowledge. Although European in name, the Flora covers plants cultivated in most areas of the United States and Canada as well as in non-tropical parts of Asia and Australasia. Volume 2 contains accounts of the first 71 families of Dicotyledons, including the Aizoaceae and Cactaceae (large and important families of succulents), as well as many tree families (Juglandaceae, Betulaceae, Fagaceae, Ulmaceae) and popular herbaceous plants (Ranunculaceae, Papaveraceae, Cruciferae).",N/A,N/A,en
"Magazine of Horticulture, Botany and All Useful Discoveries and Improvements in Rural Affairs",['Charles Mason Hovey'],1841,['Botany'],N/A,N/A,N/A,en
Thérèse Raquin,['Émile Zola'],2020-12-10,[],"Dingy apartment on the Passage du Pont-Neuf in Paris, Thérèse Raquin is trapped in a loveless marriage to her sickly cousin, Camille. The numbing tedium of her life is suddenly shattered when she embarks on a turbulent affair with her husband's earthy friend Laurent, but their animal passion for each other soon compels the lovers to commit a crime that will haunt them forever. Thérèse Raquin caused a scandal when it appeared in 1867 and brought its twenty-seven-year-old author a notoriety that followed him throughout his life. Zola's novel is not only an uninhibited portrayal of adultery, madness, and ghostly revenge, but also a devastating exploration of the darkest aspects of human existence.",N/A,N/A,en
"The Magazine of Horticulture, Botany, and All Useful Discoveries and Improvements in Rural Affairs",[],1841,['Fruit-culture'],N/A,N/A,N/A,en
The Legacy of Tethys,"['F.D. Por', 'Chanan Dimentman']",1989-10-31,['Gardening'],"This book is an attempt to present a comprehensive view on the aquatic biogeog raphy of a small but very dynamic and complex area of the globe. Luckily, this area, called here the Levant, has attracted much interest in the past and is being increasingly studied in the present. The interphasing between the knowledge of the historical and formative processes and that of the recent distributional aspects is fairly good. The recent years saw also a widening effort which expressed itself in several symposia and monographic books. Therefore I considered it possible to treat the whole subject of the aquatic biogeography of the Levant singlehandedly rather than in the presently widespread manner of an edited book. I am keenly conscious of the shortcommings of my approach of presenting much second-hand information. Possibly this is being compensated by the fact that this book has a more coherent structure and eventually a clearer scientific message. The effort spent in synthesizing the data from the widely different sources hopefully pays off in a presentation which is more easily comprehended by the average reader. For the suspicious reader, I would recommend to read first the closing chapter of this book in which the quintescence of this book and its message is presented in a summariz ing manner.",N/A,N/A,en
Concepts & Images,['Arthur Lee Loeb'],1993,['Art'],"1. Introduction . 1 2. Areas and Angles . . 6 3. Tessellations and Symmetry 14 4. The Postulate of Closest Approach 28 5. The Coexistence of Rotocenters 36 6. A Diophantine Equation and its Solutions 46 7. Enantiomorphy. . . . . . . . 57 8. Symmetry Elements in the Plane 77 9. Pentagonal Tessellations . 89 10. Hexagonal Tessellations 101 11. Dirichlet Domain 106 12. Points and Regions 116 13. A Look at Infinity . 122 14. An Irrational Number 128 15. The Notation of Calculus 137 16. Integrals and Logarithms 142 17. Growth Functions . . . 149 18. Sigmoids and the Seventh-year Trifurcation, a Metaphor 159 19. Dynamic Symmetry and Fibonacci Numbers 167 20. The Golden Triangle 179 21. Quasi Symmetry 193 Appendix I: Exercise in Glide Symmetry . 205 Appendix II: Construction of Logarithmic Spiral . 207 Bibliography . 210 Index . . . . . . . . . . . . . . . . . . . . 225 Concepts and Images is the result of twenty years of teaching at Harvard's Department of Visual and Environmental Studies in the Carpenter Center for the Visual Arts, a department devoted to turning out students articulate in images much as a language department teaches reading and expressing one self in words. It is a response to our students' requests for a ""handout"" and to l our colleagues' inquiries about the courses : Visual and Environmental Studies 175 (Introduction to Design Science), YES 176 (Synergetics, the Structure of Ordered Space), Studio Arts 125a (Design Science Workshop, Two-Dimension al), Studio Arts 125b (Design Science Workshop, Three-Dimensional),2 as well as my freshman seminars on Structure in Science and Art.",N/A,N/A,en
Globalization in World History,['Peter N. Stearns'],2009-10-20,['Gardening'],"Globalization in World History & nbsp;examines major changes in global interactions from 1000 CE onward, and defines four major turning points that have accelerated the process of globalization. It argues that although the term is a relatively new one, the process of globalization has roots much further back in time",N/A,N/A,en
Encyclopedia of House Plants,['Nico Vermeulen'],1999,['Gardening'],"First Published in 1999. Routledge is an imprint of Taylor & Francis, an informa company.",N/A,N/A,en
The Origin of Cultivated Plants,['Alphonse de Candolle'],2011-11-03,['Gardening'],A reprint of the classic investigation tracing the origins of the plants cultivated by humans.,N/A,N/A,en
Vegetable Production,['Ib Libner Nonnecke'],1989,['Business & Economics'],"This is an up-to-date comprehensive text and reference on vegetable production in America and Canada for vegetable growers, handlers and marketers. Divided into three parts, this book discusses principles of vegetable production, explores the science and technology of vegetable crops (covering 12 major crop areas) and provides a glossary of terms used throughout. Nonnecke relates the most useful technology to each topic covered and emphasizes the key role of good husbandry as well as the opportunity for each region to deliver seasonably or year-round abundant, high-quality produce.",1.5,N/A,en
Crafting with Herbs,['Debbie Wolfe'],2021-03-16,['Crafts & Hobbies'],"Capture the beauty, fragrance, and power of herbs in these delightful crafts for home and garden. Why craft with herbs? They're easy to grow, beautiful, fragrant, full of health benefits, and are incredibly versatile! Herbs are best known for their medicinal and culinary uses, but there’s so much more you can do with them. From spray disinfectants to wreaths and garlands, custom herb salts to homemade skincare products, there's something here for every room of your house—and everyone on your gift list! Learn how to make beautiful and useful items such as: Smudge Sticks Herb Sachets Hanging Herbal Swag Natural Confetti Herbal Cleaning Vinegars Herb salts (with recipes for different blends) Herbal Teas Compound Herb Butter Lavender Neck Wrap Simple Herbal Balm And much more! In addition to the crafts, learn how to grow, prune, harvest, dry, and store your favorite herbs. Woven throughout are helpful tidbits on the wellness properties and history of herbs. Create useful crafts that will beautify your home and make wonderful DIY gifts!",N/A,N/A,en
Plants from Test Tubes,"['Holly Scoggins', 'Mark Bridgen']",2013-08-13,['Gardening'],This fully revised fourth edition features background information and instructions for growing plants from cell structure and tissue culture and is written in terms that can be easily understood by both hobby botanists and experienced commercial growers.,N/A,N/A,en
What a Plant Knows,['Daniel Chamovitz'],2020-10-06,['Science'],"Thoroughly updated from root to leaf, this revised edition of the groundbreaking What a Plant Knows includes new revelations for lovers of all that is vegetal and verdant. Plants can hear—and taste things, too! The renowned biologist Daniel Chamovitz builds on the original edition to present an intriguing look at how plants themselves experience the world—from the colors they see to the schedules they keep, and now, what they do in fact hear and how they are able to taste. A rare inside look at what life is really like for the grass we walk on, the flowers we sniff, and the trees we climb, What a Plant Knows offers a greater understanding of their place in nature.",N/A,N/A,en
The Planting Design Handbook,['Nick Robinson'],2020-09-10,['Architecture'],"Since the first edition was published in 1992, Nick Robinson's The Planting Design Handbook has been widely used as a definitive text on landscape architecture courses throughout the world. It remains one of the few titles written by a practicing landscape architect and educator who is also a horticulturalist and accomplished plantsman, and which deals with the application of planting design on a large scale in landscape architecture and urban design projects. The Planting Design Handbook is distinctive for its elegant integration of an ecological approach with an understanding of visual and spatial composition. It emphasizes the role of vegetation layers and designed plant communities in complex and diverse plant assemblages for all kinds of sites and uses. This expanded and comprehensively updated third edition still provides a complete examination of principles and practice of design for public, institutional and private landscapes. It takes account of developments in theory and practice, especially in the use of perennials, and reflects a variety of media and approaches current in landscape architecture and design. All chapters have been revised and re-written to ensure updated references and new references have been added. Many new photographs of planting and projects around the world have been included, with examples of current professional drawings to illustrate the design process. It is generously illustrated, including a colour section and the beautifully detailed line drawings of the Chinese architect and painter Jia-Hua Wu.",N/A,N/A,en
Gardens and Gardeners of the Ancient World,['Linda Farrar'],2016-02-29,['Social Science'],"From the earliest of times people have sought to grow and nurture plants in a garden area. Gardens and Gardeners of the Ancient World traces the beginning of gardening and garden history, from Ancient Egypt and Mesopotamia, to the Minoans and Mycenaeans, Greeks, Etruscans and Romans, through Byzantine, Islamic and Persian gardens right up to the Middle Ages. It shows how gardens in each period were designed and cultivated. Evidence for garden art and horticulture is gathered from surviving examples of ancient art, literature, archaeology, actual period gardens that have survived the centuries and the wealth of garden myths associated with certain plants. These sources bring ancient gardens and their gardeners back to life, and provide information on which plants were chosen as garden worthy, their setting and the design and appearance of ancient gardens. Deities associated with aspects of gardens and the garden's fertility are featured - everyone wanted a fertile garden. Different forms of public and domestic gardens are explored, and the features that you would find there; whether paths, pools, arbors and arches, seating or decorative sculpture. The ideal garden could be like the Greek groves of the Academy in Athens, a garden so fine that it was comparable with that of the mythical king Alcinoos, the paradise contemplated by the Islamic world, or a personal version of a garden of Eden that Early Christians could create for themselves or in the forecourt of their churches. In general books on garden history cover all periods up to the present, often placing all ancient gardens in one chapter at the beginning. But there is so much of interest to be found in these early millennia. Generously illustrated with 150 images, with plant lists for each period, this is essential reading for everyone interested in garden history and ancient societies.",N/A,N/A,en
The Tulip,['Anna Pavord'],2014-08-20,['Gardening'],"THE TULIP is not a gardening book. It is the story of a flower that has made men mad. Greed, desire, anguish and devotion have all played their part in the development of the tulip into the world-wide phenomenon it is today. No other flower has ever carried so much cultural baggage; it charts political upheavals, illuminates social behaviour, mirrors economic booms and busts, plots the ebb and flow of religious persecution. Pavord tells how the tulip arrived from Turkey and took the whole of Western Europe by storm. Sumptuously illustrated from a wide range of sources, this beautifully produced and irresistible volume will become a bible, a unique source book, a universal gift book and a joy to all who possess it.",N/A,N/A,en
"The New Organic Grower, 3rd Edition",['Eliot Coleman'],2018-09-26,['Gardening'],"“Updated for its 30th anniversary edition [this book] remains as relevant as ever.” —New York Times Book Review Since its original publication in 1989, The New Organic Grower has been one of the most important farming books available, with pioneer Eliot Coleman leading the charge in the organic movement in the United States. Now fully illustrated and updated, this 30th Anniversary Edition is a must-have for any agricultural library. Eliot Coleman’s books and innovative methods have helped innumerable organic farmers build successful farms in deep accordance with nature. The wisdom in this seminal book holds true even as the modern agricultural canon has grown—in large part due to Coleman’s influence as a wise elder with decades of experience. New information has been included in this edition to showcase the new tools and techniques that Eliot has been developing over the last thirty-five years. Inspired by the European intensive growers, The New Organic Grower, 30th Anniversary Edition, offers a very approachable and productive form of farming that has proven to work well for the earth and its stewards for centuries. Gardeners working on 2.5 acres or less will find this book especially useful, as it offers proof that small-scale market growers and serious home gardeners can live good lives close to the land and make a profit at the same time. The New Organic Grower is ideal for young farmers just getting started, or gardeners seeking to expand into a more productive enterprise. New material in this edition includes: Beautiful color photographs throughout, taken by master gardener and author Barbara Damrosch (Eliot’s wife and co-farmer) Updated information throughout on how Eliot’s practices have changed through his experiments over the years A new section from Damrosch about incorporating flowers on the small farm More information on new tools Eliot has invented that don’t appear in any of his other books “I was interested in the environment, farming, science . . . and there was Eliot’s book lying on the shelf. I remember grabbing it, and I just FELL IN. . . . I remember reading it like it was the Bible.”—Dan Barber, chef",N/A,N/A,en
The Resilient Gardener,['Carol Deppe'],2010-10-05,['Gardening'],"""The Resilient Gardener is so essential, timely and important, and I will recommend it to everyone I know. It doesn't matter if you garden or if you don't-this is practical wisdom good for humans to know.""—Deborah Madison, Author of Local Flavors and Vegetarian Cooking for Everyone Scientist/gardener Carol Deppe combines her passion for organic gardening with newly emerging scientific information from many fields — resilience science, climatology, climate change, ecology, anthropology, paleontology, sustainable agriculture, nutrition, health, and medicine. In the last half of The Resilient Gardener, Deppe extends and illustrates these principles with detailed information about growing and using five key crops: potatoes, corn, beans, squash, and eggs. In this book you’ll learn how to: •Garden in an era of unpredictable weather and climate change •Grow, store, and use more of your own staple crops •Garden efficiently and comfortably (even if you have a bad back) •Grow, store, and cook different varieties of potatoes and save your own potato seed •Grow the right varieties of corn to make your own gourmet-quality fast-cooking polenta, cornbread, parched corn, corn cakes, pancakes and even savory corn gravy •Make whole-grain, corn-based breads and cakes using the author’s original gluten-free recipes involving no other grains, artificial binders, or dairy products •Grow and use popbeans and other grain legumes •Grow, store, and use summer, winter, and drying squash •Keep a home laying flock of ducks or chickens; integrate them with your gardening, and grow most of their feed. The Resilient Gardener is both a conceptual and a hands-on organic gardening book, and is suitable for vegetable gardeners at all levels of experience. Resilience here is broadly conceived and encompasses a full range of problems, from personal hard times such as injuries, family crises, financial problems, health problems, and special dietary needs (gluten intolerance, food allergies, carbohydrate sensitivity, and a need for weight control) to serious regional and global disasters and climate change. It is a supremely optimistic as well as realistic book about how resilient gardeners and their vegetable gardens can flourish even in challenging times and help their communities to survive and thrive through everything that comes their way — from tomorrow through the next thousand years. Organic gardening, vegetable gardening, self-sufficiency, subsistence gardening, gluten-free living. ""The Resilient Gardener is brilliantly timely, and shows us how to create gardens that can survive our increasingly erratic weather, while supplying key nutrition lacking in most vegetable gardens. This book fills a critical niche, and I recommend it unreservedly.""—Toby Hemenway, author of Gaia's Garden: A Guide to Home-Scale Permaculture",5,N/A,en
New Naturalism,['Kelly D. Norris'],2021-02-16,['Gardening'],"Recreate the wild beauty and thriving ecology of meadows, prairies, woodlands, and streamsides in your own garden. In New Naturalism, horticulturist and modern plantsman Kelly D. Norris shares his inspiring, ecologically sound vision for home gardens created with stylish yet naturalistic plantings that mimic the wild spaces we covet—far from the contrived, formal, high-maintenance plantings of the past. Through a basic introduction to plant biology and ecology, you’ll learn how to design and grow a lush, thriving home garden by harnessing the power of plant layers and palettes defined by nature, not humans. The next generation of home landscapes don’t consist of plants in a row, pruned to perfection and reliant on pesticides, fertilizers, and herbicides to survive. Instead, today’s stunning landscapes convey nature’s inherent beauty. These gardens are imbued with romance and emotion, yet they have so much more to offer than their gorgeous aesthetics. Naturalistic garden designs, such as those featured in this groundbreaking new book, contribute to positive environmental change by increasing biodiversity, providing a refuge for wildlife, and reconnecting humans to nature. In the pages of New Naturalism you’ll find: Planting recipes for building meadows, prairies, and other grassland-inspired open plantings even in compact, urban settings Nature-inspired ways to upgrade existing foundation plantings, shrub beds, and flower borders to a wilder aesthetic while still managing the space Inspiration for taking sidewalk and driveway plantings and turning them into visually soft, welcoming spaces for humans and wildlife alike Ideas for turning shady landscapes into canopied retreats that celebrate nature Creative ways to make an ecologically vibrant garden in even the smallest of spaces New Naturalism approaches the planting beds around our homes as ecological systems. If properly designed and planted, these areas can support positive environmental change, increase plant and animal diversity, and create a more resilient space that’s less reliant on artificial inputs. And they do it all while looking beautiful and improving property values.",N/A,N/A,en
Teaming with Bacteria,['Jeff Lowenfels'],2022-10-12,['Gardening'],"A must-read handbook for organic gardeners and small-scale growers. Thanks to research conducted over the last few decades, we know that most plants get a significant portion of their nutrients by attracting endophytic bacteria—bacteria that live inside a plant’s cells. Through a complex process, plant cells harvest the nitrogen and other nutrients in a bacterium’s cell wall and expel the bacterium’s protoplasts back into the soil where they rebuild their cell walls, start feeding again, and repeat the cycle. Interesting, you may think, but why does this matter? As it turns out, it matters a lot. The bottom line is this: without endophytic bacteria, plants get fewer nutrients and cannot develop properly. Teaming with Bacteria not only explains the rhizophagy cycle; it shows you how to harness this amazing process to increase productivity and plant health. In addition, endophytic bacteria increase a plant’s tolerances to abiotic and biotic stresses and controlling pathogens. This is exactly what we need if we are to deal effectively with climate change, soil loss, and feeding a rapidly burgeoning population. Gardeners, farmers, and other growers must adjust best practices—and develop new ones—to ensure that the rhizophagy cycle can operate at its most efficient pace and that the right endophytic bacteria can do what they are supposed to do. Just as Teaming with Microbes introduced gardeners and growers to the soil food web, Teaming with Bacteria adds to that science by sharing the latest research on endophytic bacteria (bacteria that live inside plants) and rhizophagy (plants “eating” bacteria)—discoveries that have profound implications for the practices of home gardeners and small-scale growers.",N/A,N/A,en
