title,authors,publishedDate,categories,description,averageRating,textSnippet
Zom-B,['Darren Shan'],2013,['High school students'],Can you love a bullying racist thug if he's your father? How do you react when confronted with your darkest inner demons? What do you do when zombies attack? B Smith is about to find out...,N/A,N/A
Voodoo Moon,"['Wendy Corsi Staub', 'Constance M. Burge']",2000,['Fiction'],"The Halliwell sisters are on vacation in New Orleans when Phoebe has a dream filled with images of strange, violent rituals under a full moon. When the moon is full, a new friend of Prue's disappears. When the Charmed Ones try to find her, they are drawn into a dark world of voodoo sorcery.",5,N/A
Dance of the Dead,['Christie Golden'],1992,['Fiction'],"When the riverboat on which she works as a dancer docks at a zombie-plagued island known as Sourange, Larissa Snowmane must rely on the help of the swamp creatures to save her soul. Original.",N/A,N/A
The Messenger of Magnolia Street,['River Jordan'],2006-01-03,['Fiction'],"As something evil begins to threaten their peaceful way of life, three childhood friends--Trice, Billy, and Nehemiah--are reunited to fight an unnamed presence menacing the peace of what should be their idyllic Southern town of Shibboleth.",N/A,N/A
The Haunted Mask,['R.l. Stine'],2008-09,[],"Carly Beth, who believes she has found the best mask for Halloween-with long animal fangs and yellow-green skin-soon discovers that she cannot take it off.",N/A,N/A
Revenge,['Yōko Ogawa'],2013,['Fiction'],"Offers eleven interwoven macabre short stories that take an ominous look at grotesque characters, violent emotions, and murder.",N/A,N/A
Down a Dark Hall,['Lois Duncan'],1990,['Juvenile Fiction'],Kit Gordy and three other students at an exclusive boarding school for girls find themselves part of a terrifying experiment.,N/A,N/A
All the Lovely Bad Ones,['Mary Downing Hahn'],2009,['Juvenile Fiction'],"While spending the summer at their grandmother's Vermont inn, two prankster siblings awaken young ghosts from the inn's distant past who refuse to ""rest in peace.""",4.5,N/A
House,"['Frank E. Peretti', 'Ted Dekker']",2006,['Fiction'],Two stranded couples find shelter in an inn but find themselves trapped in a game with rules setting up a life-or-death situation.,4.5,N/A
Invasion of the Body Squeezers,['R. L. Stine'],1998,['Horror tales'],"The alien takes a heavy, wet step toward Jack and will not answer him.",N/A,N/A
House of Horrors Boxed Set: Welcome to dead house,['R. L. Stine'],1992,['Horror'],N/A,N/A,N/A
Terror All Around,['Amy Kalmanofsky'],2008-06-15,['Psychology'],"Among the many strategies of persuasive speech, biblical prophets often employ a rhetoric of horror. Prophets use verbal threats and graphic images of destruction to terrify their audience. Contemporary horror theory provides insight into the rhetoric of horror employed by the prophets. In this book, Amy Kalmanofsky applies horror theory to the book of Jeremiah and considers the nature of biblical horror and the objects that provoke horror, as well as the ways texts like Jeremiah work to elicit horror from their audience. Kalmanofsky begins by analyzing the emotional response of horror as reflected in characters' reactions to terrifying entities in the book of Jeremiah. Horror, she concludes, is a composite emotion consisting of fear in response to a threatening entity and a corresponding response of shame either directed toward one's self or felt on behalf of another. Having considered the nature of horror, she turns to the objects that elicit horror and consider their ontological qualities and the nature of the threat they pose. There are two central monstrous figures in the book of Jeremiah-aggressor God and defeated Israel. Both of these monsters refuse to be integrated into and threaten to disintegrate the expected order of the universe. She then presents a close, rhetorical reading of Jeremiah 6 and consider the way this text works to horrify its audience. The book concludes by considering fear's place within religious experience and the theological implications of a rhetoric that portrays God and Israel as monsters.",N/A,N/A
Portrait of a Man with Red Hair,['Hugh Walpole'],1925,['Fog'],"Depicts the malign influence of a manipulative, insane father on his family and others.",N/A,N/A
Night of the Werewolf,"['Edward Packard', 'Bill Schmidt']",1995,['Adventure and adventurers'],Young readers are challenged to investigate rumors of a werewolf while making the decisions that lead to the discovery of the deadly monster's true identity.,N/A,N/A
Grizzly Tales for Gruesome Kids,['Jamie Rix'],1992,['Behaviour'],N/A,N/A,N/A
Scared,['Kyle Carson'],2002-03,['Fiction'],"A weeping ghost, decapitated children, hungry corpses, and much more. So grab a blanket, turn down the lights, and get set for a terrifying journey into the realms of horror and fear. And if you happen to hear a noise outside your bedroom window, don't worry. It's probably nothing",N/A,N/A
Missing,['R. L. Stine'],1994-04,['Juvenile Fiction'],N/A,N/A,N/A
Don't Go to Sleep,['R. L. Stine'],1997,['Juvenile Fiction'],"It's a no-snooze situation! Matt hates his tiny bedroom. It's so small it's practically a closet! Still, Matt's mom refuses to let him sleep in the guest room. After all, they might have guests. Some day. Or year. Then Matt does it. Late one night. When everyone's in bed. He sneaks into the guest room and falls asleep. Poor Matt. He should have listened to his mom. Because when Matt wakes up, his whole life has changed. For the worse. And every time he falls asleep, he wakes up in a new nightmare. . . .",5,N/A
The Big Book of Horror,['Alissa Heyman'],2006,['Juvenile Fiction'],"Presents abridged and adapted versions of twenty-one horror stories, including Charles Dickens' ""The signalman"" and Edgar Allan Poe's the ""The black cat.""",5,N/A
Winter Moon,['Dean Ray Koontz'],1994,['Fiction'],Jack McGarvey's family is left alone to defend themselves against criminals who are his own sworn enemies. They are drawn to the ranch of his slain partner's father where a terrifing destiny awaits them.,4,N/A
Life Zero,['Stefano Vietti'],2023-01-03,[],"From the artist of Marvel Comics' Daredevil, Marco Checchetto, comes athrilling new adventure! Where were you when the cloud arrived? Wherewere you when the world changed forever? Where were you when people starteddying? Ablaze is proud to present Life Zero by Stefano Vietti (Dragonero) andMarco Checchetto (Daredevil, Avengers, Old Man Hawkeye, Wolverine), with colorsby Andres Mossa (Wolverine, Avengers, Secret Wars 2099). At the limits betweenscience fiction, action and horror is LIFE ZERO! Includes the completeseries plus cover gallery and bonus material!",N/A,N/A
The Hungry Moon,['Ramsey Campbell'],1989-02,['Horror'],"A town trapped in the grip of spreading evil. Isolated on the moors of northern England, the town of Moonwell has remained faithful to their Druid traditions and kept their old rituals alive. Right-wing evangelist Godwin Mann isn't about to let that continue, and his intolerant brand of fundamentalism has struck a chord with the residents. But Mann goes too far when he descends into the pit where the ancient being who's been worshipped by the Druids for centuries is said to dwell.... What emerges is no longer Mann, but a demon in Mann's shape, and only the town's outcasts can see that something is horribly wrong. Slowly, as the evil spreads, Moonwell becomes cut off from the rest of the world. Telephone lines become disconnected. Roads no longer lead out of town. And the monster's power only grows...and grows.",N/A,N/A
The Shining,['Stephen King'],1977,['Fiction'],"Terrible events occur at an isolated hotel in the off season, when a small boy with psychic powers struggles to hold his own against the forces of evil that are driving his father insane. Reissue.",4,N/A
Cries of the Children,['Clare McNally'],1992,['Fiction'],From the bestselling author of Ghost House and Hear the Children comes an intense thriller about three children who possess amazing powers t o heal--and harm--and the people who will do anything to save them from exploitation by unscrupulous government agents.,N/A,N/A
Scary Stories 3,[],1991-09-20,['Juvenile Fiction'],"More traditional and modern-day stories of ghosts, haunts, superstitions, monsters, and horrible scary things.",N/A,N/A
The Babysitter III,['R. L. Stine'],1993,['Juvenile Fiction'],"Eager to escape her haunting past, Jenny visits her cousin, also a baby-sitter, and brings her bad luck with her. By the author of The Baby-sitter and The Baby-sitter II. Original.",5,N/A
Everville,['Clive Barker'],1994,['Fiction'],"A survivor of a lost band of pioneers witnesses a ceremony performed by creatures from Quiddity, the dream-sea, which leads to a confrontation with malignant forces from the land Ouroboros",N/A,N/A
Web of Dreams,['Virginia C. Andrews'],1990,['Fiction'],"Relates the story of Heaven Casteel's mother, Leigh, and how she came to be in the hills of West Virginia.",N/A,N/A
Scream of the Evil Genie,['R. L. Stine'],1997-01-01,['Juvenile Fiction'],"A genie is released from a soda can and offers three wishes that, when granted, can involve a host of unexpected side effects, in an adventure with several possible endings. Original.",N/A,N/A
Barfodder,['Rain Graves'],2008,['Fiction'],A collection of over 100 macabre poems which display a wry wit.,N/A,N/A
The Bargain,['Rex Sparger'],1983,['Horror'],Concerns a struggling high school rock band with big dreams that were leading them nowhere. Then they met Chort and fame's price tag was eternal fire.,N/A,N/A
The Struggle,['L. J. Smith'],1991,['Horror'],N/A,N/A,N/A
House of Reckoning,['John Saul'],2009,['Fiction'],"Outcast by an injury sustained from her father, foster child Sara Crane befriends a former mental patient and her art teacher and soon creates paintings of long-ago violent crimes committed by the inmates of a local asylum.",N/A,N/A
Dark Dreams,['Brandon Massey'],2004,['Fiction'],"Featuring stories by acclaimed authors Zane, Tanarive Due and Robert Fleming, this collection, selected by award-winning author Brandon Massey, will chill readers to the bone. They are guaranteed to experience terror in every tingling tale from family legends to African lore - from ancient horror reborn in the jungles of Brazil to mysterious treasure recovered in a suburban garage - from weird obsession to forbidden possesion, these stories will send heart rates soaring and minds racing.",N/A,N/A
The Gathering Dark,"['Erica Waters', 'Chloe Gong', 'Tori Bovalino', 'Hannah Whitten', 'Allison Saft', 'Olivia Chadha', 'Courtney Gould', 'Aden Polydoros', 'SMP Alex Brown', 'Shakira Toussaint']",2022-09-06,['FICTION'],"These are the stories that haunt us A cemetery full of the restless dead. A town so wicked it has already burned twice, with the breath of the third fire looming. A rural, isolated bridge with a terrifying monster waiting for the completion of its summoning ritual. A lake that allows the drowned to return, though they have been changed by the claws of death. These are the shadowed, liminal spaces where the curses and monsters lurk, refusing to be forgotten. Hauntings, and a variety of horrifying secrets, lurk in the places we once called home. Written by New York Times bestselling, and other critically acclaimed, authors these stories shed a harsh light on the scariest tales we grew up with.",N/A,N/A
Butterfly,['Virginia C. Andrews'],1998,['Fiction'],An orphan named Butterfly struggles to break free of her painful past.,3,N/A
Broken Angel,['Brian Knight'],2007-12,['Fiction'],"Life in Clearwater was quiet, even a little dull for Grim, but it was better than the time he'd spent on the streets of Seattle. Then the strange girl arrived, abandoned at a roadside diner. Drugged, sick, with no memory of her past.Grim had a bad feeling about her from the beginning but he didn't say anything when his foster mother, Clara, took her in. As Angel's health improves and her memory returns, the hot Clearwater summer becomes increasingly strange. Insanity creeps through the small town like a plague, spawning violence, and no one is immune. And death has arrived in the form of a shadowy figure lurking in the woods at night.",N/A,N/A
In the Shadow of Blackbirds,['Cat Winters'],2014-11-28,['Big Library Read'],"In this original, historical ghost story set in 1918, the year of the deadly Spanish influenza, 16-year-old Mary Shelley Black watches as desperate mourners flock to sances and spirit photographers for comfort. Mary's never believed in ghosts, until",N/A,N/A
Night of the Gargoyles,['Eve Bunting'],1994,['Juvenile Fiction'],"Ominous b/w illus. When night comes, the gargoyles on a museum building come alive.",N/A,N/A
