title,authors,publishedDate,categories,description,averageRating,textSnippet,language
Go Eat Worms!,['R. L. Stine'],2004-12-01,['Juvenile Fiction'],"Discovering the creatures of his basement worm farm in unlikely and unwanted places, like his bed, his toothbrush, and his spaghetti, worm-obsessed Todd finds himself grossed out by the very things with which he used to torture his sister.",N/A,N/A,en
Making Friends with Frankenstein,['Colin McNaughton'],1994,"[""Children's poetry, English""]","Presents a collection of silly, scary, and disgusting poems about monsters and other unusual creatures.",N/A,N/A,en
Life Expectancy,['Dean Koontz'],2005,['Fiction'],"In the dazzling new thriller from the master of dark suspense, the hand of fate reaches out to touch an ordinary man with greatness. So long as he is ready. So long as he is, above all, afraid. Jimmy Tock comes into the world on the very night his grandfather leaves it. As a violent storm rages outside the hospital, Rudy Tock spends long hours walking the corridors between the expectant fathers' waiting room and his dying father's bedside. It's a strange vigil made all the stranger when, at the very height of the storm's fury, Josef Tock suddenly sits up in bed and speaks coherently for the first and last time since his stroke. What he says before he dies is that there will be five dark days in the life of his grandson -- five dates whose terrible events Jimmy will have to prepare himself to face. The first is to occur in his 20th year; the second in his 23rd year; the third in his 28th; the fourth in his 29th; the fifth in his 30th. Rudy is all too ready to discount his father's last words as a dying man's delusional rambling. birth to the minute, as well as his exact height, weight, and the fact that Jimmy would be born with syndactyly -- the unexplained anomaly of fused digits on his left foot. Suddenly, the old man's predictions take on a chilling significance. What terrifying events await Jimmy on these five dark days? What nightmares will he face? What challenges must he survive? As the novel unfolds, picking up Jimmy's story at each of these crisis points, the path he must follow will defy every expectation. And with each crisis he faces, he will move closer to a fate he could never have imagined. For who Jimmy Tock is and what he must accomplish on the five days his world turns is a mystery as dangerous as it is wondrous -- a struggle against an evil so dark and pervasive only the most extraordinary of human spirits can shine through.",N/A,N/A,en
Please Don't Feed the Vampire!,['R. L. Stine'],1997,['Juvenile Fiction'],"You are invited to choose from over 20 spooky endings. You buy something called ""Vampire in a can"" and at first you think it's just a goofy vampire costume, but then you notice a packet in the bottom of the can labeled: DANGER--KEEP AWAY!",5,N/A,en
Revenge,['Yoko Ogawa'],2013,['Horror'],"Offers eleven interwoven macabre short stories that take an ominous look at grotesque characters, violent emotions, and murder.",N/A,N/A,en
"Snow White, Blood Red","['Ellen Datlow', 'Terri Windling']",1996-01,['Fantasy'],N/A,N/A,N/A,en
Diseases of the Head,['Matt Rosen'],2020-09-22,['Literary Criticism'],"Diseases of the Head is an anthology of essays from contemporary philosophers, artists, and writers working at the crossroads of speculative philosophy and speculative horror. At once a compendium of multivocal endeavors, a breviary of supposedly illicit ponderings, and a travelogue of philosophical exploration, this collection centers itself on the place at which philosophy and horror meet. Employing rigorous analysis, incisive experimentation, and novel invention, this anthology asks about the use that speculation can make of horror and horror of speculation, about whether philosophy is fictional or fiction philosophical, and about the relationship between horror, the exigencies of our world and time, and the future developments that may await us in philosophy itself. From philosophers working on horrific themes, to horror writers influenced by heresies in the wake of post-Kantianism, to artists engaged in projects that address monstrosity and alienation, Diseases of the Head aims at nothing less than a speculative coup d'état.Refusing both total negation and absolute affirmation, refusing to deny everything or account for everything, refusing the posture of critique and the posture of all-encompassing unification, this collection of essays aims at exposition and construction, analysis and creation - it desires to fight for some thing, but not everything, and not nothing. And it desires, most of all, to speak from the position of its own insufficiency, its own partiality, its own under-determinacy, which is always indicative of the practice of thinking, of speculation. Considering themes of anonymity, otherness and alterity, the gothic, extinction and the world without us, the end times, the apocalypse, the ancient and the world before us, and the uncanny or unheimlich, among other motifs, this anthology seeks to articulate the cutting edge which can be found at the intersection of speculative philosophy and speculative horror.Matt Rosen is a philosopher. He is the author of numerous books and pamphlets, including Speculative Annihilationism (Zero Books, 2019) and the forthcoming treatise Angst and Abnegation. His theoretical writings have also appeared in journals and anthologies. His work centers on radical ethics and alterity, and his interests range across a variety of areas, including moral philosophy, metaphysics, literature, mysticism, psychoanalysis, theology, politics, and aesthetics.",N/A,N/A,en
The Secret Bedroom,['R. L. Stine'],1991,['Juvenile Fiction'],Lea Carson discovers the secret of the creepy room in the attic of her house on Fear Street.,5,N/A,en
The Curse of Magoria,['Paul Stewart'],2004,['Juvenile Nonfiction'],"A breathtaking tale of dark magic, adventure and revenge.",N/A,N/A,en
One Million Tiny Fires,['Ashley Robin Franklin'],2020,['Comics & Graphic Novels'],"A metaphysical horror comic from cartoonist Ashley Robin Franklin, author of Fruiting Bodies. Fusing sexual intimacy with cosmic dread, this queer horror tale follows Briana and Cassie, a couple in an isolated Texas farmhouse, whose rural fantasy has soured into a tense nightmare. After discovering an unknown object that had crash landed from the sky, Briana begins to suspect that something uncanny is happening to her partner.",N/A,N/A,en
Night Pilgrims,['Chelsea Quinn Yarbro'],2013-07-30,['Fiction'],Blood and faith are on display as the vampire Count Saint-Germain leads a caravan of pilgrims through an Egypt still recovering from the Crusades,N/A,N/A,en
I Know what You Did Last Summer,['Lois Duncan'],1995,['Detective and mystery stories'],Julie faces a crisis of conscience when she is involved in a fatal hit and run accident.,N/A,N/A,en
Portrait of a Man with Red Hair,['Hugh Walpole'],1925,['Fog'],"Depicts the malign influence of a manipulative, insane father on his family and others.",N/A,N/A,en
The Haunted Mask,['R.l. Stine'],2008-09,[],"Carly Beth, who believes she has found the best mask for Halloween-with long animal fangs and yellow-green skin-soon discovers that she cannot take it off.",N/A,N/A,en
Field of Screams,['R. L. Stine'],1997,['Fiction'],"The Moon and Sixpence, published in 1919, was one of the novels that galvanized W. Somerset Maughams reputation as a literary master. It follows the life of one Charles Strickland, a bourgeois city gent whose dull exterior conceals the soul of a genius. Compulsive and impassioned, he abandons his home, wife, and children to devote himself slavishly to painting. In a tiny studio in Paris, he fills canvas after canvas, refusing to sell or even exhibit his work. Beset by poverty, sickness, and his own intransigent, unscrupulous nature, he drifts to Tahiti, where, even after being blinded by leprosy, he produces some of his most extraordinary works of art. Inspired by the life of Paul Gauguin, The Moon and Sixpence is an unforgettable study of a man possessed by the need to createregardless of the cost to himself and to others.",N/A,N/A,en
Voodoo Moon,"['Wendy Corsi Staub', 'Constance M. Burge']",2000,['Fiction'],"The Halliwell sisters are on vacation in New Orleans when Phoebe has a dream filled with images of strange, violent rituals under a full moon. When the moon is full, a new friend of Prue's disappears. When the Charmed Ones try to find her, they are drawn into a dark world of voodoo sorcery.",5,N/A,en
We Have Always Lived in the Castle,['Shirley Jackson'],2006-10-31,['Fiction'],"Alone since four members of the family died of arsenic poisoning, Merricat, Constance, and Julian Blackwood spend their days in happy isolation until cousin Charles appears.",N/A,N/A,en
"Cobwebs, Chatters, and Chills",[],2004,['American poetry'],"An anthology of poems about frightening things, plus Toolbox tips that help the reader understand poetry and how poems are written.",N/A,N/A,en
Dance of the Dead,['Christie Golden'],1992,['Fiction'],"When the riverboat on which she works as a dancer docks at a zombie-plagued island known as Sourange, Larissa Snowmane must rely on the help of the swamp creatures to save her soul. Original.",N/A,N/A,en
The Accident,['Elie Wiesel'],1982-08-01,['Fiction'],"A man seriously injured when hit by a car is taken to the hospital where a doctor, the woman who loves him, and his artist friend lead him to yearn for life rather than death",N/A,N/A,en
All the Lovely Bad Ones,['Mary Downing Hahn'],2009,['Juvenile Fiction'],"While spending the summer at their grandmother's Vermont inn, two prankster siblings awaken young ghosts from the inn's distant past who refuse to ""rest in peace.""",4.5,N/A,en
Zom-B,['Darren Shan'],2013,['High school students'],Can you love a bullying racist thug if he's your father? How do you react when confronted with your darkest inner demons? What do you do when zombies attack? B Smith is about to find out...,N/A,N/A,en
The Struggle,['L. J. Smith'],1991,['Horror'],N/A,N/A,N/A,en
Revenge,['Yōko Ogawa'],2013,['Fiction'],"Offers eleven interwoven macabre short stories that take an ominous look at grotesque characters, violent emotions, and murder.",N/A,N/A,en
Winter Moon,['Dean Ray Koontz'],1994,['Fiction'],Jack McGarvey's family is left alone to defend themselves against criminals who are his own sworn enemies. They are drawn to the ranch of his slain partner's father where a terrifing destiny awaits them.,4,N/A,en
The Messenger of Magnolia Street,['River Jordan'],2006-01-03,['Fiction'],"As something evil begins to threaten their peaceful way of life, three childhood friends--Trice, Billy, and Nehemiah--are reunited to fight an unnamed presence menacing the peace of what should be their idyllic Southern town of Shibboleth.",N/A,N/A,en
Everville,['Clive Barker'],1994,['Fiction'],"A survivor of a lost band of pioneers witnesses a ceremony performed by creatures from Quiddity, the dream-sea, which leads to a confrontation with malignant forces from the land Ouroboros",N/A,N/A,en
Down a Dark Hall,['Lois Duncan'],1990,['Juvenile Fiction'],Kit Gordy and three other students at an exclusive boarding school for girls find themselves part of a terrifying experiment.,N/A,N/A,en
House,"['Frank E. Peretti', 'Ted Dekker']",2006,['Fiction'],Two stranded couples find shelter in an inn but find themselves trapped in a game with rules setting up a life-or-death situation.,4.5,N/A,en
Scared,['Kyle Carson'],2002-03,['Fiction'],"A weeping ghost, decapitated children, hungry corpses, and much more. So grab a blanket, turn down the lights, and get set for a terrifying journey into the realms of horror and fear. And if you happen to hear a noise outside your bedroom window, don't worry. It's probably nothing",N/A,N/A,en
House of Horrors Boxed Set: Welcome to dead house,['R. L. Stine'],1992,['Horror'],N/A,N/A,N/A,en
Don't Go to Sleep,['R. L. Stine'],1997,['Juvenile Fiction'],"It's a no-snooze situation! Matt hates his tiny bedroom. It's so small it's practically a closet! Still, Matt's mom refuses to let him sleep in the guest room. After all, they might have guests. Some day. Or year. Then Matt does it. Late one night. When everyone's in bed. He sneaks into the guest room and falls asleep. Poor Matt. He should have listened to his mom. Because when Matt wakes up, his whole life has changed. For the worse. And every time he falls asleep, he wakes up in a new nightmare. . . .",5,N/A,en
The Last Vampire,['Christopher Pike'],1994,['Horror'],"Alisa Perne is the last vampire. Beautiful and brilliant, she hunts alone, living among humans, living off humans. But someone is stalking her. Someone wants her dead. And Alisa has a choice to make - to keep a long held promise or protect the mortal she seems to be falling for.",N/A,N/A,en
Terror All Around,['Amy Kalmanofsky'],2008-06-15,['Psychology'],"Among the many strategies of persuasive speech, biblical prophets often employ a rhetoric of horror. Prophets use verbal threats and graphic images of destruction to terrify their audience. Contemporary horror theory provides insight into the rhetoric of horror employed by the prophets. In this book, Amy Kalmanofsky applies horror theory to the book of Jeremiah and considers the nature of biblical horror and the objects that provoke horror, as well as the ways texts like Jeremiah work to elicit horror from their audience. Kalmanofsky begins by analyzing the emotional response of horror as reflected in characters' reactions to terrifying entities in the book of Jeremiah. Horror, she concludes, is a composite emotion consisting of fear in response to a threatening entity and a corresponding response of shame either directed toward one's self or felt on behalf of another. Having considered the nature of horror, she turns to the objects that elicit horror and consider their ontological qualities and the nature of the threat they pose. There are two central monstrous figures in the book of Jeremiah-aggressor God and defeated Israel. Both of these monsters refuse to be integrated into and threaten to disintegrate the expected order of the universe. She then presents a close, rhetorical reading of Jeremiah 6 and consider the way this text works to horrify its audience. The book concludes by considering fear's place within religious experience and the theological implications of a rhetoric that portrays God and Israel as monsters.",N/A,N/A,en
Night of the Werewolf,"['Edward Packard', 'Bill Schmidt']",1995,['Adventure and adventurers'],Young readers are challenged to investigate rumors of a werewolf while making the decisions that lead to the discovery of the deadly monster's true identity.,N/A,N/A,en
Grizzly Tales for Gruesome Kids,['Jamie Rix'],1992,['Behaviour'],N/A,N/A,N/A,en
Scary Stories 3,[],1991-09-20,['Juvenile Fiction'],"More traditional and modern-day stories of ghosts, haunts, superstitions, monsters, and horrible scary things.",N/A,N/A,en
Invasion of the Body Squeezers,['R. L. Stine'],1998,['Horror tales'],"The alien takes a heavy, wet step toward Jack and will not answer him.",N/A,N/A,en
Web of Dreams,['Virginia C. Andrews'],1990,['Fiction'],"Relates the story of Heaven Casteel's mother, Leigh, and how she came to be in the hills of West Virginia.",N/A,N/A,en
Missing,['R. L. Stine'],1994-04,['Juvenile Fiction'],N/A,N/A,N/A,en
The Big Book of Horror,['Alissa Heyman'],2006,['Juvenile Fiction'],"Presents abridged and adapted versions of twenty-one horror stories, including Charles Dickens' ""The signalman"" and Edgar Allan Poe's the ""The black cat.""",5,N/A,en
Life Zero,['Stefano Vietti'],2023-01-03,[],"From the artist of Marvel Comics' Daredevil, Marco Checchetto, comes athrilling new adventure! Where were you when the cloud arrived? Wherewere you when the world changed forever? Where were you when people starteddying? Ablaze is proud to present Life Zero by Stefano Vietti (Dragonero) andMarco Checchetto (Daredevil, Avengers, Old Man Hawkeye, Wolverine), with colorsby Andres Mossa (Wolverine, Avengers, Secret Wars 2099). At the limits betweenscience fiction, action and horror is LIFE ZERO! Includes the completeseries plus cover gallery and bonus material!",N/A,N/A,en
The Hungry Moon,['Ramsey Campbell'],1989-02,['Horror'],"A town trapped in the grip of spreading evil. Isolated on the moors of northern England, the town of Moonwell has remained faithful to their Druid traditions and kept their old rituals alive. Right-wing evangelist Godwin Mann isn't about to let that continue, and his intolerant brand of fundamentalism has struck a chord with the residents. But Mann goes too far when he descends into the pit where the ancient being who's been worshipped by the Druids for centuries is said to dwell.... What emerges is no longer Mann, but a demon in Mann's shape, and only the town's outcasts can see that something is horribly wrong. Slowly, as the evil spreads, Moonwell becomes cut off from the rest of the world. Telephone lines become disconnected. Roads no longer lead out of town. And the monster's power only grows...and grows.",N/A,N/A,en
Cries of the Children,['Clare McNally'],1992,['Fiction'],From the bestselling author of Ghost House and Hear the Children comes an intense thriller about three children who possess amazing powers t o heal--and harm--and the people who will do anything to save them from exploitation by unscrupulous government agents.,N/A,N/A,en
The Babysitter III,['R. L. Stine'],1993,['Juvenile Fiction'],"Eager to escape her haunting past, Jenny visits her cousin, also a baby-sitter, and brings her bad luck with her. By the author of The Baby-sitter and The Baby-sitter II. Original.",5,N/A,en
Scream of the Evil Genie,['R. L. Stine'],1997-01-01,['Juvenile Fiction'],"A genie is released from a soda can and offers three wishes that, when granted, can involve a host of unexpected side effects, in an adventure with several possible endings. Original.",N/A,N/A,en
Butterfly,['Virginia C. Andrews'],1998,['Fiction'],An orphan named Butterfly struggles to break free of her painful past.,3,N/A,en
Barfodder,['Rain Graves'],2008,['Fiction'],A collection of over 100 macabre poems which display a wry wit.,N/A,N/A,en
The Bargain,['Rex Sparger'],1983,['Horror'],Concerns a struggling high school rock band with big dreams that were leading them nowhere. Then they met Chort and fame's price tag was eternal fire.,N/A,N/A,en
Dragon Tears,['Dean Ray Koontz'],1993,['Fiction'],Police Detective Harry Lyon is caught in a whirlwind of terror that threatens to sweep away not only him but his partner and everyone he loves.,4,N/A,en
In the Shadow of Blackbirds,['Cat Winters'],2014-11-28,['Big Library Read'],"In this original, historical ghost story set in 1918, the year of the deadly Spanish influenza, 16-year-old Mary Shelley Black watches as desperate mourners flock to sances and spirit photographers for comfort. Mary's never believed in ghosts, until",N/A,N/A,en
Cemetery Girl,"['Charlaine Harris', 'Christopher Golden']",2014-01,['Comics & Graphic Novels'],"Calexa Rose Dunhill was just fourteen when she woke in a cemetery. Bruised, bloody and left for dead, with no memory of her previous life, she took a new name from the headstones that surrounded her. Now, three years on, Calexa still lives in Dunhill Cemetery, struggling with the desire to know her true identity - and the all-consuming fear of what she might discover when she does. Then, when she witnesses a gang of teenagers staging a stunt that goes horribly, fatally wrong, Calexa Rose Dunhill discovers she has a unique ability. One she cannot control...",N/A,N/A,en
House of Reckoning,['John Saul'],2009,['Fiction'],"Outcast by an injury sustained from her father, foster child Sara Crane befriends a former mental patient and her art teacher and soon creates paintings of long-ago violent crimes committed by the inmates of a local asylum.",N/A,N/A,en
Dark Dreams,['Brandon Massey'],2004,['Fiction'],"Featuring stories by acclaimed authors Zane, Tanarive Due and Robert Fleming, this collection, selected by award-winning author Brandon Massey, will chill readers to the bone. They are guaranteed to experience terror in every tingling tale from family legends to African lore - from ancient horror reborn in the jungles of Brazil to mysterious treasure recovered in a suburban garage - from weird obsession to forbidden possesion, these stories will send heart rates soaring and minds racing.",N/A,N/A,en
Night of the Gargoyles,['Eve Bunting'],1994,['Juvenile Fiction'],"Ominous b/w illus. When night comes, the gargoyles on a museum building come alive.",N/A,N/A,en
