title,authors,publishedDate,categories,description,averageRating,textSnippet,language
The Spook's Bestiary,['Joseph Delaney'],2010,['Juvenile Fiction'],A companion title to the phenomenally successful Spook's Apprentice titles. Discover how to bind a boggart and deal with a dead witch in this fascinating and lavishly illustrated Spook's own notebook. A must for die-hard fans of the series and an irresistible introduction to the dark and the dangerous for new recruits.,N/A,N/A,en
Ghost Stories (Nancy Drew ),['Carolyn Keene'],1989-10,['Juvenile Fiction'],A collection of six ghost stories.,5,N/A,en
The New Girl,['R. L. Stine'],1991-08,['Fiction'],A dead girl returns from the grave and lures a high school student down the road to terror-- to Fear Street-- an isolated block believed to be haunted by shocking curses.,N/A,N/A,en
The Possessed,['Lisa J. Smith'],1995,['Extrasensory perception'],"The bestselling author of The Forbidden Game brings readers the second volume in her all-new horror trilogy, Dark Visions. Now, Kaitlyn Fairchild and her four friends have no choice but to follow their own psychic gifts . . . to a lonely white house on a cliff . . . and into the terrifying unknown!",4.5,N/A,en
The Shrinking Man,['Richard Matheson'],2014-04-10,['Body size'],"While on a boating holiday, Scott Carey is exposed to a cloud of radioactive spray. A few weeks later, following a series of medical examinations, he can no longer deny the extraordinary truth. Not only is he losing weight, he is also shorter than he was. Scott Carey has begun to shrink. Richard Matheson's novel follows through its premise with remorseless logic, with Carey first attempting to continue some kind of normal life and later having left human contact behind, having to survive in a world where insects and spiders are giant adversaries. And even that is only a stage on his journey into the unknown.",N/A,N/A,en
Dracula in Love,['Karen Essex'],2010,['Fiction'],"Dracula's beautiful, eternal muse, Mina - the most famous woman in vampire lore - vividly recounts the joys and terrors of a passionate affair that has linked her and Count Dracula through the centuries. Time falls away as she is swept into a mythical voyage where she must finally make the decision she has been avoiding for almost a millennium.",N/A,N/A,en
The Tomb,['F. Paul Wilson'],1998-08-15,['Fiction'],A repairman Jack thriller. Follow Hosts.,5,N/A,en
A Dead Calmness,['Steven Deighan'],2006,['Fiction'],"'A Dead Calmness' plays host to an unusual and terrifying mixture of stories from one of today's newest horror writers. Bringing together fiendish tales of parental betrayal, evil beings and growing madness, it delves into the places of our minds we'd like to forget ... and brings the darkness to light.Featuring in some of the UK's best-selling anthologies in recent years, this is Steven Deighan's debut horror collection.",4,N/A,en
Firestarter,['Stephen King'],1993,['Horror fiction'],"From the author of THE SHINING, CARRIE and THE DEAD ZONE, this is Stephen King's most mesmerizing and menacing novel yet...It is the story of a sinister government agency, a fteful drug experiment, and a pigtailed girl named Charlie, who has an unimaginably terrifying gift. As PLAYBOY said, 'King does this better than anyone else. We finished the book about three non-stop hours after we picked it up.",N/A,N/A,en
Starving Anonymous 2,['Kazu Inabe'],2018-04-10,['Graphic novels'],"They found themselves in a sinister facility where human feelings are transformed into food… Surrounded by death on all sides, I’e, Natsune, Yamabiki, and Kazu manage to escape from the feedlot with their lives…only to discover the Breeders, women who bear child after child behind bars and men who are driven mad by a cocktail of super-strong aphrodisiacs. What other secrets does the facility hold? In volume 2, the fight to survive unfolds in the desolate depths of the prison!",N/A,N/A,en
The Damnation Game,['Clive Barker'],1985,['Fiction'],"Chance had ruled Marty Strauss' life for as long as he could remember. Now at last luck was turning his way. Parolled from prison, he becomes bodyguard to Joseph Whitehead, one of the richest men in Europe. But Whitehead has also played with chance - an ancient game which gave him vast power and wealth, in exchange for his immortal soul. Now the forces he played against are back to claim what's theirs. Terryifying forces, with the power to raise the dead; and Marty is trapped between his human masters and Hell itself, with just one last, desperate game left to play...",N/A,N/A,en
The Dark is Rising Sequence: The dark is rising,['Susan Cooper'],1973,['Cornwall (England : County)'],N/A,N/A,N/A,en
The Strange Case of Dr. Jekyll and Mr. Hyde and Other Stories,['Robert Louis Stevenson'],2023-09-12,[],"What a study in contrasts is the friendship between Henry Jekyll and his boon companion, Edward Hyde. Where Jekyll is a handsome and respected man of science, Hyde is a surly and brutish misanthrope. Nevertheless, Jekyll has allowed Hyde free access to his home and laboratory and, surprisingly, made him the sole beneficiary of his will. Given the closeness of their bond, it seems peculiar that no one has ever seen the two men together in public. And yet they share a remarkable chemistry . . . First published in 1886, The Strange Case of Dr. Jekyll and Mr. Hyde is Robert Louis Stevenson's classic tale of the duality of human nature and his iconic presentation of what would come to be referred to as the ""split personality.""",N/A,N/A,en
Sibs,['Francis Paul Wilson'],1991,['Fiction'],N/A,N/A,N/A,en
The Dead Zone,[],1989-03-23,['Feature films'],"A man awakens from a 5 year coma to discover he has powers to see visions of the past, present and future, a power which drives him insane.",N/A,N/A,en
Spiral,"['Sakura Mizuki', 'Koji Suzuki']",2004,['Forensic pathologists'],"The popular novel The Ring has seen the lion's share of publicity, but that's not where the story ends. In this adaptation of Suzuki's next novel Spiral (Rasen in Japanese), the legend of Sadako's evil takes a scientific turn, as Ryuji Takayama's old college friend, Mitsuo Ando, must decipher a mysterious code while investigating this strange virus that kills people after watching a video tape. Disbelief gives way to fear. Logic bends to survival. And human evolution changes drastically. What Sadako plans is not simply horror, but something much, much deeper.",N/A,N/A,en
All Our Hidden Gifts,['Caroline O?Donoghue'],2021,['Fantasy fiction'],N/A,N/A,N/A,en
Night Shift,['Stephen King'],1976,['Horror'],"Newly repackaged, the master's greatest short-story collection features his classic tales that inspired the films ""Children of the Corn, Graveyard Shift, "" and ""Sometimes They Come Back."" Reissue. Copyright © Libri GmbH. All rights reserved.",N/A,N/A,en
The Werewolf of Fever Swamp,['R. L. Stine'],2009,['Juvenile Fiction'],"When a strange howling is heard and a rabbit is torn to shreds, everyone thinks that Grady's new dog is responsible, and Grady is determined to prove them wrong.",N/A,N/A,en
The Shining,['Stephen King'],1977,['Fiction'],"Terrible events occur at an isolated hotel in the off season, when a small boy with psychic powers struggles to hold his own against the forces of evil that are driving his father insane. Reissue.",4,N/A,en
Red Dice,['Christopher Pike'],1995,['Horror'],N/A,N/A,N/A,en
The Strain,"['Guillermo del Toro', 'Chuck Hogan']",2009,['Fiction'],"The high-concept thriller with a supernatural edge from the world-famous director, whose films include Pan's Labyrinth and Hellboy. A plane lands at JFK and mysteriously 'goes dark', stopping in the middle of the runway for no apparent reason, all lights off, all doors sealed. The pilots cannot be raised. When the hatch above the wing finally clicks open, it soon becomes clear that everyone on board is dead - although there is no sign of any trauma or struggle. Ephraim Goodweather and his team from the Center for Disease Control must work quickly to establish the cause of this strange occurrence before panic spreads. The first thing they discover is that four of the victims are actually still alive. But that's the only good news. And when all two hundred corpses disappear from various morgues around the city on the same night, things very rapidly get worse. Soon Eph and a small band of helpers will find themselves battling to protect not only their own loved ones, but the whole city, against an ancient threat to humanity. Perfect for fans of Dean Koontz's The Eyes of Darkness",N/A,N/A,en
The Exorcist,['William Peter Blatty'],1971,['Demoniac possession'],"One of the most famous horror stories ever written, The Exorcist is the terrifying story of an 11-year-old girl possessed by an overwhelming demonic force.",N/A,N/A,en
Headless Halloween,['R. L. Stine'],1998,['Juvenile Fiction'],"Brandon thinks his impersonation of a headless freak is the height of Halloween scariness, until he gets invited to the creepiest costume party of all time, where guests bob for rats and eat doughnuts filled with worms. Original.",N/A,N/A,en
Great Tales and Poems,['Edgar Allan Poe'],1960,[],N/A,N/A,N/A,en
Attack of the Graveyard Ghouls,['R. L. Stine'],1998,['Juvenile Fiction'],"During a creepy field trip to the local cemetery, Spencer accidentally knocks over a headstone. Now he's face to face with the undead, a cold, ghastly ghoul who wants to take over his body!",N/A,N/A,en
Let's get invisible,['R. L. Stine'],1997,['HORROR.'],N/A,N/A,N/A,en
The Killer and the Slain,['Hugh Walpole'],1942,['Horror'],A psychological horror tale of two strongly attached former schoolmates.,N/A,N/A,en
Prodigal Son,"['Dean Ray Koontz', 'Kevin J. Anderson']",2005,['Fiction'],"SOMEONE NEW IS PLAYING GOD The Frankenstein story updated to the 21st century by the great American storyteller Dean Koontz. Created centuries ago by a madman, possessed of seemingly supernatural powers and a dogged drive for justice, the mysterious Deucalion arrives in New Orleans as the next generation of Dr Frankenstein's monsters are about to be unleashed by their deranged maker, now known as Victor Helios. Deucalion's path will cross with that of tough police detective Carson O'Connor and her partner, Michael Maddison, who are on the trail of a vicious serial killer stalking the city, a killer who selects his victims for the humanity that is missing in himself. Reluctantly, Carson will join forces with Deucalion against a far greater, terrifying threat: an entire race of killers who are much more - and less - than human ... Deucalion seeks one final confrontation with the evil genius who created him, Dr Frankenstein. Dean Koontz, the master storyteller, creates a bold new legend.",N/A,N/A,en
Monster Blood,['R. L. Stine'],1992,['Juvenile Fiction'],"When Evan and Andy find a dusty can labeled ""Monster Blood"" in weird Aunt Kathryn's house, they make the mistake of opening it.",5,N/A,en
The Legend of Sleepy Hollow,['Washington Irving'],2021,['Anxiety'],"""The story is set in 1790 in the countryside around the Dutch settlement of Tarry Town (historical Tarrytown, New York), in a secluded glen known as Sleepy Hollow. Sleepy Hollow is renowned for its ghosts and the haunting atmosphere that pervades the imaginations of its inhabitants and visitors. Some residents say this town was bewitched during the early days of r the Dutch settlement, while others claims that the mysterious atmosphere was caused by an old Native American Chief, the 'wizard of his tribe... before the country was discovered by Master Hendrik Hudson.' Residents of the town are seemingly subjected to various supernatural and mysterious occurrences. They are subjected to trance like visions and frequented by strand sights, music, and voices 'in the air.' "" -- back cover",N/A,N/A,en
No Go the Bogeyman,['Marina Warner'],1998,['Art'],"Examines the figure of the bogeyman, monster and other figures of male terror in literature, mythology, folk tale, jokes and lullaby.",N/A,N/A,en
Haunted,['R. L. Stine'],1993,['Horror'],YA. Horror tale.,N/A,N/A,en
Bitten,['Kelley Armstrong'],2001,['Fiction'],"""Young, beautiful, and successful, Elena Michaels seems to have it all. Her happy, organized life follows a predictable pattern: filing stories for her job as a journalist, working out at the gym, living with her architect boyfriend, and lunching with her girlfriends from the office. And once a week, in the dead of night, she streaks through a downtown ravine, naked and furred, tearing at the throats of her animal prey."" ""Elena Michaels is a werewolf."" ""The man who made her one has been left behind, but his dark legacy has not. And though Elena struggles to maintain the normal life she's worked so hard to create, she cannot resist the call of the elite pack of werewolves from her past. Her feral instincts will lead her back to them and into a desperate war for survival that will test her own understanding of who, and what, she is.""--BOOK JACKET.Title Summary field provided by Blackwell North America, Inc. All Rights Reserved",N/A,N/A,en
Cell,['Stephen King'],2006,['Cell phones'],"Clayton Riddell, an artist from Maine, has just landed a deal that might finally enable him to support his family by making art instead of teaching it. Clay's feeling good about the future. That changes in a hurry ... The cause of the devastation is a phenomenon that will come to be known as The Pulse, and the delivery method is a cell phone. Everyone's cell phone.",N/A,N/A,en
Stargazer,['Claudia Gray'],2011-05-14,[],"The second novel in the internationally bestselling EVERNIGHT series - a vampire romance with a shocking twist.Evernight Academy is an exclusive boarding school for the most beautiful and dangerous students of all and Bianca has always been told it's her destiny to be just like them.But Bianca fell in love with Lucas - sworn enemy of her kind, and when his true identity was revealed he fled the school.Although they may be separated, Bianca and Lucas cannot give each other up. She will risk anything for the chance to see him again, even if that means coming face to face with the hunters of Black Cross or keeping secrets from those whom she loves the most.However, Bianca isn't the only one keeping secrets and when Evernight is attacked by an evil force she discovers that the truth she thought she knew is only the beginning",N/A,N/A,en
Bitten,['Kelley Armstrong'],2004,['Fiction'],"On the eve of her marriage, Elena Michaels learns that her fiance has been concealing his secret life as a werewolf, and, as a bonus, he has made her into one also.",N/A,N/A,en
The Scarecrows,['Robert Westall'],1989-07-04,['Fiction'],"In a brooding story about jealousy, hatred, murder and love, Simon is outraged that his mum plans to remarry. He can’t bear the way she and his sister seem to have forgotten his late father. Overwhelmed by hatred, he seeks solace in a nearby abandoned water mill. But another, powerful hatred lingers within its walls. And it is about to be unleashed . . .",N/A,N/A,en
The Forbidden Body,['Douglas E. Cowan'],2022-05-17,['Fiction'],"""Throughout history, the religious imagination has attempted to control nothing so much as our bodies: what they are and what they mean; what we do with them, with whom, and under what circumstances; how they may be displayed-or, more commonly, how they must be hidden. Religious belief and mandate affect how our bodies are used in ritual practice, as well as how we use them to identify and marginalize threatening religious Others. This book examines how horror culture treats religious bodies that have stepped (or been pushed) out of their 'proper' place. Unlike most books on religion and horror, This book explores the dark spaces where sex, sexual representation, and the sexual body come together with religious belief and scary stories. Because these intersections of sex, horror, and the religious imagination force us to question the nature of consensus reality, supernatural horror, especially as it concerns the body, often shows us the religious imagination at work in real time. It is important to note that the discussion in this book is not limited either to horror cinema or to popular fiction, but considers a wide range of material, including literary horror, weird fiction, graphic storytelling, visual arts, participative culture, and aspects of real-world religious fear. It is less concerned with horror as a genre (which is mainly a function of marketing) and more with the horror mode, a way of storytelling that finds expression across a number of genres, a variety of media, and even blurs the boundary between fiction and non-fiction. This expanded focus not only deepens the pool of potential examples, but invites a much broader readership in for a swim""--",N/A,N/A,en
First Date,['R.L. Stine'],2006,['Fiction'],"Fifteen-year-old Chelsea longs for a boyfriend, but when two new boys come to Shadyside and the FBI tracks a killer there, she wonders if she should accept her first date.",4.5,N/A,en
It Came from Beneath the Sink!,['R. L. Stine'],2003,['Juvenile Fiction'],Kat and her brother love their new house except for the evil thing living under the sink.,5,N/A,en
Twilight Eyes,['Dean Ray Koontz'],2004-01-01,['Fiction'],"Sought by police for murder, slim Mackenzie, a young man both blessed and cursed by ""twilight eyes,"" stalks the diabolical ""Others,"" who feed their twisted needs with human suffering",N/A,N/A,en
We Need to Talk About Kevin,['Lionel Shriver'],2004-05,['Fiction'],"The gripping international bestseller about motherhood gone awry Eva never really wanted to be a mother certainly not the mother of the unlovable boy who murdered seven of his fellow high school students, a cafeteria worker, and a much-adored teacher who tried to befriend him, all two days before his sixteenth birthday. Now, two years later, it is time for her to come to terms with marriage, career, family, parenthood, and Kevin's horrific rampage in a series of startlingly direct correspondences with her estranged husband, Franklyn. Uneasy with the sacrifices and social demotion of motherhood from the start, Eva fears that her alarming dislike for her own son may be responsible for driving him so nihilistically off the rails.",N/A,N/A,en
The Deadly Past,['Christopher Pike'],1996,['Dinosaurs'],N/A,N/A,N/A,en
The Stand,['Stephen King'],1980-01-01,['Good and evil'],"For use in schools and libraries only. A monumentally devastating plague leaves only a few survivors who, in a desert world, experience dreams of good and evil in confrontation and, through their choices, move toward an actual confrontation.",N/A,N/A,en
More Horowitz Horror,['Anthony Horowitz'],2000,"[""Children's stories, English""]","Some mysterious deaths linked to a second hand camera, a boy trapped inside a computer game, a frightening journey on a bus that doesn't seem to exist and a terrifying dream that comes true. These are some of the horror stories in this collection.",N/A,N/A,en
Hollowland,['Amanda Hocking'],2010,['Horror'],Hollowland - the first book in the young adult dystopian series The Hollows.,N/A,N/A,en
Doctor Sleep,['Stephen King'],2013,['Families'],"On highways across America, a tribe of people called The True Knot travel in search of sustenance. But as Dan Torrance knows, and spunky twelve-year-old Abra Stone learns, The True Knot are quasi-immortal, living off the steam that children with the shining produce when they are slowly tortured to death",N/A,N/A,en
Silent Night 2,['R. L. Stine'],1993,['Juvenile Fiction'],"Reva Dalby's father, who owns Dalby Department Stores, lets cold Reva dole out Christmas jobs to her friends. But Reva only hires boys--prospective dates for herself. Soon someone is stalking her and sending her threatening letters. Then Reva receives a gift-wrapped box containing a corpse! Copyright © Libri GmbH. All rights reserved.",N/A,N/A,en
Ticktock,['Dean Ray Koontz'],1997,"['California, Southern']","Detective novelist Tommy Phan comes home to find a strange doll on his doorstep. That night, something terrifying breaks out of the doll and begins to follow Tommy wherever he goes.",N/A,N/A,en
Inside the Worm,['Robert Swindells'],1994,['Dragons'],Everyone in Elsworth knows the local legend about the monstrous worm - or dragon - that once terrorized the village. But it never really happened. Or did it? The worm is returning - with a thousand-year hunger in its belly . . .,N/A,N/A,en
Welcome to Dead House,['R. L. Stine'],1992,['Juvenile Fiction'],"When their father inherits an old house in the town of Dark Falls, Amanda and Josh are excited--until they begin to suspect that the house is haunted.",N/A,N/A,en
Fantastic Cinema Subject Guide,"['Bryan Senn', 'John Johnson']",1992,['Performing Arts'],"About 2,500 genre films are entered under more than 100 subject headings, ranging from abominable snowmen through dreamkillers, rats, and time travel, to zombies, with a brief essay on each topic: development, highlights, and trends. Each film entry shows year of release, distribution company, country of origin, director, producer, screenwriter, cinematographer, cast credits, plot synopsis and critical commentary.",N/A,N/A,en
The Electric Black,"['Joseph Schmalke', 'Rich Woodall']",2021-10-12,['Comics & Graphic Novels'],"The Electric Black is a horror series set in an antique shop that travels through time and space delivering cursed objects to unsuspecting customers. written and Illustrated by Joseph Schmalke and Rich Woodall published quarterly by Black Caravan a Scout Comics Imprint. The Electric Black is a cursed antique shop, appearing in any time or space, soliciting customers it hungers to corrupt or devour. The mysterious Julius Black is the store's demonic proprietor and narrator. He, along with his psychopathic employees, regularly manipulates patrons for their own devious purposes. Inside the eerie emporium, all of the forbidden objects have secrets to unlock. The poor souls that enter never leave without something. It's dark light will shine on macabre mysteries, grisly murders, and other frightful occurrences. Dare you step within its sinister halls?",N/A,N/A,en
The H.P. Lovecraft Omnibus 3,['Howard Phillips Lovecraft'],1985,['Fiction'],A collection of some of the most famous stories from the master of tomb-dark fear...,N/A,N/A,en
The Abominable Snowman of Pasadena,['R. L. Stine'],2003-08-01,['Juvenile Fiction'],"Becoming sick of the endless hot weather in their Pasadena home, Jordan and Nicole Blake wish for a real winter and are delighted with an Alaskan family vacation, until they come face-to-face with the abominable snowman.",5,N/A,en
Saurian,['William Schoell'],1988,['Fiction'],N/A,N/A,N/A,en
The Deadly Doll,['Janine Burke'],2008,['Juvenile Fiction'],"When Claudine's family receives in the mail a beautiful old French doll that has been in the family for generations, no one anticipates its malevolent intentions.",N/A,N/A,en
Pet Sematary,['Stephen King'],1983,['Fiction'],"""""Sometimes dead is better...."""" When the Creeds move into a beautiful old house in rural Maine, it all seems too good to be true: physician father, beautiful wife, charming little daughter, adorable infant son -- and now an idyllic home. As a family, they've got it all...right down to the friendly cat. But the nearby woods hide a blood-chilling truth -- more terrifying than death itself...and hideously more powerful.",N/A,N/A,en
Halloween Party,['R. L. Stine'],1990,['Horror'],N/A,N/A,N/A,en
Clockwork,['Philip Pullman'],1998,['Juvenile Fiction'],"Long ago in Germany, a storyteller's story and an apprentice clockwork-maker's nightmare meet in a menacing, lifelike figure created by the strange Dr. Kalmenius.",N/A,N/A,en
The Throat,['Peter Straub'],1993,['Fiction'],"A tormented writer unable to exorcise the demons of his past...an all-American town plagued by horrific secrets...a beautiful woman brutally murdered by a twisted killer thought long dead-or by an even more terrifying copycat? In The Throat , Peter Straub's Blue Rose trilogy blooms into a horrifically chilling, maniacally suspenseful masterwork of terror.",N/A,N/A,en
Switched,['R. L. Stine'],1995,['English fiction'],"There's a little cabin in the Fear Street woods where a girl can lose her mind. In fact, she can change it into someone else's. That's what happened to Nicole and Lucy. Now Lucy is in Nicole's body and vice-versa. What a trip! But for Nicole, what a trap! Because Lucy is using her body to get away with murder. Copyright © Libri GmbH. All rights reserved.",N/A,N/A,en
The Witch's Revenge,['Christopher Pike'],1998,"[""Children's stories""]",N/A,N/A,N/A,en
The Dwelling,['Susie Moloney'],2004,['Fiction'],"In the tradition of Shirley Jackson's ""The Haunting of Hill House,"" this novel about a suburban home that has as many secrets as owners is told through the stories of three families who occupy the house.",N/A,N/A,en
How to Kill a Monster,['R. L. Stine'],2003-08-01,['Juvenile Fiction'],"Hating to stay with their deaf grandfather and baking-crazed grandmother, Gretchen and her stepbrother, Clark, fear the strange growling noises that they hear coming from the room on the second floor.",N/A,N/A,en
The Oxford Book of Scary Tales,['Dennis Pepper'],1995,['Juvenile Fiction'],"A collection of scary tales, some dealing with ordinary things, and others with ghosts, monsters and strange happenings.",N/A,N/A,en
Tales of Mystery and Imagination ... Illustrated by Harry Clarke,"['Edgar Allan Poe', 'Harry CLARKE (Artist.)']",1923*,[],N/A,N/A,N/A,en
Cry of the Cat,['R. L. Stine'],1998-01-01,['Juvenile Fiction'],"Hoping to simply return a black cat to its rightful owner, Allison ventures into the dark, broken-down house where the cat lives, never suspecting that her biggest problem will be getting out. Original.",5,N/A,en
