title,authors,publishedDate,categories,description,averageRating,textSnippet
It Came from Beneath the Sink!,['R. L. Stine'],2003,['Juvenile Fiction'],Kat and her brother love their new house except for the evil thing living under the sink.,5,N/A
Prodigal Son,"['Dean Ray Koontz', 'Kevin J. Anderson']",2005,['Fiction'],"SOMEONE NEW IS PLAYING GOD The Frankenstein story updated to the 21st century by the great American storyteller Dean Koontz. Created centuries ago by a madman, possessed of seemingly supernatural powers and a dogged drive for justice, the mysterious Deucalion arrives in New Orleans as the next generation of Dr Frankenstein's monsters are about to be unleashed by their deranged maker, now known as Victor Helios. Deucalion's path will cross with that of tough police detective Carson O'Connor and her partner, Michael Maddison, who are on the trail of a vicious serial killer stalking the city, a killer who selects his victims for the humanity that is missing in himself. Reluctantly, Carson will join forces with Deucalion against a far greater, terrifying threat: an entire race of killers who are much more - and less - than human ... Deucalion seeks one final confrontation with the evil genius who created him, Dr Frankenstein. Dean Koontz, the master storyteller, creates a bold new legend.",N/A,N/A
Let's get invisible,['R. L. Stine'],1997,['HORROR.'],N/A,N/A,N/A
The Strain,"['Guillermo del Toro', 'Chuck Hogan']",2009,['Fiction'],"The high-concept thriller with a supernatural edge from the world-famous director, whose films include Pan's Labyrinth and Hellboy. A plane lands at JFK and mysteriously 'goes dark', stopping in the middle of the runway for no apparent reason, all lights off, all doors sealed. The pilots cannot be raised. When the hatch above the wing finally clicks open, it soon becomes clear that everyone on board is dead - although there is no sign of any trauma or struggle. Ephraim Goodweather and his team from the Center for Disease Control must work quickly to establish the cause of this strange occurrence before panic spreads. The first thing they discover is that four of the victims are actually still alive. But that's the only good news. And when all two hundred corpses disappear from various morgues around the city on the same night, things very rapidly get worse. Soon Eph and a small band of helpers will find themselves battling to protect not only their own loved ones, but the whole city, against an ancient threat to humanity. Perfect for fans of Dean Koontz's The Eyes of Darkness",N/A,N/A
The Killer and the Slain,['Hugh Walpole'],1942,['Horror'],A psychological horror tale of two strongly attached former schoolmates.,N/A,N/A
The Legend of Sleepy Hollow,['Washington Irving'],2021,['Anxiety'],"""The story is set in 1790 in the countryside around the Dutch settlement of Tarry Town (historical Tarrytown, New York), in a secluded glen known as Sleepy Hollow. Sleepy Hollow is renowned for its ghosts and the haunting atmosphere that pervades the imaginations of its inhabitants and visitors. Some residents say this town was bewitched during the early days of r the Dutch settlement, while others claims that the mysterious atmosphere was caused by an old Native American Chief, the 'wizard of his tribe... before the country was discovered by Master Hendrik Hudson.' Residents of the town are seemingly subjected to various supernatural and mysterious occurrences. They are subjected to trance like visions and frequented by strand sights, music, and voices 'in the air.' "" -- back cover",N/A,N/A
Starving Anonymous 2,['Kazu Inabe'],2018-04-10,['Graphic novels'],"They found themselves in a sinister facility where human feelings are transformed into food… Surrounded by death on all sides, I’e, Natsune, Yamabiki, and Kazu manage to escape from the feedlot with their lives…only to discover the Breeders, women who bear child after child behind bars and men who are driven mad by a cocktail of super-strong aphrodisiacs. What other secrets does the facility hold? In volume 2, the fight to survive unfolds in the desolate depths of the prison!",N/A,N/A
Cell,['Stephen King'],2006,['Cell phones'],"Clayton Riddell, an artist from Maine, has just landed a deal that might finally enable him to support his family by making art instead of teaching it. Clay's feeling good about the future. That changes in a hurry ... The cause of the devastation is a phenomenon that will come to be known as The Pulse, and the delivery method is a cell phone. Everyone's cell phone.",N/A,N/A
Stargazer,['Claudia Gray'],2011-05-14,[],"The second novel in the internationally bestselling EVERNIGHT series - a vampire romance with a shocking twist.Evernight Academy is an exclusive boarding school for the most beautiful and dangerous students of all and Bianca has always been told it's her destiny to be just like them.But Bianca fell in love with Lucas - sworn enemy of her kind, and when his true identity was revealed he fled the school.Although they may be separated, Bianca and Lucas cannot give each other up. She will risk anything for the chance to see him again, even if that means coming face to face with the hunters of Black Cross or keeping secrets from those whom she loves the most.However, Bianca isn't the only one keeping secrets and when Evernight is attacked by an evil force she discovers that the truth she thought she knew is only the beginning",N/A,N/A
The Forbidden Body,['Douglas E. Cowan'],2022-05-17,['Fiction'],"""Throughout history, the religious imagination has attempted to control nothing so much as our bodies: what they are and what they mean; what we do with them, with whom, and under what circumstances; how they may be displayed-or, more commonly, how they must be hidden. Religious belief and mandate affect how our bodies are used in ritual practice, as well as how we use them to identify and marginalize threatening religious Others. This book examines how horror culture treats religious bodies that have stepped (or been pushed) out of their 'proper' place. Unlike most books on religion and horror, This book explores the dark spaces where sex, sexual representation, and the sexual body come together with religious belief and scary stories. Because these intersections of sex, horror, and the religious imagination force us to question the nature of consensus reality, supernatural horror, especially as it concerns the body, often shows us the religious imagination at work in real time. It is important to note that the discussion in this book is not limited either to horror cinema or to popular fiction, but considers a wide range of material, including literary horror, weird fiction, graphic storytelling, visual arts, participative culture, and aspects of real-world religious fear. It is less concerned with horror as a genre (which is mainly a function of marketing) and more with the horror mode, a way of storytelling that finds expression across a number of genres, a variety of media, and even blurs the boundary between fiction and non-fiction. This expanded focus not only deepens the pool of potential examples, but invites a much broader readership in for a swim""--",N/A,N/A
Monster Blood,['R. L. Stine'],1992,['Juvenile Fiction'],"When Evan and Andy find a dusty can labeled ""Monster Blood"" in weird Aunt Kathryn's house, they make the mistake of opening it.",5,N/A
Twilight Eyes,['Dean Ray Koontz'],2004-01-01,['Fiction'],"Sought by police for murder, slim Mackenzie, a young man both blessed and cursed by ""twilight eyes,"" stalks the diabolical ""Others,"" who feed their twisted needs with human suffering",N/A,N/A
No Go the Bogeyman,['Marina Warner'],1998,['Art'],"Examines the figure of the bogeyman, monster and other figures of male terror in literature, mythology, folk tale, jokes and lullaby.",N/A,N/A
Saurian,['William Schoell'],1988,['Fiction'],N/A,N/A,N/A
The Deadly Past,['Christopher Pike'],1996,['Dinosaurs'],N/A,N/A,N/A
The Abominable Snowman of Pasadena,['R. L. Stine'],2003-08-01,['Juvenile Fiction'],"Becoming sick of the endless hot weather in their Pasadena home, Jordan and Nicole Blake wish for a real winter and are delighted with an Alaskan family vacation, until they come face-to-face with the abominable snowman.",5,N/A
The Deadly Doll,['Janine Burke'],2008,['Juvenile Fiction'],"When Claudine's family receives in the mail a beautiful old French doll that has been in the family for generations, no one anticipates its malevolent intentions.",N/A,N/A
Switched,['R. L. Stine'],1995,['English fiction'],"There's a little cabin in the Fear Street woods where a girl can lose her mind. In fact, she can change it into someone else's. That's what happened to Nicole and Lucy. Now Lucy is in Nicole's body and vice-versa. What a trip! But for Nicole, what a trap! Because Lucy is using her body to get away with murder. Copyright © Libri GmbH. All rights reserved.",N/A,N/A
Hollowland,['Amanda Hocking'],2010,['Horror'],Hollowland - the first book in the young adult dystopian series The Hollows.,N/A,N/A
The Dwelling,['Susie Moloney'],2004,['Fiction'],"In the tradition of Shirley Jackson's ""The Haunting of Hill House,"" this novel about a suburban home that has as many secrets as owners is told through the stories of three families who occupy the house.",N/A,N/A
Doctor Sleep,['Stephen King'],2013,['Families'],"On highways across America, a tribe of people called The True Knot travel in search of sustenance. But as Dan Torrance knows, and spunky twelve-year-old Abra Stone learns, The True Knot are quasi-immortal, living off the steam that children with the shining produce when they are slowly tortured to death",N/A,N/A
Ticktock,['Dean Ray Koontz'],1997,"['California, Southern']","Detective novelist Tommy Phan comes home to find a strange doll on his doorstep. That night, something terrifying breaks out of the doll and begins to follow Tommy wherever he goes.",N/A,N/A
Inside the Worm,['Robert Swindells'],1994,['Dragons'],Everyone in Elsworth knows the local legend about the monstrous worm - or dragon - that once terrorized the village. But it never really happened. Or did it? The worm is returning - with a thousand-year hunger in its belly . . .,N/A,N/A
Bitten,['Kelley Armstrong'],2004,['Fiction'],"On the eve of her marriage, Elena Michaels learns that her fiance has been concealing his secret life as a werewolf, and, as a bonus, he has made her into one also.",N/A,N/A
Welcome to Dead House,['R. L. Stine'],1992,['Juvenile Fiction'],"When their father inherits an old house in the town of Dark Falls, Amanda and Josh are excited--until they begin to suspect that the house is haunted.",N/A,N/A
More Horowitz Horror,['Anthony Horowitz'],2000,"[""Children's stories, English""]","Some mysterious deaths linked to a second hand camera, a boy trapped inside a computer game, a frightening journey on a bus that doesn't seem to exist and a terrifying dream that comes true. These are some of the horror stories in this collection.",N/A,N/A
Fantastic Cinema Subject Guide,"['Bryan Senn', 'John Johnson']",1992,['Performing Arts'],"About 2,500 genre films are entered under more than 100 subject headings, ranging from abominable snowmen through dreamkillers, rats, and time travel, to zombies, with a brief essay on each topic: development, highlights, and trends. Each film entry shows year of release, distribution company, country of origin, director, producer, screenwriter, cinematographer, cast credits, plot synopsis and critical commentary.",N/A,N/A
Bitten,['Kelley Armstrong'],2001,['Fiction'],"""Young, beautiful, and successful, Elena Michaels seems to have it all. Her happy, organized life follows a predictable pattern: filing stories for her job as a journalist, working out at the gym, living with her architect boyfriend, and lunching with her girlfriends from the office. And once a week, in the dead of night, she streaks through a downtown ravine, naked and furred, tearing at the throats of her animal prey."" ""Elena Michaels is a werewolf."" ""The man who made her one has been left behind, but his dark legacy has not. And though Elena struggles to maintain the normal life she's worked so hard to create, she cannot resist the call of the elite pack of werewolves from her past. Her feral instincts will lead her back to them and into a desperate war for survival that will test her own understanding of who, and what, she is.""--BOOK JACKET.Title Summary field provided by Blackwell North America, Inc. All Rights Reserved",N/A,N/A
Clockwork,['Philip Pullman'],1998,['Juvenile Fiction'],"Long ago in Germany, a storyteller's story and an apprentice clockwork-maker's nightmare meet in a menacing, lifelike figure created by the strange Dr. Kalmenius.",N/A,N/A
Halloween Party,['R. L. Stine'],1990,['Horror'],N/A,N/A,N/A
The Witch's Revenge,['Christopher Pike'],1998,"[""Children's stories""]",N/A,N/A,N/A
First Date,['R.L. Stine'],2006,['Fiction'],"Fifteen-year-old Chelsea longs for a boyfriend, but when two new boys come to Shadyside and the FBI tracks a killer there, she wonders if she should accept her first date.",4.5,N/A
The Stand,['Stephen King'],1980-01-01,['Good and evil'],"For use in schools and libraries only. A monumentally devastating plague leaves only a few survivors who, in a desert world, experience dreams of good and evil in confrontation and, through their choices, move toward an actual confrontation.",N/A,N/A
The Throat,['Peter Straub'],1993,['Fiction'],"A tormented writer unable to exorcise the demons of his past...an all-American town plagued by horrific secrets...a beautiful woman brutally murdered by a twisted killer thought long dead-or by an even more terrifying copycat? In The Throat , Peter Straub's Blue Rose trilogy blooms into a horrifically chilling, maniacally suspenseful masterwork of terror.",N/A,N/A
How to Kill a Monster,['R. L. Stine'],2003-08-01,['Juvenile Fiction'],"Hating to stay with their deaf grandfather and baking-crazed grandmother, Gretchen and her stepbrother, Clark, fear the strange growling noises that they hear coming from the room on the second floor.",N/A,N/A
Tales of Mystery and Imagination ... Illustrated by Harry Clarke,"['Edgar Allan Poe', 'Harry CLARKE (Artist.)']",1923*,[],N/A,N/A,N/A
The H.P. Lovecraft Omnibus 3,['Howard Phillips Lovecraft'],1985,['Fiction'],A collection of some of the most famous stories from the master of tomb-dark fear...,N/A,N/A
We Need to Talk About Kevin,['Lionel Shriver'],2004-05,['Fiction'],"The gripping international bestseller about motherhood gone awry Eva never really wanted to be a mother certainly not the mother of the unlovable boy who murdered seven of his fellow high school students, a cafeteria worker, and a much-adored teacher who tried to befriend him, all two days before his sixteenth birthday. Now, two years later, it is time for her to come to terms with marriage, career, family, parenthood, and Kevin's horrific rampage in a series of startlingly direct correspondences with her estranged husband, Franklyn. Uneasy with the sacrifices and social demotion of motherhood from the start, Eva fears that her alarming dislike for her own son may be responsible for driving him so nihilistically off the rails.",N/A,N/A
Making Friends with Frankenstein,['Colin McNaughton'],1994,"[""Children's poetry, English""]","Presents a collection of silly, scary, and disgusting poems about monsters and other unusual creatures.",N/A,N/A
The Oxford Book of Scary Tales,['Dennis Pepper'],1995,['Juvenile Fiction'],"A collection of scary tales, some dealing with ordinary things, and others with ghosts, monsters and strange happenings.",N/A,N/A
Life Expectancy,['Dean Koontz'],2005,['Fiction'],"In the dazzling new thriller from the master of dark suspense, the hand of fate reaches out to touch an ordinary man with greatness. So long as he is ready. So long as he is, above all, afraid. Jimmy Tock comes into the world on the very night his grandfather leaves it. As a violent storm rages outside the hospital, Rudy Tock spends long hours walking the corridors between the expectant fathers' waiting room and his dying father's bedside. It's a strange vigil made all the stranger when, at the very height of the storm's fury, Josef Tock suddenly sits up in bed and speaks coherently for the first and last time since his stroke. What he says before he dies is that there will be five dark days in the life of his grandson -- five dates whose terrible events Jimmy will have to prepare himself to face. The first is to occur in his 20th year; the second in his 23rd year; the third in his 28th; the fourth in his 29th; the fifth in his 30th. Rudy is all too ready to discount his father's last words as a dying man's delusional rambling. birth to the minute, as well as his exact height, weight, and the fact that Jimmy would be born with syndactyly -- the unexplained anomaly of fused digits on his left foot. Suddenly, the old man's predictions take on a chilling significance. What terrifying events await Jimmy on these five dark days? What nightmares will he face? What challenges must he survive? As the novel unfolds, picking up Jimmy's story at each of these crisis points, the path he must follow will defy every expectation. And with each crisis he faces, he will move closer to a fate he could never have imagined. For who Jimmy Tock is and what he must accomplish on the five days his world turns is a mystery as dangerous as it is wondrous -- a struggle against an evil so dark and pervasive only the most extraordinary of human spirits can shine through.",N/A,N/A
Revenge,['Yoko Ogawa'],2013,['Horror'],"Offers eleven interwoven macabre short stories that take an ominous look at grotesque characters, violent emotions, and murder.",N/A,N/A
Please Don't Feed the Vampire!,['R. L. Stine'],1997,['Juvenile Fiction'],"You are invited to choose from over 20 spooky endings. You buy something called ""Vampire in a can"" and at first you think it's just a goofy vampire costume, but then you notice a packet in the bottom of the can labeled: DANGER--KEEP AWAY!",5,N/A
Diseases of the Head,['Matt Rosen'],2020-09-22,['Literary Criticism'],"Diseases of the Head is an anthology of essays from contemporary philosophers, artists, and writers working at the crossroads of speculative philosophy and speculative horror. At once a compendium of multivocal endeavors, a breviary of supposedly illicit ponderings, and a travelogue of philosophical exploration, this collection centers itself on the place at which philosophy and horror meet. Employing rigorous analysis, incisive experimentation, and novel invention, this anthology asks about the use that speculation can make of horror and horror of speculation, about whether philosophy is fictional or fiction philosophical, and about the relationship between horror, the exigencies of our world and time, and the future developments that may await us in philosophy itself. From philosophers working on horrific themes, to horror writers influenced by heresies in the wake of post-Kantianism, to artists engaged in projects that address monstrosity and alienation, Diseases of the Head aims at nothing less than a speculative coup d'état.Refusing both total negation and absolute affirmation, refusing to deny everything or account for everything, refusing the posture of critique and the posture of all-encompassing unification, this collection of essays aims at exposition and construction, analysis and creation - it desires to fight for some thing, but not everything, and not nothing. And it desires, most of all, to speak from the position of its own insufficiency, its own partiality, its own under-determinacy, which is always indicative of the practice of thinking, of speculation. Considering themes of anonymity, otherness and alterity, the gothic, extinction and the world without us, the end times, the apocalypse, the ancient and the world before us, and the uncanny or unheimlich, among other motifs, this anthology seeks to articulate the cutting edge which can be found at the intersection of speculative philosophy and speculative horror.Matt Rosen is a philosopher. He is the author of numerous books and pamphlets, including Speculative Annihilationism (Zero Books, 2019) and the forthcoming treatise Angst and Abnegation. His theoretical writings have also appeared in journals and anthologies. His work centers on radical ethics and alterity, and his interests range across a variety of areas, including moral philosophy, metaphysics, literature, mysticism, psychoanalysis, theology, politics, and aesthetics.",N/A,N/A
The Electric Black,"['Joseph Schmalke', 'Rich Woodall']",2021-10-12,['Comics & Graphic Novels'],"The Electric Black is a horror series set in an antique shop that travels through time and space delivering cursed objects to unsuspecting customers. written and Illustrated by Joseph Schmalke and Rich Woodall published quarterly by Black Caravan a Scout Comics Imprint. The Electric Black is a cursed antique shop, appearing in any time or space, soliciting customers it hungers to corrupt or devour. The mysterious Julius Black is the store's demonic proprietor and narrator. He, along with his psychopathic employees, regularly manipulates patrons for their own devious purposes. Inside the eerie emporium, all of the forbidden objects have secrets to unlock. The poor souls that enter never leave without something. It's dark light will shine on macabre mysteries, grisly murders, and other frightful occurrences. Dare you step within its sinister halls?",N/A,N/A
Cry of the Cat,['R. L. Stine'],1998-01-01,['Juvenile Fiction'],"Hoping to simply return a black cat to its rightful owner, Allison ventures into the dark, broken-down house where the cat lives, never suspecting that her biggest problem will be getting out. Original.",5,N/A
The Curse of Magoria,['Paul Stewart'],2004,['Juvenile Nonfiction'],"A breathtaking tale of dark magic, adventure and revenge.",N/A,N/A
"Cobwebs, Chatters, and Chills",[],2004,['American poetry'],"An anthology of poems about frightening things, plus Toolbox tips that help the reader understand poetry and how poems are written.",N/A,N/A
Night Pilgrims,['Chelsea Quinn Yarbro'],2013-07-30,['Fiction'],Blood and faith are on display as the vampire Count Saint-Germain leads a caravan of pilgrims through an Egypt still recovering from the Crusades,N/A,N/A
We Have Always Lived in the Castle,['Shirley Jackson'],2006-10-31,['Fiction'],"Alone since four members of the family died of arsenic poisoning, Merricat, Constance, and Julian Blackwood spend their days in happy isolation until cousin Charles appears.",N/A,N/A
Field of Screams,['R. L. Stine'],1997,['Fiction'],"The Moon and Sixpence, published in 1919, was one of the novels that galvanized W. Somerset Maughams reputation as a literary master. It follows the life of one Charles Strickland, a bourgeois city gent whose dull exterior conceals the soul of a genius. Compulsive and impassioned, he abandons his home, wife, and children to devote himself slavishly to painting. In a tiny studio in Paris, he fills canvas after canvas, refusing to sell or even exhibit his work. Beset by poverty, sickness, and his own intransigent, unscrupulous nature, he drifts to Tahiti, where, even after being blinded by leprosy, he produces some of his most extraordinary works of art. Inspired by the life of Paul Gauguin, The Moon and Sixpence is an unforgettable study of a man possessed by the need to createregardless of the cost to himself and to others.",N/A,N/A
Go Eat Worms!,['R. L. Stine'],2004-12-01,['Juvenile Fiction'],"Discovering the creatures of his basement worm farm in unlikely and unwanted places, like his bed, his toothbrush, and his spaghetti, worm-obsessed Todd finds himself grossed out by the very things with which he used to torture his sister.",N/A,N/A
Pet Sematary,['Stephen King'],1983,['Fiction'],"""""Sometimes dead is better...."""" When the Creeds move into a beautiful old house in rural Maine, it all seems too good to be true: physician father, beautiful wife, charming little daughter, adorable infant son -- and now an idyllic home. As a family, they've got it all...right down to the friendly cat. But the nearby woods hide a blood-chilling truth -- more terrifying than death itself...and hideously more powerful.",N/A,N/A
The Accident,['Elie Wiesel'],1982-08-01,['Fiction'],"A man seriously injured when hit by a car is taken to the hospital where a doctor, the woman who loves him, and his artist friend lead him to yearn for life rather than death",N/A,N/A
"Snow White, Blood Red","['Ellen Datlow', 'Terri Windling']",1996-01,['Fantasy'],N/A,N/A,N/A
One Million Tiny Fires,['Ashley Robin Franklin'],2020,['Comics & Graphic Novels'],"A metaphysical horror comic from cartoonist Ashley Robin Franklin, author of Fruiting Bodies. Fusing sexual intimacy with cosmic dread, this queer horror tale follows Briana and Cassie, a couple in an isolated Texas farmhouse, whose rural fantasy has soured into a tense nightmare. After discovering an unknown object that had crash landed from the sky, Briana begins to suspect that something uncanny is happening to her partner.",N/A,N/A
I Know what You Did Last Summer,['Lois Duncan'],1995,['Detective and mystery stories'],Julie faces a crisis of conscience when she is involved in a fatal hit and run accident.,N/A,N/A
The Last Vampire,['Christopher Pike'],1994,['Horror'],"Alisa Perne is the last vampire. Beautiful and brilliant, she hunts alone, living among humans, living off humans. But someone is stalking her. Someone wants her dead. And Alisa has a choice to make - to keep a long held promise or protect the mortal she seems to be falling for.",N/A,N/A
The Secret Bedroom,['R. L. Stine'],1991,['Juvenile Fiction'],Lea Carson discovers the secret of the creepy room in the attic of her house on Fear Street.,5,N/A
