title,authors,publishedDate,categories,description,averageRating,textSnippet,language
Managing Technological Innovation,['Frederick Betz'],2003-07-03,['Business & Economics'],"Technology management as a field came together during the 1980s in response to the question of how society could deliberately create new technology and exploit it in economic development. This updated edition introduces technology management, covers the importance of managing information technologies, and compares them to existing physical technologies.",N/A,N/A,en
Nascent Entrepreneurship,['Per Davidsson'],2006,['Business & Economics'],"Small Firm Growth has two purposes -- to review the extant empirical literature on small firm growth by focusing on small and medium-sized firms (SMEs) and to suggest a framework for integrating our knowledge on small firm growth to guide future research. The authors identify a number of key themes: the conceptualization of small firm growth, assessing small firm growth, factors driving or hindering growth, modes of growth (such as organic growth versus acquisitions), growth stages and transition, and the effects of small firm growth. Small Firm Growth first discusses the nature of the phenomenon of small firm growth and its relation to entrepreneurship as well as size and age. It then moves on to how growth can best be assessed. A major section is devoted to findings on factors that contribute to or hinder firm growth. Following this it offers a section on how small firms grow, if and when they grow at all. In particular, it examines organic growth versus acquisitions; growth through networking and alliances, and international expansion. The next topic treated is 'growth stages and transitions' and the effects of growth in terms of profitability and job creation. Finally, the authors propose a framework for guiding future research and furthering management theory and practice on small firm growth.",N/A,N/A,en
A Social Theory of Innovation,['Alexander Styhre'],2013,['Business & Economics'],"The contemporary economy is primarily understood through the rationalist and formalist lenses of economic theory and its accompanying (mainstream) theories of organization and management. In this corpus of work, the economy is commonly portrayed as emerging on the basis of the calculated and instrumental use of heterogeneous resources. Innovation - the capacity to produce new goods and services, being of key importance in a competitive capitalist economic regime - is a joint collaborative process embedded in social action, i.e., through forms of agency. In contrast to individualist, calculative, and utilitarian images of economic agency, sociologists, historians, anthropologists, and others have demonstrated that economic agency is determined in many cases by social and cultural conditions that extend beyond the narrow sphere of instrumental economic behavior. A Social Theory of Innovation makes a connection between innovation, economic agency, and three complementary perspectives - i.e. those of playfulness, reciprocity, and squandering (the conspicuous and symbolic waste of excess resources) - in terms of being three principles that underlie innovative and creative work. Rather than postulating the homo oeconomicus model of economic agency - prescribed by neoclassical economic theory - as the only possible and legitimate image of economic agency, alternative models exist which in various ways contribute to our understanding of how and why innovation is produced in contemporary society. The book draws on a diverse corpus of literature from management studies, economics, economic sociology, and the humanities to provide a less confined and narrow image of innovation and economic agency. This book is intended for undergraduate, graduate, and post-graduate business school curricula in both economic sociology and other educational programs addressing the organization of the economy and society at large.",N/A,N/A,en
Insight in Innovation,"['Jan Verloop', 'J. G. Wissema']",2004-05-08,['Business & Economics'],"Managing innovation in such a way that it becomes an effective tool for achieving strategic organizational objectives is the subject of this work, which provides insight into the management process for innovation in creating intellectual capital and supporting sustainable development.",N/A,N/A,en
Organizing Innovation,['Marcel Veenswijk'],2006,['Business & Economics'],"New Public Management as an administrative reform ideology as well as conceptual innovation has changed the outlook of public administration during the last ten years. Public administration and public administration reform should not only be concerned with the improvement of the efficiency and coherence which play an important role in public administration, but also political values like liberty, equity and security as well as legal values like the rule of the law. The modernization agenda of public administration has a rather internal focus, while the ultimate test for the modernization of public administration is the way in which governments are able to respond to changing social, cultural and economic conditions and the wicked policy problems which result from them. This publication contains interesting contributions to the science and practice of public administration.",N/A,N/A,en
Enterprise,"['Robin Lowe', 'Sue Marriott']",2006,['Business & Economics'],"The authors here discuss the factors that should be taken into account when starting up a new business. However, a key factor of this book is the emphasis on the learning and decision-making processes of entrepreneurs.",N/A,N/A,en
Research Handbook on Gender and Innovation,"['Gry Agnete Alsos', 'Ulla Hytti', 'Elisabet Ljunggren']",2016-09-30,['Business & Economics'],"Innovation is seen as one of the main engines of economic growth. It is generally assumed to be gender neutral when, in fact, the gendered construction of innovation has been traditionally masculine. This Handbookexplores the nexus between innovation and gender by providing a wide range of studies from different analytical and methodological perspectives and from various regional and industry contexts and draws implications for a gender-inclusive innovation policy. The multi-disciplinary group of contributors discuss topics such as gender and innovation in new and small businesses, and growth businesses; addressing innovation in different organizational contexts ranging from public sector health care to mining and forestry; researching gender in innovation policy and in design and materiality. ThisHandbook will be useful to researchers looking to understand parallels between research on gender and innovation on one hand, and research on gender and entrepreneurship or management on the other. It will also be invaluable to students looking for an overview of research in both areas. Contributors include: R. Aidis, G.A. Alsos, N. Amble, E. Andersson, L. Andersson, P. Axelsen, K.-E. Berglund, T. Bijedic, E. Börjesson, S. Brink, K. Ehrnberger, K. Ettl, E. Fernandes, L. Foss, C. Henry, U. Hytti, S. Ilstedt, A. Isaksson, M. Johansson, A. Kovalainen, S. Kriwoluzky, T. Kvidal-Røvik, R. Leite, M. Lindberg, B. Ljunggren, E. Ljunggren, S. Martins, S. Poutanen, S.R. Sardeshmukh, R.M. Smith, L.K. Snerthammer, M. Tillmar, F. Welter",N/A,N/A,en
Software Takes Command,['Lev Manovich'],2013-07-04,['Social Science'],Offers the first look at the aesthetics of contemporary design from the theoretical perspectives of media theory and 'software studies'.,N/A,N/A,en
Managing Innovation and Change,['David Mayle'],2006-08-30,['Business & Economics'],"Building on the success of the Second Edition with 19 new chapters, Managing Innovation and Change showcases the best work of thinkers writing in this area and provides a coherent picture of key ideas and concepts to have emerged from this exciting field. Frequently radical and intentionally provocative in terms of topic and treatment, the book: - covers the increasing diversity of pressures to which modern enterprises are subjected; - reviews some of the more persistent acronyms to which the art of management is increasingly prone; - examines the nature of innovation; - looks at the broader issues surrounding change, and - turns to those attributes of leadership which are consistent with the successful management of innovation and change.",4,N/A,en
Innovative Minds,"['Ulrich Eberl', 'Joerg Puma', 'Jörg U. Puma']",2007-08-13,['Business & Economics'],"Innovative Minds: A Look Inside Siemens' Idea Machine tells the story of 30 innovations - the large and the small, the rapid and the slow-moving, the disruptive and the evolutionary - and covers the entire spectrum of people and processes involved in their development. The book provides a unique insight into the multi-dimensional process of innovation development at Siemens. All of the innovations were shaped not only by complex organizational forces and strategies, but also by a host of factors, including bold visions, creative freedom, conflicts, internal and external networks, customer orientation, teamwork - and an ample measure of luck. Every innovation story yields many valuable lessons, for companies and for each individual involved. With this in mind, the authors offer a wealth of experiences for all readers who are involved in the process of innovation - whether in a strategic or hands-on capacity - infields such as research and development, marketing, production and sales, strategy and innovation management, organization and management.",N/A,N/A,en
Leadership for Innovation,['John Eric Adair'],2007,['Business & Economics'],"Innovate or stagnate: that is the stark challenge facing all businesses today. Creating an innovative climate is essential for positive organizational change and this throws up a need for leaders who can bring about this change.Adair looks at the links between leadership, creativity and change. This book will help leaders of all types to meet the challenge of innovation, and achieve profitable growth through team creativity.Using case studies of Google, Honda and 3M, Adair covers topics such as the characteristics of innovators, organizing for team creativity, the expectations of creative people, creative leadership, managing the criticism of ideas and overcoming resistance to change.Leadership for Innovation will help leaders of all types to meet the challenge of innovation, and achieve profitable growth through team creativity.",N/A,N/A,en
Innovation & Creativity,"['Jonne Ceserani', 'Peter Greatwood']",1995,['Business & Economics'],The authors of this book make use of Synectics' unrivalled experience and expertise in helping people and organisations to use more of their innate creativity and talent. It is packed with tools and case examples.,N/A,N/A,en
New Service Development,"['James A. Fitzsimmons', 'Mona J. Fitzsimmons']",2000,['Business & Economics'],This text addresses the issues of how to develop new service products - where the concept of service has moved from transaction to experience. The authors draw upon the expertise of internationally recognised authors.,N/A,N/A,en
The Innovative Leader,['Paul Sloane'],2007,['Business & Economics'],Sloane stresses the importance of innovation and creativity in modern business to help organizations secure competitive advantage over rivals. He also demonstrates the importance of setting out a clear vision and the need for continual evaluation of the process.,N/A,N/A,en
Creating Regional Wealth in the Innovation Economy,"['Jeff Saperstein', 'Daniel Rouach']",2002,['Business & Economics'],"""Pinpoints the reasons why some locations succeed in the quest to become centres of technology and innovation."" - cover.",4,N/A,en
"Innovation, Product Development and Commercialization",['Dariush Rafinejad'],2007-06-15,['Business & Economics'],"This title uses a holistic approach to examine the diverse issues that managers face to channel resources in the right direction for commercial success. It details the commercialization of innovation and new products in fast-paced, high-tech markets and how to match tecnological advances to new market opportunities.",4,N/A,en
Creative Research,['Hilary Collins'],2010-11-25,['Art'],"Techniques and procedures for collecting and analysing different types of data are examined and analysed in detail. The skills necessary to promote the effectiveness and validity of research within the creative industries are highlighted in case studies, all of which also demonstrate what a well-designed research project can achieve.",N/A,N/A,en
Encyclopedia of New Venture Management,['Matthew R. Marvel'],2012-05-18,['Business & Economics'],"The Encyclopedia of New Venture Management explores the skills needed to succeed in business, along with the potential risks and rewards and environmental settings and characteristics.",N/A,N/A,en
The Oxford Handbook of Innovation,"['Jan Fagerberg', 'David C. Mowery', 'Richard R. Nelson']",2006-01-19,['Business & Economics'],This handbook provides academics and students with a comprehensive and holistic understanding of the phenomenon of innovation.,N/A,N/A,en
Management of Change and Innovation,['Bengt-Arne Vedin'],1994,['Business & Economics'],"This work on change and innovation covers, among other topics, the strategic management of uncertainty; the third dimension of leadership; managing corporate development; culture as an invisible barrier to strategic change; implementing innovation; and the acceleration trap.",N/A,N/A,en
The Dynamics of Innovation in Eastern Europe,['Per Högselius'],2005,['Business & Economics'],"Building strong and dynamic systems of innovation constitutes a key challenge for the post-socialist economies of Central and Eastern Europe. This book develops a strong conceptual and empirical foundation for understanding how such dynamic systems may emerge. The Dynamics of Innovation in Eastern Europeexplains, in particular, how this has been possible in the case of the Estonian system of innovation in telecommunications. The book shows that the socialist historical heritage, and in particular inherited competencies, may be used in highly creative ways for generating dynamic innovation in the post-socialist context. It also uncovers the complex and multifaceted ways in which the geographical and cultural proximity to Western Europe can be creatively used as a powerful resource in the pursuit of building systems of innovation in the East. Moreover, the book demonstrates that it is possible for East European systems of innovation to develop highly creative domestic dynamics without necessarily imitating Western systems or styles of innovation. Providing a unique empirical analysis of how systems of innovation undergo far-reaching transformation and change, this book will be of interest to economists and scholars involved in issues relating to innovation, technology, economic development and East-West integration. Policymakers in the EU and in Central and East European countries and practitioners involved in innovation-related activities will also find it of great appeal.",N/A,N/A,en
Open Innovation,"['Henry William Chesbrough', 'Wim Vanhaverbeke', 'Joel West']",2008-01,['Business & Economics'],"Publisher description: ""Counter This collection investigates the phenomenon of ""Open Innovation,"", in which firms draw on research and development that may lie outside their own boundaries. The book's contributors link the practice of innovation to the established body of innovation rsearch, showing what's new and what's familiar in the process. Looking in depth at a process recently adopted by such leading firms as Intel and Cisco, this book will lead the intellectual debate in an increasingly important area. """,N/A,N/A,en
Small Business Management and Entrepreneurship,"['David Stokes', 'Nicholas Wilson']",2006,['Business & Economics'],"Now in its 5th edition this comprehensive, practically focused and highly accessible text explores the contexts, choices and strategies facing the small business venture, including extensive coverage of planning a new venture. Pedagogical features developed in response to market feedback include running case material to explore the same case situation from a number of different but interrelated angles, annotated further reading, new chapter-end real world case studies, learning objectives and linked chapter summaries – providing a student- and lecturer-friendly learning environment.Students on modules such as Personal Development and Effectiveness, Study Skills, Management Skills, Business Skills, Business Communication, Business Awareness, Managing Oneself and Others at – for example – BABS/BABA, HND/HNC, DMS, MBA levels will all find this a hugely valuable text through study and working life.",N/A,N/A,en
Research on the Management of Innovation,"['Andrew H. Van de Ven', 'Harold L. Angle', 'Marshall Scott Poole']",2000,['Business & Economics'],"List of Figures. List of Tables. Preface to the Paperback Edition. Preface to the Original Edition. Section I: Overview of Research Program and Methods. 1. An Introduction to the Minnesota Innovation Research Program, Andrew H. Van de Ven and Harold L. Angle. 2. Methods for Studying Innovation Processes, Andrew H. Van de Ven and Marshall Scott Poole. 3. A Psychometric Assessment of the Minnesota Innovation Survey, Andrew H. Van de Ven and Yun-han Chu. Section II: The Minnesota Innovation Research Program Framework. 4. The Development of Innovation Ideas, Roger G. Schroeder, Andrew H. Van de Ve.",N/A,N/A,en
Managerial Economics and Organizational Architecture,"['James A. Brickley', 'Clifford W. Smith', 'Jerold L. Zimmerman']",2001,['Business & Economics'],This text shows managers how economics can be used to structure organizations.,N/A,N/A,en
Creative Industries and Innovation in Europe,['Luciana Lazzeretti'],2013,['Business & Economics'],"In recent years, the study of creativity has shifted from analysis of culture as an end in itself to one of economic enhancement, and its capability to generate wealth and promote economic development. Increasingly, European cities and regions are using the arts to fuel wellbeing and reinvigorate economies after the comparative demise of more traditional industry and manufacturing. A growing literature is starting to highlight the innovation capacity of cultural and creative industries (CCIs) as they intersect the innovation processes of other manufacturing and services sectors with an innovative and creative output. Culture and creativity may be a strategic weapon to exit the present crisis and redefine an economic model of sustainable development. This book brings together a set of multidisciplinary contributions to investigate the kaleidoscope of European creativity, focussing on CCIs and the innovations connected with them. The two main questions that this volume aims to address are: How can we identify, map and define CCIs in Europe? And how do they contribute to innovation and sustainable growth? The volume is split into two parts. The first part deals with the definition, measurement and mapping of the geography of European CCIs according to a local economic approach, focussing on Italy, Spain, the UK, Austria, Denmark and France. This section surveys the different industrial typologies and spatial patterns, which underline a significant dissimilarity between the North and the South of Europe, mainly due to the difference between heritage-driven and technology-driven countries. The section concludes with a case study on a Japanese creative city. The second part collects some interesting cases of innovation generated in creative spaces such as cities of art or creative clusters and networks. This entails the study of innovations among creative and non-creative sectors (e.g. laser technologies in conservation of works of art and design networks in Italy) and across European and non-European countries (e.g. Spaghetti Western movies in the US or visual artists in New Zealand). Finally, an innovation capacity of culture that can regenerate mature sectors (e.g. the French food supply chain and Swiss watch Valley) or combine the creative and green economics paradigms (e.g. the green creative cities in North Europe) is analyzed. This book will appeal to academics, scholars and practitioners of urban and regional studies, cultural and creative economics and managerial and organization studies.",N/A,N/A,en
Innovation Management and New Product Development,['Paul Trott'],1998,['Industrial management'],"This text offers final year undergraduate and post-graduate students a contemporary view of innovation management that focuses on the links and overlaps between groups and disciplines. It takes a necessarily broad perspective, bringing together the three areas of business/organisation strategy, marketing and R&D. Moreover, it offers a framework through which students can view the management process of innovation. *Brings together the three areas of business/organisation strategy, marketing and R&D. *Uses international mini-cases including: the development of the Guinness 'in-can system', Gillette Sensor, 3M and many more. *Includes innovation and new product development in one volume.",N/A,N/A,en
The Economics of Technical Change,"['Edwin Mansfield', 'Elizabeth Mansfield']",1993,['Business & Economics'],"The 25 classic articles in this volume deal with the role of technological change in economic growth, the extent of social and private returns from research and development, the relationship between market structure and technological change, the controversies over intellectual property rights, the processes by which innovations spread, and the management of technology. This volume will prove invaluable to economists, managers and government policymakers.",N/A,N/A,en
Innovative Public Procurement and Health Care,"['Nordic Council of Ministers', 'Nordiska Ministerrådet']",2011-11-16,['Medical'],"This report focuses on the use of innovative procurement in the health sector in the Nordic countries. It presents six Nordic cases demonstrating best practice within innovative procurement. The report argues that despite challenges particularly relating to navigating the legal framework, there are benefits associated with the use of innovative procurement. The use of dialogue between procurers and suppliers is highlighted as a key benefit in innovative procurement as it leads to increased knowledge of possibilities available in the market and hence better solutions. As innovative procurement practice is still relatively new across the Nordic countries, there is a need to disseminate best practices and to develop procurement guides to assist the implementation. The report has been prepared by DAMVAD.",N/A,N/A,en
Management of Technology and Operations,['R. Ray Gehani'],1998-09-14,['Business & Economics'],"In the global marketplace, there are six sources of sustainable competitive advantage which determine a company's short-term survival and long-term market leadership. This text discusses the concepts in the context of an engine - where the cylinders are the six sources of sustainable advantage.",N/A,N/A,en
Cooperation in Research and Development,['Nicholas S. Vonortas'],1997-10-31,['Business & Economics'],"The volume attempts to fill a void caused by this lack of consistent data on the rate of RJV formation, RJV characteristics, and RJV member characteristics.",N/A,N/A,en
Prototype Nation,['Silvia M. Lindtner'],2020-09-15,['Business & Economics'],"A vivid look at China’s shifting place in the global political economy of technology production How did China’s mass manufacturing and “copycat” production become transformed, in the global tech imagination, from something holding the nation back to one of its key assets? Prototype Nation offers a rich transnational analysis of how the promise of democratized innovation and entrepreneurial life has shaped China’s governance and global image. With historical precision and ethnographic detail, Silvia Lindtner reveals how a growing distrust in Western models of progress and development, including Silicon Valley and the tech industry after the financial crisis of 2007–8, shaped the rise of the global maker movement and the vision of China as a “new frontier” of innovation. Lindtner’s investigations draw on more than a decade of research in experimental work spaces—makerspaces, coworking spaces, innovation hubs, hackathons, and startup weekends—in China, the United States, Africa, Europe, Taiwan, and Singapore, as well as in key sites of technology investment and industrial production—tech incubators, corporate offices, and factories. She examines how the ideals of the maker movement, to intervene in social and economic structures, served the technopolitical project of prototyping a “new” optimistic, assertive, and global China. In doing so, Lindtner demonstrates that entrepreneurial living influences governance, education, policy, investment, and urban redesign in ways that normalize the persistence of sexism, racism, colonialism, and labor exploitation. Prototype Nation shows that by attending to the bodies and sites that nurture entrepreneurial life, technology can be extricated from the seemingly endless cycle of promise and violence. Cover image: Courtesy of Cao Fei, Vitamin Creative Space and Sprüth Magers",N/A,N/A,en
Wikinomics,"['Don Tapscott', 'Anthony D. Williams']",2007,['Business networks'],"Translated into more than 20 languages and named one of the best business books of the year by reviewers around the world, ""Wikinomics"" has become essential reading for business people everywhere as it explains how mass collaboration is happening not just at Web sites but at traditional companies.",N/A,N/A,en
