title,authors,publishedDate,categories,description,averageRating,textSnippet,language
Innovation and Industrial Strength,"['Joan G. Cox', 'Herbert Kriegbaum']",1989,['Business & Economics'],"""To survive in a competitive world, manufacturing industry muat invest both in new plant and in new technology. This study estimates the volume of investment of both kinds of five industries in Britain, Wesy Germany, the United States and Japan...Overall, the authors find that a high level of investment in plant is no guarantee of success but, on the other hand, lack of sufficient investment in research and innovation is invariably a recipe for competitive failure."" --",N/A,N/A,en
Innovation and Industrial Strength,"['Joan G. Cox', 'Herbert Kriegbaum']",1989,['Business & Economics'],"""To survive in a competitive world, manufacturing industry muat invest both in new plant and in new technology. This study estimates the volume of investment of both kinds of five industries in Britain, Wesy Germany, the United States and Japan...Overall, the authors find that a high level of investment in plant is no guarantee of success but, on the other hand, lack of sufficient investment in research and innovation is invariably a recipe for competitive failure."" --",N/A,N/A,en
Value Creation,['McKinsey and Company'],2001,['Business & Economics'],"Induced by globalization and shareholder value orientation, there is in the chemical industry an increasing demand for value creation. Written by management consultancy McKinsey, this handbook provides first-hand experience on strategic and operational management in the chemical industry.",N/A,N/A,en
Management and Economics of Organization,"['Felix FitzRoy', 'Zoltán J. Ács', 'Daniel A. Gerlowski']",1998,['Business & Economics'],"This text uses an economic analysis to develop a framework for the study of organisation. The authors develop key themes such as the international experience of the economic organisation, the influence of technological change and international comparisons of organisations. They begin with the theory of exchange and systematically develop the theory of economic organisation without mathematical or other prerequisites. The approach is designed toaccurately reflect the changing business environment through examination of organizational issues from a historical, technical and global perspective. Instructor's Manual 0-13-923541-8.",N/A,N/A,en
The Elgar Companion to Intellectual Property and the Sustainable Development Goals,"['Matthew Rimmer', 'Caroline B. Ncube', 'Bita Amani']",2023-12-28,[],"Complex geopolitical debate surrounds the role of intellectual property (IP) in advancing and achieving the UN's sustainable development goals (SDGs). Summarising and advancing this discourse, this prescient Companion is a thorough examination of how IP law interacts, influences and impacts each of the seventeen SDGs. This comprehensive Companion brings together an array of leading international experts to assess and interrogate how IP law impacts each specific SDG in turn. Providing in-depth analysis and invaluable insight, chapters explore IP's role in ending poverty and inequality, improving food security, ensuring a sustainable environment, better regulating gene patents, and supporting health and well-being through access to medicines. This Companion deftly explores a variety of models of technology transfer and diffusion. Ultimately, the book provides a realistic overview of current progress towards the SDGs and a blueprint to reform IP institutions, agreements, and laws to achieve a more sustainable future. The Elgar Companion to Intellectual Property and the Sustainable Development Goals will be an essential resource for academics, researchers, regulators and policymakers interested in the unique intersection between IP law and sustainable development. It will also prove a highly informative read for researchers specialising in development studies, as well as legal practitioners working in private law, technology law, comparative law and international law.",N/A,N/A,en
New Zealand,['Organisation for Economic Co-operation and Development'],2007,['Business & Economics'],"This is one of a series of publications which assess the innovation system of individual OECD member and non-member countries, focusing on the role of government. They set out recommendations on how to improve policies which impact on innovation performance, including research and development policies, and identify good practices from which other countries can learn. This review assesses the governance of New Zealand's innovation system and suggests the reforms needed to ensure that additional public investment in R&D will yield the expected economic and social benefits.",N/A,N/A,en
Stimulating Innovation in Industry,"['Alex Bowen', 'Martin Ricketts']",1992,['Great Britain'],N/A,N/A,N/A,en
Small Firms and Innovation,['Mark Dodgson'],1993,['High technology industries'],N/A,N/A,N/A,en
Principles of Marketing,['Adrian Palmer'],2000,['Brands'],"This book provides and introduction to the principles of marketing, beginning from the underlying theoretical bases which are often borrowed from the disciplines of economics, sociology, and psychology. Practical application of theory is provided through case studies and vignettes. This booktries not to present prescriptive solutions to marketing problems, but encourages debate about causes and effects. Underlying much of the discussion in this book is the question of whether marketing should be considered a science or an art.In addition to chapters covering the traditional elements of the marketing mix, the book provides insights into issues of contemporary concern in marketing. A chapter is devoted to discussion of the social responsibility of marketing. The growing importance of direct marketing and the role ofelectronic commerce is reflected in a separate chapter. The role of information management is emphasized throughout the book. There is a separate chapter on the marketing of services, although throughout the text an attempt has been made to provide services examples, which reflect their relativeimportance in western economics.Practical applications of theory highlight shortcomings of established frameworks for the study of marketing, and the reader is encouraged to formulate alternative frameworks. Although the book has necessarily been divided into a number of chapter it recognizes that in the real world marketingcannot be neatly compartmentalized in this way. In an attempt to offer a holistic vision, each chapter closes with a summary of how that chapter relates to other chapters. Vignettes and case studies provide integrative perspectives. To encourage further study each chapter contains suggestions forfurther reading and a selection of useful websites.",N/A,N/A,en
Studies on Market Structure and Technological Innovation,['Tuomas Saarenheimo'],1994,['Business enterprises - Finland - Technological innovations'],N/A,N/A,N/A,en
The Economics of Industrial Organization,['William G. Shepherd'],1997,['Industrial organization (Economic theory)'],"This text covers all the subjects in a business and government course, with a focus on the industrial organization.",N/A,N/A,en
Success @ E-business,['Peter Morath'],2000,['Business & Economics'],Electronic business has become mandatory for a successful enterprise. This text reflects the different situations internationally. It shows examples of how the different approaches and solutions are developed under different circumstances.,N/A,N/A,en
Revolutionising New Product Development,['Paul Kidd'],1997,['Automobile industry and trade'],N/A,N/A,N/A,en
Innovation,['W. R. Spence'],1994,['Business & Economics'],"This introductory text helps the reader to understand and manage the spread and acceptance of new ideas, practices and products. It is essential reading for all managers, business students, public relations consultants and teachers concerned with innovation, creativity, change and applied communication.",N/A,N/A,en
The Strategy of Managing Innovation and Technology,"['Murray R. Millson', 'David L. Wilemon']",2008,['Business & Economics'],"For undergraduate courses in Innovation and Creativity, or for graduate students in schools of management, business, or engineering and technology management programs. A comprehensive collection of research illustrating advances in innovation over the past century, this unique anthology equips its readers with the knowledge and tools to construct a model of innovation and effectively implement it in both business and non-business settings. The world continues to change at an accelerating pace. The concepts developed in this vast collection of research represent a large part of the study of innovation and technological progress for the past century. An excellent resource for students and practitioners, it offers readers in-depth insight into many of the areas that influence and are influenced by the innovation process giving them an excellent perspective for conceptualizing the innovation process.",N/A,N/A,en
Innovation and Automation,['Paul M. Satchell'],1998,['Science'],"Organizational competitiveness requires innovation and automation and current approaches to both hamper creativity. The increasing coexistence of innovation and automation is resulting in each impacting the other in ways that can be detrimental to both. This book links these forces of change positively by shifting the focus on human-machine interactions from the current, technology-centred approach, to one where sharing is evolved and creativity is no longer suppressed.It provides a unique way of understanding innovation in organizations, but using an environmental interaction approach to understanding creativity and its translation into innovatory behaviour. The current dampening of creativity in organizations is made meaningful by explaining organizational behaviour in terms of rituals.The author succinctly assembles the current evidence that the prevailing technology-centred approach to automation is in part responsible for the inability of humans to be creative in work situations. Many of the behavioural constraints necessary for this type of automation paralyse the translation of creativity into innovatory behaviour. In producing an antidote to the technology-centred approach, he moves beyond current human-centred thinking, to an approach where humans and machines share by using the same processes that underlie the sharing between humans. This sharing-centred approach to automation is explained and illustrated.Throughout the book, the current state of human-machine interactions is illustrated with vignettes from aviation, medicine and from organizations. The book also discusses three pictures of future human-machine interactions of the flight deck, in primary care medical practice, and in boardrooms or major organizations.",N/A,N/A,en
Innovation and Industrial Strength,"['Joan G. Cox', 'Herbert Kriegbaum']",1989,['Business & Economics'],"""To survive in a competitive world, manufacturing industry muat invest both in new plant and in new technology. This study estimates the volume of investment of both kinds of five industries in Britain, Wesy Germany, the United States and Japan...Overall, the authors find that a high level of investment in plant is no guarantee of success but, on the other hand, lack of sufficient investment in research and innovation is invariably a recipe for competitive failure."" --",N/A,N/A,en
Generating Breakthrough New Product Ideas,"['Robert G. Cooper', 'Scott J. Edgett']",2009-04,['Business & Economics'],"Companies are experiencing a shortage of game-changing ideas that drive growth. This is a 'how to' book about generating a steady stream of breakthrough new product ideas. Experts, Dr. Cooper and Dr. Edgett, provide an unbiased evaluation of the top 15+ ideation methods used by leading companies. This book explains how to 'feed' your innovation funnel with a steady stream of breakthrough new product ideas. Through numerous examples of the methods, approaches and techniques being used by leading companies such as Motorola and Procter and Gamble, the authors confirm the importance of a robust Discovery Stage and illustrate how to implement such a system. For more information, visit: www.stage-gate.com",3.5,N/A,en
Holding a Cat by the Tail,['Steve Blank'],2014-05-20,[],N/A,N/A,N/A,en
The Art of Encouraging Invention,['Stefan Fölster'],1991,['Technology & Engineering'],N/A,N/A,N/A,en
Leading Innovation,['Brian McDermott'],2004,['Business & Economics'],"This book gives leaders solid advice for unleashing intellectual energy and making change something to value, not fear.",N/A,N/A,en
"The Markets for Innovation, Ownership, and Control","['Richard Hollis Day', 'Gunnar Eliasson', 'Clas Wihlborg']",1993,['Business & Economics'],"Three themes are brought together in this volume: innovative activity, managerial performance in the organization of innovations, and markets for ownership and control. In consideration of these themes several specific questions are raised.",N/A,N/A,en
The Hothouse Effect,['Barton Lee Kunstler'],2004,['Business & Economics'],"Annotation Examines the dynamics of communities that have stood out as bastions of creativity and intellectual progress, such as ancient Athens to the American jazz scene of the 20th century, and identifies the factors that drove their ususual creative fervor.",N/A,N/A,en
"Product Innovation Strategy, Pure and Simple: How Winning Companies Outpace Their Competitors",['Michel Robert'],1995-06,['Business & Economics'],"Drawing on 10 years of research into successful product development, the author goes beyond tips and techniques to provide a unique process of product innovation that encompasses four key steps--search, assessment, development and pursuit. Filled with anecdotes and case histories, this guide puts a revitalized future within the reach of every organization. Illustrations.",N/A,N/A,en
Managing Technology for Competitive Advantage,"['Brian C. Twiss', 'Mark Goodridge']",1989,['Business & Economics'],N/A,N/A,N/A,en
Technological Transitions and System Innovations,['Frank W. Geels'],2005,['Innovation'],"This important book addresses how long term and large scale shifts from one socio-technical system to another come about, using insights from evolutionary economics, sociology of technology and innovation studies. These major changes involve not just technological changes, but also changes in markets, regulation, culture, industrial networks and infrastructure. The book develops a multi-level perspective, arguing that transitions take place through the alignment of multiple processes at three levels: niche, regime and landscape. This perspective is illustrated by detailed historical case studies: the transition from sailing ships to steamships, the transition from horse-and-carriage to automobiles and the transition from propeller-piston engine aircraft to turbojets. This book will be of great interest to researchers in innovation studies, evolutionary economics, sociology of technology and environmental studies. It will also be useful for policy makers involved in long-term sustainability and systems transitions issues.",N/A,N/A,en
Managing Innovation and Change,"['Nigel King', 'Neil Anderson']",2002,['Business & Economics'],"This critical introduction discusses the origins of creativity, group approaches to innovation, managing innovative teams and how to manage organizations. By understanding the psychological principles, theories and techniques applied in these areas, managers can improve organizational strategies and their responses to change.In addition to managers and HR professionals, students of management and occupational psychology at undergraduate and MBA level will benefit from the clear and concise coverage of this important topic.",N/A,N/A,en
The Economics of Industrial Innovation,"['Christopher Freeman', 'Luc Soete']",1997,['Business & Economics'],Massive technological development over the last ten years has changed the face of industry dramatically. This updated edition explores the debates surrounding macroeconomics in a stimulating analysis of the impact of globalisation on industrial change.,N/A,N/A,en
Corporate Entrepreneurship and Innovation,['Paul Burns'],2020-02-28,['Business & Economics'],"Written by a highly regarded expert on entrepreneurship, this bestselling textbook provides an engaging and comprehensive overview of corporate entrepreneurship. Now in its fourth edition and fully revised throughout, this accessible text is structured in four key parts that cover everything a student needs to know about the topic. After an initial consideration of what constitutes corporate entrepreneurship and innovation, the author then guides students through the four pillars of entrepreneurial architecture: culture, structure, leadership and strategy. The third section focusses on the entrepreneurial mind-set, including how to encourage creativity, business ideas and developing concepts. Finally, the book draws attention to corporate venturing, examining venture teams, intrapreneurs, market development and the role of shareholder value. It is no longer sufficient for businesses to grow simply by cutting costs and taking over competitors. To achieve true success, organisations must avoid an ageing product or service portfolio to bring new, innovative ideas to market. Corporate entrepreneurship is inherently risky and therefore requires a fresh approach to strategy. The approach Paul Burns offers will successfully overcome barriers to launching new ideas, internal challenges of managing creativity and show how to foster an entrepreneurial culture. This is the go-to textbook for all students studying Corporate Entrepreneurship, Intrapreneurship or Corporate Venturing at undergraduate, postgraduate or MBA level. The book is also essential reading for courses on Strategic Entrepreneurship and Innovation. New to this Edition: - Fully revised and updated content throughout with new four-part structure - Brand new case studies in every chapter, featuring some of the world's highest profile companies from across the globe - A greater focus on innovation, including a new chapter on this topic at the start of the book - New chapters on 'Developing a Business Model', 'Managing Change' and 'Managing Risk' - New on-page glossary with key terms highlighted in the text and defined in the margins - New Activities and Group Discussion topics at the end of each chapter",N/A,N/A,en
Innovation in Business,"['Columbia University. Graduate School of Business. Library', 'Marion Bishop']",1954,['Entrepreneurship'],N/A,N/A,N/A,en
Out of the Box,['Gunter Pauli'],2004,['Business & Economics'],"The 21 fairy tales in Gunter Pauli's Out of the Box prepare companies, executives and their teams to be the pioneering agents of transformation, as well as promising to be both fun and profitable. Each concept is clarified with a concrete, brief business case. Some are successes, some failures. Examples are based on first-hand experiences from 20 different companies, some large multinationals, some small niche players, some venture capital-funded innovation companies operating in Europe, North and South America, Asia and Africa. Creativity and innovation are not the exclusive domain of the North and the multinational corporation; it also is happening in the Southern Hemisphere. Those executives who embrace these concepts of creativity, innovation and leadership will bring business to the forefront of society, responding to people's requirements in co-evolution with nature, strengthening culture and tradition, as well as creating a wonderful platform upon which entrepreneurs will thrive, wherever they are in the world.",N/A,N/A,en
The Economics of Production and Innovation,['Gerhard Rosegger'],1996,['Business & Economics'],"The role of technology and innovation in enhancing the competitiveness of companies and industries in domestic and international markets is of vital concern to both economists and managers. This fully-updated third edition of a well-established text takes account of the numerous new approaches and ideas in the field of technological change, and how these changes affect the behaviour and performance of businesses. This book is ideal for higher-level management undergraduates and MBA students, as well as economics undergraduates and engineering students taking economics and management courses. In addition, students on any course requiring an understanding of technological change will find this book a valuable guide to help understand the forces which govern the rapidly changing world of technology. * This book was originally part of the Omega Management Science series published by Pergamon and edited by Professor Sam Eilon. Fully updated third edition Fully updated third edition",N/A,N/A,en
Nanovation,"['Kevin Freiberg', 'Jackie Freiberg', 'Dain Dunston']",2011-08-23,['Business & Economics'],"Nanovation is a story of how a little car is teaching the world to think big. One dreary, rainy morning in India, Ratan Naval Tata, the Chairman of the Tata Group, was driving to work, right behind a family of four. It wasn’t an unfamiliar sight, all four of them crammed onto a single scooter, trying to get to school and work. Then it happened—a busy intersection, a slick road, and down they went, scooter one direction, family members the other. Fortunately, no one was seriously hurt because the congested traffic had been moving so slowly. But it gave new impetus to an idea Tata had been working on: as the chairman of a car company, how could he get Indian families off scooters and into something safer that they could afford? Today we have the answer, and it’s called the Nano, the least expensive—and arguably most significant—car in the world. Nanovation is not only the story of one car; it represents the leading edge of a revolution in business thinking and design that will have a profound effect on everything that comes after it, not just in the automotive industry, not just in India, but in every industry around the world.",N/A,N/A,en
Innovation Clusters and Interregional Competition,"['Johannes Bröcker', 'Dirk Dohse', 'Rüdiger Soltwedel']",2003-06-17,['Business & Economics'],"Empirical evidence about cluster building, the emphasis of new growth theory on innovation, the recent interest in economic geography and the high pressure on politicians to establish favourable conditions for attracting dynamic industries have triggered a wave of research during the last decade, trying to understand more deeply why, how and where clusters emerge, and what factors determine their respective success or failure. In this volume the world's leading experts contribute to our understanding of regional innovation, cluster formation and the factors influencing regional productivity and innovative performance. It provides a timely and comprehensive picture on innovation, location, networks and clusters as important means in an environment of intensifying interregional competition.",N/A,N/A,en
Industry and Innovation in the North East of England,['Great Britain: Parliament: House of Commons: North East Regional Committee'],2009,['Business & Economics'],"In this report, from the North East Regional Committee (HCP 169, session 2009-10, ISBN 9780215542731), renewable industries could lead a recovery in the North East's manufacturing industry. The Committee states that the region is well placed to benefit from the growing global market for green technologies, but warns that British innovation and ideas could be lost as other countries benefit from quicker commercial development and implementation. World-class renewable energy companies in the North East - such as the New and Renewable Energy Centre (NaREC) at Blyth, the North East Process Industries Cluster (NEPIC) on Teesside, and NETPark, the North East Technology park in County Durham - could put the region at the forefront of the Government's efforts to turn the UK into a low-carbon economy. The Committee warns though, that the UK's cumbersome and slow planning process poses a significant risk to long-term development in the North East as businesses from countries like China seek quicker, guaranteed sites elsewhere in Europe. The report also states that the Government should explore incentives to encourage local development of renewable and clean energy. Also, underinvestment in transport links is proving detrimental to investment in the region.",N/A,N/A,en
Teaching Innovation,"['Ken Friedman', 'Olav Djupvik', 'Trond Blindheim']",1996,['Business education'],N/A,N/A,N/A,en
