title,authors,publishedDate,categories,description,averageRating,textSnippet,language
Financial Times Handbook of Management,"['Stuart Crainer', 'Des Dearlove']",2001,['Business & Economics'],This edition has been updated to include more emphasis on leading edge ideas and a greater international flavour with more US contributors.,N/A,N/A,en
Building Innovation,['David Gann'],2000,['Business & Economics'],"David Gann considers the changes in the construction and use of the built environment that are currently emerging, and how innovative practices and materials can be integrated into the construction process",5,N/A,en
The Role of Universities in Regional Innovation Systems,['Jan-Evert Nilsson'],2006,['Business & Economics'],"""This first major study of the Nordic model of enterprising universities will be of interest to theoreticians, analysts and practitioners alike, not least for the valuable factual detail that enables exploration of numerous, sometimes idealistic, concepts that ignore the barriers to communication among epistemic communities.""",N/A,N/A,en
"Technological Innovation, Industrial Evolution, and Economic Growth",['Sanjaya Panth'],1997,['Business & Economics'],"First Published in 1998. Routledge is an imprint of Taylor & Francis, an informa company.",N/A,N/A,en
The Dynamics of Product Quality and International Competitiveness,"['Ashoka Mody', 'Deniz Igan', 'Stefania Fabrizio']",2007-04,['Business & Economics'],"Despite the appreciation of the exchange rate, the eight Central and Eastern European countries (the CEE-8) that entered the European Union in May 2004 have achieved a decade of impressive export growth, expanding significantly their shares of world markets. Does this mean that the real exchange rate is irrelevant? If not, what other factors compensated for the appreciation to explain the apparently strong competitiveness of these economies? And will these favorable factors continue to power export growth? This paper places in international context the achievements of the CEE-8 and helps more broadly to identify the determinants of international competitiveness. Building from data at the six-digit level of disaggregation, it shows that the CEE-8 made an impressive shift in product quality and in the technological intensity of exports, and that these shifts associated with the structural transformation were also associated with increased market share. The analysis strongly suggests that, when trading in international markets, countries benefit from higher product quality. However, while the structural transformation achieved was valuable in raising market shares, the easy gains from this process may be over.",N/A,N/A,en
"Fast Innovation: Achieving Superior Differentiation, Speed to Market, and Increased Profitability","['Michael L. George, Sr.', 'James Works', 'Kimberly Watson-Hemphill']",2005-07-15,['Business & Economics'],"Provides strategies for speeding innovation and getting to market. This work explains why it usually takes so long for innovations to reach the market, and why they often fail. It also helps readers learn how to: achieve faster, more controllable time-to-market; generate highly differentiated products, services, or experiences; and more.",N/A,N/A,en
Developments in Telecommunications,"['Edward Mozley Roche', 'Henry Bakis']",1997,['Technology & Engineering'],"Developments in information technology and telecommunications are giving a new meaning to the concepts of space and time. In particular, the concepts of 'local' and 'global' are starting to merge together even though they apparently represent entirely different scales. One example is 'telework', also known as 'telecommuting'. Another is the rapid growth of outsourcing. These developments are based on new technologies such as multimedia, rapid improvements in storage technologies and the information superhighway, including the Internet. The structure of the world's telecommunications industry is changing and in addition, political and social autonomy is breaking down. The role of the nation state is challenged, as are the old avenues and levers of political power. Nation States have attempted to grab functional control over the emerging infrastructure, but they are ultimately unable to exert control over the flood of information surging around the world. There still remains a strong middle ground between local and global, dominated by multinational corporations and national governments.",N/A,N/A,en
"Multinational Firms, Innovation and Productivity","['Davide Castellani', 'Antonello Zanfei']",2006,['Business planning'],"This book gets to the root of how and why multinational firms differ in the cross-border creation, transfer and diffusion of technology, and provides fresh evidence on the effects that these differences have on productivity and innovation in the economic systems in which they are active. Davide Castellani and Antonello Zanfei consider multinationals as heterogeneous institutions that combine internal networks of subsidiaries with external networks of collaborative linkages, to bridge different economic and innovation systems. They examine heterogeneity in productivity and innovative behaviour between multinational and national firms, as well as across and within multinationals. The authors argue that not every foreign firm is a good source of externality, and not every domestic firm is equally well placed to benefit from multinationals. It is shown that spillovers from multinationals differ according to the technological profiles, embeddedness and linkage creation of both foreign and domestic firms active in local markets. The book supports this view with empirical evidence based on illustrative case studies, and on econometric analysis using extensive firm-level datasets on multinational activities, innovation and economic performances. Integrating an in-depth account of state of the art literature with detailed evidence, this book will be of great interest to an extensive audience. This will encompass students, researchers, academics, policy makers and practitioners across a wide range of disciplines including: international business, economics and management of innovation, international economics and industrial organisation.",N/A,N/A,en
Flexible Innovation,"['Jorge Niosi', 'Maryse Bergeron', 'Nathalie Hade', 'Michèle Sawchuck']",1995,['Business & Economics'],"Basing his study on in-depth interviews with more than 130 companies across Canada, Jorge Niosi analyses the scope of collaborative research activities - both domestic and international - in the fields of biotechnology, electronics, advanced materials, and manufacturing of transportation equipment. He describes successful patterns of collaboration, obstacles and limitations, and the role of public policy, universities, and government laboratories in technological alliances. He compares Canadian partnerships and public policy with similar patterns in the United States, Europe, and Japan.",N/A,N/A,en
Product Lifecycle Management,['Michael Grieves'],2006,['Business & Economics'],"Introduces the next level of lean thinking that focuses on the life of a product, from inception to the customer's door",N/A,N/A,en
"Platforms, Markets and Innovation",['Annabelle Gawer'],2009,['Business & Economics'],"'Annabelle Gawer's collected volume of research shows that a vibrant community of scholars has arisen around platforms and innovation. Each of the chapters is first rate, with top researchers offering some of their latest work. This will be an indispensable book for students of innovation and technology management everywhere.' - Henry Chesbrough, University of California, Berkeley, US",N/A,N/A,en
Design for Policy,['Christian Bason'],2020-09-30,['Municipal services'],"Design for Policy charts, for the first time, the emergence of collaborative design approaches to innovation in public policy. It is a rich resource for policy makers, public managers, the academic community and advisers to government.The book is structured in three main sections, covering the global context of the rise of design for policy",N/A,N/A,en
System Innovation and the Transition to Sustainability,"['Boelie Elzen', 'Frank W. Geels', 'Kenneth Green']",2004,['Business & Economics'],"Modern societies face several structural problems such as transport congestion and greenhouse gas emissions due to the widespread use of fossil fuels. To address these important societal problems and achieve sustainability in the broad sense, major transformations are required, but this poses an enormous challenge given the complexity of the processes involved. Such transformations are called 'transitions' or 'system innovations' and involve changes in a variety of elements, including technology, regulation, user practices and markets, cultural meaning and infrastructure. This book considers two main questions: how do system innovations or transitions come about and how can they be influenced by different actors, in particular by governments. The authors identify the theories which can be used to conceptualise the dynamics of system innovations and discuss the weaknesses in these theories. They also look at the lessons which can be learned from historical examples of transitions, and highlight the instruments and policy tools which can be used to stimulate future system innovations towards sustainability. The expert contributors address these questions using insights from a variety of different disciplines including innovation studies, evolutionary economics, the sociology of technology, environmental analysis and governance studies. The book concludes with an extensive summary of the results and practical suggestions for future research. This important new volume offers an interdisciplinary assessment of how and why system innovations occur. It will engage and inform academics and researchers interested in transitions towards sustainability, and will also be highly relevant for policymakers concerned with environmental issues, structural change and radical innovation.",N/A,N/A,en
Entrepreneurship,['Richard Swedberg'],2000,['Business & Economics'],"A new addition to the series that looks at the culture and role of the entrepreneur from different disciplinary perspectives. Includes all the key readings, introduced by a highly respected editor.",N/A,N/A,en
Learning from Exporting,['Robert Salomon'],2006,['Business & Economics'],Explores the relationship between exports and productivity. This work argues that exporters can access diverse knowledge inputs that are not available in the domestic market.,N/A,N/A,en
The Witch Doctors,"['John Micklethwait', 'Adrian Wooldridge']",1997,['Business & Economics'],"The Witch Doctors is a one-stop guide to management theories, fads, and the gurus who promote them that will spark controversy, debate, and a dialogue for change. Funny, entertaining and outspoken, this is a book no American worker can afford to miss. ""From the Hardcover edition.",N/A,N/A,en
Winning the Innovation Race,['Lee Sage'],2000-02,['Business & Economics'],"An Inside Look at the Process of Innovation-and How to Make it Work for your Business While the need for innovation is widely recognized, the practices that nurture it elude many executives. Winning the Innovation Race examines the three dimensions of innovation-people, processes, and technology-and provides vivid examples of practices that encourage innovation. This comprehensive book describes the forms that innovation takes in industrial organizations and how superior companies manage to sustain innovation through effective management. The practices of PACE (Premier Automotive Suppliers' Contributions to Excellence) Award-winning companies are used to illustrate how truly innovative companies make the most of their employees, how they treat product development as a ""perfectible process,"" and how they create reward systems that build cultures of innovation. Some of the vital lessons you'll learn in this unique resource: * The virtue of ""cheap failures"" * Why organizational discomfort is needed * The role of executive leadership * How to sustain a culture of innovation",N/A,N/A,en
Green Japan,['Carin Holroyd'],2018-01-01,['Business & Economics'],Green Japan critically examines the Japanese effort to combine economic growth with commitments to environmental sustainability.,N/A,N/A,en
Systems of Innovation and Development,"['José Eduardo Cassiolato', 'Helena Maria Martins Lastres', 'Maria Lucia Maciel']",2003,['Business & Economics'],"Confronting the challenges and opportunities of the knowledge era, this text focuses particularly on the new conditions for industrial and technological development. The contributors address many of the most significant issues including the globalizing learning economy, the finance dominated accumulation regime, learning and development divides, systems of innovation and local productive arrangements. They also define the conceptual and methodological instruments which can be used to analyse and understand the core issues of learning, knowledge and innovation. In doing so, they demonstrate the value of the systems of innovation approach in the design and implementation of strategic development policies which are urgently required in many countries.",N/A,N/A,en
"Technology, Innovation and Industrial Economics: Institutionalist Perspectives",['William E. Cole'],1998-07-31,['Business & Economics'],"Technology, Innovation and Industrial Economics: Institutional Perspectives, inspired by the work of William E. Cole, Professor Emeritus at the University of Tennessee at Knoxville, extends his work with essays on technology, innovation and industrial economics from an Institutionalist perspective. The managerial style, innovational practices and industrial setting of the continuous improvement firm are central to several chapters. This volume also features innovation and technology in Latin America, Adam Smith's writing on entrepreneurship and a comparison of American and European Institutionalism. The topics of technology, innovation, industrial organization and industrial policy are being widely discussed and debated in today's literature, but seldom from an Institutionalist perspective. The purpose of this book is to reduce substantially this missing dimension in the ongoing debates on these important issues.",N/A,N/A,en
Serendipitous and Strategic Innovation,"['Shantha Liyanage', 'Jan Annerstedt']",2006,['Business & Economics'],"Innovation is a time-consuming process that involves invention as a beginning and a marketable service or product as an end. This work examines the technology innovation process, and displays its critical links with organizational functions",N/A,N/A,en
Big Ideas,['Jonne Ceserani'],2003,['Business & Economics'],"This book describes the tools and techniques that can be used to develop creativity and innovation. It is about leadership qualities that allow them to flourish both in you and in others. It is aimed at anyone in an organization who needs to be open-minded, have new ideas and create new solutions.",N/A,N/A,en
Managing Innovation,"['Stephan M. Wagner', 'Christian Busse']",2008,['Business logistics'],N/A,N/A,N/A,en
New Product Development and Production Networks,['Ulrich Jürgens'],2000-02-03,['Business & Economics'],"Prof. Dr. U. Jürgens, Wissenschaftszentrum Berlin, is renown for his scientific work in fields like human resources, work organization and organization of production and development, especially for automotive industries. In this publication the authors from different countries discuss practical models of integration in development and production as realized in practice. Time-to-Market is the key for success, efficient integration of development and production necessary to reach the goal. Jürgens himself acts as a publication editor and creates a book reporting about the state of art in automotive and electronics industry. The publication is directed to scientists and is of interest to those practitioners, who have to develop the benchmarks for their own development and production.",N/A,N/A,en
The Elgar Companion to Innovation and Knowledge Creation,"['Harald Bathelt', 'Patrick Cohendet', 'Sebastian Henn', 'Laurent Simon']",2017,['BUSINESS & ECONOMICS'],"This unique Companion provides a comprehensive overview and critical evaluation of existing conceptualizations and new developments in innovation research. It draws on multiple perspectives of innovation, knowledge and creativity from economics, geography, history, management, political science and sociology. The Companion brings together leading scholars to reflect upon innovation as a concept (Part I), innovation and institutions (Part II), innovation and creativity (Part III), innovation, networking and communities (Part IV), innovation in permanent spatial settings (Part V), innovation in temporary, virtual and open settings (Part VI), innovation, entrepreneurship and market making (Part VII), and the governance and management of innovation (Part VIII).",N/A,N/A,en
Built for Growth,"['Arthur Rubinfeld', 'Collins Hemingway']",2005,['Business & Economics'],"From a major player in Starbucks' expansion and the co-author of Bill Gates' ""Business at the Speed of Thought"" come specific solutions to create a brand and presence that generates true customer passion and lays a solid foundation for long-term success.",N/A,N/A,en
Managing Technology for Corporate Success,['Chris Floyd'],1997,['Business & Economics'],"Focusing on the questions that face top management, such as deciding which technologies to invest in and how to manage and exploit them, and shaping management roles to fit technological strategy. This text explores these and other key issues in an accessible, non-technical way.",N/A,N/A,en
"Creativity, Innovation, and Quality",['Paul E. Plsek'],1997,['Business & Economics'],"This book targets the needs of individuals engaged in quality management activities and enables them to incorporate new skills into their daily work. The author presents a serious study of creativity and innovation targeted at the needs of professionals engaged in quality management activities. It will appeal to even the most analytical thinkers in quality. Creativity, Innovation, and Quality clearly articulates five reasons why practitioners of quality management should be interested in innovation and the three central principles that underlie all the tools of creativity. Once you know the principles behind the tools, you can generate your own methods for creative thinking that are uniquely suited for your specific needs.",N/A,N/A,en
Strategic Management of Technology and Innovation,"['Robert A. Burgelman', 'Modesto A. Maidique', 'Steven C. Wheelwright']",2001,['Business & Economics'],"This text has been written for a course in technology and innovation. It covers contemporary research by using a combination of text, readings, and cases. Based on reviewer response to a survey, the authors have updated many of the cases that instructors found outdated or lacking. Classic cases such as Claire McCloud have been kept, while newer cases such as Intel Corporation in 1999 have been added. There is also a strong set of readings from sources such as Harvard Business Review, California Management Review, and Sloan Management Review.",N/A,N/A,en
Market Oriented Product Innovation,['Knut Holt'],2002-10-31,['Business & Economics'],"Market-Oriented Product Innovation differs from most other titles, written either from a marketing or technical perspective, by giving a holistic view of the product innovation process. It has a product perspective, written from a managerial point of view, recognizing that product innovation, or new product development, is a discipline of its own. It is concerned with managing the products (goods and services) through their life cycle, integrating marketing knowledge and technological expertise, with the aim of getting satisfied customers. The book also gives a thorough treatment of the human and cultural aspects of product innovation by focusing on the change processes needed for the development of a market-oriented culture. The book has practical focus and relevance, due to the professional background of the author, Knut Holt, who has established the field of Technology Management at the Norwegian Institute of Science and Technology and is the founder of ISPIM, the International Society for Professional Innovation Management. By linking deep theoretical knowledge with extensive practical experience, the book provides an excellent foundation, whether used as support to courses or for self-studies. The learning is facilitated by about 200 cases and examples from leading companies throughout the world. A unique feature of the book is its dual capacity to serve both as an introductory text, supported by teacher and student manuals, and as a base for advanced studies with more than four hundred references, mainly based on selected key management books and publications from recognized researchers. Each research publication comprises extensive literature reviews and summaries of the latest advances.",N/A,N/A,en
The Handbook of Innovation and Services,['Faïz Gallouj'],2010,['Business & Economics'],"`The Handbook of Innovation and Services is an exceptional volume. Its contributors, including Faiz Gallouj, William Baumol, Jean Gadrey, and Pascal Petit, are among the major thinkers in both the fields of the economics of services and the economics of innovation. Selected topics include the ""cost disease"", services innovation in the global economy, social innovation in the services, and innovation and employment in services. The book, I am sure, will become a standard reference volume in both these fields in the ensuing years.'---Edward Wolff, New York University, USA This Handbook brings together 49 international specialists to address an issue of increasing importance for the world's post-industrial economies; innovation as it relates to services. Contemporary economies have two fundamental characteristics. Firstly, they are service economies in as much as services account for more than 70 per cent of the wealth and jobs in most developed countries. Secondly, they are innovation economies as recent decades have seen an unprecedented development of scientific, technological, organisational and social innovations. This Handbook expertly links these two major characteristics in order to investigate the role of innovation in services, an issue that until now has been inadequately explored and one that poses many theoretical and operational challenges. This comprehensive volume encompasses the views of eminent scholars from a range of disciplines including economics, management, sociology and geography, and draws on a number of different analytical and methodological perspectives. With its multi-disciplinary approach this Handbook will be an invaluable reference source for academics and students in the fields of economics, management and the geography of services and innovation. Public authorities and managers in the service sector will also find this book fascinating.",N/A,N/A,en
Managerial Economics,"['W. Bruce Allen', 'Keith Weigelt']",2009,['Business & Economics'],"The seventh edition of Managerial Economics is the most current text available, encouraging students to see beyond the equations and graphs to the general precepts, such as marginal analysis and backward induction. Its new content draws on dozens of contemporary case studies, inviting students to apply problem-solving skills and to reflect on real-world economic decisions.",N/A,N/A,en
To the Desert and Back,"['Philip H. Mirvis', 'Karen Ayas', 'George Roth']",2003-05-07,['Business & Economics'],"This title tells the inside story of how Tex Gunning, president of VdBN, led a transformation that achieved market leadership through dramatic and innovative methods. The authors spin a fascinating story of change that is bound to entertain as well as inform all consultants, leaders, and managers.",N/A,N/A,en
Marketing the SME,"[""Michele O'Dwyer""]",2009,['Business & Economics'],"Prior to the recent global economic downturn, Ireland witnessed a decade of unprecedented economic growth. Almost overnight, the countryâ (TM)s labour base was transformed from one where decades-long emigration was the norm to a new and dynamic paradigm incorporating net in-migration. A significant element in Irelandâ (TM)s economic transformation involved innovative marketing strategies and the role of Small and Medium-size Enterprises (SMEs). SMEâ (TM)s were major providers for new jobs and this research addresses the key determinants of their success. This volume investigates a wide range of sophisticated, diverse and market-efficient strategies as adopted by Irelandâ (TM)s SMEâ (TM)s to ensure global success.",N/A,N/A,en
Innovation in the Making,"['Lotte Darsø', 'Handelshøjskolen i København. Erhvervsøkonomiske Fakultet']",2000,[],N/A,N/A,N/A,en
Artful Creation,['Lotte Darsø'],2004,['Art and industry'],"This is about social innovation and organisational transformation through the Arts. It presents live artists working in business settings as catalysts for change. The book primarily proposes two approaches for Arts-in-Business: 1) The Arts applied as an instrument for teambuilding, communication training, leadership development, problem-solving and innovation. 2) The Arts integrated as a strategic process of organisational transformation. The message of the book is not to promote a new magical instrument, a new 'quick fix' for business. It is an attempt to show the great potential of 'Artful Creation; and at the same time point out that the birth of a new paradigm offers promising prospects for the future of business and society. The book offers ground-breaking ideas, new methods, inspiration and concrete recommendations.",N/A,N/A,en
