title,authors,publishedDate,categories,description,averageRating,textSnippet,language
The Hidden Rules of Successful Negotiation and Communication,['Marc O. Opresnik'],2014-06-17,['Business & Economics'],"Negotiations in professional or private life often take an unsatisfactory course due to stress, confrontation with aggressive or unfair behavior, or because of overwhelming situations. Negotiations generally require a thorough preparation, strategy and a sophisticated tactic to make us feel safe in the presentation of our goals and arrive at a mutually satisfactory outcome. Conventional books about negotiations are usually limited to strategies and techniques, but leave out elements of psychological communication and emotional intelligence, which include non-verbal communication and empathy, which in turn are essential for successful negotiation. Therefore, this book on the one hand constitutes the essential techniques and strategies in the context of negotiation, but also considers ""soft skills"" without which negotiations cannot be successful. This book presents practical examples in dealing with situations such as salary, contract and sales negotiations. In particular on context and time appropriate negotiation techniques; analyzing negotiation partners and their motives; interpret group processes, and how to successfully implement negotiation psychology.",N/A,N/A,en
The Catalyst Leader,['Brad Lomenick'],2013,['Leadership'],"It's time for a new generation of leaders to rise up and take charge. The Catalyst Leader is the ultimate guide to get there. After thirteen years of gathering, influencing, and inspiring hundreds of thousands of young leaders through cutting-edge experiential events, conferences, and resources, Brad Lomenick understands leadership and the next generation. The Catalyst Leader provides practical help for all leaders at any stage of their leadership journey, ultimately defining what it means to be a Catalyst in this generation, and inspiring us all to be true change makers wherever we lead. The question isn't how do we lead now; it's how do we lead well. This is the new generation of leaders' handbook for influence. Practical. Inspiring. Timely. Defining. Get ready for your own leadership to be taken to a new level. -- Publisher.",N/A,N/A,en
The Chinese Egg,['Catherine Storr'],1975,['Detective and mystery stories'],"Emotional Intelligence has become an integral part of how leaders of the day function and respond to challenges. Since leadership is a function of and leadership emotional response, understanding one s emotional strengths and weaknesses can provide the edge to become better leaders. EQ and Leadership, a seminal work by a management expert, brings out the context of emotional intelligence and the underpinnings of leadership. Organized in three parts, the book identifies nine leadership styles and provides insights to leaders, managers and HR heads to be on the learning curve, perpetually.",N/A,N/A,en
Leading with Joy,"['Akaya Windwood', 'Rajasvini Bhansali']",2022-10-04,['Business & Economics'],"In a time of increasing disconnection and uncertainty, Leading with Joy shows how leaders can reclaim their purpose and embrace joy in service of social transformation. Leadership that connects people and centers compassion and trust instead of competition and disconnection is needed more than ever before. There are plenty of manuals that show people how to manage organizations, but what is really needed in this moment is a book that shows us how to include kindness and inspiration within leadership. Leading with Joy promotes a courageous and compassionate approach to leadership that can sustain purposeful action and social change. This book takes the form of a series of vignettes about the authors' insights and stories, with reflection questions at the end of each one. Through these stories-which address topics such as workplace triumphs and lessons, family relationships, and even near-death experiences- Akaya Windwood and Rajasvini Bhansali illuminate different aspects of leadership, such as humility, forgiveness, and kindness, and invite leaders to respond to the current moment. The book draws on the authors' lived experiences as leaders, including their encounters with oppression, and their wisdom in principled leadership. They demonstrate how leaders can create conditions of abundance and well-being, which are necessary for long-term social transformation.",N/A,N/A,en
The Compound Effect,['Darren Hardy'],2010-01-01,['Leadership'],"""The Compound Effect"" is an extraordinary operating system that shows how small, smart choices, plus consistency, plus time, equal a radical difference in ones life. By exploring our choices, habits, momentum and influences, this book is the plan, the guide, the map that shows you how to get and stay on the path to success.",4,N/A,en
Reframing Organizations,"['Lee G. Bolman', 'Terrence E. Deal']",2003-08-27,['Business & Economics'],"Authors Lee Bolman and Terrence Deal explain how to use the powerful tool of reframing, deliberately looking at situations from more than one vantage point, to bring order out of confusion and to build high-performing, responsive organizations.",N/A,N/A,en
Blind Trust,['Vamik D. Volkan'],2004,['Political Science'],"The author explores the etiologic bases of war, revolution, massacres, and terror. His analysis focuses on the psychological motivations of large groups and their leaders, covering such diverse figures as Joseph Stalin, Osama bin Laden, and the Prophet Muhammad.",N/A,N/A,en
Management of Organizational Behavior,"['Paul Hersey', 'Blanc']",1996,[],"Used by more than a million people throughout the world, this highly readable book provides a comprehensive examination of the applied behavioral sciences, and focuses on fundamental ideas which have stood the test of years of application in academic, business, not-for-profit and administrative environments. Complete coverage of motivation and behavior, situational leadership, building effective relationships, planning and implementing change, leadership strategies, the organizational cone and integrating situational leadership with the Classics. For individuals interested in expanding their knowledge of, and proficiency in leadership strategies.",N/A,N/A,en
Full Leadership Development,['Bruce J. Avolio'],1999-03-11,['Business & Economics'],"The author approaches the concept of leadership as a system, not just as a process or a person. His framework is based on what he defines as the full range of leadership: people, timing, resources, the context of interaction, and the expected results in performance and motivation. He contends that when a leadership system is optimized, it in turn optimizes the vital force of each individual, thereby enhancing the collective force of the entire organization.",3,N/A,en
Leadership and Lifestyle,['Dr Steve Walton'],2000,['Bible'],"This study contributes to debate about the portraits of Paul in Acts and his epistles by considering Paul's Miletus speech (Acts 20.18b-35) and identifies and compares major themes in Luke and Paul's views of Christian leadership. Comparisons with Jesus' speeches in Luke show how Lukan the speech is and, with 1 Thessalonians, how Pauline it is. The speech calls the Ephesian elders to service after Paul's departure to Jerusalem, focusing on: faithful fulfilment of leadership responsibility; suffering; attitudes to wealth and work; and the death of Jesus. Paul models Christian leadership for the elders. Parallels in Luke highlight his view of Christian leadership - modelled by Jesus and taught to his disciples, and modelled by Paul and taught to the elders. Study of 1 Thessalonians identifies a remarkably similar portrait of Christian leadership. The Miletus speech is close in thought, presentation and vocabulary to an early, indubitably Pauline letter.",N/A,N/A,en
Our Iceberg Is Melting,"['John Kotter', 'Holger Rathgeber']",2014-01,['Business & Economics'],"This charming story about a penguin colony in Antarctica illustrates key truths about how to deal with the issue of change: handle the challenge well and you can prosper greatly; handle it poorly and you put yourself at risk. The penguins are living happily on their iceberg as they have done for many years. Then one curious penguin discovers a potentially devastating problem threatening their home - and pretty much no one listens to him. The characters in this fable are like people we recognise, even ourselves. Their story is one of resistance to change and heroic action, confusion and insight, seemingly intractable obstacles and the most clever tactics for dealing with those obstacles. It is a story that is occurring in different forms around us today - but the penguins handle change a great deal better than most of us. Based on John Kotter's pioneering work on how to make smart change happen faster and better, the lessons you can learn from this short and easy-to-read book will serve you well in your job, in your family, and in your community. And these lessons are becoming ever more important as the world around us changes faster and faster.",N/A,N/A,en
Leading Leaders,['Jeswald W. Salacuse'],2006,['Elite (Social sciences)'],"Whether you were born a leader or have had leadership thrust upon you, you're in for a whole new set of challenges when managing other leaders. Leading Leaders breaks the challenge down into the Seven Daily Tasks of Leadership, and shows you how to carry out each task when you have to manage other leaders.",N/A,N/A,en
The Leadership Wheel,['C. Clinton Sidle'],2005-09-17,['Business & Economics'],"Sidle outlines a five-step framework for organizational change in today's rapidly changing business world, explaining how to enable effective leadership, healthy professional relationships, and dynamic teams, in a guide complemented by group exercise suggestions and case examples.",N/A,N/A,en
HBR's 10 Must Reads on Managing Across Cultures,"['Harvard Business Review', 'Jeanne Brett']",2016,['Commerce'],Resource added for the Business Management program 101023.,N/A,N/A,en
To Sell is Human,['Daniel H. Pink'],2012,['PSYCHOLOGY'],"""In the tradition of his bestselling book Drive, a revolutionary look at the art of selling. This is a book about sales for people who don't know they're in sales""--",N/A,N/A,en
Management Of Organizational Behavior: Leading Human Resources 8Th Ed.,['Paul Hersey'],2001,['Leadership'],Instructor's Manual with tests.,N/A,N/A,en
Leadership in Statistics and Data Science,['Amanda L. Golbeck'],2021-03-22,['Business & Economics'],"This edited collection brings together voices of the strongest thought leaders on diversity, equity and inclusion in the field of statistics and data science, with the goal of encouraging and steering the profession into the regular practice of inclusive and humanistic leadership. It provides futuristic ideas for promoting opportunities for equitable leadership, as well as tested approaches that have already been found to make a difference. It speaks to the challenges and opportunities of leading successful research collaborations and making strong connections within research teams. Curated with a vision that leadership takes a myriad of forms, and that diversity has many dimensions, this volume examines the nuances of leadership within a workplace environment and promotes storytelling and other competencies as critical elements of effective leadership. It makes the case for inclusive and humanistic leadership in statistics and data science, where there often remains a dearth of women and members of certain racial communities among the employees. Titled and non-titled leaders will benefit from the planning, evaluation, and structural tools offered within to contribute inclusive excellence in workplace climate, environment, and culture.",N/A,N/A,en
The Quantum Leader,['Danah Zohar'],2016,['Business & Economics'],"Drawing inspiration from quantum physics, innovative management thinker Danah Zohar offers a powerful new model for business thinking and practice. ""Quantum leaders,"" she says, like the systems they have to manage, are poised at ""the edge of chaos."" They thrive on the potential latent in uncertainty and are adept at unleashing the creativity of self-organization. More important, they are vision- and value-led; they adapt quickly, are unafraid to play with the boundaries and reinvent the rules, and celebrate diversity. Zohar points out that the existing, business-as-usual paradigm owes a great deal to the outdated thinking, assumptions, and values of Newtonian science, which gave rise to the Industrial Revolution. Newtonian thinking assumes that corporations and markets are like machines--predictable, stable, and controllable; they are best managed in a way that eliminates risk and assures equilibrium. Unfortunately, as the global financial collapse of 2008 demonstrated, this way of thinking is as obsolete as the steam engine. Further developing ideas she introduced in her acclaimed Rewiring the Corporate Brain and Spiritual Capital, Zohar has written an inspirational book that will motivate leaders to tap the full potential of their employees, their businesses, and the customers they serve.",N/A,N/A,en
The Sea-crossed Fisherman,['Yaşar Kemal'],1985,['Leadership'],N/A,N/A,N/A,en
Group Counseling,"['Edward E. Jacobs', 'Riley L. Harvill', 'Robert L. Masson']",1988,['Psychology'],"This text concentrates on the skills and techniques required to lead a group, and offers potential group leaders a model of group counselling that includes both the techniques and the tools for planning and implementing effective groups. This model shows how to integrate leadership and member roles in bringing about decisions, promoting sharing, and facilitating therapeutic change. Every facet of group counselling is discussed in detail - from planning the format, screening members, and identifying issues to conducting in-depth therapy, closing sessions, and handling problem or crisis situations. The reader is taught skills such as getting and holding the focus, and drawing out more passive members. This book should be of interest to degree and diploma students on courses in departments of counsellor education, psychology, human services, social work and nursing.",N/A,N/A,en
The Edge of the Sword,['Charles de Gaulle'],1975-01-01,['Political Science'],N/A,N/A,N/A,en
Mastering Leadership,['Robert J. Anderson'],2016,['BUSINESS & ECONOMICS'],N/A,N/A,N/A,en
The Delta Model,['Arnoldo C. Hax'],2009-11-27,['Business & Economics'],"Strategy is the most central issue in management. It has to do with defining the purpose of an organization, understanding the market in which it operates and the capabilities the firm possesses, and putting together a winning plan. There are many influential frameworks to help managers undertake a systematic reflection on this issue. The most dominant approaches are Michael Porter’s ""Competitive Strategy"" and the ""Resource-Based View of the Firm,"" popularized by Gary Hamel and C.K. Prahalad. Arnoldo Hax argues there are fundamental drawbacks in the underlying hypotheses of these approaches in that they define strategy as a way to achieve sustainable competitive advantage. This line of thinking could be extremely dangerous because it puts the competitor at the center and therefore anchors you in the past, establishes success as a way of beating your competitors, and this obsession often leads toward imitation and congruency. The result is commoditization - which is the worst outcome that could possibly happen to a business. The Delta Model is an extremely innovative view of strategy. It abandons all of these assumptions and instead puts the customer at the center. By doing that it allows us to be truly creative, separating ourselves from the herd in pursuit of a unique and differentiated customer value proposition. Many years of intense research at MIT, supported by an extensive consulting practice, have resulted in development of powerful new concepts and practical tools to guide organizational leaders into a completely different way of looking at strategy, including a new way of doing customer segmentation and examining the competencies of the firm, with an emphasis on using the extended enterprise as a primary way of serving the customer. This last concept means that we cannot play the game alone; that we need to establish a network among suppliers, the firm, the customers, and complementors – firms that are in the business of developing products and services that enhance our own offering to the customer. Illustrated through dozens of examples, and discussion of application to small and medium-sized businesses and not-for-profits, the Delta Model will help readers in all types of organizations break out of old patterns of behavior and achieve strategic flexibility -- an especially timely talent during times of crisis, intense competition, and rapid change.",N/A,N/A,en
Surrounded by Idiots,['Thomas Erikson'],2019-07-30,[],"A runaway bestseller in Sweden that has sold more than a million copies worldwide, Surrounded by Idiots shares a groundbreaking new method of understanding the people around you that will change how you interact with everyone from your coworkers to your spouse. Author Thomas Erikson explains that there are four key behavior types that define how we interact with and perceive the people around us. Understanding someone's pattern of behavior is the key to successful communication. Erikson breaks down the four kinds of behavior types--Reds who are dominant and commanding, Yellows who are social and optimistic, Greens who are laid back and friendly, and Blues who are analytical and precise--and explains how to identify and interact with each type of person. Instead of being bogged down with overly technical categorizations, the simple four color system allows you to speedily identify a friend or coworker and adjust how you speak and share with them. Surrounded by Idiots is full of practical information for interacting with people based on their color, including the strengths and weaknesses of all the profiles, how to give positive and negative feedback to each, and the best way to word an email when writing to someone with a different profile.",N/A,N/A,en
Principle-centered Leadership,['Stephen R. Covey'],2003,['Leadership'],N/A,N/A,N/A,en
Leadership,"['Richard L. Hughes', 'Robert C. Ginnett', 'Gordon J. Curphy']",1996,['Business & Economics'],"Leadership: The Art of Experience, Fifth Edition, is written for the general student to serve as a stand-alone introduction to the subject of leadership. The text consists of 13 chapters and a final section on Basic and Advanced Leadership Skills. Authors Hughes, Ginnett, and Curphy have drawn upon three different types of literature: empirical studies; interesting anecdotes, stories and findings; and leadership skills to create a text that is personally relevant, interesting and scholarly. The authors' unique quest for a careful balancing act of leadership materials help students apply theory and research to their real-life experiences.",N/A,N/A,en
The Truth about Managing People,['Stephen P. Robbins'],2013,['Communication'],"In the Third Edition of the bestselling book, The Truth About Managing People, bestselling author Stephen Robbins shares even more proven principles for handling virtually every management challenge. Robbins delivers 61 real solutions for the make-or-break problems faced by every manager. Readers will learn how to overcome the true obstacles to teamwork; why too much communication can be as dangerous as too little; how to improve your hiring and employee evaluations; how to heal ""layoff survivor sickness""; how to manage a diverse culture; and ways to lead effectively in a digital world. New truths include: how to nurture friendly employees, forget about age stereotypes, first impressions count, be a good citizen, techniques for managing a diverse age group, and ethical leadership among others.",N/A,N/A,en
Leadership and Power,"['Daan Van Knippenberg', 'Michael A Hogg']",2003,['Business & Economics'],This is a synthesis of contributions from eminent social psychologists and organizational scientists that address issues about leadership and power from a fresh perspective.,N/A,N/A,en
The New One Minute Manager,"['Kenneth H. Blanchard', 'Spencer Johnson']",2015,['Business & Economics'],"With a new foreword by Ken Blanchard The original, bestselling blockbuster which has transformed businesses world wide. The blockbuster number one international bestselling phenomenon is back ... not that it ever really went away. This easily-read story quickly demonstrates three very practical management techniques: One Minute Goals, One Minute Praisings and One Minute Reprimands. The One Minute Manager also includes information on several studies in medicine and in the behavioural sciences, which help readers understand why these apparently simple methods work so well with so many people. The book is brief, the language is simple, and best of all ... it works.",5,N/A,en
The Structure and Dynamics of Organizations and Groups,[],1966,['Leadership'],N/A,N/A,N/A,en
Leadership is an Art,['Max De Pree'],1989,['Biography & Autobiography'],"In what has become a bible for the business world, the successful CEO of Herman Miller, Inc., explores how executives and managers can learn the leadership skills that build a better, more profitable organization.",4,N/A,en
The Big Five for Life - Paperback,['John Strelecky'],2012-01-05,[],N/A,N/A,N/A,en
Why Leaders Can't Lead,['Warren G. Bennis'],1989-04-15,['Business & Economics'],An analysis of the problems facing anyone who tries to take charge of an organization--of whatever kind--and effect change; with specific suggestions.,N/A,N/A,en
Midas Touch Intl,['Trump Donald J'],2012-09-01,['Businesspeople'],N/A,N/A,N/A,en
The Game-Changer,"['Lafley', 'A.G. & Charan', 'Ram']",2008,['Corporations'],"&Lsquo;A.G. Lafley Has Made Procter And Gamble Great Again&Rsquo;&Mdash;Economist &Lsquo;Ram Charan Is The Most Influential Consultant Alive&Rsquo;&Mdash;Fortune Magazine How To Increase And Sustain Organic Revenue And Profit Growth&Mdash;Whether You&Rsquo;Re Running An Entire Company Or In Your First Management Job. Over The Past Seven Years, Procter &Amp; Gamble Has Tripled Profits; Hugely Improved Organic Revenue Growth, Cash Flow, And Operating Margins; And Significantly Boosted Dividends. How? A. G. Lafley And His Leadership Team Have Integrated Innovation Into Everything Procter &Amp; Gamble Does&Mdash;Creating New Customers And New Markets. Through Eye-Opening Stories A. G. Lafley And Ram Charan Show How P&Amp;G And Companies Such As Nokia, Lego, And Ge Have Become Game-Changers. Their Inspiring Lessons Will Help You Achieve Higher Growth And Higher Margins, Tap In To Abundant Creativity Outside Your Business, Manage Risk And Integrate Innovation Into Your Decision-Making. In A World Of Unprecedented Change And Competitiveness, Innovation Is The Best&Mdash;And Arguably The Only&Mdash;Way To Win. Innovation Is Not A Separate Activity, But The Job Of Everyone In A Leadership Position And The Integral Driving Force For Any Business That Wants To Grow And Succeed. This Is A Game-Changing Book That Helps You Redefine Your Leadership.",N/A,N/A,en
Onward,"['Howard Schultz', 'Joanne Gordon']",2011,['Coffee'],"In 2008, Howard Schultz, the president and chairman of Starbucks, made the unprecedented decision to return as the CEO eight years after he stepped down from daily oversight of the company and became chairman. Concerned that Starbucks had lost its way, Schultz was determined to help it return to its core values and restore not only its financial health, but also its soul. In Onward, he shares the remarkable story of his return and the company's ongoing transformation under his leadership, revealing how, during one of the most tumultuous economic times in history, Starbucks again achieved profitability and sustainability without sacrificing humanity. Offering readers a snapshot of a moment in history that left no company unscathed, the book zooms in to show, in riveting detail, how one company struggled and recreated itself in the midst of it all. The fast paced narrative is driven by day-to-day tension as conflicts arise and lets readers into Schultz's psyche as he comes to terms with his limitations and evolving leadership style. Onward is a compelling, candid narrative documenting the maturing of a brand as well as a businessman. Onward represents Schultz's central leadership philosophy: It's not just about winning, but the right way to win. Ultimately, he gives readers what he strives to deliver every day- a sense of hope that, no matter how tough times get, the future can be just as or more successful than the past, whatever one defines success to be. ""Through the lens of his personal leadership journey, with all of its dizzying ups and agonizing downs, Howard Schultz has written, with aching honesty and passion, the single most important book on leadership and change for our time and for every generation of leaders. This book is not just recommended reading, it's required."" Warren Bennis, Distinguished Professor of Business, University of Southern California, and author of the recently published Still Surprised: A Memoir of a Life in Leadership ""[This] sequel to the founding of Starbucks is grittier, more gripping, and dramatic, and [Schultz's] voice is winning and authentic. This is a must-read for anyone interested in leadership, management, or the quest to connect a brand with the consumer."" Publishers Weekly",N/A,N/A,en
