title,authors,publishedDate,categories,description,averageRating,textSnippet,language
Leadership and Decision-making,"['Victor Harold Vroom', 'Philip W. Yetton']",1973,['BUSINESS & ECONOMICS'],N/A,N/A,N/A,en
The Art of War,['Sun Tzu'],2017-03,['Business & Economics'],A manual on the rational planning and conduct of military operations written over two millennia ago in China.,N/A,N/A,en
Organizations,"['James L. Gibson', 'John M. Ivancevich', 'James H. Donnelly']",1982,['Business & Economics'],N/A,N/A,N/A,en
"Vested Outsourcing, Second Edition","['K. Vitasek', 'M. Ledyard']",2013-05-13,['Business & Economics'],"In her classic book Vested Outsourcing , Kate Vitasek identified the top 10 flaws in most outsourced business models and shows organizations how to rethink their outsourcing relationships in a way that will lower costs, improve service, and increase innovation. This revised edition includes updated case studies and a new chapter based on Dell.",N/A,N/A,en
Art of War,['Sun Tzu'],2022-07-19,['Business & Economics'],This elegant edition of Sun Tzu's classic text The Art of War uses traditional Chinese binding techniques to deliver essential wisdom in a beautiful package.,N/A,N/A,en
The Nature of Leadership,"['John Antonakis', 'Anna T. Cianciolo', 'Robert J. Sternberg']",2004,['Business & Economics'],"More than ever before, leadership is seen as critical for the proper functioning of societies and social institutions. Written by a team of leading experts, The Nature of Leadership will provide compelling answers to the most vexing questions surrounding leadership: Is leadership measurable? Are there traits that reliably distinguish leaders from nonleaders? Does the situation matter? Are there differences in women's and men's leadership styles? Is ethical leadership effective leadership? Are elements of leadership culturally bounded whereas other elements are universal? Does vision really matter? Can leadership be developed? --COVER.",5,N/A,en
"Cases on Management, Leadership and Organisations","['Knud Sinding', 'Anne Bøllingtoft']",2012-10-11,['Business & Economics'],"The realities of organisational life seem a far departure from what is taught in the classroom, particularly if one has never before worked for an organisation. The examples presented in this book bring to life the challenges of managing and leading organisations and are relevant for students who must learn to analyse, discuss and assess what takes place within organisations, what ought to happen and why certain strategies fail. The book contains 24 case studies from a range of organisations, some anonymous and others known. Among other things the case studies include profiles of leaders or managers, the organisational structure, decision-making and information flow in each organisation. The businesses covered range widely, from anonymous government offices to the arcane peculiarities of university departments and to vast shipping conglomerates.",N/A,N/A,en
Ethics and Leadership in Business and Politics,"['Faan Malan', 'Ben Smit (professor.)']",2001,['Business & Economics'],"This work provides a mindset for leadership to deal with the problem of unethical transgressions in South African communities and buisness. It provides a thorough and comprehensive diagnosis of leadership and morality, from an analysis of causes, to the compilation of remedies.",N/A,N/A,en
Management of Organizational Behavior,"['Paul Hersey', 'Kenneth H. Blanchard']",1977,['Business & Economics'],"Monograph on the behavioural sciences approach to personnel management - covers managerial skills, motivation, leadership, job enrichment, group dynamics, behavioural change, etc. Bibliography pp. 321 to 351, graphs and references.",N/A,N/A,en
Principle-centered Leadership,['Stephen R. Covey'],1999,['Business & Economics'],Stephen Covey's empowering philosophy for life is translated into a useful guide to managing people in organisations and business. He shows how to create harmony in organisations that have suffered poor internal relationships over a long period.,5,N/A,en
The Leader Who Had No Title,['Robin Sharma'],2010-03-23,['Business & Economics'],"From the author of ""The Monk Who Sold His Ferrari"" comes an inspiring parableabout the skills needed to excel in career and life.",4.5,N/A,en
Global Marketing Strategy,['Bodo B. Schlegelmilch'],2016-03-02,['Business & Economics'],"This book has been written for experienced managers and students in postgraduate programs, such as MBA or specialized Masters programs. In a systematic yet concise manner, it addresses all major issues companies face when conducting business across national and cultural boundaries, including assessing and selecting the most promising overseas markets, evaluating market entry alternatives, examining the forces that drive adaptation versus standardization of the marketing mix. It looks at the various global marketing challenges from a strategic perspective and also addresses topics not usually found in international marketing texts, such as aligning marketing strategies with global organizational structures, managing the relationship between national subsidiaries, regional headquarters and global headquarters, as well as corporate social responsibility challenges, and pertinent future trends that are likely to affect global business.",N/A,N/A,en
Doing the Right Things Right,['Laura Stack'],2016-01-18,['Business & Economics'],"A How-To Guide for the Modern Leader Inspired by Peter Drucker's groundbreaking book The Effective Executive, Laura Stack details precisely how 21st-century leaders and managers can obtain profitable, productive results by managing the intersection of two critical values: effectiveness and efficiency. Effectiveness, Stack says, is identifying and achieving the best objectives for your organization—doing the right things. Efficiency is accomplishing them with the least amount of time, effort, and cost—doing things right. If you're not clear on both, you're wasting your time. As Drucker put it, “There is nothing so useless as doing efficiently that which should not be done at all.” Stack's 3T Leadership offers twelve practices that will enable executives to be effective and efficient, grouped into three areas where leaders spend their time: Strategic Thinking, Teamwork, and Tactics. With her expert advice, you'll get scores of new ideas on how you, your team, and your organization can boost productivity.",N/A,N/A,en
Synchronicity,"['Joseph Jaworski', 'Betty S. Flowers']",1998,['Business & Economics'],"Sparked by a conversation about the lack of moral and ethical standards at high levels in business, this text explores the issues of leadership.",4,N/A,en
Leading Consciously,['Debashis Chatterjee'],1998,['Business & Economics'],"This work brings together classical spiritual wisdom and contemporary scientific truths about work, organization and leadership. The author addresses issues of motivation, decision-making, work psychology, and self-mastery.",N/A,N/A,en
Develop Your Leadership Skills,['John Eric Adair'],2007,['Business & Economics'],"Develop your Leadership Skills is John Adair's most accessible title on leadership. Full of exercises and checklists, it can help to boost confidence levels and guide and inspire anyone on their journey to becoming a leader of excellence.Acknowledged as a world expert, John Adair offers stimulating insights into recognizing and developing individual leadership qualities, aquiring personal authority, and most importantly, mastering core leadership functions such as planning, communicating and motivating.Suitable for anyone who wishes to improve or develop their leadership skills, this guide distils the essence of John Adair's teaching and provides a framework for becoming an effective leader.",3,N/A,en
Organizations,[],2006,['Corporate culture'],N/A,N/A,N/A,en
Start with why,['Simon Sinek'],2011,['Leadership'],"Why are some people and organisations more inventive, pioneering and successful than others?And why are they able to repeat their success again and again? Because in business, it doesn't matter what you do, it matters why you do it. Steve Jobs, the Wright Brothers, and Martin Luther King have one thing in common - they started with why. This book is for anyone who wants to inspire others, or to be inspired. www.startwithwhy.com Jacket design: Base Art Co.",N/A,N/A,en
Education and Leadership,"['Tom Claes', 'Frank McMahon', 'David Seth Preston']",2008,['Education'],"This truly international book brings together authors from different regions of the world including North America, South Africa, Europe, Iran and Russia all of whom are concerned with aspects of the challenges involved in the expansion of higher education, both in student numbers and areas of study. Some are concerned about the loss of guiding principles which steered university education for centuries. The traditional purposes of higher education have come under such pressure that we have achieved ""conflicting models of the university"" (Claes) and ""ambiguity"" in regard to teaching and research (Simons et al). For others, the problems are at a different stage. Contributions from South Africa look at three challenges: Can we provide enough places in higher education? How do we deal with institutional mergers? How do we make staff development effective in a situation in which English is the first language of less than five percent of the staff? Young scholars in Russian regions face formidable hurdles in achieving academic careers while the best law graduates in Canada are faced with the ethical dilemma of personal career advancement or social justice (Topsakal). The problem of integrating nursing into a traditional Irish university is reviewed by Grant while the role of a university in regional development is addressed from a Greek perspective by Papaelias et al. The comparative international approach features in research into teacher job satisfaction in India and Iran while McMahon reviews the impact of the Bologna Process.",N/A,N/A,en
Body Language in Business,"['A. Furnham', 'E. Petrova']",2010-05-13,['Business & Economics'],"This innovative new work clarifies the misconceptions around body language while providing a scientific approach to understanding non-verbal communication at work. The authors explain why it is so important to understand body language in business, combining hard research evidence with unambiguous tips and practical applications.",N/A,N/A,en
How to Win Friends and Influence People,['Dale Carnegie'],2018,[],"How to Win Friends and Influence People' is one of the first best-selling self-help books ever published. Just after publishing, it quickly exploded into an overnight success, eventually selling more than 15 million copies worldwide, and pioneering an entire genre of self-help and personal success books. With an enduring grasp of human nature, it teaches his readers how to handle people without letting them feel manipulated, how to make people feel important without inspiring resentment, how win people over to your point of view without causing offence, and how to make a friend out of just about anyone. Millions of people around the world have improved their lives based on the teachings of Dale Carnegie. This classic book will turn your relationships around and improve your interactions with everyone in your life. ABOUT THE AUTHOR: Dale Carnegie (1888-1955) was an American writer and lecturer and the developer of famous courses in self-improvement, salesmanship, corporate training, public speaking and interpersonal skills. He was born in an impoverished family in Maryville, Missouri. Carnegie harboured a strong love and passion for public speaking from a very early age and was very proactive in debate in high school. During the early 1930's, he was renowned and very famous for his books and a radio program. 'When How to Win Friends and Influence People' was published in 1930, it became an instant success and subsequently became one of the biggest bestsellers of all time. Carnegie loved teaching others to climb the pillars of success. His valuable and tested advice was used in many domains and has been the inspiration of many famous people's success. One of the core ideas in his books is that it is possible to change other people's behavior by changing one's reaction to them.",5,N/A,en
Managing Human Behavior in Public and Nonprofit Organizations,"['Robert B. Denhardt', 'Janet V. Denhardt', 'Maria P. Aristigueta']",2012-04-10,['Business & Economics'],"The only text in management and organizational behavior to focus on public organizations, nonprofit organizations, and school systems, Managing Human Behavior in Public and Nonprofit Organizations fosters competency in critical management and leadership skills including communication, motivation, teamwork, group dynamics, and decision-making. Cases, self-assessment exercises, simulations, and evaluative instruments provide students the opportunity to experience the applied side of theories and to learn both cognitively and experientially. The Third Edition covers recent developments in the field including the emergence of ""positive organizational behavior.""",N/A,N/A,en
Work-Life Matters,"['David Pendleton', 'Peter Derbyshire', 'Chloe Hodgkinson']",2021-08-27,['Business & Economics'],"Work-life balance isn’t about where or how you spend your time. At least not solely. It’s about where and how you use and replenish your energy. Work matters. Life matters. Work-life matters. As we start to navigate life during and after the pandemic, employers and employees are increasingly re-evaluating how work can be made more sustainable and more fulfilling. Many employees - particularly Gen X and Gen Z - are seeking a new psychological contract with their employers. Putting these trends into context and offering practical solutions, this book takes a deep dive into why work matters as part of a healthy and fulfilling life. The authors present a new and different way of thinking about the matter of balance, arguing that there is no hard divide between ‘work’ and life’ because ‘work’ takes place entirely within ‘life’ and you can’t balance two things when one is a subset of the other. To achieve the balance required for a healthy existence, we need to recognise that there are activities in all parts of work-life that drain our energy and others that give us a buzz. Rather than trying to solve the drain of hard work by living it large at the weekend – or compensating for an unfulfilling home life by working like a demon, we need to create balance at work and balance at home. Now is a golden opportunity to re-examine the world of work and job-craft to make them more satisfying, less draining and more energising. The ideas in this book provide a practical guide to help that process.",N/A,N/A,en
How to Win Friends & Influence People,['Dale Carnegie'],2019*,['Fiction'],"The book 'How to win Friends & Influence People' (Lok Vyavhar) presents a lot on personality development thus making you an extraordinary person. The book provides fundamental techniques in handling people and big secret of dealing with people. By reading this book you get one of the best things that 'An increased tendency to think always in terms of other people's point of view, and see things from their angle', may easily prove to be one of the building blocks of your career. he book suggests you very simple ways to make a good first impression like 'the value of a smile', and how to become a good conversationalist. This self-help book provides very simple ways to make people like you and how to win them to your way of thinking, and suggest how to begin in friendly way. The book mentions the secret of Socrates, which in turn sets the psychological process of the listeners moving in the affirmative direction. The book helps in developing the Leadership Qualities too. A detailed study with various practical examples, incidences are mentioned herewith so that each concept becomes clear and easy to understand. In addition, DALE CARNEGIE hired a trained researcher to spend one and half years in various libraries reading everything he had missed, searching through countless biographies, over hundreds of magazine articles, trying to ascertain how the great leaders had dealt with people. This will sharply increase your skill in human relationship. The language of the book is lucid and simple. A must-read book for everyone.",N/A,N/A,en
China’s Management Revolution,['Charles-Edouard Bouée'],2010-11-24,['Business & Economics'],As one of the world's largest economies China is facing many unique management challenges in the wake of the financial crisis. The future presents many opportunities for growth and commerce but new management skills must be developed to cope with these issues.,N/A,N/A,en
Readings in Organizations,"['James L. Gibson', 'John M. Ivancevich', 'James H. Donnelly']",1979,['Business & Economics'],N/A,N/A,N/A,en
Reasons for Frequent Failure in Mergers and Acquisitions,['Thomas Straub'],2007-10-16,['Business & Economics'],"Using four statistical methods, Thomas Straub shows that M&A performance is a multi-dimensional function of: strategic logic, organizational behavior, and financial aspects.",N/A,N/A,en
The Science of Leadership,['Julian Barling'],2014,['Business & Economics'],"Barling takes an evidenced-based approach to his subject, relying primarily on knowledge generated from psychological research on organisational leadership conducted around the world, with some personal reflections from two decades of involvement in leadership research and leadership development with executives.",N/A,N/A,en
The Art of War,['Sunzi'],2013,['Leadership'],"Presents sixth-century philosopher Sun Tzu's thoughts on war, in which he discusses the laying of plans, the actual waging of war, and the value of negotiation.",N/A,N/A,en
Managers as Facilitators,"['Richard G. Weaver', 'John D. Farrell']",1997,['Business & Economics'],"An effective program to help transform business leaders and managers into skilled facilitators, this book offers readers practical guidance to become effective facilitators of teams and groups. The authors outline the four essential skills facilitators need to be successful. 33 charts, 60 tables.",N/A,N/A,en
The 7 Habits of Highly Effective People,"['Stephen R. Covey', 'Sean Covey']",2020-06,[],"The 7 habits have become famous and are integrated into everyday thinking by millions and millions of people. Why? Because they work! With Sean Covey's added takeaways on how the habits can be used in our modern age, the wisdom of the 7 habits will be refreshed for a new generation of leaders. They include: Habit 1: Be Proactive Habit 2: Begin with the End in Mind Habit 3: Put First Things First Habit 4: Think Win/Win Habit 5: Seek First to Understand, Then to Be Understood Habit 6: Synergize Habit 7: Sharpen the Saw This beloved classic presents a principle-centered approach for solving both personal and professional problems. With penetrating insights and practical anecdotes, Stephen R. Covey reveals a step-by-step pathway for living with fairness, integrity, honesty, and human dignity--principles that give us the security to adapt to change and the wisdom and power to take advantage of the opportunities that change creates.",N/A,N/A,en
Joining Together,"['David W. Johnson', 'Frank Pierce Johnson']",1991,['Business & Economics'],N/A,N/A,N/A,en
The Culture Code,['Daniel Coyle'],2019,['Business & Economics'],"THE NEW YORK TIMES BESTSELLER 'A marvel of insight and practicality' Charles Duhigg, author of The Power of Habit ____________________________ How do you build and sustain a great team? The Culture Code reveals the secrets of some of the best teams in the world - from Pixar to Google to US Navy SEALs - explaining the three skills such groups have mastered in order to generate trust and a willingness to collaborate. Combining cutting-edge science, on-the-ground insight and practical ideas for action, it offers a roadmap for creating an environment where innovation flourishes, problems get solved, and expectations are exceeded. ____________________________ 'There are profound ideas on every single page, stories that will change the way you work, the way you lead, and the impact you have on the world. Highly recommended, an urgent read.' Seth Godin, author of Linchpin 'Truly brilliant . . . Read it immediately' Adam Grant, author of Originals 'Well told stories, with actionable lessons' Financial Times",N/A,N/A,en
21st Century Management: A Reference Handbook,['Charles Wankel'],2008,['Business & Economics'],Ordered as part of a set on ID 7574134.,N/A,N/A,en
How to Win Friends and Influence People,['Dale Carnegie'],2022-05-17,['Business & Economics'],"This new edition of the most influential self-help book of the last century features updated information from the author's daughter, with timeless advice on topics such as effective communication and navigating social situations.",N/A,N/A,en
The Palgrave Handbook of Spirituality and Business,"['L. Bouckaert', 'L. Zsolnai']",2011-08-16,['Business & Economics'],"A summary of the most important issues, approaches and models in the field of spirituality in business, economics and society. The Handbook of Spirituality and Business presents a comprehensive pluralistic view covering all the major religious and spiritual traditions.",N/A,N/A,en
China's Next Strategic Advantage,"['George S. Yip', 'Bruce McKern']",2016-04-08,['Business & Economics'],A book for everyone who does business with China or in China.,N/A,N/A,en
The SPEED of Trust,"['Stephen M.R. Covey', 'Stephen R. Covey', 'Rebecca R. Merrill']",2008-02-05,['Business & Economics'],Part of NWTC's Talent Development collection.,3.5,N/A,en
Eastern European Perspectives on the Development of Public Relations,['T. Watson'],2014-08-19,['Business & Economics'],"The National Perspectives on the Development of Public Relations: Other Voices series is the first to offer an authentic world-wide view of the history of public relations. It features six books, five of which cover continental and regional groups. This second book in the series focuses on Eastern Europe.",N/A,N/A,en
Well-being,"['Ivan Robertson', 'Cary Cooper']",2011-04-27,['Business & Economics'],"High levels of well-being at work is good for the employee and the organization. It means lower sickness-absence levels, better retention and more satisfied customers. People with higher levels of well-being live longer, have happier lives and are easier to work with. This book shows how to improve well-being in your organization.",N/A,N/A,en
Alexander the Great's Art of Strategy,['Partha Sarathi Bose'],2003,['Business & Economics'],"Partha Bose follows Alexander the Great's life and military campaigns and shows how one can employ his leadership lessons to conquer today's challenges in commerce, politics, and life.",4,N/A,en
Women in Power,['Blema S. Steinberg'],2008-03-20,['Biography & Autobiography'],"How the personality traits of Gandhi, Meir, and Thatcher developed, and their impact on leadership behaviour.",N/A,N/A,en
The Butterfly Effect in Competitive Markets,['. Rajagopal'],2015-03-04,['Business & Economics'],"This book provides an introduction to the concept of entrepreneurship and entrepreneurial business management. It covers many elements of the entrepreneurial management discipline including choosing a business, organizing, financing, marketing, developing an offering that the market will value, and growing the business in all its dimensions.",N/A,N/A,en
The Art of Leadership,['Dag Heward-Mills'],2008-12-10,['Religion'],"The art of leadership is very important in the church today and if you have been called to ministry, you have been called to leadership. This book contains information on absolutely everything you have to know about leadership and how to be a good leader. Leadership is a great responsibility and that is why you need to know the secrets and truths. The list is endless Â as a leader you have to inspire people, find solutions for problems, be a thinker and make your followers love you to mention only a few. In this book Dag Heward-Mills discusses every important aspect so that you can discover this important art that you need as Christian leader. Dr. David Yonggi Cho, senior pastor from the Yoidi Full Gospel Church in South Korea, writes the foreword and says: ÂThe Art of Leadership will show you the way and it will provide a guide into the secrets of a true leader. It is an art and as such, it must be learned. This book will teach you everything that you need or desire to learn about the important art of leadership in the church today.Â",N/A,N/A,en
The Power Elite,['Charles Wright Mills'],1959,['History'],"First published in 1956, The Power Elite stands as a contemporary classic of social science and social criticism. C. Wright Mills examines and critiques the organization of power in the United States, calling attention to three firmly interlocked prongs of power: the military, corporate, and political, elite. The Power Elite can be read as a good account of what was taking place in America at the time it was written, but its underlying question of whether America is democratic in practice as it is in theory continues to matter very much today. Copyright © Libri GmbH. All rights reserved.",N/A,N/A,en
