title,authors,publishedDate,categories,description,averageRating,textSnippet,language
The Leader's Guide to Lateral Thinking Skills,['Paul Sloane'],2003,['Business & Economics'],"Praise and Reviews `If you are only going to read one business book this year, this is the one. No modern business leader should be unaware of these insights.`BRIAN MCBRIDE, VP Northern Europe, Dell Computer Corporation`Sloane delivers rocket fuel for the business brain.`BILL PENN, CEO, Sparx Group`Every business should embrace lateral thinking. Every leader should embrace this book.`AJAZ AHMED, CEO, AKQA`This book teaches leaders how to transform creativity into meaningful innovation.`SHAWN JAVID, CEO, Insightful Inc.Do you want to unlock the creative potential of your team?Is innovation a core value for your organization?Do you have the skills to inspire new ideas?Do you know how lateral leadership can transform your organization?Leadership is not just about command and control - it is about inspiring your team to make the vision a reality by conceiving and implementing creative solutions they never thought possible.With a lively and energetic approach, this highly acclaimed author, trainer and presenter will teach you dynamic, up-to-date techniques to unleash the creative energies of your people and show you how to put the techniques to work immediately. You can use lateral thinking to turn your organization around. This book describes how the lateral leader develops the vision, culture and processes that transform a regular business into an innovation hothouse. The book is packed with real-life examples, practical methods and lateral thinking exercises you can put to work today.",N/A,N/A,en
7 HABITS OF HIGHLY EFFECTIVE PEOPLE.,[],2017,[],N/A,N/A,N/A,en
The Art of Project Management,['Scott Berkun'],2005,['Business & Economics'],"In this book, you'll learn from a veteran manager of software and web development how to plan, manage, and lead projects. This personal account of hard lessons learned over a decade of work in the industry distills complex concepts and challenges into practical nuggets of useful advice. Inspiring, funny, honest, and compelling, this is the book you and your team need to have within arms reach. It will serve you well with your current work, and on future projects to come. - Publisher.",5,N/A,en
Organizations,['James L. Gibson'],2003,['Business & Economics'],"A theme throughout this text is that effective management of organizational behaviour requires an understanding of theory, research, and practice. It illustrates how organizational behaviour theory leads to research and how theory and research provide the foundations for practical applications.",N/A,N/A,en
Business and Society,"['Danica Purg', 'Alenka Braček Lalić', 'Jennifer A. Pope']",2018-06-26,['Business & Economics'],"The world of business is constantly evolving and management education institutions will likely face a number of challenges in keeping up with these changes. While most books focus on the needs of management education institutions, this work addresses the needs of the corporate world in the era of the Fourth Industrial Revolution. Featuring an extensive research study spanning 11 countries, it offers a unique perspective on the business challenges and developmental needs of companies in emerging and recently emerged economies, and on the missing links between those needs and management education. Using both company-specific and country-level data, the book provides businesses and educators with rare insights and recommendations on strengthening existing partnerships (or establishing them anew) between management education institutions and the corporate sector in order to make management education relevant for the 21st century. The book argues that ‘relevance’ should take the center-stage of all higher education institutions in order to accomplish their third mission, namely service to society. This is especially important for management education institutions, whose mission is to mold future managers and leaders who can have a significant influence on economic success and the wellbeing of society.",N/A,N/A,en
"Green Growth, Green Profit",['Roland Berger Strategy Consultants GmbH'],2016-01-22,['Business & Economics'],"Green business is here. It is a multi billion business with enormous growth potential, driven by megatrends such as demographic change, climate change and urbanization. It is driving the transformation of existing businesses and changing the way customers and suppliers act, forcing them to rethink their business strategy.",N/A,N/A,en
Leaders Make the Future,['Robert Johansen'],2012-05-07,['Business & Economics'],"NEW EDITION, REVISED AND UPDATEDWhat are the new leadership skills needed to succeed in the decade ahead? In this second edition Bob Johansen, bestselling author and longtime CEO of the Institute for the Future, teams with the prestigious Center for Creative Leadership (CCL), not only describing and updating the 10 new essential leadership skills but also offering tools and techniques for developing and applying them.",N/A,N/A,en
"The New Economics for Industry, Government, Education",['William Edwards Deming'],1994,['Business & Economics'],"The new second edition of W. Edwards Deming's final book includes revisions to THE DEMING SYSTEM OF PROFOUND KNOWLEDGE (tm). This is the knowledge needed for transformation from the present style of management to one of optimization. Dr. Deming writes, ""This book is for people who are living under the tyranny of the prevailing style of management."" This second edition also includes an appendix, titled ""Continuing Purchase of Supplies & Service,"" which will be helpful to readers who wish to better understand his writings on relationships with suppliers. This important book builds & expands on the foundation of Dr. Deming's lifework as detailed in his classic book, OUT OF THE CRISIS (ISBN 0-911379-01-0, MIT/CAES, $29.50). THE NEW ECONOMICS is heavily cross-referenced to OUT OF THE CRISIS--new followers of the Deming philosophy will find it necessary to read both books. Born with the century, W. Edwards Deming was one of the great American leaders of the postwar era & the voice of quality worldwide. Until his death in December of 1993, Dr. Deming maintained a thriving consulting practice with clients in manufacturing, telecommunications, transportation, healthcare, education, & government. His renowned four-day seminars reached over 10,000 people annually. To order from MIT Center for Advanced Engineering Study (617) 253-7444. FAX: (617) 253-8301.",N/A,N/A,en
Leading Minds,"['Howard E. Gardner', 'Emma Laskin']",1995-07-14,['Business & Economics'],"Howard Gardner is, in the words of the New York Times Book Review, ""one of America's most interesting psychologists.",N/A,N/A,en
The Art of War,['S. Tzu'],2014,['History'],"Presented here in a beautifully illustrated new edition, Sun Tzu's classic work of strategic thinking is filled with powerful insights and philosophical revelations that are applicable to just about any aspect of life.",N/A,N/A,en
"Green Growth, Green Profit",['Roland Berger Strategy Consultants'],2010-11-24,['Business & Economics'],"Highlights the challenges ahead for business managers and politcial leaders on the issues of green business and sustainability, with insights from experts in the key markets and regions",N/A,N/A,en
The Accountable Leader,['Brian Dive'],2008,['Business & Economics'],"Management consultant Dive explores the relationship between leadership, accountability, and organizational structure. He argues that the majority of leadership-related problems arise not from ineffective individuals but from organizational structures that lack accountable jobs.",N/A,N/A,en
The Leader as Martial Artist,['Arnold Mindell'],2014-02-27,['Business & Economics'],"Arnold Mindell describes ""The Leader as Martial Artist"" in his new 2014 preface: ""Here you will find my first introduction to Deep Democracy, as the core of organizational process. Here is where you will find a basic and today, still completely relevant application of field theory, how it connects with Taoism, and ""time spirits."" The stress upon awareness in the midst of psychological and political turbulence is timeless. We are especially thrilled to be able to republish the ""The Leader as Martial Artist."" All of us here at DDX after having read the book, resonate with the following quote of Mindell updating this 3rd edition: ""If I was a Taoist and lived hundreds or thousands of years ago, and found the Leader as Martial Artist, I would leave my quiet monastery. Then I would make ""worldwork"" as described in this book, my next step.""",N/A,N/A,en
Beyond Strategic Vision,"['Michael Cowley', 'Ellen Domb']",1997,['Business & Economics'],"Hoshin is a system which was developed in Japan in the 1960's, and is a derivative of Management By Objectives (MBO). It is a Management System for determining the appropriate course of action for an organization, and effectively accomplishing the relevant actions and results. Having recognized the power of this system, Beyond Strategic Vision tailors the Hoshin system to fit the culture of North American and European organizations. It is a ""how-to"" guide to the Hoshin method for executives, managers, and any other professionals who must plan as part of their normal job. The management of an organization, whether it be large or small, has as one of its principal responsibilities setting the direction of the organization for the future. The most effective way to set the future direction is to develop a shared vision of what the organization will be in the future, contrast it to the way the organization is now, and then to create a plan for bridging the gap: the Strategic Plan. Beyond Strategic Vision shows you how to do this effectively and efficiently.",N/A,N/A,en
What Great Service Leaders Know and Do,"['James L. Heskett', 'W. Earl Sasser', 'W. Earl Sasser Jr.', 'Leonard A. Schlesinger']",2015-09,['Business & Economics'],"In this book the authors cover every aspect of optimal service leadership: the best hiring, training, and workplace organization practices; the creation of operating strategies around areas such as facility design, capacity planning, queue management, and more; the use - and misuse - of technology in delivering top-level service; and practices that can transform loyal customers into ""owners."" They describe the world of great service leaders in which ""both/and"" thinking replaces trade-offs. It's a world in which new ideas will be tested against the sine qua non of the ""service trifecta""--Wins for employees, customers, and investors. And it's a world in which the best leaders admit that they don't have the answers and create organizations that learn, innovate, ""sense and respond, "" operate with fluid boundaries, and seek and achieve repeated strategic success. --",N/A,N/A,en
High Performance Team Coaching,"['Jacqueline Peters', 'Catherine Carr']",2013,['Business & Economics'],"""High Performance Team Coaching (HPTC) is a fantastic resource and a 'must read' for all Team Leaders and Coaches. The authors demystify the concepts of creating and sustaining high performance teams and how to lead and coach them. Built upon solid research and investigation along with practical and relevant action steps, it is a resource that will help move your team from average or good, to high performance in any context."" - Lillas Marie Hatala and Richard Hatala, Co-authors of Integrative Leadership: Building a Foundation for Personal, Interpersonal, and Organizational Success ""With a combination of systematic field research and an intense scrutiny of the literature, Peters and Carr have developed a system of high performance team coaching that is fit-for-purpose and accessible for practitioners but with an appropriate and transparent evidence base. It provides the framework and underpinning that will allow this much needed team coaching] modality to achieve its potential."" - Dr. Annette Fillery-Travis, M/DProf Programme Coordinator, Middlesex University Member of the Steering Group of the International Centre for the Study of Coaching ""High Performance Team Coaching advances the field of coaching by filling the gap for a practical, yet thoroughly evidence-based model to guide team coaching practice. Drawing on the authors' considerable experience and their recent empirical research this clearly written, well-documented text provides actionable guidelines and practical strategies for working with teams and makes a genuine and important contribution to the field."" - Dr. Elaine Cox, Editor: International Journal of Evidence Based Coaching and Mentoring Director of Postgraduate Coaching & Mentoring Programmes, Oxford Brookes University...",N/A,N/A,en
The Human Group,['George Caspar Homans'],1975,['Psychology'],N/A,N/A,N/A,en
Foch,['Michael S. Neiberg'],2003,['Biography & Autobiography'],Analyzes the career of one of France s greatest military heroes and examines the contentious postwar Versailles Conference of 1919,N/A,N/A,en
"Humble Leadership, Second Edition","['Edgar H. Schein', 'Peter A. Schein']",2023-08-22,['Business & Economics'],"Discover a more agile, democratic, and effective model of leadership, from legendary business scholar Edgar Schein and Silicon Valley executive Peter Schein. Legendary organizational scholar Edgar Schein and former Silicon Valley executive Peter Schein say leadership today requires that people transcend their hierarchical roles and relate to each other as human beings-what they call humble leadership. In such relationships new ideas can flow freely, mistakes can come to light immediately, and course corrections can be made in real time rather than by committee or by order of the lone heroic CEO. This second edition includes three new chapters. Chapter 1 zeros-in on the Schein's actionable definition of leadership-relative to management and administration-focused on leading people toward new and better. Chapter 2 introduces the concept of situational humility-leaders now need to shift between several types of relationships to deal with the accelerating complexity of a supply-constrained, quiet-quitting, and two-days-in-the-office world. And Chapter 5 explains how to create a culture of humble leadership. Illustrated with examples from healthcare, government, the military, tech, and more, this is a compact, accessible guide to a leadership paradigm far better suited to a world that demands fast, nimble response to change, and a workplace hungry for mutual respect and trust.",N/A,N/A,en
Management of Organizational Behavior,"['Paul Hersey', 'Kenneth H. Blanchard', 'Dewey E. Johnson']",1996,['Business & Economics'],"Used by more than a million people, this best-selling book is based on fundamental ideas from the applied behavioral sciences that have been successfully applied in thousands of organizations throughout the world. The Seventh Edition of Management of Organizational Behavior continues to build on the concepts and techniques of two important applied behavioral science approaches: Situational Leadership and One Minute Management - programs adopted worldwide by more than 400 of the Fortune 500 companies. The Seventh Edition is thoroughly revised and updated to reflect the most current research in the behavioral sciences as well as the continued development in the authors' thinking and their consulting activities. In addition to bringing quality management into clearer focus, the book features two new chapters written by international consultants. The new edition also takes into account comments and suggestions provided by managers, students, teachers, researchers, consultants, and reviewers; offers a clear writing style and flexible format; and includes an extensive list of suggested supplementary reading. Management of Organizational Behavior, Seventh Edition, provides readers with a thorough introduction to the exciting field of management of organizational behavior applicable to public and private management and administration in a wide variety of disciplines: business, communication, health sciences, education, nursing, engineering, and agribusiness.",N/A,N/A,en
Understanding Leadership,"['Gayle C Avery', 'Andrew Bell', 'Martin Hilb', 'Anne E. Witte']",2004-02-18,['Business & Economics'],"In Part One of this title, Gayle Avery integrates a fragmented field into four broad paradigms or forms of leadership, helping to simplify and clarify the ill-defined field of leadership. Part Two provides 10 case studies from leading organizations across Europe, Australia and the USA.",5,N/A,en
Out of the Crisis,['William Edwards Deming'],2000,['Business & Economics'],Deming offers a theory of management based on his famous 14 Points for Management.,4,N/A,en
The Public Wealth of Nations,"['Dag Detter', 'Stefan Fölster']",2016-02-05,['Social Science'],"We have spent the last three decades engaged in a pointless and irrelevant debate about the relative merits of privatization or nationalization. We have been arguing about the wrong thing while sitting on a goldmine of assets. Don’t worry about who owns those assets, worry about whether they are managed effectively. Why does this matter? Because despite the Thatcher/ Reagan economic revolution, the largest pool of wealth in the world – a global total that is much larger than the world’s total pensions savings, and ten times the total of all the sovereign wealth funds on the planet – is still comprised of commercial assets that are held in public ownership. If professionally managed, they could generate an annual yield of 2.7 trillion dollars, more than current global spending on infrastructure: transport, power, water, and communications. Based on both economic research and hands-on experience from many countries, the authors argue that publicly owned commercial assets need to be taken out of the direct and distorting control of politicians and placed under professional management in a ‘National Wealth Fund’ or its local government equivalent. Such a move would trigger much-needed structural reforms in national economies, thus resurrect strained government finances, bolster ailing economic growth, and improve the fabric of democratic institutions. This radical, reforming book was named one of the ""Books of the Year"".by both the FT and The Economist.",N/A,N/A,en
Group Dynamics,"['Dorwin Cartwright', 'Alvin Zander']",1968,['Business & Economics'],N/A,N/A,N/A,en
Imamate and Leadership,['Mujtabá Mūsavī Lārī'],2000,['Imamate'],N/A,N/A,N/A,en
The Art of War,['Sun Tzu'],2024-10,['Fiction'],"More than 2,000 years old, this classic of Chinese philosophy lays out a systematic, rational approach to tactics and strategy that leaders worldwide have applied not only to the military, but also to business, law, martial arts, and sports. This elegant edition uses Lionel Giles's classic translation and stands apart for its gorgeous design, and Giles's extensive annotations and commentary on Sun Tzu's aphorisms and proverbs are also included.",N/A,N/A,en
Price Management,"['Hermann Simon', 'Martin Fassnacht']",2018-12-11,['Business & Economics'],"In this book, the world’s foremost experts on pricing integrate theoretical rigor and practical application to present a comprehensive resource that covers all areas of the field. This volume brings together quantitative and qualitative approaches and highlights the most current innovations in theory and practice. Going beyond the traditional constraints of “price theory” and “price policy,” the authors coined the term “price management” to represent a holistic approach to pricing strategy and tactical implementation. They remind us that the Ancient Romans used one word, pretium, to mean both price and value. This is the fundamental philosophy that drives successful price management where producer and customer meet. Featuring dozens of examples and case studies drawn from their extensive research, consulting, and teaching around the world, Simon and Fassnacht cover all aspects of pricing following the price management process with its four phases: strategy, analysis, decision, and implementation. Thereby, the authors take into account the nuances across industry sectors, including consumer goods, industrial products, services, and trade/distribution. In particular, they address the implications of technological advancements, such as the Internet and new measurement and sensor technologies that have led to a wealth of price management innovations, such as flat rates, freemium, pay-per-use, or pay-what-you-want. They also address the emergence of new price metrics, Big Data applications, two-sided price systems, negative prices, and the sharing economy, as well as emerging payment systems such as bitcoin. The result is a “bible” for leaders who recognize that price is not only a means to drive profit in the short term, but a tool to generate sustained growth in shareholder value over the longer term, and a primer for researchers, instructors, and students alike. Praise for Price Management “This book is truly state of the art and the most comprehensive work in price management.” - Prof. Philip Kotler, Kellogg School of Management, Northwestern University “This very important book builds an outstanding bridge between science and practice.“ - Kasper Rorsted, CEO, Adidas “This book provides practical guidelines on value creation, communication and management, which is an imperative for businesses to survive in the coming era of uncertainty.” - Dr. Chang-Gyu Hwang, Chairman and CEO, KT Corporation (Korea Telecom)",N/A,N/A,en
"Group Dynamics, Research and Theory","['Dorwin Cartwright', 'Alvin Frederick Zander']",1953,['Leadership'],N/A,N/A,N/A,en
The Marking Enterprise,"['Jean-Claude Thoenig', 'Charles Waldman']",2006-10-12,['Business & Economics'],"Based on their studies of successful firms, the authors highlight two main paths to success. As well as delivering a groundbreaking new analytical framework, they also provide practical advice to practitioners on avoiding pitfalls and taking decisions while elaborating their marking discipline.",N/A,N/A,en
Under the Dome,['Stephen King'],2013-06-11,['Fiction'],"After an invisible force field seals off Chester's Mill, Maine, from the rest of the world, it is up to a select group of citizens to save the town, if they can get past a murderous politician and his son.",N/A,N/A,en
"Pharmacy Management, Leadership, Marketing, and Finance","['Marie A. Chisholm-Burns', 'Allison M. Vaillancourt', 'Marv Shepherd']",2014,['Business & Economics'],"The Second Edition of the award-winning Pharmacy Management, Leadership, Marketing, and Finance has been updated to make this quality textbook an even more integral resource for your Pharmacy Management course. All previous chapters have been updated and multiple new chapters have been added including ""Quality Improvement,"" ""The Basics of Managing Risk,"" ""Insurance Fundamentals,"" ""Integrating Pharmacoeconomic Principles and Pharmacy Management,"" and ""Developing and Evaluating Clinical Pharmacy Services."" Chapters continue to be written in a concise and reader-friendly style, facilitating a deeper level of understanding of essential leadership and management concepts. The updated content has been designed with the next generation of pharmacists in mind and to prepare them using an integration of knowledge, skills, attitudes, and values. This includes new in-text features, such as the Management Challenge found at the end of each chapter, and online self-assessment questions and answers. With an easy-to-read and colorful new layout, engaging pedagogical features, and online tools and resources for both students and instructors, this new edition has everything needed to provide a complete and enriched learning experience. Instructor Resources Lesson Plans PowerPoint Presetnations Sample Syllabus Answers to End of Chapter Questions Case Studies Test Bank Student Companion Website includes: Self-Assessment Questions Interactive Glossary Crossword Puzzles Flashcards Web Links to additional learning materials",N/A,N/A,en
The Bezos Blueprint,['Carmine Gallo'],2022-11-15,['Business & Economics'],"From Carmine Gallo, the bestselling author of Talk Like TED, The Bezos Blueprint reveals the communication and leadership secrets of Jeff Bezos and how to master them...",N/A,N/A,en
Improving Your Project Management Skills,['Larry Leon Richman'],2012,['Business & Economics'],"Based on the hugely popular American Management Association seminar of the same name, this ultrapractical reference offers powerful and repeatable project initiatives that improve processes, streamline productivity, and cut costs dramatically.",5,N/A,en
The Innovative Leader,['Paul Sloane'],2007,['Business & Economics'],Sloane stresses the importance of innovation and creativity in modern business to help organizations secure competitive advantage over rivals. He also demonstrates the importance of setting out a clear vision and the need for continual evaluation of the process.,N/A,N/A,en
The Swordless Samurai,['Kitami Masao'],2008-07-08,['Biography & Autobiography'],"In a time of endless chaos and bloodshed, when the only law was the law of the sword, a peasant boy named Hideyoshi dreamed of becoming a samurai. Despite his lack of strength and size, he learned to outthink and outmaneuver every foe to become not just a samurai, but one of the greatest military and civic leaders Japan has ever known. Hideyoshi's timeless leadership secrets offer effective strategies for succeeding in business, con?ict, and life, and are destined to take their place beside such classics as The Book of Five Rings and The Art of War.",N/A,N/A,en
