title,authors,publishedDate,categories,description,averageRating,textSnippet,language
The Chosen,['Chaim Potok'],1967,['Fiction'],"""Anyone who finds it is finding a jewel. Its themes are profound and universal."" THE WALL STREET JOURNAL It is the now-classic story of two fathers and two sons and the pressures on all of them to pursue the religion they share in the way that is best suited to each. And as the boys grow into young men, they discover in the other a lost spiritual brother, and a link to an unexplored world that neither had ever considered before. In effect, they exchange places, and find the peace that neither will ever retreat from again.... From the Paperback edition.",N/A,N/A,en
Island of the Blue Dolphins,"[""Scott O'Dell""]",1989-04,['Literature'],A young Indian girl learns the art of survival when she is stranded on an isolated Pacific island,N/A,N/A,en
The Secret Diary of Hendrik Groen,['Hendrik Groen'],2017,['Fiction'],"""Published in 2017 by arrangement with Grand Central, a division of Hachette Book Group, Inc.""--Title page verso.",N/A,N/A,en
Myths of Modern Individualism,['Ian Watt'],1996,['Literary Criticism'],"In this volume, Ian Watt examines the myths of Faust, Don Quixote, Don Juan and Robinson Crusoe, as the distinctive products of modern society. He traces the way the original versions of Faust, Don Quixote and Don Juan - all written within a forty-year period during the Counter Reformation - presented unflattering portrayals of the three figures, while the Romantic period two centuries later recreated them as admirable and even heroic. The twentieth century retained their prestige as mythical figures, but with a new note of criticism. Robinson Crusoe came much later than the other three, but his fate can be seen as representative of the new religious, economic and social attitudes which succeeded the Counter-Reformation. The four figures help to reveal problems of individualism in the modern period: solitude, narcissism, and the claims of the self versus the claims of society. They all pursue their own view of what they should be, raising strong questions about their heroes' character and the societies whose ideals they reflect.",5,N/A,en
The Harvard Classics,['Charles William Eliot'],1927,['Harvard classics'],N/A,N/A,N/A,en
The Orwell Reader,['George Orwell'],1956,['Fiction'],"[1.] Prologue in Burma: Shooting an elephant -- A hanging -- From Burmese days -- [2.] The thirties: From Down and out in Paris and London -- How the poor die -- From A clergyman's daughter -- From Keep the aspidistra flying -- From The road to Wigan Pier -- From Homage to Catalonia -- From Coming up for air -- [3.] World War II and after: From The lion and the unicorn : socialism and the English genius -- England your England -- Rudyard Kipling -- Politics vs. literature : an examination of ""Gulliver's travels""--Lear, Tolstoy and the Fool -- In defense of P.G. Wodehouse -- Reflections on Gandhi -- Second thoughts on James Burnham -- Politics and the English language -- The prevention of literature -- ""I write as I please"": Decline of the English murder ; Some thoughts on the common toad ; A good word for the vicar of Bray -- Why I write -- From Nineteen eighty-four -- ""Such, such were the joys ...""",N/A,N/A,en
The Style and Timbre of English Speech and Literature,['Marklen E. Konurbaev'],2016-02-09,['Foreign Language Study'],"The book introduces the reader into the world of mental perception of literary contents. Based on the research in modern semantics, functional stylistics and cognitive phonetics, it explores the way linguistic elements of a literary work cause readers to form a single perception shape identified as a cultural, literary or social stereotype.",N/A,N/A,en
Eliot to Derrida,['John Harwood'],2016-07-27,['Philosophy'],"'...a book which should be read by all students contemplating enrolment for a university course in modern English or European literary studies.' - Roy Harris, Times Higher Education Supplement Eliot to Derrida is a sardonic portrait of the cult of the specialist interpreter, from I.A. Richards and the Cambridge School to Jacques Derrida and his disciples. This lucid, iconoclastic study shows how, and why, so much of the academic response to a rich variety of literary experiment has been straitjacketed by the vast industries which have grown up around `modernism' and `postmodernism'. For anyone disenchanted with the extravagant claims - and leaden prose - of literary theorists, this will be an exhilarating book.",N/A,N/A,en
The Light that Failed,['Rudyard Kipling'],1915,['Blind'],N/A,N/A,N/A,en
The Shooting Party,['Anton Pavlovich Chekhov'],2004-06-24,['Fiction'],"When a young woman dies during a shooting party at the country estate of a dissolute count, a magistrate is called upon to investigate. The mystery deepens and suspicion falls more widely as it emerges that the dead woman was at the centre of a tangled web of relationships: with her elderly husband, with the lecherous count, and with the magistrate himself...",N/A,N/A,en
Making Stories,['Jerome Seymour Bruner'],2003,['Education'],"Stories pervade our daily lives, from human interest news items, to a business strategy, to daydreams between chores. Stories are what we use to make sense of the world. But how does this work? This text examines this pervasive human habit and suggests ways to think about how we use stories.",N/A,N/A,en
The House of Mirth,['Edith Wharton'],1989,['Fiction'],"Wharton's novel criticizes the emptiness and folly of life among the idle rich. Lily Bart sacrifices her principles, her chance for real love, and even her life in a vain attempt to find a life of ease for herself. This volume is part of the prestigious Hudson River Edition series and is bound in sturdy cloth with complete reinforcement.",N/A,N/A,en
Italian Science Fiction,"['Simone Brioni', 'Daniele Comberiati']",2019-07-18,['Literary Criticism'],"This book explores Italian science fiction from 1861, the year of Italy’s unification, to the present day, focusing on how this genre helped shape notions of Otherness and Normalness. In particular, Italian Science Fiction draws upon critical race studies, postcolonial theory, and feminist studies to explore how migration, colonialism, multiculturalism, and racism have been represented in genre film and literature. Topics include the role of science fiction in constructing a national identity; the representation and self-representation of “alien” immigrants in Italy; the creation of internal “Others,” such as southerners and Roma; the intersections of gender and race discrimination; and Italian science fiction’s transnational dialogue with foreign science fiction. This book reveals that though it is arguably a minor genre in Italy, science fiction offers an innovative interpretive angle for rethinking Italian history and imagining future change in Italian society.",N/A,N/A,en
"The Gentleman's Magazine, and Historical Chronicle, for the Year ...",[],1831,['English essays'],N/A,N/A,N/A,en
Notes to Myself,['Hugh Prather'],1982,['Poetry'],N/A,N/A,N/A,en
Fiction & Diction,['Gérard Genette'],1993,['Literary Criticism'],Litteraturens aspekter beskrevet ud fra forskellige indfaldsvinkler med udgangspunkt i bl. a. Roman Jakobson's definitioner,4,N/A,en
The Infinity of Lists,['Umberto Eco'],2009,['Aesthetics'],"Umberto Eco reflects on how the idea of catalogues has changed over the centuries and how, from one period to another, it has expressed the spirit of the times. His essay is accompanied by a literary anthology and a wide selection of works of art illustrating and analysing the texts presented.",N/A,N/A,en
The Myth of Sisyphus,['Albert Camus'],1975,['French literature'],"Throughout history, some books have changed the world. They have transformed the way we see ourselves - and each other. They have inspired debate, dissent, war and revolution. They have enlightened, outraged, provoked and comforted. They have enriched lives - and destroyed them. Now Penguin brings you the works of the great thinkers, pioneers, radicals and visionaries whose ideas shook civilization and helped make us who we are. mountain and watch it roll back to the valley below, The Myth of Sisyphus transformed twentieth-century philosophy with its impassioned argument for the value of life in a world without religious meaning.",N/A,N/A,en
Unseen City,['Ankhi Mukherjee'],2021-12-09,['Literary Criticism'],"Reconfiguring the lines between literature and psychoanalysis, this book argues that to alleviate poverty we engage with its psychic life.",N/A,N/A,en
The Life and Opinions of the Tomcat Murr,['E. T. A. Hoffmann'],1999-11,['Fiction'],"Tomcat Murr is a loveable, self-taught animal who has written his own autobiography. But a printer's error causes his story to be accidentally mixed and spliced with a book about the composer Johannes Kreisler. As the two versions break off and alternate at dramatic moments, two wildly different characters emerge from the confusion - Murr, the confident scholar, lover, carouser and brawler, and the moody, hypochondriac genius Kreisler. In his exuberant and bizarre novel, Hoffmann brilliantly evokes the fantastic, the ridiculous and the sublime within the humdrum bustle of daily life, making The Life and Opinions of the Tomcat Murr (1820-22) one of the funniest and strangest novels of the nineteenth century. For more than seventy years, Penguin has been the leading publisher of classic literature in the English-speaking world. With more than 1,700 titles, Penguin Classics represents a global bookshelf of the best works throughout history and across genres and disciplines. Readers trust the series to provide authoritative texts enhanced by introductions and notes by distinguished scholars and contemporary authors, as well as up-to-date translations by award-winning translators.",N/A,N/A,en
The New Feminist Criticism,['Elaine Showalter'],1985,['Literary Criticism'],"""The New Feminist Criticism"" brings together for the first time the most influential and controversial essays on the feminist approach to literature. These groundbreaking essays by well-known critics offer a much-needed overview of feminist critical theory, and illustrate its practice. In ""The New Feminist Criticism"" the authors take up a variety of topics. They challenge received notions of literary tradition and shows how women's writing has been systematically excluded, misread, and misinterpreted. They address the relationship of women's writing to ethnicity, separatism, and feminism itself. And they ask how it differs from that of men, with regard to recurrent images, symbols, themes, and plots. Complete with a bibliography of feminist literary theory, ""The New Feminist Criticism"" is an indispensable introduction to one of the most important intellectual movements of recent times. -- From publisher's description.",5,N/A,en
Graphing Jane Austen,"['J. Carroll', 'J. Gottschall', 'John A. Johnson', 'Daniel J. Kruger']",2015-12-29,['Literary Criticism'],"This book helps to bridge the gap between science and literary scholarship. Building on findings in the evolutionary human sciences, the authors construct a model of human nature in order to illuminate the evolved psychology that shapes the organization of characters in nineteenth-century British novels, from Jane Austen to E. M. Forster.",N/A,N/A,en
Essays in the History of Ideas,"['Arthur O. Lovejoy', 'Johns Hopkins History of Ideas Club']",1948,['History'],"Originally published in 1948. In the first essay of this collection, Lovejoy reflects on the nature, methods, and difficulties of the historiography of ideas. He maps out recurring phenomena in the history of ideas, which the essays illustrate. One phenomenon is the presence and influence of the same presuppositions or other operative ""ideas"" in very diverse provinces of thought and in different periods. Another is the role of semantic transitions and confusions, of shifts and of ambiguities in the meanings of terms, in the history of thought and taste. A third phenomenon is the internal tensions or waverings in the mind of almost every individual writer—sometimes discernible even in a single writing or on a single page—arising from conflicting ideas or incongruous propensities of feeling or taste to which the writer is susceptible. These essays do not contribute to metaphysical and epistemological questions; they are primarily historical.",N/A,N/A,en
Mimesis,[],1971,['Literature'],N/A,N/A,N/A,en
"Machine, Metaphor, and the Writer",['Bettina Liebowitz Knapp'],1989,['Language Arts & Disciplines'],"The brilliant and far-reaching comparative and interdisciplinary work explores the impact of the machine on the literary mind and its ramifications. Knapp displays an unusual command of world literatures in dealing with a topic that is of outstanding importance to a broad field of scholars and generalists, including those concerned with contemporary literature, comparative literature, and Jungian theory. It is very much in line with the current trend toward interdisciplinary studies. Knapp offers powerful and original analyses of texts by French, Irish, Japanese, Israeli, German, Polish, and American authors: Alfred Jarry, James Joyce, Stanislaw I. Witkiewicz, Luigi Pirandello, Antoine de Saint-Exupery, Juan Jose Arreola, S. Yizhar, Jiro Osaragi, N. K. Narayan, Peter Handke, and Sam Shepard. The authors explored here were deeply affected by the changes occurring in their lives and times and reacted to these ideationally and feelingly. In some of their writings, images, characters, and plots were used to create monstrous and robotlike individuals unable to accept the world around them and hence seeking to destroy it. Others of these writers attempted to understand and integrate the environmental, human, and mechanical alterations taking place about them, and to transform these into positive attributes. The realization of the increasing domination of the machine, we see, catalyzed and mobilized each author into action. Each in his own way spoke his mind, revealing the corrosive and beneficial factors in his world as he saw them.",N/A,N/A,en
"The Dyer's Hand, and Other Essays",['Wystan Hugh Auden'],1975,['Literature'],Auden speaks of the poet and his craft as well as literary figures and their works and observations on life in general.,N/A,N/A,en
The Harvard Classics,['Charles Darwin'],1961,['Evolution'],N/A,N/A,N/A,en
How to Read and why,['Harold Bloom'],2000,['Literary Criticism'],America's leading literary critic addresses the uses of deep reading. How to Read and Why is Harold Bloom's manifesto for the preponderance of written culture and will be an inspiration to students and teachers alike.,N/A,N/A,en
European Literature and the Latin Middle Ages,['Ernst Robert Curtius'],1953,"['Latin literature, Medieval and modern']",N/A,N/A,N/A,en
The Edinburgh Review,[],1810,['English literature'],N/A,N/A,N/A,en
A Defoe Companion,['J. Hammond'],1993-07-21,['Literary Criticism'],"Defoe occupies a central place in the history of English literature. As the author of Robinson Crusoe and Moll Flanders he can claim to be the creator of the first novels in English, and he was one of the earliest practitioners of the 'desert island' myth which has had such an influence on the human imagination. In A Journal of the Plague Year and A Tour through the Whole Island of Great Britain he forged a distinctive documentary style which deeply influenced later writers.",N/A,N/A,en
Pan,"['Knut Hamsun', 'W. W. Worster']",2008-01-01,['Fiction'],A short novel of a man who lives alone in the woods and becomes involved with two women.,N/A,N/A,en
Beyond Culture,['Lionel Trilling'],1965,['Literary Criticism'],N/A,N/A,N/A,en
Hollywood Husbands,['Jackie Collins'],1990-05,['Fiction'],"""Hollywood Wives, "" with its ten-million copy sales and its spectacular success as a television mini-series, left Jackie Collins' devoted audience avid for the other side of the story.",N/A,N/A,en
"Selected Essays, 1917-1932",['Thomas Stearns Eliot'],1932,['Fiction'],"Thirty-seven essays in which Eliot critically analyzes the works of famous literary figures such as Tennyson, Shakespeare, Dante and Dryden.",N/A,N/A,en
Africana Womanism,['Clenora Hudson-Weems'],2020,['Feminism'],"This is a new edition of the classic text in which Clenora Hudson-Weems sets out a paradigm for women of African descent. it includes five new chapters as well as an evolution of the classic Africana Womanist paradigm, to that of Africana-Melanated Womanism.",N/A,N/A,en
Red Sorghum,['Mo Yan'],1994-04,['Fiction'],A story of Northeast Gaomi Township narrated omnisciently by a young man at the end of the cultural revolution.,N/A,N/A,en
Scott Foresman Reading,['Patricia Lauber'],1993-03-31,['Juvenile Nonfiction'],"Describes the eruption, aftermath, and gradual return of life to the Mount St. Helens slopes devastated by the 1980 eruption.",N/A,N/A,en
Congo,['Michael Crichton'],1980,['Fiction'],"The legendary ruins of the Lost City of Zinj have seen an eight-person field exhibition die. After startling discoveries, a new expedition is sent back into the Congo--its mission, to descend into the secret world where the only way back out may be through the grisliest death....",4,N/A,en
Poetry Handbook,['Babette Deutsch'],1965,['English language'],N/A,N/A,N/A,en
The Divine Comedy of Dante Alighieri,['Dante Alighieri'],1909,[],N/A,N/A,N/A,en
"Candide, Or, Optimism","['Voltaire', 'Burton Raffel']",2005,['Fiction'],The translation of choice for twenty-first-century readers of Voltaire's satiric masterpiece.,N/A,N/A,en
A Room of One's Own,['Virginia Woolf'],2018-07-12,['Literary Criticism'],"A Room of One's Own is an extended essay by Virginia Woolf. First published on 24 October 1929, the essay was based on a series of lectures she delivered at Newnham College and Girton College, two women's colleges at Cambridge University in October 1928. While this extended essay in fact employs a fictional narrator and narrative to explore women both as writers of and characters in fiction, the manuscript for the delivery of the series of lectures, titled ""Women and Fiction,"" and hence the essay, are considered non-fiction. The essay is generally seen as a feminist text, and is noted in its argument for both a literal and figural space for women writers within a literary tradition dominated by patriarchy.",N/A,N/A,en
Among Famous Books,['John Kelman'],1912,['Books and reading'],N/A,N/A,N/A,en
The Charterhouse of Parma,['Stendhal'],1958,['Fiction'],"The story of Fabrizio del Dongo, an aristocrat who joins Napoleon's army just before the Battle of Waterloo, his beautiful aunt, the Duchess of Sanseverina, and her lover, Count Mosca.",N/A,N/A,en
On Flirtation,['Adam Phillips'],1994,['Literary Criticism'],"This is a book about the possibilities of flirtation, its risks and instructive amusements - about the spaces flirtation opens in the stories we tell ourselves, particularly within the framework of psychoanalysis.",4,N/A,en
W. C. Fields from Burlesque and Vaudeville to Broadway,['A. Wertheim'],2016-11-09,['Performing Arts'],"W. C. Fields was a virtuoso comedian, often called a comic genius, legendary iconoclast, and ""Great Man,"" who brought so much laughter to millions while enduring so much anguish. This book explores his little-known, long stage career from 1898 to 1930, which had a major influence on his comedy and screen presence.",N/A,N/A,en
Literary Theory,['Johannes Willem Bertens'],2001,['Literary Criticism'],"Providing the ideal first step in understanding the often bewildering world of literary theory, Literary Theory: The Basics is an easy to follow and clearly presented introduction to this fascinating area. Showing that theory can not only make sense, but also radically change the way in which we read, Literary Theory: The Basics: * leads readers through the major approached to literature that are signalled by the term â¬~literary theory' * places each critical movement in its historical (and often political) context * illustrates theory in practice with examples from well-known texts * suggests further reading for those especially interested in a particular critical approach. Covering all the basics and much more, this is the perfect book for anyone interested in how we read and why that matters.",3,N/A,en
Literature,"['X. J. Kennedy', 'Dana Gioia']",2010,['Anthologies'],"The compact version of the most popular Literature anthology continues to engage readers with its literary selections and human approach to lterature. Presents a rich array of diverse and exciting selections including 52 short stores, 376 poems, and 11 plays; a chapter on Latin American poetry; and nine extensive casebooks composed of five author casebooks as well as four masterpiece casebooks on specific selections. New to this edition are: Conversations with Amy Tan, Kay Ryan (the 2008 poet laureate), and David Ives, conducted by Dana Gioia, offer readers an insider’s look into the importance of reading to three contemporary writers. A Latin American Writers casebook is new to Fiction and collects some of the finest authors from the region including Octavia Paz, Gabriel Garcia Marquez, and Ines Arendondo. Many new writers have been added including Naguib Mahfouz, Virginia Woolf, Sherman Alexie, Mary Oliver, Bettie Sellers, and Anne Deavere Smith. For anyone who enjoys reading a diverse selection of fiction, poetry, and drama.",N/A,N/A,en
The Dialogic Imagination : Four Essays,['Mikhail Mikhailovich Bakhtin'],1996,[],N/A,N/A,N/A,en
Anne of Green Gables,['Lucy Maud Montgomery'],1989,['Country life'],"The Cuthberts want to adopt an orphan boy who can help out on the farm. Instead they get Anne, a proud, talkative eleven-year-old girl. Anne stays on the farm and eventually wins their hearts.",N/A,N/A,en
Mammonart,['Upton Sinclair'],1925,['Literary Collections'],"""A school of ingenious Bible-twisters arose, . . . in order that people who no longer believed could continue with good conscience to collect the salaries of belief."" ―Upton Sinclair, Mammonart Mammonart: An Essay in Economic Interpretation (1925) by Upton Sinclair consists mainly of critiques of many great artists from Homer to Mark Twain and from Michelangelo to Jack London. It is one in a series of six books the author wrote analyzing American institutions from a socialist perspective. Other books in this muckraking Dead-Hand collection, include: The Profits of Religion (religion, 1917), The Brass Check (journalism, 1919), The Goose-Step (higher education, 1923), The Goslings (education, 1924), and Money Writes! (literature, 1927), all available from Cosimo Classics.",N/A,N/A,en
The Dark Matter of Words,['Timothy Walsh'],1998,['Language Arts & Disciplines'],"Timothy Walsh's study of the function and significance of absence in literature demonstrates its centrality in terms of both literary technique and philosophical consequence. Textual gaps, narrative lacunae, and strategic vagueness, together with the uncertainties that such devices inevitably generate, have been essential elements of literature from Lao-Tzu to Lawrence, from Chaucer to Faulkner and beyond. Walsh finds that poststructural approaches to indeterminacy tend to overlook the specific and productive roles that absence and uncertainty often play within the overall design of a work. The aesthetic generation of uncertainty, he demonstrates, is not a roadblock on the path to meaning or a sign of some radical and suppressed internal contradiction; rather, it is as basic an artistic aim as the desire to evoke sympathy, laughter, or outrage. Coining the phrase ""structured absence"" to explain a central tenet in his discussion of the ""mechanics"" of uncertainty, Walsh analyzes various literary devices and tropes involved in generating a felt sense of absence and a purposeful uncertainty. Structured absences, he demonstrates, combine to form intricate patterns and networks, which explains how the dynamic potential of uncertainty can increase exponentially through a deft orchestration of absence. Walsh argues that the use of absence in works of art--of silence, shadow, blankness, and void--is a principal means by which the inherent biological limitations of human consciousness and of human language are encoded in aesthetic constructs. Because of the limitations of our senses and because we often are more attuned to what lies beyond the threshold of perceptual limits, the lacunae in artistic works represent attempts to replicate the real and inescapable limits of human experience.",N/A,N/A,en
"Anecdotes, observations, and characters of books and men. Collected from the conversation of Mr. Pope, and other eminent persons of his time ... Now first published from the original papers, with notes and a life of the author, by S. W. Singer. (Appendix. Letters to Mr. Spence.)",['Joseph SPENCE'],1858,"['Authors, English']",N/A,N/A,N/A,en
Novel Guide for the Hound of the Baskervilles by Arthur Conan Doyle,"['Scott, Foresman and Company', 'Arthur Conan Doyle']",1989,['Literature'],N/A,N/A,N/A,en
