title,authors,publishedDate,categories,description,averageRating,textSnippet,language
Humanism,['Tony Davies'],1997,['Literary Criticism'],"Definitions of humanism as educational movement, philosophical concept or existential ‘life stance’ have evolved over the centuries as the term has been adopted for a variety of cultural and political purposes and contexts, and reactions against humanism have contributed to movements such as structuralism, postmodernism and postcolonialism. Tony Davies offers a clear introduction to the many uses of this influential yet complex concept, and this second edition extends his discussion to include: a wide-ranging history of the development of the term and its influences the implications of debates around humanism and post-humanism for political, religious and environmental activism discussion of the key figures in humanist debate from Erasmus and Milton to Heidegger, Foucault and Chomsky",N/A,N/A,en
The Poetics of Mind,['Raymond W. Gibbs'],1994-08-26,['Language Arts & Disciplines'],"In this bold new work, Ray Gibbs demonstrates that human cognition is deeply poetic and that figurative imagination constitutes the way we understand ourselves and the world in which we live.",4,N/A,en
A Burnt-out Case,['Graham Greene'],1961,"['Africa, Central']","Querry is assigned to a leper colony on the upper reaches of the Congo, run by a doctor as lacking in faith as he is himself.",N/A,N/A,en
Macbeth,"['Eric Rasmussen', 'Jonathan Bate']",2009-04-23,['Literary Criticism'],"From the Royal Shakespeare Company – a modern, definitive edition of Shakespeare’s great drama of ambition, desire and guilt. With an expert introduction by Sir Jonathan Bate, this unique edition presents a historical overview of Macbeth in performance, takes a detailed look at specific productions, and recommends film versions. Included in this edition are three interviews with leading directors – Rupert Goold, Gregory Doran and Trevor Nunn – providing an illuminating insight into the extraordinary variety of interpretations that are possible. This edition also includes an essay on Shakespeare’s career and Elizabethan theatre, and enables the reader to understand the play as it was originally intended – as living theatre to be enjoyed and performed. Ideal for students, theatre-goers, actors and general readers, the RSC Shakespeare editions offer a fresh, accessible and contemporary approach to reading and rediscovering Shakespeare’s works for the twenty-first century.",N/A,N/A,en
Tales from Shakespeare,"['Charles Lamb', 'Mary Lamb']",1986,['Fiction'],"Celebrated prose retellings of Shakespeare's plays Charles and Mary Lamb have delighted generations of adults as well as children with their famed prose renderings of Shakespeare's originals. Bringing the plays to life in a form that encourages readers to enjoy and explore, ""Tales from Shakespeare"" provides an entertaining and informative introduction to the great works while retaining much of Shakespeare's lyricism, phrasing, and rhythm. It is a captivating work of Romantic storytelling as well as the original literary homage to the Bard.",N/A,N/A,en
Combat Trauma and the Ancient Greeks,"['P. Meineck', 'D. Konstan']",2015-12-18,['Literary Criticism'],"This ground-breaking book applies trauma studies to the drama and literature of the ancient Greeks. Diverse essays explore how the Greeks responded to war and if what we now term ""combat trauma,"" ""post-traumatic stress,"" or ""combat stress injury"" can be discerned in ancient Greek culture.",N/A,N/A,en
The Derrida Reader,['Jacques Derrida'],1998,['Foreign Language Study'],"In the English-speaking world, Jacques Derrida's writings have most influenced the discipline of literary studies. Yet what has emerged since the initial phase of Derrida's influence on the study of English literature, classed under the rubric of deconstruction, has often been disowned by Derrida. What, then, can Derrida teach us about literary language, about the rhetoric of literature, and about questions concerning style, form, and structure? The Derrida Reader draws together a number of Derrida's most interesting and idiosyncratic essays that treat literary language, the idea of the literary, and questions of poetics and poetry. The essays discuss single tropes or concepts, a figure such as metaphor, the ideas of titles and signatures, proper names, and Derrida's thinking on such subjects as undecidability or aporia. The editor's introduction is a demonstration in practice of how Derrida reads and how he adapts the act of reading to the text or figure in question. The introduction also outlines each essay's main points, its usefulness for reading literary texts, and its particular area of interest. The Derrida Reader thus provides students of literature with a focused, contextualized, and readily understandable volume.",N/A,N/A,en
Six Memos for the Next Millennium,['Italo Calvino'],1992-01,['Literature'],"Six Memos for the Millennium is a collection of five lectures Italo Calvino was about to deliver at the time of his death. Here is his legacy to us: the universal values he pinpoints become the watchwords for our appreciation of Calvino himself. What should be cherished in literature? Calvino devotes one lecture, or memo to the reader, to each of five indispensable qualities: ""lightness,"" ""quickness,"" ""exactitude,"" ""visibility,"" and ""multiplicity."" A sixth lecture, on ""consistency,"" was never committed to paper, and we are left only to ponder the possibilities. With this book, he gives us the most eloquent defense of literature written in the twentieth century--a fitting gift for the next millennium.",N/A,N/A,en
Dictionary of Phrase & Fable,['Ebenezer Cobham Brewer'],1882,['Allusions'],N/A,N/A,N/A,en
Books that Changed the World,['Robert Bingham Downs'],1956,['Books and reading'],N/A,N/A,N/A,en
Ephemera Critica,['John Churton Collins'],1901,['Criticism'],N/A,N/A,N/A,en
"Anecdotes, Observations, and Characters, of Books and Men",['Joseph Spence'],1858,"['Authors, English']",N/A,N/A,N/A,en
The Bookman,[],1903,['Literature'],N/A,N/A,N/A,en
Night Prey,['John Sandford'],1995,['Fiction'],Lucas Davenport confronts an elusive cat burglar obsessed with a woman whose initials are being carved into the bodies of a growing list of butchered women. Reprint.,N/A,N/A,en
"Anecdotes, Observations, and Characters, of Books and Men","['Joseph Spence', 'Samuel Weller Singer']",1820,"['Authors, English']",N/A,N/A,N/A,en
The Friday Book,['John Barth'],1997,['Architecture'],"""...The Friday Book was the first work of nonfiction by novelist John Barth, author of The Sot-Weed Factor, Giles Goat-Boy, and Chimera. Taking its title from the day of the week Barth would devote to nonfiction, the three dozen essays discuss a wide range of topics from the blue crabs of Barth's beloved Chesapeake Bay to weighty literary subjects such as Borges, Homer, and semiotics...""--www.amazon.com.",N/A,N/A,en
The Remains of the Day,['Kazuo Ishiguro'],1999,['Butlers'],"An elderly butler on holiday in the West Country in the 1950's reflects on his life and work at Darlington Hall, his former employer and his friendships. By the author of the Whitbread book of the year for 1986 An artist of the floating world.",4,N/A,en
The Illustrated Timeline of Western Literature,['Carol Strickland'],2009-07-10,['Literature'],"Professors, students, and anyone who loves to read will want this fascinating and attractive volume. Beginning with great works from Antiquity to the Middle Ages, this literary timeline gallops from Mesopotamian pictograms and Julius Caesar's Commentaries on the Gallic to Renaissance and Baroque masterworks by Machiavelli and Moli+re, and on to modernism. Along the way, it presents the birth of the novel, Gothic chills, Thomas Paine's rabble-rousing, as well as landmark French and Russian authors, Emerson's essays, and the first detective story by Poe. Victoriana, the Aesthetic Movement, Utopian Literature, and Naturalism make their appearance, all the way up to today's Tom Stoppard and Tony Kushner. There's a detailed introduction, plus color-coding to show whether a work is poetry, fiction, non-fiction, or drama.",N/A,N/A,en
Jane Austen,['Tony Tanner'],2007-09-15,['Literary Criticism'],"Tony Tanner's classic text on Jane Austen addresses the issues that have always occupied the author's most perceptive critics and offers a stimulating analysis of Austen's novels which is now regarded as one of the finest introductions to the author. This revised edition features a new Preface by leading Romantic scholar Marilyn Gaull who examines Tanner's background and places the original work in context, explaining why a reissue of this highly influential text is timely.",N/A,N/A,en
An Introduction to the Greek Theatre,['Peter Arnott'],1991-06-18,['Literary Criticism'],N/A,N/A,N/A,en
Reason and Romanticism,['Herbert Read'],1963,['Criticism'],N/A,N/A,N/A,en
Understanding Children's Literature,['Peter Hunt'],1998,['Literary Criticism'],"This book offers a systematic introduction to some of the essential concepts necessary for the study of childrens literature. Incorporating thirteen essays from the highly-acclaimed International Companion Encyclopedia of Children's Literature , the chapters guide the reader through the most relevant areas of criticism and theory and summarise their contexts and application. Bibliographies provide details of useful further information sources and a glossary explains the literary terms encountered in the book. This work is a useful and accessible guide for readers involved both in literature and education.",N/A,N/A,en
The New York Times Parent's Guide to the Best Books for Children,['Eden Ross Lipson'],1988,['Education'],"A selective guide to nearly 1,000 best books for children of all ages. Includes indexes.",N/A,N/A,en
The Wind in the Willows,['Kenneth Grahame'],1975,"[""Children's plays""]","The tales of Ratty, Mole, Badger and Toad. When Mole goes boating with the Water Rat instead of spring-cleaning, he discovers a new world. As well as the river and the Wild Wood, there is Toad''s craze for fast travel which leads him and his friends on a whirl of trains, barges, gipsy caravans and motor cars and even into battle.",N/A,N/A,en
Studies in Translation,['Ed. Mohit K. Ray'],2008,['Literature'],N/A,4,N/A,en
Three Guineas,['Virginia Woolf'],1938,['History'],"""Witty, scornful, deeply serious...If you are a woman, or anti-war, or both, read it.""--The New Yorker ""How are we to prevent war?"" Setting out to answer this question, Virginia Woolf argues that the inequalities between women and men must first be addressed. Framing her arguments in the form of a letter, Woolf ponders to whom--among the many who have requested it--she will donate a guinea. As she works out her reasons for which causes she will support, Woolf articulates a vision of peace and political culture as radical now as it was when first published on the eve of the Second World War. A founding text of cultural theory, Three Guineas can also help us understand the twenty-first-century realities of endless war justified by ""unreal loyalties.""",N/A,N/A,en
Silas Marner,['George Eliot'],1909,['Adopted children'],The story of a lonely and embittered old man and the orphaned child who helps him find love and hope.,N/A,N/A,en
Season of Migration to the North,['al-Ṭayyib Ṣāliḥ'],1997,['Fiction'],"""A beautifully constructed novel by an author whose reputation in Arabic is deservedly vast.""--London Tribune ""An Arabian Nights in reverse, enclosing a pithy moral about international misconceptions and delusions.""--The Observer Salih's shocking and beautiful novel reveals much about the people on each side of a cultural divide. A brilliant Sudanese student takes his mix of anger and obsession with the West to London, where he has affairs with women who are similarly obsessed with the mysterious East. Life, ecstasy, and death share the same moment in time. First published in Arabic in 1969.",N/A,N/A,en
Wuthering Heights,['Emily Brontë'],1993-09-28,['Fiction'],"Every critical theory in the last twenty years has, it seems, cut its teeth on Wuthering Heights, and the New Casebook on Wuthering Heights includes essays of major importance from positions including liberal humanism, psychoanalysis, deconstruction, Marxism and feminism. The editor suggests that this remarkable variety of persuasive readings is itself a critical statement, establishing the link between what one critic calls 'our spellbinding admiration for Wuthering Heights and our remarkable inability to agree on what it means'.",N/A,N/A,en
The RSC Shakespeare: The Complete Works,"['Jonathan Bate', 'Eric Rasmussen']",2007-04-19,['Literary Criticism'],"Developed in partnership with The Royal Shakespeare Company, this edition of the Complete Works of William Shakespeare combines exemplary textual scholarship with elegant writing and design. Sir Jonathan Bate and Professor Eric Rasmussen, two of today’s most accomplished Shakespearean scholars, lead the expert editorial team. Bate’s excellent general introduction and essays on each play draw on a unique wealth of experience and resources and will help the reader to understand Shakespeare's plays as they were originally intended – as living theatre to be enjoyed and performed. The text is based on the iconic 1623 First Folio: the first and original Complete Works lovingly assembled by Shakespeare’s fellow actors and the version of Shakespeare’s text preferred by many actors and directors today. The result is a fresh and definitive Complete Works for the twenty-first century that will inspire students, teachers and lovers of Shakespeare everywhere.",N/A,N/A,en
The Four Loves,['Clive Staples Lewis'],2001,['Literature'],"C.S. Lewis distinguishes here Affection, Friendship, Eros and Charity. He observes how each merges into another, without losing sight of the necessary and real difference between them.",N/A,N/A,en
The Harvard Classics,['Charles William Eliot'],1963,['Greece'],N/A,N/A,N/A,en
Saint Joan,['Bernard Shaw'],1956,['Adult education'],N/A,N/A,N/A,en
Perrine's Sound and Sense 12e-Im,"['Arp', 'Steve Johnson']",2007-05,[],"The Instructor's Manual contains comments on each and every poem in Sound and Sense by either Larry Perrine, Greg Johnson, or Tom Arp, or some instances, all three authors. This useful resource also includes answers to the ""Exercises in Sound,"" featured throughout the book, as well as additional information that help answers one or more of the ""Questions"" for an individual poem. Finally, the Instructor Manual also includes references to additional poems in the ""Poems For Further Reading"" section of the book that treat the topic of the chapter.",N/A,N/A,en
Literacy and the Survival of Humanism,['Richard A. Lanham'],1983,[],N/A,N/A,N/A,en
The Heart of Oak Books,"['Charles Eliot Norton', 'Kate Stephens']",1893,['Literature'],N/A,N/A,N/A,en
The Romantic Manifesto,['Ayn Rand'],1975,['Aesthetics'],N/A,N/A,N/A,en
Dubliners,['James Joyce'],1993,[],"Six short stories about everyday life in Ireland in the early nineteen hundreds - about families, growing up, love and death in the city of Dublin.",N/A,N/A,en
The Spirit of Man in Art and Literature,['C. G. Jung'],2023-07-10,['Psychology'],"Some of Jung's best insights into artistic and literary creation. Essays on Freud, Wilhelm, Picasso, Joyce, and on poetry and literature.",N/A,N/A,en
Theory of Literature,"['René Wellek', 'Austin Warren']",1993,['Criticism'],"A classic of criticism that examines the nature, function, form, and contents of literature. ""The most ordered, ranging and purposeful attempt...toward keeping the study of literature at once intelligent and liberal"" (New York Times). Index.",N/A,N/A,en
Essays on Books,['William Lyon Phelps'],1914,['Literature'],N/A,N/A,N/A,en
Ideological Manipulation of Children’s Literature Through Translation and Rewriting,['Vanessa Leonardi'],2020-07-06,['Language Arts & Disciplines'],"This book explores the topic of ideological manipulation in the translation of children’s literature by addressing several crucial questions, including how target language norms and conventions affect the quality of a translation, how translations are selected on the basis of what is culturally accepted, who is involved in the selection of what should be translated for children in the target culture, and how this process takes place. The author presents different ways of looking at the translation of children’s books, focusing particularly on the practices of intralingual and interlingual translations as a form of rewriting across a selection of European languages. This book will be of interest to Translation Studies and children's literature scholars, as well as those with a wider interest in the impact of ideology on culture.",N/A,N/A,en
Imagining Columbus,['Ilan Stavans'],1993,['Literary Criticism'],"""With the Columbian quincentennial have come a spate of books devoted to one or another aspect of the Italian mariner and his famous 1492 voyage. None, however, has taken the bold, creative approach of this new volume: to explore Columbus's ""fifth voyage,"" the one depicted in hundreds of literary musings by writers worldwide over the past half-millennium."" ""Imagining Columbus: The Literary Voyage is Ilan Stavans's stunning contribution to the literature on Columbus. ""My purpose,"" says Stavans, ""is to revisit, to investigate, to play with the asymmetrical geometries of the admiral's literary adventures in the human imagination."" Arguing that writers have portrayed Columbus in three ways - as prophet or messiah, as ambitious goldseeker, and as conventional, unremarkable man - Stavans examines a veritable treasure trove of poems, novels, short stories, dramas, and other works on Columbus."" ""Organizing his material into two main parts, Stavans first takes up ""Mapmaking,"" inspecting the two opposing views of the celebration of the quincentennial; discussing the most notable biographies of Columbus, including those by Washington Irving and Samuel Eliot Morison; and providing the necessary biographical data on Columbus's life and achievements. Then, in ""The Literary Character,"" Stavans takes up the geographic and historical development of Columbus as a narrative figure in literature, devoting a chapter to each of the three literary views of the admiral - portrayals by writers as diverse as Walt Whitman, Alejo Carpentier, James Fenimore Cooper, Friedrich Nietzsche, Nikos Kazantzakis, Ruben Dario, Michael Dorris and Louise Erdrich, Philip Freneau, Stephen Marlowe, and scores of others."" ""In a brilliantly imaginative conclusion, Stavans attempts to foresee what the future might bring. ""My goal,"" he says, ""is to describe some of the unwritten books on the mariner, the apocryphal titles that are likely to be published in the next 100 years."""" ""A hallmark testament to the potential of the human imagination, Imagining Columbus will be hailed by scholars, students, and general audiences.""--BOOK JACKET.Title Summary field provided by Blackwell North America, Inc. All Rights Reserved",N/A,N/A,en
Children and Books in the Modern World,['Ed Marum'],1996,['Education'],"This text is concerned with contemporary attitudes and approaches to the teaching of literacy, children's literature and other non-book texts and media. Based on research from the UK, the USA and Europe it makes a contribution to theory and practice.",N/A,N/A,en
Principles of Literary Criticism,['Lascelles Abercrombie'],1932,['Criticism'],N/A,N/A,N/A,en
One Hundred Years of Solitude,['Gabriel García Márquez'],1971,['Fiction'],"The rise and fall, birth and death, of the mythical town of Macondo through the history of the Buendia family.",N/A,N/A,en
The English Understand Wool,['Helen DeWitt'],2022,['Fiction'],"A modern amorality play about a 17-year-old girl, the wilder shores of connoisseurship, and the power of false friends",N/A,N/A,en
What is Literature?,['Jean-Paul Sartre'],1978,[],N/A,N/A,N/A,en
"Audiobooks, Literature, and Sound Studies",['Matthew Rubery'],2011,['Audiobooks'],"This is the first scholarly work to examine the cultural significance of the ""talking book"" since the invention of the phonograph in 1877, the earliest machine to enable the reproduction of the human voice. Recent advances in sound technology make this an opportune moment to reflect on the evolution of our reading practices since this remarkable invention. Some questions addressed by the collection include: How does auditory literature adapt printed texts? What skills in close listening are necessary for its reception? What are the social consequences of new listening technologies? In sum, the essays gathered together by this collection explore the extent to which the audiobook enables us not just to hear literature but to hear it in new ways. Bringing together a set of reflections on the enrichments and impoverishments of the reading experience brought about by developments in sound technology, this collection spans the earliest adaptations of printed texts into sound by Charles Dickens, Thomas Hardy, and other novelists from the late nineteenth century to recordings by contemporary figures such as Toni Morrison and Barack Obama at the turn of the twenty-first century. As the voices gathered here suggest, it is time to give a hearing to one of the most talked about new media of the past century.",N/A,N/A,en
Modern Criticism and Theory,['David Lodge'],1988,['Language Arts & Disciplines'],"'A Reader' aims to provide, within the covers of a single book, a selection of important and representative work from all the major theoretical schools or tendencies in contemporary criticism, and to place them before the reader in two alternative orders: one historical, the other thematic.",N/A,N/A,en
Shakespeare and the Question of Theory,"['Geoffrey H. Hartman', 'Patricia Parker']",2015-05-19,['Literary Criticism'],"The theoretical ferment which has affected literary studies over the last decade has called into question traditional ways of thinking about, classifying and interpreting texts. Shakespeare has been not just the focus of a variety of divergent critical movements within recent years, but also increasingly the locus of emerging debates within, and with, theory itself. This collection of essays, written by distinguished and powerful critics in the fields of literary theory and Shakespeare studies, is intended both for those interested in Shakespeare and for those interested more generally in the emerging debates within contemporary criticism and theory.",N/A,N/A,en
Mammonart,['Upton Sinclair'],2003-04-01,['Art'],"Sinclair wrote: ""All art is propaganda.."". ""Who owns the artists?"" Thus begins Sinclair's history of art, concluding that ""the bulk of the successful artists of any time are men in harmony with the spirit of the time, and identified with the powers prevailing.""",N/A,N/A,en
Literary Theory,"['Jonathan Culler', 'Jonathan D. Culler', 'Professor of English Jonathan Culler']",1997,['Criticism'],"What is Literary Theory? Is there a relationship between literature and culture? In fact, what is Literature, and does it matter? These are the sorts of questions addressed by Jonathan Culler in a book which steers a clear path through a subject often perceived to be complex and impenetrable. It offers discerning insights into theories about the nature of language and meaning, whether literature is a form of self-expression ora method of appeal to an audience, and outlines the ideas behind a number of different schools: deconstruction, semiotics, postcolonial theory, and structuralism amongst them.",N/A,N/A,en
What is Literature?,['Jean-Paul Sartre'],1978,['Literature'],N/A,N/A,N/A,en
The Book of Lost Books,['Stuart Kelly'],2005,['Authors'],"Beginning with the earliest hominids, 'The Book of Lost Books' traces various pieces of literature which, for a variety of reasons, cannot be read. Each entry describes the reasons for the loss - it may have been destroyed, or left incomplete at the time of the author's death.",N/A,N/A,en
Books Across Borders,['Miriam Intrator'],2019-06-19,['Literary Criticism'],"Books Across Borders: UNESCO and the Politics of Postwar Cultural Reconstruction, 1945-1951 is a history of the emotional, ideological, informational, and technical power and meaning of books and libraries in the aftermath of World War II, examined through the cultural reconstruction activities undertaken by the Libraries Section of the United Nations Educational, Scientific and Cultural Organization (UNESCO). The book focuses on the key actors and on-the-ground work of the Libraries Section in four central areas: empowering libraries around the world to acquire the books they wanted and needed; facilitating expanded global production of quality translations and affordable books; participating in debates over the contested fate of confiscated books and displaced libraries; and formulating notions of cultural rights as human rights. Through examples from France, Poland, and surviving Jewish Europe, this book provides new insight into the complexities and specificities of UNESCO’s role in the realm of books, libraries, and networks of information exchange during the early postwar, post-Holocaust, Cold War years.",N/A,N/A,en
The Tangled Bank,['Stanley Edgar Hyman'],1962,['Fiction'],N/A,N/A,N/A,en
