title,authors,publishedDate,categories,description,averageRating,textSnippet
The Principia,"['Isaac Newton', 'I. Bernard Cohen', 'Anne Whitman']",1999-10-20,['Science'],Presents Newton's unifying idea of gravitation and explains how he converted physics from a science of explanation into a general mathematical system.,N/A,N/A
Philosophiæ naturalis principia mathematica,['Isaac Newton'],1822,['Celestial mechanics'],N/A,N/A,N/A
The Mathematical Principles of Natural Philosophy,['Isaac Newton'],1968,['Celestial mechanics'],N/A,N/A,N/A
Classical Mechanics,['Joseph L. McCauley'],1997-05-08,['Science'],This advanced text is the first book to describe the subject of classical mechanics in the context of the language and methods of modern nonlinear dynamics. The organizing principle of the text is integrability vs. nonintegrability.,N/A,N/A
Philosophia naturalis principia mathematica,['Isaac Newton'],1687,['Celestial mechanics'],N/A,N/A,N/A
New Foundations for Classical Mechanics,['David Hestenes'],1986-06-30,['Mathematics'],"This is a textbook on classical mechanics at the intermediate level, but its main purpose is to serve as an introduction to a new mathematical language for physics called geometric algebra. Mechanics is most commonly formulated today in terms of the vector algebra developed by the American physicist J. Willard Gibbs, but for some applications of mechanics the algebra of complex numbers is more efficient than vector algebra, while in other applica tions matrix algebra works better. Geometric algebra integrates all these algebraic systems into a coherent mathematical language which not only retains the advantages of each special algebra but possesses powerful new capabilities. This book covers the fairly standard material for a course on the mechanics of particles and rigid bodies. However, it will be seen that geometric algebra brings new insights into the treatment of nearly every topic and produces simplifications that move the subject quickly to advanced levels. That has made it possible in this book to carry the treatment of two major topics in mechanics well beyond the level of other textbooks. A few words are in order about the unique treatment of these two topics, namely, rotational dynamics and celestial mechanics.",N/A,N/A
The Principia: The Authoritative Translation and Guide,"['Isaac Newton', 'Julia Budenz']",2016-02-05,['Science'],"In his monumental 1687 work,ÊPhilosophiae Naturalis Principia Mathematica, known familiarly as theÊPrincipia, Isaac Newton laid out in mathematical terms the principles of time, force, and motion that have guided the development of modern physical science. Even after more than three centuries and the revolutions of Einsteinian relativity and quantum mechanics, Newtonian physics continues to account for many of the phenomena of the observed world, and Newtonian celestial dynamics is used to determine the orbits of our space vehicles. This authoritative, modern translation by I. Bernard Cohen and Anne Whitman, the first in more than 285 years, is based on the 1726 edition, the final revised version approved by Newton; it includes extracts from the earlier editions, corrects errors found in earlier versions, and replaces archaic English with contemporary prose and up-to-date mathematical forms. Newton's principles describe acceleration, deceleration, and inertial movement; fluid dynamics; and the motions of the earth, moon, planets, and comets. A great work in itself, theÊPrincipiaÊalso revolutionized the methods of scientific investigation. It set forth the fundamental three laws of motion and the law of universal gravity, the physical principles that account for the Copernican system of the world as emended by Kepler, thus effectively ending controversy concerning the Copernican planetary system. The illuminating Guide to Newton's PrincipiaÊby I. Bernard Cohen makes this preeminent work truly accessible for today's scientists, scholars, and students. Designed with collectors in mind, this deluxe edition has faux leather binding covered with a beautiful dustjacket. Ê",N/A,N/A
An Account of Sir Isaac Newton's Philosophical Discoveries,"['Colin MacLaurin', 'Patrick Murdoch']",1750,['Mechanics'],N/A,N/A,N/A
The Science of Mechanics,['Ernst Mach'],1893,['Mechanics'],N/A,N/A,N/A
"On the Loadstone and Magnetic Bodies, and on the Great Magnet the Earth",['William Gilbert'],1893,['Blood'],N/A,N/A,N/A
A View of Sir Isaac Newton's Philosophy,['Henry Pemberton'],1728,['Celestial mechanics'],N/A,N/A,N/A
Einstein in Matrix Form,['Günter Ludyk'],2013-06-12,['Science'],"This book is an introduction to the theories of Special and General Relativity. The target audience are physicists, engineers and applied scientists who are looking for an understandable introduction to the topic - without too much new mathematics. The fundamental equations of Einstein's theory of Special and General Relativity are derived using matrix calculus, without the help of tensors. This feature makes the book special and a valuable tool for scientists and engineers with no experience in the field of tensor calculus. In part I the foundations of Special Relativity are developed, part II describes the structure and principle of General Relativity. Part III explains the Schwarzschild solution of spherical body gravity and examines the ""Black Hole"" phenomenon. Any necessary mathematical tools are user friendly provided, either directly in the text or in the appendices.",N/A,N/A
The Works of Archimedes,['Archimedes'],1897,['Geometry'],N/A,3.5,N/A
Compendium of Theoretical Physics,"['Armin Wachter', 'Henning Hoeber']",2006-04-18,['Science'],"Mechanics, Electrodynamics, Quantum Mechanics, and Statistical Mechanics and Thermodynamics comprise the canonical undergraduate curriculum of theoretical physics. In Compendium of Theoretical Physics, Armin Wachter and Henning Hoeber offer a concise, rigorous and structured overview that will be invaluable for students preparing for their qualifying examinations, readers needing a supplement to standard textbooks, and research or industrial physicists seeking a bridge between extensive textbooks and formula books. The authors take an axiomatic-deductive approach to each topic, starting the discussion of each theory with its fundamental equations. By subsequently deriving the various physical relationships and laws in logical rather than chronological order, and by using a consistent presentation and notation throughout, they emphasize the connections between the individual theories. The reader’s understanding is then reinforced with exercises, solutions and topic summaries. Unique Features: Every topic is reviewed axiomatically-deductively and then reinforced through exercises, solutions and summaries Each subchapter ends with a set of applications, making the Compendium an ideal review of theoretical physics for physicists working in industry or research A Mathematical Appendix covers vector operations, integral theorems, partial differential quotients, complete function systems, Fourier analysis, Bessel functions, spherical Bessel functions, Legendre functions, Legendre polynomials and spherical harmonics Armin Wachter holds a Ph.D. in Physics from the John von Neumann Institute for Computing (NIC) / Research Centre of Jülich, Germany. His research interests include theoretical elementary particle physics, heavy quark physics, heavy meson spectroscopy, algorithms on parallel computers, andlattice gauge theory. He is presently writing a textbook on relativistic quantum mechanics for Springer. Henning Hoeber received his Ph.D. in Physics from the University of Edinburgh, Scotland and has since held research positions at the John von Neumann Institute for Computing (NIC) / Research Centre of Jülich, Germany and the University of Wuppertal, Germany. His research interests include elementary particle physics, lattice gauge theory, and computational physics, and since 1998 he has done extensive work in the fields of seismic processing, time series analysis, statistical and transform methods for seismic signal processing, and elastic wave propagation.",N/A,N/A
A View of Sir Isaac Newton's Philosophy,['Anonymous'],2023-10-01,['Science'],"A View of Sir Isaac Newton's Philosophy is a significant work by the renowned scientist Sir Isaac Newton himself. In this book, Newton provides a comprehensive overview of his groundbreaking theories and philosophical perspectives that revolutionized the understanding of the physical world. Key Aspects of The Book “A View of Sir Isaac Newton's Philosophy: Principia Mathematica: Newton explains the fundamental principles of his landmark work, Mathematical Principles of Natural Philosophy, commonly known as the Principia. He elucidates his laws of motion, universal gravitation, and the mathematical framework that underpins his theories, shaping the foundations of modern physics. Experimental and Deductive Reasoning: Newton emphasizes the importance of empirical observation and rigorous experimentation in scientific inquiry. He highlights the interplay between experimental data and deductive reasoning, illustrating his scientific method and its application in formulating laws and theories. The Nature of Light and Optics: Newton delves into his experiments and theories on the nature of light and optics. He discusses the phenomena of reflection, refraction, and color, providing insights into the behavior of light and the properties of different materials. Through A View of Sir Isaac Newton's Philosophy, readers gain a deeper understanding of Newton's profound contributions to the scientific community. From his laws of motion to his investigations into light and optics, the book showcases Newton's intellectual prowess, rigorous scientific approach, and the transformative impact of his discoveries on the field of physics. Sir Isaac Newton: Sir Isaac Newton, an English mathematician, physicist, and astronomer, is regarded as one of the greatest scientists in history. Born in 1643, Newton's groundbreaking work in the fields of mechanics and gravitation laid the foundation for classical physics. His seminal work, Philosophiæ Naturalis Principia Mathematica, introduced the laws of motion and the universal law of gravitation, transforming our understanding of the physical world. Newton's contributions to mathematics and science revolutionized scientific thought, establishing him as an intellectual giant whose influence continues to shape our understanding of the universe.",N/A,N/A
Newton's Principia,['Isaac Newton'],1848,['Celestial mechanics'],N/A,5,N/A
Low Reynolds number hydrodynamics,"['J. Happel', 'H. Brenner']",1983-09-30,['Science'],"One studying the motion of fluids relative to particulate systems is soon impressed by the dichotomy which exists between books covering theoretical and practical aspects. Classical hydrodynamics is largely concerned with perfect fluids which unfortunately exert no forces on the particles past which they move. Practical approaches to subjects like fluidization, sedimentation, and flow through porous media abound in much useful but uncorrelated empirical information. The present book represents an attempt to bridge this gap by providing at least the beginnings of a rational approach to fluid particle dynamics, based on first principles. From the pedagogic viewpoint it seems worthwhile to show that the Navier-Stokes equations, which form the basis of all systematic texts, can be employed for useful practical applications beyond the elementary problems of laminar flow in pipes and Stokes law for the motion of a single particle. Although a suspension may often be viewed as a continuum for practical purposes, it really consists of a discrete collection of particles immersed in an essentially continuous fluid. Consideration of the actual detailed boundary value problems posed by this viewpoint may serve to call attention to the limitation of idealizations which apply to the overall transport properties of a mixture of fluid and solid particles.",5,N/A
Essays on Several Curious and Useful Subjects,['Thomas Simpson'],1740,['Astronomy'],N/A,N/A,N/A
Oscillations and Waves,['Fritz K. Kneubühl'],2013-03-09,['Science'],"In the course of over thirty years of research in various fields of physics and teaching experimental physics to undergraduate and graduate students of physics, mathematics, electrical engineering, chemistry and natural sciences I missed an introductory comprehensive book on the mathematics of linear and nonlinear oscillations and waves from the point of view of physicists and engineers. Oscillations and waves are the playground for all kinds of scientists in spite of the fact that they represent essentially mathematical concepts. In this field, however, the interests of experimentalists and engineers, on one side, and mathematicians, on the other side, usually differ. The latter are most interested and engaged in proofs of general fundamentallaws on the existence and behavior of the solutions of basic differential equations and on the convergence of their approximations, whereas the former need explicit analytical and numerical solutions or approximations, computer programs and graphic displays. In the past decades a gap opened between these two groups with the result that they have difficulties in communicating with each other. This comprehensive book represents a novel attempt to bridge this gap. This book is based on my lecture notes and its predecessor ""Lineare und nichtlineare Schwingungen und Wellen"" published by B. G. Teubner, Stuttgart, FRG, in 1995. The contents of the previous book have been considerably extended, revised and improved thanks to advice from colleagues and co-workers. Additions to be mentioned are the first c1assification of two-dimensional autonomous, i. e.",N/A,N/A
Archimedis Opera Omnia: Volume 3,['Archimedes'],2013-04-18,['Mathematics'],"Published 1880-1, this three-volume edition of Archimedes' extant works in Greek includes commentaries and parallel Latin translation.",N/A,N/A
Two New Sciences,['Galileo Galilei'],1989,['Science'],N/A,N/A,N/A
Mechanics,['Florian Scheck'],2010-04-01,['Science'],"Purpose and Emphasis. Mechanics not only is the oldest branch of physics but was and still is the basis for all of theoretical physics. Quantum mechanics can hardly be understood, perhaps cannot even be formulated, without a good kno- edge of general mechanics. Field theories such as electrodynamics borrow their formal framework and many of their building principles from mechanics. In short, throughout the many modern developments of physics where one frequently turns back to the principles of classical mechanics its model character is felt. For this reason it is not surprising that the presentation of mechanics re?ects to some - tent the development of modern physics and that today this classical branch of theoretical physics is taught rather differently than at the time of Arnold S- merfeld, in the 1920s, or even in the 1950s, when more emphasis was put on the theoryandtheapplicationsofpartial-differentialequations. Today, symmetriesand invariance principles, the structure of the space–time continuum, and the geom- rical structure of mechanics play an important role. The beginner should realize that mechanics is not primarily the art of describing block-and-tackles, collisions of billiard balls, constrained motions of the cylinder in a washing machine, or - cycle riding.",4,N/A
Mechanics of Pre-industrial Technology,"['Brian Cotterell', 'Johan Kamminga']",1990,['Biography & Autobiography'],"First general account of the mechanics behind pre-industrial technology, combining the skills of an engineer and an archaeologist.",N/A,N/A
The Feynman Lectures on Physics,"['Richard Phillips Feynman', 'Robert B. Leighton', 'Matthew Sands']",1977,['Science'],N/A,N/A,N/A
Fatigue of Structures and Materials,['Jaap Schijve'],2001,['Science'],"This is primarily a textbook written for engineers, students and teachers, and for people working on fatigue problems of engineering structures and materials. An important theme is what happens in the material of an engineering structure subjected to a spectrum of cyclic loads in service",N/A,N/A
Theoretical Concepts in Physics,['Malcolm S. Longair'],2020-04-16,['Science'],An innovative integrated approach to classical physics and the beginnings of quantum physics through a sequence of historical case studies.,N/A,N/A
Isaac Newton's Natural Philosophy,"['Jed Z. Buchwald', 'I. Bernard Cohen']",2001,['Biography & Autobiography'],"Shedding new light on the intellectual context of Newton's scientific thought, this book explores the development of his mathematical philosophy, rational mechanics, and celestial dynamics. An appendix includes the last paper written by Newton biographer Richard S. Westfall.",N/A,N/A
Classical Mechanics,['Walter Greiner'],2006-04-18,['Science'],"Intended for advanced undergraduates and beginning graduate students, this text is based on the highly successful course given by Walter Greiner at the University of Frankfurt, Germany. The two volumes on classical mechanics provide not only a complete survey of the topic but also an enormous number of worked examples and problems to show students clearly how to apply the abstract principles to realistic problems.",3,N/A
Basic Theoretical Physics,"['Uwe Krey', 'Anthony Owen']",2007-08-14,['Science'],"This concise treatment embraces, in four parts, all the main aspects of theoretical physics. Recent topics such as holography and quantum cryptography are included. The book summarizes what a graduate student, physicist working in industry, or a physics teacher should master during his or her degree course. It will also be useful for deepening one’s insight and it adds new dimensions to understanding of these elemental concepts.",4.5,N/A
Statistical Physics I,"['Morikazu Toda', 'Ryogo Kubo', 'Nobuhiko Saito']",2012-12-06,['Science'],"Statistical Physics I discusses the fundamentals of equilibrium statistical mechanics, focussing on basic physical aspects. No previous knowledge of thermodynamics or the molecular theory of gases is assumed. Illustrative examples based on simple materials and photon systems elucidate the central ideas and methods.",N/A,N/A
"Elements of Mechanics Including Kinematics, Kinetics and Statics, with Applications",['Thomas Wallace Wright'],1898,['Mechanics'],N/A,N/A,N/A
Mechanics in Sixteenth-century Italy,"['Stillman Drake', 'Israel Edward Drabkin']",1969,['Science'],N/A,N/A,N/A
The Mechanical Universe,['Steven C. Frautschi'],1986-03-31,['Science'],This innovative physics textbook develops classical mechanics from a historical perspective while introducing new concepts.,N/A,N/A
Mathematical Principles of Natural Philosophy,['Isaac Newton'],1969,['Science'],N/A,N/A,N/A
Dialogues Concerning Two New Sciences,['Galileo Galilei'],1963,['Mechanics'],N/A,N/A,N/A
Vectorial Mechanics,['Edward Arthur Milne'],1948,['Mechanics'],N/A,N/A,N/A
Newton's Principia for the Common Reader,['Subrahmanyan Chandrasekhar'],2003,['Biography & Autobiography'],"Newton's Philosophiae Naturalis Principia Mathematica provides a coherent and deductive presentation of his discovery of the universal law of gravitation. It is very much more than a demonstration that 'to us it is enough that gravity really does exist and act according to the laws which we have explained and abundantly serves to account for all the motions of the celestial bodies and the sea'. It is important to us as a model of all mathematical physics.Representing a decade's work from a distinguished physicist, this is the first comprehensive analysis of Newton's Principia without recourse to secondary sources. Professor Chandrasekhar analyses some 150 propositions which form a direct chain leading to Newton's formulation of his universal law of gravitation. In each case, Newton's proofs are arranged in a linear sequence of equations and arguments, avoiding the need to unravel the necessarily convoluted style of Newton's connected prose. In almost every case, a modern version of the proofs is given to bring into sharp focus the beauty, clarity, and breath-taking economy of Newton's methods.Subrahmanyan Chandrasekhar is one of the most reknowned scientists of the twentieth century, whose career spanned over 60 years. Born in India, educated at the University of Cambridge in England, he served as Emeritus Morton D. Hull Distinguished Service Professor of Theoretical Astrophysics at the University of Chicago, where he has was based from 1937 until his death in 1996. His early research into the evolution of stars is now a cornerstone of modern astrophysics, and earned him the Nobel Prize for Physics in 1983. Later work into gravitational interactions between stars, the properties of fluids, magnetic fields, equilibrium ellipsoids, and black holes has earned him awards throughout the world, including the Gold Medal from the Royal Astronomical Society in London (1953), the National Medal of Science in the United States (1966), and the Copley Medal from the Royal Society (1984). His many publications include Radiative transfer (1950), Hydrodynamic and hydromagnetic stability (1961), and The mathematical theory of black holes (1983), each being praised for its breadth and clarity. Newton's Principia for the common reader is the result of Professor Chandrasekhar's profound admiration for a scientist whose work he believed is unsurpassed, and unsurpassable.",N/A,N/A
"The Method of Archimedes, Recently Discovered by Heiberg",['Sir Thomas Heath'],2007-06-01,['History'],"Greek philosopher, astronomer, and mathematician ARCHIMEDES(circa 287 BC-circa 212 BC) is considered by many the greatest mathematician-and possibly the greatest scientist-of all time. He has made priceless contributions to the fields of maths, physics, and engineering, including the discovery of the principle of density and buoyancy. First published in English in 1897, this collection of supplementary writings on treating mechanical problems provides a thorough exposition of Archimedes' methods in mathematics, physics, logic, and even science in general.",N/A,N/A
An Account of Sir Isaac Newton's Philosophical Discoveries,['Colin MacLaurin'],1968,['Mechanics'],N/A,N/A,N/A
An Introduction to Boundary Layer Meteorology,['Roland B. Stull'],1988-07-31,['Science'],"Part of the excitement in boundary-layer meteorology is the challenge associated with turbulent flow - one of the unsolved problems in classical physics. An additional attraction of the filed is the rich diversity of topics and research methods that are collected under the umbrella-term of boundary-layer meteorology. The flavor of the challenges and the excitement associated with the study of the atmospheric boundary layer are captured in this textbook. Fundamental concepts and mathematics are presented prior to their use, physical interpretations of the terms in equations are given, sample data are shown, examples are solved, and exercises are included. The work should also be considered as a major reference and as a review of the literature, since it includes tables of parameterizatlons, procedures, filed experiments, useful constants, and graphs of various phenomena under a variety of conditions. It is assumed that the work will be used at the beginning graduate level for students with an undergraduate background in meteorology, but the author envisions, and has catered for, a heterogeneity in the background and experience of his readers.",N/A,N/A
The Feynman Lectures on Physics,"['Richard Phillips Feynman', 'Robert B. Leighton', 'Matthew Linzee Sands']",1989,['Electromagnetism'],"Perseus Books is pleased to continue its program to publish the complete collection of audio recordings of Feynman's famous Caltech course on which his classic textbook, Lectures on Physics, was based. This season we present the third and fourth volumes, which together we call ""Feynman on Matter"". We plan to release two more volumes per list until all III lectures have been published.These two volumes in the collection comprise a complete course on matter: Volume 3: From Crystal Structure to Magnetism includes chapters on the internal geometry of crystals, the refractive index of dense materials, elastic materials, dielectrics, and magnetism.Volume 4: Electrical and Magnetic Behavior includes chapters on propagation in a crystal lattice, semiconductors, the independent particle approximation, the Schrodinger equation in a classical context, superconductivity, paramagnetism and magnetic resonance, and ferromagnetism. Copyright © Libri GmbH. All rights reserved.",N/A,N/A
A Manual of Applied Mechanics,['William John Macquorn Rankine'],1877,['Mechanical engineering'],N/A,4,N/A
Philosophia naturalis principia mathematica,['Isaac Newton'],1687,['Celestial mechanics'],N/A,N/A,N/A
Thinking with Objects,['Domenico Bertoloni Meli'],2006-11-17,['History'],"'Bertoloni Meli reexamines such major texts as Galileo's Dialogues Concerning Two New Sciences, Descartes' Principles of Philosophy, and Newton's Principia, and in them finds a reliance on objects that has escaped proper understanding. From Pappus of Alexandria to Guidobaldo dal Monte, Bertoloni Meli sees significant developments in the history of mechanical experimentation, all of them crucial for understanding Galileo. Bertoloni Meli uses similarities and tensions between dal Monte and Galileo as a springboard for exploring the revolutionary nature of seventeenth-century mechanics.' (Back cover)",N/A,N/A
Treatise on Natural Philosophy,"['William Thomson Baron Kelvin', 'Peter Guthrie Tait']",1886,['Calculators'],N/A,N/A,N/A
A History of Mechanics,['René Dugas'],1957,['Mechanics'],N/A,N/A,N/A
The Works of Archimedes,['Archimedes'],1953,['Geometria - Obras anteriores a 1800'],N/A,N/A,N/A
