title,authors,publishedDate,categories,description,averageRating,textSnippet
The General Theory of Homogenization,['Luc Tartar'],2009-12-03,['Science'],"Homogenization is not about periodicity, or Gamma-convergence, but about understanding which effective equations to use at macroscopic level, knowing which partial differential equations govern mesoscopic levels, without using probabilities (which destroy physical reality); instead, one uses various topologies of weak type, the G-convergence of Sergio Spagnolo, the H-convergence of François Murat and the author, and some responsible for the appearance of nonlocal effects, which many theories in continuum mechanics or physics guessed wrongly. For a better understanding of 20th century science, new mathematical tools must be introduced, like the author’s H-measures, variants by Patrick Gérard, and others yet to be discovered.",N/A,N/A
"The History of Gutta-Percha Willie, the Working Genius",['George MacDonald'],1887,['Blacksmiths'],"Young Willie Macmichael, a blacksmith, shoemaker, carpenter, and mechanic, discovers a medicinal spring where he builds himself quarters and later a hospital.",N/A,N/A
The Principia,['Isaac Newton'],2013-07-05,['Celestial mechanics'],"Newton's Principia by Sir Isaac Newton is presented here in a high quality paperback edition. This publication was produced from a professional scan of an original edition of the book, which can include imperfections from the original book or through the scanning process, and has been created from an edition which we consider to be of the best possible quality available. This popular classic work by Sir Isaac Newton is in the English language. Newton's Principia is highly recommended for those who enjoy the works of Sir Isaac Newton, and for those discovering the works of Sir Isaac Newton for the first time.",N/A,N/A
Sliding Friction,['Bo N.J. Persson'],2013-03-14,['Science'],"Sliding friction is one of the oldest problems in physics and certainly one of the most important from a practical point of view. The ability to produce durable low-friction surfaces and lubricant fluids has become an important factor in the miniaturization of moving components in many technological devices, e.g. magnetic storage, recording systems, miniature motors and many aerospace components. This book will be useful to physicists, chemists, materials scientists, and engineers who want to understand sliding friction. The book (or parts of it) could also form the basis for a modern undergraduate or graduate course on tribology. This second edition covers several new topics including friction on superconductors, experimental studies and computer simulations of the layering transition, nanoindentation, wear in combustion engines, rubber wear, effects due to humidity, rolling and sliding of carbon nanotubes and the friction dynamics of granular materials.",N/A,N/A
Classical Mechanics,"['Herbert Charles Corben', 'Philip Stehle']",1960,['Mechanics'],N/A,N/A,N/A
NEWTONS PRINCIPIA THE MATHEMAT,"['Isaac 1642-1727 Newton', 'Andrew Tr Motte', 'N. W. Chittenden']",2016-08-28,['History'],"This work has been selected by scholars as being culturally important, and is part of the knowledge base of civilization as we know it. This work was reproduced from the original artifact, and remains as true to the original work as possible. Therefore, you will see the original copyright references, library stamps (as most of these works have been housed in our most important libraries around the world), and other notations in the work. This work is in the public domain in the United States of America, and possibly other nations. Within the United States, you may freely copy and distribute this work, as no entity (individual or corporate) has a copyright on the body of the work. As a reproduction of a historical artifact, this work may contain missing or blurred pages, poor pictures, errant marks, etc. Scholars believe, and we concur, that this work is important enough to be preserved, reproduced, and made generally available to the public. We appreciate your support of the preservation process, and thank you for being an important part of keeping this knowledge alive and relevant.",N/A,N/A
"On Motion, and On Mechanics",['Galileo Galilei'],1960,['Science'],N/A,N/A,N/A
"Classical Mechanics by Herbert Goldstein, Charles Poole and John Safko",['Herbert Goldstein'],2002,['Mechanics'],N/A,N/A,N/A
The Science of Mechanics,['Ernst Mach'],1919,['Dynamics'],N/A,N/A,N/A
Elements of Newtonian Mechanics,"['Jens M. Knudsen', 'Poul G. Hjorth']",2012-12-06,['Science'],"This book is intended as a textbook for an entry-level university course in Newtonian mechanics for students of physics, astronomy, and the engineering sciences. The material has been used as a first-semester text for first-year undergraduates at the Niels Bohr Institute, which is part of the University of Copenhagen. Our way of presenting Newtonian mechanics is influenced by the writings of the late Max Born. Also, the Feynman Lectures on Physics have been an important source of inspiration. In fact, the idea for the book came when we read Section 16.1 of Volume 1 of the Feynman Lectures. Ideas from the well-known Berkeley Physics Course may also be traced in the text. All of the books quoted in the literature list have, in one way or another, served as a source for our lectures for undergraduates. It is assumed that the students already have a rudimentary knowledge of Newtonian mechanics, say at the high-school level. Some background in vectors and elementary calculus is also required, i.e., the students should know how to add vectors as well as how to differentiate and integrate elementary functions. The Appendix contains the required background for the use of vectors in Newtonian mechanics.",N/A,N/A
Reading the Principia,['Niccol- Guicciardini'],2003-10-30,['Mathematics'],"The mathematical methods employed by Newton in the Principia stimulated much debate among contemporaries. This book explains how Newton addressed these issues, taking into consideration the values that directed his research. It will be of interest to researchers and students in history and philosophy of science, physics, mathematics and astronomy.",N/A,N/A
Selections from Newton's Principia,['Isaac Newton'],2004,['Science'],"Newton's new conception of the laws of the universe challenged centuries of received opinion, and laid a new foundation for our ?common sense? understanding of the physical world. If you have always wanted to know more about Newton's achievement but thought it was the exclusive province of experts, this little book will guide you through the essentials of Newton's argument in his own words and using only elementary mathematics. Traces the basic development of universal gravitation. Newton's text with notes, commentary, questions for discussion, and additional diagrams. Includes Newton's definitions, laws, scholia, Book I propositions 1 and 4, Rules of Philosophizing, Phenomena, Book III Propositions 1 through 4, and General Scholium.",4,N/A
Foams and Emulsions,"['J.F. Sadoc', 'N. Rivier']",2013-03-09,['Technology & Engineering'],"A general and introductory survey of foams, emulsions and cellular materials. Foams and emulsions are illustrations of some fundamental concepts in statistical thermodynamics, rheology, elasticity and the physics and chemistry of divided media and interfaces. They also give rise to some of the most beautiful geometrical shapes and tilings, ordered or disordered. The chapters are grouped into sections having fairly loose boundaries. Each chapter is intelligible alone, but cross referencing means that the few concepts that may not be familiar to the reader can be found in other chapters in the book. Audience: Research students, researchers and teachers in physics, physical chemistry, materials science, mechanical engineering and geometry.",N/A,N/A
A Field Guide to Automotive Technology,"['Ed Sobey', 'Edwin J. C. Sobey']",2009,['Science'],"Written for mechanical novices who may not know their catalytic converters from their universal joints, this practical guide helps teach a basic understanding of how automobiles function. Devices are grouped according to their habitats - under the hood, inside the car, and more - to help identify the technology in question. Solving automotive puzzles such as where exactly does a dipstick dip and what is rack and pinion steering, this handy reference illuminates what's going on under the hood without all that grime and grease.",N/A,N/A
The Science of Mechanics,['Ernst Mach'],1915,['Mechanics'],N/A,N/A,N/A
The Principia,['Isaac Newton'],1999-10-20,['Science'],"In his monumental 1687 work Philosophiae Naturalis Principia Mathematica, known familiarly as the Principia, Isaac Newton laid out in mathematical terms the principles of time, force, and motion that have guided the development of modern physical science. Even after more than three centuries and the revolutions of Einsteinian relativity and quantum mechanics, Newtonian physics continues to account for many of the phenomena of the observed world, and Newtonian celestial dynamics is used to determine the orbits of our space vehicles. This completely new translation, the first in 270 years, is based on the third (1726) edition, the final revised version approved by Newton; it includes extracts from the earlier editions, corrects errors found in earlier versions, and replaces archaic English with contemporary prose and up-to-date mathematical forms. Newton's principles describe acceleration, deceleration, and inertial movement; fluid dynamics; and the motions of the earth, moon, planets, and comets. A great work in itself, the Principia also revolutionized the methods of scientific investigation. It set forth the fundamental three laws of motion and the law of universal gravity, the physical principles that account for the Copernican system of the world as emended by Kepler, thus effectively ending controversy concerning the Copernican planetary system. The illuminating Guide to the Principia by I. Bernard Cohen, along with his and Anne Whitman's translation, will make this preeminent work truly accessible for today's scientists, scholars, and students.",N/A,N/A
The Principia,['Isaac Newton'],2023-10-20,[],"A groundbreaking work in the field of physics and mathematics. In this monumental work, Newton formulated the laws of motion and universal gravitation, laying the foundation for classical mechanics and revolutionizing our understanding of the physical world. The Principia remains one of the most significant scientific books ever written, influencing generations of scientists, and shaping the course of modern physics and mathematics. The Groundbreaking Work of Sir Isaac Newton Mathematical proofs and equations. Comprehensive coverage of planetary motion. Helps in understanding the principles of motion. Logical and rigorous approach to scientific inquiry. Studied and revered as a seminal work in the field of science.",N/A,N/A
The Mechanical Universe,"['Richard P. Olenick', 'Tom M. Apostol', 'David L. Goodstein']",2008-01-14,['Science'],"This book studies electricity and magnetism, light, the special theory of relativity, and modern physics.",5,N/A
Dialogues Concerning Two New Sciences,['Galileo Galilei'],1939,['Mechanics'],N/A,N/A,N/A
Mechanical Properties and Testing of Polymers,['G.M. Swallowe'],2013-04-17,['Science'],"This volume represents a continuation of the Polymer Science and Technology series edited by Dr. D. M. Brewis and Professor D. Briggs. The theme of the series is the production of a number of stand alone volumes on various areas of polymer science and technology. Each volume contains short articles by a variety of expert contributors outlining a particular topic and these articles are extensively cross referenced. References to related topics included in the volume are indicated by bold text in the articles, the bold text being the title of the relevant article. At the end of each article there is a list of bibliographic references where interested readers can obtain further detailed information on the subject of the article. This volume was produced at the invitation of Derek Brewis who asked me to edit a text which concentrated on the mechanical properties of polymers. There are already many excellent books on the mechanical properties of polymers, and a somewhat lesser number of volumes dealing with methods of carrying out mechanical tests on polymers. Some of these books are listed in Appendix 1. In this volume I have attempted to cover basic mechanical properties and test methods as well as the theory of polymer mechanical deformation and hope that the reader will find the approach useful.",N/A,N/A
A Modern Approach to Classical Mechanics,['Harald Iro'],2002,['Science'],"The approach to classical mechanics adopted in this book includes and stresses recent developments in nonlinear dynamical systems. The concepts necessary to formulate and understand chaotic behavior are presented. Besides the conventional topics (such as oscillators, the Kepler problem, spinning tops and the two centers problem) studied in the frame of Newtonian, Lagrangian, and Hamiltonian mechanics, nonintegrable systems (the Hnon-Heiles system, motion in a Coulomb force field together with a homogeneous magnetic field, the restricted three-body problem) are also discussed. The question of the integrability (of planetary motion, for example) leads finally to the KAM-theorem.This book is the result of lectures on 'Classical Mechanics' as the first part of a basic course in Theoretical Physics. These lectures were given by the author to undergraduate students in their second year at the Johannes Kepler University Linz, Austria. The book is also addressed to lecturers in this field and to physicists who want to obtain a new perspective on classical mechanics.",N/A,N/A
Technological Concepts and Mathematical Models in the Evolution of Modern Engineering Systems,"['Mario Lucertini', 'Ana Millàn Gasca', 'Fernando Nicolò']",2004,['Mathematics'],"This collection of historical research studies covers the evolution of technology as knowledge, the emergence of an autonomous engineering science in the Industrial Age, the idea of scientific managment of production and operation systems, and the interaction between mathematical models and technological concepts. The book is published with the support of the UNESCO Venice Office - Regional Office for Science & Technology in Europe as an activity of the Project: The evolution of events, concepts and models in engineering systems.",N/A,N/A
Seven Ideas that Shook the Universe,"['Nathan Spielberg', 'Bryon D. Anderson']",1987-02-05,['History'],"Discusses the background and impact of Copernican astronomy, Newtonian mechanics, the concept of energy, entropy, relativity, quantum theory, and conservation symmetries.",N/A,N/A
Differential Equations and Dynamical Systems,['Lawrence Perko'],2013-11-21,['Mathematics'],"Mathematics is playing an ever more important role in the physical and biological sciences, provoking a blurring of boundaries between scientific disciplines and a resurgence of interest in the modern as well as the clas sical techniques of applied mathematics. This renewal of interest, both in research and teaching, has led to the establishment of the series: Texts in Applied Mathematics (TAM). The development of new courses is a natural consequence of a high level of excitement on the research frontier as newer techniques, such as numerical and symbolic computer systems, dynamical systems, and chaos, mix with and reinforce the traditional methods of applied mathematics. Thus, the purpose of this textbook series is to meet the current and future needs of these advances and encourage the teaching of new courses. TAM will publish textbooks suitable for use in advanced undergraduate and beginning graduate courses, and will complement the Applied Math ematical Sciences (AMS) series, which will focus on advanced textbooks and research level monographs.",N/A,N/A
Newton's Principia,['Isaac Newton'],1878,['Celestial mechanics'],N/A,N/A,N/A
Physics for Technical Students,['William Ballantyne Anderson'],1914,['Heat'],N/A,N/A,N/A
Springer Handbook of Mechanical Engineering,"['Karl-Heinrich Grote', 'Hamid Hefazi']",2021-04-10,['Technology & Engineering'],This resource covers all areas of interest for the practicing engineer as well as for the student at various levels and educational institutions. It features the work of authors from all over the world who have contributed their expertise and support the globally working engineer in finding a solution for today‘s mechanical engineering problems. Each subject is discussed in detail and supported by numerous figures and tables.,N/A,N/A
The Pendulum,"['Michael Matthews', 'Colin F. Gauld', 'Arthur Stinner']",2006-01-19,['Science'],"The pendulum is a universal topic in primary and secondary schools, but its full potential for learning about physics, the nature of science, and the relationships between science, mathematics, technology, society and culture is seldom realised. Contributions to this 32-chapter anthology deal with the science, history, methodology and pedagogy of pendulum motion. There is ample material for the richer and more cross-disciplinary treatment of the pendulum from elementary school to high school, and through to advanced university classes. Scientists will value the studies on the physics of the pendulum; historians will appreciate the detailed treatment of Galileo, Huygens, Newton and Foucault’s pendulum investigations; psychologists and educators will learn from the papers on Piaget; teachers will welcome the many contributions to pendulum pedagogy. All readers will come away with a new awareness of the importance of the pendulum in the foundation and development of modern science; and for its centrality in so many facets of society and culture.",N/A,N/A
The Principles of Quantum Mechanics,['Paul Adrien Maurice Dirac'],1930,['Matrix mechanics'],N/A,N/A,N/A
Danny the Champion of the World,['Roald Dahl'],1977,['Birds'],"A young English boy describes his relationship with his father and the special adventure they share together. Danny thinks the world of his father, but imagine his surprise when he finds out he's been breaking the law! Even grown-ups bend the rules sometimes, but Danny knows his father is still good, kind and clever and full of exciting ideas.",N/A,N/A
"Elements of Mechanics Including Kinematics, Kinetics and Statics",['Thomas Wallace Wright'],1906,['Mechanics'],N/A,N/A,N/A
Principia Mathematica,['Isaac Newton'],2008,['Celestial mechanics'],N/A,N/A,N/A
Thermal Stresses—Advanced Theory and Applications,"['Richard B. Hetnarski', 'M. Reza Eslami']",2019-04-11,['Science'],"This is an advanced modern textbook on thermal stresses. It serves a wide range of readers, in particular, graduate and postgraduate students, scientists, researchers in various industrial and government institutes, and engineers working in mechanical, civil, and aerospace engineering. This volume covers diverse areas of applied mathematics, continuum mechanics, stress analysis, and mechanical design. This work treats a number of topics not presented in other books on thermal stresses, for example: theory of coupled and generalized thermoelasticity, finite and boundary element method in generalized thermoelasticity, thermal stresses in functionally graded structures, and thermal expansions of piping systems. The book starts from basic concepts and principles, and these are developed to more advanced levels as the text progresses. Nevertheless, some basic knowledge on the part of the reader is expected in classical mechanics, stress analysis, andmathematics, including vector and cartesian tensor analysis. This 2nd enhanced edition includes a new chapter on Thermally Induced Vibrations. The method of stiffness is added to Chapter 7. The variational principle for the Green-Lindsay and Green-Naghdi models have been added to Chapter 2 and equations of motion and compatibility equations in spherical coordinates to Chapter 3. Additional problems at the end of chapters were added.",N/A,N/A
Dialogues Concerning Two New Sciences 1638,['Galileo Galilei'],2015-05-05,[],"""Dialogues Concerning Two New Sciences 1638"" from Galileo Galilei. Italian physicist, mathematician, astronomer, and philosopher (1564-1642).",N/A,N/A
Push and Pull,"['Gail Saunders-Smith', 'Lola M. Schaefer']",2001,['Juvenile Nonfiction'],Simple text and photographs describe and illustrate push and pull movement.,N/A,N/A
Astronautics,['Ulrich Walter'],2019-02-14,['Technology & Engineering'],"This introductory text covers all the key concepts, relationships, and ideas behind spaceflight and is the perfect companion for students pursuing courses on or related to astronautics. As a crew member of the STS-55 Space Shuttle mission and a full professor of astronautics at the Technical University of Munich, Ulrich Walter is an acknowledged expert in the field. This book is based on his extensive teaching and work with students, and the text is backed up by numerous examples drawn from his own experience. With its end-of-chapter examples and problems, this work is suitable for graduate level or even undergraduate courses in spaceflight, as well as for professionals working in the space industry. This third edition includes substantial revisions of several sections to extend their coverage. These include both theoretical extensions such as the study of relative motion in near-circular orbits, and more practical matters such as additional details about jet-engine and general rocket performance. New sections address regularized equations of orbital motion and their algebraic solutions and also state vector propagation; two new chapters are devoted to orbit geometry and orbit determination and to thermal radiation physics and modelling.",N/A,N/A
Galileo,['Stillman Drake'],1990-01-01,['Biography & Autobiography'],"Since publication of Stillman Drake?s landmark volume, Galileo at Work: His Scientific Biography, new and exciting information has come to light about this towering figure in the history of Western science. Drawing largely from Galileo?s manuscript working papers, Drake now adds a wealth of detail to the story. Among the findings he presents in this volume are the steps that led to discovery of the pendulum law and the law of fall, by which Galileo opened the road to modern physics; Galileo?s path to the new astronomy of Copernicus, closely linked to his first essays in physics; his subsequent misgivings and final reassurances provided by the telescope. Drake focuses on Galileo?s pioneering work in physics, previously unknown, and shows that time has not diminished its value. He also considers some of the factors that played a part in the development of physics, its classical Greek beginnings, the medieval interlude, the contribution of some of Galileo?s contemporaries, and the resistance of others to his new science of motion. We see in a new light the relation of that science to modern dynamics, created by Newton half a century later. Galileo is better known as an astronomer than as a modern physicist. Drake sheds new light here too as he explores Galileo?s pioneer invention of satellite astronomy, his sighting of Neptune two and one-half centuries before that planet was identified, and his proposal of a cosmogony based on speeds of freely falling bodies. With this book Drake confirms Galileo as the first recognizably modern scientist, in both his methods and results.",N/A,N/A
Fundamental Laws of Mechanics,['Igorʹ Evgenʹevich Irodov'],1980,['Science'],N/A,5,N/A
The Three-body Problem from Pythagoras to Hawking,"['Mauri Valtonen', 'Joanna Anosova', 'Konstantin Kholshevnikov', 'Aleksandr Mylläri', 'Victor Orlov', 'Kiyotaka Tanikawa']",2016-05-03,['Science'],"This book, written for a general readership, reviews and explains the three-body problem in historical context reaching to latest developments in computational physics and gravitation theory. The three-body problem is one of the oldest problems in science and it is most relevant even in today’s physics and astronomy. The long history of the problem from Pythagoras to Hawking parallels the evolution of ideas about our physical universe, with a particular emphasis on understanding gravity and how it operates between astronomical bodies. The oldest astronomical three-body problem is the question how and when the moon and the sun line up with the earth to produce eclipses. Once the universal gravitation was discovered by Newton, it became immediately a problem to understand why these three-bodies form a stable system, in spite of the pull exerted from one to the other. In fact, it was a big question whether this system is stable at all in the long run. Leading mathematicians attacked this problem over more than two centuries without arriving at a definite answer. The introduction of computers in the last half-a-century has revolutionized the study; now many answers have been found while new questions about the three-body problem have sprung up. One of the most recent developments has been in the treatment of the problem in Einstein’s General Relativity, the new theory of gravitation which is an improvement on Newton’s theory. Now it is possible to solve the problem for three black holes and to test one of the most fundamental theorems of black hole physics, the no-hair theorem, due to Hawking and his co-workers.",N/A,N/A
Mechanical Design in Organisms,['Stephen A. Wainwright'],1976,['Science'],N/A,N/A,N/A
