title,authors,publishedDate,categories,description,averageRating,textSnippet,language
Debt,['David Graeber'],2011,['Business & Economics'],"Here anthropologist David Graeber presents a reversal of conventional wisdom. He shows that for more than 5,000 years, since the beginnings of the first agrarian empires, humans have used elaborate credit systems to buy and sell goods that is, long before the invention of coins or cash. It is in this era, Graeber argues, that we also first encounter a society divided into debtors and creditors. --",N/A,N/A,en
Extreme Money,['Satyajit Das'],2011,['Business & Economics'],"Everything from home mortgages to climate change has become financialized, as vast fortunes are generated by individuals who build nothing of lasting value. Das shows how ""extreme money"" has become ever more unreal; how ""voodoo banking"" continues to generate massive phony profits even now; and how a new generation of ""Masters of the Universe"" has come to domiinate the world.",N/A,N/A,en
"Money, Whence it Came, where it Went",['John Kenneth Galbraith'],1995,['Business & Economics'],"The author, a noted economist and diplomat, traces the evolution of money and the institutions and techniques for its management and mismanagement from Lydian coinage to 20th century inflation.",N/A,N/A,en
A History of Money,['John F. Chown'],1994,['Business & Economics'],"Introduces monetary history: money as coin, the development of credit and banking, and inconvertible paper money.",5,N/A,en
Big Money,['Pelham Grenville Wodehouse'],1981,['Fiction'],"Most of the big money belongs to Torquil Paterson Frisby, the dyspeptic American millionaire--but that doesn't stop him wanting more out of it. His niece, the beautiful Ann Moon, is engaged to ""Biscuit"", Lord Biskerton, who doesn't have very much money and so has to escape to Valley Fields to hide from his creditors. Meanwhile, his old schoolfriend Berry Conway, who is working for Frisby, falls for Ann, just as Biscuit falls for her friend Kitchie Valentine.",N/A,N/A,en
Money Manipulation and Social Order,['Denis Fahey'],1944,['Antisemitism'],"""First printed, 1944."" Bibliographical references in ""Foreword"" (p. [vi]) Bibliographical foot-notes.",N/A,N/A,en
What Has Government Done to Our Money?,['Murray Newton Rothbard'],1974,['Currency question'],N/A,N/A,N/A,en
"Monetary Statistics of the United States: Estimates, Sources, Methods","['Milton Friedman', 'Anna Jacobson Schwartz']",1870,['Business & Economics'],N/A,N/A,N/A,en
Introduction to the Theory of Employment,['Joan Robinson'],1960,['Economics'],N/A,N/A,N/A,en
A Treatise on Money,['John Maynard Keynes'],2011-03,['Business & Economics'],"2011 Reprint of 1930 American Edition. Two volumes Complete in One. Full facsimile of the original edition, not reproduced with Optical Recognition Software. Volumes One and Two of Keynes' classic work published in a handy one volume format. Exact facsimile of the original Edition. Keynes had begun a theoretical work to examine the relationship between unemployment, money and prices back in the 1920s. The work, Treatise on Money, was published in 1930 in two volumes. We reproduce this two volume edition in one volume. A central idea of the work was that if the amount of money being saved exceeds the amount being invested - which can happen if interest rates are too high - then unemployment will rise. This is in part a result of people not wanting to spend too high a proportion of what employers pay out, making it difficult, in aggregate, for employers to make a profit.",N/A,N/A,en
The Theory of Money and Credit,['Ludwig von Mises'],1934,['Banks and banking'],N/A,N/A,N/A,de
Investigations in Currency and Finance,['William Stanley Jevons'],1884,['Business & Economics'],N/A,N/A,N/A,en
"Exchange Rates, Money and Output","['P. de Grauwe', 'Michele Fratianni', 'Mustapha K. Nabli']",1985,['Business & Economics'],N/A,N/A,N/A,en
The Optimum Quantity of Money,['Milton Friedman'],1969,['Monetary policy'],Merendeels eerder verschenen essays,N/A,N/A,en
People of Prowess,['Nancy L. Struna'],1996,['History'],"Prowess--extraordinary skill and ability, especially in sports--has always been important to Americans, even in the seventeenth and eighteenth centuries. Nancy L. Struna explores the significance, meaning, and structure of competitive matches and displays of physical prowess for both men and women in colonial culture. Engrossingly written for the general reader as well as sport and leisure historians, People of Prowess is a pioneering work that explores a rarely examined area of colonial history and society.",N/A,N/A,en
"Mystery of Banking, The",['Murray Newton Rothbard'],2008,['Banks and banking'],N/A,N/A,N/A,en
The Mystery of Banking,['Murray N. Rothbard'],2011,['Banks and banking'],N/A,N/A,N/A,en
"The General Theory of Employment, Interest, and Money",['John Maynard Keynes'],1957,['Economics'],N/A,N/A,N/A,en
The Collected Writings of John Maynard Keynes,"['John Maynard Keynes', 'Royal Economic Society']",1976,['Employment (Economic theory)'],N/A,N/A,N/A,en
The Optimum Quantity of Money,"['Nicholas Eberstadt', 'Milton Friedman']",2017-09-20,[],"This classic set of essays by Nobel Laureate and leading monetary theorist Milton Friedman presents a coherent view of the role of money, focusing on specific topics related to the empirical analysis of monetary phenomena and policy. The early chapters cover factors determining the real quantity of money held in a community and the welfare implications of policies that affect the quantity held. The following chapters formally restate why quantity analysis has become central to the science of economics. Friedman's presidential address to the American Economic Association, included here, provides a general summary of his views on the role of monetary policy, with an emphasis on its limitations and its possibilities. This theoretical framework is used in examining a number of empirical problems: the demand for money, the explanation of price changes in wartime periods, and the role of money in business cycles. These essays summarize some of the most important results of Friedman's extensive research over the course of his lifetime. The chapters on policy that follow survey the positions of earlier economists and deal with the importance of lags and the implications of destabilizing speculation in foreign markets. Taken as a whole, The Optimum Quantity of Money provides a comprehensive view of the body of monetary theory developed in leading centers of monetary analysis. This work is essential reading for economists and graduate students in the field. The volume will be no less important for practicing business and banking personnel as well. The new statement by Michael Bordo, a student of Friedman's and an expert in the field, provides a sense of where the field now stands in the economy and academy.",N/A,N/A,en
The Monetary and Banking Development of Singapore and Malaysia,['Sheng-Yi Lee'],1990,['Business & Economics'],"The first edition of the book was published in 1974, and received a book award for best non-fiction in English presented by the National Book Development Council of Singapore in 1976, while the Second Edition published in 1986, saw much more econometric-statistical analysis. This Third Edition highlights the role of banking and finance in the economic development of Singapore and Malaysia; recent developments in Singapore and Malaysia are analysed; and special topics are presented in Epilogues 1 and 2.",N/A,N/A,en
The Economics of Inflation,['Costantino Bresciani-Turroni'],1953,['Currency question'],N/A,N/A,N/A,en
Investigations in Currency and Finance,['William Stanley Jevons'],1909,['Bimetallism'],N/A,N/A,N/A,en
Harvesting Gold,['David L. Hammes'],2012-03,['Federal Reserve banks'],"The untold story of how Thomas Edison, America's most celebrated inventor, tried to create an entirely new system of U.S. currency as a way of addressing social problems and stabilizing his nation's economy. Written and researched by economist David L. Hammes, this fascinating account draws on previously unpublished material from the Edison archives, including correspondence between the inventor and the foremost economic theorists and businessmen of his day. The appendix includes Edison's original proposal for reinvention of American money as well as relevant economic data.",N/A,N/A,en
The Guinness Book of Money,"['Leslie Dunkling', 'Adrian Room']",1990,['Business & Economics'],"A comprehensive reference book on the subject of money which includes a history and description of the various forms that money has taken - wood and metal, and slang names for money, coins and notes. The authors use tables, charts and diagrams to provide a wealth of information.",N/A,N/A,en
"American Treasure and the Price Revolution in Spain, 1501-1650",['Earl Jefferson Hamilton'],1934-02-05,[],N/A,N/A,N/A,en
A History of Gold and Money,['Pierre Vilar'],2011,['Gold'],"“A work of sweeping scholarship, it is impressive and welcome in English.”-The Economist",N/A,N/A,en
Denationalisation of Money,['Friedrich August Hayek'],1990,['Business & Economics'],"In this groundbreaking work, first published in 1976, Friedrich von Hayek argues that the government monopoly of money must be abolished to stop recurring bouts of inflation and deflation. Abolition is also the cure for the more deep-seated disease of the recurring waves of depression and unemployment attributed to 'capitalism'.",N/A,N/A,en
Warman's Coins & Paper Money,['Allen G. Berman'],1999-08,['Antiques & Collectibles'],"The best reference available for beginning coin collectors has been completely revamped and improved. Anyone with an interest in coins or paper money will appreciate the helpful, comprehensive and easy-to-follow format of this book -- the hobby's best introductory volume.",N/A,N/A,en
"Money, Credit & Commerce",['Alfred Marshall'],1923,['Banks and banking'],"Supplements the author's ""Principles of economics"" and ""Industry and trade."" cf. Pref. Includes bibliographical references and index. Master negative: 2000-10095-6. No. 6 on a reel of 8 titles.",N/A,N/A,en
Indian Currency and Finance,['John Maynard Keynes'],1913,['Banks and banking'],N/A,N/A,N/A,en
"Theory of Money and Credit, The",['Ludwig Von Mises'],2009,['Economics'],N/A,N/A,N/A,en
The Value of Money,['B. M.. Anderson'],1922,['Money'],N/A,N/A,N/A,en
Some Thoughts Concerning Education,['John Locke'],1984,['Education'],N/A,N/A,N/A,en
Monetary Theory and Public Policy,['Kenneth K. Kurihara'],1951,['Currency question'],N/A,N/A,N/A,en
The Wisdom of Money,['Pascal Bruckner'],2017-05-02,['Business & Economics'],"Money is an evil that does good, and a good that does evil. It is wise to have money, says Pascal Bruckner, and wise to think and talk about it critically. One of the world’s great essayists guides us through the commentary that money has generated since ancient times, as he builds an unfashionable defense of the worldly wisdom of the bourgeoisie.",N/A,N/A,en
The Pure Theory of Money,['John M. Keynes'],1976,[],N/A,N/A,N/A,en
The Little Money Book,['David Boyle'],2003,['Money'],N/A,N/A,N/A,en
An Outline of Money,['Geoffrey Crowther'],1940,['Foreign exchange'],N/A,N/A,N/A,en
The Essence Of Law Of Success (With Cd),['Napoleon Hill'],2009-01-01,[],"Collector s Edition Includes LAW OF SUCCESS AudiobookLAW OF SUCCESS is the most comprehensive guide to achieving success. This condensed version of Napoleon Hill s classic will help you achieve dreams and personal success you may never have thought possible. Discover the incredible amount of useful information brought together for you in this one magnificent CD.This book presents, in a greatly condensed form, the entire seventeen factors out of which the Law of Success philosophy was evolved. This philosophy represents all that the most successful men who ever lived have learned about the achievement of success in practically every sort of human endeavor. Its compilation has cost a fortune, to say nothing of the better part of a lifetime of effort upon the part of the author.",N/A,N/A,en
Exchange Rates and International Finance,['Laurence S. Copeland'],2005,['Business & Economics'],"Exchange rates and exchange rate fluctuation continue to play an increasingly important role in all our lives. Exchange Rates and International Finance fourth edition provides a clear and concise guide to the causes and consequences of exchange rate fluctuations, enabling you to grasp the essentials of the theory and its relevance to major events in currency markets. The orientation of the book is towards exchange rate determination with particular emphasis given to the contributions of modern finance theory. Both fixed and floating exchange rate models and empirical results are explored and discussed. KEY FEATURES A clear, non-technical explanation of the issues, emphasising intuitive understanding and interpretation of economic arguments rather than mathematical proofs. A balanced summary of the state of our knowledge in this area, including explanations of the problems faced by researchers in this field, and an indication of what questions remain open. Provides a sound overview of empirical evidence, without going into intricate detail: a springboard for those wishing to delve deeper into the published literature. Early chapters explain the basics of demand and supply, and basic macroeconomics, so those without prior study in economics will find the subject accessible. Covers leading edge material including the latest general equilibrium approaches. NEW TO THIS EDITION Thoroughly updated to reflect recent events on the world monetary/financial scene. More included on recent empirical results. New chapter on general equilibrium models to cover the latest thinking on more advanced techniques. Expanded and up-to-date coverage of the Euro. Extended coverage of recent innovations on the Law of One Price and Purchasing Power Parity. New section on the relationship between PPP, UIRP and the Fisher equation. Suitable for those following a course on international macroeconomics, international finance, or international money as a part of an economics or business programme at undergraduate, MBA or specialist Masters levels. Laurence Copeland is Professor of Finance at Cardiff University, UK.",N/A,N/A,en
You Shall Know Our Velocity,['Dave Eggers'],2004,['Fiction'],"Will and Hand are burdened by $38,000 and the memory of their friend Jack. Taking a week out of their lives, they decide to travel around the world to give the money away. They can't really say why they're doing it, just that it needs to be done. Perhaps it's something to do with Jack's death - perhaps they'll find the reason later. But as their plans are frustrated, twisted and altered at every step and the natives prove far from grateful to their benefactors, Will and Hand find that the world is an infinitely bigger, more surreal and exhilarating place than they ever realised. In fact, it's somewhere to get lost in ...",N/A,N/A,en
International Monetary Conferences,['Henry Benajah Russell'],1898,['Currency question'],N/A,N/A,N/A,en
The Origins of Value,"['William N. Goetzmann', 'K. Geert Rouwenhorst']",2023,['Capital market'],This collection of essays traces the history of finance and financial instruments from the earliest Mesopotamiam clay loan tablets to the development of global financial securities. The book is fully illustrated with images chosen by contributing scholars.,N/A,N/A,en
"The General Theory of Employment, Interest and Money",['John Maynard Keynes'],2013-09-28,['Economics'],"The General Theory of Employment, Interest and Money The ""Keynesian Revolution"" Complete EditionBy John Maynard Keynes The General Theory of Employment, Interest and Money was written by the English economist John Maynard Keynes. The book, generally considered to be his magnum opus, is largely credited with creating the terminology and shape of modern macroeconomics. Published in February 1936, it sought to bring about a revolution, commonly referred to as the ""Keynesian Revolution"", in the way economists thought - especially in relation to the proposition that a market economy tends naturally to restore itself to full employment after temporary shocks. Regarded widely as the cornerstone of Keynesian thought, the book challenged the established classical economics and introduced important concepts such as the consumption function, the multiplier, the marginal efficiency of capital, the principle of effective demand and liquidity preference. The central argument of The General Theory is that the level of employment is determined, not by the price of labour as in neoclassical economics, but by the spending of money (aggregate demand). Keynes argues that it is wrong to assume that competitive markets will, in the long run, deliver full employment or that full employment is the natural, self-righting, equilibrium state of a monetary economy. On the contrary, under-employment and under-investment are likely to be the natural state unless active measures are taken. One implication of The General Theory is that a lack of competition is not the fundamental problem and measures to reduce unemployment by cutting wages or benefits are not only hard-hearted but ultimately futile.",N/A,N/A,en
Money in a Free Society,['Tim Congdon'],2011,['Business & Economics'],"""Money in a Free Society"" contains 18 provocative essays from Congdon, an influential economic adviser to the Thatcher government in the U.K. and one of the world's leading monetary commentators. He calls for a return to stable money growth and sound public finances, and argues that these remain the best answers to the problems facing modern capitalism.",N/A,N/A,en
How Much is that in Real Money?,"['John J. McCusker', 'American Antiquarian Society']",1996,['Consumer price indexes'],This information updates John J. McCusker's 1992 book with the same title.,N/A,N/A,en
"Money, Method, and the Market Process",['Ludwig Von Mises'],1990-07-31,['Business & Economics'],"This volume might be called the Mises Reader, for it contains a wide sampling of his academic essays on money, trade, and economic systems. Some of them, like ""Observations on the Cooperative Movement,"" have not been published previously. Others, like ""The Idea of Liberty Is Western,"" have already made their mark on intellectual history. Brought together by Mrs. Mises after her husband's death, and edited with an introduction by Richard Ebeling, this volume fills an important gap in providing an overview of Ludwig von Mises's best academic work. For that reason, this book is already widely used in graduate courses and seminars on the resurgence of the Austrian School.",N/A,N/A,en
Fountain of Fortune,['Richard Von Glahn'],1996,['Business & Economics'],"In this study, the first of its kind in English, Richard von Glahn offers a definitive analysis of the economic, political, and social history of money and monetary policy during the Song, Yuan, Ming, and early Qing dynasties. Von Glahn departs from previously held ideas about the effects of money and international trade in bullion on the rise and decline of dynastic power in China. His study also links Chinese monetary history to changing trends in money-use and trade in gold and silver in Asia, Europe, and the Western Hemisphere. He argues that China's shift to a silver economy had a decisive influence not only on the growth of a market economy in China but also on the formation of a global economy in the early modern era. Exhaustively researched from archival sources, Fountain of Fortune examines critically the many facets of China's domestic and foreign monetary policy, including the foundations of Chinese monetary theory.",N/A,N/A,en
A History of Money,['Glyn Davies'],2002,['Business & Economics'],"A new updated edition of a detailed, scholary analysis of the development and role of money in many of the world's nations from ancient to modern times. First published in 1996.",5,N/A,en
Buy It! History of Money,['Debra J. Housel'],2012-01-30,['Juvenile Nonfiction'],"A history of currency explores its invention, how paying for objects has changed over time, and different types of coins and paper money from around the world.",N/A,N/A,en
A Tract on Monetary Reform,['John Maynard Keynes'],1929,['Currency question'],N/A,N/A,N/A,en
The Collected Writings of John Maynard Keynes,['John Maynard Keynes'],1979,['Economics'],N/A,N/A,N/A,en
Coined,['Kabir Sehgal'],2015,['Money'],"Money isn't just coins, bank notes or clamshells; it is more than a store of value or unit of payment. It's an idea, a transformative player in how we view, cope, and harmonise with the world. Like it or not, money is a measure of status, well-being, and our chances to survive and thrive. Money isn't just what makes the world go around; it is largely what makes each of us go around. In Coined, Kabir Sehgal travels the world while presenting a multidimensional portrait of currency through the ages. He explores the origin of exchange in the Galapagos Islands, searches for hoards of coins from an ancient civilization in Bangladesh, and learns about the art that appears on money from coin collectors in Vietnam. He takes you from the vaults beneath the Federal Reserve in New York to a beehive where pollen can be understood as a natural form of exchange. He details the birth of money, to its place in our culture both past and present, to how the obsession for it can lead to death and destruction, all the while mixing engaging and entertaining stories from the front lines of global currency exchange with extensive, thoughtful research.The story of money is rich and varied because it is our story.",N/A,N/A,en
Gold and the Gold Standard,['Edwin Walter Kemmerer'],1944,['Gold'],"""Selected bibliography"" at end of each chapter.",N/A,N/A,en
The Currency of Politics,['Stefan Eich'],2023-08-22,['Business & Economics'],"In the wake of the 2008 financial crisis, critical attention has shifted from the economy to the most fundamental feature of all market economies - money. Yet despite the centrality of political struggles over money, it remains difficult to articulate its democratic possibilities and limits. 'The Currency of Politics' takes readers from ancient Greece to today to provide an intellectual history of money, drawing on the insights of key political philosophers to show how money is not just a medium of exchange but also a central institution of political rule. Money appears to be beyond the reach of democratic politics, but this appearance - like so much about money - is deceptive. Even when the politics of money is impossible to ignore, its proper democratic role can be difficult to discern.",N/A,N/A,en
How Much is that in Real Money?,['John J. McCusker'],1992,['Antiques & Collectibles'],"Includes prices for the United States from 1700-1991, for Great Britain from 1600-1991, and American Revolutionary War currency depreciation tables.",N/A,N/A,en
The Richest Man in Babylon,['George S Clason'],2018,[],"The Richest Man in Babylon' is considered as the greatest of all inspirational works on the subject of thrift, financial planning, and personal wealth. Revealed inside are the secrets to acquiring money, keeping money, and making money earn more money. Providing financial wisdom through parables, 'The Richest Man in Babylon' was originally a set of pamphlets, written by the author and distributed by banks and insurance companies. These pamphlets were later bundled together, giving birth to a book. In this new rendering by Charles Conrad, the classic tale is retold in clear, simple language for today's readers. These fascinating and informative stories set you on a sure path to prosperity and its accompanying joys. ABOUT THE AUTHOR: George Samuel Clason was born in Louisiana, Missouri, on November 7, 1874. He attended the University of Nebraska and served in the United States Army during the Spanish-American War. Beginning a long career in publishing, he founded the Clason Map Company of Denver, Colorado, and published the first road atlas of the United States and Canada. In 1926, he issued the first of a famous series of pamphlets on thrift and financial success, using parables set in ancient Babylon to make each of his points. These were distributed in large quantities by banks and insurance companies and became familiar to millions, the most famous being 'The Richest Man in Babylon', the parable from which the present volume takes its title. These 'Babylonian parables' have become a modern inspirational classic.",N/A,N/A,en
Essays in Monetary Economics,['Harry Gordon Johnson'],1969,['Business & Economics'],N/A,N/A,N/A,en
Single & single,['John Le Carré'],1999,['England'],"Un abogado de la prestigiosa asesoría financiera británica Single & Single, experto en paraísos fiscales, muere asesinado en la costa turca de un tiro en la cabeza. Su muerte tiene todos los integrantes de una ejecución, un castigo ejemplar. Por esas mismas fechas, Oliver, un animador de fiestas infantiles, es conducido a un banco de un pueblo de Devon a media noche para que justifique el repentino ingreso de una exhorbitante suma en su exigua cuenta. Por otra parte, un carguero ruso es abordado y detenido por la policía en el mar Negro, y un famoso financiero de aduanas. Brock, investiga un caso de corrupción internacional... La conexión secreta de todos estos hechos constituye el nudo gordiano de esta extraordinaria novela de John Le Carré, sin duda uno de los grandes maestros del espionaje.",N/A,N/A,es
