title,authors,publishedDate,categories,description,averageRating,textSnippet,language
The Future of Money,['Benjamin J. Cohen'],2004,['Business & Economics'],"This book is a thoughtful, amply documented reflection on the future of currency. The dollar, euro and yen dominate the global monetary order, with the dollar now unrivaled at the top and unlikely to be threatened in the future. The countries that issue lesser currencies face a trade-off between monetary sovereignty and international acceptability (with all its economic advantages). Some economists say these lesser currencies should simply dollarize, that is, sacrifice their monetary sovereignty on the altar of international economic efficiency by adopting a stronger currency as their own. Author Benjamin J. Cohen argues that these countries are likely to reject dollarization because the emotional and political advantages of issuing one's own currency are simply too strong. He suggests various alternate mechanisms that allow countries to maintain some monetary independence and authority while gaining the advantages of a fully liquid, widely used currency. Non-specialists may find his extensive discussions a bit dry or sometimes tedious, but getAbstract.com applauds the author's ability to explore monetary economics in admirably lucid detail.",5,N/A,en
Money and the Mechanism of Exchange,['William Stanley Jevons'],1882,['Exchange'],N/A,N/A,N/A,en
The Demand for Money,['David E. W. Laidler'],1977,['Business & Economics'],N/A,N/A,N/A,en
Marginal Gains,['Jane I. Guyer'],2004-03,['Business & Economics'],"In America, almost all the money in circulation passes through financial institutions every day. But in Nigeria's ""cash and carry"" system, 90 percent of the currency never comes back to a bank after it's issued. What happens when two such radically different economies meet and mingle, as they have for centuries in Atlantic Africa? The answer is a rich diversity of economic practices responsive to both local and global circumstances. In Marginal Gains, Jane I. Guyer explores and explains these often bewildering practices, including trade with coastal capitalism and across indigenous currency zones, and within the modern popular economy. Drawing on a wide range of evidence, Guyer demonstrates that the region shares a coherent, if loosely knit, commercial culture. She shows how that culture actually works in daily practice, addressing both its differing scales of value and the many settings in which it operates, from crisis conditions to ordinary household budgets. The result is a landmark study that reveals not just how popular economic systems work in Africa, but possibly elsewhere in the Third World.",N/A,N/A,en
An Inquiry Into the Nature and Causes of the Wealth of Nations,['Adam Smith'],1811,['Economics'],N/A,N/A,N/A,en
The Archaeology of the Roman Economy,['Kevin Greene'],1986,['Business & Economics'],Kevin Greene shows how archaeology can help provide a more balanced view of the Roman economy by informing the classical historian about geographical areas and classes of society that received little attention from the largely aristocratic classical writers whose work survives.,N/A,N/A,en
The Theory of Money and Credit,['Ludwig Von Mises'],1953,['Credit'],N/A,5,N/A,en
Making Money,['Terry Pratchett'],2007-09-18,['Fiction'],"The Ankh-Morpork Post Office is running like . . . well, not at all like a government office. The mail is delivered promptly; meetings start and end on time; five out of six letters relegated to the Blind Letter Office ultimately wend their way to the correct addresses. Postmaster General Moist von Lipwig, former arch-swindler and confidence man, has exceeded all expectations—including his own. So it's somewhat disconcerting when Lord Vetinari summons Moist to the palace and asks, ""Tell me, Mr. Lipwig, would you like to make some real money?"" Vetinari isn't talking about wages, of course. He's referring, rather, to the Royal Mint of Ankh-Morpork, a venerable institution that haas run for centuries on the hereditary employment of the Men of the Sheds and their loyal outworkers, who do make money in their spare time. Unfortunately, it costs more than a penny to make a penny, so the whole process seems somewhat counterintuitive. Next door, at the Royal Bank, the Glooper, an ""analogy machine,"" has scientifically established that one never has quite as much money at the end of the week as one thinks one should, and the bank's chairman, one elderly Topsy (née Turvy) Lavish, keeps two loaded crossbows at her desk. Oh, and the chief clerk is probably a vampire. But before Moist has time to fully consider Vetinari's question, fate answers it for him. Now he's not only making money, but enemies too; he's got to spring a prisoner from jail, break into his own bank vault, stop the new manager from licking his face, and, above all, find out where all the gold has gone—otherwise, his life in banking, while very exciting, is going to be really, really short. . . .",N/A,N/A,en
The Theory of Money and Banks Investigated,['George Tucker'],1839,['Business & Economics'],N/A,N/A,N/A,en
Money and the Mechanism of Exchange,['William Stanley Jevons'],1920,['Exchange'],N/A,N/A,N/A,en
The Big Problem of Small Change,"['Thomas J. Sargent', 'François R. Velde']",2003-11-23,['Antiques & Collectibles'],This text offers an explanation of how a problem that dogged monetary authorities for hundreds of years was finally solved. It amounts to a history of how commodity money (money literally worth its weight in gold) became fiat money (money not literally equal to the value claimed for it).,N/A,N/A,en
The Count of Monte Cristo,['Alexandre Dumas'],1993,['Juvenile Fiction'],A young sailor returns home from a dangerous voyage when an act of jealous treachery changes his life forever.,N/A,N/A,en
"Origins of Money, The",['Carl Menger'],2009,['Finance'],N/A,5,N/A,en
Lombard Street,['Walter Bagehot'],1882,['Banks and banking'],N/A,N/A,N/A,en
Lombard Street,['Walter Bagehot'],1873,['Banks and banking'],N/A,N/A,N/A,en
"The History of Currency, 1252 to 1894",['William Arthur Shaw'],1896,['Money'],N/A,N/A,N/A,en
Exorbitant Privilege,['Barry Eichengreen'],2011-01-07,['Business & Economics'],"For more than half a century, the U.S. dollar has been not just America's currency but the world's. It is used globally by importers, exporters, investors, governments and central banks alike. Nearly three-quarters of all $100 bills circulate outside the United States. The dollar holdings of the Chinese government alone come to more than $1,000 per Chinese resident.This dependence on dollars, by banks, corporations and governments around the world, is a source of strength for the United States. It is, as a critic of U.S. policies once put it, America's ""exorbitant privilege."" However, recent events have raised concerns that this soon may be a privilege lost. Among these have been the effects of the financial crisis and the Great Recession: high unemployment, record federal deficits, and financial distress. In addition there is the rise of challengers like the euro and China's renminbi. Some say that the dollar may soon cease to be the world's standard currency--which would depress American living standards and weaken the country's international influence.In Exorbitant Privilege, one of our foremost economists, Barry Eichengreen, traces the rise of the dollar to international prominence over the course of the 20th century. He shows how the greenback dominated internationally in the second half of the century for the same reasons--and in the same way--that the United States dominated the global economy. But now, with the rise of China, India, Brazil and other emerging economies, America no longer towers over the global economy. It follows, Eichengreen argues, that the dollar will not be as dominant. But this does not mean that the coming changes will necessarily be sudden and dire--or that the dollar is doomed to lose its international status. Challenging the presumption that there is room for only one true global currency--either the dollar or something else--Eichengreen shows that several currencies have shared this international role over long periods. What was true in the distant past will be true, once again, in the not-too-distant future.The dollar will lose its international currency status, Eichengreen warns, only if the United States repeats the mistakes that led to the financial crisis and only if it fails to put its fiscal and financial house in order. The greenback's fate hinges, in other words, not on the actions of the Chinese government but on economic policy decisions here in the United States.Incisive, challenging and iconoclastic, Exorbitant Privilege, which was shortlisted for the FT Goldman Sachs 2011 Best Business Book of the Year, is a fascinating analysis of the changes that lie ahead. It is a challenge, equally, to those who warn that the dollar is doomed and to those who regard its continuing dominance as inevitable.",N/A,N/A,en
"Some Considerations of the Consequences of the Lowering of Interest, and Raising the Value of Money",['John Locke'],1692,['Coinage'],N/A,N/A,N/A,en
Lombard Street,['Walter Bagehot'],2011-12-29,['Business & Economics'],"Published in 1873, this is Bagehot's masterpiece on financial crisis management, described by J. M. Keynes as 'an undying classic'.",N/A,N/A,en
Power and Money,['Ernest Mandel'],1992-06-17,['Business & Economics'],"Analyses of bureaucratic power and privilege have an academic pedigree but have also long preoccupied socialists. The collapse of communist rule in the Soviet Union and Eastern Europe puts to a new test the classical theories concerning the relationship between bureaucracy and class. Power and Money is a timely contribution to this renewal of theory, exploring the social and historical roots of bureaucracy, both within the capitalist state and in workers’ mass organizations. Ernest Mandel draws on archival and contemporary accounts in an analysis of both capitalist administration and the ideology and practice of bureaucratic dictatorship in the communist bloc. He measures the actual performance of western and eastern societies against the forecasts of Lenin and Trotsky, Ludwig von Mises and Roberto Michels, or the more recent reflections of Amitai Etzioni and Alvin Gouldner. This lucid study challenges those theories—Stalinist, Weberian or social-democratic—which claim that an autonomous officialdom is a necessary feature of modern societies. It also furnishes a perceptive account of the specific dynamics of communist and post-communist society.",N/A,N/A,en
Studies in the Byzantine Monetary Economy C.300-1450,['Michael F. Hendy'],2008-10-30,['Antiques & Collectibles'],"This is a major study of the Byzantine coinage set in the wider context of finance, administration and economy. The book consists of four main sections, on economy and society, on finance, and on the circulation and production of coinage, and has made an unrivalled contribution in the field of late classical, Byzantine and medieval economic history.",N/A,N/A,en
"The General Theory of Employment, Interest and Money",['John Maynard Keynes'],1961,['Economics'],N/A,N/A,N/A,en
"The History of Currency, 1252 to 1894",['William Arthur Shaw'],1896,['Money'],N/A,N/A,N/A,en
My Rows and Piles of Coins,['Tololwa Marti Mollel'],1999,['Juvenile Nonfiction'],"A Tanzanian boy saves his coins to buy a bicycle so that he can help his parents carry goods to market, but then he discovers that in spite of all he has saved, he still does not have enough money.",4,N/A,en
The Ascent of Money,['Niall Ferguson'],2008,['Business & Economics'],"Ferguson tells the human story behind the evolution of money, from its origins in ancient Mesopotamia to the latest Wall Street upheavals. The author shows that finance is, in fact, the foundation of human progress.",3.5,N/A,en
Studies on Anglo-Saxon Institutions,['Hector Munro Chadwick'],1905,['Anglo-Saxons'],N/A,N/A,N/A,en
The Foreign Exchange Matrix,"['Barbara Rockefeller', 'Vicki Schmelzer']",2013-02-11,['Business & Economics'],"""The Foreign Exchange Matrix"" is the go-to book for sophisticated financial market professionals seeking a deeper understanding of the world of foreign exchange--written by experienced insiders. The book aims to cut through the clutter and present a concise and definitive picture of the market that is not only true, but also useful.",5,N/A,en
An Outline of Money,['Sir Geoffrey Crowther'],1949,['Foreign exchange'],N/A,N/A,N/A,en
Serious Money,['Caryl Churchill'],1987,['Drama'],"With full commentary, notes, and a chronology of the writer's life and work.",N/A,N/A,en
The Golden Age of the Quantity Theory,['David E. W. Laidler'],1991,['Business & Economics'],N/A,N/A,N/A,en
The Purchasing Power of Money,['Irving Fisher'],1963,['Purchasing power'],N/A,N/A,N/A,en
Essays on Political Economy,['Frédéric Bastiat'],1872,['Capital'],N/A,N/A,N/A,en
Denationalisation of Money,['Friedrich A. von Hayek'],1976,['Money'],N/A,5,N/A,en
The Beginnings of Commercial and Financial Journalism,"['John J. McCusker', 'Cora Gravesteijn']",1991,['Language Arts & Disciplines'],N/A,N/A,N/A,en
Currency and Coercion,['Jonathan Kirshner'],1997-04-06,['Business & Economics'],"Kirshner thus succeeds in developing a general framework for the analysis of an important yet neglected form of state power that is likely to be of increasing importance in the post-Cold War era. Although some distinguished scholars have touched on the issue of monetary power, there has been until now no standard text on the subject.",N/A,N/A,en
The Psychology of Money,['Morgan Housel'],2021-03-02,['Business & Economics'],"Doing well with money isn't necessarily about what you know. It's about how you behave. In The Psychology of Money, author Morgan Housel shares 19 short stories exploring the strange ways people think about money and teaches how to make better sense of one of life's most important topics.",N/A,N/A,en
Changing Values in Medieval Scotland,"['Elizabeth Gemmill', 'Nicholas Mayhew']",1995-06,['Business & Economics'],"This is a full-scale study of prices in medieval Scotland, c. 1260-1542, which includes detailed discussions of coinage, and weights and measures. Nearly 6000 prices are listed individually, average prices are calculated for each commodity, and for groups of commodities such as cereals and livestock. Scots prices are compared with English, and the significance of the data for the economic history of medieval Scotland is analyzed fully. This is the only full study to have been undertaken on Scots medieval prices, and there is no comparable work on Scottish medieval economic history in print.",N/A,N/A,en
The Richest Man In Babylon & The Magic Story,"['George S Clason', 'Frederick Van Rensselaer']",2018-11-19,[],"The Richest Man in Babylon, based on ""Babylonian parables"", has been hailed as the greatest of all inspirational works on the subject of thrift, financial planning, and personal wealth. In simple language, these fascinating and informative stories set you on a sure path to prosperity and its accompanying joys. A celebrated bestseller, it offers an understanding and a solution to your personal financial problem. Revealed inside are the secrets to acquiring money, keeping money, and making money earn more money. Gold Edition includes bonus material: The Magic Story by Frederick Van Dey. The Magic Story: My task is done. I have written the recipe for ""success."" If followed, it cannot fail. Wherein I may not be entirely comprehended, the plus-entity of whosoever reads will supply the deficiency; and upon that Better Self of mine, I place the burden of imparting to generations that are to come, the secret of this all-pervading good, - the secret of being what you have it within you to be. It is claimed that many who read or hear this story almost immediately begin to have good fortune - so it is worth a few minutes of your time to find out if it works for you?",N/A,N/A,en
Richest Man In Babylon - Original Edition,['George S Clason'],2015-08-01,['Business & Economics'],"The Richest Man in Babylon, based on ""Babylonian parables,"" has been hailed as the greatest of all inspirational works on the subject of thrift, financial planning, and personal wealth. In simple language, these fascinating and informative stories set you on a sure path to prosperity and its accompanying joys. A celebrated bestseller, it offers an understanding and a solution to your personal financial problem. Revealed inside are the secrets to acquiring money, keeping money, and making money earn more money.",N/A,N/A,en
A Treatise on Money,['John Maynard Keynes'],1958,['Banks and banking'],N/A,N/A,N/A,en
"American Treasure and the Price Revolution in Spain, 1501-1650",['Earl Jefferson Hamilton'],1965,['Business & Economics'],N/A,N/A,N/A,en
Secrets of the Millionaire Mind,['T. Harv Eker'],2007-01-02,['Business & Economics'],"Secrets of the Millionaire Mind reveals the missing link between wanting success and achieving it! Have you ever wondered why some people seem to get rich easily, while others are destined for a life of financial struggle? Is the difference found in their education, intelligence, skills, timing, work habits, contacts, luck, or their choice of jobs, businesses, or investments? The shocking answer is: None of the above! In his groundbreaking Secrets of the Millionaire Mind, T. Harv Eker states: Give me five minutes, and I can predict your financial future for the rest of your life! Eker does this by identifying your money and success blueprint. We all have a personal money blueprint ingrained in our subconscious minds, and it is this blueprint, more than anything, that will determine our financial lives. You can know everything about marketing, sales, negotiations, stocks, real estate, and the world of finance, but if your money blueprint is not set for a high level of success, you will never have a lot of money -- and if somehow you do, you will most likely lose it! The good news is that now you can actually reset your money blueprint to create natural and automatic success. Using the principles he teaches, T. Harv Eker went from zero to millionaire in only two and a half years. Eker is president of Peak Potentials Training, one of the fastest growing success training companies in North America. With his unique brand of street smarts with heart, Eker's humorous, cut-to-the-chase style keeps his audience spellbound. People come from all over the world to attend his sold-out seminars, where crowds often exceed 2,000 people for a weekend program. So far, Eker's teachings have touched the lives of more than a quarter million people. Now, for the first time, he shares his proven secrets of success in this revolutionary book. Read it and grow rich!",5,N/A,en
Currency and Credit,['Ralph George Hawtrey'],1930,['Credit'],N/A,N/A,N/A,en
The Origin of Metallic Currency and Weight Standards,['William Ridgeway'],1892,['Business & Economics'],N/A,N/A,N/A,en
A Treatise on Money and Essays on Monetary Problems,['Joseph Shield Nicholson'],1893,['Bimetallism'],N/A,N/A,N/A,en
Making Money,['Abby Jackson'],2004,['Juvenile Nonfiction'],"Text and photographs introduce the purpose of money, how old coins and paper money are disposed of, and how new money is made.",N/A,N/A,en
Happy Money,"['Elizabeth Dunn', 'Michael Norton']",2013-05-14,['Business & Economics'],Two rising stars in behavioral science explain how money can buy happiness--if five core principles of smarter spending are followed. It offers a tour of new research on the science of spending.,N/A,N/A,en
Money in Its Relations to Trade and Industry,['Francis Amasa Walker'],1880,['Economics'],N/A,N/A,N/A,en
Money,['David Kinley'],1904,['Money'],N/A,N/A,N/A,en
"History of Money and Banking in the United States: The Colonial Era to World War II, A",['Murray Newton Rothbard'],2002,['Banks and banking'],N/A,5,N/A,en
As Red as Blood,['Salla Simukka'],2014,['Art schools'],"In the midst of the freezing Arctic winter, seventeen-year-old Lumikki Andersson walks into her school's darkroom and finds a stash of money splattered with someone's blood. She is swept into a whirlpool of dangerous encounters with dirty cops and a notorious drug kingpin as she helps to trace the origin of the cash.",N/A,N/A,en
Great Expectations,[],2016,['England'],"Young Pip is shocked when he meets an escaped convict in a lonely churchyard. It's a terrifying experience that changes his life forever. Helped by a mysterious benefactor, the orphan boy grows up to become a wealthy gentleman, yet memories of that day in the churchyard return to haunt him. The story of Pip's life and loves, set against the violent nineteenth century underworld, introduces some of Charles Dicken's most famous characters - the convict Magwitch, the tragic Miss Haversham, the kindly Mr. Joe, the pompous Uncle Pumblechook, the wily lawyer, Mr. Jaggers, and the murderous Orlick.",N/A,N/A,en
Richest Man in Babylon,['George Samuel Clason'],2007-01-01,['Business & Economics'],Inspirational book on the subject of thrift and financial planning.,N/A,N/A,en
The Trade and Administration of China,['Hosea Ballou Morse'],1913,['China'],N/A,N/A,N/A,en
The History of Money,['Jack Weatherford'],1997,['Business & Economics'],"Traces the historical evolution of humankind's relationship with money, from ancient times to the present-day revolutionary transformation in the meaning and use of money as represented by the electronic cash card, and discusses the implications of such changes.",5,N/A,en
Lombard Street,['Walter Bagehot'],1927,['Banks and banking'],N/A,N/A,N/A,en
The Principles of Economic Planning,['William Arthur Lewis'],1969,['Business & Economics'],N/A,N/A,N/A,en
Monetary Economics,"['David G. Pierce', 'Peter J. Tysome']",1985,['Business & Economics'],"Monetary Economics: Theories, Evidence and Policy, Second Edition provides basic introduction to various aspects of monetary economics.",N/A,N/A,en
Mastering Bitcoin,['Andreas M. Antonopoulos'],2014-09-15,['Business & Economics'],"Want to join the technological revolution that’s taking the world of finance by storm? Mastering Bitcoin is your guide through the seemingly complex world of bitcoin, providing the requisite knowledge to help you participate in the internet of money. Whether you’re building the next killer app, investing in a startup, or simply curious about the technology, this practical book is essential reading. Bitcoin, the first successful decentralized digital currency, is still in its infancy and it’s already spawned a multi-billion dollar global economy. This economy is open to anyone with the knowledge and passion to participate. Mastering Bitcoin provides you with the knowledge you need (passion not included). This book includes: A broad introduction to bitcoin—ideal for non-technical users, investors, and business executives An explanation of the technical foundations of bitcoin and cryptographic currencies for developers, engineers, and software and systems architects Details of the bitcoin decentralized network, peer-to-peer architecture, transaction lifecycle, and security principles Offshoots of the bitcoin and blockchain inventions, including alternative chains, currencies, and applications User stories, analogies, examples, and code snippets illustrating key technical concepts",N/A,N/A,en
Modern Money and Banking,"['Roger LeRoy Miller', 'Robert W. Pulsinelli']",1989,['Business & Economics'],"Deals with financial institutions, financial markets, interest rates; the banking industry; central banking; monetary theory; stabilization policy; international finance.",N/A,N/A,en
"Treatise on Money, V1",['John Maynard Keynes'],2013-10,[],This is a new release of the original 1930 edition.,N/A,N/A,en
Lombard Street,['Walter Bagehot'],1906,['Banks and banking'],N/A,N/A,N/A,en
Understanding Modern Money Theory,['L. Randall Wray'],2025-05-16,['Business & Economics'],"In this illuminating book, Randall Wray explores the origins, nature, and evolution of money, emphasizing the critical role played by both credit and state money in capitalism. Integrating and updating the influential theories presented in Wray's previous books, Money and Credit in Capitalist Economies and Understanding Modern Money, this new book addresses key questions in modern economic theory and policy. Wray adopts the monetary theory of production shared by the three principle heterodox traditions, Marxism, Institutionalism and Keynesianism to highlight the role played by money in the capitalist system. He applies Keynes's liquidity preference theory and Marx's labor theory of value to examine the determinants of the value of money and uncover the systemic properties driving capitalist production. He provides insights into the vital role of the state in the development and regulation of the modern monetary system. Finally, he identifies how monetary and fiscal policy can be improved to mitigate future challenges and promote economic, social and environmental sustainability. Students and scholars of heterodox approaches to economic theory, the endogenous approach to money and banking, and fiscal and monetary policy will greatly benefit from this valuable book. It is also a vital resource for academics studying the social sciences, such as sociology, political science and anthropology.",N/A,N/A,en
Bimetallism,['Angela Redish'],2000-08-28,['Business & Economics'],"A history of Western monetary systems and their preference to the bimetallism before 1800, first published in 2000.",N/A,N/A,en
