title,authors,publishedDate,categories,description,averageRating,textSnippet,language
Argonauts of the Western Pacific,['Bronislaw Malinowski'],1961,['Business & Economics'],"Bronislaw Malinowski, one of the all-time great anthropologists of the world, had a talent for bringing together in single comprehension the warm reality of human living with the cool abstractions of science. His pages have become an almost indispensable link between the knowing of exotic and remote people with theoretical knowledge about humankind. This volume¿originally published in 1922¿can be considered the founding document of economic anthropology, and remains the best one to read. It emphasizes the great significance of primitive economics by singling out the notable exchange system of the Trobriand Islands for special consideration. Although the main theme is economic, constant reference is made in this milestone of anthropological research and interpretation to social organization, life and meaning, the power of magic, and mythology and folklore.",N/A,N/A,en
Atlas of Afterlives,['Emily Hawkins'],2023-09-28,['Juvenile Nonfiction'],"An Atlas of Afterlives is a haunting and darkly intriguing take on world myth, giving readers a glimpse at what lies beyond.",N/A,N/A,en
Norse Myths,['Kevin Crossley-Holland'],2017-09-28,['Young Adult Fiction'],"Collects tales of Norse mythology featuring the powerful Odin, Thor and his hammer, Mjolnir, Loki, the final battle of Ragnarok, and power stuggles among the figures.",2,N/A,en
Usborne Greek Myths,['Heather Amery'],2024-09-03,['Juvenile Fiction'],"A pocket-sized collection of some of the best-known Greek myths, specially written for young children to enjoy. With vivid illustrations throughout to bring the stories of gods, monsters and mortals to life. Perfect for reading aloud, with a pronunciation guide at the back to help with Greek names.",N/A,N/A,en
Odin Vs. Ares,['Lydia Lukidis'],2023-08,['Juvenile Nonfiction'],"""Which of these gods of war is more powerful? Who has more abilities? Will Odin or Ares be the one to come out on top? Let the battle begin!""--",N/A,N/A,en
Old Indian Legends,['Zitkala-Sa'],2022-08-30,['Social Science'],"LARGE PRINT EDITION. In the mythology of the Lakota and other Oceti Sakowin peoples, Iktomi is a spider-trickster spirit and cultural hero. In the vast wilderness of the American Midwest, Iktomi experiences a series of humorous and instructive trials that illuminate humanity's relationship with nature. In Old Indian Legends, Zitkála-Sá uses her voice and expansive traditional knowledge to elevate the stories of her people.",N/A,N/A,en
The World of Italian Folk Magic,['Rose Inserra'],2024-09-03,"['Body, Mind & Spirit']","Ancient magical practices to integrate into everyday life. Drawing on her Italian strega (witch) heritage, Rose Inserra's guide to the folk magic of this ancient culture is a treasure trove of Italian folklore, customs, magic and healing practices that will simplify your life and declutter your mind and heart. These practices fulfill the most basic needs of life: warmth, nourishment and connection to the magical and the spiritual. Discover unique Italian witchcraft such as spells, charms and curse removal and learn how to make divination tools, protective amulets and invocations. You'll also find kitchen and herbal witchery with natural remedies to create, spells for love and potions, and recipes for food, wine and even beauty. Delve into Italian spiritual practices and learn about dreams, divination and working with your ancestors, saints and angels, deities, fairies and nature spirits. Brimming with history, culture, remedies, folklore, recipes and – most of all – magic, this book is for anyone fascinated by ancient magical practices with deep connections to nature and the environment – or who wants to discover their Italian heritage.",N/A,N/A,en
Old Indian Legends,['Zitkala-Sa'],2021-03-09,['Social Science'],"Old Indian Legends (1901) is a collection of traditional stories from Yankton Dakota writer Zitkála-Sá. Published while Zitkála-Sá was just beginning her career as an artist and activist, Old Indian Legends collects fourteen traditional legends and stories passed down through Sioux oral tradition. Intending to keep the stories or her people alive, Zitkála-Sá popularized and protected these cultural treasures for generations to come. In ""Iktomi and the Ducks,"" spider-trickster spirit Iktomi befriends a group of ducks by playing them music to dance to. Gaining their trust, he sends them into a dancing frenzy causing them to break their necks, after which he takes them to his teepee to cook a meal. When a tree branch snaps outside, distracting Iktomi, a pack of wolves moves in for a feast of their own. In ""Iktomi's Blanket,"" a starving Iktomi prays to Inyan for a blessing of food. Stumbling across a deer carcass, he believes his prayers have been answered and prepares a fire to roast the deer meat over. Feeling a chill, however, he goes to his teepee for a blanket, leaving the fire unattended. Throughout her collection, Zitkála-Sá faithfully and respectfully retells the stories of her people. Old Indian Legends is a charming compilation from one of the leading American Indian writers of her generation, a committed activist and true voice for change who saw through her own eyes the lives and experiences of countless others. With a beautifully designed cover and professionally typeset manuscript, this edition of Zitkála-Sá's Old Indian Legends is a classic of American Indian literature reimagined for modern readers.",N/A,N/A,en
Norse Mythology,['Neil Gaiman'],2024-11-12,['Fiction'],"The #1 New York Times bestseller--a ""gripping, suspenseful"" (Washington Post) retelling of Norse myths--now with spectacular illustrations.",N/A,N/A,en
Race to the Sun,['Rebecca Roanhorse'],2021,['Juvenile Fiction'],"""Guided by her Navajo ancestors, seventh-grader Nizhoni Begay discovers she is descended from a holy woman and destined to become a monsterslayer, starting with the evil businessman who kidnapped her father. Includes glossary of Navajo terms""--Provided by publisher.",N/A,N/A,en
Hades Vs. Anubis,['Lydia Lukidis'],2023-08,['Juvenile Nonfiction'],"""Who's more powerful? Who has more abilities? Which of these gods of the dead will be the victor? They'll have to battle it out to see who wins!""--",N/A,N/A,en
"I See You, Mara!",['Josh Bartok'],2021-09-14,['Juvenile Fiction'],"""[A] tale from the Buddhist sutras told in the memorable and engaging rhyming verse in the tradition of Dr. Seuss and Shel Silverstein""--Provided by publisher.",N/A,N/A,en
The Trojan War,['Olivia E. Coolidge'],1980,['History'],"Retells legends of the heroes of the Trojan War, which began with Paris of Troy's abduction of Helen, wife of Menelaus, lord of Greece.",3.5,N/A,en
Norse Mythology,['Neil Gaiman'],2017,['Fiction'],"Neil Gaiman has long been inspired by ancient mythology in creating the fantastical realms of his fiction. Now he presents his fashioning of the primeval Norse myths into a novel, which begins with the genesis of the legendary nine worlds, delves into the exploits of the deities, dwarves, and giants, and culminates in Ragnarok, the twilight of the gods and the rebirth of a new time and people. Gaiman stays true to the myths while vividly recreating the characters -- the gods with their fiercely competitive natures, their susceptibility to being duped and to dupe others, and their tendency to let passion ignite their actions -- and making these long-ago myths breathe pungent life again.--",N/A,N/A,en
The Penguin Book of Myths and Legends of Ancient Egypt,['Joyce Tyldesley'],2011,['History'],"The civilization we know as Ancient Egypt stretched over three thousand years. What was life like for ancient Egyptians? What were their beliefs - and how different were they from ours? This title uses Egypt's narratives to create a panorama of its history, from the earliest settlers to the time of Cleopatra.",N/A,N/A,en
Arch-Conspirator,['Veronica Roth'],2023-02-21,['Fiction'],"""From dystopian visionary and bestselling phenomenon Veronica Roth comes a razor-sharp reimagining of Antigone. In Arch-Conspirator, Roth reaches back to the root of legend and delivers a world of tomorrow both timeless and unexpected. ""A gut punch of a story. Roth takes everything fragile about love, everything powerful about certain doom, and blooms with it. You'll be holding your breath until the very last word.""-Olivie Blake, New York Times bestselling author of The Atlas Six Outside the last city on Earth, the planet is a wasteland. Without the Archive, where the genes of the dead are stored, humanity will end. Passing into the Archive should be cause for celebration, but Antigone's parents were murdered, leaving her father's throne vacant. As her militant uncle Kreon rises to claim it, all Antigone feels is rage. When he welcomes her and her siblings into his mansion, Antigone sees it for what it really is: a gilded cage, where she is a captive as well as a guest. But her uncle will soon learn that no cage is unbreakable. And neither is he""--",N/A,N/A,en
Hel Vs. Persephone,['Lydia Lukidis'],2023-08,['Juvenile Nonfiction'],"""Which of these goddesses of the dead is more powerful? Who has more abilities? Hel and Persephone will have to fight it out to be the queen of the underworld!""--",N/A,N/A,en
Dictionary of Jewish Lore and Legend,['Alan Unterman'],1991,['Religion'],"Entries provide an introduction to the people, places, and objects important to Jewish history and tradition",N/A,N/A,en
Across the Rainbow Bridge: Stories of Norse Gods and Humans,['Kevin Crossley-Holland'],2021-12-07,['Juvenile Fiction'],"""Step back into a sweeping landscape of green glades and glaciers where dwarves, frost giants, and ghosts roam and where gods and goddesses work their magic for Middle Earth, sometimes crossing the great rainbow bridge to come to the aid of humans""--Amazon.",N/A,N/A,en
Philippine Folk-Tales,"['Clara Kern Bayliss', 'Laura Benedict']",2023-09-22,[],"Philippine Folk-Tales, a classical book, has been considered essential throughout the human history, and so that this work is never forgotten we at Alpha Editions have made efforts in its preservation by republishing this book in a modern format for present and future generations. This whole book has been reformatted, retyped and designed. These books are not made of scanned copies of their original work and hence the text is clear and readable.",N/A,N/A,en
Myth,['Kenneth McLeish'],1996,['Religion'],"Features over 2,500 entries detailing the origins and historical significance of individual myths and legends, as well as myth tradition from every continent",N/A,N/A,en
By Means of Performance,"['Richard Schechner', 'Willa Appel']",1995,[],"Essays by leading anthropologists for students of anthropology, theater, folklore, semiotics and performance studies.",N/A,N/A,en
Old Fool and the Corruption of Myth,['Adolf Guggenbühl-Craig'],1991,['Psychology'],With this book Guggenbühl-Craig relieves the old of having to be wise and the young of wisdom worship.,N/A,N/A,en
Goddesses and Heroines,['Jean Menzies'],2023-07-11,[],"A beautifully illustrated collection of profiles and stories of women from religion and myth, retold for children Discover the stories of goddesses and other powerful women shared throughout the ages in this beautifully illustrated compendium for children. With profiles of over 80 goddesses, heroines, and legendary women featured, this is a must-have introduction to the key female figures from cultures all over the world. More than 30 beloved stories are retold by award-winning author Jean Menzies, with striking illustrations bringing the tales to life. Find out how Japanese goddess of the dawn Ame-no-Uzume saved the day by dancing; how ancient Greek witch Medea helped defeat a dragon; and how legendary Celtic warrior Scáthach trained the hero Cú Chulainn to fight. In addition, the reference section is packed with extra information, including a pronunciation guide. Goddesses and Heroines is the ideal gift, with foil on the cover and stunning illustrations throughout. Children will love exploring the tales by themselves or as bedtime stories.",N/A,N/A,en
Queer Heroes of Myth and Legend,['Dan Jones'],2023-01-12,[],"Featuring 50 profiles and select B&W illustrated portraits, Queer Heroes of Myth & Legend is a celebration of gay gods and goddesses, sapphic sirens, misunderstood mermen, lesbians of legend and transgender trailblazers.[Bokinfo].",N/A,N/A,en
Tales of Brave and Brilliant Girls from the Greek Myths,"['Rosie Dickins', 'Susanna Davidson']",2023-06-21,[],"Tales of Brave and Brilliant Girls from the Greek Myths celebrates heroines from Circe to Psyche, from Athena to Artemis, re-telling their stories to inspire and empower a new generation of readers. Watch as Penelope cunningly outwits her suitors and discover how Artemis defeats two giants. See Circe perform powerful magic and follow Demeter on her brave search for her missing daughter. Beautifully illustrated with lively retellings which bring these much-loved myths to life.",N/A,N/A,en
The Sea-Ringed World,['María García Esperón'],2022-06-07,['Juvenile Nonfiction'],"Now in paperback--a collection of stories from nations and cultures across our two continents--the Sea-Ringed World, as the Aztecs called it--from the Andes all the way up to Alaska. ""Hypnotizing...Provocative...Disarming"" -The New York Times ""Evocative and stirring...mesmerizing to read aloud."" --The Wall Street Journal ★ ""Visually striking...full of vivid language."" --Publishers Weekly (starred review) ★ ""A rich anthology to understand and delight in Native traditions."" --Booklist (starred review) ★ ""Begs to be read aloud."" --Kirkus (starred review) ★ ""Impressive, handsome, and universally appealing."" --Horn Book (starred review) ★ ""Breathtaking and simply beautiful."" --School Library Journal (starred review) ★ ""The language sparkles and the tales beg to be read aloud."" --School Library Connection (starred review) ""Visually arresting, captivating collection of traditional stories."" --Shelf-Awareness ""David Bowles' graceful translation renders this volume an excellent addition to any storytelling collection."" --BCCB ""With its one-of-a-kind art to accompany each tale, it is a collection that will appeal to children, but also to any lover and collector of books."" --BookRiot Fifteen thousand years before Europeans stepped foot in the Americas, people had already spread from tip to tip and coast to coast. Like all humans, these Native Americans sought to understand their place in the universe, the nature of their relationship with the divine, and the origin of the world into which their ancestors had emerged. The answers lay in their sacred stories.",N/A,N/A,en
Gender Swapped Greek Myths,['Karrie Fransman'],2022-09,['Juvenile Fiction'],"A new captivating, inspiring, and totally perspective-shifting volume from the wife and husband team behind Gender Swapped Fairy Tales The Greek myths were first told thousands of years ago, by poets and singers who wanted to tell how the world came to be. These brilliant stories are full of adventure and drama, but they also explore our deepest fears and fantasies. There's a reason these myths still feel so powerful - they've formed the foundations of narratives and archetypes that we see in books and on our screens even today. Having changed the way we look at Fairy Tales in their last book, Karrie and Jon have turned to these ancient stories to see what magic their marvelous gender swapping machine can work on them. As before, they haven't rewritten these myths. They haven't reimagined endings, or reinvented characters. All they've done is switch all the genders. It might not sound like that much of a change, but you'll be amazed by the world this swap creates - and by the new godesses, heroes, villainesses and adventurers you're about to discover.",N/A,N/A,en
Storyland,['Amy Jeffs'],2023-08-22,['History'],"Immersed in mist and old magic, Storyland is an exquisitely illustrated new mythology of Britain, set in its wildest landscapes. Historian and printmaker Amy Jeffs reimagines ancient legends in wondrous detail in this this gift-worthy collection for all lovers of myth, folklore, and mysticism. Storyland begins between the Creation and Noah's Flood, follows the footsteps of the earliest generation of giants, covers the founding of Britain, England, Wales, and Scotland, the birth of Christ, the wars between Britons, Saxons and Vikings, and closes with the arrival of the Normans. These are retellings of medieval tales of legend, landscape, and the yearning to belong, inhabited by characters now half-remembered: Arthur, Brutus, Albina, and more. Told with narrative flair, embellished in stunning, original linocuts and glossed with a rich and erudite commentary, Storyland illuminates a collective memory that still informs the identity and culture of Britain and its descendants. Readers will visit beautiful, sacred places that include prehistoric monuments like Stonehenge and Wayland's Smithy; mountains and lakes such as Snowdon and Loch Etive; and rivers including the Ness, the Soar, and the storied Thames in this vivid, beautiful tale of a land steeped in myth.",N/A,N/A,en
The Life-Giving Myth,['A. M. Hocart'],2004,['Social Science'],"Myths are the expression of a form of knowledge essential to life. Including mainly previously unpublished work by A.M. Hocart the book examines such issues as: Why a queen should not have been married before; why a guest is sacred; why people are believed to have been turned into stone; how money originated. These issues are considered as part of a socio-religious complex embraced in many parts of the world, both East and West. (There are chapters on the UK, India, Sri Lanka, Africa, Fiji, Egypt, and Ancient Greece).",N/A,N/A,en
A Sliver of Moon and a Shard of Truth: Stories from India,['Chitra Soundar'],2022-10-11,['Juvenile Fiction'],"""Clever Prince Veera and his best friend, Suku, are back in a vibrant new collection of stories riddled with surprises. When the prince's great uncle, Raja Apoorva, invites the boys to the summer festival in Peetalpur, Prince Veera and Suku are excited to compete in the games. It's no easy feat to make the peahen sing (when peahens can't sing) or defeat the country's champion wrestler, but Raja Apoorva's riddles prove the ultimate test of the boys' wit and wisdom. Who owns the tree that provides the palace figs? What intruder dared pull the Raja's beard? And what are the secrets of the holy man and the astronomer?""--",N/A,N/A,en
Television Mythologies,['Len Masterman'],1984,['Performing Arts'],"A collection of essays on television which focuses on the previewers, the TV magazines, quiz shows, commercial breaks, Top of the Pops, One Man and His Dog, personalities, politicians and continuity announcers.",N/A,N/A,en
"Magic, Witchcraft, and Religion","['Arthur C. Lehmann', 'James Edward Myers']",2001,['Magic'],"This is a comparative reader that takes an anthropological approach to the study of religious beliefs, both strange and familiar.",N/A,N/A,en
Los Mundos Magicos De El Senor De Los Anillos/The Magical Worlds of The Lord of The Rings,['David Colbert'],2006-01,['Juvenile Fiction'],"Behind the unforgettable characters, worlds, and battles of The Lord of the Rings trilogy and The Hobbit lie a vast range of world myths and historical events that originally inspired J. R. R. Tolkien. From the Finnish epic poem Kalevala and the medieval Beowulf to Arthurian mythology, Shakespeare, and even World War II, Tolkien's sources are unpacked and explained for the novice and connoisseur alike. Laid out in dictionary form, this indispensable guide provides insights not only into literature's most beloved fantasy, but also into the man who brought it to life.",4,N/A,es
Chinese Children's Favorite Stories,['Mingmei Yip'],2020-08,['Juvenile Fiction'],"A collection of 13 timeless tales told and charmingly illustrated by Yip, whose inspiration for retelling them came from her father's nightly storytelling when she was a child, this lovely book of Asian folktales and legends is sure to help readers learn more about Chinese traditions and culture. Full color.",N/A,N/A,en
An Illustrated Kalevala,['Kirsti Mäkinen'],2020-08-25,['Juvenile Fiction'],Discover mighty eagles and mythical heroes in this beautifully illustrated prose retelling of Finland's classic epic,N/A,N/A,en
Djeliya,['JUNI. BA'],2021-03-30,[],"Inspired by West African folklore and stories handed over centuries, this unique graphic novel follows the adventures of Mansou, last prince of a dying kingdom, and Awa, his loyal Djeliya, or 'royal storyteller' as they journey to meet the great wizard who destroyed their world and then withdrew into his tower, never to be seen again. On their journey they'll cross paths with friend and foe, from myth and legend alike, and revisit the traditions, tales, and stories that gave birth to their people and nurture them still. But what dark secret lies at the heart of these stories, and what purpose do their tellers truly serve?",N/A,N/A,en
Myths and Legends of the World,"['Lonely Planet', 'Lonely Planet Kids', 'Alli Brydon']",2019-10,['Legends'],"Retells twenty-one myths and legends from around the world, including tales featuring gods and goddesses, talking fish, and clever spiders.",N/A,N/A,en
The Encyclopedia of Myths and Legends,['Stuart Gordon'],1993,['Legends'],N/A,N/A,N/A,en
Unicornios,['Cari Meister'],2021,['Juvenile Nonfiction'],"¡Escucha! ¿Oyes un ruido de cascos por el suelo del bosque? Un destello blanco sale de entre los árboles. Un cuerno largo brilla como una corona sobre la cabeza de este animal. ¡Es un unicornio! ¿Alguna vez te has preguntado qué poderes mágicos tiene el cuerno del unicornio? ¿Dónde viven los unicornios? ¿Qué comen? ¡Aquí encontrarás todas las respuestas! Con ilustraciones llamativas y un texto claro, vivirás una gran aventura y aprenderás todo sobre los unicornios. Listen! Do you hear the clomping of hooves upon the forest floor? A flash of white bursts from behind a tree. A long horn shines like a crown upon the creature's head. It's a unicorn! Ever wondered about the magical powers of the unicorn's horn? Where does a unicorn live? What does it eat? Wonder no more! Striking illustrations and matter-of-fact text take you on a magical journey to learn all about unicorns.",N/A,N/A,es
Diosas Y Heroínas (Goddesses and Heroines),['Jean Menzies'],2024-04-16,['Juvenile Nonfiction'],"Adéntrate en el mundo mágico de la mitología y conoce la historia de las diosas y mujeres más poderosas de todos los tiempos: ¡desde sirenas y hadas hasta aguerridas guerreras y divinidades de la antigua Grecia! ¿Sabes cómo la hechicera Medea ayudó a dormir al dragón que cuidaba del vellocino de oro, o cómo la diosa japonesa Ame-No-uzume salvó al mundo de la oscuridad eterna? ¿Quieres conocer la historia de Hua Mulan, la guerrera que inspiró la peli de Disney? Una fantástica recopilación de relatos, mitos y leyendas protagonizadas por intrépidas heroínas, diosas, criaturas mágicas y otros apasionantes personajes femeninos, narrados como cuentos y extraordinariamente ilustrados. - Un regalo perfecto para niños de 7 a 9 años con interés por la mitología clásica y universal. - Incluye más de 30 increíbles relatos: clásicos populares e historias menos conocidas. - Retrata más de 80 mujeres de leyenda de todas las culturas del mundo. - Con originales ilustraciones a todo color en cada página. Un precioso libro ilustrado que despertará la curiosidad de los más pequeños y hará las delicias de toda la familia. Discover the stories of goddesses and other powerful women shared throughout the ages in this beautifully illustrated compendium for children. With profiles of over 80 goddesses, heroines, and legendary women featured, this is a must-have introduction to the key female figures from cultures all over the world. More than 30 beloved stories are retold by award-winning author Jean Menzies, with striking illustrations bringing these magical myths and tales to life. Find out how Japanese goddess of the dawn Ame-no-Uzume saved the day by dancing; how ancient Greek witch Medea helped to defeat a dragon; and how legendary Celtic warrior Scáthachtrained the hero Cú Chulainn to fight. Inside the pages of this mythical book for kids, you can find: - More than 80 profiles of women - combining the appeal of narrative stories with core-reference material. - A wide selection of stories - some well-known myths and legends and, some less well-known - Foil on the front jacket and spine make this book an attractive gift to be treasured. Goddesses and Heroines is the ideal book for children aged 7-9 with foil on the cover and stunning illustrations throughout. Children will love exploring the tales by themselves or as bedtime stories.",N/A,N/A,es
"Mitos, leyendas y tradiciones de la Banda Oriental",['Gonzalo Abella'],2001,['Social Science'],N/A,N/A,N/A,es
"Diccionario, signos, símbolos y personajes míticos y legendarios del Pirineo Aragonés",['José Miguel Navarro López'],2018,[],N/A,N/A,N/A,es
"Legende, mitovi i narodni običaji Đerdapa","['Jelena Bujdić Krečković', 'Aleksandar Repedžić']",2015,[],N/A,N/A,N/A,en
Les créatures fantastiques,['Cécile Lecan'],2023-10-27,[],N/A,N/A,N/A,fr
Viaggio nel West misterioso,['Gian Mario Mollar'],2022,['History'],N/A,N/A,N/A,it
