title,authors,publishedDate,categories,description,averageRating,textSnippet,language
De natura deorum,['Ovid'],2000-11-02,['History'],"Book XIII of Ovid's Metamorphoses presents a wide variety of brilliant episodes, from the rhetorically charged contest between Ulysses and Ajax over the arms of Achilles, to the tragic tale of Hecuba and her gruesome revenge, to the amusing story of Polyphemus' unrequited love for Galatea and its bloody conclusion. This edition discusses in detail Ovid's treatment of his sources and sets out the ways in which he has adapted earlier literature as material for his novel work. Guidance is offered on points of language and style, and the Introduction treats in general terms the themes of metamorphosis and the structure of the poem as a whole.",N/A,N/A,en
Dictionary of Greek and Roman Biography and Mythology,['William Smith'],1849,['Biography'],N/A,N/A,N/A,en
The Cambridge Companion to Greek Tragedy,['P. E. Easterling'],1997-10-02,['Drama'],"As a creative medium, ancient Greek tragedy has had an extraordinarily wide influence: many of the surviving plays are still part of the theatrical repertoire, and texts like Agamemnon, Antigone, and Medea have had a profound effect on Western culture. This Companion is not a conventional introductory textbook but an attempt, by seven distinguished scholars, to present the familiar corpus in the context of modern reading, criticism, and performance of Greek tragedy. There are three main emphases: on tragedy as an institution in the civic life of ancient Athens, on a range of different critical interpretations arising from fresh readings of the texts, and on changing patterns of reception, adaptation, and performance from antiquity to the present. Each chapter can be read independently, but each is linked with the others, and most examples are drawn from the same selection of plays.",4,N/A,en
The Metamorphoses of Publius Ovidius Naso ...,"['Ovid', 'Nathan Covington Brooks']",1860,['Mythology'],N/A,N/A,N/A,en
The Oxford Companion to World Mythology,['David Leeming'],2005-11-17,['Reference'],"An interesting and lively book that contains articles on heros, villains, mythologists and mythological approaches.",4.5,N/A,en
The White Goddess,['Robert Graves'],1978,['Literary Criticism'],"Examines the language of ancient Celtic and Mediterranean poetic myths, probing the role of the all-encompassing female figure, the White Goddess, in the earliest forms of poetry.",3,N/A,en
The Golden Bough,['James George Frazer'],1998,['Fiction'],"First published in 1890, The Golden Bough is a seminal work of modern anthropology. A classic study of the beliefs and institutions of mankind that traces the development and confluence of thought from magic and ritual to modern scientific theory, it has been a source of great influence upon such diverse writers as T.S. Eliot, Wyndham Lewis, and D.H. Lawrence. This edition restores many of the controversial passages expurgated in the 1922 edition that elucidate Frazer's bolder theories, and sets them within the framework of a valuable introduction and notes.",4.5,N/A,en
"A Classical Dictionary of Greek and Roman Biography, Mythology and Geography",['William Smith'],1889,['Biography'],N/A,N/A,N/A,en
The Raw and the Cooked,['Claude Lévi-Strauss'],1983-03-15,['Religion'],"In anthropological terms the concept of ""the raw"" verses ""the cooked"" has long been associated with the dichotomy between the natural world and the world of human culture. In a broad-based empirical study of native mythologies, Claude Lévi-Strauss proposes a structural and thematic link between the opposition of the raw and the cooked in mythological thought and man's attempt to establish a balanced relationship between natural and cultural forces. Lévi-Strauss postulates that the raw/cooked axis is characteristic of all human culture, with elements falling along the ""raw"" side of the axis being those of ""natural"" origin, and those on the ""cooked"" side being of ""cultural"" origin - i.e. products of human creation. Symbolically, cooking marks the transition from nature to culture, by means of which the human state can be defined in accordance with all its attributes. In mythological thought, the cooking of food is, in effect, a form of mediation between nature and society, between life and death, and between heaven and earth. The cook, in turn, can be viewed as a cultural agent whose function is to ""mediate the conjunction of the raw product and the human consumer,"" the operation of which has the effect of ""making sure the natural is at once cooked and socialized.""",N/A,N/A,en
The Encyclopedia of Celtic Mythology and Folklore,['Patricia Monaghan'],2014-05-14,"['Body, Mind & Spirit']","Presents an illustrated A to Z reference containing over 1,000 entries providing information on Celtic myths, fables and legends from Ireland, Scotland, Celtic Britain, Wales, Brittany, central France, and Galicia.",N/A,N/A,en
Mystery of the White Lions,['Linda Tucker'],2003,['Nature'],"Linda Tucker invites us to join her on a personal quest of discovery, handing over clues entrusted to her by African elders, taking us deeper and deeper into ancient wisdom which may prove absolutely vital in solving our present condition of global crisis.",N/A,N/A,en
A Dictionary of Greek and Roman Antiquities,"['William Smith', 'Charles Anthon']",1843,['Classical antiquities'],N/A,N/A,N/A,en
The Jealous Potter,['Claude Lévi-Strauss'],1988-04-15,['Psychology'],"As Lévi-Strauss freely explores the mythologies of the Americas, with occasional incursions into European and Japanese folklore, tales of sloths and squirrels interweave with discussions of Freud, Saussure, ""signification,"" and plays by Sophocles and Labiche. Lévi-Strauss critiques psychoanalytic interpretation and defends the interpretive powers of structuralism. ""Electrifying. . . . A brilliant demonstration of structural analysis in action. . . . Can be read with pleasure and profit by anyone interested in that aspect of self-discovery that comes through knowledge of the universal and timeless myths that live on in all of us.""—Jonathan Sharp, San Francisco Examiner-Chronicle ""A characteristic tour de force. . . . One remains awed by him.""—Colin Thubron, Sunday Times ""With all its epistemological depth, the book reads at times like a Simenon or a Lewis Carroll, fusing concise methodology with mastery of style.""—Bernadette Bucher, American Ethnologist ""[An] engagingly provocative exploration of mythology in the Americas. . . . Always a good read.""—Choice ""A playful, highly entertaining book, fluently and elegantly translated by Bénédicte Chorier.""—Wendy Doniger O'Flaherty, New York Times Book Review",N/A,N/A,en
The Golden Bough,['James George Frazer'],2012-04-26,['History'],The greatly revised and enlarged twelve-volume third edition (1911-15) of Sir James Frazer's controversial work on classical religion.,N/A,N/A,en
The Age of Fable,['Thomas Bulfinch'],1855,['Mythology'],N/A,N/A,N/A,en
The Hero's Journey,['Joseph Campbell'],2003,['Biography & Autobiography'],"Joseph Campbell, arguably the greatest mythologist of our time, was certainly one of our greatest storytellers.",5,N/A,en
A New System,['Jacob Bryant'],1807,['Folklore and history'],N/A,N/A,N/A,en
The Two Towers,['John Ronald Reuel Tolkien'],1991,['Fiction'],"This is the second book in the trilogy The Lord of the Rings. It tells the epic story of the great quest undertaken by Frodo and the Fellowship of the Ring and involves Gandalf the Wizard, Merry, Pippin and Sam, Gimli the Dwarf and Strider.",N/A,N/A,en
Greek popular religion...,['Martin Persson Nilsson'],N/A,['Fiction'],N/A,N/A,N/A,en
Philoktetes,['Sophokles'],2015,['Mythology'],N/A,N/A,N/A,en
Researches Into the Nature and Affinity of Ancient and Hindu Mythology,['Vans Kennedy'],1831,['Hindu mythology'],N/A,N/A,N/A,en
Prometheus,['Karl Kerényi'],1997-11-30,['Literary Criticism'],"Prometheus the god stole fire from heaven and bestowed it on humans. In punishment, Zeus chained him to a rock, where an eagle clawed unceasingly at his liver, until Herakles freed him. For the Greeks, the myth of Prometheus's release reflected a primordial law of existence and the fate of humankind. Carl Kerényi examines the story of Prometheus and the very process of mythmaking as a reflection of the archetypal function and seeks to discover how this primitive tale was invested with a universal fatality, first in the Greek imagination, and then in the Western tradition of Romantic poetry. Kerényi traces the evolving myth from Hesiod and Aeschylus, and in its epic treatment by Goethe and Shelley; he moves on to consider the myth from the perspective of Jungian psychology, as the archetype of human daring signifying the transformation of suffering into the mystery of the sacrifice.",N/A,N/A,en
Who's who in Non-classical Mythology,"['Egerton Sykes', 'Alan Kendall']",1995,['Literary Criticism'],"First published by Dent in 1952, revised in 1961.",N/A,N/A,en
Bulfinch's Mythology,['Thomas Bulfinch'],1962-08,['Fiction'],Medieval tales of kings and knights.,N/A,N/A,en
Comparative Mythology,['Jaan Puhvel'],1987,['Literary Criticism'],"In myth, author Puhvel argues, a human group expresses the thought patterns by which it formulates self-cognition and self-realization, attains self-knowledge and self-confidence, explains its own sources and sometimes tries to chart its destinies. Here, Puhvel unravels the prehistoric origins of the traditions of India and Iran, Greece and Rome, of the Celts, Germans, Balts, and Slavs. Utilizing the methodologies of historical linguistics and archaeology, he reconstructs a shared prehistorical religious, mythological, and cultural heritage. Separate chapters on individual traditions as well as on recurrent themes give life to the book as both a general introduction and a detailed reference.--From publisher description.",N/A,N/A,en
Myth,['G. S. Kirk'],1973-06-08,['History'],"This book, developed out of the 1969 Sather lectures at Berkeley, California, confronts a wide range of problems concerning the nature, meaning and functions of myths. Professor Kirk's aim is to introduce a degree of coherence and of critical awareness into a subject that arouses profound interest today, but which for too long has been the target of excessive theorizing and interdisciplinary confusion between anthropologists, sociologists, classicists, philosophers and psychologists. Professor Kirk begins by discussing the relation of myths to rituals and folktales, and the weakness of universalist theories of function. He then subjects Lévi-Strauss's structuralist theory to an extended exposition and criticism; he considers the character and meaning of ancient Near Eastern myths, their influence on Greece, and the special forms with rational modes of thought, and finally, he assesses the status of myths as expressions of the unconscious, as elements of dreams, universal symbols, as accidents along the way to some narrative objective. The result is a significant critical venture into the history and philosophy of thought, imagination, symbol and society.--From publisher description.",5,N/A,en
The Origin of All Religious Worship,['Dupuis'],1872,['Astronomy'],N/A,N/A,N/A,en
The Odyssey of Homer,['Homer'],1967,['Literary Collections'],N/A,N/A,N/A,en
The Magical Worlds of Harry Potter,['David Colbert'],2004,['Fiction'],"Explores the true history, folklore and mythology behind the magical practices, creatures, and personalities that appear in J.K. Rowling's Harry Potter books.",N/A,N/A,en
The Age of Fable,['Thomas Bulfinch'],1914,['Mythology'],N/A,N/A,N/A,en
Mythology,['Edith Hamilton'],1989,['Fiction'],"MONSTERS, MORTALS, GODS, AND WARRIORSFor over fifty years readers have chosen this book above all others to discover the thrilling, enchanting, and fascinating world of Western mythology. From Odysseus's adventure-filled journey to the Norse god Odin's effort to postpone the final day of doom, Edith Hamilton's classic collection not only retells these stories with brilliant clarity but shows us how the ancients saw their own place in the world and how their themes echo in our consciousness today. An essential part of every home library, MYTHOLOGY is the definitive volume for anyone who wants to know the key dramas, the primary characters, the triumphs, failures, fears, and hopes first narrated thousands of years ago -- and still spellbinding to this day. Copyright © Libri GmbH. All rights reserved.",N/A,N/A,en
The Shaman's Doorway,['Stephen Larsen'],1998,"['Body, Mind & Spirit']","Drawing on his experience as a psychotherapist and his understanding of the ancient shamanic techniques for altering consciousness, the author shows the relevance of the shamanic path to the modern world and how it can lead us to creative and affirming relationships with life.",N/A,N/A,en
Language and Myth,"['Ernst Cassirer', 'Ernst Alfred Cassirer']",1946-01-01,['Philosophy'],Six essays which analyze the non-national thought processes that influence culture,N/A,N/A,en
Encyclopedia of Greek and Roman Mythology,"['Luke Roman', 'Monica Roman']",2010,['Reference'],"Greek and Roman mythology has fascinated people for more than two millennia, and its influence on cultures throughout Europe, America, North Africa, and the Middle East attests to the universal appeal of the stories. This title examines the best-known figures of Greek and Roman mythology together with the great works of classic literature.",5,N/A,en
Epic Mythology,['Edward Washburn Hopkins'],1915,['Hindu mythology'],"The mythology of the two epics of India, the Mahābhārata and the Rāmāyaṇa.",N/A,N/A,en
The Golden Bough,['Sir James George Frazer'],1976,['Magic'],N/A,N/A,N/A,en
The Sacred and the Profane,['Mircea Eliade'],1959,['History'],"Famed historian of religion Mircea Eliade observes that even moderns who proclaim themselves residents of a completely profane world are still unconsciously nourished by the memory of the sacred. Eliade traces manifestations of the sacred from primitive to modern times in terms of space, time, nature, and the cosmos. In doing so he shows how the total human experience of the religious man compares with that of the nonreligious. This book serves as an excellent introduction to the history of religion, but its perspective also emcompasses philosophical anthropology, phenomenology, and psychology. It will appeal to anyone seeking to discover the potential dimensions of human existence. -- P. [4] of cover.",3.5,N/A,en
The Age of Fable,['Thomas Bulfinch'],1913,['Mythology'],N/A,N/A,N/A,en
Acheron,['Sherrilyn Kenyon'],2009-03-31,['Fiction'],"At last, the long awaited and most anticipated book of the Dark-Hunter world.",N/A,N/A,en
The Outline of Mythology,['Thomas Bulfinch'],1913,['Chivalry'],N/A,N/A,N/A,en
Chips from a German Workshop,['Friedrich Max Müller'],1868,['Comparative linguistics'],N/A,N/A,N/A,en
"A Classical Dictionary of Hindu Mythology and Religion, Geography, History, and Literature",['John Dowson'],1879,['Hindu mythology'],N/A,N/A,N/A,en
The Fellowship of the Ring,['John Ronald Reuel Tolkien'],1991,['Adventure stories'],"'The Fellowship of the Ring' is the first part of J.R.R. Tolkien’s epic adventure 'The Lord of the Rings'. Sauron, the Dark Lord, has gathered to him all the Rings of Power – the means by which he intends to rule Middle-earth. All he lacks in his plans fo",N/A,N/A,en
Mythology,['Thomas Bulfinch'],1913,['Chivalry'],N/A,4.5,N/A,en
The Odyssey,['Homer'],1994,['Mythology'],N/A,N/A,N/A,en
Myth and Meaning,['Claude Lévi-Strauss'],2001,['Social Science'],"In addresses written for a wide general audience, Claude Levi-Strauss offers the insights of a lifetime on the crucial questions of human existence. Myth and Meaning is one of the most famous anthropology texts of the 20th century.",N/A,N/A,en
Los mundos mágicos de Harry Potter,['David Colbert'],2002,['Juvenile Nonfiction'],"""La obra de J.K. Rowling está llena de referencias a la historia, a los mitos, a las leyendas y a la literatura. Por tanto, a través de ella, se abre un excelente camino para llegar a los orígenes de esos seres mágicos o al misterio que encierran sus nombres. Esta libro, Los mundos mágicos de Harry Potter, se ha propuesto desvelar las historias que hay detrás de las aventuras y los personajes de estas populares novelas. Este enriquecedor recorrido incluye muchos otros mundos, tanto reales como imaginarios, desde el antiguo Egipto y Grecia hasta la India y Japón. También muestra los puntos de encuentro con magos como Circe y Merlín, y con auténticos alquimistas de la Edad Media, y revela el sorprendente origen de seres mágicos como el fénix y el hipogrifo. Detrás de estas historias se pueden descubrir también referencias a páginas de autores tan universalmente reconocidos como Shakespeare, Flaubert, Ovidio, Dickens o Tolkien""--Cover, p. 4.",4.5,N/A,es
Searches for an Imaginary Kingdom,['Lev Nikolaevich Gumilev'],1987,['History'],This bold synthesis fills in many of the missing links between the histories of Europe and medieval China.,N/A,N/A,en
Mythologies,['Roland Barthes'],1993,['Cultural studies'],"A series of essays in which Barthes seeks to tear away masks and demystify the signs, signals, gestures and messages through which western society sustains, sells, identifies and yet obscures itself.",N/A,N/A,en
Primitive Culture,['Edward Burnett Tylor'],1958,['Animism'],N/A,N/A,N/A,en
Myth in Primitive Psychology,['Bronislaw Malinowski'],1926,['Ethnopsychology'],N/A,N/A,N/A,en
The Classical Tradition,['Gilbert Highet'],1959,['American literature'],"""This is an account of the chief ways in which the Greco-Roman tradition has shaped the literatures of modern Europe and America. Beginning with Old English poetry and French Romance, and continuing to mid-twentieth century, Mr. Highet shows how one country after another learned forms, imagery, myths, style, and standards in the gradual but continuous rediscovery of Greco-Roman literary arts.""--",N/A,N/A,en
The New Golden Bough,['Sir James George Frazer'],1959,['Magic'],N/A,N/A,N/A,en
The Age of Chivalry and Legends of Charlemagne,['Thomas Bulfinch'],1992,['History'],N/A,N/A,N/A,en
Mythology,['Edith Hamilton'],1998-09,['Mythology'],"The great stories from Greek, Roman, and Norse mythology which are the fountainhead of all literature. Oversized edition.",N/A,N/A,en
Bulfinch's Mythology,['Thomas Bulfinch'],2003-01-13,['Social Science'],N/A,N/A,N/A,en
The World of Classical Myth,"['Carl A. P. Ruck', 'Danny Staples']",1994,['Foreign Language Study'],"The in-depth and well researched material in The World of Classical Myth is presented against a background of history, archaeology, social custom, religion, topography, and monuments. Part One, ""Orientation,"" defines mythology and portrays it as an evolving pattern, constantly undergoing revision to keep pace with the evolution of the culture. Hence, mythology offers an archaeology of a people's changing sense of identity. Part Two, ""Transmutations,"" portrays symbolic forms as eternal and archetypal, never annihilated but merely changing appearance to meet the demands of changing times. Hence, the analysis of the iconography and worship of the twelve Olympian deities paints a picture of their evolution into their Classical identities. Part Three, ""The Liminal Hero,"" describes the two ways of telling a hero's story: either the hero steps forward to found a new world and defeat the past, or he steps back to become the fundament of his present world. Part Four, ""Liminal Heroines,"" delineates the three versions of the heroine's identity -- maiden, mother, and witch -- and explores the portrayal of women in classical mythology. Staples and Ruck follow these themes through the course of Classical Myth, incorporating over 100 illustrations and maps integral to the presentation of the material. The book also offers new perspectives on the goddesses and heroines of classical mythology and on the role of women in antiquity. ""It is indeed a cause for some alarm that so important a subject as Greek Mythology has hitherto lacked an adequate primary textbook... Ruck's book may well be the long-awaited remedy. I am impressed not only by his knowledge and organization, but also by his patent concern for student needs."" -- Professor C. Robert Phillips, III, Lehigh University",N/A,N/A,en
Hindu Goddesses,['David Kinsley'],1998,['Religion'],"Hindu Goddesses is a valuable sourcebook and reference work for students and scholars of Hindu goddesses and of Hinduism in general. Each goddess is dealt with as an independent deity with a coherent mythology, theology and, in some cases, cult of her own. Within the complex, diverse, and rich goddess traditions of Hinduism, one can find suggestions of nearly every important theme in the Hindu religion. In many ways, this book is as much a study of the Hindu tradition itself as it is a study of one aspect of that tradition. No other living religious tradition has displayed such an ancient, continuous, and diverse history of goddess worship.",5,N/A,en
The Light of Asia,['Sir Edwin Arnold'],1906,[],N/A,N/A,N/A,en
Physiologus,[],1979,['Fiction'],"One of the most popular and widely read books of the Middle Ages, ""Physiologus ""contains allegories of beasts, stones, and trees both real and imaginary, infused by their anonymous author with the spirit of Christian moral and mystical teaching.a Accompanied by an introduction that explains the origins, history, and literary value of this curious text, this volume also reproduces twenty woodcuts from the 1587 version. Originally composed in the fourth century in Greek, and translated into dozens of versions through the centuries, ""Physiologus ""will delight readers with its ancient tales of ant-lions, centaurs, and hedgehogsOCoand their allegorical significance. OC An elegant little book . . . still diverting to look at today. . . . The woodcuts reproduced from the 1587 Rome edition are alone worth the price of the book.OCOOCoRaymond A. Sokolov, ""New York Times Book Review""""",N/A,N/A,en
"Selected Essays on Language, Mythology and Religion",['Friedrich Max Müller'],1881,['Language and languages'],N/A,N/A,N/A,en
Dictionary of Phrase and Fable,['Ebenezer Cobham Brewer'],1879,['Allusions'],N/A,N/A,N/A,en
A Dictionary of Phrase and Fable,['Ebenezer Cobham Brewer'],1923,['Allusions'],N/A,N/A,N/A,en
American Gods,['Neil Gaiman'],2017-03-28,[],"American Gods, the extraordinary, highly acclaimed epic novel from storytelling genius and international bestseller Neil Gaiman, comes vividly to life this May in the hottest major TV show of 2017. Praised by Empire as 'something very special', the series will be shown in the UK on Amazon Prime Video and stars Ricky Whittle, Ian McShane, Emily Browning and Gillian Anderson. 'Gaiman is a treasure-house of story and we are lucky to have him' Stephen King. If you are to survive, you must believe. Shadow Moon has served his time. But hours before his release from prison, his beloved wife is killed in a freak accident. Dazed, he boards a plane home where he meets the enigmatic Mr Wednesday, who professes both to know Shadow and to be king of America. Together they embark on a profoundly strange road trip across the USA, encountering a kaleidoscopic cast of characters along the way. Yet all around them a storm threatens to break. The war has already begun, an epic struggle for the very soul of America, and Shadow is standing squarely in its path.",N/A,N/A,en
Fantastic Beasts and where to Find Them,"['J. K. Rowling', 'Newt Scamander']",2017,['Juvenile Fiction'],"A brand new edition of this essential companion to the Harry Potter stories, with a new foreword from J.K. Rowling, an irresistible new jacket by Jonny Duddle, illustrations by Tomislav Tomic and six new beasts! An approved textbook at Hogwarts School of Witchcraft and Wizardry since publication, Newt Scamander's masterpiece has entertained wizarding families through the generations. Fantastic Beasts and Where to Find Them is an indispensable introduction to the magical beasts of the Wizarding World. In this comprehensively updated edition, eagle-eyed readers will spot a number of new beasts and an intriguing new author's note. Scamander's years of travel and research have created a tome of unparalleled importance. Some of the beasts will be familiar to readers of the Harry Potter books - the Hippogriff, the Basilisk, the Hungarian Horntail ... Others will surprise even the most ardent amateur Magizoologist. Dip in to discover the curious habits of magical beasts across five continents ... 'No wizarding household is complete without a copy' - Albus Dumbledore",N/A,N/A,en
Totem and Taboo,"['Sigmund Freud', 'Abraham Arden Brill']",1919,['Mythology'],N/A,2.5,N/A,en
"Myth, Ritual and Religion",['Andrew Lang'],1901,['Mythology'],N/A,N/A,N/A,en
"Myth, Legend & Romance",['Dáithí Ó hÓgáin'],1990,"['Folk literature, Irish']",N/A,N/A,N/A,en
The Myth of the State,['Ernst Cassirer'],1946-01-01,['Social Science'],Examines the nature and functions of myth and its role in the development of political thought from the time of the ancient Greeks to the twentieth century,N/A,N/A,en
