title,authors,publishedDate,categories,description,averageRating,textSnippet,language
Understanding Myths and Legends,['Karen Moncrieffe'],2012-10,['Education'],"Understanding Myths and Legends contains 27 stories from different countries around the World, ranging from Perseus and Medusa from Ancient Greece to an Indian legend on how the Peacock got his glorious feathers. These exciting stories are full of fearsome monsters, brave heroes and magical happenings, and will appeal to both girls and boys. Understanding Myths and Legends is a flexible resource that can be used to support topic work in history and RE or used as part of a unit of work in literacy. The stories and activities are ideal for use in guided reading sessions. To enable teachers to make the most of each story, they are accompanied by: background information to enable teachers to place the story confidently in context; differentiated reading tasks, using a variety of question styles, to help improve children's reading and comprehension skills; speaking and listening activities to deepen children's insight into the stories and encourage engagement; cross-curricular follow-up ideas, enabling you to extend the story further. Myths and legends are not only excellent stories. They also help children to gain a true understanding of life in ancient times and improve their understanding of other people, cultures and places, making them an essential part of the primary curriculum.",N/A,N/A,en
Persian Mythology,['John R. Hinnells'],1985,['Reference'],"Discusses the mythology of ancient Persia and of religions which have flourished there, notably Zoroastrianism.",N/A,N/A,en
Mythology,['Edith Hamilton'],1999-08,['Fiction'],"A collection of Greek and Roman myths arranged in sections on the gods and early heroes, love and adventure stories, the Trojan war, and a brief section on Norse mythology.",N/A,N/A,en
Creatures in the Mist,['Gary R. Varner'],2007,['Fiction'],"Bringing together a medley of stories, myths, and folklore Gary Varner shares a fascination and respect for humankind's early and contemporary cultures and wonders at similarities across the board. Here, he focuses on ""Little People"" and giants, animals and were-creatures, and the odd, helpful or threatening ways imputed to our earthly companions including dogs and cats, bats and spiders, and the stories people have told each other about them since time immemorial. Gary Varner has performed a valuable service in these books. [Presenting] lore from about the world, a collector's hoard of traditions rich and strange, ... Varner shows there really are obvious and puzzling similarities between widely separated cultures. Gary Varner has pointed the way to some important cross-cultural readings in the ageless themes of stone and water. - Jeremy Harte, Curator of the Bourne Hall Museum, Surrey, England, in Northern Earth magazine, #103, 2005 Menhirs, Dolmen and Circles of Stone is an excellent guide to large-scale magical stones and stone magic. This book is a must for anyone interested in megalithic sites. Most highly recommended. -PanGaia Magazine, United States As with other books by the same author, this is a book based upon broad research into the subject, stretching across the world. What results is a fascinating weave of stories and images, descriptions of sites and associated tales, that leaves a sense of a thousand deities whispering in the air. Because it is so broad a sweep, the positive outcome is an overreaching perspective of the patterns and commonalities held between human communities - our ancestors - all around the world. The book is a sound overview and provocation toresearch more deeply ourselves, to find alternative visions, tales and interpretations, to find out more about the sacred currents, their depths and importance - both to our ancestors and to ourselves. The author's notations are comprehensive, allowing us easily to follow the clues. A valuable piece of work. -The Druid Network, England * Gary R. Varner is a lecturer and writer on folklore and early religions. He is author of several popular books comparing legends and beliefs around the world, including The Mythic Forest, the Green Man & the Spirit of Nature (Algora 2006); Menhirs, Dolmen and Circles of Stone: The Folklore and Magic of Sacred Stone (Algora 2005); and Sacred Wells: A Study in the History, Meaning, and Mythology of Holy Wells. His approach incorporates details from ancient cultures and from Native American, UK and European, Asian, South Pacific and African folklore. Varner is a member of the American Folklore Society.",N/A,N/A,en
Sacred Narrative,['Alan Dundes'],1984-11-15,['Fiction'],"Alan Dundes defines myth as a sacred narrative that explains how the world and humanity came to be in their present form. This new volume brings together classic statements on the theory of myth by the authors. The twenty-two essays by leading experts on myth represent comparative, functionalist, myth-ritual, Jungian, Freudian, and structuralist approaches to studying the genre.",N/A,N/A,en
The Hero with a Thousand Faces,['Joseph Campbell'],1949,['Mythology'],Traces the concept of heroes and places Christ in that category along with myths and folk heroes.,5,N/A,en
Bulfinch's Mythology,['Thomas Bulfinch'],1968,['Chivalry'],With a foreword by Robert Graves. Illustrated by Joseph Papin.,N/A,N/A,en
"Asklepios, Medicine, and the Politics of Healing in Fifth-Century Greece",['Bronwen L. Wickkiser'],2008,['History'],"Delving deeply into ancient medical history, Bronwen L. Wickkiser explores the early development and later spread of the cult of Asklepios, one of the most popular healing gods in the ancient Mediterranean. Though Asklepios had been known as a healer since the time of Homer, evidence suggests that large numbers of people began to flock to the cult during the fifth century BCE, just as practitioners of Hippocratic medicine were gaining dominance. Drawing on close readings of period medical texts, literary sources, archaeological evidence, and earlier studies, Wickkiser finds two primary causes for the cult’s ascendance: it filled a gap in the market created by the refusal of Hippocratic physicians to treat difficult chronic ailments and it abetted Athenian political needs. Wickkiser supports these challenging theories with side-by-side examinations of the medical practices at Asklepios' sanctuaries and those espoused in Hippocratic medical treatises. She also explores how Athens' aspirations to empire influenced its decision to open the city to the healer-god's cult. In focusing on the fifth century and by considering the medical, political, and religious dimensions of the cult of Asklepios, Wickkiser presents a complex, nuanced picture of Asklepios' rise in popularity, Athenian society, and ancient Mediterranean culture. The intriguing and sometimes surprising information she presents will be valued by historians of medicine and classicists alike.",N/A,N/A,en
"Myth, Ritual and Religion",[],1887,[],N/A,N/A,N/A,en
Jung on Mythology,"['Carl Gustav Jung', 'Robert Alan Segal']",1998,['Fiction'],"At least three major questions can be asked of myth: what is its subject matter? What is its origin? What is its function? Theories of myth may differ in the answers they give to any of these questions, but more basically they may also differ on which of the questions they ask. C.G. Jung's theory is one of the few that purports to answer fully all three questions. This volume collects and organizes the key passages on myth by Jung himself and by some of the most prominent Jungian writers after him: Erich Neumann, Marie-Louise von Franz and James Hillman. The book synthesizes the discovery of myth as a way of thinking, where it becomes a therapeutic tool providing an entrance to the unconscious.",N/A,N/A,en
Dictionary of Gods and Goddesses,['Michael Jordan'],2014-05-14,['Religion'],Presents brief entries describing the gods and goddesses from the mythology and religion of a wide variety of cultures throughout history.,5,N/A,en
Magic and Religion,['Andrew Lang'],1901,['Religion'],N/A,N/A,N/A,en
Bulfinch's Mythology,"['Thomas Bulfinch', 'Valerie Willis']",2020-08-24,['Fiction'],"Welcome to the Battle Goddess Edition of ""Bulfinch's Mythology"" by Thomas Bulfinch as revised by Rev. E.E. Hale. This is a cornerstone piece for anyone wanting to dive deeper into mythology of various kinds. Mr. Bulfinch does a wonderful job in making a collective account of stories for most of the entities he covers, including several excerpts from poets, historians, Milton, Homer, including his own brother, and many more. Traversing from Greek to Roman to Hindu to Celtic and beyond, this is a great book for any mythology lover. If this wasn't enticing enough, we added in the volumes of ""King Arthur and His Knights"" and even ""Legends of Charlemagne"" to give you an unforgettable resource and collection. The artwork found within is a collection of work from a mixture of artists from over a hundred years ago and older. A listing of artists can be found in the back matter so you may search for more of their work within our edition. Not all of the public domain images had the artist labelled, but we felt the ""unknown"" deserved to be shown off right along with the more well-known artists. The collective was known for illustrating fairy tales, mythology, or even prior versions of Bulfinch's own publications including Arthur Rackham, who is a personal favorite. --",N/A,N/A,en
Dionysus,['Walter F. Otto'],1965,['Philosophy'],"""Who is Dionysus? The god of ecstasy and terror, of wildness and of the most blessed deliverance, and the mad god whose appearance sends mankind into madness. In this classic study of the myth and cult of Dionysus, Walter F. Otto recreates the theological world of ancient Greek religion. Otto's provocative starting point is to accept the immanent reality of the gods. To understand the cult of Dionysus, it is necessary to reimagine the original vision of the god. Otto challenges us to understand the power of this vision not as a bloodless abstraction but as a force animating belief, to see the myth and art of Dionysus as a passionate search to regain the power of the lost gof.""--Back cover.",N/A,N/A,en
The Magical Worlds of Harry Potter,['David Colbert'],2004,"['Animals, Mythical']",N/A,N/A,N/A,en
Women of Classical Mythology,['Robert E. Bell'],1993,['Fiction'],"Over 2,600 entries identify the women of classical mythology.",N/A,N/A,en
"A Classical Dictionary of Greek and Roman Biography, Mythology and Geography","['Sir William Smith', 'George Eden Marindin']",1894,['Greece'],N/A,N/A,N/A,en
The Gods of the Greeks,['Karl Kerényi'],1958,['Greece'],N/A,N/A,N/A,en
The Power of Myth,['Joseph Campbell'],1991,['Philosophy'],"The noted mythologist discusses the relationship of ancient myths to modern life, including discussions of recent heros, tales of love and marriage, the power of myth, and mythic themes",5,N/A,en
The Twelve Dancing Princesses,"['Jane Ray', 'Jacob Grimm', 'Wilhelm Grimm']",1996,"[""Children's stories, English""]","With its sumptuous detailed illustrations and gold and silver highlights, The Twelve Dancing Princesses is the latest jewel in the crown of Jane Ray''s retellings of classic stories, which are themselves rapidly becoming modern classics'",N/A,N/A,en
"The Myth of the Birth of the Hero, and Other Writings",['Otto Rank'],1959,['Heroes'],N/A,N/A,N/A,en
Myths and Myth Makers,['John Fiske'],1996,['Social Science'],"Unlike some other reproductions of classic texts (1) We have not used OCR(Optical Character Recognition), as this leads to bad quality books with introduced typos. (2) In books where there are images such as portraits, maps, sketches etc We have endeavoured to keep the quality of these images, so they represent accurately the original artefact. Although occasionally there may be certain imperfections with these old texts, we feel they deserve to be made available for future generations to enjoy.",N/A,N/A,en
Mythology,['David Adams Leeming'],1998-05-28,['Fiction'],"Leeming illustrates the various rites of passage of the mythic universal hero, from birth to childhood, through trial and quest, death, descent, rebirth, and ascension. The arrangement of texts by themes such as ""The Descent to the Underworld"" and ""Resurrection and Rebirth"" strip mythic characters of their national and cultural ""masks"" to reveal their archetypal aspects. Real figures, including Jesus and Mohammed, are also included to underline the theory that myths are real and can be applied to real life. This updated edition includes additional myths, as well as Navajo, Indonesian, Indian, Chinese, and African tales.",N/A,N/A,en
The Mythic Image,"['Joseph Campbell', 'Marie-Jeanne Abadie']",1981-11-21,['Philosophy'],"This book presents approximately 450 illustrations of mythic art from Mesopotamian, Egyptian, Indian, Chinese, European, and Olmec cultures as a basis for an exploration into the relation of dreams to myth.",N/A,N/A,en
The Denial of Death,['Ernest Becker'],1997-05-08,['Family & Relationships'],"Addresses the issue of mortality discussing how humans universally share a fear of death and examines the theories of leading thinkers on this subject including Freud, Rank, and Kierkegaard.",N/A,N/A,en
Bulfinch's Mythology - The Age of Fable Or Stories of Gods and Heroes,['Thomas Bulfinch'],2007-11,['Juvenile Fiction'],"THE religions of ancient Greece and Rome are extinct. The so-called divinities of Olympus have not a single worshipper among living men. They belong now not to the department of theology, but to those of literature and taste. There they still hold their place, and will continue to hold it, for they are too closely connected with the finest productions of poetry and art, both ancient and modern, to pass into oblivion.",N/A,N/A,en
Before Philosophy,"['Henri Frankfort', 'Henriette Antonia Groenewegen-Frankfort']",1949,"['Civilization, Ancient']",N/A,N/A,N/A,en
What the Bee Knows,['Pamela Lyndon Travers'],1989,['Social Science'],N/A,N/A,N/A,en
A Wonder Book and Tanglewood Tales for Girls and Boys,['Nathaniel Hawthorne'],1923,"[""Children's stories""]",Two collections of tales for young people from classical mythology.,N/A,N/A,en
Bulfinch's Mythology,['Thomas Bulfinch'],1970,['Folklore'],N/A,N/A,N/A,en
B&N Bulfinchs Mythology Leather,['Thomas Bulfinch'],2013,['Folklore'],"One of the leading popularisers of classical learning in the nineteenth century, Thomas Bulfinch made the myths and legends of the ancient and medieval world available to American audiences through his three decisive works, The Age of Fable, The Age of Chivalry, and Legends of Charlemagne, collectively published and widely known as Bulfinch s Mythology. This deluxe leatherbound gift edition contains not only the full text of Bulfinch's definitive works, but also dozens of colour illustrations and paintings. A banking clerk by day, Bulfinch spent his nights skillfully weaving often disparate versions of classical and medieval mythology into a coherent whole. The thoroughness with which he combed through his sources made his mythological books standard reference guides for many years, while the vigor of his storytelling enthralled generations of readers. Written to 'teach mythology not as a study but as a relaxation from study', these timeless volumes span the ages.",N/A,N/A,en
The Penguin Dictionary of Symbols,"['Jean Chevalier', 'Alain Gheerbrant']",1996,['Language Arts & Disciplines'],"Symbols form an all-pervasive and potent part of our mental and emotional universes. A rich inventory of symbols is presented in this dictionary - myths, dreams, images, story archetypes, plants, animals - drawing from may different cultures",5,N/A,en
"Magic, Science and Religion",['Bronislaw Malinowski'],1954,['Literary Collections'],"The author takes into account the various views of religion which Tylor, Frazer, Marett, and Durkheim have given and goes on from there to provide his own conception that religion and magic are ways men have to make the world acceptable.",N/A,N/A,en
"Myth, Ritual & Religion",['Andrew Lang'],1996,['Religion'],"This is a reproduction of a book published before 1923. This book may have occasional imperfections such as missing or blurred pages, poor pictures, errant marks, etc. that were either part of the original artifact, or were introduced by the scanning process. We believe this work is culturally important, and despite the imperfections, have elected to bring it back into print as part of our continuing commitment to the preservation of printed works worldwide. We appreciate your understanding of the imperfections in the preservation process, and hope you enjoy this valuable book. ++++ The below data was compiled from various identification fields in the bibliographic record of this title. This data is provided as an additional tool in helping to ensure edition identification: ++++ La Mythologie Andrew Lang A. Dupret, 1886 Social Science; Folklore & Mythology; Mythology; Religion; Rites and ceremonies; Social Science / Folklore & Mythology",N/A,N/A,en
The Hero with a Thousand Faces,['Joseph Campbell'],1988,['Social Science'],"A study of heroism in the myths of the world - an exploration of all the elements common to the great stories that have helped people make sense of their lives from the earliest times. It takes in Greek Apollo, Maori and Jewish rites, the Buddha, Wotan, and the bothers Grimm's Frog-King.",N/A,N/A,en
Introduction to the Science of Religion,['F. Max Muller'],2006-05-01,['Religion'],"Many of the earliest books, particularly those dating back to the 1900s and before, are now extremely scarce and increasingly expensive. Hesperides Press are republishing these classic works in affordable, high quality, modern editions, using the original text and artwork.",N/A,N/A,en
Greek mythology,['John Pinsent'],1982,['Antiquities'],N/A,N/A,N/A,en
An Introduction to Greek Mythology,['David Bellingham'],1996,"['Mythology, Greek']","The legends of ancient Greece have come down through the ages in various permutations, never failing to entrance generation upon generation. This handsome volume presents the myths in the most accesible form, the stories are told simply but intriguingly",N/A,N/A,en
Larousse World Mythology,['Pierre Grimal'],1977,['Mythology'],N/A,N/A,N/A,en
The Folktale,['Stith Thompson'],1977,['Social Science'],"As interest in folklore increases, the folktale acquires greater significance for students and teachers of literature. The material is massive and scattered; thus, few students or teachers have accessibility to other than small segments or singular tales or material they find buried in archives. Stith Thompson has divided his book into four sections which permit both the novice and the teacher to examine oral tradition and its manifestation in folklore. The introductory section discusses the nature and forms of the folktale. A comprehensive second part traces the folktale geographically from Ireland to India, giving culturally diverse examples of the forms presented in the first part. The examples are followed by the analysis of several themes in such tales from North American Indian cultures. The concluding section treats theories of the folktale, the collection and classification of folk narrative, and then analyzes the living folklore process. This work will appeal to students of the sociology of literature, professors of comparative literature, and general readers interested in folklore.",N/A,N/A,en
The Complete Idiot's Guide to World Mythology,"['Evans Lansing Smith', 'Nathan Robert Brown']",2008,['Literary Criticism'],"The dictionary defines mythology as a collection of ancient tales handed down over millennia, mainly dealing with gods and goddesses, that explains the way the world works, from natural events to society at large. Many people think of the deities of Greece and Rome when they think of mythology, forgetting that almost every culture has its own set of myths to interpret and explain its distinct worldview, often showing striking and fascinating similarities to the classical myths most people are familiar with. The Complete Idiot's Guide to World Mythologyexplores the gods and goddesses, heroes and heroines, monsters and angels of the myths from every corner of the globe - the Americas, the Middle East and Africa, Asia, and more. Additionally, it explores the parallels between every culture, including Greece and Rome - striking similarities in mythic figures and the structure, action, wording, and result of the stories themselves.",N/A,N/A,en
The Book of Imaginary Beings,['Margarita Guerrero'],1987,"['Animals, Mythical']",N/A,N/A,N/A,en
Transformations of Myth Through Time,['Joseph Campbell'],1990,['Fiction'],"A collection of thirteen lectures, all given near the end of Joseph Campbell's life, that examine the great sweep of mythological development around the world and across the ages.",N/A,N/A,en
Dream Angus,['Alexander McCall Smith'],2006,['Fiction'],"If he's in the right mood, divine Angus might grant you sight of your true love in a dream; you might even fall in love with him - but he'll never love you back. This book retells the Myth of Dream Angus as part of the Canongate Myths series.",N/A,N/A,en
Gods and Myths of Northern Europe,['Hilda Roderick Ellis Davidson'],1986,['Mythology'],N/A,N/A,N/A,en
Myth,['Robert Alan Segal'],2015,['Religion'],"This Very Short Introduction explores different approaches to myth from several disciplines, including science, religion, philosophy, literature, and psychology. In this new edition, Robert Segal considers both the future study of myth as well as the impact of areas such as cognitive science and the latest approaches to narrative theory.",5,N/A,en
The Flight of the Wild Gander,['Joseph Campbell'],1990,['Fiction'],"""Exploration in the mythological dimensions of fairy tales, legends, and symbols""--Cover subtitle.",4,N/A,en
The Blood of Olympus,['Rick Riordan'],2015-05-07,"[""Children's stories""]","Though the Greek and Roman crew members of the Argo II have made progress in their many quests, they still seem no closer to defeating the earth mother, Gaea. Her giants have risen - all of them - and they're stronger than ever. The gods, still suffering from multiple personality disorder, are useless. How can a handful of young demigods hope to persevere against Gaea's army of powerful giants? As dangerous as it is to head to Athens, they have no other option. They have sacrificed too much already. And if Gaea wakes, it is game over . . .",5,N/A,en
The Cry for Myth,['Rollo May'],1991-05,['Literary Criticism'],"Rollo May, respected therapist and bestselling author of Love and Will, discusses the relationships between myths and the subconscious, showing how myths can provide meaning and structure for those who seek direction in a confused world. Here are case studies in which myths have helped Dr. May's patients make sense out of an often senseless world.",N/A,N/A,en
"Magic, Witchcraft, and Ghosts in the Greek and Roman Worlds",['Daniel Ogden'],2009,['History'],"In a culture where the supernatural possessed an immediacy now strange to us, magic was of great importance both in the literary and mythic tradition and in ritual practice. Recently, ancient magic has hit a high in popularity, both as an area of scholarly inquiry and as one of general, popular interest. In Magic, Witchcraft, and Ghosts in the Greek and Roman Worlds Daniel Ogden presents three hundred texts in new translations, along with brief but explicit commentaries. This is the first book in the field to unite extensive selections from both literary and documentary sources. Alongside descriptions of sorcerers, witches, and ghosts in the works of ancient writers, it reproduces curse tablets, spells from ancient magical recipe books, and inscriptions from magical amulets. Each translation is followed by a commentary that puts it in context within ancient culture and connects the passage to related passages in this volume. Authors include the well known (Sophocles, Herodotus, Plato, Aristotle, Virgil, Pliny) and the less familiar, and extend across the whole of Greco-Roman antiquity. The second edition includes a new preface, an updated bibliography, and new source-passages, such as the earliest use of the word ""mage"" in Greek"" (fr. Aeschylus' Persians ), a werewolf tale (Aesop's Fables), and excerpts from the most systematic account of ancient legislation against magic (Theodosian Code).",N/A,N/A,en
Bulfinch's Mythology (Illustrated),['Thomas Bulfinch'],2021-05-21,[],"""one of the most popular books ever published in the United States and the standard work on classical mythology for nearly a century""-Edith Hamilton. Most of the mythology books are boring. Bulfinch's Mythology is an attempt to solve this problem, by telling the stories of mythology in such a manner as to make them a source of amusement. In the ""Stories of Gods and Heroes"" the compiler has endeavored to impart the pleasures of classical learning to the English reader, by presenting the stories of Pagan mythology in a form adapted to modern taste. In ""King Arthur and His Knights"" and ""The Mabinogeon"" the attempt has been made to treat in the same way the stories of the second ""age of fable,"" the age which witnessed the dawn of the several states of Modern Europe. ""Hero myths of the British race"" and ""Legends of Charlemagne"" completed this book. Bulfinch interspersed the stories with his own commentary, and with quotations from writings by his contemporaries. This new edition (easy-to-read layout) contains illustrations or paintings.",N/A,N/A,en
Hellenosemitica,['Michael C. Astour'],1967,['Civilization'],N/A,N/A,N/A,en
The Golden Bough: pt. I. The magic art and the evolution of kings. 1926,['James George Frazer'],1925,['Magic'],N/A,N/A,N/A,en
