title,authors,publishedDate,categories,description,averageRating,textSnippet,language
In Search of Myths & Heroes,['Michael Wood'],2005,['Biography & Autobiography'],"In this companion to a forthcoming PBS series, Wood journeys to some of the remotest places on earth in search of four of mankind's most powerful myths: Shangri-La, Jason and the Golden Fleece, the Queen of Sheba, and King Arthur.",N/A,N/A,en
The New Golden Bough,['Sir James George Frazer'],1959,['Magic'],N/A,N/A,N/A,en
A Game of Retribution,['Scarlett St. Clair'],2022,['Fiction'],"""Fan favorite Scarlett St. Clair expands her universe of New Greece and the Hades and Persephone retellings with a new series told in Hades's point of view. Rediscover the world of A Touch of Ruin through the eyes of the God of the Underworld, Hades, as he tries to balance the demands of his position while maintaining his relationship with Persephone""--",N/A,N/A,en
Mythology for Storytellers,['Josepha Sherman'],2003,['Education'],Mythology has existed in some form in every human society that has left records. This collection of myths begins with a 16-page introductory essay on the definition of mythology.,N/A,N/A,en
Bulfinch's Mythology,['Thomas Bulfinch'],1913,"['Charlemagne (Romances, etc.)']",N/A,N/A,N/A,en
The New Golden Bough,['Sir James George Frazer'],1959,['Religion'],The classic study which relates magic and religion to the institutions and folk customs on which they are based,N/A,N/A,en
The Book of Imaginary Beings,"['Jorge Luis Borges', 'Margarita Guerrero']",1987,"['Animals, Mythical']",N/A,N/A,N/A,en
The Hero,[],1956,['Drama'],N/A,N/A,N/A,en
The Raw and the Cooked,['Claude Lévi-Strauss'],1975,['Animals'],N/A,N/A,N/A,en
Mythology,['Edith Hamilton'],1969,['Religion'],"Since its original publication by Little, Brown and Company in 1942, Edith Hamilton's Mythology has sold millions of copies throughout the world and established itself as a perennial bestseller in its various available formats: hardcover, trade paperback, and mass market paperback. Mythology succeeds like no other book in bringing to life for the modern reader the Greek, Roman, and Norse myths and legends that are the keystone of Western culture -- the stories of gods and heroes that have inspired human creativity from antiquity to the present. This new Back Bay trade paperback edition of Mythology replaces the Meridian edition formerly available from the Penguin Group. In August 1998 a new mass market paperback edition of Mythology published by Warner Books will replace the Mentor/Dutton Signet mass market edition formerly available from the Penguin Group.",N/A,N/A,en
The Dictionary of Mythology,['J. A. Coleman'],2015,['Fiction'],"""... packed with information on heroes and heroines, mythical beasts, imaginary characters, legendary artifacts, mythological places and celebrated historical figures ...The scope of the book ... covering ... many cultures and countries ...""--Dust jacket.",N/A,N/A,en
Brewer's Dictionary of Phrase and Fable,"['Chambers (ed.)', 'Philip Pullman']",2010,['English language'],Take the scenic route to knowledge,N/A,N/A,en
"Prolegomena to Homer, 1795",['Friedrich August Wolf'],1985,['Literary Collections'],The subjects Wolf addressed have dominated Homeric scholarship for almost two centuries. Especially important were his analyses of the history of writing and of the nature of Alexandrian scholarship and his consideration of the composition of the Homeric poems--which set the terms for the analyst/unitarian controversy. His exploration of the history of the transmission of the text in antiquity opened a new field of research and transformed conceptions of the relations of ancient and modern culture. Originally published in 1986. The Princeton Legacy Library uses the latest print-on-demand technology to again make available previously out-of-print books from the distinguished backlist of Princeton University Press. These editions preserve the original texts of these important books while presenting them in durable paperback and hardcover editions. The goal of the Princeton Legacy Library is to vastly increase access to the rich scholarly heritage found in the thousands of books published by Princeton University Press since its founding in 1905.,N/A,N/A,en
"Sex, Culture, and Myth",['Bronislaw Malinowski'],1963,['Culture'],N/A,N/A,N/A,en
Bulfinch's Mythology,['Thomas Bulfinch'],1979,['Chivalry'],"An extensive collection of classical Greek and Roman, Eastern, and Norse mythology.",N/A,N/A,en
"Folklore, Myths, and Legends",['Donna Rosenberg'],1997,['Business & Economics'],"Covers folklore, myths and legends in Africa, the Middle East, Europe, the Americas, and the Far East.",N/A,N/A,en
Ancient Egypt,"['Lorna Oakes', 'Lucia Gahlin']",2002,['History'],"An illustrated reference to the myths, religions, pyramids and temples of the land of the pharaohs.",N/A,N/A,en
Black Ships Before Troy,['Rosemary Sutcliff'],1993,"[""Children's stories""]","Retells the story of the Trojan War, from the quarrel for the golden apple, and the flight of Helen with Paris, to the destruction of Troy.",N/A,N/A,en
Bulfinch's Mythology,['Thomas Bulfinch'],1938,['Chivalry'],N/A,N/A,N/A,en
The Body of Myth,['J. Nigro Sansonese'],1994,['Health & Fitness'],"Long ago the ancestors of the Greeks, Romans, and Hindus were one people living on the Eurasian steppes. At the core of their religion was the ""shamanic trance,"" a natural state but one in which consciousness achieves a profound level of inner awareness. Over the course of millennia, the Indo-Europeans divided and migrated into Europe and the Indian subcontinent. The knowledge of shamanic trance retreated from everyday awareness and was carried on in the form of myths and distilled into spiritual practices--most notably in the Indian tradition of yoga. J. Nigro Sansonese compares the myths of Greece as well as those of the Judeo-Christian tradition with the yogic practices of India and concludes that myths are esoteric descriptions of what occurs within the human body, especially the human nervous system, during trance. In this light, the myths provide a detailed map of the shamanic state of consciousness that is our natural heritage. This book carries on from the works of Carl Jung and Joseph Campbell to show how the portrayal of consciousness embodied in myth can be extended to a reappraisal of the laws of physics; before they are descriptions of the world, these laws--like myths--are descriptions of the human nervous system.",N/A,N/A,en
Bulfinch's Mythology,['Thomas Bulfinch'],194?,"['Civilization, Medieval']",N/A,N/A,N/A,en
The Age of Fable,['Thomas Bulfinch'],2013,['Folklore'],N/A,N/A,N/A,en
Pagan & Christian Creeds,['Edward Carpenter'],1921,['Christianity'],N/A,5,N/A,en
Artificial Mythologies,['Craig J. Saper'],1997,['Literary Criticism'],"Artificial Mythologies was first published in 1997. Minnesota Archive Editions uses digital technology to make long-unavailable books once again accessible, and are published unaltered from the original University of Minnesota Press editions. Cultural critics teach us that myths are artificial. Cultural innovators use the artificial to make something new. In this exhilarating guide, Craig J. Saper takes us on an eye-opening tour of the process of cultural invention-willfully entertaining foolish, absurd, even fake, solutions as a way of reaching new perspectives on cultural problems. Saper deploys this method to reveal unsuspected connections among major cultural issues, such as urban decay, the dangers of television's power, family values, and conservative criticism of higher education. The model Saper uses builds on the later works of the revered French cultural critic Roland Barthes. These works, Saper argues, suggest poignant, playful, and productive ways of engaging dominant methodologies and mythologies. Artificial Mythologies shows us how, by allowing the artificial-our received ideas, common responses, and cultural mythologies-full play, we can arrive at provocative new solutions. The book demonstrates that the very conceptions of media and sociocultural issues that stymie innovation can be made to serve the cause of invention. Craig J. Saper is assistant professor in the Department of English at the University of Pennsylvania.",N/A,N/A,en
Norse Mythology,['Neil Gaiman'],2017,['Fiction'],"Neil Gaiman has long been inspired by ancient mythology in creating the fantastical realms of his fiction. Now he presents his fashioning of the primeval Norse myths into a novel, which begins with the genesis of the legendary nine worlds, delves into the exploits of the deities, dwarves, and giants, and culminates in Ragnarok, the twilight of the gods and the rebirth of a new time and people. Gaiman stays true to the myths while vividly recreating the characters -- the gods with their fiercely competitive natures, their susceptibility to being duped and to dupe others, and their tendency to let passion ignite their actions -- and making these long-ago myths breathe pungent life again.--",N/A,N/A,en
"The Age of Chivalry ; Legends of Charlemagne, Or Romance of the Middle Ages",['Thomas Bulfinch'],1997,['Mythology'],N/A,N/A,N/A,en
Bulfinch's Complete Mythology,['Thomas Bulfinch'],1989-01-01,['Literary Criticism'],"Tales of monsters, heroes, deities, and tragic lovers are narrated in this classic anthology of ancient legends",N/A,N/A,en
Heroes,['Stephen Fry'],2019,['Fiction'],"Few mere mortals have ever embarked on such bold and heart-stirring adventures, overcome myriad monstrous perils, or outwitted scheming vengeful gods, quite as stylishly and triumphantly as Greek heroes. In this companion to his bestselling Mythos, Stephen Fry brilliantly retells these dramatic, funny, tragic and timeless tales. Join Jason aboard the Argo as he quests for the Golden Fleece. See Atalanta - who was raised by bears - outrun any man before being tricked with golden apples. Witness wily Oedipus solve the riddle of the Sphinx and discover how Bellerophon captures the winged horse Pegasus to help him slay the monster Chimera. Heroes is the story of what we mortals are truly capable of - at our worst and our very best.",N/A,N/A,en
The Masks of God,['Joseph Campbell'],1959,['Fiction'],"Written between 1962 and 1968, Campbell's four-volume work The Masks of God covers mythology from around the world, from ancient to modern. Where The Hero with a Thousand Faces focused on the commonality of mythology (the ""elementary ideas""), the Masks of God books focus upon historical and cultural variations the monomyth takes on (the ""folk ideas""). In other words, where The Hero with a Thousand Faces draws perhaps more from psychology, the Masks of God books draw more from anthropology and history. The four volumes of Masks of God are as follows: Primitive Mythology, Oriental Mythology, Occidental Mythology, and Creative Mythology.",N/A,N/A,en
The Portable Jung,['Carl Gustav Jung'],1971,['Psychology'],Collects the most notable writings of Carl Jung. Includes a biography and a chronology.,N/A,N/A,en
Loki: A Bad God's Guide to Being Good,['Louie Stowell'],2022-06-14,['Juvenile Fiction'],"I, Loki, the mighty trickster god, have been banished by Odin to live on Earth as an eleven-year-old boy. To get back home I must... 1) Do good deeds (so tedious) 2) Go to school (so cruel) 3) Put up with Thor (so many farts). Wish me luck! Or don't. I care not for the opinion of mere mortals.",N/A,N/A,en
Women's Encyclopedia of Myths and Secrets,['Barbara G. Walker'],1996,['Reference'],"A comprehensive reference on mythology, anthropology, religion and sexuality from a feminist point of view.",N/A,N/A,en
"Myths, Dreams, and Mysteries",['Mircea Eliade'],1967,"['Body, Mind & Spirit']",N/A,N/A,N/A,en
The Flood Myth,['Alan Dundes'],1988,['Social Science'],N/A,N/A,N/A,en
Fables and Reflections,['Neil Gaiman'],1991,"['Comic books, strips, etc']","An attempt to summon and imprison Death, results, instead, in the capture of Morpheus, the Sandman, who must regain the tools of his powers.",N/A,N/A,en
The Myth of the Eternal Return,['Mircea Eliade'],1954,['Cosmology'],N/A,N/A,N/A,en
Monk and Robot,['Becky Chambers'],2025-05-06,['Fiction'],"Becky Chambers' two award-winning, bestselling, beloved, and uplifting Monk and Robot stories, A Psalm for the Wild-Built and A Prayer for the Crown-Shy, together in trade paperback for the first time! Becky Chambers' delightful, post-Utopian, Hugo Award-winning series gives us hope for the future. It's been centuries since the robots of Panga gained self-awareness and laid down their tools; centuries since they wandered, en masse, into the wilderness, never to be seen again; centuries since they faded into myth and urban legend. One day, the life of a tea monk is upended by the arrival of a robot, there to honor the old promise of checking in. The robot cannot go back until the question of ""what do people need?"" is answered. But the answer to that question depends on who you ask, and how. They're going to need to ask it a lot. Becky Chambers' series asks: in a world where people have what they want, does having more matter? This book includes both A Psalm for the Wild-Built and A Prayer for the Crown-Shy in paperback for the first time!",N/A,N/A,en
The Signifying Monkey,['Henry Louis Gates'],1988,['Literary Criticism'],"Pronde's the critical framework to examine several major works including, Their eyes were watching God by Zora Neale Hurston, Invisible man by Ralph Ellison, and Mumbo jumbo by Ishmael Reed.",3,N/A,en
