title,authors,publishedDate,categories,description,averageRating,textSnippet,language
Bardo or not Bardo,['Antoine Volodine'],2004,['Novel'],"Les sept chapitres de ce roman mettent en scène des mourants qui ne savent pas toujours qu'ils sont en train de mourir et se retrouvent dans des lieux oniriques ou tout à fait réalistes, et font face à une série d'épreuves initiatiques en entendant, par divers moyens, la voix du ""Livre des morts tibétain"".",N/A,N/A,fr
Flowers in the Rain & Other Stories,['Rosamunde Pilcher'],1991,['Large type books'],Sixteen short stories by the author whose themes deal with various forms of love.,N/A,N/A,en
Non-Combatants and Others,['Dame Rose Macaulay'],2012-01,[],"Unlike some other reproductions of classic texts (1) We have not used OCR(Optical Character Recognition), as this leads to bad quality books with introduced typos. (2) In books where there are images such as portraits, maps, sketches etc We have endeavoured to keep the quality of these images, so they represent accurately the original artefact. Although occasionally there may be certain imperfections with these old texts, we feel they deserve to be made available for future generations to enjoy.",N/A,N/A,en
Rochelle,['Eric Fottorino'],2005,['Fiction'],"C'est l'histoire d'un jeune homme et d'une vieille ville. Enfant naturel, Paul Dupaty cherche les traces de son père absent dans une cité océane qui désarme ses navires. Mais comment trouver l'auteur de ses jours quand il n'est plus qu'une ombre sur les photos de famille ? Et pourquoi Rochelle, la belle Rochelle, a-t-elle mis la mer en fuite ? Sur cette double partition de l'identité, un premier roman où l'on rencontre déjà les personnages de Korsakov : Lina l'éternelle femme-enfant et son fils, à jamais égarés dans le monde des adultes.",N/A,N/A,fr
Malcolm,['James Purdy'],1966,['Drama'],"THE STORY: In the words of Stanley Kauffmann, the play, ...which is a fantasy of the corruption of innocence, concerns a fourteen- or fifteen-year-old boy, well-dressed and well-spoken, who--when we meet him--has been sitting daily on a bench in front",N/A,N/A,en
"Silence, on ment",['Gilles Martin-Chauffier'],2003,['Novel'],"En apparence, tout oppose Richard Tessler, l'animateur vedette de Canal Première, qui manie la langue comme une arme de combat, et Hassan Elgann, l'ailier droit de l'équipe de France, au physique de pharaon émacié, le crâne rasé, le verbe rare, soudé à son clan familial dans le 93. En apparence, seulement. Ces deux fauves ont au moins un rêve en commun : Delphine, blonde aux jambes affolantes, aussi cynique que Tessler dont elle ne fera qu'une bouchée. En la raccompagnant chez elle, Richard voit ce qu'il n'aurait pas dû voir : une émeute dans la cité où un enseignant se fait molester puis tombe dans le coma. La police cherche les responsables et surtout leur commanditaire. Richard sera-t-il impliqué ? Alors la bluette entre "" happy few "" des plateaux télé vire à la série noire. Chacun verra son passé resurgir. On découvrira, au passage, que tout le monde ment. Et se ment. Tessler a effacé toutes traces de ses origines, le clan Elgann flirte avec le banditisme, Delphine est une manipulatrice hors pair. Mais au juste, qui manipule qui ? Avec le brio et la causticité qu'on lui connaît, Gilles Martin-Chauffier ne décrit plus seulement les coulisses du Tout-Paris médiatique, il aborde ici les problèmes de notre société : en fustigeant les "" grandes consciences "" qui, sous couvert de morale, font des banlieues le théâtre de leurs ambitions, il pose des questions gênantes. Comment s'intégrer à la société française ? Et qu'arrive-t-il quand on s'affranchit des règles ?",N/A,N/A,fr
Opera and the Novel,['Michael Halliwell'],2005,['Art'],"Opera and the Novel: The Case of Henry James offers the first full-length study of the theory and practice of the adaptation of fiction into opera: the transference of a work from one medium to another - metaphrasis - is its point of departure. Starting with a survey of the current thinking regarding the nexus between words and music with specific reference to operatic adaptation of existing literary works, it traces the four-hundred-year history of opera, demonstrating that the novel has become increasingly attractive to librettists and composers as an operatic source. As the resources of modern music theatre have increased in sophistication, so too have the possibilities for an expanded engagement with complex fictional works. The intricate relationship between fictional and musical narrative is examined: the proposition that the orchestra assumes much of the function of the narrator in fiction is explored. The second section is a detailed examination of eight operatic works based on Henry James's fiction. It is opera's unique capability to present the intense emotional and psychological situations central to James's fiction as well as the ability to engage with his synthesis of melodrama and psychological ambiguity which makes James's work peculiarly amenable to operatic adaptation. Composers who have used James as a source include Douglas Moore, Benjamin Britten, Thomas Pasatieri, Donald Hollier, Thea Musgrave, Philip Hagemann and Dominick Argento. The operas discussed represent a contemporary critical and often self-conscious engagement with the art form itself as well as illustrating current adaptive strategies, and suggest ways in which new operatic paths may be forged. This volume is of relevance to students and scholars of English literature and opera as well as readers who take an interest in intermedial research and the question of adaptation in general.",N/A,N/A,en
"Fasting, Feasting",['Anita Desai'],1999,['Fiction'],"In a stirring new novel by the author of In Custody, an Indian sister and brother both attempt to balance the pressures of traditional family life and individual self-expression. Original.",N/A,N/A,en
Doris Lessing,"['Carey Kaplan', 'Ellen Cronan Rose']",1988,['Literary Criticism'],"Long neglected by the academic world because of her rejection of belletristic values and resistance to convenient literary taxonomy, Doris Lessing has nonetheless built an international following of serious, dedicated readers. Acknowledging the difficulties posed by the multiple dimensions of Lessing’s work, Kaplan and Rose have gathered eleven essays that address her artistic, philosophical, political, and psychological complexity, and so provide a welcome introduction to the extraordinary depth and diversity of this important contemporary novelist. Lessing has been described as an “alchemical” writer, in that her work is directed toward changing people’s lives and perceptions rather than simply recording experience. Accordingly, the contributors examine her various postures and tactics for the purpose of discovering how the alchemical elements inform her various personae. Frederick C. Stern discusses Lessing’s commitment to radical humanist thought, while Carey Kaplan examines how Lessing’s imperialist past has shaped her futuristic fiction. Elizabeth Abel offers a feminist interpretation of the pattern of brother-sister incest in Lessing’s work, showing how Lessing has established Antigone as a female alternative to the Oedipal myth of male incest. Particularly insightful is Eve Bertelsen’s report of her interview with Lessing, demonstrating how Lessing’s often evasive style of adversarial dialogue works in concert with her refusal to be conveniently pigeonholed by academic analysis. For those readers new to her work, Doris Lessing: The Alchemy of Survival will serve as a useful introduction to Lessing’s concerns and techniques. Those who have long admired her writing will find in this collection new keys to understanding Lessing’s philosophical, political, and psychological complexity.",N/A,N/A,en
A Summer Bird-cage,['Margaret Drabble'],1962,[],N/A,N/A,N/A,en
For the Term of His Natural Life,['Marcus Clarke'],1970,['Australian fiction'],N/A,N/A,N/A,en
Bail Up!,['Hume Nisbet'],1890,['Bushrangers'],"Fiction based on a factual localities and native colouring; Situated in Queensland, near Brisbane.",N/A,N/A,en
Anagrams,['Lorrie Moore'],1987,['Fiction'],"The difficult life of Benna, a woman of mysterious adaptability, is followed as she transforms herself through a variety of wild careers--from a nightclub singer to an aerobic instructor for senior citizens--and revealing relationships with eccentric friends",N/A,N/A,en
The Railwayman's Wife,['Ashley Hay'],2013-04-01,['Fiction'],"Three people, struggling to come to terms with great loss after the end of the war, search for peace in a small town's library in a heartbreaking novel of love and loss and the healing power of memory and words.",5,N/A,en
Fascination,['Rachid Boudjedra'],2000,['Novel'],"Eleveur de pur-sang arabes (dont une lignée de juments porte le nom de Fascination) sur les hauts plateaux constantinois, Ila souffre d'une stérilité qui le ronge intérieurement. Il passe sa vie à adopter des enfants, croiser ses chevaux avec d'autres races, imiter les grands voyageurs qu'il ne cesse de lire et séjourner dans les geôles coloniales. Parmi ses enfants, l'aînée, quelque peu extravagante, préfère les femmes aux hommes mais entretient des rapports ambigus avec Lam, l'un de ses frères adoptifs, auquel elle se donne la veille de son départ au maquis. Lam, sa vie durant, hanté par cet inceste qu'il croit avoir commis, va bourlinguer à son tour de Constantine aux Aurès, de Tunis à Moscou où il soigne une grave blessure de guerre, de Barcelone à Hanoï et Pékin où il fait du trafic d'armes ; à l'image de son père adoptif, toujours parti à la recherche de l'étalon miraculeux. Ce roman de l'errance et de l'inassouvissement s'adosse à l'Histoire pour tenter de donner un sens au monde.",N/A,N/A,fr
Seasons Out of Time,['B. J. Kruse'],N/A,[],N/A,N/A,N/A,en
The Bounty of the Goddess,['Buddhadeba Guha'],2004,['Fiction'],"The Bounty Of The Goddess is the English translation of Buddhadev Guha's nivel, Kojagar in Bengali which is a perennial bestseller for the last four decades. The novel depicts the life of the tribal inhabiting the obscure spaces of India.",N/A,N/A,en
My Argument with the Gestapo,['Thomas Merton'],1969,['American fiction'],"Of the full-length prose works that Thomas Merton wrote before he entered the Cistercian Order in 1941, only My Argument with the Gestapo has survived--perhaps in part because it was a book that Merton never ceased wanting to see in print. Although it first appeared after his death in 1968, he had arranged for its publication, written a foreword for it, and was delighted with the prospect of its at last becoming a part of his published works. My Argument with the Gestapo tells of the adventures of a young man, clearly identified by the name Thomas Merton, who travels from America to Europe to report on the war with Germany from the viewpoint of a poet. He hates the war, yet is driven to come to terms with it. There is a pervading sense of dreamworld or hallucination, heightened by the device of passages written in a macaronic language, invented from multilingual roots, to satirize and parody political propaganda speeches dealing with the war. A work of imagination (Merton did not in fact return to England after the start of World War II in Europe), it nevertheless contains much that is autobiographical and revealing of the young Merton. Most clearly visible are the seeds of his never-forsaken concern with peace and nonviolence and his abhorrence of war. Indeed, his outspoken criticism of Britain at a time when all the emphasis was on ''the brave little island standing alone"" foreshadows his devotion to truth as he saw it, no matter what the cost. And students of Merton will find scenes in the book that are straight autobiography, amplifying and perhaps filling in gaps in what later was to be the beginning of Merton's great literary success, The Seven Storey Mountain",N/A,N/A,en
Warwyck's Woman,['Rosalind Laker'],1978,['Fiction'],"In order to appease his uncle, who deplores his activities as a prize fighter, rich, young Daniel Warwyck buys a woman at auction and pretends that she has become his wife. Daniel falls in love with his purchase and she with him, but neither realizes the other's feelings. Set against the background of Regency England.",N/A,N/A,en
Fergus,['Brian Moore'],1995,['Fiction'],N/A,N/A,N/A,en
This Other Eden,['Marilyn Harris'],1977,['Historical fiction'],Story of French Revolution in London.,N/A,N/A,en
Alone,['Beverley Farmer'],1984,['Fiction'],N/A,N/A,N/A,en
Berry and Co,['Dornford Yates'],1981,[],N/A,N/A,N/A,en
Jordanstown,['Josephine Winslow Johnson'],1937,['African Americans'],"In the novel, a handful of people in a small town struggle to push back against their poverty and to provide better jobs and opportunities for themselves.This uprising is led by Allen Craig, who has managed to scrape together the funds to purchase the local newspaper, and through that medium he begins to criticize the local powers-that-be, encouraging hope in the ones struggling during these hard times as society is still reeling from the Depression, while exciting resentment from those he attacks.",N/A,N/A,en
A Summer Bird-cage,['Margaret Drabble'],1963,['Sisters'],N/A,N/A,N/A,en
The Moonraker,['Richard Dumbledore'],1877,['Novel'],N/A,N/A,N/A,en
Singing,['Alison Croggon'],2009-05-04,['Fiction'],"THE FOURTH AND FINAL BOOK IN THE CRITICALLY ACCLAIMED PELLINOR SERIES In a desperate race against the Dark, Maerad must try to solve the final riddle of the Treesong. Only then will the Nameless One be defeated and peace restored in the Seven Kingdoms. But Maerad only holds the key to half the riddle – her long-lost brother, Hem, has the other. Before embarking on a perilous journey to find Hem, Maerad must first wage an epic war against the Landrost. And Hem, fleeing the advances of the Black Army, must endure betrayal and mortal illness in his search for Maerad. But the Dark grows ever more powerful – will brother and sister reach one another in time or will all be lost in a final, apocalyptic battle? 'Passionate, inspiring characters . . . vividly described landscapes . . . a great series of fantasy novels . . . ' THE BOOKSELLER (UK) 'This is a quest narrative, one of the most durable and enchanting kinds of story . . . Croggon tells it fluently and confidently.' SYDNEY MORNING HERALD Visit betweenthelines.com.au - the destination for Young Adult books.",N/A,N/A,en
Los vampiros de la mente,['Dan Simmons'],1992,['Novel'],N/A,3,N/A,es
The Blue and the Black,['王藍'],1987,['Chinese fiction'],N/A,N/A,N/A,en
Charles the Bold,['Yves Beauchemin'],2006,['Fiction'],Follows the boyhood of a Montrealer born in 1966.,N/A,N/A,en
The Able McLaughlins,['Margaret Wilson'],2019-09-09,[],"he Able McLaughlins is a 1923 novel by Margaret Wilson first published by Harper & Brothers. It won the Pulitzer Prize for the Novel in 1924. It won the Harper Prize Novel Contest for 1922-23, the first time the prize was awarded. Wilson published a sequel, The Law and the McLaughlins, in 1936.A pre-publication notice described it as ""a story of pioneer life in Iowa in Civil War times"" focused on ""a family of Scotch Covenanters."" Some reviews praised the novel but viewed its prize-winning status differently. Allan Nevins called it ""remarkable for the unity of impression produced"" and added that ""the book would win rapid distinction if introduced without its blue ribbon."" But the Boston Transcript's reviewer wrote: ""The book is so good as a first novel that it is impossible not to regret that it must always be judged as a prize novel."" The New York Times was less enthusiastic: ""Miss Wilson does quite well with her characters, develops them by phrase and incident. In the mechanics of story-telling she appears less practiced; or, perhaps, more labored. The novel does not always run smoothly from one incident to the next.""Book Review Digest provided a summary: Wully McLaughlin, doughty but inarticulate young hero, returns from Grant's army to find that his sweetheart, Christie McNair, has fallen a victim, against her will, to the scapegrace of the community, Peter Keith. She has concealed her plight from every one [sic], but cannot conceal it from him. Wully grasps the situation with masterful promptness. He makes Peter leave under threat of death, marries Christie, and accepts the paternity of her child and the blame for its disgracefully early birth. Peter steals back to see the woman he violated, at a time when the anger of Wully and Christie against him has not lost a degree of its incandescence. Wully hunts him with a shotgun, but he has disappeared. Then, a few weeks later, Wully suddenly finds him-and revenge and forgiveness are reconciled in Miss Wilson's last pages with surprising convincingness.",N/A,N/A,en
The Habit of Love,['Namita Gokhale'],2012,['Fiction'],"Key Features A collection of elegantly told stories about women by a well-known writer. About the Book: The Habit of Love Collection of stories offering a profound insight into the female mind!. The Habit of Love is a collection of stories about the inner lives of women. Some of these women inhabit the ancient past, some the present day but they share the whimsical humour with which they speak of themselves. Journalist Madhu Sinha strikes up a friendship with a young man the same age as her indifferent children; a messenger swan relates the story of the doomed lovers Nala and Damayanti; Vatsala Vidyarthi suspects her one night stand of stealing her money.",N/A,N/A,en
On the Far Side of the Mountain,['Jean Craighead George'],1999-09,['Brothers and sisters'],"Two years ago, Sam ran away from New York City to live in the Catskill Mountains. Now his younger sister Alice has joined him and is quietly living in a tree house of her own nearby. Their peaceful life is shattered when a conservation officer confiscates Sam's falcon, Frightful, and Alice suddenly vanishes. Sam leaves his home to search for Alice, hoping to find Frightful, too. But the trail to the far side of the mountain may lead Sam into great danger. ""Surpasses the original in style and substance . . . This story [is] a jewel."" --Booklist ""George has outdone herself here."" --Kirkus Reviews",N/A,N/A,en
Black Mirror,['Gail Jones'],2009,['Fiction'],"'I am waiting for this visitor so that I can tell my story and die.' The award-winning novel from Gail Jones Victoria Morrell was once a great artist. She led the high life - living and working in Paris, mixing with the artists of the Surrealist movement. Her work was largely forgotten in the fifties and sixties, but was rediscovered in the seventies when she became something of a cult figure on the London art scene. She now lives as a recluse in Hampstead, London. And she is dying. Anna Griffin is the young woman commissioned to write a biography of Victoria's life. In many ways their lives strangely intersect, since they grew up in the same mining town and share preoccupations with underground spaces, deserts and the many forms of grief. In a compelling double narrative, Gail Jones tracks Victoria's past as it intertwines with Anna's life. The stories Victoria tells enable both women to enter into new forms of sympathy and understanding. Elegant, enthralling, and emotionally charged, Black Mirror is both a novel of love and family mystery, and a meditation on the nature of artistic vision and obsession.",N/A,N/A,en
The Testament of Gideon Mack,['James Robertson'],2006,['Fiction'],"Mack is a minister who doesn't believe in God, the Devil or an afterlife. One day he discovers a standing stone in the middle of a wood where previously there had been none. Unsure what to make of this apparition, Mack's life begins to unravel dramatically.",N/A,N/A,en
The Gone-away Man,['Lucy Walker'],1969,['Novel'],N/A,N/A,N/A,en
Mark,['Lonnie Coleman'],1981,['Gay youth'],"Set in Montmorency, Alabama and Savannah, Georgia in the 20s and 30s, the book is fictional memoir of Mark, a young boy orphaned by the death of both parents and raised by his aunt and uncle, from adolescence to adult hood, and ending with the outbreak of World War II.",N/A,N/A,en
A Question of Upbringing,['Anthony Powell'],1951,['Fiction'],Roman.,N/A,N/A,en
The Heart of Yoknapatawpha,['John Pilkington'],1981,['Literary Criticism'],"Pilkington brings the soul of a historian to the study of Faulkner's arguably best fiction. This is a splendid treatment of Faulkner's Yoknapatawpha novels from 1929 to 1942. It places them not only within the context of his whole body of work and his time, but also in the larger context of American literature and his relationships with its other makers. At the same time that Professor Pilkington provides new insights into these major works, he draws on the broad background of previous scholarship and criticism. Thus this is a valuable book both for the novice and the veteran, the general reader and the specialist. It is written with sensitivity and good sense, with clarity and grace. It should become a standard work in the Faulkner commentary. - Back cover.",N/A,N/A,en
Is this the Way You Said?,['Adam Thorpe'],2006,['Fiction'],"Celebrated as a novelist of breathtaking historical range and depth, Adam Thorpe is also an accomplished and celebrated writer of short fiction, and the stories collected here show his deftness with character, his enormous versatility of voice. In the title story, an expectant first-time novelist meets the publisher who has asked him to lunch, only to find himself drawn, unwittingly and inexorably, into a terrible personal tragedy. In 'The Concert Interval' Rob, an orchestral tympanist, sees his life crumble over the half-time coffee and sandwiches. In 'Heavy Shopping' a business executive is called in the middle of an important conference in Scotland with the news that his wife has given birth prematurely; his inability to cope with the resulting divided loyalties, and the way he deals with his own passive indecisiveness, reveals the terrifying emotional vacuum in his life. Exquisitely written, these stories breathe life into their characters, exposing their deepest desires, their catastrophic fears, their perilous frailty in the face of the responsibilities they carry; they are the work of one of Britain's most important writers, working at the height of his powers.",N/A,N/A,en
Poor Man's Orange,['Ruth Park'],1977,['Australian fiction'],"'She knew the poor man's orange was hers, with its bitter rind, its paler flesh, and its stinging, exultant, unforgettable tang. So she would have it that way, and wish it no other way. She knew that she was strong enough to bear whatever might come in her life as long as she had love.' Only Ruth Park understands so well what it is like to grow to womanhood in the inner-city slums of Sydney during the years immediately after World War II. She likes the people she writes about and has a rare skill in evoking them. In this poignant sequel to The Harp in South she tells of the Darcy family, and their vitality and humour in the midst of acute poverty.",N/A,N/A,en
Memoirs of a Midget,['Walter De la Mare'],1932,[],"Miss M., the narrator of these fictional memoirs, is a diminutive young woman (though just how diminutive, the author never says) with a ""passion for shells, fossils, flints, butterflies, and stuffed animals."" Miss M. tells of her early life as a dreamy orphan and, in particular, of her tempestuous twentieth year -- in which she falls in love with a beautiful and ambitious full-sized woman and is courted by a male dwarf. Concluding that she must choose either to simply tolerate her difference or grow callous to it, Miss M. resolves to become independent by offering herself up as a spectacle in a circus. Book jacket.",N/A,N/A,en
Amitav Ghosh,['Brinda Bose'],2003,['Literary Criticism'],"Amitav Ghosh: Critical Perspectives Presents A Wide Range Of Incisive Scholarly Criticism On The Eminent Indian Writer'S Work To Date. With An Introduction That Places Amitav Ghosh In The Context Of His Historical/Cultural/ Social/Political Times, This Anthology Brings Together Both Established And New Critics In Their Perceptive Grasp Of Ghosh'S Extraordinary Oeuvre Of Fiction, Staring From The Circle Of Reason(1986) Through The Shadow Lines(1988), In An Antique Land(1992)And The Calcutta Chromosome(1996) To The Fairly Recent The Glass Palace(2000), Ghosh'S Best-Known And Most Influential Piece Of Political Writing. A Greater Emphasis Is Placed On The Shadow Lines And In An Antique Land, Which Have Received The Widest Critical Attention And Are, As Yet, The Ghosh Text Most Taught In University Courses Across The World. An Innovative 'Pedagogy' Section In This Collection Also Explores These Texts From Both Teachers' And Students' Perspectives, As They Play Out In Classrooms At Locations As Far Apart As Delhi And The American Mid-West. An Interview With Amitav Ghosh Animates This Anthology With An Authorial Intervention That - Perhaps Unwittingly - Both Validates And Questions The Praxis Of Literary Critism Today In Its Peculiarly Postmodern Predicament.",N/A,N/A,en
A Love of Innocence,['Robin Jenkins'],1963,['novel'],N/A,N/A,N/A,en
