title,authors,publishedDate,categories,description,averageRating,textSnippet,language
Teen spirit,[],2002,[],"Bruno, la trentaine, est batteur dans un groupe de rock. Il est un peu irresponsable, pas assez adulte pour savoir se débrouiller tout seul. Alors quand il apprend qu'il est le père d'une enfant de treize ans, il ne sait comment l'assumer. Un roman sur la paternité, la maternité et l'adolescence.",N/A,N/A,fr
The Empty House,['Rosamunde Pilcher'],1973,['Fiction'],"Virginia Keole, recently widowed and uncertain of her future, is prompted to decision and action by Eustace Phillips, a man she once loved. (Romance).",N/A,N/A,en
The Last Tycoon,['Francis Scott Fitzgerald'],1969,['First loves'],Monroe Stahr is a studio executive who has worked obsessively to produce high-quality films without regard to cost. At age 35 he is almost burned out. This is the story of how he loses control of ever.,N/A,N/A,en
Jonah's Gourd Vine,['Zora Neale Hurston'],1990-01-22,['Fiction'],"Despite being a married man and pastor of Zion Hope, John Buddy Pearson is a ""natchel man"" during the week ""who loves too many women for his own good.""--Back cover.",N/A,N/A,en
The Motorcycle Diaries,['Che Guevara'],2014,[],"The story of a road journey, in the words of a 23-year-old medical student known as ""Che"". There are fights, parties, and serious drinking, and moving examples of Guevara's idealism and solidarity with the oppressed. A record of Guevara's thoughts as he journeyed around South America in the early 1950's.",N/A,N/A,en
The Secret Garden,"['Frances Hodgson Burnett', 'Tasha Tudor']",1976,['Children with disabilities'],Ten-year-old Mary comes to live in a lonely house on the Yorkshire moors and discovers an invalid cousin and the mysteries of a locked garden.,N/A,N/A,en
Chamán,['Noah Gordon'],2000,['American fiction'],"From the wide-open prairie of frontier Illinois to the war-torn fields of the Civil War, this quintessential epic of 19th-century America sweeps across decades of conflict and change. Persecuted as an heir to a family of healers who have been practicing medicine for generations, Dr. Rob J. Cole leaves behind Scotland to pursue his destiny in America. Little does he know that his journey West to the Great Plains, and a fateful encounter with a Native American healer called ""Bear Woman,"" will change his life forever.",3,N/A,es
A quoi rêvent les loups,[],1999,[],"Par quel cheminement aberrant un homme ordinaire peut-il,sans crier gare,sombrer dans l'horreur de la folie?C'est ce glissement inexorable que nous décrit yasmina Khadra à travers l'histoire de Nafa Walid,un jeune acteur qui rêvait de gloire et de pactole avant de se réveiller au coeur même du cauchemar.",N/A,N/A,fr
Narcopolis,['Jeet Thayil'],2012,['Bombay (India)'],"Shortlisted for the 2012 Man Booker Prize Jeet Thayil's luminous debut novel completely subverts and challenges the literary traditions for which the Indian novel is celebrated. This is a book about drugs, sex, death, perversion, addiction, love, and god, and has more in common in its subject matter with the work of William S. Burroughs or Baudelaire than with the subcontinent's familiar literary lights. Above all, it is a fantastical portrait of a beautiful and damned generation in a nation about to sell its soul. Written in Thayil's poetic and affecting prose, Narcopolis charts the evolution of a great and broken metropolis. Narcopolis opens in Bombay in the late 1970s, as its narrator first arrives from New York to find himself entranced with the city's underworld, in particular an opium den and attached brothel. A cast of unforgettably degenerate and magnetic characters works and patronizes the venue, including Dimple, the eunuch who makes pipes in the den; Rumi, the salaryman and husband whose addiction is violence; Newton Xavier, the celebrated painter who both rejects and craves adulation; Mr. Lee, the Chinese refugee and businessman; and a cast of poets, prostitutes, pimps, and gangsters. Decades pass to reveal a changing Bombay, where opium has given way to heroin from Pakistan and the city's underbelly has become ever rawer. Those in their circle still use sex for their primary release and recreation, but the violence of the city on the nod and its purveyors have moved from the fringes to the center of their lives. Yet Dimple, despite the bleakness of her surroundings, continues to search for beauty--at the movies, in pulp magazines, at church, and in a new burka-wearing identity. After a long absence, the narrator returns in 2004 to find a very different Bombay. Those he knew are almost all gone, but the passion he feels for them and for the city is revealed.",N/A,N/A,en
The Horse and His Boy,['Clive Staples Lewis'],1997,['Horses'],N/A,N/A,N/A,en
The Holcroft Covenant,['Robert Ludlum'],1978,['Architects'],"Dertig jaar na de dood van zijn vader, een hooggeplaatste Nazi, ontvangt een jonge Amerikaanse architect van een bank in Genève een brief waarin hij gevraagd wordt een moeilijke opdracht te vervullen.",N/A,N/A,en
Gobi Or Shamo,['Gilbert Murray'],1890,['Novel'],N/A,N/A,N/A,en
The Wedding,['Danielle Steel'],2001,['Fiction'],"'The Wedding' is a portrait of real people in an unreal world. The author uses Hollywood as a backdrop to reveal the dreams, fears and expectations of a ceremony that unites us all - from movie stars, to nervous teenagers, to long-married couples.",N/A,N/A,en
"Léonore, toujours",['Christine Angot'],1997,['Novel'],N/A,N/A,N/A,fr
A Burnt-out Case,['Graham Greene'],1966,[],N/A,N/A,N/A,en
Notes from a Coma,['Mike McCormack'],2005,['Fiction'],"Rescued from the squalor of a Rumanian orphanage, and adopted by the rural community of west Mayo, the child that is named J.J. O'Malley should have grown up happy.. After a sudden tragedy, J.J. suffers a catastrophic mental breakdown. Unable to live with himself, he volunteers for an improbable government project which has been set up to explore the possibility of using deep coma as a future option within the EU penal system. When his coma goes online the nation turns to watch, and J.J. is quickly elevated to the status of cultural icon.. The story of a man cursed with guilt and genius and a compassionate examination of how our identities are safeguarded and held in trust by those who love us.",N/A,N/A,en
Inheritance,['Christopher Paolini'],2012,['Juvenile Nonfiction'],"Eragon Dragon Rider and Saphira have come further than anyone dared to hope in ridding their land of tyranny. But can they topple the evil king Galbatorix and restore justice to Alagaesia? And if so, at what cost?",1,N/A,en
Foucault's Pendulum,['Umberto Eco'],1990,['Fiction'],"Three Milan editors, who have spent much time rewriting crackpot manuscripts on the occult, decide to have a little fun. Their plan encompasses the secrets of the solar system, Satanic initiation rites, and Brazilian voodoo. A terrific joke--until people begin to disappear.",N/A,N/A,en
"Fat Man in History and Other Stories, The",['Peter Carey'],2020-03-03,['Fiction'],"The Fat Man in History and Other Stories combines the brilliant, bizarre, funny, chilling pieces originally published in The Fat Man in History and War Crimes (plus three stories not in either). Those from Fat Man posit what-ifs, with the title story wondering how, were some post-Marxist utopia to declare obesity counter-revolutionary, a household of fat men would strike back. Those from War Crimes are all in one way or another about power - those who wield it, those who want it, and those who recall either its dazzling exhilaration or degradation.",N/A,N/A,en
Sleepwalking Land,['Mia Couto'],2006,['Fiction'],"""On almost every page of this witty magical realist whodunit, we sense Couto's delight on those places where language slips officialdom's asphyxiating grasp.""--The New York Times Book Review on The Last Flight of the Flamingo ""The most prominent of the younger generation of writers in Portuguese-speaking Africa, Couto passionately and sensitively describes everyday life in poverty-stricken Mozambique.""--Guardian (London) ""Quite unlike anything else I have read from Africa.""--Doris Lessing As the civil war rages in 1980s Mozambique, an old man and a young boy, refugees from the war, seek shelter in a burnt-out bus. Among the effects of a dead passenger, they come across a set of notebooks that tell of his life. As the boy reads the story to his elderly companion, this story and their own develop in tandem. Written in 1992, Mia Couto's first novel is a powerful indictment of the suffering war brings. Born in 1955 in Mozambique, Mia Couto ran the AIM news agency during the revolutionary struggle. He now lives in Maputo where he works as an environmental biologist and heads the Mozambique side of the Limpopo Transnational Park. In 2007 he was the first African author to win the Latin Union Award for Romance Languages; in 2013 he was awarded the e100,000 Camões Prize for Literature, in recognition of his life's work. In 2014 he received the $50,000 Neustadt Prize for Literature, and in 2015 he was shortlisted for the Man Booker International Prize.",N/A,N/A,en
Amours transversales,['Catherine Cusset'],2004,['Man-woman relationships'],""" Quand elle avait quitté le studio à la tombée de la nuit, elle était éperdument amoureuse, elle juive, d'un Allemand trouvé en Italie. Il était beaucoup plus âgé qu'elle: trente-trois ans. Pendant des mois elle n'avait pu se réveiller sans voir le visage de Hans. Elle lui avait écrit une lettre. Il n'avait pas répondu. Elle n'avait jamais oublié Hans et cette délicatesse qui l'avait conduit à la laisser vierge. Le souvenir de Hans habite Myriam, qui est mariée à Xavier, qui tombe amoureux de Camille, qui rencontre Luis, qui aime Margarita, qui est morte. Ainsi s'entrelacent les fils de ces amours transversales - ces amours qui ne sont pas celles sur lesquelles on fonde sa vie, mais qui n'en sont pas moins importantes - jusqu'à la tragédie finale.",N/A,N/A,fr
L'occupation,['Annie Ernaux'],2002,['Jealousy'],""" J'avais quitté W. Quelques mois après, il m'a annoncé qu'il allait vivre avec une femme, dont il a refusé de me dire le nom. A partir de ce moment, je suis tombée dans la jalousie. L'image et l'existence de l'autre femme n'ont cessé de m'obséder, comme si elle était entrée en moi. C'est cette occupation que je décris. "" A.E.",N/A,N/A,fr
Flowers in the Rain & Other Stories,['Rosamunde Pilcher'],1991,['Fiction'],Sixteen short stories by the author whose themes deal with various forms of love.,N/A,N/A,en
All Our Worldly Goods,['Irène Némirovsky'],2008,['Fiction'],"In haunting ways this wonderful, compelling novel prefigures Suite Fran aise and some of the themes of N mirovsky's great unfinished sequence of novels. All Our Worldly Goods, though, is complete, and exquisitely so u a perfect novel in its own right. First published in France in 1947, after the author's death, it is a gripping story of family life and starcrossed lovers, of money and greed, set against the backdrop of France from 1911 to 1940 between two terrible wars. Pierre and Agn s marry for love against the wishes of his parents and the family patriarch, the tyrannical industrialist Julien Hardelot, provoking a family feud which cascades down the generations. This is Balzac or The Forsyte Saga on a smaller, more intimate scale, the bourgeoisie observed close-up with N mirovsky's characteristically sly humour and clear-eyed compassion. Full of drama and heartbreak, telling observation of the devastating effects of two wars on a small town and an industrial family, this is N mirovsky at the height of her powers. The exodus and flow of refugee humanity through the town in both wars foreshadows Suite Fran aise, but differently, because this is Northern France, near the Somme, and the town itself is twice razed. Taut, evocative and beautifully paced, the novel points up with heartbreaking detail and clarity how close were those two wars, how history repeated itself, tragically, shockingly... It opens in the Edwardian era, on a fashionable Normandy beach, and ends with a changed world, under Nazi occupation.",N/A,N/A,en
"Thank You, Jeeves",['P. G. Wodehouse'],1986-01,['England'],N/A,N/A,N/A,en
Accident nocturne,['Patrick Modiano'],2003,['Novel'],Analyse: Roman psychologique (intime).,N/A,N/A,fr
Little Women,['Louisa May Alcott'],1953,['Families'],Theatre program.,N/A,N/A,en
Court serpent,['Bernard Du Boucheron'],2004,"['Authors, French']","Un petit peuple issu d'Europe s'est établi "" au Nord du monde "", dans une solitude glacée où il s'acharne à survivre. Mais, au fil des siècles, les communications s'espacent, puis s'interrompent. L'oubli et l'abandon menacent. Court Serpent est le navire spécialement commandité et construit selon un savoir ancestral, à la fin du XVIe siècle, pour aller à la recherche de cette communauté pendue et lui porter secours. L'abbé Montanus, chargé de conduire l'expédition, de relever le diocèse et d'y ranimer la foi, raconte les épreuves inouïes qu'il a dû affronter pour parvenir au but. Son récit est aussi celui d'une aventure politique et spirituelle, que traverse un amour sacrilège. Il donne la clé de cette aventure fascinante dont débattent encore aujourd'hui historiens et archéologues.",N/A,N/A,fr
Why are We in Vietnam?,['Norman Mailer'],1967,['Alaska'],"A novel about a hunting trip in Alaska which turns into an initiation rite. Vietnam is mentioned only once and the book can be seen either as an allegory or a symbolic psychic explanation of America’s fighting in Vietnam. The author has won the Pulitzer Prize, The National Book Award for Arts and Letters (1969) and the 14th Annual Award for Outstanding Service to the Arts, McDowell Colony (1973).",N/A,N/A,en
"Harriet, the Spy",['Louise Fitzhugh'],1987,['Juvenile Fiction'],"Eleven-year-old Harriet keeps notes on her classmates and neighbors in a secret notebook, but when some of the students read the notebook, they seek revenge.",N/A,N/A,en
The Time is Noon,['Pearl Sydenstricker Buck'],1967,['Domestic fiction'],"A college graduate returns to her hometown in Pennsylvania. Then ""an unfortunate love affair, a mother's long illness, the aloof and meditative figure of her father, all cast their shadows. But Joan Richards, in her successive roles as daughter, sister, wife and mother, survives [and] grows stronger ... with fulfillment just ahead.""",N/A,N/A,en
The Haunted Mesa,"[""Louis L'Amour""]",1987,['Fiction'],Mike Raglan is drawn into the mystery of the disappearance of the Anasazi when he receives a desperate letter from an old friend.,N/A,N/A,en
Radicalizing Lawrence,['Robert Burden'],2000,['Language Arts & Disciplines'],"In this study of D.H.Lawrence and critical theory, Robert Burden pays particular attention to the critical formations that underpin the reception history of the main novels, including the much maligned ""leadership"" novels, because strong readings have always contested the meaning and significance of Lawrence, and because there has been a persistent reluctance to approach his writing through post-structuralist theory. This study demonstrates in some detail that once Lawrence's texts are the objects of the newer critical paradigms, their principles of coherence are understood differently; and that older notions of textual unity are displaced by aesthetic structures of degrees of generic and linguistic destabilization. This enables a radicalizing of Lawrence's fiction by drawing out its deconstructive effects on his myth-making and essentialist notions of the self. The sexual identities represented in the fiction are read as experiments, or ""thought adventures"", as Lawrence himself characterized his work. The different approaches to Lawrence's writing in this study lead to a radical reassessment of his relationship to Modernism, especially in the light of the more elastic concept of Modernism in recent discussion, and one which traditional Lawrence scholars have ignored. What emerges is a more self-deconstructive Lawrence, with some surprising results.",N/A,N/A,en
Burglars Can't be Choosers,['Lawrence Block'],1995,['Fiction'],"The novel that first introduced burglar-turned-sleuth Bernie Rhodenbarr follows his introduction to the world of crime-solving after he accepts an apparently simple job in Greenwich Village and suddenly realizes that he has been set up for a murder. Reissue. 50,000 first printing. Tour.",N/A,N/A,en
Silas Timberman,['Howard Fast'],1954,['Anti-communist movements in literature'],Silas Timberman is the academic victim of a McCathyite witch hunt.,N/A,N/A,en
The Seven Spiritual Laws of Success,['Deepak Chopra'],2017,['Novel'],N/A,5,N/A,en
Burr,['Gore Vidal'],1973,['Fiction'],The contemporary novelist uses a fictional memoir to illuminate Aaron Burr's life and times,4.5,N/A,en
Faith,['Len Deighton'],1995,['Fiction'],A New Bernard Samson novel.,N/A,N/A,en
The Red Badge of Courage,['Stephen Crane'],1968,"['Chancellorsville, Battle of, Chancellorsville, Va., 1863']",N/A,N/A,N/A,en
Kamal Jann,['Dominique Eddé'],2014,['Families'],"Dominique Edde's gripping novel tells the story of the doomed Jann family as they plot against one another for revenge and power. Kamal Jann, a successful lawyer in New York City, has a troubled past unseen to most. His uncle Sayf Eddine Jann, the head of the Syrian intelligence, has his parents killed, leaving kamal orphaned at the age of twelve, and then paid for Kamal's education, leading to eventual success. Now living in Manhatten, Kamal receives news that his uncle is planning a terrorist attack on Paris and has recruited Kamal's jihadist brother to carry it out.",N/A,N/A,en
Redback,['Lindy Cameron'],2010,['Fiction'],"Commander Bryn Gideon and the crack Australian 'Redback Retrieval Team' rescue hostages from Pacific island rebels. American journalist Scott Dreher, researching computer war-game training, uncovers links between Western government agencies and known terrorist groups.",N/A,N/A,en
The English Novel,['Walter Alexander Raleigh'],1907,['English fiction'],N/A,N/A,N/A,en
Mortal Fear,['Robin Cook'],1989,['Fiction'],Internist Jason Howard believes that eminent geneticist Dr. Alvin Hayes was murdered and that the key to his death lies hidden in the Boston Health Care Clinic's molecular genetics lab,N/A,N/A,en
The Rogue's March,['Ernest William Hornung'],1896,['Bookbinding'],N/A,N/A,N/A,en
Heavy Odds,['Marcus Clarke'],1896,['Australian fiction'],N/A,N/A,N/A,en
Darling,['Jean Teulé'],1998,['Novel'],"Elle voulait qu'on l'appelle Darling. Elle y tenait ! Pour oublier les coups reçus depuis l'enfance, les rebuffades et les insultes, pour effacer les cicatrices et atténuer la morsure des cauchemars qui la hantent. Elle voulait que les autres entendent, au moins une fois dans leur existence, la voix de toutes les Darling du monde. Elle a rencontré Jean Teulé. Il l'a écoutée et lui a écrit ce roman. Un livre unique. Derrière l'impitoyable lucidité de son humour, Jean Teulé célèbre le flamboyant courage de celles qui refusent de continuer à subir en silence la cruauté imbécile de la vie et des autres.",N/A,N/A,fr
The Weight of Water,['Anita Shreve'],1997,['Large type books'],"In 1873, on a desolate island off the New Hampshire coast, two women were violently murdered. More than a century later, Jean, a photojournalist, is sailing to that island to capture images for a photo-essay about the legendary crime. Along the way, she falls prey to uncontrollable emotions. As Jean immerses herself in the unsettling details of the murders, she begins to suspect her husband of having an affair with a woman accompanying them on the trip.",N/A,N/A,en
Babes in the Bush,['Rolf Boldrewood'],1900,['Novel'],N/A,N/A,N/A,en
The Rowan,['Anne McCaffrey'],1990,['Fiction'],"The Rowan was one of the strongest Talents ever born, but she was also lonely and without family, friends --or love. Then a telepathic message came from a distant world facing an alien threat, a message sent by an unknown Talent named Jeff Raven, and be it power, danger, or love--the Rowan is about to meet her match. Copyright © Libri GmbH. All rights reserved.",4,N/A,en
Exhibition,['Michka Assayas'],2002,['Novel'],""" Partout, les gens exhibaient leurs plaies mentales devant des inconnus. Ils exhibaient leur viol par leur père, leur homosexualité mal vécue à l'EDF, leur humiliation d'être trop gros, leur douleur de n'être pas remarqué, leur douleur d'être trop remarqué, leur stress après une victoire, leur stress après une défaite, leur harcèlement au travail, leur harcèlement au chômage. Tous exhibaient leur souffrance, tous faisaient pour ainsi dire la queue pour exhiber leur souffrance, parce qu'ils attendaient tous de l'exhibition de celle-ci une compensation à cette souffrance, l'exhibition constituant en somme le remède miracle, l'arme absolue contre la souffrance, un mal contre lequel l'argent et les loisirs organisés ne pouvaient rien, bien au contraire. """,N/A,N/A,fr
New York brûle-t-il,"['Dominique Lapierre', 'Larry Collins']",2004,['Novel'],"Trois ans après le 11 Septembre, des terroristes cachent une bombe atomique au cœur de New York. Si le président américain n'oblige pas les Israéliens à quitter toutes les colonies des territoires arabes occupés, Manhattan sera rayée de la carte. Faut-il céder à ce chantage ? Des terroristes peuvent-ils vraiment se procurer une bombe atomique et l'introduire sur le territoire américain ? Y a-t-il, pour les forces de l'Etat le plus puissant de la planète, la moindre chance de la trouver et de la désamorcer ? Peut-on évacuer New York ? Le compte à rebours commence... Deux ans d'enquête, une quantité impressionnante de documents examinés, dont beaucoup ultra-confidentiels ; plus de trois cents personnes interrogées aux Etats-Unis, en Israël, en Grande-Bretagne, en Inde, dans les centres les plus secrets de la guerre contre le terrorisme... New York brûle-t-il ? Un thriller diabolique, un roman d'une force exceptionnelle au cœur de notre temps et de sa folie. Dominique Lapierre et Larry Collins sont les auteurs de paris brûle-t-il ?, ...Ou tu porteras mon deuil, O Jérusalem, Cette nuit la liberté et du Cinquième Cavalier.",N/A,N/A,fr
Deep Lie,['Stuart Woods'],1998-07-08,['Fiction'],Submarine thriller.,N/A,N/A,en
In the Beginning,['Norman Douglas'],1928,['Families'],N/A,N/A,N/A,en
The Skull Beneath the Skin,['P. D. James'],1982-01-01,['Fiction'],"Hired as a bodyguard to faded actress Clarissa Lisle, the recent recipient of numerous death threats, Cordelia Gray accompanies the actress to an island castle, whose owner collects funeral paraphernalia",N/A,N/A,en
The Right to an Answer,['Anthony Burgess'],1961,['Novel'],N/A,N/A,N/A,en
Kamal Jann,['Dominique Eddé'],2012,['Novel'],"Kamal Jann, Syrien de 40 ans, avocat d'affaires à Manhattan, est un mystère. Sa réussite professionnelle recouvre son drame : son oncle, chef des services de renseignements syrien, homme redoutable et redouté, a fait tuer ses parents quand il avait 12 ans, mais il a aussi financé ses études à New York. Quand, début septembre 2010, la CIA l'avertit que son frère djihadiste, resté en Syrie, va commettre un attentat terroriste à Paris, Jann comprend qu'il va devoir cette fois s'engager dans la toile d'araignée des services secrets occidentaux pour faire tomber son oncle et le pouvoir syrien. Un roman puissant et sombre. Entre Damas, Beyrouth, New York ou Paris, une mosaïque de personnages liés par des relations ambiguës où le pouvoir, le désir, la manipulation, la survie poussent leurs pions sur un échiquier dément et sanglant. Une chorégraphie puissamment orchestrée où violence, trahison, peur, lâcheté, mensonge et corruption rendent impossible le moindre règlement politique au Moyen-Orient tant que les dictateurs en place serviront les intérêts de tous ceux qui ont le pouvoir en ce monde. Kamal Jann est le produit de ces interactions, de cette schizophrénie arabe, de cette conscience éclatée, pour qui l'appartenance au clan, la révolte et la liberté sont incompatibles.",N/A,N/A,fr
"Novel and Romance, 1700-1800",['Ioan M. Williams'],1970-01-01,['English fiction'],N/A,N/A,N/A,en
Bitter Medicine,['Sara Paretsky'],1991,['Chicago (Ill.)'],N/A,N/A,N/A,en
Where Bonds are Loosed,['Elliot Lovegood Grant Watson'],1918,['Novel'],N/A,N/A,N/A,en
A Summons to Memphis,['Peter Taylor'],1986,['Fiction'],"One of the most celebrated novels of its time, the Pulitzer Prize winner A Summons to Memphis introduces the Carver family, natives of Nashville, residents, with the exception of Phillip, of Memphis, Tennessee. During the twilight of a Sunday afternoon in March, New York book editor Phillip Carver receives an urgent phone call from each of his older, unmarried sisters. They plead with Phillip to help avert their widower father's impending remarriage to a younger woman. Hesitant to get embroiled in a family drama, he reluctantly agrees to go back south, only to discover the true motivation behing his sisters' concern. While there, Phillip is forced to confront his domineering siblings, a controlling patriarch, and flood of memories from this troubled past. Peter Taylor is one of the masters of Southern literature, whose work stands in the company of Eudora Walty, James Agee, and Walker Percy. In A Summons to Memphis, he composed a richly evocative story of revenge, resolution, and redemption, and gave us a classic work of American literature.",N/A,N/A,en
Ma catastrophe adorée,['Mathieu Lindon'],2004,['Novel'],Analyse : Roman d'amour.,N/A,N/A,fr
Half Girl Friend,['Chetan Bhagat'],2014,['Novel'],N/A,N/A,N/A,en
Perros y chacales,['Barbara Wood'],1994,['Novel'],"Una novela en la que la intriga, los mejores sentimientos humanos, el abigarrado universo del Egipto actual y los solemnes misterios del pasado se dan la mano con vivacidad y ternura ...",N/A,N/A,es
