title,authors,publishedDate,categories,description,averageRating,textSnippet,language
The Empty Sea,"['Ilaria Perissi', 'Ugo Bardi']",2021-02-12,['Science'],"The “Blue Economy” is used to describe all of the economic activities related to the sea, with a special emphasis on sustainability. Traditional activities such as fisheries, but also undersea mining, tourism, and scientific research are included, as well as the phenomenal growth of aquaculture during the past decade. All of these activities, and the irresistible prospect of another new frontier, has led to enthusiastic and, most likely, overenthusiastic assessments of the possibilities to exploit the sea to feed the world, provide low-cost energy, become a new source of minerals, and other future miracles. This book makes sense of these trends and of the future of the blue economy by following our remote ancestors who gradually discovered the sea and its resources, describing the so-called fisherman’s curse – or why fishermen have always been poor, explaining why humans tend to destroy the resources on which we depend, and assessing the realistic expectations for extracting resources from the sea. Although the sea is not so badly overexploited as the land, our demands on ecosystem services are already above the oceans’ sustainability limits. Some new ideas, including “fishing down” for untapped resources such as plankton, could lead to the collapse of the entire marine ecosystem. How Neanderthals crossed the sea in canoes, how it was possible for five men on a small boat to kill a giant whale, what kind of oil the virgins of the Gospel put into their lamps, how a professor of mathematics, Vito Volterra, discovered the “equations of fishing,” why it has become so easy to be stung by a jellyfish while swimming in the sea, and how to play “Moby Dick,” a simple board game that simulates the overexploitation of natural resources are just some of the questions that you will be able to answer after reading this engaging and insightful book about the rapidly expanding relationship between humanity and the sea.",N/A,N/A,en
Tropical Meteorology,"['T.N. Krishnamurti', 'Lydia Stefanova', 'Vasubandhu Misra']",2013-07-14,['Science'],"This book is designed as an introductory course in Tropical Meteorology for the graduate or advanced level undergraduate student. The material within can be covered in a one-semester course program. The text starts from the global scale-view of the Tropics, addressing the zonally symmetric and asymmetric features of the tropical circulation. It then goes on to progressively smaller spatial and time scales – from the El Niño Southern Oscillation and the Asian Monsoon, down to tropical waves, hurricanes, sea breezes, and tropical squall lines. The emphasis in most chapters is on the observational aspects of the phenomenon in question, the theories regarding its nature and maintenance, and the approaches to its numerical modeling. The concept of scale interactions is also presented as a way of gaining insight into the generation and redistribution of energy for the maintenance of oscillations of a variety of spatial and temporal scales.",N/A,N/A,en
Rogue Waves in the Ocean,"['Christian Kharif', 'Efim Pelinovsky', 'Alexey Slunyaev']",2008-12-11,['Science'],"“It came from nowhere, snapping giant ships in two. No one believed the survivors . . . until now” —New Scientist magazine cover, June 30, 2001 Rogue waves are the focus of this book. They are among the waves naturally - served by people on the sea surface that represent an inseparable feature of the Ocean. Rogue waves appear from nowhere, cause danger, and disappear at once. They may occur on the surface of a relatively calm sea and not reach very high amplitudes, but still be fatal for ships and crew due to their unexpectedness and abnormal features. Seamen are known to be unsurpassed authors of exciting and horrifying stories about the sea and sea waves. This could explain why, despite the increasing number of documented cases, that sailors’ observations of “walls of - ter” have been considered ctitious for a while. These stories are now addressed again due to the amount of doubtless evidence of the existence of the phenomenon, but still without suf cient information to - able interested researchers and engineers to completely understand it. The billows appear suddenly, exceeding the surrounding waves by two times their size and more, and obtaining many names: abnormal, exceptional, extreme, giant, huge, s- den, episodic, freak, monster, rogue, vicious, killer, mad- or rabid-dog waves, cape rollers, holes in the sea, walls of water, three sisters, etc.",N/A,N/A,en
Protecting the Oceans,['John D. Baines'],1991,['Juvenile Nonfiction'],"Discusses the importance of the oceans, the sources and effects of their pollution and misuse, and ways to protect them.",N/A,N/A,en
McGraw-Hill Dictionary of Earth Science,['Sybil P. Parker'],1997,['Juvenile Nonfiction'],"Includes more than 8,000 essential terms and definitions in the earth sciences, this complete and handy source for the latest terminology covers the fields of climatology, geochemistry, geodesy, geography, hydrology, oceanography, and palaeontology.",N/A,N/A,en
Estuaries and Coasts,"['Michael Elliott', 'Jean-Paul Ducrotoy']",1991,['Coast changes'],N/A,N/A,N/A,en
Environmental Oceanography,['Tom Beer'],1983,['Nature'],N/A,N/A,N/A,en
WCFS2020,"['Łukasz Piątek', 'Soon Heng Lim', 'Chien Ming Wang', 'Rutger de Graaf-van Dinther']",2021-08-05,['Technology & Engineering'],"This book highlights state-of-the-art research findings on floating developments in both inland and coastal waters with focus on living, recreation and working offshore. It includes six themes: (1) business case and real estate development, (2) spatial planning and architecture, (3) food and energy production, (4) ecological impact and nature-based solutions, (5) governance and social impact and (6) design and engineering of (infra)structures. The book presents key issues addressed when utilizing water space. It gives an overview of findings and discussions from the world’s leading experts from the industry, policymakers, entrepreneurs, researchers and identifies new opportunities as well as fosters collaboration on floating projects for a more climate-adaptive, socially inclusive, sustainable and better world.",N/A,N/A,en
Oceans in Decline,['Sergio Rossi'],2019-03-25,['Science'],"What is happening in our oceans? By describing their main elements, this book shows how and why the oceans are being transformed, and suggests possible future scenarios to address this complex, yet often-asked, question. The ocean is being dramatically transformed, but the magnitude of this transformation remains unclear since the ocean is largely inaccessible and still unknown: there is more information about the outer universe than about the deepest parts of our oceans. The author, a marine biologist with extensive research experience, offers a holistic view of our oceans. Focusing on fishing, pollution and the effects of climate change, he identifies and describes the changes occurring in all marine ecosystems, and discusses the long-passed state of equilibrium.",N/A,N/A,en
Deep,['James Nestor'],2014,['Nature'],"Our species is more profoundly connected to the sea than we ever realized, as an intrepid cadre of scientists, athletes, and explorers is now discovering. Deep follows these adventurers into the ocean to report on the latest findings about its wondrous biology -- and unimagined human abilities.",N/A,N/A,en
Oceanographic History,"['Keith Rodney Benson', 'Philip F. Rehbock']",2002,['Nature'],"From a study of knowledge of the sea among indigenous cultures in the South Seas to inquiries into the subject of sea monsters, from studies of Pacific currents to descriptions of ocean-going research vessels, the sixty-three essays presented here reflect the scientific complexity and richness of social relationships that characterize ocean-ographic history. Based on papers presented at the Fifth International Congress on the History of Oceanography held at the Scripps Institution of Oceanography (the first ICHO meeting following the cessation of the Cold War), the volume features an unusual breadth of contributions. Oceanography itself involves the full spectrum of physical, biological, and earth sciences in their formal, empirical, and applied manifestations. The contributors to Oceanographic History: The Pacific and Beyond undertake the interdisciplinary task of telling the story of oceanography?s past, drawing on diverse methodologies. Their essays explore the concepts, techniques, and technologies of oceanography, as well as the social, economic, and institutional determinants of oceanographic history. Although focused on the Pacific, the geographic range of subjects is global and includes Micronesia, East Africa, and Antarctica; the bathymetric range comprises inshore fisheries, coral reefs, and the ?azoic zone.? The seventy-one contributors represent every continent of the globe except Antarctica, bringing together material on the history of oceanography never before published.",2,N/A,en
Introductory Oceanography,['Harold V. Thurman'],1975,['Science'],N/A,4,N/A,en
Managing European Coasts,"['Jan E. Vermaat', 'Laurens Bouwer', 'R. Kerry Turner', 'Wim Salomons']",2010-10-28,['Political Science'],"Coastal zones play a key role in Earth System functioning and form an “edge for society” providing a significant contribution to the life support systems. Goods and services derived from coastal systems depend strongly on multiple transboundary interactions with the land, atmosphere, open ocean and sea bottom. Increasing demands on coastal resources driven by human habitation, food security, recreation and transportation accelerate the exploitation of the coastal landscape and water bodies. Many coastal areas and human activities are subject to increasing risks from natural and man-induced hazards such as flooding resulting from major changes in hydrology of river systems that has reached a global scale. Changes in the hydrological cycle coupled with changes in land and water management alter fluxes of materials transmitted from river catchments to the coastal zone, which have a major effect on coastal ecosystems. The increasing complexity of underlying processes and forcing functions that drive changes on coastal systems are witnessed at a multiplicity of temporal and spatial scales.",N/A,N/A,en
Marine Debris,"['James M. Coe', 'Donald Rogers']",2012-12-06,['Science'],"Marine debris is a global pollution problem affecting marine life, maritime commerce and environmental quality. Scientists, policymakers and the public must be knowledgeable about the source, impact and control efforts if effective solutions are to be developed. Marine Debris addresses the origin of persistent solid waste in the ocean, from urban and rural discharges to waste from ships and the recreational use of oceans. The book identifies key issues from biological, technological, economic and legal perspectives, and gives a framework for controlling each of the main sources of marine debris.",5,N/A,en
The Indian Ocean,['Anne Ylvisaker'],2003,['Juvenile Nonfiction'],"Introduces the ocean that lies between Australia and Asia, and provides instructions for an activity to demonstrate how to remove the salt from salt water.",N/A,N/A,en
The Encyclopedia of Oceanography,['Rhodes Whitmore Fairbridge'],1966,['Encyclopedias and dictionaries'],N/A,N/A,N/A,en
The Red Sea,['Alexis Wick'],2016-01-19,['History'],"The Red Sea has, from time immemorial, been one of the world’s most navigated spaces, in the pursuit of trade, pilgrimage and conquest. Yet this multidimensional history remains largely unrevealed by its successive protagonists. Intrigued by the absence of a holistic portrayal of this body of water and inspired by Fernand Braudel’s famous work on the Mediterranean, this book brings alive a dynamic Red Sea world across time, revealing the particular features of a unique historical actor. In capturing this heretofore lost space, it also presents a critical, conceptual history of the sea, leading the reader into the heart of Eurocentrism. The Sea, it is shown, is a vital element of the modern philosophy of history. Alexis Wick is not satisfied with this inclusion of the Red Sea into history and attendant critique of Eurocentrism. Contrapuntally, he explores how the world and the sea were imagined differently before imperial European hegemony. Searching for the lost space of Ottoman visions of the sea, The Red Sea makes a deeper argument about the discipline of history and the historian’s craft.",N/A,N/A,en
Oceanography,[],1958,['Oceanography'],N/A,N/A,N/A,en
Frontiers of the Sea,['Robert C. Cowen'],1969,['Oceanography'],N/A,N/A,N/A,en
Practical Handbook of Marine Science,['Michael J. Kennish'],2019,['Marine biology'],"Key features: Includes an entirely new in-depth section devoted to Climate Change and Climate Change Effects Adds new sections on Estuaries, Beaches, Barrier Islands, Shellfish, Macroalgae, Food Chains, Food Webs, Trophic Dynamics, System Productivity, Physical-Chemical-Biological Alteration, and Coastal Resource Management Assembles an extensive international collection of marine science data throughout the handbook Contains approximately 1,000 tables and illustrations Provides comprehensive coverage of anthropogenic impacts in estuarine and marine ecosystems from local, regional, and global perspectives The heavily-revised Practical Handbook of Marine Science, Fourth Editioncontinues its tradition as a state-of-the-art reference that updates the field of marine science to meet the interdisciplinary research needs of physical oceanographers, marine biologists, marine chemists, and marine geologists. This edition adds an entirely new chapter on the impacts of climate change. Maintaining its user-friendly, multi-sectional format, this comprehensive resource will also be of value to undergraduate and graduate students, research scientists, administrators, and other professionals who deal with the management of marine resources. Now published in full color, the new edition offers extensive illustrative and tabular reference material covering all the major disciplines related to the sea. the interdisciplinary research needs of physical oceanographers, marine biologists, marine chemists, and marine geologists. This edition adds an entirely new chapter on the impacts of climate change. Maintaining its user-friendly, multi-sectional format, this comprehensive resource will also be of value to undergraduate and graduate students, research scientists, administrators, and other professionals who deal with the management of marine resources. Now published in full color, the new edition offers extensive illustrative and tabular reference material covering all the major disciplines related to the sea.",N/A,N/A,en
Oceanography,"['C. P. Summerhayes', 'S. A. Thorpe']",1996,['Science'],"Oceans cover over 70% of the Earth’s surface and are essential to life on this planet. And yet it is only recently that the science and technology of Oceanography has matured - indeed, astronauts walked on the surface of the Moon before scientists explored the Mid-Ocean Ridge, a great mountain range that covers close to 23% of the Earth’s total surface area! Oceanography provides the basis for understanding the oceans’ complexities, and an appreciation of the importance of recent discoveries (the volcanism and hydrothermal circulation within the Mid-Ocean Ridge) and improved sampling techniques (advanced remotely operated vehicle systems and satellite monitoring). It is written by expert teachers and leading researchers in each of the many aspects of Oceanography: Weather Systems; Physical Geography; Chemistry; Biology; Measurement Techniques; Economics. Oceanography is an authoritative, comprehensive, easy to read and richly illustrated guide to this vast and fascinating subject. It is essential reading for anyone interested in the oceans - crucial to our future, but as yet barely explored. Contributors M. V. Angel J. M. Bull J. D. Burton H. Charnock K. J. Collins M. B. Deacon N. C. Flemming A. Gebruk C. R. German W.J. Gould G. Griffiths T. Guymer P.J. Herring A.C. Jensen A.E.S. Kemp N.H. Kenyon R.S. Lampitt A.P.M. Lockwood J.J. Mallinson D.G. Masson R.A. Mills L.M. Parson D.A. Purdie A.L. Rice K.J. Richards P. Riddy I.S. Robinson R.G. Rothwell M. Sheader C.P. Summerhayes J. Thomson S.A. Thorpe P.A. Tyler M. Varney P.P.E. Weaver N.C. Wells R.B. Whitmarsh J.A. Williams C.M. Young",N/A,N/A,en
Oceanography,['Tom Garrison'],2001,['Oceanography'],"This introduction to oceanography text uses an interdisciplinary approach and emphasizes the discipline's connections with astronomy, physics, chemistry, meteorology, geology, biology, ecology, history, and economics. It strives to enhance students' natural enthusiasm for the ocean, including many full-color illustrations and photographs and a writing style that is clear, personal, and lively. Extensive reviewing by experts and students ensure the text's readability, accuracy, and currency. This book is the #1 seller in oceanography.",N/A,N/A,en
Invitation to Oceanography,"['Pinet', 'Paul R. Pinet']",2006-04-01,['Science'],N/A,N/A,N/A,en
Introduction to Physical Oceanography,['Robert H. Stewart'],2009-09,['Oceanography'],"This book is written for college juniors and seniors and new graduate students in meteorology, ocean engineering, and oceanography. It begins with a brief overview of what is known about the ocean. This is followed by a description of the ocean basins, for the shape of the seas influences the physical processes in the water. Next, students will study the external forces, wind and heat, acting on the ocean, and the ocean's response. It also includes the equations describing dynamic response of the ocean. For example, the equations of motion, the influence of earth's rotation, and viscosity. Finally, students consider some particular examples: the deep circulation, the equatorial ocean and El NiE no, and the circulation of particular areas of the ocean. Contents: 1) A Voyage of Discovery. 2) The Historical Setting. 3) The Physical Setting. 4) Atmospheric Influences. 5) The Oceanic Heat Budget. 6) Temperature, Salinity and Density. 7) The Equations of Motion. 8) Equations of Motion with Viscosity. 9) Response of the Upper Ocean to Winds. 10) Geostrophic Currents. 11) Wind Driven Ocean Circulation. 12) Vorticity in the Ocean. 13) Deep Circulation in the Ocean. 14) Equatorial Processes. 15) Numerical Models. 16) Ocean Waves. 17) Coastal Processes and Tides.""",N/A,N/A,en
Principles of Oceanography,['Richard A. Davis (Jr.)'],1972,['Science'],N/A,N/A,N/A,en
Marine Geochemistry,"['Horst D. Schulz', 'Matthias Zabel']",2014-03-12,['Science'],"A summary of the latest research in this field. The topics comprise the sedimentological examination and physical properties of the sedimentary solid phase, pore water and pore water constituents, organic matter as the driving force of most microbiological processes, biotic and abiotic redox reactions, carbonates and stable isotopes as proxies for paleoclimate reconstruction, metal enrichments in ferromanganese nodules and crusts as well as in hot vents and cold seeps on the seafloor. The current model conceptions lead to the development of different types of computer models, allowing the global mass exchanges between oceans and sediments to be balanced.",N/A,N/A,en
The Power of the Sea,['Bruce Parker'],2012-03-13,['History'],"The awesome power of the earth's oceans has been in the headlines in recent years, from the 2004 Indian Ocean Tsunami (300,000 dead) to the devastation of New Orleans caused by the storm surge from Hurricane Katrina, to the huge rogue waves that have struck oil tankers and cruise ships.",N/A,N/A,en
Riches of the Sea,['Jacques Cousteau'],1974,['Nature'],Series: The ocean world of Jacques Cousteau.,N/A,N/A,en
Ocean,"['FABIEN COUSTEAU INTRO', 'Fabien Cousteau']",2014-08-27,['Marine animals'],"From mangrove swamp to ocean floor, mollusc to manatee, Atlantic Conveyor to Hurricane Katrina, this book unravels the mysteries of the sea. It features illustrations and satellite-derived maps to explain each natural process and phenomena",N/A,N/A,en
Oceans,['Dorrik A. V. Stow'],2006,['Nature'],"With hundreds of beautiful full-color photographs and explanatory diagrams, charts, and maps, this volume combines the visual splendor of ocean life with up-to-date scientific information to provide an invaluable and fascinating resource on this vital realm.",N/A,N/A,en
Seaside Studies in Natural History,"['Elizabeth Cabot Cary Agassiz', 'Alexander Agassiz']",1865,['Nature'],N/A,N/A,N/A,en
Founders of Oceanography and Their Work,['Sir William Abbott Herdman'],1923,['Science'],N/A,N/A,N/A,en
Oceanography,['Hilary L. Maybaum'],1996,['Science'],N/A,N/A,N/A,en
Physical Oceanography of the Baltic Sea,"['Matti Leppäranta', 'Kai Myrberg']",2009-01-12,['Science'],"The Baltic Sea oceanographic research community is wide and the research history is over 100 years old. Nevertheless, there is still no single, coherent book on the physical oceanography of the Baltic Sea as a whole. There is a strong need for such a book, coming from working oceanographers as well as the university teaching programmes in advanced undergraduate to graduate levels. In the regional conference series in physical oceanography (Baltic Sea Science Conference, Baltic Sea Oceanographers' conference, Baltex-conferences) about 500 scientists take part regularly. Even more scientists work in the fields of marine biology, chemistry and the environment, and they need information on the physics of the Baltic Sea as well. There are nine countries bordering on the Baltic Sea and five more in the runoff area. The Baltic Sea as a source of fish, means of transportation and leisure activities is highly important to the regional society. In the runoff area there are a total of 85 million people. Research and protection strategies need to be developed, as the Baltic Sea is probably the most polluted sea in the world. Since the Baltic Sea has become an inner sea of the EU (apart from small shore parts of Russia in Petersburg and Kaliningrad), it is anticipated that the importance of the region will consequently rise. The book will arouse interest among students, scientists and decision makers involved with the Baltic problems. It will also give important background information for those working with biogeochemical processes in the Baltic Sea, because the physical forcing for those processes is of vital importance.",N/A,N/A,en
Encyclopedia of Ocean Sciences: Data assimilation in models-Fossil turbulence,[],N/A,['Marine ecology'],N/A,N/A,N/A,en
Navigational Restrictions Within the New LOS Context,['Alexander M. Lewis'],1986,['Law'],"In Navigational Restrictions within the New LOS Context, J. Ashley Roach faithfully edits and presents the like-titled report prepared by Dr. Lewis M. Alexander for the U.S. Department of Defense in 1986.",N/A,N/A,en
The World Ocean,"['William A. Anikouchine', 'Richard W. Sternberg']",1981,['Science'],N/A,N/A,N/A,en
Encyclopedia of Ocean Sciences,"['John H. Steele', 'S. A. Thorpe (FRS.)', 'Karl K. Turekian']",2009,['Marine ecology'],"Encyclopedia of Ocean Sciences 2e is a new 6-volume online reference work, pulling together all the key information in one source from the leading publisher in the field. This second edition is online, offering the user greater flexibility, accessibility, and most importantly, usability with 24 hour access, multi-user access, remote access and excellent search functionality. Structured for success, each article contains a glossary, an introduction, a reference section and a wealth of cross-referenced links to premium and related material all accessible in a mouse-click, making complicated, time consuming research a thing of the past. *Approximately 500 articles covering the breadth and depth of the field with over 30% new and updated content reflecting the latest research *Greater coverage of climate, remote sensing, and data modeling, with greater consideration of economic and political aspects provides a broad view of the field *Structured for success, each article contains an introduction, a reference section, a glossary and a wealth of cross references to premium related journal and book content",N/A,N/A,en
Oceanography,['Peter K. Weyl'],1968,['Oceanography'],N/A,N/A,N/A,en
An Introduction to the Biology of Marine Life,['James L. Sumich'],1996,['Marine biology'],"The new edition of An Introduction to the Biology of Marine Life is designed to reach your introductory students with effective and interesting learning tools. Its design and content are focused on capturing the attention of your students-- and focused on helping you teach. In the sixth edition, author James Sumich has maintained the text's readability and balanced approach, while incorporating several exciting new features:",N/A,N/A,en
"Translated Tables of Contents of Current Foreign Fisheries, Oceanographic, and Atmospheric Publications",[],1981,['Atmosphere'],N/A,N/A,N/A,en
Marine Physics,['Robert Edgar Craig'],1973,['NATURE'],N/A,N/A,N/A,en
The Barents Sea (Morze Barentsa),"['Kazimierz Demel', 'Stanisław Rutkowicz']",1966,['Barents Sea'],N/A,N/A,N/A,en
