title,authors,publishedDate,categories,description,averageRating,textSnippet,language
Sedimentary Basins,['Gerhard Einsele'],2012-12-06,['Science'],"The modern geological sciences are characterized by extraordinarily rapid progress, as well as by the development and application of numerous new and refined methods,most of them handling an enormous amount of data available from all the continents and oceans. Given this state of affairs, it seams inevitable that many students and professionals tend to become experts in relatively narrow fields and there by are in danger of losing a broad view of current knowledge. The abun dance of new books and symposium volumes testifies to this trend toward specialization. However, many geologic processes are complex and result from the interaction of many, seemingly unrelated, individual factors. This signifies that we still need generalists who have the broad overview and are able to evaluate the great variety of factors and processes controlling a geologic system, such as a sedimentary basin. In addition, this also means that cooperation with other disciplines in the natural sciences and engi neering is increasingly important. Modern text books providing this broad overview of the earth sciences are rare. Some are written by several authors together to make sure that all topics are treated properly. When individual authors write a book, they run the risk of creating a text that is less balanced, because they cannot avoid indulging their own preferences for specific topics and field examples. However, this disadvantage can be compensated for by the fact that just one author can produce a more concise and uniform text and include ap propriate cross references.",N/A,N/A,en
Descriptive Physical Oceanography,"['George L. Pickard', 'William J. Emery']",1990-01-15,['Science'],"'Descriptive Physical Oceanography: An Introduction' 5th edition provides an introduction to descriptive (synoptic) physical oceanography for science undergraduates and early graduate students. There has been an updating of topics such as the heat budget, instruments (particularly the use of satellites), a complete revision of the material on equatorial oceanography, sea-ice physics and distribution and El Nino and information has been added on thermohaline circulation, mixing nad coral reef oceanography.",1,N/A,en
Waves in the Ocean,"['Paul H. LeBlond', 'Lawrence A. Mysak']",1978,['NATURE'],N/A,N/A,N/A,en
Descriptive Physical Oceanography,['George L. Pickard'],1979,['Science'],N/A,N/A,N/A,en
Oceanic Histories,"['David Armitage', 'Alison Bashford', 'Sujit Sivasundaram']",2018,['Business & Economics'],"Freshly presents world history through its oceans and seas in uniquely wide-ranging, original chapters by leading experts in their fields.",N/A,N/A,en
Marine Geochemistry,"['Horst D. Schulz', 'Matthias Zabel']",2006-03-09,['Science'],"Since 1980 a considerable amount of scientific research dealing with geochemical processes in marine sediments has been carried out. This textbook summarizes the state-of-the-art in this field of research providing a complete representation of the subject and including the most recent findings. The topics covered include the examination of sedimentological and physical properties of the sedimentary solid phase. A new chapter describes properties, occurrence and formation of gas hydrates in marine sediments. The textbook ends with a chapter on model conceptions and computer models to quantify processes of early diagenesis.",N/A,N/A,en
Physical Oceanography of the Dying Aral Sea,['Peter O. Zavialov'],2007-03-06,['Science'],"Physical Oceanography of the Dying Aral Sea describes the background, present crisis state, and possible future of this peculiar inland water body from the physical oceanographic standpoint. Based on a wide range of material, a large part of which was published in Russian and has not been previously available to the international reader, the book first provides an historical overview of this unique system, which possesses both lake and sea properties. Next, the current physical state of the lake is described, partly based on original field research and model experiments, along with the remote sensing data, model results and analyses extracted from recent literature. Next, book attempts to forecast the forthcoming state of the Aral Sea and identify plausible future scenarios. Finally, the book discusses the Aral Sea dessication viewd as a part of the global perspective.",N/A,N/A,en
Stable Isotope Geochemistry,['Jochen Hoefs'],2009-01-13,['Science'],"Stable Isotope Geochemistry is an introduction to the use of stable isotopes in the geosciences. It is subdivided into three parts: theoretical and experimental principles; fractionation processes of light and heavy elements; the natural variations of geologically important reservoirs. Since the application of stable isotopes to earth sciences has grown in the last few years, a new edition appears necessary. Recent progress in analysing the rare isotopes of certain elements for instance allow the distinction between mass-dependent and mass-independent fractionations. Special emphasis has been given to the growing field of ""heavy"" elements. Many new references have been added, which will enable quick access to recent literature. For students and scientists alike the book will be a primary source of information with regard to how and where stable isotopes can be used to solve geological problems.",5,N/A,en
"The Cnidaria, Past, Present and Future","['Stefano Goffredo', 'Zvy Dubinsky']",2016-09-07,['Science'],"This volume presents a broad panorama of the current status of research of invertebrate animals considered belonging to the phylum Cnidaria, such as hydra, jellyfish, sea anemone, and coral. In this book the Cnidarians are traced from the Earth’s primordial oceans, to their response to the warming and acidifying oceans. Due to the role of corals in the carbon and calcium cycles, various aspects of cnidarian calcification are discussed. The relation of the Cnidaria with Mankind is approached, in accordance with the Editors’ philosophy of bridging the artificial schism between science, arts and Humanities. Cnidarians' encounters with humans result in a broad spectrum of medical emergencies that are reviewed. The final section of the volume is devoted to the role of Hydra and Medusa in mythology and art.",N/A,N/A,en
The Oceans and Climate,['Grant R. Bigg'],2003-12-11,['Science'],"The oceans are an integral and important part of the climate system. The Oceans and Climate introduces the multi-disciplinary controls on air-sea interaction - physical, chemical and biological - and shows how these interact. It demonstrates how the ocean contributes to, and is affected by, climate processes on timescales from seasonal to millennial and longer. Past, present and future relationships between the ocean and climate are discussed. The new edition of this successful textbook has been completely updated throughout, with extensive new material on thermohaline processes in the ocean and their link to both abrupt climate change and longer-term climate change. It will prove an ideal course and reference book for undergraduate and graduate students studying earth and environmental sciences, oceanography, meteorology and climatology. The book will also be useful for students and teachers of geography, physics, chemistry and biology.",N/A,N/A,en
Oceanography: an Introduction to the Marine Environment,['Peter K. Weyl'],1970,['Science'],N/A,N/A,N/A,en
Basic Coastal Engineering,['Robert Sorensen'],1997-09-30,['Science'],"In the 20 years since publication of the first edition of this book there have been a number of significant changes in the practice of coastal engineering. This new edition has been completely rewritten to reflect these changes as well as to make other improvements to the material presented in the original text. _ Basic Coastal Engineering is an introductory text on wave mechanics and coastal processes along with the fundamentals of the practice of coa~tal engi neering. This book was written for a senior or first postgraduate course in coastal engineering. It is also suitable for self study by anyone having a basic engineering or physical science background. The level of coverage does not require a math or fluid mechanics background beyond that presented in a typical undergraduate civil or mechanical engineering curriculum. The material presented in this text is based on the author's lecture notes from a one-semester course at Virginia Pol ytechnic Institute, Texas A&M University, and George Washington University, and a senior elective course at Lehigh University. The text contains examples to demonstrate the various analysis techniques that are presented and each chapter (except the first and last) has a collection of problems for the reader to solve that further demonstrate and expand upon the text material. Chapter 1 briefly describes the coastal environment and introduces the rela tively new field of coastal engineering.",3,N/A,en
The Sea Around Us,['Rachel Carson'],2003,['Nature'],"One of the most popular books ever written about the natural world is now in a beautifully illustrated commemorative edition. 130 illustrations, many in color.",4.5,N/A,en
Oceanographers and the Cold War,['Jacob Darwin Hamblin'],2005,['History'],"This book examines the study of the oceans during the Cold War era and explores the international focus of American oceanographers, taking into account the role of the U.S. Navy, U.S. foreign policy, and scientists through the world. Hamblin demonstrates that to understand the history of American oceanography, one must consider its role in both conflict and cooperation with other nations. Scientists redefined the field of oceanography and turned it into one of the most well-funded, militarily decisive, and politically controversial activities in science.",N/A,N/A,en
Ecological Geography of the Sea,['Alan R. Longhurst'],1998,['Science'],"This book presents an in-depth discussion of the biological and ecological geography of the oceans. It synthesizes locally restricted studies of the ocean to generate a global geography for the vast marine world. It attempts to divide the ocean into distinguishable regions that permit detailed comparisons. Based on patterns of algal ecology, the book divides the ocean into four primary compartments, which are then subdivided into secondary compartments. The secondary compartments are identified and characterized by biogeochemical features including nutrient dynamics, continental shelf topography, and algal blooms. Because ocean-wide regional classification has broad impact on the way oceanographers and ecologists study ocean patterns, this book should have wide and long-term appeal.",N/A,N/A,en
Physical Geodesy,"['Bernhard Hofmann-Wellenhof', 'Helmut Moritz']",2006-10-10,['Science'],"""Physical Geodesy"", published in 1967, has for many years been considered as the standard introduction to its field. The enormous progress since then has required a complete reworking. While basic material has been retained other parts are completely updated. However, there is a seamless welding of new ideas and methods (GPS, satellites, collocation). Highlights include: emphasis on global integration of geometry and gravity, a simplified approach to Molodensky's theory without integral equations, and a general combination of all geodetic data by least-squares collocation. In the second edition minor mistakes have been corrected.",N/A,N/A,en
Marine Climate and Climate Change,['Ralf Weisse'],2010-01-08,['Science'],"Marine environmental conditions such as storms, storm surges and wave heights are directly experienced by, for example, off-shore operations or coastal populations. The authors review and bring together the state-of-the-art and present day knowledge about historical changes, recent trends and concepts on how marine environmental conditions may change in the future as well as discuss models and data problems.",N/A,N/A,en
"Advanced Dam Engineering for Design, Construction, and Rehabilitation",['R.B. Jansen'],1988-12-31,['Science'],"The present state of the art of dam engineering has been ronmental, and political factors, which, though important, attained by a continuous search for new ideas and methods are covered in other publications. while incorporating the lessons of the past. In the last 20 The rapid progress in recent times has resulted from the years particularly there have been major innovations, due combined efforts of engineers and associated scientists, as largely to a concerted effort to blend the best of theory and exemplified by the authorities who have contributed to this practice. Accompanying these achievements, there has been book. These individuals have brought extensive knowledge a significant trend toward free interchange among the pro to the task, drawn from experience throughout the world. fessional disciplines, including open discussion of prob With the convergence of such distinguished talent, the op lems and their solutions. The inseparable relationships of portunity for accomplishment was substantial. I gratefully hydrology, geology, and seismology to engineering have acknowledge the generous cooperation of these writers, and been increasingly recognized in this field, where progress am indebted also to other persons and organizations that is founded on interdisciplinary cooperation. have allowed reference to their publications; and I have This book presents advances in dam engineering that attempted to acknowledge this obligation in the sections have been achieved in recent years or are under way. At where the material is used. These courtesies are deeply ap tention is given to practical aspects of design, construction, preciated.",5,N/A,en
Tsunami,['Edward Bryant'],2008-01-29,['Nature'],"Tsunamis are underrated as major hazards, mainly due to the misconceptions that they occur infrequently and happen along some distant shoreline. However, evidence for past great tsunami has recently been discovered along apparently aseismic and protected coastlines, such as those of Australia and Western Europe. This is a comprehensive and well illustrated textbook on all aspects of tsunami. It can be used by a student or layperson to gain encyclopedic knowledge about tsunami.",5,N/A,en
The Drift of Sea Ice,['Matti Leppäranta'],2007-03-06,['Science'],"The author presents in The Drift of Sea Ice the fundamental laws of sea ice drift which come from the material properties of sea ice and the basic laws of mechanics. The resulting system of equations is analysed for the general properties of sea ice drift, the free drift model and analytical models for ice drift in the presence of internal friction, and the construction of numerical ice drift models is detailed. The science of sea ice drift through its 100-year history to the present day is explained. The text includes the geophysical theory, observations from field programs, and mathematical models. Topics covered include the science of sea ice drift, forecasting drift velocity based on volume, size and shape, sea ice ridging and remote sensing, modelling of the ice conditions, and finally the role of sea ice drift in research fields in ice-covered seas, oceanography, marine ecology and engineering.",N/A,N/A,en
"The Physical Geography of the Sea, and Its Meteorology",['Matthew Fontaine Maury'],1861,['History'],N/A,N/A,N/A,en
"Oceanography, a View of the Earth",['Meredith Grant Gross'],1982,['Science'],"Good,No Highlights,No Markup,all pages are intact, Slight Shelfwear,may have the corners slightly dented, may have slight color changes/slightly damaged spine.",N/A,N/A,en
Modelling the Dispersion of Radionuclides in the Marine Environment,['Raúl Periánez'],2005-12-28,['Science'],This guide details the techniques and numerical procedures required for numerical modelling of radioactivity dispersion in marine environments. The book goes beyond the basics of hydrodynamic modeling to analyze the latest trends in modeling.,N/A,N/A,en
Turbulence in Fluids,['Marcel Lesieur'],2012-12-06,['Science'],"Turbulence is a dangerous topic which is often at the origin of serious fights in the scientific meetings devoted to it since it represents extremely different points of view, all of which have in common their complexity, as well as an inability to solve the problem. It is even difficult to agree on what exactly is the problem to be solved. Extremely schematically, two opposing points of view have been ad vocated during these last twenty years: the first one is ""statistical"", and tries to model the evolution of averaged quantities of the flow. This com munity, which has followed the glorious trail of Taylor and Kolmogorov, believes in the phenomenology of cascades, and strongly disputes the possibility of any coherence or order associated to turbulence. On the other bank of the river stands the ""coherence among chaos"" community, which considers turbulence from a purely deterministic po int of view, by studying either the behaviour of dynamical systems, or the stability of flows in various situations. To this community are also associated the experimentalists who seek to identify coherent structures in shear flows.",N/A,N/A,en
The Physical Geography of the Sea,['Matthew Fontaine Maury'],1857,['Marine meteorology'],N/A,N/A,N/A,en
The Physical Geography of the Sea,['Matthew Fontaine Maury'],1856,['Marine meteorology'],N/A,N/A,N/A,en
The Earth's Hydrological Cycle,"['L. Bengtsson', 'R.-M. Bonnet', 'M. Calisto', 'G. Destouni', 'R. Gurney', 'J. Johannessen', 'Y. Kerr', 'W.A. Lahoz', 'M. Rast']",2014-05-02,['Science'],"This book gives a comprehensive presentation of our present understanding of the Earth's Hydrological cycle and the problems, consequences and impacts that go with this topic. Water is a central component in the Earth's system. It is indispensable for life on Earth in its present form and influences virtually every aspect of our planet's life support system. On relatively short time scales, atmospheric water vapor interacts with the atmospheric circulation and is crucial in forming the Earth's climate zones. Water vapor is the most powerful of the greenhouse gases and serves to enhance the tropospheric temperature. The dominant part of available water on Earth resides in the oceans. Parts are locked up in the land ice on Greenland and Antarctica and a smaller part is estimated to exist as groundwater. If all the ice over the land and all the glaciers were to melt, the sea level would rise by some 80 m. In comparison, the total amount of water vapor in the atmosphere is small; it amounts to ~ 25 kg/m2, or the equivalent of 25 mm water for each column of air. Yet atmospheric water vapor is crucial for the Earth’s energy balance. The book gives an up to date presentation of the present knowledge. Previously published in Surveys in Geophysics, Volume 35, No. 3, 2014",N/A,N/A,en
Measuring the Oceans from Space,['Ian S. Robinson'],2004-06-30,['Science'],"This book covers the fundamental principles of measuring oceans from space, and also contains state-of-the-art developments in data analysis and interpretation and in sensors. Completely new will be material covering advances in oceanography that have grown out of remote sensing, including some of the global applications of the data. The variety of applications of remotely sensed data to ocean science has grown significantly and new areas of science are emerging to exploit the gobal datasets being recovered by satellites, particularly in relation to climate and climate change, basin-scale, air-sea interaction processes (e.g. El Nino) and the modelling, forecasting and prediction of the ocean.",3.5,N/A,en
Photographic Atlas of the Mid-Atlantic Ridge Rift Valley,"['R. D. Ballard', 'J. G. Moore']",1977,['Science'],"The oceans are so large and our knowledge of them so limited that we sometimes think of the sea floor as a vast uniform wasteland. But modern oceanographic research is revealing that each part of the sea floor has its own characteristic features and is as distinct as the geologic and topographic provinces on land. The deep ocean floor holds the same fascination for us as unexplored mountain tops, jungles, or the surface of the moon and planets. And, since the oceans cover more than 70 percent of the earth's surface, the ocean floor holds the key to much of the history and evolution of our earth. There are very few places in the depths of the ocean that have been explored and studied directly by man, and to which man can relate in the way he relates to the earth on land. The Mid-Atlantic Ridge rift valley, studied during Project FAMOUS, is one of these places.",N/A,N/A,en
Smiths’ Sea Fishes,"['Margaret M. Smith', 'Phillip C. Heemstra']",1986-11,['Nature'],"Dr. D. S. Henderson, Chairman of the 1. L. B. Smith Institute of Ichthyology and Vice Chancellor of Rhodes University This book is a unique, international collaborative effort ranging all of the colour plates for the book. For the past of 76 scientists, representing 15 countries. Several skilled eight years, she has been assisted in the research, writing artists and photographers have also contributed to the and editing of the book by Dr. P. C. Heemstra. numerous and beautiful illustrations. Research done in It is essential for the proper management of the marine South Africa was supported by the Council for Scientific fish resources of southern Africa that we know what species and Industrial Research. Work on the book at the J.L.B. we are dealing with. This book will greatly facilitate the Smith Institute was also funded by the Department of identification of our fishes. It will thus be of vital import National Education and The Trustees of the Sea Fishes of ance to the understanding and wise use of our tremendously Southern Africa Book Fund. Expenses of visits by ichthy diverse and valuable fish fauna. ologists from overseas were defrayed by a grant from the We are proud of the affiliation of the J.L.B. Smith Insti John S. Schlesinger Foundation. tute with Rhodes University and happy to see the successful Although this book is an impressive contribution to the completion of this long-awaited work.",N/A,N/A,en
Geophysical Data Analysis: Discrete Inverse Theory,['William Menke'],2012-06-21,['Mathematics'],"""The treatment of inverse theory in this book is divided into four parts. Chapters 1 and 2 provide a general background, explaining what inverse problems are and what constitutes their solution as well as reviewing some of the basic concepts from linear algebra and probability theory that will be applied throughout the text. Chapters 3-7 discuss the solution of the canonical inverse problem: the linear problem with Gaussian statistics. This is the best understood of all inverse problems; and it is here that the fundamental notions of uncertainty, uniqueness, and resolution can be most clearly developed. Chapters 8-11 extend the discussion to problems that are non-Gaussian, nonlinear and continuous. Chapters 12-13 provide examples of the use of inverse theory and a discussion of the steps that must be taken to solve inverse problems on a computer""--",N/A,N/A,en
Satellites,['Michel Capderou'],2005-12-31,['Science'],"In all, the European Space Agency (ESA) has developed 60 spacecrafts over the last few decades. Some of these, such as the ERS satellites and Envisat, are dedicated to monitoring the Earthand providing vital data on the health status of our planet. Other spacecraft have helped to improve the accuracy of weather forecasting. Galileo, the joint ESA/EU satellite navigation p- gramme, demonstrates the political dimension of space as service-provider for the bene?t of European citizens. While these missions involve utilitarian space activities, others are devoted to either exploring the solar system, - cluding the Sun, or achieving a better understanding of the Universe and the cosmic beginnings. Theorbitsofthesesatellitescoverawiderange(Sun-synchronous,geos- tionary, highly eccentric, at Lagrange points, etc.) so that a complete novice may be astonished when tackling the space technology ?eld. The main credit of Michel Capderou’s book is to take the reader (whether it be a student, an engineer or a research scientist) progressively from the basic Kepler laws to the most complex equations of space mechanics. His educational concern has led him to propose many examples and graphicalillustrations from ESA, but alsofromthe American,Russian,Indian,Japaneseor evenChinese space agencies. These programmes provide scienti?c insights and moreover appear to fascinate the general public, in particular the younger generation. Those wishing to understand the orbital mechanisms behind these programmes will ?nd the explanations they seek in this book.",N/A,N/A,en
