title,authors,publishedDate,categories,description,averageRating,textSnippet,language
The Handbook of Individual Therapy,"['Windy Dryden', 'Andrew Reeves']",2013-11-15,['Psychology'],"′[This] is essential reading for all who aspire to professional practice to ensure that knowledge and skills are up to date in order to best serve their clients.′ Professor Sue Wheeler, University of Leicester ′[It] continues to be the book that one turns to when looking for a clear introduction to the broad range of therapies that are offered in the UK today.′ Dr Nick Midgley, Anna Freud Centre This classic text has helped over 50,000 students wishing to understand the key counselling and psychotherapy approaches. This sixth edition is the most comprehensive update since it was first published in 1984, with 15 newly contributed chapters and 8 updated chapters. Each approach now includes a new Research section summarising the research findings, an in-depth Case Study illustrating how that approach works in practice, and an extended Practice section. Also covered: · historical context and development · main theoretical assumptions · which clients will benefit most · strengths and limitations. New chapters include Compassion-Focussed Therapy, Interpersonal Therapy, Mindfulness in Individual Therapy, Pluralistic Therapy and The Transpersonal in Individual Therapy. This is an ideal one-stop shop for trainees of counselling, psychotherapy, counselling psychology, psychology and other allied professions wanting to learn about the most commonly practised therapies today. Windy Dryden has worked in the fields of counselling and psychotherapy since 1975. He is author/editor of over 200 books. Andrew Reeves is a BACP Senior Accredited Counsellor/Psychotherapist at the Univeristy of Liverpool and a freelance writer, trainer and supervisor. He is former Editor of the Counselling and Psychotherapy Research journal.",N/A,N/A,en
"Handbook for Theory, Research, and Practice in Gestalt Therapy",['Philip Brownell'],2009-03-26,['Psychology'],"Many books have been written about gestalt therapy. Not many have been written on the relationship between gestalt therapy and psychotherapy research. The Handbook for Theory, Research, and Practice in Gestalt Therapy is a needed bridge between these two concerns, and a timely addition to scholarly literature on gestalt therapy itself. In 2007 an international team of experienced gestalt therapists devoted themselves to create this book, and they have collaborated with one another to produce a challenging and enriching addition to the literature relevant to gestalt therapy. The book discusses the philosophy of science, the need for research specifically focused on gestalt therapy, and the critical realism and natural attitude found in both research and gestalt praxis. It provides discussions of qualitative and quantitative research, describes the methods of gestalt therapy as based in a unified theory, and illustrates the application of research in the contexts of emerging gestalt research communities. The discussion contained in this book is needed at a time when warrant for the practice of psychotherapy is increasingly sought in the empirical support available through psychotherapy research–the so called evidence-based movement–and at a time when public policy is increasingly driven by the call for ""what works.""",N/A,N/A,en
The Ethics of Psychoanalysis 1959-1960,['Jacques Lacan'],2013-11-19,['Psychology'],"In his famous seminar on ethics, Jacques Lacan uses this question as his departure point for a re-examination of Freud's work and the experience of psychoanalysis in relation to ethics. Delving into the psychoanalyst's inevitable involvement with ethical questions, Lacan clarifies many of his key concepts. During the seminar he discusses the problem of sublimation, the paradox of jouissance, the essence of tragedy, and the tragic dimension of analytical experience. One of the most influential French intellectuals of this century, Lacan is seen here at the height of his powers.",N/A,N/A,en
Mental and Moral Science,['Alexander Bain'],1879,['Ethics'],N/A,N/A,N/A,en
Influence and Autonomy in Psychoanalysis,['Stephen A. Mitchell'],2014-01-14,['Psychology'],"Stephen A. Mitchell has been at the forefront of the broad paradigmatic shift in contemporary psychoanalysis from the traditional one-person model to a two-person, interactive, relational perspective. In Influence and Autonomy in Psychoanalysis, Mitchell provides a critical, comparative framework for exploring the broad array of concepts newly developed for understanding interactive processes between analysand and analyst. Drawing on the broad traditions of Kleinian theory and interpersonal psychoanalysis, as well as object relations and progressive Freudian thought, he considers in depth the therapeutic action of psychoanalysis, anachronistic ideals like anonymity and neutrality, the nature of analytic knowledge and authority, and the problems of gender and sexual orientation in the age of postmodernism. The problem of influence guides his discussion of these and other topics. How, Mitchell asks, can analytic clinicians best protect the patient’s autonomy and integrity in the context of our growing appreciation of the enormous personal impact of the analyst on the process? Although Mitchell explores many facets of the complexity of the psychoanalytic process, he presents his ideas in his customarily lucid, jargon-free style, making this book appealing not only to clinicians with various backgrounds and degrees of experience, but also to lay readers interested in the achievements of, and challenges before, contemporary psychoanalysis. A splendid effort to relate parallel lines of theorizing and derivative changes in clinical practice and informed by mature clinical judgment and broad scholarship into the history of psychoanalytic ideas, Influence and Autonomy in Psychoanalysis takes a well-deserved place alongside Mitchell’s previous books. It is a brilliant synthesis of converging insights that have transformed psychoanalysis in our time, and a touchstone for enlightened dialogue as psychoanalysis approaches the millennium.",N/A,N/A,en
Undoing Gender,['Judith Butler'],2004,['History'],"First Published in 2004. Routledge is an imprint of Taylor & Francis, an informa company.",5,N/A,en
The Kama Sutra of Vatsyayana,['Vâtsyâyana'],2012-03-16,[],"In the literature of all countries there will be found a certain number of works treating especially of love. Everywhere the subject is dealt with differently, and from various points of view. In the present publication it is proposed to give a complete translation of what is considered the standard work on love in Sanscrit literature, and which is called the 'Vatsyayana Kama Sutra,' or Aphorisms on Love, by Vatsyayana.",N/A,N/A,en
Words and Minds,['Neil Mercer'],2000,['Language Arts & Disciplines'],Words and Minds takes a lively and accessible look at the evolution of language and how we use language in joint activities.,N/A,N/A,en
Connect,['Simon Lancaster'],2022-06-09,['Language Arts & Disciplines'],"*NEW EDITION FEATURING UPDATED MATERIAL* 'Erudite, interesting and, above all, entertaining' ALAN JOHNSON, FORMER UK HOME SECRETARY 'A racy, engrossing read' PROFESSOR IAN ROBERTSON 'Incredibly absorbing, leaving even the most confident orator with food for thought' PSYCHOLOGIES Communication can make the difference between failure and success. When communication goes badly, it's a nightmare. When it goes well, it's the stuff of dreams. In this revelatory and entertaining guide, top speechwriter Simon Lancaster reveals that the secret to great communication lies not in logic alone, but in skilfully connecting with people's deepest instincts and emotions. Through the power of connections, it is possible to transform people's perceptions about almost anything, making the scary safe, the unfamiliar familiar, and even turning a 'no' into a 'yes'. Drawing on cutting-edge neuroscience and ancient rhetoric, Lancaster examines ten powerful connections you can instantly make to change how people think, feel and act. Forget incomprehensible acronyms, mixed metaphors and jumbled jargon; with these connections, you can literally get people's mouths watering, make their hearts race and leave them addicted to your presence. Packed with wisdom, humour and actionable methods, Connect is the ultimate guide to great communication, giving you the power to inspire, influence and energise anyone, anywhere, anytime.",N/A,N/A,en
Euthydemus,['Plato'],2016-06-25,[],"The Euthydemus, though apt to be regarded by us only as an elaborate jest, has also a very serious purpose. It may fairly claim to be the oldest treatise on logic; for that science originates in the misunderstandings which necessarily accompany the first efforts of speculation. Translated by B. Jowett. Notice: This Book is published by Historical Books Limited (www.publicdomain.org.uk) as a Public Domain Book, if you have any inquiries, requests or need any help you can just send an email to publications@publicdomain.org.uk This book is found as a public domain and free book based on various online catalogs, if you think there are any problems regard copyright issues please contact us immediately via DMCA@publicdomain.org.uk",N/A,N/A,en
Bipolar Disorder,['Francis Mark Mondimore'],2008-02-01,['Health & Fitness'],"Bipolar disorder can be devastating. It can disrupt relationships and careers, it can wreak havoc on family life, and, when not properly treated, it can be fatal. Since 1999 this compassionate and comprehensive guide has helped tens of thousands of people cope with this complex disease. This, the second edition of Bipolar Disorder, is thoroughly updated and discusses promising new options for diagnosis and treatment along with new information on the disease's genetic components. Bipolar disorder is difficult to diagnose. Dr. Mondimore explains how symptoms fluctuate in persons with seasonal affective disorder, how they can lead to a mistaken diagnosis of attention deficit–hyperactivity disorder in children, and how they may be made worse by alcohol or drug addiction. The disease can also be difficult to treat. Dr. Mondimore gives advice about how to pick a psychiatrist and cope with the stigma of psychiatric diagnosis. He provides extensive information on treatment options, including the advantages, disadvantages, and side effects of various drug therapies. He also describes what it is like to live with bipolar disorder and discusses how lifestyle changes can improve quality of life. Throughout, he focuses on the importance of building a support system, planning for emergencies, and giving yourself permission to seek help.",N/A,N/A,en
The Complete MRCPsych,['Ashok Patel'],2006-01-27,['Medical'],"Studying for the MRCPsych exams can seem a daunting prospect, especially when faced with the vast amounts of literature available to help, but this book offers a complete solution in the form of a thoroughly comprehensive guide to the Part I Exam. Completely up to date and taking in the recent changes to the exam, the book reflects the exam format and content extremely accurately. Written by an experienced examiner with contributions from trainees, the book combines these elements to ensure that it is the perfect revision companion for any psychiatrist preparing for the MRCPsych Part I.",N/A,N/A,en
The Language Instinct,['Steven Pinker'],1995,['Language Arts & Disciplines'],"In this classic, the world's expert on language and mind lucidly explains everything you always wanted to know about language: how it works, how children learn it, how it changes, how the brain computes it, and how it evolved. With deft use of examples of humor and wordplay, Steven Pinker weaves our vast knowledge of language into a compelling story: language is a human instinct, wired into our brains by evolution. The Language Instinct received the William James Book Prize from the American Psychological Association and the Public Interest Award from the Linguistics Society of America. This edition includes an update on advances in the science of language since The Language Instinct was first published.",N/A,N/A,en
Encyclopedia of Human Development,['Neil J. Salkind'],2005-10-14,['Psychology'],"The field of human development focuses on the growth and development of the human being including physical, social, psychological, and emotional development. Under the broad umbrella of the term human development you find countless topics that range from charting the emotional attachment of an infant to his or her parents and its long-term effects on well-being, media violence and adolescents′ behavior, or factors moderating the natural decline in physical and mental abilities associated with aging. The Encyclopedia of Human Development is the first comprehensive, authoritative, and informative reference work that presents state-of-the-art research and ready-to-use facts from the fields of psychology, individual and family studies, and education in a way that is not too technical. With more than 600 entries, this three-volume Encyclopedia covers topics as diverse as adolescence, cognitive development, education, family, gender differences, identity, longitudinal research, personality development, prenatal development, temperament, and more. Key Features Provides cross-disciplinary coverage, with contributions from experts in the fields of psychology, education, human development and family studies, and gerontology Highlights classic studies and theories and provides brief biographies of notable researchers and theorists Takes a lifespan approach by including several ""anchor essays"" that cover specific phases of development such as prenatal, infancy, childhood, adolescence, early and middle adulthood, later adulthood and aging Begins with an Introduction that details the scope, rationale, and audience for the work The cross-disciplinary field of human development is one that captures interest among and holds practical relevance for the general public as well as academia, therefore this engaging Encyclopedia will be a welcome addition to any academic or public library.",N/A,N/A,en
Psychopathy,"['D.J. Cooke', 'Adelle E. Forth', 'Robert D. Hare']",2012-12-06,['Psychology'],"Psychopathy is a very important concept for those working in the field of criminal justice - investigators, prosecutors, and those who have to evaluate, manage and treat offenders. In Psychopathy: Theory, Research and Implications for Society, detailed, empirically based contributions by the world's leading researchers describe the relevance of the construct to practical and policy issues, examining its relevance to such topics as treatment, risk management and recidivism. The use of the concept in a range of populations is discussed, including juveniles, children, and the mentally disordered, as well as across cultures. The major strength of the volume is that the validity of the psychopathy construct is enhanced by the extensive empirical support: contributors explore topics including the genetic, biological, affective, interpersonal and information processing models that underpin the disorder. Audience: All those dealing with offenders - psychologists, psychiatrists, lawyers, judges, prison administrators and those who formulate policy in the criminal justice system.",N/A,N/A,en
HOW TO ANALYZE PEOPLE ON SIGHT,"['Lincoln, Elsie', 'Paine, Ralph']",2014-03-03,['Psychology'],"""Elsie Lincoln Benedict is known nationally, having conducted lecture courses in many of the large Eastern cities. Her work is based upon the practical methods of modern science as worked out in the world's leading laboratories where exhaustive tests are applied to determine individual types, talents, vocational bents and possibilities.""—San Francisco Bulletin, January 25, 1919.",N/A,N/A,en
"Identity, Security and Democracy","['Emilio Mordini', 'Manfred Green']",2009,['Computers'],"Many people think of personal identification as only part of the security/surveillance apparatus. This is likely to be an oversimplification, which largely misrepresents the reality. 'Personal identity' means two separate concepts, namely that an individual belongs to specific categories and also that this individual is distinguished by other persons and understood as one. In other words, there are two different aspects involved in personal recognition: distinguishing between individuals and distinguishing between sets of people. The latter is likely to be the real issue. Dictatorships of any kind and totalitarian regimes have always ruled by categorizing people and by creating different classes of subjects. When rules want their subjects to humiliate themselves or their fellows, they create categories of people or exploit existing categories. From social and political points of view this allows a process known as 'pseudospeciation' to be produced. Pseudospeciation is a process which turns social and cultural differences into biological diversities. It promotes cooperation within social groups, overpowering the selfish interests of individuals in favor of collective interests, yet it also inhibits cooperation between groups, and it fosters conflict and mistrust. This work is dedicated to the thorny and multifaceted relations between identity, security and democracy. Identity, Security and Democracy shows how full of nuances the process of human identification is. IOS Press is an international science, technical and medical publisher of high-quality books for academics, scientists, and professionals in all fields.",N/A,N/A,en
Learning ACT,"['Jason B. Luoma', 'Steven C. Hayes', 'Robyn D. Walser']",2017-12-01,['Psychology'],"Acceptance and commitment therapy (ACT) is among the most remarkable developments in contemporary psychotherapy. This second edition of the pioneering ACT skills-training manual for clinicians provides a comprehensive update—essential for both experienced practitioners and those new to using ACT and its applications. ACT is a proven-effective treatment for numerous mental health issues, including depression, anxiety, stress, addictions, eating disorders, schizophrenia, borderline personality disorder, and more. With important revisions based on new developments in contextual behavioral science, Learning ACT, Second Edition includes up-to-date exercises and references, as well as material on traditional, evidence-based behavioral techniques for use within the ACT framework. In this fully revised and updated edition of Learning ACT, you’ll find workbook-format exercises to help you understand and take advantage of ACT’s unique six process model—both as a tool for diagnosis and case conceptualization, and as a basis for structuring treatments for clients. You’ll also find up-to-the-minute information on process coaching, new experiential exercises, an increased focus on functional analysis, and downloadable extras that include role-played examples of the core ACT processes in action. By practicing the exercises in this workbook, you’ll learn how this powerful modality can improve clients’ psychological flexibility and help them to live better lives. Whether you’re a clinician looking for in-depth training and better treatment outcomes for individual clients, a student seeking a better understanding of this powerful modality, or anyone interested in contextual behavioral science, this second edition provides a comprehensive revision to an important ACT resource.",N/A,N/A,en
The Secret of Childhood,['Maria Montessori'],1977,['Education'],Dr Montessori s revolutionary method of education began early this century. In this classic work she expounds her conviction that in the child there are laws of growth in character and disposition as marked as those in his physical life. This book will be of great interest and importance to all those who care for the young.,N/A,N/A,en
How to Win Friends and Influence People,['Dale Carnegie'],2012,['Business & Economics'],"A canonical self help classic that has made Dale Carnegie a household word in self improvement. Vietnamese translation by FirstNews. New edition. In Vietnamese. Distributed by Tsai Fong Books, Inc.",5,N/A,en
"The Cognitive Neurosciences, fifth edition","['Michael S. Gazzaniga', 'George R. Mangun']",2014-10-24,['Science'],"The fifth edition of a work that defines the field of cognitive neuroscience, with entirely new material that reflects recent advances in the field. Each edition of this classic reference has proved to be a benchmark in the developing field of cognitive neuroscience. The fifth edition of The Cognitive Neurosciences continues to chart new directions in the study of the biological underpinnings of complex cognition—the relationship between the structural and physiological mechanisms of the nervous system and the psychological reality of the mind. It offers entirely new material, reflecting recent advances in the field. Many of the developments in cognitive neuroscience have been shaped by the introduction of novel tools and methodologies, and a new section is devoted to methods that promise to guide the field into the future—from sophisticated models of causality in brain function to the application of network theory to massive data sets. Another new section treats neuroscience and society, considering some of the moral and political quandaries posed by current neuroscientific methods. Other sections describe, among other things, new research that draws on developmental imaging to study the changing structure and function of the brain over the lifespan; progress in establishing increasingly precise models of memory; research that confirms the study of emotion and social cognition as a core area in cognitive neuroscience; and new findings that cast doubt on the so-called neural correlates of consciousness.",N/A,N/A,en
A Mind that Found Itself,['Clifford Whittingham Beers'],1907,['Biography & Autobiography'],I am not telling the story of my life just to write a book. I tell it because it seems my plain duty to do so. A narrow escape from death and a seemingly miraculous return to health after an apparently fatal illness are enough to make a man ask himself: For what purpose was my life spared? That question I have asked myself and this book is in part an answer.,N/A,N/A,en
A Shameful Life,['Osamu Dazai'],2018-11-13,['Fiction'],"Recipient of the 2018 William F. Sibley Memorial Subvention Award for Japanese Translation A new, definitive translation of the postwar classic known to the west as No Longer Human—a tortured vision inspiring the likes of Junji Ito and Bungo Stray Dogs Osamu Dazai is one of the most famous—and infamous—writers of 20th-century Japan. A Shameful Life (Ningen Shikkaku) is his final published work and has become a bestselling classic for its depiction of the tortured struggle of a young man to survive in a world that he cannot comprehend. Paralleling the life and death of Dazai himself, the delicate weaving of fact and fiction remorselessly documents via journals the life of Yozo, a university student who spends his time in increasing isolation and debauchery. His doomed love affairs, suicide attempts, and constant fear of revealing his true self haunt the pages of the book and reveal a slow descent into madness. This dark tale nevertheless conveys something authentic about the human heart and its inability to find its true bearing. Gibeau's translation cements A Shameful Life's place in the existentialist literary canon from Dostoevsky to Camus. Fans of Bungo Stray Dogs will recognize Osamu Dazai as one of the characters named after the giants of Japanese literature. Those familiar with the numerous adaptations in graphic novels and animation can experience the source material in faithful, modern prose.",N/A,N/A,en
Being and Nothingness,['Jean-Paul Sartre'],2018,['Existential psychology'],"A new trade edition of Sartre's magnum opus. First published in 1943, this masterpiece defines the modern condition and still holds relevance for today's readers.",N/A,N/A,en
The Anatomy of Human Destructiveness,['Erich Fromm'],1997,['Aggressiveness'],"In a world in which violence in every form seems to be increasing, Erich Fromm has treated this problem with deep perception in the most original and far-reaching work of his brilliant career. Fromm asks: what is there in the conditions of human existence to lead man to the orgies of destruction and violence in which he has indulged? By drawing on the findings of anthropology, palaeontogy, psychology and history; and including striking character analyses of Stalin, Hitler and Himmler, he shows how the failure to use our capacity for love and reason results in the development of the reverse: we wish to control life absolutely, or to destroy it.",N/A,N/A,en
Eros and Civilization,['Herbert Marcuse'],2015-09-29,['Psychology'],"""A philosophical critique of psychoanalysis that takes psychoanalysis seriously but not as unchallengeable dogma. . . . The most significant general treatment of psychoanalytic theory since Freud himself ceased publication.""—Clyde Kluckhohn, The New York Times",N/A,N/A,en
