title,authors,publishedDate,categories,description,averageRating,textSnippet,language
Critical Applied Linguistics,['Alastair Pennycook'],2021-06-28,['Education'],"Now in its second edition, this accessible guide and introduction to critical applied linguistics provides a clear overview of the problems, debates, and competing views in language education, literacy, discourse analysis, language in the workplace, translation, and other language-related domains. Covering both critical theory and domains of practice, the book is organized around five themes: the politics of knowledge, the politics of language, the politics of difference, the politics of texts, and the politics of pedagogy. Recognizing that a changing world requires new ways of thinking, and that many approaches have watered down over time, the new edition applies a sharp, fresh look at established and new intellectual frameworks. The second edition is comprehensively updated with additional research throughout and features new discussions of colonialism, queer theory, race and gender, translanguaging, and posthumanism. With a critical focus on the role of applied linguists, Pennycook emphasizes the importance of a situated, collaborative perspective that takes the discussion away from questions of implementation, and insists instead that critical applied linguistics has to be an emergent program from the contexts in which it works. This landmark text is essential reading for students and researchers of applied linguistics, multilingualism, language and education, TESOL, and language and identity.",N/A,N/A,en
Why Not Kill Them All?,"['Daniel Chirot', 'Clark McCauley']",2010-07-01,['Social Science'],"Genocide, mass murder, massacres. The words themselves are chilling, evoking images of the slaughter of countless innocents. What dark impulses lurk in our minds that even today can justify the eradication of thousands and even millions of unarmed human beings caught in the crossfire of political, cultural, or ethnic hostilities? This question lies at the heart of Why Not Kill Them All? Cowritten by historical sociologist Daniel Chirot and psychologist Clark McCauley, the book goes beyond exploring the motives that have provided the psychological underpinnings for genocidal killings. It offers a historical and comparative context that adds up to a causal taxonomy of genocidal events. Rather than suggesting that such horrors are the product of abnormal or criminal minds, the authors emphasize the normality of these horrors: killing by category has occurred on every continent and in every century. But genocide is much less common than the imbalance of power that makes it possible. Throughout history human societies have developed techniques aimed at limiting intergroup violence. Incorporating ethnographic, historical, and current political evidence, this book examines the mechanisms of constraint that human societies have employed to temper partisan passions and reduce carnage. Might an understanding of these mechanisms lead the world of the twenty-first century away from mass murder? Why Not Kill Them All? makes clear that there are no simple solutions, but that progress is most likely to be made through a combination of international pressures, new institutions and laws, and education. If genocide is to become a grisly relic of the past, we must fully comprehend the complex history of violent conflict and the struggle between hatred and tolerance that is waged in the human heart. In a new preface, the authors discuss recent mass violence and reaffirm the importance of education and understanding in the prevention of future genocides.",N/A,N/A,en
Tuesdays with Morrie,['Mitch Albom'],2002,['Amyotrophic lateral sclerosis'],"A sportswriter conveys the wisdom of his late mentor, college professor Morrie Schwartz, recounting their weekly conversations as Schwartz lay dying.",N/A,N/A,en
Dual-process Theories in Social Psychology,"['Shelly Chaiken', 'Yaacov Trope']",1999-02-19,['Psychology'],"This informative volume presents the first comprehensive review of research and theory on dual-process models of social information processing. These models distinguish between qualitatively different modes of information processing in making decisions and solving problems (e.g., associative versus rule-based, controlled versus uncontrolled, and affective versus cognitive modes). Leading contributors review the basic assumptions of these approaches and review the ways they have been applied and tested in such areas as attitudes, stereotyping, person perception, memory, and judgment. Also examined are the relationships between different sets of processing modes, the factors that determine their utilization, and how they work in combination to affect responses to social information.",2,N/A,en
Shorter Oxford Textbook of Psychiatry,"['Michael G. Gelder', 'Philip Cowen', 'Paul J. Harrison']",2006,['Medical'],"This title includes the following features: The latest edition of thestandard text for psychiatric trainees, consistently praised by readers and inreviews as one of the best examples of the genre; The balanced and humane approach is complemented by invaluable clinical tipsdrawn from the vast experience of the author team; Using both DSM and ICD classifications and written from a broad perspective,it has international appeal; Written with authority and insight, this edition has been comprehensivelyupdated and redesigned, and includes all the information needed by trainees formembership exams and in their future careers",N/A,N/A,en
Great Catastrophe,['Thomas De Waal'],2015,['History'],"Drawing on archival sources, reportage and moving personal stories, de Waal tells the full story of Armenian-Turkish relations since the Genocide in all its extraordinary twists and turns. He looks behind the propaganda to examine the realities of a terrible historical crime and the divisive ""politics of genocide"" it produced.",N/A,N/A,en
Hallucinations,['Oliver Sacks'],2012-11-08,['Literary Collections'],"Have you ever seen something that wasn't really there? Heard someone call your name in an empty house? Sensed someone following you and turned around to find nothing? Hallucinations don't belong wholly to the insane. Much more commonly, they are linked to sensory deprivation, intoxication, illness, or injury. In some conditions, hallucinations can lead to religious epiphanies or even the feeling of leaving one's own body. Humans have always sought such life-changing visions, and for thousands of years have used hallucinogenic compounds to achieve them. In Hallucinations, with his usual elegance, curiosity, and compassion, Dr Oliver Sacks weaves together stories of his patients and of his own mind-altering experiences to illuminate what hallucinations tell us about the organization and structure of our brains, how they have influenced every culture's folklore and art, and why the potential for hallucination is present in us all, a vital part of the human condition.",N/A,N/A,en
The Handbook of Child and Adolescent Clinical Psychology,['Alan Carr'],1999,['Psychology'],"This handbook covers all central concerns for practitioners of child and adolescent clinical psychology in a single manual, including conduct problems, emotional problems, learning disabilities, child protection, somatic illness and suicide.",3.5,N/A,en
The Cambridge Handbook of Multimedia Learning,['Richard E. Mayer'],2014-07-31,['Psychology'],"In recent years, multimedia learning, or learning from words and images, has developed into a coherent discipline with a significant research base. The Cambridge Handbook of Multimedia Learning is unique in offering a comprehensive, up-to-date analysis of research and theory in the field, with a focus on computer-based learning. Since the first edition appeared in 2005, it has shaped the field and become the primary reference work for multimedia learning. Multimedia environments, including online presentations, e-courses, interactive lessons, simulation games, slideshows, and even textbooks, play a crucial role in education. This revised second edition incorporates the latest developments in multimedia learning and contains new chapters on topics such as drawing, video, feedback, working memory, learner control, and intelligent tutoring systems. It examines research-based principles to determine the most effective methods of multimedia instruction and considers research findings in the context of cognitive theory to explain how these methods work.",N/A,N/A,en
The Handbook of Humanistic Psychology,"['Kirk J. Schneider', 'J. Fraser Pierson', 'James F. T. Bugental']",2014-02-14,['Psychology'],"The Second Edition of the cutting edge work, The Handbook of Humanistic Psychology, by Kirk J. Schneider, J. Fraser Pierson and James F. T. Bugental, represents the very latest scholarship in the field of humanistic psychology and psychotherapy. Set against trends inclined toward psychological standardization and medicalization, the handbook offers a rich tapestry of reflection by the leading person-centered scholars of our time. Their range in topics is far-reaching—from the historical, theoretical and methodological, to the spiritual, psychotherapeutic and multicultural. The new edition of this widely adopted and highly praised work has been thoroughly updated in accordance with the most current knowledge, and includes thirteen new chapters and sections, as well as contributions from twenty-three additional authors to extend the humanistic legacy to the emerging generation of students, scholars, and practitioners.",N/A,N/A,en
The Problems of Philosophy Illustrated,['Bertrand Russell'],2020-09,[],"The Problems of Philosophy is a 1912 book by Bertrand Russell, in which the author attempts to create a brief and accessible guide to the problems of philosophy. Focusing on problems he believes will provoke positive and constructive discussion, Russell concentrates on knowledge rather than metaphysics: If it is uncertain that external objects exist, how can we then have knowledge of them but by probability. There is no reason to doubt the existence of external objects simply because of sense data.",N/A,N/A,en
Three Contributions to the Theory of Sex,"['Sigmund Freud', 'Abraham Arden Brill']",1962,['Psychology'],"Landmark study examines sexual aberrations, infantile sexuality and the transformations of puberty. A unique work, according to translator A. A. Brill, it is ""unlike other works on sex...of interest not only to the student of abnormal manifestations [but also] indispensable to the psychologist, the anthropologist, sociologist, the jurist, and above all the teacher.""",N/A,N/A,en
Jung on Death and Immortality,['C. G. Jung'],1999-10-24,['Family & Relationships'],"""As a doctor, I make every effort to strengthen the belief in immortality, especially with older patients when such questions come threateningly close. For, seen in correct psychological perspective, death is not an end but a goal, and life's inclination towards death begins as soon as the meridian is past.""--C.G. Jung, commentary on The Secret of the Golden Flower ? Here collected for the first time are Jung's views on death and immortality, his writings often coinciding with the death of the most significant people in his life. The book shows many of the major themes running throughout the writings, including the relativity of space and time surrounding death, the link between transference and death, and the archetypes shared among the world's religions at the depths of the Self. The book includes selections from ""On Resurrection,"" ""The Soul and Death,"" ""Concerning Rebirth,"" ""Psychological Commentary on The Tibetan Book of the Dead"" from the Collected Works, ""Letter to Pastor Pfafflin"" from Letters, and ""On Life after Death.""",N/A,N/A,en
An Investigation of the Laws of Thought,['George Boole'],1951,['Mathematics'],N/A,N/A,N/A,en
The Emotional Life of Your Brain,"['Sharon Begley', 'Richard Davidson']",2012-03-01,"['Body, Mind & Spirit']","This groundbreaking book by a pioneer in neuroscience brings a new understanding of our emotions - why each of us responds so differently to the same life events and what we can do to change and improve our emotional lives. If you believe most self-help books, you would probably assume that we are all affected in the same way by events like grief or falling in love or being jilted and that only one process can help us handle them successfully. From thirty years of studying brain chemistry, Davidson shows just why and how we are all so different. Just as we all have our own DNA, so we each have our own emotional 'style' depending on our individual levels of dimensions like resilience, attention and self-awareness. Helping us to recognise our own emotional style, Davidson also shows how our brain patterns can change over our lives - and, through his fascinating experiments, what we can do to improve our emotional responses through, for example, meditation. Deepening our understanding of the mind-body connection - as well as conditions like autism and depression - Davidson stretches beyond mainstream psychology and neuroscience and expands our view of what it means to be human.",5,N/A,en
Raising An Emotionally Intelligent Child,['John Gottman'],2011-09-20,['Family & Relationships'],"Intelligence That Comes from the Heart Every parent knows the importance of equipping children with the intellectual skills they need to succeed in school and life. But children also need to master their emotions. Raising an Emotionally Intelligent Child is a guide to teaching children to understand and regulate their emotional world. And as acclaimed psychologist and researcher John Gottman shows, once they master this important life skill, emotionally intelligent children will enjoy increased self-confidence, greater physical health, better performance in school, and healthier social relationships. Raising an Emotionally Intelligent Child will equip parents with a five-step ""emotion coaching"" process that teaches how to: * Be aware of a child's emotions * Recognize emotional expression as an opportunity for intimacy and teaching * Listen empathetically and validate a child's feelings * Label emotions in words a child can understand * Help a child come up with an appropriate way to solve a problem or deal with an upsetting issue or situation Written for parents of children of all ages, Raising an Emotionally Intelligent Child will enrich the bonds between parent and child and contribute immeasurably to the development of a generation of emotionally healthy adults.",2,N/A,en
A Study in Scarlet by Arthur Conan Doyle,['Arthur Conan Doyle'],2020-12-02,[],"The first of the Sherlock Holmes stories, this was also the first of Conan Doyle's books to be published. In this fascinating and exciting tale, the two towering creations of detective fiction--Holmes, the master of the science of detection, and Watson, his faithful companion--make their auspicious debut. The two detectives are immediately in fine form as Holmes plucks the solution to the mystery from the heart of Victorian London.",N/A,N/A,en
Anti-Oedipus,"['Gilles Deleuze', 'Felix Guattari']",2009-05-26,['Social Science'],"An ""introduction to the nonfascist life"" (Michel Foucault, from the Preface) When it first appeared in France, Anti-Oedipus was hailed as a masterpiece by some and ""a work of heretical madness"" by others. In it, Gilles Deleuze and Félix Guattari set forth the following theory: Western society's innate herd instinct has allowed the government, the media, and even the principles of economics to take advantage of each person's unwillingness to be cut off from the group. What's more, those who suffer from mental disorders may not be insane, but could be individuals in the purest sense, because they are by nature isolated from society. More than twenty-five years after its original publication, Anti-Oedipus still stands as a controversial contribution to a much-needed dialogue on the nature of free thinking.",N/A,N/A,en
Status Anxiety,['Alain De Botton'],2004,['Philosophy'],"With characteristic originality, lucidity, and lan, de Botton addresses the anxieties that seem inextricably embedded in our pursuit of success and status, and explores what, if anything, we can do about them.",N/A,N/A,en
The Critique of Pure Reason,['Immanuel Kant'],2016-12-04,[],"The Critique of Pure Reason (German: Kritik der reinen Vernunft, KrV) by Immanuel Kant, ( rst published in 1781, second edition 1787), is one of the most in uential works in the history of philosophy. Also referred to as Kant's First Critique, it was followed by the Critique of Practical Reason (1788) and the Critique of Judgment (1790). In the preface to the rst edition Kant explains what he means by a critique of pure reason: ""I do not mean by this a critique of books and systems, but of the faculty of reason in general, in respect of all knowledge after which it may strive independently of all experience."" Dealing with questions concerning the foundations and extent of human knowledge, Kant builds on the work of empiricist philosophers such as John Locke and David Hume, as well as taking into account the theories of rationalist philosophers such as Gottfried Wilhelm Leibniz and Christian Wolff. Kant expounds new ideas on the nature of space and time, and claims to solve the problem which Hume posed regarding human knowledge of the relation of cause and effect, and to have assessed the ability of the human mind to engage in metaphysics. Each RADLEY CLASSIC is a meticulously restored, luxurious and faithful reproduction of a classic book; produced with elegant text layout, clarity of presentation, and stylistic features that make reading a true pleasure. Special attention is given to legible fonts and adequate letter sizing, correct line length for readability, generous margins and triple lead (lavish line separation); plus we do not allow any mistakes/changes/ additions to creep into the author's words. Visit RADLEY BOOKS at www.radleybooks.com to see more classic book titles in this series.",N/A,N/A,en
Cognition and Figurative Language,"['Richard P. Honeck', 'Robert R. Hoffman']",2018-10-31,['Language Arts & Disciplines'],"Originally published in 1980, this is a book about the psychology of figurative language. It is however, eclectic and therefore should be of interest to professionals and students in education, linguistics, philosophy, sociolinguistics, and other concerned with meaning and cognition. The editors felt there was a pressing need to bring together the growing empirical efforts of this topic. In a sense, recognition of the theoretical importance of figurative language symbolized the transition from the psycholinguistics of the 1960s to that of the late 1970s, that is from a linguistic semantics to a more comprehensive psychological semantics with a healthy respect for context, inference, world knowledge, and above all creative imagination. The organization of the volume reflects the more basic, general concerns with cognition – from historical and philosophical background, through problems of mental representation and semantic theory, to developmental trends, and to applications in problem solving.",N/A,N/A,en
A Manual of Psychology,['George Frederick Stout'],1915,['Psychology'],N/A,N/A,N/A,en
Theories of Personality,['Jess Feist'],1994,['Psychology'],"Accurate and authoritative, ""Theories of Personality"" by Jess and Gregory Feist presents 23 leading theories of personality in a thorough, interesting and logical manner. The book begins with an introductory chapter designed to acquaint students with the meaning of personality and provide them with a solid foundation for understanding the nature of theory and its crucial contributions to science. The next seventeen chapters present twenty-three major theories with a fresh approach and a more complete view encompassing, a biographical sketch of each theorist, related research and applications to real life. When appropriate, the authors point out ways in which the theorists' life experiences may have helped shape her or his theory.",N/A,N/A,en
Not Gay,['Jane Ward'],2015-07-31,['Psychology'],"A different look at heterosexuality in the twenty-first century A straight white girl can kiss a girl, like it, and still call herself straight—her boyfriend may even encourage her. But can straight white guys experience the same easy sexual fluidity, or would kissing a guy just mean that they are really gay? Not Gay thrusts deep into a world where straight guy-on-guy action is not a myth but a reality: there’s fraternity and military hazing rituals, where new recruits are made to grab each other’s penises and stick fingers up their fellow members’ anuses; online personal ads, where straight men seek other straight men to masturbate with; and, last but not least, the long and clandestine history of straight men frequenting public restrooms for sexual encounters with other men. For Jane Ward, these sexual practices reveal a unique social space where straight white men can—and do—have sex with other straight white men; in fact, she argues, to do so reaffirms rather than challenges their gender and racial identity. Ward illustrates that sex between straight white men allows them to leverage whiteness and masculinity to authenticate their heterosexuality in the context of sex with men. By understanding their same-sex sexual practice as meaningless, accidental, or even necessary, straight white men can perform homosexual contact in heterosexual ways. These sex acts are not slippages into a queer way of being or expressions of a desired but unarticulated gay identity. Instead, Ward argues, they reveal the fluidity and complexity that characterizes all human sexual desire. In the end, Ward’s analysis offers a new way to think about heterosexuality—not as the opposite or absence of homosexuality, but as its own unique mode of engaging in homosexual sex, a mode characterized by pretense, dis-identification and racial and heterosexual privilege. Daring, insightful, and brimming with wit, Not Gay is a fascinating new take on the complexities of heterosexuality in the modern era.",N/A,N/A,en
Great Ideas Civilization and Its Discontents,['Sigmund Freud'],2005-02-01,['Philosophy'],"Throughout history, some books have changed the world. They have transformed the way we see ourselves - and each other. They have inspired debate, dissent, war and revolution. They have enlightened, outraged, provoked and comforted. They have enriched lives - and destroyed them. Now Penguin brings you the works of the great thinkers, pioneers, radicals and visionaries whose ideas shook civilization, and helped make us who we are.",N/A,N/A,en
The Interpretation of Dreams (Hardcover Library Edition),['Sigmund Freud'],2021-06-10,['Psychology'],"First published in 1899, 'The Interpretation of Dreams' written by Sigmund Freud, presents the theory of the unconscious with respect to dream interpretation and discusses what would later become the theory of the Oedipus complex. Sigmund Freud is an Austrian neurologist and the founding father of psychoanalysis, a method for treating mental illness and also a theory that explains human behavior. Freud believed that events in our childhood hold a great impact on our adult lives, shaping our personality. In creating psychoanalysis, Freud designed therapeutic techniques such as the use of free association and discovered transference, establishing its central role in the analytic process. Freud saw that man is at war with himself and often unable to tolerate too much reality. He propounded the theory that dreams are the contraband representations of the beast within man, smuggled into awareness during sleep. In Freudian interpretation, the analysis of dreams is the key to unlocking the secrets of the unconscious mind. Top 10 Hardcover Library Books: A Wrinkle in Time (9789389440188) How to Stop Worrying and Start Living (9789387669161) Their Eyes Were Watching God (9789389440577) The Magic of Believing (9789388118217) Zen in the Art of Archery (9789354990298) A Cloud by Day, a Fire by Night (9789391181611) Siddhartha by Hermann hesse (9789387669116) The Richest Man in Babylon (9789354990717) The Book of Five Rings (9789389440553) The Knowledge of the Holy (9789389157239) Note: Search by ISBN",N/A,N/A,en
Descartes' Error,['Antonio Damasio'],2005-09-27,['Psychology'],"""An ambitious and meticulous foray into the nature of being."" -- The Boston Globe A landmark exploration of the relationship between emotion and reason Since Descartes famously proclaimed, ""I think, therefore I am,"" science has often overlooked emotions as the source of a person’s true being. Even modern neuroscience has tended, until recently, to concentrate on the cognitive aspects of brain function, disregarding emotions. This attitude began to change with the publication of Descartes’ Error in 1995. Antonio Damasio—""one of the world’s leading neurologists"" (The New York Times)—challenged traditional ideas about the connection between emotions and rationality. In this wondrously engaging book, Damasio takes the reader on a journey of scientific discovery through a series of case studies, demonstrating what many of us have long suspected: emotions are not a luxury, they are essential to rational thinking and to normal social behavior.",N/A,N/A,en
