title,authors,publishedDate,categories,description,averageRating,textSnippet,language
Fear,['Thich Nhat Hanh'],2012-11-13,['Religion'],"“Written in words so intimate, calm, kind, and immediate, this extraordinary book feels like a message from our very own heart….Thich Nhat Hanh is one of the most important voices of our time, and we have never needed to listen to him more than now.” —Sogyal Rinpoche Fear is destructive, a pervasive problem we all face. Vietnamese Buddhist Zen Master, poet, scholar, peace activist, and one of the foremost spiritual leaders in the world—a gifted teacher who was once nominated for the Nobel Peace Prize by Martin Luther King Jr.—Thich Nhat Hanh has written a powerful and practical strategic guide to overcoming our debilitating uncertainties and personal terrors. The New York Times said Hanh, “ranks second only to the Dalai Lama” as the Buddhist leader with the most influence in the West. In Fear: Essential Wisdom for Getting through the Storm, Hanh explores the origins of our fears, illuminating a path to finding peace and freedom from anxiety and offering powerful tools to help us eradicate it from our lives",5,N/A,en
From Cliche to Archetype,"['Marshall McLuhan', 'Wilfred Watson']",1970,['Language Arts & Disciplines'],"Six years after the publication of his seminal work, Understanding Media, the Extensions of Man, Marshall McLuhan linked his insights into media to his love of literature and produced From Cliché to Archetype. ""In the age of electronic retrieval, the entire phenomenal universe is at once junkyard and museum"" -- cliché and archetype. ""Every culture now rides on the back of every other culture.""In these pages, readers learn how to look at stale clichés with fresh eyes, as artists do, and discover that clichés provide the key to understanding Modernism, from the puns of James Joyce to Ionesco's Theater of the Absurd. McLuhan mines the greats of modern literature, such as Yeats, Eliot, and Pound, and points the way to richer understanding of their work. Discussion ranges over conventional topics of literary analysis such as genres, esthetics, rhetoric, paradox, mimesis, and parody, though never in conventional fashion, because McLuhan deliberately stakes his turf in a manner that draws technology and culture together. As a result, the key terms cliché and archetype are not confined to language but are shown to have counterparts in the non-linguistic world. --",N/A,N/A,en
The Cultural Nature of Human Development,['Barbara Rogoff'],2003-02-13,['Social Science'],"Three-year-old Kwara'ae children in Oceania act as caregivers of their younger siblings, but in the UK, it is an offense to leave a child under age 14 ears without adult supervision. In the Efe community in Zaire, infants routinely use machetes with safety and some skill, although U.S. middle-class adults often do not trust young children with knives. What explains these marked differences in the capabilities of these children? Until recently, traditional understandings of human development held that a child's development is universal and that children have characteristics and skills that develop independently of cultural processes. Barbara Rogoff argues, however, that human development must be understood as a cultural process, not simply a biological or psychological one. Individuals develop as members of a community, and their development can only be fully understood by examining the practices and circumstances of their communities.",5,N/A,en
"The Descent of Man, and Selection in Relation to Sex, Volume 1",['Charles Darwin'],2016-05-20,[],"This work has been selected by scholars as being culturally important, and is part of the knowledge base of civilization as we know it. This work was reproduced from the original artifact, and remains as true to the original work as possible. Therefore, you will see the original copyright references, library stamps (as most of these works have been housed in our most important libraries around the world), and other notations in the work. This work is in the public domain in the United States of America, and possibly other nations. Within the United States, you may freely copy and distribute this work, as no entity (individual or corporate) has a copyright on the body of the work. As a reproduction of a historical artifact, this work may contain missing or blurred pages, poor pictures, errant marks, etc. Scholars believe, and we concur, that this work is important enough to be preserved, reproduced, and made generally available to the public. We appreciate your support of the preservation process, and thank you for being an important part of keeping this knowledge alive and relevant.",N/A,N/A,en
"Stress of War, Conflict and Disaster",['George Fink'],2010-11-25,['Psychology'],"Stress is a universal phenomenon that impacts adversely on most people. Following on the heels of Stress Science: Neuroendocrinology and Stress Consequences: Mental, Neuropsychological and Socioeconomic, this third derivative volume will provide a readily accessible and affordable compendium that explains the phenomenon of stress as it relates physically and mentally to war, conflict and disaster. The first section will be dedicated to study of the link between stress and various forms of conflict. Specific instances of conflict will be discussed - the Gulf wars, Korea, Hiroshima bombing, the Holocaust, 9/11, Northern Ireland, terrorism in general, torture. The second section will explore the stress impact of more general physical disasters such as airline and vehicle accidents, earthquakes, floods, and hurricanes. The final section will focus on the clinical relationship between conflict stress and various mental diseases – PTSD, suicide, disaster syndrome, etc – as well as the adverse impact of stress on human physical health in general. Comprised of about 100 top articles selected from Elsevier's Encyclopedias of Stress, the volume will provide a valuable desk reference that will put relevant articles readily at the fingertips of all scientists who consider stress. - Chapters offer impressive and unique scope with topics addressing the relationship between stress generated by war, conflict and disaster and various physical/mental disorders - Richly illustrated with over 200 figures, dozens in color - Articles carefully selected by one of the world's most preeminent stress researchers and contributors represent the most outstanding scholarship in the field, with each chapter providing fully vetted and reliable expert knowledge",N/A,N/A,en
Coping,['C. R. Snyder'],1999,['Medical'],"Most people take the process of coping for granted as they go about their daily activities. In many ways, coping is like breathing, an automatic process requiring no apparent effort. However, when people face truly threatening events--what psychologists call stressors--they become acutely aware of the coping process and respond by consciously applying their day-to-day coping skills. Coping is a fundamental psychological process, and people's skills are commensurately sophisticated. This volume builds on people's strengths and emphasizes their role as positive copers. It features techniques for preventing psychological problems and breaks from the traditional research approach, which is modeled on medicine and focuses on pathology and treatment. Collecting both award-winning research and new findings, this book may well set the agenda for research on stress and coping for the next century. These provocative and readable essays explore a variety of topics, including reality negotiation, confessing through writing, emotional intelligence, optimism, hope, mastery-oriented thinking, and more. Unlike typical self-help books available at any newsstand, this volume features the work of some of the most eminent researchers in the field. Yet like those books it is written for the general reader, as well as for the specialist, and includes numerous practical suggestions and techniques. It will prove an invaluable tool for a wide range of readers.",N/A,N/A,en
Adaptation in Natural and Artificial Systems,['John Henry Holland'],1992,['Psychology'],"Genetic algorithms are playing an increasingly important role in studies of complex adaptive systems, ranging from adaptive agents in economic theory to the use of machine learning techniques in the design of complex devices such as aircraft turbines and integrated circuits. Adaptation in Natural and Artificial Systems is the book that initiated this field of study, presenting the theoretical foundations and exploring applications. In its most familiar form, adaptation is a biological process, whereby organisms evolve by rearranging genetic material to survive in environments confronting them. In this now classic work, Holland presents a mathematical model that allows for the nonlinearity of such complex interactions. He demonstrates the model's universality by applying it to economics, physiological psychology, game theory, and artificial intelligence and then outlines the way in which this approach modifies the traditional views of mathematical genetics. Initially applying his concepts to simply defined artificial systems with limited numbers of parameters, Holland goes on to explore their use in the study of a wide range of complex, naturally occuring processes, concentrating on systems having multiple factors that interact in nonlinear ways. Along the way he accounts for major effects of coadaptation and coevolution: the emergence of building blocks, or schemata, that are recombined and passed on to succeeding generations to provide, innovations and improvements.",N/A,N/A,en
Escape from Freedom,['Erich Fromm'],2011-09-30,['History'],N/A,N/A,N/A,en
Emotional Intelligence,['Daniel Goleman'],2005-09-27,['Self-Help'],"#1 BESTSELLER • The groundbreaking book that redefines what it means to be smart, with a new introduction by the author “A thoughtfully written, persuasive account explaining emotional intelligence and why it can be crucial.”—USA Today Everyone knows that high IQ is no guarantee of success, happiness, or virtue, but until Emotional Intelligence, we could only guess why. Daniel Goleman's brilliant report from the frontiers of psychology and neuroscience offers startling new insight into our “two minds”—the rational and the emotional—and how they together shape our destiny. Drawing on groundbreaking brain and behavioral research, Goleman shows the factors at work when people of high IQ flounder and those of modest IQ do surprisingly well. These factors, which include self-awareness, self-discipline, and empathy, add up to a different way of being smart—and they aren’t fixed at birth. Although shaped by childhood experiences, emotional intelligence can be nurtured and strengthened throughout our adulthood—with immediate benefits to our health, our relationships, and our work. The twenty-fifth-anniversary edition of Emotional Intelligence could not come at a better time—we spend so much of our time online, more and more jobs are becoming automated and digitized, and our children are picking up new technology faster than we ever imagined. With a new introduction from the author, the twenty-fifth-anniversary edition prepares readers, now more than ever, to reach their fullest potential and stand out from the pack with the help of EI.",N/A,N/A,en
The Importance of Being Earnest,['Oscar Wilde'],2021-09-09,[],"This work has been selected by scholars as being culturally important and is part of the knowledge base of civilization as we know it. This work is in the public domain in the United States of America, and possibly other nations. Within the United States, you may freely copy and distribute this work, as no entity (individual or corporate) has a copyright on the body of the work. Scholars believe, and we concur, that this work is important enough to be preserved, reproduced, and made generally available to the public. To ensure a quality reading experience, this work has been proofread and republished using a format that seamlessly blends the original graphical elements with text in an easy-to-read typeface. We appreciate your support of the preservation process, and thank you for being an important part of keeping this knowledge alive and relevant.",N/A,N/A,en
Beyond Good and Evil,['Friedrich Wilhelm Nietzsche'],2021-02-24,[],"24. O sancta simplicitas! In what strange simplification and falsification man lives! One can nevercease wondering when once one has got eyes for beholding this marvel! How we have madeeverything around us clear and free and easy and simple! how we have been able to give our senses apassport to everything superficial, our thoughts a godlike desire for wanton pranks and wronginferences!-how from the beginning, we have contrived to retain our ignorance in order to enjoyan almost inconceivable freedom, thoughtlessness, imprudence, heartiness, and gaiety-in order toenjoy life! And only on this solidified, granite-like foundation of ignorance could knowledge rearitself hitherto, the will to knowledge on the foundation of a far more powerful will, the will toignorance, to the uncertain, to the untrue! Not as its opposite, but-as its refinement! It is to behoped, indeed, that LANGUAGE, here as elsewhere, will not get over its awkwardness, and that itwill continue to talk of opposites where there are only degrees and many refinements of gradation; itis equally to be hoped that the incarnated Tartuffery of morals, which now belongs to ourunconquerable ""flesh and blood,"" will turn the words round in the mouths of us discerning ones.Here and there we understand it, and laugh at the way in which precisely the best knowledge seeksmost to retain us in this SIMPLIFIED, thoroughly artificial, suitably imagined, and suitably falsifiedworld: at the way in which, whether it will or not, it loves error, because, as living itself, it loves life!",N/A,N/A,en
Childhood And Society,['E H Erikson'],2014-08-21,['Psychology'],"With this deeply influential book, which is now internationally recognised as a classic study of childhood and its social significance, Professor Erikson has made an outstanding contribution to the study of human behaviour. Drawing on psychoanalytical theory and his own clinical experience, he devotes the main chapters to anxiety in young children, apathy in American Indians, confusion in veterans of war, and arrogance in young Nazis.",N/A,N/A,en
Statistics in Psychology and Education,['Henry Edward Garrett'],1947,['Education'],N/A,N/A,N/A,en
The Children who Lived,"['Kathryn A. Markell', 'Marc A. Markell']",2008,['Family & Relationships'],"Harry Potter's encounters with grief, as well as the grief experiences of other fictional characters, can be used by educators, counselors, and parents to help children and adolescents deal with their own loss issues. The Children Who Lived is a unique approach toward grief and loss in children. Focusing on fictional child and adolescent characters experiencing grief, this book uses classic tales and the Harry Potter books to help grieving children and adolescents. Included in the text and the companion CD are a number of activities, discussion questions, and games that could be used with grieving children and adolescents, based on the fictional characters in these books.",N/A,N/A,en
Beyond Order,['Jordan B. Peterson'],2022,['Philosophy'],"""As a follow-up to 12 Rules for Life, the author provides twelve additional rules related to the overarching theme of how the dangers of too much security and control might be profitably avoided""--",N/A,N/A,en
Handbook of Divorce and Relationship Dissolution,"['Mark A. Fine', 'John H. Harvey']",2013-12-19,['Education'],"This Handbook presents up-to-date scholarship on the causes and predictors, processes, and consequences of divorce and relationship dissolution. Featuring contributions from multiple disciplines, this Handbook reviews relationship termination, including variations depending on legal status, race/ethnicity, and sexual orientation. The Handbook focuses on the often-neglected processes involved as the relationship unfolds, such as infidelity, hurt, and remarriage. It also covers the legal and policy aspects, the demographics, and the historical aspects of divorce. Intended for researchers, practitioners, counselors, clinicians, and advanced students in psychology, sociology, family studies, communication, and nursing, the book serves as a text in courses on divorce, marriage and the family, and close relationships.",N/A,N/A,en
Walden,['Henry David Thoreau'],2008,['Biography & Autobiography'],"In July 1845, Henry David Thoreau built a small cottage in the woods near Walden Pond in Concord, Massachusetts. During the two years and two months he spent there, he began to write Walden, a chronicle of his communion with nature that became one of the most influential and compelling books in American literature. Since its first publication on August 9, 1854, by Ticknor and Fields, the work has become a classic, beloved for its message of living simply and in harmony with nature. This edition of Walden features exquisite wood engravings by Michael McCurdy, one of America's leading engravers and woodblock artists. McCurdy's engravings bring the text to life--and illuminate the spirit of Thoreau's prose. Also included is a foreword by noted author, environmentalist, and naturalist Terry Tempest Williams who reflects upon Thoreau's message that as we explore our world and ourselves, we draw ever closer to the truth of our connectedness.",N/A,N/A,en
Research Methods in Psychology,"['Glynis M Breakwell', 'Sean Hammond', 'Chris Fife-Schaw']",2000-07-27,['Medical'],"Research Methods in Psychology, Second Edition is an expanded and updated new edition of a bestselling textbook. It presents a comprehensive and accessible introduction to the key research methods, both qualitative and quantitative, employed in psychology and across the social sciences. Four new chapters are presented (Research with Special Groups, Cross-Cultural Research, Content Analysis, and Introduction to Structural Equation Modelling) and all other chapters have been thoroughly revised and brought up-to-date. The book has four parts: in the first the relationship between psychological theory and research methodology, from both a practical and ethical viewpoint is considered; the second explains how to collect data using the major types of research design, and at the same time introduces the philosophical principles underlying them; in Part Three an invaluable guide to the traditional techniques of data gathering in psychology, as well as featuring less common techniques is offered; and finally the fourth part covers the issue of data analysis, clearly explaining the logic of statistical testing and the relationships between methodology and statistics, avoiding over-complicated formulae and focusing upon what can legitimately be inferred from commonly used psychological statistics. The book is illustrated throughout with examples from current research and combines step-by-step advice, exercises and lists of further reading.",N/A,N/A,en
The Crowd,['Gustave Le Bon'],2010-09-01,['Psychology'],"A temporary classic treatise of mob psychology. Vietnamese translation by Nguyen Xuan Khanh. In Vietnamese. Distributed by Tsai Fong Books, Inc.",N/A,N/A,en
The Oxford Handbook of Prosocial Behavior,"['David A. Schroeder', 'William G. Graziano']",2015,['Philosophy'],"The Oxford Handbook of Prosocial Behavior provides a comprehensive review of the current literature on when and why people act to benefit others. It provides a comprehensive overview of the field to give both the casual reader and the neophyte to the field some perspective about fundamental questions (what, why, when, and who) relative to prosocial behavior. Taking a multi-level approach, the chapters represent the broad spectrum of this multi-faceted domain. Topics range from micro-level analyses involving evolutionary and comparative psychological factors to macro-level applications, such as reducing intergroup conflicts and ethnic genocide. Between these extremes, the contributors--all internationally recognized in their field--offer their perspectives on developmental processes that may predispose individuals to empathize with and respond to the needs of others, individual differences that seem to interact with situational demands to promote helping, and the underlying motivations of those helping others. They explain volunteerism, intragroup cooperation, and intergroup cooperation to move the analysis from the individual to group-level phenomena. They extend the consideration of this topic to include support of pro-environmental actions, means to encourage participation in medical clinical trials, and the promotion of world peace. The ways that gender, interpersonal relationships, race, and religion might affect decisions to give aid and support to others are also addressed. The final chapter offers a unique view of prosocial behavior that encourages researchers and readers to take an even broader consideration of the field to search for a prosocial consilience.",N/A,N/A,en
Imagination and the Arts in C. S. Lewis,['Peter J. Schakel'],2011,['Art'],"Imagination has long been regarded as central to C. S. Lewis's life and to his creative and critical works, but this is the first study to provide a thorough analysis of his theory of imagination, including the different ways he used the word and how those uses relate to each other. Peter Schakel begins by concentrating on the way reading or engaging with the other arts is an imaginative activity. He focuses on three books in which imagination is the central theme--Surprised by Joy, An Experiment in Criticism, and The Discarded Image--and shows the important role of imagination in Lewis's theory of education. He then examines imagination and reading in Lewis's fiction, concentrating specifically on the Chronicles of Narnia, the most imaginative of his works. He looks at how the imaginative experience of reading the Chronicles is affected by the physical texture of the books, the illustrations, revisions of the texts, the order in which the books are read, and their narrative ""voice,"" the ""storyteller"" who becomes almost a character in the stories. Imagination and the Arts in C. S. Lewis also explores Lewis's ideas about imagination in the nonliterary arts. Although Lewis regarded engagement with the arts as essential to a well- rounded and satisfying life, critics of his work and even biographers have given little attention to this aspect of his life. Schakel reviews the place of music, dance, art, and architecture in Lewis's life, the ways in which he uses them as content in his poems and stories, and how he develops some of the deepest, most significant themes of his stories through them. Schakel concludes by analyzing the uses and abuses of imagination. He looks first at ""moral imagination."" Although Lewis did not use this term, Schakel shows how Lewis developed the concept in That Hideous Strength and The Abolition of Man long before it became popularized in the 1980s and 1990s. While readers often concentrate on the Christian dimension of Lewis's works, equally or more important to him was their moral dimension. Imagination and the Arts in C. S. Lewis will appeal to students and teachers of both children's literature and twentieth-century British writers. It will also be of value to readers who wish to compare Lewis's creations with more recent imaginative works such as the Harry Potter series.",N/A,N/A,en
Driven To Distraction,"['Edward M. Hallowell', 'John J. Ratey']",1995-03-02,['Family & Relationships'],"Through vivid stories of the experiences of their patients (both adults and children), Drs. Hallowell and Ratey show the varied forms ADD takes -- from the hyperactive search for high stimulation to the floating inattention of daydreaming -- and the transforming impact of precise diagnosis and treatment.",5,N/A,en
The Sciences of the Soul,['Fernando Vidal'],2011-12-15,['History'],"Fernando Vidal’s trailblazing text on the origins of psychology traces the development of the discipline from its appearance in the late sixteenth century to its redefinition at the end of the seventeenth and its emergence as an institutionalized field in the eighteenth. Originally published in 2011, The Sciences of the Soul continues to be of wide importance in the history and philosophy of psychology, the history of the human sciences more generally, and in the social and intellectual history of eighteenth-century Europe.",N/A,N/A,en
Man and His Symbols,"['Carl Gustav Jung', 'Marie-Luise von Franz']",1964,['Psychology'],"Illustrated throughout with revealing images, this is the first and only work in which the world-famous Swiss psychologist explains to the layperson his enormously influential theory of symbolism as revealed in dreams.",4.5,N/A,en
