title,authors,publishedDate,categories,description,averageRating,textSnippet,language
The Power of Habit,['Charles Duhigg'],2012-02-28,['Business & Economics'],"NEW YORK TIMES BESTSELLER • MORE THAN 3 MILLION COPIES SOLD • This instant classic explores how we can change our lives by changing our habits. “Few [books] become essential manuals for business and living. The Power of Habit is an exception.”—Financial Times A WALL STREET JOURNAL AND FINANCIAL TIMES BEST BOOK OF THE YEAR In The Power of Habit, award-winning business reporter Charles Duhigg takes us to the thrilling edge of scientific discoveries that explain why habits exist and how they can be changed. Distilling vast amounts of information into engrossing narratives that take us from the boardrooms of Procter & Gamble to the sidelines of the NFL to the front lines of the civil rights movement, Duhigg presents a whole new understanding of human nature and its potential. At its core, The Power of Habit contains an exhilarating argument: The key to exercising regularly, losing weight, being more productive, and achieving success is understanding how habits work. As Duhigg shows, by harnessing this new science, we can transform our businesses, our communities, and our lives. With a new Afterword by the author",4,N/A,en
Marital Conflict and Children,"['E. Mark Cummings', 'Patrick T. Davies']",2011-09-01,['Psychology'],"From leading researchers, this book presents important advances in understanding how growing up in a discordant family affects child adjustment, the factors that make certain children more vulnerable than others, and what can be done to help. It is a state-of-the-science follow-up to the authors' seminal earlier work, Children and Marital Conflict: The Impact of Family Dispute and Resolution. The volume presents a new conceptual framework that draws on current knowledge about family processes; parenting; attachment; and children's emotional, physiological, cognitive, and behavioral development. Innovative research methods are explained and promising directions for clinical practice with children and families are discussed.",N/A,N/A,en
Philosophical Explanations,['Robert Nozick'],1981,['Philosophy'],"Nozick develops new views on philosophy’s central topics and weaves them into a unified perspective. He ranges widely over philosophy’s fundamental concerns: the identity of the self, knowledge and skepticism, free will, the question of why there is something rather than nothing, the foundations of ethics, the meaning of life.",3,N/A,en
The Culture Code,['Daniel Coyle'],2018-01-30,['Business & Economics'],"NEW YORK TIMES BESTSELLER • The author of The Talent Code unlocks the secrets of highly successful groups and provides tomorrow’s leaders with the tools to build a cohesive, motivated culture. “A truly brilliant, mesmerizing read that demystifies the magic of great groups.”—Adam Grant, author of Think Again A BLOOMBERG AND LIBRARY JOURNAL BEST BOOK OF THE YEAR Where does great culture come from? How do you build and sustain it in your group, or strengthen a culture that needs fixing? In The Culture Code, Daniel Coyle goes inside some of the world’s most successful organizations—including the U.S. Navy’s SEAL Team Six, IDEO, and the San Antonio Spurs—and reveals what makes them tick. He demystifies the culture-building process by identifying three key skills that generate cohesion and cooperation, and explains how diverse groups learn to function with a single mind. Drawing on examples that range from Internet retailer Zappos to the comedy troupe Upright Citizens Brigade to a daring gang of jewel thieves, Coyle offers specific strategies that trigger learning, spark collaboration, build trust, and drive positive change. Coyle unearths helpful stories of failure that illustrate what not to do, troubleshoots common pitfalls, and shares advice about reforming a toxic culture. Combining leading-edge science, on-the-ground insights from world-class leaders, and practical ideas for action, The Culture Code offers a roadmap for creating an environment where innovation flourishes, problems get solved, and expectations are exceeded. Culture is not something you are—it’s something you do. The Culture Code puts the power in your hands. No matter the size of your group or your goal, this book can teach you the principles of cultural chemistry that transform individuals into teams that can accomplish amazing things together.",N/A,N/A,en
"Introduction to Mediation, Moderation, and Conditional Process Analysis",['Andrew F. Hayes'],2013-04-22,['Psychology'],"Explaining the fundamentals of mediation and moderation analysis, this engaging book also shows how to integrate the two using an innovative strategy known as conditional process analysis. Procedures are described for testing hypotheses about the mechanisms by which causal effects operate, the conditions under which they occur, and the moderation of mechanisms. Relying on the principles of ordinary least squares regression, Andrew Hayes carefully explains the estimation and interpretation of direct and indirect effects, probing and visualization of interactions, and testing of questions about moderated mediation. Examples using data from published studies illustrate how to conduct and report the analyses described in the book. Of special value, the book introduces and documents PROCESS, a macro for SPSS and SAS that does all the computations described in the book. The companion website (www.afhayes.com) offers free downloads of PROCESS plus data files for the book's examples. Unique features include: *Compelling examples (presumed media influence, sex discrimination in the workplace, and more) with real data; boxes with SAS, SPSS, and PROCESS code; and loads of tips, including how to report mediation, moderation and conditional process analyses. *Appendix that presents documentation on use and features of PROCESS. *Online supplement providing data, code, and syntax for the book's examples.",N/A,N/A,en
What Is Intelligence?,['James R. Flynn'],2007-08-27,['Psychology'],"The 'Flynn effect' refers to the massive increase in IQ test scores over the course of the twentieth century. Does it mean that each generation is more intelligent than the last? Does it suggest how each of us can enhance our own intelligence? Professor Flynn is finally ready to give his own views. He asks what intelligence really is and gives a surprising and illuminating answer. This expanded paperback edition includes three important new essays. The first contrasts the art of writing cognitive history with the science of measuring intelligence and reports data. The second outlines how we might get a complete theory of intelligence, and the third details Flynn's reservations about Gardner's theory of multiple intelligences. A fascinating book that bridges the gulf separating our minds from those of our ancestors a century ago, and makes an important contribution to our understanding of human intelligence.",N/A,N/A,en
The Authoritarian Personality,"['Theodor Adorno', 'Else Frenkel-Brenswik', 'Daniel J. Levinson', 'R. Nevitt Sanford']",2019-08-27,['Political Science'],"This hugely influential study on the psychology of authoritarianism was written in answer to Hitler’s Germany—and now rings more relevant than ever as fascism and anti-Semitism sweep across America. What makes a fascist? Are there character traits that make someone more likely to vote for the far right? The Authoritarian Personality is not only one of the most significant works of social psychology ever written, it also marks a milestone in the development of Adorno’s thought, showing him grappling with the problem of fascism and the reasons for Europe’s turn to reaction. Over half a century later, and with the rise of right-wing populism and the reemergence of the far-right in recent years, this hugely influential study remains as insightful and relevant as ever. This new edition includes an introduction by Frankfurt School scholar Peter E. Gordon and contains the first-ever publication of Adorno’s subsequent critical notes on the project. “Adorno and his colleagues could easily have been describing Alex Jones’s paranoid InfoWars rants or the racist views expressed by many Trump supporters.” —Molly Worthen, New York Times",N/A,N/A,en
Mind Children,['Hans Moravec'],1988,['Computers'],"""A dizzying display of intellect and wild imaginings by Moravec, a world-class roboticist who has himself developed clever beasts . . . Undeniably, Moravec comes across as a highly knowledgeable and creative talent--which is just what the field needs"".--Kirkus Reviews.",5,N/A,en
Situated Learning,"['Jean Lave', 'Etienne Wenger']",1991-09-27,['Psychology'],"In this important theoretical treatist, Jean Lave, anthropologist, and Etienne Wenger, computer scientist, push forward the notion of situated learning - that learning is fundamentally a social process. The authors maintain that learning viewed as situated activity has as its central defining characteristic a process they call legitimate peripheral participation (LPP). Learners participate in communities of practitioners, moving toward full participation in the sociocultural practices of a community. LPP provides a way to speak about crucial relations between newcomers and old-timers and about their activities, identities, artefacts, knowledge and practice. The communities discussed in the book are midwives, tailors, quartermasters, butchers, and recovering alcoholics, however, the process by which participants in those communities learn can be generalised to other social groups.",N/A,N/A,en
The Science of Getting Rich,['Wallace D. Wattles'],2007-04,['Business & Economics'],"This book claims there is a science to becoming wealthy, and reveals it here. Since it first appeared in 1915 people have used its principles successfully, so it is a time-tested system. Today this book is in more demand than ever. It was the inspiration for the 2006 film, The Secret. A true classic in the art of making money - lots of it.",5,N/A,en
Intelligence and how to Get it,['Richard E. Nisbett'],2009,['Education'],Nisbett debunks the myth of genetic inheritance of intelligence and persuasively demonstrates how intelligence can be enhanced : the anti-Bell Curve book.--From publisher description.,4.5,N/A,en
Cupid and Psyche,['Apuleius'],2021-11-07,['Education'],"Cupid and Psyche Apuleius - Cupid and Psyche is a story from the Latin novel Metamorphoses, also known as The Golden Ass, written in the 2nd century AD by Apuleius. It concerns the overcoming of obstacles to the love between Psyche (Soul or Breath of Life) and Cupid (Desire), and their ultimate union in a sacred marriage.",N/A,N/A,en
Personality Types,['Daryl Sharp'],1987,['Psychology'],Explains the model of psychological types elaborated by C.G. Jung. -- Back cover.,3,N/A,en
The Expression of the Emotions in Man and Animals,['Charles Darwin'],1872,['Comics & Graphic Novels'],"MANY works have been written on Expression, but a greater number on Physiognomy, that is, on the recognition of character through the study of the permanent form of the features. With this latter subject I am not here concerned. The older treatises, which I have consulted, have been of little or no service to me. The famous 'Conferences' of the painter Le Brun, published in 1667, is the best known ancient work, and contains some good remarks. Another somewhat old essay, namely, the 'Discours, ' delivered 1774-1782, by the well-known Dutch anatomist Camper, can hardly be considered as having made any marked advance in the subject. The following works, on the contrary, deserve the fullest consideration",N/A,N/A,en
On Human Nature,['Edward O. Wilson'],2012-11,['Psychology'],"In his new preface E. O. Wilson reflects on how he came to write this book: how The Insect Societies led him to write Sociobiology, and how the political and religious uproar that engulfed that book persuaded him to write another book that would better explain the relevance of biology to the understanding of human behavior.",N/A,N/A,en
the Expression of the Emotions in Man and Animals,['Charles Darwin'],2015-07-31,['Psychology'],"Darwin's work of 1872 still provides the point of departure for research in the theory of emotion and expression. Although he lacked the modern research tool of cybernetics, his basic methods have not been improved upon: the study of infants, of the insane, of paintings and sculpture, of some of the commoner animals; the use of photographs of expression submitted to different judges; and the comparative study of expression among different peoples. This new edition will be warmly welcomed by those behavioral scientists who have recently shown an intense interest in the scientific study of expression. Lay readers, too, will be struck by the freshness and directness of this book, which includes, among other data, Darwin's delightfully objective analysis of his own baby's smiles and pouts.",N/A,N/A,en
The Principles of Psychology,['William James'],1890,['Psychology'],N/A,N/A,N/A,en
The Theory and Practice of Group Psychotherapy,"['Irvin D. Yalom', 'Molyn Leszcz']",2020-12-01,['Psychology'],"The classic work on group psychotherapy. The Theory and Practice of Group Psychotherapy has been the standard text in the field for decades. In this completely updated sixth edition, Dr. Yalom and Dr. Leszcz draw on a decade of new research as well as their broad clinical wisdom and expertise. Each chapter is revised, reflecting the most recent developments in the field. There are new sections throughout, including online group therapy, modern analytic and relational approaches, interpersonal neurobiology, measurement-based care, culture and diversity, psychological trauma, and group therapy tailored for a range of clinical populations. At once scholarly and lively, this is the most up-to-date, incisive, and comprehensive text available on the practice of group psychotherapy.",N/A,N/A,en
Altered Traits,"['Daniel Goleman', 'Richard J. Davidson']",2017-09-05,['Psychology'],"Two New York Times–bestselling authors unveil new research showing what meditation can really do for the brain. In the last twenty years, meditation and mindfulness have gone from being kind of cool to becoming an omnipresent Band-Aid for fixing everything from your weight to your relationship to your achievement level. Unveiling here the kind of cutting-edge research that has made them giants in their fields, Daniel Goleman and Richard Davidson show us the truth about what meditation can really do for us, as well as exactly how to get the most out of it. Sweeping away common misconceptions and neuromythology to open readers’ eyes to the ways data has been distorted to sell mind-training methods, the authors demonstrate that beyond the pleasant states mental exercises can produce, the real payoffs are the lasting personality traits that can result. But short daily doses will not get us to the highest level of lasting positive change—even if we continue for years—without specific additions. More than sheer hours, we need smart practice, including crucial ingredients such as targeted feedback from a master teacher and a more spacious, less attached view of the self, all of which are missing in widespread versions of mind training. The authors also reveal the latest data from Davidson’s own lab that point to a new methodology for developing a broader array of mind-training methods with larger implications for how we can derive the greatest benefits from the practice. Exciting, compelling, and grounded in new research, this is one of those rare books that has the power to change us at the deepest level.",4,N/A,en
Being There,['Andy Clark'],1998-01-23,['Psychology'],"Brain, body, and world are united in a complex dance of circular causation and extended computational activity. In Being There, Andy Clark weaves these several threads into a pleasing whole and goes on to address foundational questions concerning the new tools and techniques needed to make sense of the emerging sciences of the embodied mind. Clark brings together ideas and techniques from robotics, neuroscience, infant psychology, and artificial intelligence. He addresses a broad range of adaptive behaviors, from cockroach locomotion to the role of linguistic artifacts in higher-level thought.",4,N/A,en
The Art of War,['Sun Tzu'],N/A,['Psychology'],"The Art of War is considered the best strategy book of all time. Experts claim that this treaty inspired Napoleon, Machiavelli, MaoTse-Tung, and many other historical personalities. More than 2,500 years later, the principles attributed to Sun Tzu are still followed nowadays in the world of business, sports, politics, diplo-macy, psychology, and personal behavior. It is a study of the knowledge of human nature in moments of con-frontation. The book is not limited to war. It is a work to understand the roots of a conflict and to indicate a solution.",N/A,N/A,en
Explaining Creativity,['R. Keith Sawyer'],2011-10-15,['Psychology'],"Explaining Creativity is an accessible introduction to the latest scientific research on creativity. The book summarizes and integrates a broad range of research in psychology and related scientific fields. In the last 40 years, psychologists, anthropologists, and sociologists have devoted increased attention to creativity; we now know more about creativity than at any point in history. Explaining Creativity considers not only arts like painting and writing, but also science, stage performance, business innovation, and creativity in everyday life. Sawyer's approach is interdisciplinary. In addition to examining psychological studies on creativity, he draws on anthropologists' research on creativity in non-Western cultures, sociologists' research on the situations, contexts, and networks of creative activity, and cognitive neuroscientists' studies of the brain. He moves beyond the individual to consider the social and cultural contexts of creativity, including the role of collaboration in the creative process.",5,N/A,en
Reflections on War and Death,['Sigmund Freud'],2012-08,['Psychology'],"Reflections on War and Death is a classic historical psychology study by Sigmund Freud. Thoughts for the Time of War and Death is a set of twin essays written by Sigmund Freud in 1915, six months after the outbreak of World War I. The essays express discontent and disillusionment with human nature and human society in the aftermath of the hostilities; and generated much interest among lay readers of Freud. The first essay addressed the widespread disillusionment brought on by the collapse of the Pax Britannica of the preceding century-what Freud called ""the common civilization of peacetime. The second essay addressed what Freud called the peacetime 'protection racket' whereby the inevitability of death was expunged from civilized mentality. Building on the second essay of Totem and Taboo, Freud argued that such an attitude left civilians in particular unprepared for the stark horror of industrial-scale death in the Great War. Freud's account of the centrality of loss in culture has been seen as seminal for his later work, Civilization and its Discontents. Caught in the whirlwind of these war times, without any real information or any perspective upon the great changes that have already occurred or are about to be enacted, lacking all premonition of the future, it is small wonder that we ourselves become confused as to the meaning of impressions which crowd in upon us or of the value of the judgments we are forming. It would seem as though no event had ever destroyed so much of the precious heritage of mankind, confused so many of the clearest intellects or so thoroughly debased what is highest.",N/A,N/A,en
The Principles of Psychology (Vol. 1&2),['William James'],2018-05-11,['Psychology'],One of the greatest classics of modern Western literature and science and the source of the ripest thoughts of America's most important philosopher.,N/A,N/A,en
On Collective Memory,['Maurice Halbwachs'],1992-09,['Philosophy'],"How do we use our mental images of the present to reconstruct our past? This volume, the first comprehensive English language translation of Maurice Halbwach's writings on the social construction of memory, fills a major gap in the literature on the sociology of knowledge.",5,N/A,en
Qualitative Research from Start to Finish,['Robert K. Yin'],2010-01-01,['Social Science'],"""The pedagogical features are good and follow a learn-by-doing model; the helpful vignettes bring in real-world examples. Students who are new to the methods will be inspired by reading about studies on topics they are interested in or have experienced themselves.""--Penny L. Burge, Department of Educational Research and Evaluation, Virginia Tech.",N/A,N/A,en
"Living, Loving & Learning",['Leo F. Buscaglia'],1982,['Communication'],A collection of his lectures between 1970 and 1981.,N/A,N/A,en
The Interpretation of Dreams,['Sigmund Freud'],2015-03-18,['Psychology'],"""""The groundbreaking masterwork that launched psychoanalysis."" -- Time. Why do we dream? And what do our dreams signify? The monumental treatise that transformed the Viennese neurologist into a cause câeláebre, this exploration of the dream world features dozens of fascinating case studies and Freud's engrossing analyses of actual dreams. ""--",N/A,N/A,en
How to Write a Lot,['Paul J. Silvia'],2018-09-25,['Language Arts & Disciplines'],"All academics need to write, and many struggle to finish their dissertations, articles, books, or grant proposals. Writing is hard work and can be difficult to wedge into a frenetic academic schedule. This revised and updated edition of Paul Silvia’s popular guide provides practical, light‐hearted advice to help academics overcome common barriers and become productive writers. Silvia’s expert tips have been updated to apply to a wide variety of disciplines, and this edition has a new chapter devoted to grant and fellowship writing.",N/A,N/A,en
"Rhetoric, Ideology and Social Psychology","['Charles Antaki', 'Susan Condor']",2014-03-05,['Language Arts & Disciplines'],Professor Michael Billig is one of the most significant living figures in social psychology. This book will bring together expert accounts of Billig‘s ideas on a wide range of issues in a single text. Each of the contributors will explain the importance of Billig‘s work for a specific area detailing its application to a particular social psychological problematic.,N/A,N/A,en
Protection of Children During Armed Political Conflict,"['Charles W. Greenbaum', 'Philip E. Veerman', 'Naomi Bacon-Shnoor']",2006,['Law'],"This volume attempts to examine the issue of prevention of violence to children in violent political conflicts from a multidisciplinary perspective that includes international law, developmental psychology, education, communications and police science. While this volume concentrates mainly on the Israeli-Palestinian conflict, it also presents the experience of others in different parts of the world who have coped successfully with prevention of violence to civilian populations, and particularly to children. The editors aim to engage military and police communities world-wide, and especially in our society, Israel, in a dialogue concerning the most effective ways to abide by international conventions of human rights and childrens rights to which Israeli society is committed. The volume reports on practical methods to save the lives of civilians and children in political conflicts that have been tried and which serve to protect children.",N/A,N/A,en
The Bed of Procrustes,['Nassim Nicholas Taleb'],2010-11-30,['Business & Economics'],"The author of the modern classics The Black Swan, Fooled by Randomness, and Antifragile, Nassim Nicholas Taleb expresses major ideas in ways you least expect in this collection of aphorisms and meditations—now expanded with fifty percent more material than the hardcover. The Bed of Procrustes takes its title from the Greek myth of a man who made his visitors fit his bed to perfection, either by stretching them or by cutting their limbs. It represents Taleb’s view of modern civilization’s hubristic side effects—modifying humans to satisfy technology, blaming reality for not fitting economic models, inventing diseases to sell drugs, defining intelligence as what can be tested in a classroom, and convincing people that employment is not slavery. Playful and irreverent, these aphorisms will surprise you by exposing self-delusions you have been living with but never recognized. With a rare combination of pointed wit and potent wisdom, Taleb plows through human illusions, contrasting the classical values of courage, elegance, and erudition with the modern diseases of nerdiness, philistinism, and phonies.",N/A,N/A,en
Looking for Spinoza,['Antonio R. Damasio'],2003,['History'],Publisher Description,4,N/A,en
International Handbook of Suicide Prevention,"[""Rory C. O'Connor"", 'Stephen Platt', 'Jacki Gordon']",2011-06-01,['Psychology'],"The International Handbook of Suicide Prevention showcases the latest cutting-edge research from the world’s leading authorities, and highlights policy and practice implications for the prevention of suicide. Brings together the world’s leading authorities on suicidal behaviour, renowned for their suicide prevention research, policy and practice Addresses the key questions of why people attempt suicide, the best interventions, treatments and care for those at risk, and the key international challenges in trying to prevent suicide Describes up-to-date, theoretically-derived and evidence-based research and practice from across the globe, which will have implications across countries, cultures and the lifespan",N/A,N/A,en
