title,authors,publishedDate,categories,description,averageRating,textSnippet,language
The Dragon in the Land of Snows,['Tsering Shakya'],2000-10-01,['History'],"Based entirely on unpublished primary sources, Tsering Shakya's groundbreaking history of modern Tibet shatters the popular conception of the country as an isolated Shangri-la unaffected by broader international developments. Shakya gives a balanced, blow-by-blow account of Tibet's ongoing struggle to maintain its independence and safeguard its cultural identity while being sandwiched between the heavyweights of Asian geopolitics: Britain, India, China, and the United States. With thorough documentation, Shakya details the Chinese depredations of Tibet, and reveals the failures of the Tibetan leadership's divided strategies. Rising above the simplistic dualism so often found in accounts of Tibet's contested recent history, The Dragon in the Land of Snows lucidly depicts the tragedy that has befallen Tibet and identifies the conflicting forces that continue to shape the aspirations of the Tibetan people today.",N/A,N/A,en
The Varieties of Religious Experience,['William James'],2010-06,['Psychology'],"This classic book, written by a Professor of Psychology at Harvard University, discusses some issues that are essential to people interested in psychology concerning religion.",N/A,N/A,en
The Book of Five Rings,['Miyamoto Musashi'],2023-07-20,[],"Along with Sun Tzu's The Art of War, The Book of Five Rings is considered to be one of the most insightful texts on the subtle arts of confrontation and victory to emerge from Asia. Composed in 1643 by the famed duelist and undefeated samurai Miyamoto Musashi, The Book of Five Rings analyses the process of struggle and mastery over conflict that underlies every level of human interaction. For Musashi, the way of the martial arts was a mastery of the mind rather than simply technical prowess--and it is this path to mastery that is the core teaching in The Book of Five Rings. This brilliant manifesto is written not only for martial artists but for anyone who wants to apply the timeless principles of this text to their life.",N/A,N/A,en
A Catholic Introduction to the Bible,"['John Bergsma', 'Brant Pitre']",2018-09-04,['Religion'],"Although many Catholics are familiar with the four Gospels and other writings of the New Testament, for most, reading the Old Testament is like walking into a foreign land. Who wrote these forty-six books? When were they written? Why were they written? What are we to make of their laws, stories, histories, and prophecies? Should the Old Testament be read by itself or in light of the New Testament? John Bergsma and Brant Pitre offer readable in-depth answers to these questions as they introduce each book of the Old Testament. They not only examine the literature from a historical and cultural perspective but also interpret it theologically, drawing on the New Testament and the faith of the Catholic Church. Unique among introductions, this volume places the Old Testament in its liturgical context, showing how its passages are employed in the current Lectionary used at Mass. Accessible to nonexperts, this thorough and up-to-date introduction to the Old Testament can serve as an idea textbook for biblical studies. Its unique approach, along with its maps, illustrations, and other reference materials, makes it a valuable resource for seminarians, priests, Scripture scholars, theologians, and catechists, as well as anyone seeking a deeper understanding of the Bible.",4,N/A,en
Confessions,['Saint Augustine'],2007,['Biography & Autobiography'],"Written shortly after he became Biship of Hippo, ""Confessions"" highlights Augustine's childhood in Numidia and his riotous youth and early manhood in Carthage, Rome, and Milan. It also chronicles his continuing struggle with sin and his efforts to find satisfaction in Manichaenism and Neoplatonism. Particularly poignant are his mother's tireless efforts to rescue him from self-destruction and his dramatic conversion to the Christian faith at age 32.",N/A,N/A,en
A History of Arabic Astronomy,['George Saliba'],1995-07-01,['Religion'],"A History of Arabic Astronomy is a comprehensive survey of Arabic planetary theories from the eleventh century to the fifteenth century based on recent manuscript discoveries. George Saliba argues that the medieval period, often called a period of decline in Islamic intellectual history, was scientifically speaking, a very productive period in which astronomical theories of the highest order were produced. Based on the most recent manuscript discoveries, this book broadly surveys developments in Arabic planetary theories from the eleventh century to the fifteenth. Taken together, the primary texts and essays assembled in this book reverse traditional beliefs about the rise and fall of Arabic science, demonstrating how the traditional “age of decline” in Arabic science was indeed a “Golden Age” as far as astronomy was concerned. Some of the techniques and mathematical theorems developed during this period were identical to those which were employed by Copernicus in developing his own non-Ptolemaic astronomy. Significantly, this volume will shed much-needed light on the conditions under which such theories were developed in medieval Islam. It clearly demonstrates the distinction that was drawn between astronomical activities and astrological ones, and reveals, contrary to common perceptions about medieval Islam, the accommodation that was obviously reached between religion and astronomy, and the degree to which astronomical planetary theories were supported, and at times even financed, by the religious community itself. This in stark contrast to the systematic attacks leveled by the same religious community against astrology. To students of European intellectual history, the book reveals the technical relationship between the astronomy of the Arabs and that of Copernicus. Saliba’s definitive work will be of particular interest to historians of Arabic science as well as to historians of medieval and Renaissance European science.",N/A,N/A,en
Spiritual Ecology,['Leslie E. Sponsel'],2012-07-19,['Religion'],"A prominent scientist and scholar documents and explains the thoughts, actions, and legacies of spiritual ecology's pioneers from ancient times to the present, demonstrating how the movement may offer the last chance to restore a healthy relationship between humankind and nature. An internet search for ""Spiritual Ecology"" and related terms like ""Religion and Nature"" and ""Religion and Ecology"" reveals tens of millions of websites. Spiritual Ecology: A Quiet Revolution offers an intellectual history of this far-reaching movement. Arranged chronologically, it samples major developments in the thoughts and actions of both historic and contemporary pioneers, ranging from the Buddha and St. Francis of Assisi to Wangari Maathai's Green Belt Movement and James Cameron's 2010 epic film Avatar. This foundational book is unique in that it provides a historical, cross-cultural context for understanding and advancing the ongoing spiritual ecology revolution, considering indigenous and Asian religious traditions as well as Western ones. Most chapters focus on a single pioneer, illuminating historical context and his/her legacy, while also connecting that legacy to broader concerns. Coverage includes topics as diverse as Henry David Thoreau and the Green Patriarch Bartholomew's decades-long promotion of environmentalism as a sacred duty for more than 250 million members of the Orthodox Church worldwide. For more information, visit www.spiritualecology.info.",N/A,N/A,en
Islam's Response to Contemporary Issues,['Hazrat Mirza Tahir Ahmad'],2007,['Religion'],Presents the teachings of Islam regarding peace in the world today.,4.5,N/A,en
"The New Schaff-Herzog Encyclopedia of Religious Knowledge, Vol. 2 of 12 (Classic Reprint)",['Philip Schaff'],2018-12-12,['Religion'],"Excerpt from The New Schaff-Herzog Encyclopedia of Religious Knowledge, Vol. 2 of 12 The following list of books is supplementary to the bibliographies given at the end of the articles contained in volumes I and II, and brings the literature down to November, 1908. In this list each title entry is printed in capital letters. About the Publisher Forgotten Books publishes hundreds of thousands of rare and classic books. Find more at www.forgottenbooks.com This book is a reproduction of an important historical work. Forgotten Books uses state-of-the-art technology to digitally reconstruct the work, preserving the original format whilst repairing imperfections present in the aged copy. In rare cases, an imperfection in the original, such as a blemish or missing page, may be replicated in our edition. We do, however, repair the vast majority of imperfections successfully; any imperfections that remain are intentionally left to preserve the state of such historical works.",N/A,N/A,en
Experiencing The World's Religions,['Michael Molloy'],2007,['Religions'],"This text successfully addresses what a person should know about religions, and why. The text covers all the essential material and goes beyond traditional approaches to personally connect students with the vitality of the great religions. This edition features updated coverage of world developments.",N/A,N/A,en
Lord of the World,['Robert Hugh Benson'],2017-05-24,['Religion'],"This work has been selected by scholars as being culturally important and is part of the knowledge base of civilization as we know it. This work is in the public domain in the United States of America, and possibly other nations. Within the United States, you may freely copy and distribute this work, as no entity (individual or corporate) has a copyright on the body of the work. Scholars believe, and we concur, that this work is important enough to be preserved, reproduced, and made generally available to the public. To ensure a quality reading experience, this work has been proofread and republished using a format that seamlessly blends the original graphical elements with text in an easy-to-read typeface. We appreciate your support of the preservation process, and thank you for being an important part of keeping this knowledge alive and relevant.",N/A,N/A,en
"Myth, Ritual, and Religion",['Andrew Lang'],1899,['Mythology'],N/A,N/A,N/A,en
A New Perspective on Jesus (),['James D. G. Dunn'],2005-03-01,['Religion'],"In this compelling study, renowned author James D. G. Dunn provides a critique of the quest for the historical Jesus. Dunn claims that the quest has been misguided from the start in its attempt to separate the historical Jesus from the Christ of faith. Dunn argues that Jesus scholars have consistently failed to recognize how the early disciples' pre-Easter faith and a predominantly oral culture shaped the way the stories about Jesus were told and passed on. Dunn also examines the implications of oral transmission for our understanding of Synoptic relationships. A New Perspective on Jesus proposes a change in direction for Jesus scholarship. It will be of interest to pastors, church leaders, students, and thoughtful laypersons wanting a fresh perspective on Jesus studies.",N/A,N/A,en
The Routledge Companion to Free Will,"['Kevin Timpe', 'Meghan Griffith', 'Neil Levy']",2016-11-18,['Philosophy'],"Questions concerning free will are intertwined with issues in almost every area of philosophy, from metaphysics to philosophy of mind to moral philosophy, and are also informed by work in different areas of science (principally physics, neuroscience and social psychology). Free will is also a perennial concern of serious thinkers in theology and in non-western traditions. Because free will can be approached from so many different perspectives and has implications for so many debates, a comprehensive survey needs to encompass an enormous range of approaches. This book is the first to draw together leading experts on every aspect of free will, from those who are central to the current philosophical debates, to non-western perspectives, to scientific contributions and to those who know the rich history of the subject. Chapter 37 of this book is freely available as a downloadable Open Access PDF at http://www.taylorfrancis.com under a Creative Commons Attribution-Non Commercial-No Derivatives (CC-BY-NC-ND) 4.0 license.",N/A,N/A,en
Yuganta,['Irawati Karmarkar Karve'],1969,['Religion'],Study of chief characters in the Mahābhārata.,N/A,N/A,en
Encyclopedia of Psychology and Religion,['David A. Leeming'],2020-05-15,['Psychology'],"Encyclopedia of Psychology and Religion is a greatly expanded and updated reference work that builds on the foundation of the highly successful previous edition. The first to integrate psychology and religion in the context of modern social and behavioral sciences, Encyclopedia of Psychology and Religion continues to offer a rich contribution to the development of human self-understanding. A significant number of new entries and of updated original entries provide even more comprehensive coverage. This reference work provides a definitive and intellectually rigorous collection of psychological interpretations of the stories, rituals, motifs, symbols, doctrines, dogmas, and experiences of the world's religious and mythological traditions. A broad range of psychological approaches are used in order to help readers understand the form and content of religious experience as well as offer insight into the meanings of religious symbols and themes. It provides a technical and phenomenological vocabulary that will enable collaboration and dialogue among researchers in both fields. Easy to read and scrupulously edited, the encyclopedia draws from different religions, including modern world religions and older religious movements. It is of particular interest to researchers and professionals in psychology and religion.",N/A,N/A,en
"Boston Unitarianism, 1820-1850",['Octavius Brooks Frothingham'],1890,['Religion'],N/A,N/A,N/A,en
The Game of Life and How to Play It,['Florence Scovel Shinn'],2010-07-12,[],"In a series of three books, The Game of Life and How to Play It, Your Word is Your Wand, and The Secret Door to Success, Florence Scovel Shinn outlines the secrets and the methods to attracting health, wealth, and prosperity. This timeless classic has been dusted off and repackaged for a modern audience.",N/A,N/A,en
The Story of the Other Wise Man,['Henry Van Dyke'],2008-10-01,['Religion'],"One of the most meaningful stories ever written… “You know the story of the Three Wise Men of the East, and how they traveled from far away to offer their gifts at the manger-cradle in Bethlehem. But have you ever heard the story of the Other Wise Man?” So begins Henry van Dyke’s Christmas classic, told in the manner of the great fairy tales—and like a great fairy tale, it couldn’t be more true! This beautiful edition is designed so that you can read The Other Wise Man as it is intended to be read—slowly. His name was Artaban, and he told his doubting friends why he wanted to travel far away to see the promised king: “It has been shown to me and to my three companions among the Magi—Caspar, Melchior, and Balthazar. We have searched the ancient tablets of Chaldea and computed the time. We have studied the sky. We saw a new star there, which shone for one night and then vanished. Now again the two great planets are meeting. This night is their conjunction.” Try as he might, Artaban was unable to join the three Magi on that historic night. But as it turns out, he had even more important things to do—and he learned what it really means to know God.",N/A,N/A,en
A Companion to Dharmaśāstra,['Sures Chandra Banerji'],1998,['Law'],"This Work Highlights The Dharmasastra Essentials By Listing The Major Authors With Their Biographies, Titles And Their Dates Of Composition, Published Editions And Commentaries. It Shows How Dharmasastra Works Have Influenced The Indian Way Of Life.",N/A,N/A,en
Mudrā,['Ernest Dale Saunders'],1960,['Art'],"Appearing for the first time in paperback and illustrated with line drawings, diagrams, and 26 half-tone plates, this study of the iconographic aspect of Japanese Buddhist sculpture surveys the significance of eight principal and six secondary hand gestures (mudra), in addition to the postures (asana), such as the ""lotus,"" and the symbolic attributes. A pictorial index helps the reader in identifying the gestures.",N/A,N/A,en
Living Religions of the World,['Frederic Spiegelberg'],1956,['Religion'],N/A,N/A,N/A,en
The Witness of the Stars,['E. W. (Ethelbert William) Bullinger'],2012-01,[],"Unlike some other reproductions of classic texts (1) We have not used OCR(Optical Character Recognition), as this leads to bad quality books with introduced typos. (2) In books where there are images such as portraits, maps, sketches etc We have endeavoured to keep the quality of these images, so they represent accurately the original artefact. Although occasionally there may be certain imperfections with these old texts, we feel they deserve to be made available for future generations to enjoy.",N/A,N/A,en
The Beginning of Heaven and Earth,['Christal Whelan'],1996-09-01,['Religion'],"In 1865 a French priest was visited by a small group of Japanese at his newly built church in Nagasaki. They were descendants of Japan's first Christians, the survivors of brutal religious persecution under the Tokugawa government. The Kakure Kirishitan, or ""hidden Christians,"" had practiced their religion in secret for several hundred years. Sometime after their visit the priest received a copy of the Kakure bible, the Tenchi Hajimari no Koto, ""Beginning of Heaven and Earth,"" an intriguing amalgam of Bible stories, Japanese fables, and Roman Catholic doctrine. Whelan offers a complete translation of this unique work accompanied by an illuminating commentary that provides the first theory of origin and evolution of the Tenchi. Today, the few Kakure Kirishitan communities still in existence view the Tenchi as strange and flawed, expressing a distorted form of Christianity. It is, however, the only text produced by the Kakure Kirishitan that depicts their highly syncretistic tradition and provides a colorful window through which to examine the dynamics of religious acculturation.",4,N/A,en
The Pilgrim's Regress,['Clive Staples Lewis'],1958,['Fiction'],"The first book written by C. S. Lewis after his conversion, The Pilgrim's Regress is, in a sense, the record of Lewis's own search for meaning and spiritual satisfaction -- a search that eventually led him to Christianity. Here is the story of the pilgrim John and his odyssey to an enchanting island which has created in him an intense longing -- a mysterious, sweet desire. John's pursuit of this desire takes him through adventures with such people as Mr. Enlightenment, Media Halfways, Mr. Mammon, Mother Kirk, Mr. Sensible, and Mr. Humanist and through such cities as Thrill and Eschropolis as well as the Valley of Humiliation. Though the dragons and giants here are different from those in Bunyan's Pilgrim's Progress, Lewis's allegory performs the same function of enabling the author to say simply and through fantasy what would otherwise have demanded a full-length philosophy of religion.",N/A,N/A,en
Jesus,['W. Barnes Tatum'],2015-09-23,['Religion'],"Drawing on examples from literature, art, and popular culture, aswell as theology, this engaging book reveals the importance of thequestion, ""whose was he?"" in fully understanding the life andlegacy of Jesus. A concise, accessible and engaging exploration of Jesus's lifeand enduring influence Charts the changing global status and influence of Jesus, aGalilean Jew born when the ancient Roman Empire ruled theMediterranean world, and how he has come to be honored as theChrist and recognized by billions of people around the world Traces the reception history of Jesus and his story over thepast two millennia, through art, literature, and culture, as wellas theology Draws on a fascinating range of materials - from ancient texts,creeds, and theological treatises, to the visual and dramatic arts,including books like The DaVinci Code and films such asThe Passion of the Christ",N/A,N/A,en
The Yes of Jesus Christ,['Pope Benedict XVI'],2005,['Religion'],A must-read to understand Pope Benedict XVI’s view of the relationship between Christianity and the world. Secular thought has failed to answer the great questions of human existence. Pope Benedict XVI invites us to rediscover the Christ-centered basis for hope.,N/A,N/A,en
The Religious Spirit of the Slavs,['Nikolai Velimirovic'],2017-11-25,['Religion'],"Excerpt from The Religious Spirit of the Slavs: Three Lectures Given in Lent, 1916; I. Slav Orthodoxy, II. Slav Revolutionary Catholicism, III. The Religious Spirit if the Slavs From his point of view, Tolstoi thought it possible for mankind to stop a mistaken course of things and to begin anew, to cast, away all the burdens of culture, of State, Church, militarism, worldly ambitions, the vanities of towns, to draw the curtain on the past and to come back to the field and forest, to plough and sow, to listen to the life of Nature and to live with Nature and God in unison. About the Publisher Forgotten Books publishes hundreds of thousands of rare and classic books. Find more at www.forgottenbooks.com This book is a reproduction of an important historical work. Forgotten Books uses state-of-the-art technology to digitally reconstruct the work, preserving the original format whilst repairing imperfections present in the aged copy. In rare cases, an imperfection in the original, such as a blemish or missing page, may be replicated in our edition. We do, however, repair the vast majority of imperfections successfully; any imperfections that remain are intentionally left to preserve the state of such historical works.",N/A,N/A,en
Age of Reason Being an Investigation of True and Fabulous Theology,['Thomas Paine'],2019-03-11,['Political Science'],"This work has been selected by scholars as being culturally important, and is part of the knowledge base of civilization as we know it. This work was reproduced from the original artifact, and remains as true to the original work as possible. Therefore, you will see the original copyright references, library stamps (as most of these works have been housed in our most important libraries around the world), and other notations in the work. This work is in the public domain in the United States of America, and possibly other nations. Within the United States, you may freely copy and distribute this work, as no entity (individual or corporate) has a copyright on the body of the work. As a reproduction of a historical artifact, this work may contain missing or blurred pages, poor pictures, errant marks, etc. Scholars believe, and we concur, that this work is important enough to be preserved, reproduced, and made generally available to the public. We appreciate your support of the preservation process, and thank you for being an important part of keeping this knowledge alive and relevant.",N/A,N/A,en
The Miracles of the Antichrist,['Selma Lagerlof'],2002-12-01,['Religion'],"The Miracles of Antichrist relies heavily on the legends and folk tales of Sicily. The descriptions, rich in the warm colors of the South, convey Lagerlvf's understanding of the hot blooded Sicilians with the same insight and sympathy which she evokes while describing the introspective Swedes. Lagerlvf borrows from an ancient Sicilian legend which says, ""When Antichrist comes he shall seem as Christ. There shall be great want, and Antichrist shall go from land to land and give bread to the poor. And he shall find many followers."" Masterfully, she intertwines a tale of modern Sicily in an era when revolutionary socialism is sweeping the island and making heavy inroads upon the influence of the church. Selma Ottiliana Lovisa Lagerlvvf (1858-1940) was born in Sweden. She had been writing poetry ever since she was a child, but she did not publish anything until 1890, when a Swedish newspaper gave her the first prize in a literary competition and published excerpts from her first novel, Gvsta Berlings Saga (published in 1891 and very successful). During her travels to Italy she wrote The Miracles of Antichrist in 1897. After several minor works she published Jerusalem (translated in English as The Holy City) but it was with The Wonderful Adventures of Nils, a book for children, that she became recognized worldwide. In 1909.she became the first woman and also the first Swedish writer to win the Nobel Prize for Literature. She was so popular that her books were translated into 34 languages.",N/A,N/A,en
