title,authors,publishedDate,categories,description,averageRating,textSnippet,language
The Poetic Edda,['Carolyne Larrington'],2014,['Literary Collections'],"This collection of Norse-Icelandic mythological and heroic poetry contains the greater narratives of the creation of the world and the coming of Ragnarok, the Doom of the Gods.",N/A,N/A,en
The Taming of the Shrew,['William Shakespeare'],2008-07-30,['Drama'],"Can a man tame an ill-tempered woman? Petruchio thinks he is up to the task in The Taming of the Shrew. William Shakespeare (1564 ż 1616) is the most influential writer in English history. Shakespeare has been called The Barb of Avon and Englandżs national poet. There are 2 narrative poems, 154 sonnets and 38 plays in his collected works. He began work as an actor and writer in London first writing comedies and historic plays. He later wrote tragedies. Romeo and Juliet, MacBeth and Othello are some of his more famous plays. The Taming of the Shrew was an early comedy. The play begins with a drunken man who is deceived into thinking he is a nobleman. He then watches this play in which the noble Petruchio married an outspoken ill-tempered woman. Katherine is eventually tamed to the will be Petruchio. The play has been adapted into opera, stage plays and screen plays. Cole Porterżs play Kiss Me Kate is one instance",4.5,N/A,en
The Mandaeans,['Jorunn Jacobsen Buckley'],2002,['History'],"The Mandaeans were a gnostic sect that arose in the Middle East around the same time as Christianity. This text examines the lives and religion of contemporary Mandaeans and provides an introduction to the religion, showing how its ancient texts inform the living religion, and vice versa.",N/A,N/A,en
Zeus,['Tom Stone'],2008-02-05,['Religion'],"Traces the four-thousand-year history of the charismatic father of the Greek gods, from his origins in the Russian steppes and reign on Mount Olympus to his approaching end in Christian Constantinople, in an account that follows the author's journeys to relevant sites in Greek mythology.",N/A,N/A,en
A Record of Buddhistic Kingdoms,['Faxian'],2019-11-19,['Religion'],"In ""A Record of Buddhistic Kingdoms,"" Faxian presents a remarkable travelogue documenting his pilgrimage from China to India during the early fifth century. Written in a clear and straightforward prose, the narrative interweaves personal observations with rich descriptions of the varied cultures, practices, and landscapes he encountered in Buddhist regions. The text serves not merely as a historical account but also as a vital scholarly resource that reveals the diffusion of Buddhism and the interconnectedness of Eastern civilizations during a pivotal era in religious history. Faxian's meticulous attention to detail and reverent discourse on the teachings and monastic traditions he observed elevate his work within the literary tradition of travel writing and religious studies. Faxian, a Buddhist monk and traveler, undertook this arduous journey between 399 and 414 CE, driven by a profound desire to obtain sacred texts and seek the authentic teachings of the Buddha. His scholarly pursuits and experiences offer invaluable insights into the socio-religious fabric of the time, reflecting the spiritual fervor of early Buddhists and their tireless quest for knowledge. Faxian'Äôs background as a monk inherently influenced his perspective, imbuing his observations with a depth that resonates with readers and scholars alike. ""A Record of Buddhistic Kingdoms"" is an essential read for anyone intrigued by the histories of Buddhism, cultural exchange, and the transformative power of travel. It invites readers to embark on a journey through time and space, enriching their understanding of this profound religious tradition. Faxian's vivid narrative will resonate not just with scholars but with anyone who appreciates adventure, spirituality, and the interplay of diverse cultures.",N/A,N/A,en
Book of Omens,['Talât Tekin'],1993,['Reference'],N/A,N/A,N/A,en
The Individual and the Cosmos in Renaissance Philosophy,['Ernst Cassirer'],2010-04,['Biography & Autobiography'],"This provocative volume, one of the most important interpretive works on the philosophical thought of the Renaissance, has long been regarded as a classic in its field. Ernst Cassirer here examines the changes brewing in the early stages of the Renaissance, tracing the interdependence of philosophy, language, art, and science; the newfound recognition of individual consciousness; and the great thinkers of the period—from da Vinci and Galileo to Pico della Mirandola and Giordano Bruno. The Individual and the Cosmos in Renaissance Philosophy discusses the importance of fifteenth-century philosopher Nicholas Cusanus, the concepts of freedom and necessity, and the subject-object problem in Renaissance thought. “This fluent translation of a scholarly and penetrating original leaves little impression of an attempt to show that a ‘spirit of the age’ or ‘spiritual essence of the time’ unifies and expresses itself in all aspects of society or culture.”—Philosophy",N/A,N/A,en
Wor(l)d Religions,['Daniel Deleanu'],2003-12-16,['Religion'],"Daniel Deleanu continues in Wor(l)d Religions the logosophistic adventure started in Principles of Logosophism, The Logoarchetype and Logosophistic Investigations. Unlike the other three books from the logosophistic series, Wor(l)d Religions appeals to a wider array of readers. Daniel Deleanu chooses a rational methodology, namely that exposed by Immanuel Kant in his essay Fundamental Principals of the Metaphysic of Morals. By this approach, the creator of logosophism does not intend to reduce the study of religion to a strict framework of empirical determinism, but, on the contrary, he wishes to prove that the analytical study religion should have all the attributes of science. By eliminating most of the subjective properties of world religions, which are due to the nature of the observer rather than the religions themselves, the author traces a common path of all major beliefs, leading to the most important archetype of humankind, the Word (the logoarchetype), which is associated with the Divinity in every spiritual tradition.",N/A,N/A,en
The Most Learned of the Shiʻa,['Linda S. Walbridge'],2001,['History'],"The problem of who should succeed the Prophet has plagued the Islamic community since the time of his death. The Shiites have decided on a successor, but that does not solve who is the lawful marja (or grand ayatollah) of all the Shi'a.",N/A,N/A,en
Pilgrimage to the End of the World,['Conrad Rudolph'],2004-05-19,['Art'],"Traveling two and a half months and one thousand miles along the ancient route through southern France and northern Spain, Conrad Rudolph made the passage to the holy site of Santiago de Compostela, one of the most important modern-day pilgrimage destinations for Westerners. In this chronicle of his travels to this captivating place, Rudolph melds the ancient and the contemporary, the spiritual and the physical, in a book that is at once travel guide, literary work, historical study, and memoir.",N/A,N/A,en
Classical Indian Metaphysics,['Stephen H. Phillips'],1997,['Philosophy'],"Our knowledge of the most ancient times in India rests mainly on tradition. The Puranas, the Mahabharata, and in a minor degree of Ramayana profess to give accounts from tradition about the earliest accurrences. The Rgveda contains historical allusions, of which some record contemporary persons and events, but more refer to bygone times and persons and are obviously based on tradition. Almost all the information therefore comes from tradition. The results obtained from an examination of Puranic and epic tradition as well as of the Rgveda and Vedic literature are set forth in the present book, which happens to be a pioneering work in the area by an important orientalist of the nineteenth century.",N/A,N/A,en
Moralia,['Plutarch'],1961,['Ethics'],"""Plutarch (Plutarchus), ca. 45-120 CE, was born at Chaeronea in Boeotia in central Greece, studied philosophy at Athens, and, after coming to Rome as a teacher in philosophy, was given consular rank by the emperor Trajan and a procuratorship in Greece by Hadrian. He was married and the father of one daughter and four sons. He appears as a man of kindly character and independent thought, studious and learned.Plutarch wrote on many subjects. Most popular have always been the 46 Parallel Lives, biographies planned to be ethical examples in pairs (in each pair, one Greek figure and one similar Roman), though the last four lives are single. All are invaluable sources of our knowledge of the lives and characters of Greek and Roman statesmen, soldiers and orators. Plutarch's many other varied extant works, about 60 in number, are known as Moralia or Moral Essays. They are of high literary value, besides being of great use to people interested in philosophy, ethics and religion.The Loeb Classical Library edition of the Moralia is in fifteen volumes, volume XIII having two parts.""--",N/A,N/A,en
THE LECTURES ON FAITH,"['JOSEPH SMITH, JR.']",2022-08-07,['Religion'],"THE LECTURES ON FAITH BY JOSEPH SMITH, JR. Key features of this book: Unabridged original content This book is comprised of 5 lectures on Faith Available in multiple formats: - Paperback - Hard cover - eBook - Large print paperback - Large print hard cover Proper paragraph formatting with Indented first lines, 1.25 Line Spacing and Justified Paragraphs Properly formatted for aesthetics and ease of reading. Custom Table of Contents and Design elements for each chapter The Copyright page has been placed at the end of the book, as to not impede the content and flow of the book. Original publication: 1835 This book makes a wonderful addition to any Latter-day Saint library At Latter-day Strengths we have taken the time and care into formatting this book to make it the best possible reading experience. We specialize in publishing classic books for Latter-day Saints and have been publishing books since 2014. We now have over 500 book listings available for purchase. Enjoy!",N/A,N/A,en
The Gospel According to John,['Colin G. Kruse'],2004,['Religion'],"The Tyndale New Testament Commentaries have long been a trusted resource for Bible study. Written by some of the world's most distinguished evangelical scholars, these twenty volumes offer clear, reliable, and relevant explanations of every book in the New Testament. These Tyndale volumes are designed to help readers understand what the Bible actually says and what it means. The introduction to each volume gives a concise but thorough description of the authorship, date, and historical background of the biblical book under consideration. The commentary itself examines the text section by section, drawing out its main themes. It also comments on individual verses and deals with problems of interpretation. The aim throughout is to get at the true meaning of the Bible and to make its message plain to readers today. Book jacket.",4,N/A,en
Arguing for Atheism,['Robin Le Poidevin'],1996,['Philosophy'],"Instead of simply defending a denial of God's existence, Le Poideven presents a way of interpreting religious discourse which allows us to make sense of the role of religion in our spiritual and moral lives.",N/A,N/A,en
The Hindu Religious Tradition,"['Thomas J. Hopkins', 'Graham M. Schweig']",2025-04-17,['Religion'],"The Hindu Religious Tradition by Thomas J. Hopkins, originally published in 1971, provided a comprehensive survey of Hindu development from the Indus civilization to the present. This new edition incorporates up-to-date scholarship to provide a more complete history of India’s cultural and religious development, and is an invaluable resource for students in need of an introduction to the history and practice of Hinduism. In addition to textual analysis, this book offers a new approach to the study of Hinduism that reconstructs the history of India through an examination of scientific research on geography, archaeology, genetics, art history, linguistic and inscriptions, bringing to awareness the ways that patterns of cultural development, migration, kingship, and technology impacted the synthesis and integration of a wide range beliefs and practices into what we call Hinduism today. Extending beyond the borders of present-day India, The Hindu Religious Tradition shows how Hinduism was influenced by other civilizations in modern day Greece and Iran, and how it influenced them as well. This volume will provide new students of Indian religion with a detailed understanding of Hinduism’s rich history and scriptural canons, and it will provide scholars of Hinduism with a fresh perspective rooted in historical detail, offering both a more complete picture of how the Hindu religion is a network of beliefs and practices drawn from multiple civilizations and cultures over its vast history.",N/A,N/A,en
The Islamic Law of Personal Status,['Jamal J. Nasir'],2020-06-02,['Law'],"This new edition of the authoritative English-language treatment of Islamic personal status law gives practitioners and courts throughout the world direct access to this important body of law in its most up-to-date development. All Middle Eastern and North African Arab states are covered; new to this edition is coverage of recent provisions enacted in Kuwait, Yemen, and Sudan. The chapter on dissolution of marriage has been completely revised to reflect current legal interpretation and judicial practice in this rapidly changing area of Islamic law. Also new and especially valuable are English versions, for the first time anywhere, of fundamental Shiite and Jaafari legal works with the most thorough analysis and commentary available in any non-Arabic source. Dr. Nasir's much-appreciated methodology has been continued since the very successful first edition of 1986. For each topic - e.g., marriage, dower, dissolution of marriage, parentage, inheritance, and waqf - he begins with a consideration of the subject in Sharia law, and then goes on to present legislation and contemporary views, in particular Arab countries. This approach, while it clearly manifests the continuity of Islamic law respecting personal status, is of great practical value to judges and practitioners, especially those who must resolve disputes under Islamic law in non-Muslim countries.",N/A,N/A,en
Against Celsus,['Origen'],N/A,['Religion'],"In this powerful work, Origen defends Christianity against the attacks of the pagan philosopher Celsus, addressing a wide range of theological and philosophical issues. With meticulous arguments and deep spiritual insights, Origen demonstrates the superiority of the Christian faith and its compatibility with reason, while also exploring the nature of God, the divinity of Christ, and the role of free will in human life.",N/A,N/A,en
Myth and Method,"['Laurie L. Patton', 'Wendy Doniger']",1996,['Religion'],"In confronting these tension, they provide an outline of the most troubling questions in the field and offer a variety of responses to them.",3,N/A,en
Sikh Art and Literature,['Kerry Brown'],1999,['Art'],"Sikh Art and Literature introduces Sikhism through its rich artistic culture. Using an assembly of rare imagery and literature, we are given the chance to explore the fruitful world of the Sikhs.",N/A,N/A,en
"Pope Gregory VII, 1073-1085",['H. E. J. Cowdrey'],1998-08-20,['History'],"The reign of Pope Gregory VII (1073-85), who gave his name to an era of Church reform, is critically important in the history of the medieval church and papacy. Thus it is surprising that this is the first comprehensive biography to appear in any language for over fifty years. H. E. J. Cowdrey presents Gregory's life and work in their entirety, tracing his career from early days as a clerk of the Roman Church, through his political negotiations, ecclesiastical governance, and final exile at Salerno. Full account is taken of his turbulent relations with King Henry IV of Germany, from his first deposition and excommunication in 1076, to the absolution at Canossa and the imposition of a second sentence in 1080. Pope Gregory was also a contemporary of William the Conqueror, and, as the author shows, fully supported his conquest of England. Gregory VII is presented as an individual whose deep inner belief in iustitia (righteousness) did not waver in the face of new circumstances, although his broad outlook underwent changes. Deeply committed to the traditions of the past and especially to those of Pope Gregory the Great, his reign prepared the way for an age of strong papal monarchy in the western Church.",N/A,N/A,en
Alberuni's India,"['Muḥammad ibn Aḥmad Bīrūnī', 'Edward C. Sachau']",2000,['History'],"First Published in 2000. Routledge is an imprint of Taylor & Francis, an informa company.",N/A,N/A,en
Arguing about Gods,['Graham Oppy'],2006-09-04,['Philosophy'],"In this book, Graham Oppy examines arguments for and against the existence of God. He shows that none of these arguments is powerful enough to change the minds of reasonable participants in debates on the question of the existence of God. His conclusion is supported by detailed analyses of the arguments as well as by the development of a theory about the purpose of arguments and the criteria that should be used in judging whether or not arguments are successful. Oppy discusses the work of a wide array of philosophers, including Anselm, Aquinas, Descartes, Locke, Leibniz, Kant, Hume and, more recently, Plantinga, Dembski, White, Dawkins, Bergman, Gale and Pruss.",N/A,N/A,en
On Belief,['Slavoj Žižek'],2001,['Juvenile Nonfiction'],"What is the basis for belief in an era when globalization, multiculturalism and big business is the new religion? This book probes beneath the surface of the way we normally think about belief, in particular Judaism and Christianity.",N/A,N/A,en
The Epistle to the Romans,['Leon Morris'],2018-09-06,['Religion'],"In this now-classic commentary, first published in 1988 in the Pillar New Testament Commentary series, noted biblical scholar Leon Morris unravels Romans and the complexities of faith and interpretation associated with the epistle. In his introduction Morris deals with matters of authorship, destination, date, occasion, and contents in a brief but helpful way. The commentary proper consists of careful verse-by-verse exposition of the text along with full and informative footnotes. Though he interacts considerably with the immense body of literature on Romans, Morris’s approach to the study of the epistle remains clearly his own. His thorough exegesis enables readers to understand Romans as one of the greatest and most spiritually significant books in the Bible.",N/A,N/A,en
Sitting Still Like a Frog,['Eline Snel'],2013-12-03,['Family & Relationships'],"Simple mindfulness practices to help your child (ages 5-12) deal with anxiety, improve concentration, and handle difficult emotions—with a 60-minute audio CD of guided exercises Mindfulness—the quality of attention that combines full awareness with acceptance of each moment, just as it is—is gaining broad acceptance among mental health professionals as an adjunct to treatment. This little book is a very appealing introduction to mindfulness meditation for children and their parents. In a simple and accessible way, it describes what mindfulness is and how mindfulness-based practices can help children calm down, become more focused, fall asleep more easily, alleviate worry, manage anger, and generally become more patient and aware. The book contains eleven practices that focus on just these scenarios, along with short examples and anecdotes throughout. Included with purchase is an audio CD with guided meditations, voiced by Myla Kabat-Zinn, who along with her husband, Jon Kabat-Zinn, popularized mindfulness-based stress reduction (MBSR) as a therapeutic approach.",N/A,N/A,en
Formations of the Secular,['Talal Asad'],2003-02-03,['Religion'],"“A dark but brilliantly original work . . . one of the most important books on religion and the modern in recent years.” —H-Net Reviews Opening with the provocative query “what might an anthropology of the secular look like?” this book explores the concepts, practices, and political formations of secularism, with emphasis on the major historical shifts that have shaped secular sensibilities and attitudes in the modern West and the Middle East. Talal Asad proceeds to dismantle commonly held assumptions about the secular and the terrain it allegedly covers. He argues that while anthropologists have oriented themselves to the study of the “strangeness of the non-European world” and to what are seen as non-rational dimensions of social life (things like myth, taboo, and religion),the modern and the secular have not been adequately examined. The conclusion is that the secular cannot be viewed as a successor to religion, or be seen as on the side of the rational. It is a category with a multi-layered history, related to major premises of modernity, democracy, and the concept of human rights. This book will appeal to anthropologists, historians, religious studies scholars, as well as scholars working on modernity. “A difficult if stunningly eloquent book, a response both elusive and forthright to the many shelves of ‘books on terrorism’ which this country’s trade publishers are rushing into print.” —Bryn Mawr Review of Comparative Literature “This wonderfully illuminating book should be read alongside the author’s Genealogies of Religion.” —Religion “One of the most interesting scholars of religious writing today.” —Christian Scholar’s Review “Asad’s brilliant study remains a defining piece of intellectual and scholarly contribution for all of those interested in exploring the religious and the secular in the modern era.” —The American Journal of Islamic Social Sciences",N/A,N/A,en
The Treasury of Catholic Wisdom,['John Hardon'],2011-05-17,['Religion'],"The Treasury of Catholic Wisdom is a Catholic library in miniature, a one-volume microcosm of what the Church's great minds have thought and said since the apostolic age. Indeed, in The Treasury of Catholic Wisdom, noted theologian Fr. John A. Hardon has compiled the works of thirty-three of the greatest Catholic thinkers and writers, representing every period of the Church's passage through time, from the beginnings of Christianity to the present day. Here are men and women, bishops and priests, religious and the laity ""whose native talents were elevated by the supernatural light that God reserves for those who are most submissive to His will."" Included in this extraordinary and fascinating anthology are the works of the early saints, such as Gregory, Basil, Augustine, John Chrysostom, Patrick, Bernard Francis, and Thomas Aquinas. Here, too, are the writings of the great reformers Ignatius, Catherine of Siena, and Teresa of Avila; the mystic John of the Cross; the practical wisdom of Francis de Sales, Louis de Montfort, and Peter Julian Eymard; and the modern-day reflections of Gerard Manley Hopkins, Francis Thompson, Therese of Lisieux, G.K. Chesterton, and Fulton J. Sheen. The Treasury of Catholic Wisdom is a comprehensive anthology of the outstanding Catholic literature from the first century to modern times. Mystics and martyrs, philosophers and theologians, poets and prose writers are quoted at length and in depth. They are truly representative of the spirit and substance of Catholicism in its paradox of phenomenal stability and versatility over the centuries. Fr. Hardon has selected those writings which are representative of the thought and philosophy of each contributor, and has carefully chosen excerpts which are not always the most familiar. Thus, his volume provides not only a fresh collection of the best of Catholic wisdom, but also a uniquely comprehensive work which offers enlightenment and faith for generations of readers. John A. Hardon, S.J., holds a master's degree in philosophy from Loyola University and a doctorate in theology from the Gregorian University in Rome. He is the author of The Catholic Catechism and many other books. Fr. Hardon is also a founder of the Catholic Home Study Institute, a correspondence school which operates under pontifical approval.",N/A,N/A,en
