title,authors,publishedDate,categories,description,averageRating,textSnippet
Sacred Selfishness,['Bud Harris'],2005,"['Body, Mind & Spirit']","While growing up, selfishness is defined for most people as a destructive force -- power-driven, self-obsessed, a tyranny against others, and a drain on energy. Early lessons teach that the needs of others must be put above one's own. This has created a culture of outward-directed people, cut off from the inner sources of energy and vitality. Failing to develop one's individuality can eventually lead to depression and ill health. Only after becoming whole can one help others as well as society. This is the lesson of Sacred Selfishness, in which Jungian analyst Bud Harris argues persuasively that one must live authentically in order to be whole, happy, healthy, and a truly contributing member of society. This essential guide offers many strategies readers can use in order to live a ""sacredly selfish"" life, from analyzing dreams to keeping a detailed journal that teaches seekers to understand themselves, their worth, and their needs.",3,N/A
The Study of the Meaning of Life,['Zhengyu Sun'],2024-10-28,['Philosophy'],"Based on the revelation and analysis of the social self-consciousness contained in the individual self-consciousness of the meaning of life, the book discusses the human life-world, spiritual world, cultural world and meaning-world. Then, it states the life-world, modes of thought, values ideas, aesthetic consciousness and ultimate concerns of modern humans. It also systematically expounds on the cultivation, the truth, the nurture, the sublimation, the support, the tension and the source of the spiritual home in perspectives of education, science, art, philosophy, theory, mentality and ideals. Constructing a fulfilling spiritual home for man is the realistic meaning of this book.",N/A,N/A
Body Disownership in Complex Posttraumatic Stress Disorder,['Yochai Ataria'],2018-05-11,['Psychology'],"This book explores the long-term outcomes of severe and ongoing trauma—particularly complex posttraumatic stress disorder (C-PTSD)—from phenomenological and cognitive perspectives. For example, C-PTSD can result in impairments at the body-schema level. In order to survive, trauma victims may conduct their lives at the body-image level, thus producing a mismatch between body schema and body image. In turn, as in the case of somatoparaphrenia and body integrity identity disorder, this incongruity can result in body disownership, which will affect long-term outcomes of severe and ongoing trauma.",N/A,N/A
Humanising Higher Education,"['Camila Devis-Rozental', 'Susanne Clarke']",2020-11-16,['Psychology'],"This book explores humanising practice within higher education (HE). It provides a fresh perspective by bringing together expert voices with empirical experience of humanising theory and practice in various areas of higher education, in order to influence and improve the way in which universities work. The book draws on Todres et. al’s humanisation framework, as well other relevant theories such as positive organisational scholarship, Vygotsky’s socio-cultural theory and socio-emotional intelligence. Topics include micro elements of humanisation such as transitions and the student experience, and macro elements such as the policy impact of humanising HE and sustainability. The authors demonstrate how a humanising approach can provide the catalyst for wider change and help to improve wellbeing in the community. This book offers an invaluable resource for scholars interested in teaching and learning in HE, and for HE practitioners and policy makers keen to develop a more human practice.",N/A,N/A
The Films of Lars von Trier and Philosophy,"['José A. Haro', 'William H. Koch']",2019-08-31,['Performing Arts'],"The films of Lars von Trier offer unique opportunities for thinking deeply about how Philosophy and Cinema speak to one another. The book addresses von Trier’s films in order of their release. The earlier chapters discuss his Golden Heart trilogy and USA: Land of Opportunities series by addressing issues of potential misogyny, ethical critique, and racial justice. The later chapters focus on his Depression Trilogy and address the undermining of gender binaries, the psychoanalytic meaning of the sacrifice of children and depression, and philosophical questions provoked by the depiction of the end of the world. Taken together, the volume explores the topics of Philosophical Psychology, Social Theory, Political Theory, Theories of the Self, Philosophy of Race, and Feminist Thought, and opens a conversation about von Trier’s important work.",N/A,N/A
Falling Awake,['Todd L. Blattner'],2016-11-29,['Self-Help'],"Waking is a natural shift from unconsciousness to awareness. Falling awake is a special case of waking where we relax out of old patterns, ease out of resistance, and surrender to the grace and love that are always present beneath the surface of appearances. Although falling awake, like falling asleep, cannot be forced, it can be prepared for. Integrating perspectives from physical, social and psychological sciences, philosophy, religion and energy awareness, and calling on many years of experience as a teacher, counsellor and Buddhist monk, Blattner takes us step by step into an expanded understanding of the universe in which we live, the mind/body system that we call ""self "", and that which may lie beyond. With gentleness and kindness, Falling Awake shows us how to move beyond the programs and limiting belief systems that support the problems in our lives, and awaken into an increasingly gentle, joyful, and expanded experience of the art of living....",N/A,N/A
Beyond Identities: Human Becomings in Weirding Worlds,['Jim Dator'],2022-08-31,['Philosophy'],"This book is an argument for moving beyond culturally/historically/ethnically/biologically-grounded identity as the necessary foundation of an authentic self. It highlights examples of people who are attempting to inhabit identities they feel are more appropriate to themselves, by deploring the damage done via claims about authentic identity. The sole theme of this book is “becoming beyond identity”. We are not fixed human beings but rather perpetually-dynamic human becomings. As intelligence is enabled or recognized beyond the merely human, we should welcome our continuing evolution from homosapiens, sapiens, into many varieties of intelligences on Earth and the cosmos. This book builds from tiny ripples into a tsunami of examples from conventional identity studies, to Confucian human becomings, to apotemnophilia, to DIY biohacking, to cyborgs, to artilects, to hiveminds, to intelligence in animals, plants and fungi from the Holocene through the beginnings of the precarious, climate change-driven Anthropocene Epoch, with hints far beyond and throughout the cosmos. From a lifetime of work in future studies, anticipation science and space studies, the author balances frank tales of his own experiences and beliefs concerning his uncertain and fluid identities with those of others who tell their stories. In addition to material from academic and popular sources, a few poems further illuminate the scene.",N/A,N/A
The Self in Understanding and Treating Psychological Disorders,"['Michael Kyrios', 'Richard Moulding', 'Guy Doron', 'Sunil S. Bhar', 'Maja Nedeljkovic', 'Mario Mikulincer']",2016-03-10,['Medical'],"A unique exploration of how the 'self' influences psychopathology, psychotherapy, emphasizing the need to integrate self-constructs into evidence-based conceptual models.",N/A,N/A
The Mind Made Flesh,['Nicholas Humphrey'],2002,['Psychology'],"In a series of essays, Nicholas Humphrey invites us to take another look at a variety of central and not-so-central issues, of contemporary psychology including: the evolution of consciousness, multiple personality disorder and cave art.",N/A,N/A
Self-Understanding in Childhood and Adolescence,"['William Damon', 'Daniel Hart']",1991-10-25,['Psychology'],"Reports data from several cross-sectional and longitudinal studies of children's and adolescent's self conceptions and presents new methods for interviewing children about themselves and for analyzing their responses for developmental level and schematic orientation. Annotation copyrighted by Book News, Inc., Portland, OR",N/A,N/A
Ego Analysis in the Helping Professions,['Frances Upham'],1973,['Psychology'],N/A,N/A,N/A
