title,authors,publishedDate,categories,description,averageRating,textSnippet,language
Golden Bats and Pink Pigeons,['Gerald Durrell'],1989,['Rare animals'],First published 1977. An account of Durrell's conservation work on the island of Mauritius,N/A,N/A,en
Images Of Animals,['Eileen Crist'],2010-06-02,['Gardening'],A fascinating exploration of the language we use for animal behavior.,N/A,N/A,en
Innocent Killers,['Hugo van Lawick'],1973,['African wild dog'],N/A,N/A,N/A,en
Biology,['Marielle Hoefnagels'],2009-07-01,['Animals'],N/A,N/A,N/A,en
Dingoes at Dinnertime,['Mary Pope Osborne'],2000,['Animals'],The magic tree house whisks Jack and Annie away to Australia where they must save some animals from a wildfire.,N/A,N/A,en
Creatures of the Antarctic,['Susan Gough'],1992,['Antarctica'],N/A,N/A,N/A,en
Secrets of the Woods,['William Joseph Long'],1901,['Fiction'],"""Vivid sketches of the wood-mouse, otter, kingfisher, red squirrel, partridge, deer, and other wood folk. Through his anecdotes the author shares with the reader what can be learned of the habits of animals through keen observation over a long period of time-details that elude the casual visitor to the woods""--Google Books (viewed July 16, 2014).",N/A,N/A,en
Animal Treasure,['Ivan Terence Sanderson'],1937,['Fiction'],N/A,N/A,N/A,en
Travels of William Bartram,['William Bartram'],1955-01-01,['Nature'],Reprint of 1791 ed.,N/A,N/A,en
De Re Metallica,['Georg Agricola'],1950,['Literary Collections'],"One of the most important scientific classics, and first to offer detailed technical drawings illustrating mining techniques, field research, and the earliest scientific methods. Translated by Herbert Hoover. 289 woodcuts.",N/A,N/A,en
