title,authors,publishedDate,categories,description,averageRating,textSnippet,language
Instant Notes Animal Biology,['Richard David Jurd'],2004,['Juvenile Nonfiction'],"This is a student-friendly compendium of the essentials of animal biology, including the Animal Kingdom, comparative physiology, reproductive physiology and developmental biology.",3,N/A,en
Zoo,"['Eric Baratay', 'Elisabeth Hardouin-Fugier']",2004,['Gardening'],"Wild animals have fascinated human observers since time immemorial. The story of our interest in collecting, classifying and dominating Nature so that its inner workings could be understood also looms large in the history of science, and thus it is surprising that the history of menageries, zoological gardens and the zoo as we know it today has been so poorly documented. This gap is addressed by Zoo, a comprehensive history of the zoo in the Western world.",N/A,N/A,en
The zoology of the voyage of H.M.S. Beagle,['Charles Darwin'],1842,"['Mammals, Fossil']",N/A,N/A,N/A,en
"De Animalibus. Michael Scot's Arabic-Latin Translation, Volume 2 Books XI-XIV",['Aafke M. I. van Oppenraay'],1998-07-31,['Architecture'],"This volume makes available for the first time to the scholarly world the version of Aristotle's ""Parts of Animals"" that has long been one of the main sources of knowledge in Europe on the subject. Being a faithful translation of a translation produced by a Syriac-speaking Christian, the text also contributes to our knowledge of Middle Arabic.",N/A,N/A,la
Aristotle's History of Animals,['Aristotle'],1897,['Zoology'],N/A,5,N/A,en
Ecology of Java & Bali,"['Tony Whitten', 'Roehayat Emon Soeriaatmadja', 'Suraya A. Afiff']",1996,['History'],"Java and Bali are the best known of all the islands in Indonesia, and nowhere else in the country are ecological issues so acute. This book provides invaluable ecological data, so that development activities can be viewed in light of their ecological and social impacts.These eagerly-awaited volumes are the result of four years of research into the status of Indonesian coastal and marine ecosystems. They chart the extraordinary treasure trove of the areas marine biodiversity, and discuss the problems that have resulted from current population pressures and economic development.",1,N/A,en
Aristotle,['Aristotle'],1882,['Zoology'],N/A,N/A,N/A,en
The Lung-Air Sac System of Birds,['John N. Maina'],2005-12-28,['Science'],"In biology, few organs have been as elusive as the lung-air sac system of birds. Considerable progress has recently been made to fill the gaps in the knowledge. While summarizing and building on earlier observations and ideas, this book provides cutting-edge details on the development, structure, function, and the evolutionary design of the avian respiratory system. Outlining the mechanisms and principles through which biological complexity and functional novelty have been crafted in a unique gas exchanger, this account will provoke further inquiries on the many still uncertain issues. The specific goal here was to highlight the uniqueness of the design of the avian respiratory system and the factors that obligated it.",N/A,N/A,en
Entomology,['Cedric Gillott'],2013-11-11,['Science'],"Extensively revised, the Second Edition continues to offer senior undergraduate students a well-balanced treatment of all major areas in entomology. This edition features coverage of the new phylogenies for most of the insect orders",N/A,N/A,en
The zoology of the voyage of H.M.S. Beagle,['Charles Darwin'],1840,['Beagle (Ship)'],N/A,N/A,N/A,en
A Source-book of Biological Names and Terms,['Edmund Carroll Jaeger'],1955,['Science'],Discusses origin and significance of biological names and words.,N/A,N/A,en
An Essay on Classification,['Louis Agassiz'],1859,['Biology'],N/A,N/A,N/A,en
The Encyclopedia of Animals,[],2004,['Nature'],"This lavishly illustrated trade reference to mammals, birds, reptiles, amphibians, fishes, and invertebrates features hundreds of glorious photos, masterful illustrations, and informative maps.",4.5,N/A,en
Index Generum Mammalium,['Theodore Sherman Palmer'],1904,['Animals'],N/A,N/A,N/A,en
Return of the Crazy Bird,['Clara Pinto-Correia'],2003-01-27,['Juvenile Nonfiction'],"Although everybody is familiar with the dodo bird, very few people know its history. Yet this history is compelling when read as a fable of the negative impact of humans on Earth's ecosystems. The author describes the complexity of the factors involved in animal extinction. Although we think of ourselves as more ecologically aware than our ancestors, we are propelling extinction to alarming rates.",N/A,N/A,en
Sketches of the Natural History of Ceylon,['Sir James Emerson Tennent'],1861,['Elephants'],N/A,N/A,N/A,en
The Guinness Book of Animal Facts and Feats,['Gerald L. Wood'],1976,['Science'],N/A,N/A,N/A,en
Bulletin of the American Museum of Natural History,['Joel Asaph Allen'],1890,['Anthropology'],"Comprises articles on geology, paleontology, mammalogy, ornithology, entomology and anthropology.",N/A,N/A,en
Cynographia Britannica,['Sydenham Teak Edwards'],1800,['Dogs'],N/A,N/A,N/A,en
"Systematics and the Origin of Species, from the Viewpoint of a Zoologist",['Ernst Mayr'],1999,['Science'],"This classic study, first published in 1942, helped to revolutionize evolutionary biology by offering a new approach to taxonomic principles and correlating the ideas and findings of modern systematics with those of other life science disciplines. This book is one of the foundational documents of the ""Evolutionary Synthesis.""",5,N/A,en
The Naturalist in Nicaragua,['Thomas Belt'],1874,['Natural history'],N/A,N/A,N/A,en
Aristotle's De Motu Animalium,"['Aristoteles', 'Martha C. Nussbaum']",1985,['Literary Collections'],"Available for the first time in paperback, this volume contains text with translation of De Motu Animalium, Aristotle's attempt to lay the groundwork for a general theory of the explanation of animal activity, along with commentary and interpretive essays on the work.",N/A,N/A,en
The Natural History of Birds,['Georges Louis Leclerc comte de Buffon'],1793,['Zoology'],N/A,N/A,N/A,en
The Works of Aristotle,['Aristotle'],1927,['Zoology'],N/A,N/A,N/A,en
Journal of comparative zoology,['Julius Victor Carus'],1888,['Zoology'],N/A,N/A,N/A,de
"Natural History of Birds, Fish, Insects, and Reptiles",['Georges Louis Leclerc comte de Buffon'],1798,['Zoology'],N/A,N/A,N/A,en
Owls (Strigiformes),['Friedhelm Weick'],2007-08-13,['Science'],"The owl is a magical creature: it exudes an ambivalent fascination that can trigger completely antithetical responses. On the one hand, there is something unsettling about the owl’s soundless flight, eerie call, and nocturnal activity that can result in its demonization as a messenger of darkness. On the other hand, however, its masklike visage and seemingly penetrating gaze prove - thralling, and this may have contributed to the deification of the owl as the companion spirit of an omniscient mother earth. In addition, the highly s- cialized captor of prey aroused the competitive envy of hunting parties, even provoking a bit of resentment when they lost out to owls in their hunt for small game. Moreover, the excrement and pellets (hairballs) they deposited in barns and church towers contributed to their reputation as undesirables or even pests. With the overcoming of superstition and suspicion, our relati- ship with these creatures of the night has now become one of unreserved - miration. They grant us insights into the rich diversity of adaptation to n- turnal hunting as well as into sound inventories, brooding biology, and ne- ling development. In a complete transformation of what was once a symbol of fear and hatred, charismatic owls now enjoy an almost singular popularity in large parts of the population.",N/A,N/A,en
The Geographical Distribution of Animals,['Alfred Russel Wallace'],1876,['Geography'],"""Wallace, together with Darwin was the founder of modern evolutionary theory, and when Darwin received Wallace's paper of 1858 (a year before the publication of the Origin of Species), he wrote to Lyell ""All my originality, whatever it may amount to, will be smashed"".""I never saw a more striking coincidence.Your words (referring to Lyell's earlier warnings that Darwin might be anticipated) have come true with a vengeance."" In 1858 Wallace was already preparing an announcement of an importent zoogeographical discovery, which proposed a boundary line dividing the archipelago of Indo-Malayan and Australian zoological regions. The culmination of Wallace's approach was achieved in his monumental two-volume ""The geographical Distribution."" and it is a pioneer-work in zoogeography.""--Abebooks website.",N/A,N/A,en
The Origins of Larvae,['D. Williamson'],2013-04-17,['Science'],"Many biological facts are irreconcilable with the assumption that larvae and adults evolved from the same genetic stock. The author of this book draws attention to these, and presents his alternative hypothesis that larvae have been transferred from one taxon to another. In his previous book (Larvae and Evolution, 1992), the author used larval transfer to explain developmental anomalies in eight animal phyla. In the present book, he claims that the basic forms of all larvae and all embryos have been transferred from foreign taxa. This leads to a new, comprehensive theory on the origin of embryos and larvae, replacing the discredited 'recapitulation' theory of Haeckel (1866). Metamorphosis, previously unexplained, represents a change in taxon during development.",N/A,N/A,en
The Zoology of the Voyage of H.M.S. Beagle,[],1986,['Beagle Expedition'],N/A,N/A,N/A,en
Aristotle on the Parts of Animals,['Aristotle'],1987,['Medical'],N/A,N/A,N/A,en
Animal Diversity,"['GLENCOE', 'McGraw-Hill Companies, Inc.']",2005-06-30,['Science'],N/A,N/A,N/A,en
"Tropical Nature, and Other Essays",['Alfred Russel Wallace'],1878,['Botany'],N/A,N/A,N/A,en
Observations on Certain Parts of the Animal Oeconomy,['John Hunter'],1786,['Anatomy'],"Some observations of Hunter about the secondary sexual characteristics in birds, the air sac in birds, the structure of the placenta along with the original description of the olfactory nerves are included in this book.",N/A,N/A,en
De Re Metallica,['Georg Agricola'],1912,['Metallurgy'],N/A,N/A,N/A,en
"An history of the earth, and animated nature",['Oliver Goldsmith'],1777,[],N/A,N/A,N/A,en
The Drunken Forest,['Gerald Durrell'],1958,['Argentina'],N/A,N/A,N/A,en
A History of the Earth and Animated Nature,['Oliver Goldsmith'],1828,['Physical geography'],N/A,N/A,N/A,en
Encyclopedia of Parasitology: A-M,['Heinz Mehlhorn'],2007-11-28,['Medical'],"Knowledge in the field of parasitology must be kept at a high level and up to date in order to fight a parasitosis as quickly and effectively as possible. The third edition of this, one of Springer’s renowned and authoritative Major Reference Works, contributes to these goals in several ways. First, the number of entries has been increased by about 30%. Secondly the content has been improved even more by adding additional tables and figures. Thirdly, the extensive linking between definitions and essays facilitates information within a minimum of time. More than 40 international contributors, who are well known specialists in their fields, give a comprehensive review of all parasites and therapeutic strategies in veterinarian and human parasitology.",5,N/A,en
Ichthyology Handbook,"['B.G. Kapoor', 'Bhavna Khanna']",2004-03-11,['Science'],"In recent years, progress in fish biology has advanced at an unprecedented rate and has led to many breakthroughs in the field. This book provides a wealth of information on the strategies that fish adopt with respect to waters with markedly different physical and chemical characteristics. It shows how their physiology, behaviour and lifestyles are adapted to exploit particular niches and gives comprehensive insight into fish life under extreme conditions. The readers are introduced to the ways in which fish exemplify many phenomena of general biological interest - the existence of competitors, chaos, and predator-prey interaction. Fish pathology as well as the components of the immune system are addressed. In this book, original and at times controversial views are presented, areas which have so far received inadequate attention are highlighted and avenues for further research are suggested.",5,N/A,en
"De animalibus: books XI-XIV, Parts of animals",['Aristotle'],1992,['Reproduction'],"Scot's 13th century Latin translation of Aristotle's biological works, from an Arabic translation of the original Greek.",N/A,N/A,en
Aristotle in twenty-three volumes,['Aristotle'],1961,['Animal locomotion'],N/A,N/A,N/A,en
Avian Physiology,['Paul D Sturkie'],1998-07-17,[],N/A,N/A,N/A,en
Integrated Principles of Zoology,['Cleveland P. Hickman'],2008,['Science'],This comprehensive text is suitable for one- or two-semester courses. It features illustrations and photographs together with comprehensive coverage.,N/A,N/A,en
"A History of the Earth, and Animated Nature",['Oliver Goldsmith'],1824,['Physical geography'],N/A,N/A,N/A,en
The Romance of Natural History,['Philip Henry Gosse'],1861,"[""Binders' tickets""]",N/A,N/A,N/A,en
The Handbook of Palestine,['Sir Harry Luke'],1922,['Eretz Israel'],N/A,N/A,N/A,en
The Overloaded Ark,['Gerald Durrell'],1953,"['Africa, West']",N/A,N/A,N/A,en
The Philosophy of Natural History,['William Smellie'],1850,['Animal behavior'],N/A,N/A,N/A,en
The Microscope,['Jabez Hogg'],1883,['Botany'],N/A,N/A,N/A,en
Smiths’ Sea Fishes,"['Margaret M. Smith', 'Phillip C. Heemstra']",1986-11,['Nature'],"Dr. D. S. Henderson, Chairman of the 1. L. B. Smith Institute of Ichthyology and Vice Chancellor of Rhodes University This book is a unique, international collaborative effort ranging all of the colour plates for the book. For the past of 76 scientists, representing 15 countries. Several skilled eight years, she has been assisted in the research, writing artists and photographers have also contributed to the and editing of the book by Dr. P. C. Heemstra. numerous and beautiful illustrations. Research done in It is essential for the proper management of the marine South Africa was supported by the Council for Scientific fish resources of southern Africa that we know what species and Industrial Research. Work on the book at the J.L.B. we are dealing with. This book will greatly facilitate the Smith Institute was also funded by the Department of identification of our fishes. It will thus be of vital import National Education and The Trustees of the Sea Fishes of ance to the understanding and wise use of our tremendously Southern Africa Book Fund. Expenses of visits by ichthy diverse and valuable fish fauna. ologists from overseas were defrayed by a grant from the We are proud of the affiliation of the J.L.B. Smith Insti John S. Schlesinger Foundation. tute with Rhodes University and happy to see the successful Although this book is an impressive contribution to the completion of this long-awaited work.",N/A,N/A,en
Through the Brazilian Wilderness,['Theodore Roosevelt'],1969,['Science'],On the occasion in question Father Zahm had just returned from a trip across the Andes and down the Amazon and came in to propose that after I left the presidency he and I should go up the Paraguay into the interior of South America.,N/A,N/A,en
Pests of Stored Foodstuffs and Their Control,['Dennis S. Hill'],2002-09-30,['Science'],"This textbook gives a broad overview of pests of human foodstuffs held in storage. The work contains a large amount of illustrations, which make the mentioned (larger) species easier for recognition. The text is greatly expanded and is orientated to the food industry, which makes it, unlike many other textbooks, a one of a kind in its subject area. The book is mainly intended for B.Sc. and M.Sc. Food Science students and staff, and related courses as well as for Environmental Health Officers.",N/A,N/A,en
On the Parts of Animals,['Aristotle'],2001,['Zoology'],N/A,N/A,N/A,en
The History of Animals,['Aristotle'],2014-06-16,['History'],"Aristotle is best known along with Plato and Socrates as a philosopher responsible for the establishment of Western philosophy as it exists today, but his interests were varied far beyond philosophy. In The History of Animals, Aristotle wrote what can be considered an ancient form of zoology, discussing the natural history of other creatures. It's a massive tome that helped serve as a base of knowledge for animals in the West moving forward.",N/A,N/A,en
Bound for Integrated Principles of Zoology,['Jr. Hickman'],2016-12-15,[],"Overview Emphasizing the central role of evolution in generating diversity, this best-selling text describes animal life and the fascinating adaptations that enable animals to inhabit so many ecological niches. Featuring high quality illustrations and photographs set within an engaging narrative,Integrated Principles of Zoology is considered the standard by which other texts are measured. With its comprehensive coverage of biological and zoological principles, mechanisms of evolution, diversity, physiology, and ecology, organized into five parts for easy access, this text is suitable for one- or two-semester introductory courses.",N/A,N/A,en
Evolutionary Aesthetics,"['Eckart Voland', 'Karl Grammer']",2013-04-17,['Science'],"Evolutionary Aesthetics is the attempt to understand the aesthetic judgement of human beings and their spontaneous distinction between ""beauty"" and ""ugliness"" as a biologically adapted ability to make important decisions in life. The hypothesis is - both in the area of ""natural beauty"" and in sexuality, with regard to landscape preferences, but also in the area of ""artificial beauty"" (i.e. in art and design) - that beauty opens up fitness opportunities, while ugliness holds fitness risks. In this book, this adaptive view of aesthetics is developed theoretically, presented on the basis of numerous examples, and its consequences for evolutionary anthropology are illuminated.",N/A,N/A,en
The Malay Archipelago,['Alfred Russel Wallace'],2000,['Animals'],"This book is still one of the great classics of natural history and travel. It contains Wallace's observations of the different native people inhabiting the islands: descriptions of the island groupings, such as the Indo-Malays, the Timors, the Celebes, the Moluccas, and the Papuan Islands, and his accounts of the abundant and strange animals, startling birds, and varied insects, that flourished there. His basic thesis that the western half of the archipelago is Indian in animal life, whereas the eastern is Australian, is still accepted, and the line separating the two is called the Wallace Line in his honour. This is an unabridged reprint of the 1922 edition, with 62 drawings and maps. There are three appendices, one on cranial measurements, and the other two on native languages and vocabulary.",N/A,N/A,en
De animalibus,['Aristotle'],1998,['Reproduction'],N/A,N/A,N/A,en
The Natural History of Barbados,['Griffith Hughes'],1750,['Barbados'],N/A,N/A,N/A,en
The Naturalist in La Plata,['William Henry Hudson'],1892,['Animal behavior'],N/A,N/A,N/A,en
Principles of Zoölogy,"['Louis Agassiz', 'Augustus Addison Gould']",1860,"['Physiology, Comparative']",N/A,N/A,N/A,en
Animal,"['David Burnie', 'Don E. Wilson']",2001,['Nature'],"Offers photographs and information about mammals, birds, reptiles, amphibians, fishes, and invertebrates from throughout the world.",N/A,N/A,en
Avian Physiology,['Paul D. Sturkie'],1976,['Birds'],N/A,N/A,N/A,en
"The Works of John Hunter, F.R.S. with Notes",['John Hunter'],1835,['Anatomy'],N/A,N/A,N/A,en
Encyclopedia of Life Sciences,"[""Anne O'Daly""]",1996,['Juvenile Nonfiction'],"An encyclopedia covering the disciplines of zoology, botany, evolutionary science, medicine, physiology, human anatomy, cytology, and genetics.",N/A,N/A,en
The Algorithmic Beauty of Sea Shells,['Hans Meinhardt'],2009-08-02,['Science'],"The pigment patterns on tropical shells are of great beauty and diversity. Their mixture of regularity and irregularity is fascinating. A particular pattern seems to follow particular rules but these rules allow variations. No two shells are identical. The motionless patterns appear to be static, and, indeed, they consist of calci?ed material. However, as will be shown in this book, the underlying mechanism that generates this beauty is eminently dynamic. It has much in common with other dynamic systems that generate patterns, such as a wind-sand system that forms large dunes, or rain and erosion that form complex rami?ed river systems. On other shells the underlying mechanism has much in common with waves such as those commonly observed in the spread of an epidemic. A mollusk can only enlarge its shell at the shell margin. In most cases, only at this margin are new elements of the pigmentation pattern added. Therefore, the shell pattern preserves the record of a process that took place over time in a narrow zone at the growing edge. A certain point on the shell represents a certain moment in its history. Like a time machine one can go into the past or the future just by turning the shell back and forth. Having this complete historical record opens the possibility of decoding the generic principles behind this beauty.",N/A,N/A,en
Curious Creatures in Zoology,['John Ashton'],1890,['Animals'],"Curious Creatures in Zoology “TRAVELLERS see strange things,” more especially when their writing about, or delineation of, them is not put under the microscope of modern scientific examination. Our ancestors were content with what was given them, and being, as a rule, a stay-at-home race, they could not confute the stories they read in books. That age of faith must have had its comforts, for no man could deny the truth of what he was told. But now that modern travel has subdued the globe, and inquisitive strangers have poked their noses into every portion of the world, “the old order changeth, giving place to new,” and, gradually, the old stories are forgotten. It is to rescue some of them from the oblivion into which they were fast falling, that I have written, or compiled, this book. I say compiled it, for I am fonder of letting old authors tell their stories in their old-fashioned language, than to paraphrase it, and usurp the credit of their writings, as is too much the mode now-a-days. It is not given to every one to be able to consult the old Naturalists; and, besides, most of them are written in Latin, and to read them through is partly unprofitable work, as they copy so largely one from another. But, for the general reader, selections can be made, and, if assisted by accurate reproductions of the very quaint wood engravings, a book may be produced which, I venture to think, will not prove tiring, even to a superficial reader. Perhaps the greatest wonders of the creation, and the strangest forms of being, have been met with in the sea; and as people who only occasionally saw them were not draughtsmen, but had to describe the monsters they had seen on their return to land, their effigies came to be exceedingly marvellous, and unlike the originals. The Northern Ocean, especially, was their abode, and, among the Northern nations, tales of Kraken, Sea-Serpents, Whirlpools, Mermen, &c., &c., lingered long after they were received with doubt by other nations; but perhaps the most credulous times were the fourteenth and fifteenth centuries, when no travellers’ tales seem too gross for belief, as can well be seen in the extreme popularity, throughout all Europe, of the “Voyages and Travels of Sir John Maundeville,” who, though he may be a myth, and his so-called writings a compilation, yet that compilation represented the sum of knowledge, both of Geography, and Natural History, of countries not European, that was attainable in the first half of the fourteenth century. All the old Naturalists copied from one another, and thus compiled their writings. Pliny took from Aristotle, others quote Pliny, and so on; but it was reserved for the age of printing to render their writings available to the many, as well as to represent the creatures they describe by pictures (“the books of the unlearned”), which add so much piquancy to the text. Mine is not a learned disquisition. It is simply a collection of zoological curiosities, put together to suit the popular taste of to-day, and as such only should it be critically judged.",N/A,N/A,en
Phenology: An Integrative Environmental Science,['Mark D. Schwartz'],2025-01-08,['Science'],"Phenology refers to recurring plant and animal life cycle stages, such as leafing and flowering, maturation of agricultural plants, emergence of insects, and migration of birds. It is also the study of these recurring events, especially their timing and relationships with weather and climate. Phenological phenomena all give a ready measure of the environment as viewed by the associated organism and are thus ideal indicators of the impact of local and global changes in weather and climate on the earth’s biosphere. Assessing our changing world is a complex task that requires close cooperation from experts in biology, climatology, ecology, geography, oceanography, remote sensing, and other areas. Like its two predecessors, this third edition of Phenology is a synthesis of current phenological knowledge, designed as a primer on the field for global change and general scientists, students, and interested members of the public. With updated and new contributions from over sixty phenological experts, covering data collection, current research, methods, and applications, it demonstrates the accomplishments, progress over the last decade, and future potential of phenology as an integrative environmental science.",N/A,N/A,en
The Naturalist in La Plata,['William Henry Hudson'],1892,['Animal behavior'],N/A,N/A,N/A,en
