title,authors,publishedDate,categories,description,averageRating,textSnippet,language
The Crayfish,['Thomas Henry Huxley'],1880,['Astacoidea'],N/A,N/A,N/A,en
Systema Porifera,"['John N.A. Hooper', 'Rob W.M. van Soest']",2004-09-30,['Science'],"Research whilst compiling this book has uncovered a fauna about twice the size as that previously published in the literature and consequently Systema Porifera revises and stabilizes the systematics of the phylum to accommodate this new knowledge in a contemporary framework. Practical tools (key illustrations, descriptions of character) are provided to facilitate the assignment of approximately 680 extant and 100 fossil genera. Systema Porifera is unique making sponge taxonomy widely available at the practical level of classification (genera, families, order). It is a taxonomic revision of sponges and spongiomorphis (such as sphinctozoans and archaeocyathans) based on re-evaluation of type materials and evidence. It is also a practical guide to sponge identification providing descriptions and illustrations of characters and interpretation of their importance to systematics. Systema Porifera addresses many long standing nomenclatural problems and provides a sound baseline for future debate on sponges and their place in time and space. Systema Porifera describes 3 classes, 7 subclasses, 24 orders, 127 families and 682 valid genera of extant sponges (with over 1600 nominal generic names and an additional 500 invalid names treated). Treatment of the fossil fauna is less comprehensive or critical, although 6 classes, 30 orders, 245 families and 998 fossil genera are mentioned. Keys to all recent and many fossil taxa are provided.",N/A,N/A,en
Lions at Lunchtime,['Mary Pope Osborne'],1998,['Juvenile Fiction'],"The magic tree house takes Jack and Annie to Africa where they meet up with wonderful wild animals, a very hungry warrior, and where they even solve a riddle.",N/A,N/A,en
Living Fossils,"['N. Eldredge', 'S. M. Stanley']",1984-07-18,['Science'],"The case history approach has an impressive record of success in a variety of disciplines. Collections of case histories, casebooks, are now widely used in all sorts of specialties other than in their familiar appli cation to law and medicine. The case method had its formal beginning at Harvard in 1871 when Christopher Lagdell developed it as a means of teaching. It was so successful in teaching law that it was soon adopted in medical education, and the collection of cases provided the raw material for research on various diseases. Subsequently, the case history approach spread to such varied fields as business, psychology, management, and economics, and there are over 100 books in print that use this approach. The idea for a series of Casehooks in Earth Science grew from my experience in organizing and editing a collection of examples of one variety of sedimentary deposits. The prqject began as an effort to bring some order to a large number of descriptions of these deposits that were so varied in presentation and terminology that even specialists found them difficult to compare and analyze. Thus, from the beginning, it was evident that something more than a simple collection of papers was needed. Accordingly, the nearly fifty contributors worked together with George de Vries Klein and me to establish a standard format for presenting the case histories.",N/A,N/A,en
The Study of Animal Life,['John Arthur Thomson'],1917,['Zoology'],N/A,N/A,N/A,en
Vertebrate Zoology,['Sir Gavin De Beer'],1928,"['Anatomy, Comparative']",N/A,N/A,N/A,en
Integrated Principles of Zoology,"['Cleveland P. Hickman (Jr.)', 'Susan L. Keen', 'David J. Eisenhour', 'Allan Larson', ""Helen I'Anson""]",2024,['Zoology'],"""The overall organization of this text has proven to work well to help students understand the content. Distinctive features, especially the emphasis on principles of evolution and zoological science, have been strengthened. To aid in student learning, several pedagogical features have been retained: opening chapter prologues drawn from the chapter's theme; chapter summaries and review questions to aid in comprehension and study; concise and visually appealing illustrations; chapter notes and essays that offer interesting sidelights to the narrative; literature citations; and an extensive glossary providing pronunciations, derivations, and definitions of terms used in the text""--",N/A,N/A,en
The Great White South,['Herbert George Ponting'],1921,['Antarctica'],N/A,N/A,N/A,en
Aristotle on How Animals Move,"['Andrea Falcon', 'Stasinos Stavrianeas', 'Pantelis Golitsis']",2021-06-24,['Philosophy'],"Critical edition, translation, and extended interpretation of this important work which reveals the operation of Aristotle's methodology.",N/A,N/A,en
The Whispering Land,['Gerald Durrell'],1961,['Science'],N/A,N/A,N/A,en
South American Primates,"['Paul A. Garber', 'Alejandro Estrada', 'Julio Cesar Bicca-Marques', 'Eckhard W. Heymann', 'Karen B. Strier']",2008-11-13,['Science'],"This will be the first time a volume will be compiled focusing on South American monkeys as models to address and test critical issues in the study of nonhuman primates. In addition, the volume will serve an important compliment to the book on Mesoamerican primates recently published in the series under the DIPR book series. The book will be of interest to a broad range of scientists in various disciplines, ranging from primatology, to animal behavior, animal ecology, conservation biology, veterinary science, animal husbandry, anthropology, and natural resource management. Moreover, although the volume will highlight South American primates, chapters will not simply review particular taxa or topics. Rather the focus of each chapter is to examine the nature and range of primate responses to changes in their ecological and social environments, and to use data on South American monkeys to address critical theoretical questions in the study of primate behavior, ecology, and conservation. Thus, we anticipate that the volume will be widely read by a broad range of students and researchers interested in prosimians, New World monkeys, Old World monkeys, apes, humans, as well as animal behavior and tropical biology.",N/A,N/A,en
General Zoology Laboratory Manual,['Stephen A. Miller'],1994,['Medical'],"This is an up-to-date zoology lab manual, which can be used with any general zoology text on the market.",N/A,N/A,en
Wild Life of the World,['Richard Lydekker'],1916,['Zoology'],N/A,N/A,N/A,en
Three Singles to Adventure,['Gerald Durrell'],1954,['Guyana'],N/A,N/A,N/A,en
Zoology,['Thomas Walton Galloway'],1915,['Zoology'],N/A,N/A,N/A,en
New Zealand Wildlife,['Julian Fitter'],2009,['Nature'],"A comprehensive overview of New Zealand's natural history, with details of where to go to see them, along with recommended tramping tracks.",N/A,N/A,en
Human Helminthiases in the Philippines,['Erhard Hinz'],2014-01-15,[],N/A,N/A,N/A,en
Deserts,['James A. MacMahon'],1985,['Juvenile Nonfiction'],Surveys the deserts of the American West and describes the various American species of desert plants and animals.,N/A,N/A,en
Zoo Quest to Guiana,['David Attenborough'],1956,['Animal behavior'],N/A,N/A,N/A,en
Art Forms in Nature,['Ernst Haeckel'],1972,['Botany'],N/A,N/A,N/A,en
Methods of Study in Natural History,['Louis Agassiz'],1880,['Animals'],N/A,N/A,N/A,en
Zoology,['Alpheus Spring Packard'],1883,['Zoology'],N/A,N/A,N/A,en
A Zoo in My Luggage,['Gerald Durrell'],1960,['Nature'],"Chronicle of a six-month trip to Bafut, a mountain grassland kingdom in the British Cameroons in West Africa.",4.5,N/A,en
Natural History for the Use of Schools and Families,['Worthington Hooker'],1882,['Natural history'],N/A,N/A,N/A,en
Zoology,['Kenneth Hyde'],2006-01-12,['Science'],N/A,N/A,N/A,en
Temperature Regulation,['A.S. Milton'],2011-09-27,['Science'],"Many advances have been made in the field of thermoregulation in the past few years. These include our understanding of Fever, which is now considered not simply a rise in deep body temperature foHowing infection, but just one aspect, though perhaps the most easily measured, of the Acute Phase of the Immune Response. Classification and identification of the Cytokines and the availability of recombinant material has greatly aided this research. Similarly, our understanding of the Hypothalamo-Pituitary Adrenal Axis has altered our way of thinking about temperature regulation. Of importance are the problems associated with adverse climatic conditions and survival, and the problems encountered by the neonate and the hibernator. At the biochemical level, our knowledge of the control of heat production and the role of brown adipose tissue is rapidly advancing. All these issues and many others were discussed at a Symposium 'Thermal Physiology 1993' held in Aberdeen, Scotland in August 1993 under the auspices of the Thermal Physiology Commission of the International Union of Physiological Sciences. Six main aspects of the subject of temperature regulation are included in this book, namely, Fever (including the Acute Phase of the Immune Response and Thermoregulatory Peptides), Neurophysiology of Thermoregulation, Neonatal Thermoregulation, Mechanisms of Heat Production, Ecological and Behavioural Thermoregulation, and Emerging Themes in Thermoregulation.",N/A,N/A,en
The Biology and Management of Mountain Ungulates,['Sandro Lovari'],1985-04-30,['Nature'],N/A,N/A,N/A,en
Dingoes at Dinnertime,['Mary Pope Osborne'],1993,['Accelerated readers'],"Jack and Annie travel back in time to the middle ages, where a mysterious knight helps the explore a castle.",N/A,N/A,en
The Ecology of Animals,['Charles Sutherland Elton'],1966,['Animal ecology'],N/A,N/A,N/A,en
Bombay Ducks,['Douglas Dewar'],1906,['Birds'],N/A,N/A,N/A,en
Principles of Systematic Zoology,"['Ernst Mayr', 'Peter D. Ashlock']",1991,['Science'],N/A,N/A,N/A,en
The Great White South,['Herbert George Ponting'],1950,['Antarctica'],N/A,N/A,N/A,en
Guide to Dissection,['Helen Graham Quiller Rowett'],1965,['Dissection'],N/A,N/A,N/A,en
The Naturalized Animals of the British Isles,['Christopher Lever'],1979,['Animal introduction'],N/A,N/A,N/A,en
Evenings at the Microscope,['Philip Henry Gosse'],1896,['Microscopy'],N/A,N/A,N/A,en
Indian Snakes,['Edward Nicholson'],1893,['Serpents'],N/A,N/A,N/A,en
The Second Jungle Book,['Rudyard Kipling'],1912,['Animals'],N/A,N/A,N/A,en
Beast & Man in India,['John Lockwood Kipling'],1984,['Animal welfare'],N/A,N/A,N/A,en
Dear Lord Rothschild,['Miriam Rothschild'],1983,['Biography & Autobiography'],N/A,N/A,N/A,en
Catalogue of the Books in the Library of the Indian Museum,['Indian Museum. Library'],1897,['India'],N/A,N/A,N/A,en
The Deep Hot Biosphere,['Thomas Gold'],2011-09-07,['Science'],"This book sets forth a set of truly controversial and astonishing theories: First, it proposes that below the surface of the earth is a biosphere of greater mass and volume than the biosphere the total sum of living things on our planet's continents and in its oceans. Second, it proposes that the inhabitants of this subterranean biosphere are not plants or animals as we know them, but heat-loving bacteria that survive on a diet consisting solely of hydrocarbons that is, natural gas and petroleum. And third and perhaps most heretically, the book advances the stunning idea that most hydrocarbons on Earth are not the byproduct of biological debris (""fossil fuels""), but were a common constituent of the materials from which the earth itself was formed some 4.5 billion years ago. The implications are astounding. The theory proposes answers to often-asked questions: Is the deep hot biosphere where life originated, and do Mars and other seemingly barren planets contain deep biospheres? Even more provocatively, is it possible that there is an enormous store of hydrocarbons upwelling from deep within the earth that can provide us with abundant supplies of gas and petroleum? However far-fetched these ideas seem, they are supported by a growing body of evidence, and by the indisputable stature and seriousness Gold brings to any scientific debate. In this book we see a brilliant and boldly original thinker, increasingly a rarity in modern science, as he develops potentially revolutionary ideas about how our world works.",N/A,N/A,en
Light on Yoga,['B. K. S. Iyengar'],1979,['Hatha yoga'],The definitive guide to the philosophy and practice of Yoga--the ancient healing discipline for body and mind--by its greatest living teacher. Light on Yoga provides complete descriptions and illustrations of all the positions and breathing exercises. Features a foreword by Yehudi Menuhin. Illustrations throughout.,N/A,N/A,en
University of Iowa Studies in Natural History,[],1922,['Natural history'],N/A,N/A,N/A,en
The Science of Zoology,['Paul B. Weisz'],1973,['Science'],N/A,N/A,N/A,en
Collins Field Guide to New Zealand Wildlife,"['Terence Lindsey', 'Rod Morris']",2011,['Animals'],"First published in 2000, the Collins Field Guide to New Zealand Wildflife quickly became a classic of its kind. Familiar to both national and international travellers keen to identify the birds, mammals, amphibians, reptiles, freshwater fish and invertebrates commonly encountered in this country, its combination of authoritative yet clear and precise textual descriptions and stunning photographs proved an instant winner. Now, more than 10 years on, this classic field guide has been updated and extended to make it even more useful to travellers with an interest in natural history and ecology. Retaining its useful glovebox-friendly format, the significantly expanded text will also include the latest research findings and changes in classification and nomenclature that have occurred in the past 10 years, along with new photographs where appropriate. Including both native and introduced species, each entry succinctly describes both habits and habitats, distribution, classification, breeding patterns, food and recognition tips to assist amateur identification.",N/A,N/A,en
Animals,['Anita Ganeri'],1994,['Juvenile Nonfiction'],N/A,N/A,N/A,en
Mammals of Madagascar,['Nick Garbutt'],1999,['Mammals'],"Complementing a photographic guide to Madagascan birds by Peter Morris, this is a guide to all the mammals of the island. The majority - all the lemurs, for example - are shown in photographs. It also portrays some of the smaller species, such as tenrecs and rodents, illustrated in line drawings.",N/A,N/A,en
General Zoology,"['Claude Alvin Villee', 'Robert D. Barnes', 'Warren Franklin Walker']",1978,['Zoology'],N/A,N/A,N/A,en
Lions at Lunchtime,['Mary Pope Osborne'],1998,['Africa'],"The magic tree house takes Jack and Annie to Africa where they meet up with wonderful wild animals, a very hungry warrior, and where they even solve a riddle.",N/A,N/A,en
Animal Life of the Galapagos,['Norman E. Hickin'],1979,['Science'],N/A,N/A,N/A,en
Edge of the Jungle,['William Beebe'],1921,['Biography & Autobiography'],"Edge of the Jungle is a fascinating book that describes William Beebe's adventures and discoveries in the South American jungles. William Beebe, born Charles William Beebe (July 29, 1877 - June 4, 1962) was an American naturalist, ornithologist, marine biologist, entomologist, explorer, and author. He is remembered for the numerous expeditions he conducted for the New York Zoological Society, his deep dives in the Bathysphere, and his prolific scientific writing for both academic and popular audiences. ""I stood beneath the familiar cashew trees, which had yielded for me so bountifully of their crops of blossoms and hummingbirds, of fruit and of tanagers, and looked out toward the distant jungle, which trembled through the expanse of palpitating heat-waves; and I knew how a hermit crab feels when its home pinches, or is out of gear with the world. And, too, Nupee was dead, and the jungle to the south seemed to call less strongly. So I wandered through the old house for the last time, sniffing the agreeable odor of aged hypo still permeating the dark room, re-covering the empty stains of skins and traces of maps on the walls, and re-filling in my mind the vacant shelves. The vampires had returned to their chosen roost, the martins still swept through the corridors, and as I went down the hill, a moriche oriole sent a silver shaft of song after me from the sentinel palm, just as he had greeted me four years ago."" ""Then I gathered about me all the strange and unnameable possessions of a tropical laboratory--and moved. A wren reaches its home after hundreds of miles of fast aerial travel; a hermit crab achieves a new lease with a flip of his tail. Between these extremes, and in no less strange a fashion, I moved. A great barge pushed off from the Penal Settlement, piled high with my zoological Lares and Penates, and along each side squatted a line of paddlers, --white-garbed burglars and murderers, forgers and fighters, --while seated aloft on one of my ammunition trunks, with a microscope case and a camera close under his watchful eye, sat Case, King of the Warders, the biggest, blackest, and kindest-hearted man in the world.""",N/A,N/A,en
Antarctica,"['David McGonigal', 'Lynn Woodworth']",2003,['Antarctica'],"An Illustrated guide to Antarctica's environment, geography, wildlife, and history.",N/A,N/A,en
The Zoology of the Voyage of H.M.S. Beagle: pt. 3. Birds,['Charles Darwin'],1980,['Scientific expeditions'],N/A,N/A,N/A,en
Wildlife Issues in a Changing World,"['Michael P. Moulton', 'James Sanderson']",1998-09-01,['Science'],"The broad perspective of wildlife issues presented in this book make fascinating reading for professionals and non-professionals alike. The authors discuss the ecological impact of introduced species, wildlife rehabilitation, and nonindigenous species. They explain wildlife laws, and why these are failing to protect endangered species. Concrete examples of wildlife issues worldwide are given. Fast becoming a standard textbook in U.S. college ecology curricula, the book should appeal to all ecologists and convervationists worldwide.",N/A,N/A,en
Chordate Morphology,['Malcolm Jollie'],1973,['Chordata'],N/A,N/A,N/A,en
Reptiles & Amphibians,"[""Mark O'Shea""]",1992-01-01,['Amphibians'],"A comprehensive introduction describes the anatomy, lifecycle, and behavior of the major groups of reptiles and amphibians. DK Handbooks.",N/A,N/A,en
Modern Text Book of Zoology,['R. L. Kotpal'],1977,['Invertebrates'],N/A,N/A,N/A,en
Invertebrate Zoology (Multicolour Edition),['P.S.Verma'],2001-01-21,['Science'],"For B.Sc. and B.Sc(hons.) students of all Indian Universities & Also as per UGC Model Curriculum. The multicoloured figures and arrestingly natural photographs effectively complement the standard text matter. The target readers shall highly benefit by correlating the content with the muliticoloured figures and photographs The book has been further upgraded with addition of important questions: long, short, very short and multiple questions in all chapters. A complete comprehensive source for the subject matter of various university examinations.",5,N/A,en
Sketches of the Natural History of Ceylon,['Sir James Emerson Tennent'],1868,[],N/A,N/A,N/A,en
A Source-book of Biological Names and Terms,['Edmund C. Jaeger'],1972,['Botany'],N/A,N/A,N/A,en
Ecophysiology of Spiders,['Wolfgang Nentwig'],1986-12-01,['Science'],"Recently another book on insect physiology was published. It was restricted to a few focal points as are many of these new insect physiology books, but there was considerable depth in its specialized point of view. We were dis cussing the structure of this book and of insect physiology books, in general, when Prof. Remmert asked me "" . . . and what about books on spider physio logy?"" Silence. Then I started to explain ""oh yes, there is a congress pro ceedings volume on this topic and there is a group with excellent publica tions on another topic . . . "", but I felt that this answer was weak. One can no longer buy the proceedings volume in a bookshop and to read a series of publications on a given topic one must search in a library for a dozen journals. Why is there not a single book on spider physiology comparable with the many books on insect physiology? Are spiders a scientific ivory tower, far from public interest and commercial importance? I do not think so, although spiders are one of the many ""forgotten"" animal groups which always grew in the shadow of the insects. There are research groups working on spider physiology, there are fascinating phenomena in this animal group and there are plenty of exciting results. Spiders may have been always underresearch ed, but research is progressing. In the last few years, new books have been published, e. g.",N/A,N/A,en
The Bafut Beagles,['Gerald Durrell'],1958,['Wild animal collecting'],N/A,N/A,N/A,en
The Bafut Beagles,['Gerald Malcolm Durrell'],1961,['Wild animal collecting'],N/A,N/A,N/A,en
The Common Objects of the Country,['John George Wood'],1858,['Animals'],N/A,N/A,N/A,en
The Naturalist in Manchuria,['Arthur de Carle Sowerby'],1922,['Manchuria (China)'],N/A,N/A,N/A,en
Zoologist,[],1844,['English periodicals'],N/A,N/A,N/A,en
Wildlife of Mexico,['Aldo Starker Leopold'],1959,['Science'],N/A,N/A,N/A,en
Invertebrate Zoology,"['E. L. Jordan', 'Prem Singh Verma']",1976,['Invertebrates'],N/A,N/A,N/A,en
Illustrated Encyclopedia of Animals,['David Burnie'],2008,['Animals'],"The ultimate visual guide to the animal kingdom From the largest mammal to the smallest invertebrate, this is the ultimate reference to all creatures great and small. Capturing their beauty and diversity with award-winning images this unique guide brings over 2,000 mammals, birds, reptiles, amphibians, fish and invertebrates in the wild vividly to life. Written by a team of wildlife experts, led by Editor-in-Chief David Burnie, an award-winning natural-history author, explore the excitement and fascination of the animal world.This is a new compact edition of Animal.",N/A,N/A,en
The Overloaded Ark,['Gerald Malcolm Durrell'],1965,['Zoological specimens'],N/A,N/A,N/A,en
On the Motion of Animals,['Aristotle'],2001,['Natural history'],N/A,N/A,N/A,en
Zoo-ology,['Joelle Jolivet'],2008-10-01,['Animals'],"Zoo-ology is the original big book of animals, a picture book of epic proportions providing a visual treat for readers, young and old. With a new environment on every colourful, artistic page, Zoo-ology is filled with beautifully crafted species from the Aardvark to the Zebra. Joelle Jolivet connects each animal in thought-provoking and unusual ways, grouping creatures of all shapes and sizes in a zoo without bars. Animal books don’t get much bigger than this. Perfect for fans of Jenny Broom’s Animalium and Maps by Aleksandra and Daniel Mizielinska, this is a gorgeous picture book to pored over by children and grown-ups alike.",N/A,N/A,en
Cry of the Kalahari,"['Mark Owens', 'Delia Owens']",1984,['Nature'],"This account of the authors' seven-year stay in Africa's Kalahari wilderness covers their adventures of survival, their contact with curious and dangerous animals, and the establishment of their conservation research project.",N/A,N/A,en
The Drunken Forest,['Gerald Malcolm Durrell'],1963,['Zoological specimens'],N/A,N/A,N/A,en
Miller's Guide to the Dissection of the Dog,"['Malcolm Eugene Miller', 'Howard Edward Evans', 'Alexander DeLahunta']",1969,['Dissection'],N/A,N/A,N/A,en
Cyprinid Fishes,"['Ian Winfield', 'Joe S. Nelson']",2012-01-21,['Science'],Among the fishes. a remarkably wide range ofbiological adaptations to diverse habitats has evolved. As weIl as living in the conventional habitats of lakes. ponds. rivers. rock pools and the open sea. fish have solved the problems of life in deserts. in the deep sea. in the cold Antarctic. and in warm waters of high alkalinity or of low oxygen. Along with these adaptations. we find the most impressive specializations of morphology. physiology and behaviour. For example we can marvel at the high-speed swimming of the marlins. sailfish and warm-blooded tunas. air breathing in catfish and lungfish. parental care in the mouth-brooding cichlids and viviparity in many sharks and toothcarps. Moreover. fish are of considerable importance of the survival of the human species in the form ofnutritious and delicious food ofnumerous kinds. Rational exploitation and management of our global stocks of fishes must rely upon a detailed and precise insight of their biology. The Chapman and Hall Fish and Fisheries Series aims to present timely volumes reviewing important aspects of fish biology. Most volumes will be of interest to research workers in biology. zoology. ecology and physiology. but an additional aim is for the books to be accessible to a wide spectrum of non specialist readers ranging from undergraduates and postgraduates to those with an interest in industrial and commercial aspects of fish and fisheries.,N/A,N/A,en
Atlas and Dissection Guide for Comparative Anatomy,['Saul Wischnitzer'],1972-01-01,['Anatomie comparée - Atlas'],New edition of a standard textbook/lab guide.,N/A,N/A,en
The Feejee Mermaid and Other Essays in Natural and Unnatural History,['Jan Bondeson'],1999,['Zoology'],"Bondeson investigates basilisks, vegetable lambs, intelligent pigs and other oddities.",N/A,N/A,en
Kunstformen der Natur,['Ernst Haeckel'],1904,['Botany'],N/A,N/A,N/A,de
Ecological Methods,"['T.E. Southwood', 'Peter Henderson', 'T R Southwood']",1998-12-01,[],"This extensive third revision of Southwood's influential Ecological Methods retains the general objectives and style of the previous editions and extends its coverage to include more up-to-date methods, such as computational techniques, distance sampling, aquatic methods and GIS. In combining both theory and pratical methods this book provides unique coverage of an area of importance to students and researchers of ecology alike.",N/A,N/A,en
